Ticker,Title,Link
CDNS,Cadence Design Poised for Growth Amid Market Opportunities and Intel’s Challenges: Arya’s Buy Rating with $350 Price Objective,8/16/2024 10:24:35 AM
CDNS,"CDNS, DDOG, FSLR: Which Strong Buy-Rated Tech Stock’s a Better Buy?",8/14/2024 2:04:27 PM
CDNS,"Semiconductors could start recovering in October, BofA says",8/12/2024 2:22:08 PM
CDNS,Analysts Offer Insights on Technology Companies: Temenos (OtherTMNSF) and Cadence Design (CDNS),7/24/2024 8:11:06 AM
CDNS,What 7 Analyst Ratings Have To Say About Cadence Design Sys,7/23/2024 3:01:13 PM
CDNS,"Cadence Design Systems Q2 Profit Increases, Beats Estimates ",7/22/2024 10:38:39 PM
CDNS,Notable earnings after Monday's close,7/21/2024 9:35:01 PM
CDNS,Cadence Design (CDNS): New Buy Recommendation for This Technology Giant,7/19/2024 12:16:55 PM
CDNS,"Cadence Design Systems, Inc. is Attracting Investor Attention: Here is What You Should Know",7/16/2024 7:50:11 PM
CDNS,3 Momentum Stocks That Could Still Have More Room to Run,7/10/2024 7:39:32 PM
CDNS,Micron Up 53% YTD: Is It Too Late to Buy the Stock Now?,7/9/2024 9:58:54 PM
CDNS,Demystifying Cadence Design Sys: Insights From 12 Analyst Reviews,6/27/2024 2:01:40 PM
CDNS,7 Stocks to Buy if You Think We’ll See Nasdaq 20K in 2024,6/20/2024 6:06:10 PM
CDNS,3 Low-Debt Stocks Delivering High Returns,6/18/2024 11:00:00 AM
CDNS,The 3 Best Climate Change Stocks to Buy in June 2024,6/12/2024 10:15:00 AM
CDNS,Cadence Acquires Switzerland-Based BETA CAE for $1.24B,6/5/2024 9:44:20 PM
CDNS,"Broadcom, Marvell Capitalize On Generative AI Demand With Custom ASIC Solutions",6/4/2024 2:20:50 PM
CDNS,Silvaco Analysts Recommend The Stock As Unique Small-Cap Opportunity In Semiconductor Design,6/3/2024 8:57:49 PM
CDNS,"SONY, UBER, CDNS: Which Strong-Buy-Rated Tech Stock Is Best?",5/31/2024 3:16:34 AM
CDNS,Cadence Design’s Growth and Profitability: A Buy Rating Amid AI Expansion and Market Share Opportunities,5/30/2024 10:17:34 AM
CDNS,Analyst Ratings For Cadence Design Sys,5/17/2024 2:00:29 PM
CDNS,Retire Before 50: 7 Must-Own Stocks for Accelerated Wealth Building,5/15/2024 10:00:00 AM
CDNS,Analysts’ Opinions Are Mixed on These Technology Stocks: Cadence Design (CDNS) and Qualys (QLYS),5/8/2024 4:50:22 AM
CDNS,Stock Market Crash Warning: Don’t Get Caught Holding These 3 Tech Stocks,5/3/2024 11:30:00 AM
CDNS,"With rate cuts pushed out, Goldman looks at quality stocks",4/28/2024 7:24:54 PM
CDNS,3 Tech Stocks to Sell Now Before the Next Market Downturn Hits,4/25/2024 12:00:00 PM
CDNS,Buy Rating on Cadence Design: Strong H2 Revenue Growth and Innovative Product Line Justify Positive Outlook,4/24/2024 6:25:51 AM
CDNS,"Analysts Are Bullish on These Technology Stocks: Lam Research (LRCX), Cadence Design (CDNS)",4/23/2024 12:40:34 PM
CDNS,"Cadence Design Systems Q1 Profit Increases, beats estimates",4/22/2024 10:09:17 PM
CDNS,Notable earnings after Monday's close,4/21/2024 9:35:17 PM
CDNS,Schneider Electric confirms discussions with Bentley Systems (update),4/19/2024 10:55:00 AM
CDNS,Bentley Systems jumps amid report of takeover interest (update),4/18/2024 7:59:39 PM
CDNS,Analysts Offer Insights on Technology Companies: ON Semiconductor (ON) and Cadence Design (CDNS),4/15/2024 11:40:27 PM
CDNS,Evaluating Cadence Design Sys: Insights From 10 Financial Analysts,4/4/2024 2:01:17 PM
CDNS,Scorching Hot: 3 Nasdaq AI Stocks to Buy Now,4/2/2024 10:31:00 AM
CDNS,3 AI Stocks to Buy Following the 2024 Nvidia GTC Conference,3/25/2024 7:00:00 PM
CDNS,How Nvidia GTC 2024 Can Supercharge NVDA Stock,3/19/2024 2:53:44 PM
CDNS,"Nvidia GTC 2024: Tech giant shows off new GB200 GPU, accelerated computing, more",3/18/2024 10:05:51 PM
CDNS,"DELL, CDNS, INTU: Which AI-Exposed Tech Stock Is Best?",3/14/2024 2:29:05 AM
CDNS,3 AI Stocks That Nvidia Should Buy Next,3/8/2024 8:37:09 PM
CDNS,Wall Street Analysts Are Bullish on Top Technology Picks,3/7/2024 5:03:21 AM
CDNS,"Nvidia Tops in Popularity Among S&P 500 Semiconductor Stocks, Analyst Sees Room for Growth",3/6/2024 10:18:45 PM
CDNS,Buy Rating Affirmed: Cadence Design’s Growth Prospects Strengthened by Strategic Acquisition,3/5/2024 8:15:33 PM
CDNS,"Intel Foundry Day Takeaway: Revenue Scale Is 'Several Years' Away, Analysts Say",2/23/2024 9:28:31 PM
CDNS,Exit Now! 7 Nasdaq Stocks to Sell in February 2024.,2/14/2024 6:00:28 PM
CDNS,Why IPG Photonics Shares Are Trading Lower By Around 11%? Here Are Other Stocks Moving In Tuesday's Mid-Day Session,2/13/2024 7:13:37 PM
CDNS,"Cadence Design Systems Q4 Profit Increases, beats estimates",2/12/2024 10:08:51 PM
CDNS,Cadence Design Systems Q4 2023 Earnings Preview,2/11/2024 10:35:00 PM
CDNS,Notable earnings after Monday's close,2/10/2024 10:35:58 PM
CDNS,"Analysts’ Opinions Are Mixed on These Technology Stocks: Roper Technologies (ROP), Cadence Design (CDNS) and Rapid7 (RPD)",2/5/2024 8:10:23 AM
CDNS,4 Stocks to Buy for the Coming AI Wars,1/23/2024 9:06:32 PM
CDNS,7 A-Rated Software Stocks to Buy in January,1/17/2024 5:20:21 PM
CDNS,7 A-Rated Software Stocks to Buy in January,1/15/2024 11:00:00 PM
CDNS,Cadence Acquires Invecas ,1/8/2024 4:05:42 PM
CDNS,"3 Stocks to Buy for the $100,000 Portfolio: 2024 Edition",1/3/2024 6:53:42 PM
CDNS,The 3 Best Software Stocks to Buy for 2024,12/26/2023 10:16:06 PM
CDNS,3 Key Stocks to Capitalize on Rising Resource Scarcity,12/20/2023 12:09:19 AM
CDNS,Luke Lango Sees Growth Ahead for These Potential Trillion-Dollar AI Stocks,12/6/2023 9:46:26 PM
CDNS,"Analysts’ Top Technology Picks: KLA (KLAC), Confluent (CFLT)",11/30/2023 10:40:10 AM
CDNS,What 7 Analyst Ratings Have To Say About Cadence Design Sys,11/10/2023 10:00:13 PM
CDNS,3 Dependable AI Stocks to Buy for 2024,11/7/2023 4:51:51 PM
CDNS,5 Top-Tier AI Stocks for Dependable Returns in 2024,10/30/2023 8:24:45 PM
CDNS,Pfizer To Expand Access To Cadence Products And Programming Toolkits For Advanced Molecular Design ,10/25/2023 4:54:44 PM
CDNS,"Analysts Offer Insights on Technology Companies: Rivian Automotive (RIVN), Nokia (NOK) and Cadence Design (CDNS)",10/24/2023 12:21:11 PM
CDNS,"Cadence Design Systems Q3 Profit Increases, beats estimates",10/23/2023 10:13:06 PM
CDNS,Here's what Wall Street expects from Cadence Design Systems's earnings,10/22/2023 3:01:13 PM
CDNS,Analyst Expectations for Cadence Design Sys's Future,10/19/2023 2:00:50 PM
CDNS,"Analysts Offer Insights on Technology Companies: Cadence Design (CDNS), Klaviyo, Inc. Class A (KVYO) and Trade Desk (TTD)",10/16/2023 10:35:02 AM
CDNS,Cadence To Acquire Intrinsix From CEVA For Undisclosed Sum ,9/20/2023 1:42:28 PM
CDNS,Marathon Oil To Rally Around 70%? Here Are 10 Other Analyst Forecasts For Thursday,9/14/2023 2:07:09 PM
CDNS,"DraftKings Apologizes For 9/11 'Never Forget' Parlay Promotion, Apple Set For Selling 'Made In India' iPhone 15 on Launch Day, MGM Resorts Faces Ongoing Cyber Incident: Today's Top Stories",9/12/2023 4:32:57 PM
CDNS,What 10 Analyst Ratings Have To Say About Cadence Design Sys,8/25/2023 2:00:40 PM
CDNS,5 Blue-Chip Stocks AI Thinks Will Double Your Money by 2027,8/16/2023 4:42:18 PM
CDNS,TipRanks ‘Perfect 10’ List: Looking for Tech Stocks? These 3 Attain the Highest Smart Score,8/14/2023 6:10:36 AM
CDNS,3 ‘Strong Buy’ AI Stocks You Should Be Loading Up On Now,8/1/2023 10:20:39 AM
CDNS,J.P. Morgan Keeps Their Hold Rating on Cadence Design (CDNS),7/27/2023 12:15:35 PM
CDNS,Cadence Design Systems slips on weaker-than-expected Q3 guidance,7/25/2023 3:05:14 PM
CDNS,"Cadence Design Systems Q2 Profit Increases, beats estimates",7/24/2023 10:11:03 PM
CDNS,Notable earnings after Monday's close,7/23/2023 9:35:13 PM
CDNS,Rambus' Strategic Resource Redirection To Drive Performance Despite Minor Revenue Impact: Analyst,7/21/2023 8:38:08 PM
CDNS,"Benzinga's Top Ratings Upgrades, Downgrades For July 20, 2023",7/20/2023 5:00:43 PM
CDNS,"BofA Analyst Cuts Price Target for AMD, Re-rates Semiconductor Companies, Expects Long-Term Stock Momentum For Sector",7/18/2023 10:00:27 PM
CDNS,Cadence Design (CDNS): New Buy Recommendation for This Technology Giant,7/6/2023 11:05:09 AM
CDNS,"Paycom, Chipotle highlight Goldman's Rule of 10 stock screens",7/4/2023 5:00:00 PM
CDNS,Goldman Sachs Reveals Winning Portfolio: 'Rule of 10' Unlocks S&P 500's Future Top Performers,7/3/2023 3:24:56 PM
CDNS,2 Under-the-Radar AI ETFs to Watch,6/16/2023 6:23:52 PM
CDNS,6 Analysts Have This to Say About Cadence Design Sys,6/5/2023 5:02:29 PM
CDNS,Stocks facing most buy and sell pressure into Russell rebalancing,5/26/2023 1:18:10 PM
CDNS,Betting On AI? The 12 Stocks That Should Be On Your Radar,5/22/2023 7:21:56 PM
CDNS,Synopsys jumps 8% as Baird sees it at 'beginning of decade of impact',5/18/2023 6:00:03 PM
CDNS,Cadence Design (CDNS): New Buy Recommendation for This Technology Giant,4/28/2023 1:55:07 AM
CDNS,7 Growth Stocks With Huge Return Potential for Long-Term Investors,4/25/2023 8:55:49 PM
CDNS,"Cadence Design Systems Q1 Profit Increases, beats estimates",4/24/2023 10:43:20 PM
CDNS,Notable earnings after Monday's close,4/23/2023 9:35:03 PM
CDNS,"Analysts Conflicted on These Technology Names: Cadence Design (CDNS), Lockheed Martin (LMT) and Mobileye Global, Inc. Class A (MBLY)",4/21/2023 12:02:47 PM
CDNS,Where Cadence Design Sys Stands With Analysts,4/11/2023 11:01:50 PM
CDNS,Cadence Design (CDNS) Receives a Rating Update from a Top Analyst,3/1/2023 2:35:18 AM
CDNS,Cadence Design (CDNS): New Buy Recommendation for This Technology Giant,2/24/2023 1:55:07 AM
CDNS,Cadence Analyst Sees Meaningful Upside In Stock As EDA Customers Increase R&D Spend,2/14/2023 6:37:42 PM
CDNS,"Cadence Design Systems Q4 Profit Increases, beats estimates",2/13/2023 10:28:57 PM
CDNS,Notable earnings after Monday's close,2/12/2023 10:35:26 PM
CDNS,"Catalyst watch: Inflation reads, Roblox and DoorDash in the spotlight",2/10/2023 7:30:55 PM
CDNS,Cadence Design gets mild lift as Deutsche Bank reiterates buy rating,1/31/2023 4:16:57 PM
CDNS,"Benzinga's Top Ratings Upgrades, Downgrades For January 17, 2023",1/17/2023 4:01:25 PM
CDNS,"SGMO, CDNS and HOLX are among after hour movers",1/13/2023 10:58:33 PM
CDNS,"Benzinga's Top Ratings Upgrades, Downgrades For December 16, 2022",12/16/2022 4:01:20 PM
CDNS,Director Lip-Bu Tan Is Betting Big on Intel (INTC) Stock,11/21/2022 5:44:39 PM
CDNS,Needham Sticks to Their Buy Rating for Cadence Design (CDNS),10/31/2022 10:35:11 AM
CDNS,"Cadence Analysts See It Scoring Driven By Autos, Autonomous Driving, 5G, AI/ML Despite China Restrictions",10/25/2022 6:45:36 PM
CDNS,Cadence Design Systems Lifts FY22 Outlook ,10/24/2022 10:18:07 PM
CDNS,Notable earnings after Monday's close,10/23/2022 9:35:00 PM
CDNS,Cadence Design Systems Q3 2022 Earnings Preview,10/21/2022 9:35:28 PM
CDNS,5 Analysts Have This to Say About Cadence Design Sys,9/29/2022 11:10:04 PM
CDNS,U.S./China “Chip War”: Odds in Favor of SNPS and CDNS Stocks,9/12/2022 4:36:52 PM
CDNS,Tesla Fame's Robot-Run ETF Sold Its Entire Apple Stake In August — Here's What It Bought,9/9/2022 1:14:39 PM
CDNS,What 5 Analyst Ratings Have To Say About Cadence Design Sys,9/8/2022 5:36:47 PM
CDNS,What 4 Analyst Ratings Have To Say About Cadence Design,8/17/2022 8:09:44 PM
CDNS,"Aspen's (AZPN) Q4 Earnings Beat Estimates, Revenues Up Y/Y",8/9/2022 5:49:45 PM
CDNS,"Speculative, expensive and beaten down; meet the stock market's new leadership",7/31/2022 3:50:22 PM
CDNS,Is Invesco Dynamic Software ETF (PSJ) A Strong ETF Right Now?,7/26/2022 8:39:16 PM
CDNS,Cadence Design Systems Lifts FY22 Outlook ,7/25/2022 11:18:23 PM
CDNS,Notable earnings after Monday's close,7/24/2022 9:35:31 PM
CDNS,Cadence Design Systems Q2 2022 Earnings Preview,7/22/2022 3:37:24 PM
CDNS,Cadence Design Systems agrees to acquire Future Facilities,7/11/2022 1:39:21 PM
CDNS,7 Best Tech Stocks to Buy in July 2022,7/7/2022 12:35:45 PM
CDNS,McDonald's To $278? Analysts Just Raised Their Price Targets On These 5 Stocks,6/29/2022 10:07:07 PM
CDNS,Kraft Heinz And 2 Other Stocks Insiders Are Selling,6/14/2022 1:53:46 PM
CDNS,Executives Sell Around $207M Of 5 Stocks,5/25/2022 2:10:21 PM
CDNS,Have the FAANG Stocks Been De-Fanged?,5/2/2022 1:40:17 PM
CDNS,Here's Why Analysts Were Impressed Post Cadence Design Systems' Q1 Performance,4/26/2022 8:53:48 PM
CDNS,Cadence Design Systems Lifts FY22 Outlook; Shares Up 5% ,4/25/2022 10:49:41 PM
CDNS,Notable earnings after Monday's close,4/24/2022 9:35:10 PM
CDNS,Cadence Design Systems Q1 2022 Earnings Preview,4/22/2022 9:45:49 PM
CDNS,Goldman screens companies with best and worst pricing power into earnings season,4/11/2022 11:48:55 AM
CDNS,"CNBC's Final Trades: Cadence Design Systems, Amazon, Guess And This Brick-And-Mortar Retail Giant",3/24/2022 12:43:26 PM
CDNS,All The Stocks That Moved Wednesday From CNBC's 'Fast Money: Halftime Report',3/23/2022 6:22:35 PM
CDNS,"Amgen, Target highlight BofA's new Alpha Surprise screen entrants",3/3/2022 12:20:15 PM
CDNS,Expert Ratings For Cadence Design Systems,2/23/2022 6:19:35 PM
CDNS,"Cadence Design Systems Q4 Profit Increases, beats estimates",2/22/2022 10:11:23 PM
CDNS,Notable earnings after Tuesday's close,2/21/2022 10:35:19 PM
CDNS,Cadence Design Systems Q4 2021 Earnings Preview,2/18/2022 10:35:23 PM
CDNS,What 9 Analyst Ratings Have To Say About Cadence Design Systems,1/10/2022 8:02:36 PM
CDNS,"Benzinga's Top Ratings Upgrades, Downgrades For December 14, 2021",12/14/2021 4:03:42 PM
CDNS,UBS identifies stocks getting 'greener' - without losing alpha,11/18/2021 2:35:20 PM
CDNS,"As Nasdaq 100 extends big winning streak, getting selective on tech can pay: Alpha Tactics",11/6/2021 10:25:37 PM
CDNS,Expert Ratings For Cadence Design Systems,10/26/2021 6:39:17 PM
CDNS,Cadence Design Systems Lifts FY21 Outlook ,10/25/2021 11:06:54 PM
CDNS,Notable earnings after Monday's close,10/24/2021 9:35:00 PM
CDNS,Why Needham Says This Semiconductor Stock Will Catch Up With Synopsys,10/20/2021 5:55:05 PM
CDNS,3 Best ESG Stocks for Those Committed to Sustainable Investing,9/23/2021 9:57:08 AM
CDNS,Wall Street Loves These 3 Tech Stocks,8/6/2021 3:53:40 PM
CDNS,"Cadence Design Systems, Inc. -- Moody's upgrades senior unsecured rating of Cadence Design Systems to A3 from Baa2; outlook stable",7/29/2021 5:20:00 PM
CDNS,Baird Maintains Outperform On Cadence Design; Increased Price Target Implies 16% Upside,7/27/2021 7:26:22 PM
CDNS,Cadence Design Systems Q2 adjusted earnings Beat Estimates,7/26/2021 10:19:10 PM
CDNS,Notable earnings after Monday's close,7/25/2021 9:35:00 PM
CDNS,What Wall Street expects from Cadence Design Systems's earnings,7/24/2021 3:01:19 PM
CDNS,"Benzinga's Top Ratings Upgrades, Downgrades For June 25, 2021",6/25/2021 4:02:20 PM
CDNS,52 Biggest Movers From Yesterday,4/28/2021 11:11:53 AM
CDNS,38 Stocks Moving In Tuesday's Mid-Day Session,4/27/2021 6:01:29 PM
CDNS,Cadence Design Systems Q1 adjusted earnings Beat Estimates,4/26/2021 10:18:40 PM
CDNS,Notable earnings after Monday's close,4/25/2021 9:35:00 PM
CDNS,Cadence Design Systems earnings preview: what Wall Street is expecting,4/24/2021 3:01:19 PM
CDNS,Cadence broadens its system analysis portfolio with acquisition of Pointwise,4/15/2021 2:35:52 PM
CDNS,12 Stocks Moving In Monday's After-Hours Session,2/22/2021 11:44:07 PM
CDNS,Notable earnings after Monday's close,2/21/2021 10:35:00 PM
CDNS,What Wall Street expects from Cadence Design Systems's earnings,2/20/2021 3:01:19 PM
CDNS,Cadence Design Sys. hosts conference call for investors,2/19/2021 3:03:24 PM
CDNS,"Cadence Design Systems, Inc. -- Moody's announces completion of a periodic review of ratings of Cadence Design Systems, Inc.",2/3/2021 10:57:00 PM
CDNS,Cadence to acquire NUMECA for multi-physics simulation portfolio expansion,1/20/2021 2:28:43 PM
CDNS,"After lukewarm years, BofA says chip picks ready to take off: 'Let's get cyclical'",1/12/2021 12:02:35 AM
CDNS,"Benzinga's Top Upgrades, Downgrades For January 5, 2021",1/5/2021 4:11:08 PM
CDNS,Stocks That Hit 52-Week Highs On Monday,1/4/2021 6:58:02 PM
CDNS,"Tesla leads list of 2020's biggest winners on both S&P 500, Nasdaq 100",1/1/2021 12:30:56 AM
CDNS,Stocks That Hit 52-Week Highs On Thursday,12/31/2020 4:15:08 PM
CDNS,Stocks That Hit 52-Week Highs On Wednesday,12/23/2020 4:57:31 PM
CDNS,Stocks That Hit 52-Week Highs On Tuesday,12/22/2020 4:30:53 PM
CDNS,Stocks That Hit 52-Week Highs On Friday,12/18/2020 8:42:01 PM
CDNS,"J.P. Morgan downgrades these high-multiple software names, expecting a rotation with vaccine recovery",12/9/2020 11:35:23 PM
CDNS,Rockley Photonics collaborates with Cadence to create a system for hyperscale data centers,12/2/2020 4:17:37 PM
CDNS,Stock Alert: Cadence Design Systems Up 5% ,11/11/2020 4:21:56 PM
CDNS,Cadence Design Systems Q3 Profit Rises ,10/19/2020 11:12:46 PM
CDNS,Cadence Design Systems Q3 2020 Earnings Preview,10/18/2020 9:35:11 PM
CDNS,Cadence's Pegasus Verification System receives design certification,10/8/2020 3:06:29 PM
CDNS,"Cadence Design Systems, Inc. -- Moody's announces completion of a periodic review of ratings of Cadence Design Systems, Inc.",9/29/2020 11:29:00 PM
CDNS,10 S&P 500 Stocks to Buy for Growth and Value,8/26/2020 5:12:49 PM
CDNS,Cadence Design Systems Q2 adjusted earnings Beat Estimates,7/20/2020 10:18:37 PM
CDNS,Cadence Design Systems earnings preview: what Wall Street is expecting,7/19/2020 3:01:17 PM
CDNS,Wait For the Pullback Before Buying Autodesk Stock,6/24/2020 10:46:30 AM
CDNS,Cadence collaborates with TSMC and Microsoft,6/15/2020 5:04:52 PM
CDNS,BofA sees 20% upside for Cadence Design,4/22/2020 4:33:10 PM
CDNS,Cadence Design Systems Q1 adjusted earnings Beat Estimates,4/20/2020 10:11:59 PM
CDNS,Cadence Design Systems Q4 2020 Earnings Preview,4/19/2020 9:35:22 PM
CDNS,"Cadence +2% as new bull praises upside, valuation",2/19/2020 6:42:51 PM
CDNS,Cadence Design acquires Integrand Software,2/14/2020 3:27:01 PM
CDNS,Cadence Design Systems Q4 adjusted earnings Beat Estimates,2/12/2020 10:20:20 PM
CDNS,Cadence Design Systems Q4 2019 Earnings Preview,2/11/2020 10:35:35 PM
CDNS,"Cadence Design Systems, Inc. -- Moody's announces completion of a periodic review of ratings of Cadence Design Systems, Inc.",11/13/2019 10:57:00 PM
CDNS,"Cadence Design Systems, Inc. -- Moody's affirms Baa2 rating of Cadence Design Systems; outlook stable",10/25/2019 6:56:00 PM
CDNS,"Cadence Design Systems, Inc. to Host Earnings Call",10/21/2019 3:00:00 PM
CDNS,Keep an Eye on Cadence Design Stock Ahead of Earnings,10/4/2019 6:45:52 PM
CDNS,Cadence Design Systems Q2 adjusted earnings Beat Estimates,7/22/2019 10:10:01 PM
CDNS,Here's what to expect from Cadence Design Systems's earnings report,7/21/2019 3:01:26 PM
CDNS,The Top 10 Best Sectors in the Market for 2019,7/2/2019 4:26:51 PM
CDNS,The Top 8 Tech Stocks of 2019 (So Far),6/26/2019 4:10:10 PM
CDNS,7 Top S&P 500 Stocks of 2019 (So Far),6/21/2019 5:52:40 PM
CDNS,Cadence Design Systems Q1 adjusted earnings Beat Estimates,4/22/2019 10:13:19 PM
CDNS,Cadence Design Systems earnings preview: what Wall Street is expecting,4/20/2019 3:01:18 PM
CDNS,Here's what to expect from Cadence Design Systems's earnings report,2/17/2019 3:01:21 PM
CDNS,Cadence Design Systems Holding On To Substantial Gain ,10/23/2018 7:41:51 PM
CDNS,Cadence Design Systems Q3 Profit Climbs,10/22/2018 10:11:03 PM
CDNS,Cadence Design Systems earnings preview: what Wall Street is expecting,10/20/2018 3:01:18 PM
CDNS,Cadence Design Systems Q2 adjusted earnings Beat Estimates,7/23/2018 10:10:28 PM
CDNS,Here's what Wall Street expects from Cadence Design Systems's earnings report,7/21/2018 3:01:19 PM
CDNS,Cadence Design Systems Q1 adjusted earnings Beat Estimates,4/23/2018 10:14:59 PM
CDNS,Cadence Design Systems Profit Advances In Q4,1/31/2018 10:46:38 PM
CDNS,"FACBOX-Corporate alternative minimum tax threat hits pharma, tech (BA, VRTX, INCY, REGN, CDNS, CELG, ADSK)",12/6/2017 9:52:03 PM
CDNS,Cadence Announces Availability of Industry's First PCI Express 5.0 Verification IP,11/28/2017 4:45:00 PM
CDNS,Cadence's Lip-Bu Tan and John Wall to Present at Credit Suisse 2017 TMT Conference,11/21/2017 10:30:00 PM
CDNS,Cadence Appoints Anirudh Devgan as President,11/17/2017 12:02:00 AM
CDNS,"Cadence's Alan Lindstrom to Present at MKM Partners Entertainment, Travel and Technology Conference",11/10/2017 10:30:00 PM
CDNS,HiSilicon Selects Cadence Tensilica Vision P6 DSP for its Latest Kirin 970 Mobile Application Processor,11/6/2017 4:45:00 PM
CDNS,BRIEF-Cadence to acquire Nusemi Inc (CDNS),11/1/2017 11:12:11 PM
CDNS,Cadence's John Wall to Present at 2017 RBC TMT Conference,10/31/2017 11:00:00 PM
CDNS,ChipEstimate.com Launches New Compare IP Tool,10/30/2017 3:45:00 PM
CDNS,Cadence Design Systems Q3 Profit Advances 15%,10/27/2017 12:18:07 AM
CDNS,BRIEF-Cadence sees Q4 earnings of $0.26/shr to $0.28/shr (CDNS),10/26/2017 10:52:11 PM
CDNS,"Cadence and Arm Deliver First SoC Verification Solution for Low-Power, High-Performance Arm-Based Servers",10/24/2017 4:45:00 PM
CDNS,Fluke T6 Electrical Testers win NECA Showstopper Award,10/19/2017 12:00:00 PM
CDNS,Cadence Announces Digital and Signoff Flow Support for Body-Bias Interpolation for GLOBALFOUNDRIES 22FDX™ Process Technology,10/12/2017 4:45:00 PM
CDNS,"Cadence Achieves TÜV SÜD's First Comprehensive ""Fit for Purpose - TCL1"" Certification in Support of Automotive ISO 26262 Standard",10/11/2017 4:45:00 PM
CDNS,Teradyne Standardizes on Cadence Xcelium Parallel Logic Simulator,10/10/2017 4:45:00 PM
CDNS,Cadence Genus Synthesis Solution Enables Fuji Xerox to Improve Multi-Functional Printer SoCs Design Development,10/2/2017 4:45:00 PM
CDNS,Cadence Full-Flow Digital and Signoff Tools and Custom/Analog Tools Certified and Enabled for Intel 22FFL Process Technology,9/19/2017 1:00:00 PM
CDNS,Cadence Recognized with Three TSMC Partner of the Year Awards,9/18/2017 4:45:00 PM
CDNS,"Cadence Appoints John Wall To Succeed Geoff Ribar As CEO, Effective Oct. 1 ",9/14/2017 7:19:52 AM
CDNS,BRIEF-Cadence appoints John Wall as next CFO (CDNS),9/13/2017 10:42:17 PM
CDNS,New Cadence Allegro PCB DesignTrue DFM Technology Accelerates New Product Development and Introduction Process,9/12/2017 4:45:00 PM
CDNS,Cadence Collaborates with TSMC to Advance 7nm FinFET Plus Design Innovation,9/11/2017 2:45:00 PM
CDNS,Cadence Design Systems Set to Join S&P 500; Others to Join S&P MidCap 400 and S&P SmallCap 600,9/8/2017 11:52:00 PM
CDNS,Cadence Delivers Comprehensive IP Portfolio for TSMC 16FFC Automotive Design Enablement Platform,9/7/2017 4:45:00 PM
CDNS,Cadence's Geoff Ribar to Present at Deutsche Bank 2017 Technology Conference,9/6/2017 10:30:00 PM
CDNS,"Stock Performance Review on Application Software Industry -- Box Inc., Cloudera, RingCentral, and Cadence Design Systems",9/5/2017 1:10:00 PM
CDNS,Media Alert: Cadence to Showcase System-Level Integration of Electronic/Photonic Devices at the Photonics Summit and Workshop,8/21/2017 4:45:00 PM
CDNS,"Cadence Design Systems Corporate Vice President Finance & Controller, John Wall, to Present at KeyBanc Capital Markets 19th Annual Global Technology Leadership Forum on August 8, 2017 in Vail,...",8/1/2017 10:05:00 PM
CDNS,Cadence Announces Tensilica HiFi 3z DSP Architecture for Latest Mobile and Home Entertainment Applications,7/25/2017 4:45:00 PM
CDNS,BRIEF-Cadence Design Systems  Q2 profit $0.25/shr (CDNS),7/24/2017 10:34:09 PM
CDNS,Cadence Design Systems Announces Second Quarter 2017 Financial Results Webcast,7/10/2017 10:30:00 PM
CDNS,Cadence Elects Maggie Wilderotter to Board of Directors,6/28/2017 10:30:00 PM
CDNS,Cadence Custom/Analog and Full-Flow Digital and Signoff Tools Enabled for GLOBALFOUNDRIES 7LP Process Node,6/20/2017 3:00:00 PM
CDNS,Media Alert: ChipEstimate.com Hosts 11th Annual IP Talks! Program at DAC 2017,6/12/2017 4:45:00 PM
CDNS,"Technical Snapshots for These Application Software Stocks -- Cadence Design Systems, Shopify, Sphere 3D, and Innoviva",6/9/2017 12:15:00 PM
CDNS,"Cadence Design Systems Corporate Senior Vice President & CFO, Geoff Ribar, to Present at Nasdaq 36th Investor Program",6/6/2017 11:00:00 PM
CDNS,"Cadence Design Systems Corporate Vice President Finance & Controller to Present at Baird 2017 Global Consumer, Technology & Services Conference on June 8, 2017 in New York",6/5/2017 8:37:00 PM
CDNS,Cadence Announces VirtualBridge Adapter for Palladium Z1 Emulator to Accelerate Software Bring-Up Time by Up to Three Months,5/31/2017 4:45:00 PM
CDNS,"New Cadence Virtuoso System Design Platform Provides Seamless Design Flow Between IC, Package and Board",5/30/2017 4:45:00 PM
CDNS,Cadence Expands JasperGold Platform for Advanced Formal-Based RTL Signoff,5/16/2017 10:31:00 AM
CDNS,Cadence Introduces First Interface and Verification IP Solution for CCIX to Advance New Class of Datacenter Servers,5/2/2017 2:45:00 PM
CDNS,"Cadence Unveils Industry's First Neural Network DSP IP for Automotive, Surveillance, Drone and Mobile Markets",5/1/2017 12:45:00 PM
CDNS,Amlogic Reduces HW/SW Integration Time for Multimedia SoCs by Two Months Using the Cadence Protium S1 FPGA-Based Prototyping Platform,4/26/2017 4:45:00 PM
CDNS,Cadence Design Systems Q1 Profit Rises 4%,4/24/2017 11:37:23 PM
CDNS,Cadence Tensilica Vision P-Series DSPs are Industry's First Imaging/Vision DSPs Certified by Khronos as OpenVX 1.1 Conformant,4/20/2017 4:45:00 PM
CDNS,"Research Reports Coverage on Application Software Stocks -- Nuance, Cadence Design, Sphere 3D, and Workday",4/17/2017 1:05:00 PM
CDNS,"Cadence Launches the Pegasus Verification System, a Massively Parallel Physical Signoff Solution",4/11/2017 7:30:00 PM
CDNS,Cadence Announces First Quarter 2017 Financial Results Webcast,4/7/2017 10:30:00 PM
CDNS,Cadence Unveils Expanded Virtuoso Advanced-Node Platform for 7nm Processes,4/5/2017 4:45:00 PM
