Ticker,Title,Link
MCK,Buy Rating Maintained for McKesson Despite Short-Term EPS Guidance Dip,9/5/2024 6:35:14 PM
MCK,"Medical distributors, health plans ink $300M opioid settlement",8/31/2024 1:29:49 PM
MCK,Hold Rating on McKesson Amid Acquisition Uncertainties,8/27/2024 8:45:47 AM
MCK,McKesson’s Strategic Acquisition Bolsters Oncology Market Share and Financial Outlook: Analyst Issues Buy Rating,8/26/2024 4:16:04 PM
MCK,McKesson in talks to acquire Florida cancer chain - Bloomberg,8/23/2024 7:13:06 PM
MCK,McKesson (MCK) Receives a Buy from Evercore ISI,8/16/2024 12:05:23 PM
MCK,"Analysts Conflicted on These Healthcare Names: Oric Pharmaceuticals (ORIC), Aerovate Therapeutics (AVTE) and McKesson (MCK)",8/13/2024 12:01:00 PM
MCK,Analysts Conflicted on These Healthcare Names: Harmony Biosciences Holdings (HRMY) and McKesson (MCK),8/12/2024 8:32:40 AM
MCK,McKesson (MCK) Gets a Hold from Wells Fargo,8/11/2024 4:57:16 PM
MCK,3 Healthcare Stocks to Sell in August Before They Crash & Burn,8/9/2024 4:02:42 PM
MCK,McKesson stock falls after the company misses quarterly revenue estimates,8/8/2024 4:51:20 PM
MCK,"McKesson Corp. Q1 Profit Decreases, But Beats Estimates ",8/7/2024 10:28:50 PM
MCK,Here's what Wall Street expects from McKesson's earnings report,8/6/2024 3:01:13 PM
MCK,"Earnings week ahead: Disney, Duke Energy, Palantir, Shopify, Uber and more",8/4/2024 12:00:00 PM
MCK,"Catalyst Watch: Disney earnings, Costco sales update, MicroStrategy split, and eyes on AI patents",8/2/2024 7:00:00 PM
MCK,McKesson hikes dividend by 15% to $0.71 per share,8/1/2024 12:07:32 PM
MCK,Healthy Profits: 7 Healthcare Stocks to Build a Lifetime of Wealth,7/30/2024 10:50:00 AM
MCK,"Analysts Offer Insights on Healthcare Companies: McKesson (MCK), Amedisys (AMED) and Draegerwerk AG & Co. KGaA (GB:0K5E)",7/24/2024 9:08:10 AM
MCK,McKesson (MCK) Receives a Buy from Barclays,7/22/2024 8:36:36 AM
MCK,"McKesson, Cardinal, Cencora interested in buying private cancer clinics - report",7/17/2024 9:51:42 PM
MCK,McKesson (MCK) Receives a Buy from Morgan Stanley,7/15/2024 12:26:37 PM
MCK,The 7 Most Undervalued Dividend Stocks to Buy in July 2024,7/11/2024 11:00:00 AM
MCK,Evercore ISI Sticks to Its Buy Rating for McKesson (MCK),7/10/2024 12:25:16 AM
MCK,7 ‘Buy and Hold Forever’ Stocks for Lasting Riches,7/9/2024 4:00:00 PM
MCK,McKesson’s Strategic Win: Analyst Upgrades Rating Amid Renewed IPC Contract,6/25/2024 9:56:38 AM
MCK,The 3 Healthiest Healthcare Stocks to Buy for a Huge Dose of Profits,6/23/2024 2:25:39 PM
MCK,McKesson Introduces FDA-Approved Prostate Cancer Drug,6/20/2024 9:38:12 PM
MCK,Mizuho Securities Keeps Their Hold Rating on McKesson (MCK),6/19/2024 4:38:35 AM
MCK,7 Trending Stocks With Momentum on Their Side,6/12/2024 10:43:00 AM
MCK,The 3 Best ETFs to Buy in June 2024,6/5/2024 12:00:00 PM
MCK,Bulletproof Your Retirement: 3 Stocks That Will Stand the Test of Time,6/2/2024 8:00:00 PM
MCK,Buy Rating Reaffirmed for McKesson on Strong Growth and Robust Financials,5/17/2024 9:15:59 AM
MCK,"Larry Robbins' Glenview Capital takes in Broadcom, exits Intel among Q1 moves",5/16/2024 3:01:24 PM
MCK,Health care is still very crowded but trades at a discount vs. history - BofA,5/14/2024 2:00:00 PM
MCK,8 out of 12 S&P 500 healthcare companies beat profit consensus this week: Earnings Scorecard,5/12/2024 3:22:00 PM
MCK,McKesson: Hold Rating Amidst Strong Outlook and Valuation Concerns,5/10/2024 6:09:07 AM
MCK,McKesson hits new all-time high as fiscal 2025 outlook pleases Street,5/8/2024 3:03:55 PM
MCK,"McKesson Corp. Q4 Profit Increases, but misses estimates",5/7/2024 10:17:45 PM
MCK,McKesson Q4 2024 Earnings Preview,5/6/2024 9:35:37 PM
MCK,"Catalyst Watch: Disney earnings, Apple iPad event and Fed speakers back on the circuit",5/3/2024 7:00:00 PM
MCK,Walgreens expands specialty pharmacy with unit dedicated to cell and gene therapies,4/25/2024 1:38:14 PM
MCK,McKesson declares $0.62 dividend,4/24/2024 12:24:03 PM
MCK,The Top 3 Healthcare Stocks to Buy in April 2024,4/22/2024 8:02:58 PM
MCK,Rite Aid delays major bankruptcy hearing to account for creditor deals,4/18/2024 6:46:57 PM
MCK,"Analysts Are Bullish on These Healthcare Stocks: Eli Lilly & Co (LLY), McKesson (MCK)",4/16/2024 4:20:14 AM
MCK,AbbVie keeps Humira market share near 100% despite biosimilars: report,4/13/2024 2:52:04 PM
MCK,Global Stock leaders for 2030 in Health Tech - UBS,4/10/2024 5:49:47 PM
MCK,"Markets broaden out as all-time highs are seen across ALL, CAT, DELL, RJF, and more",4/4/2024 4:49:47 PM
MCK,Rite Aid inks bankruptcy deal with stakeholders including McKesson,3/26/2024 4:57:39 PM
MCK,"Becton, Dickinson boosts syringe production amid FDA concerns on supplies",3/21/2024 2:22:39 PM
MCK,"Analysts Are Bullish on Top Healthcare Stocks: BeiGene (BGNE), McKesson (MCK)",2/26/2024 12:20:30 PM
MCK,Pharma middlemen face govt. scrutiny over generic drug shortages,2/14/2024 3:24:17 PM
MCK,"Analysts Offer Insights on Healthcare Companies: McKesson (MCK), Embecta Corporation (EMBC) and Abbott Labs (ABT)",2/12/2024 10:50:12 AM
MCK,"Medical Supplies-Focused McKesson Shares Fall On Q3 Earnings Performance, Analyst Says Street 'Wanted More'",2/8/2024 8:29:59 PM
MCK,"McKesson Corp. Q3 Profit Decreases, but beats estimates",2/7/2024 10:26:09 PM
MCK,McKesson Q3 2024 Earnings Preview,2/6/2024 10:35:55 PM
MCK,"Earnings week ahead: Alibaba, PepsiCo, Disney, Palantir, McDonalds, Ford and more",2/4/2024 1:45:00 PM
MCK,"Catalyst watch: Alibaba earnings, World Defense Show, Fed speakers unleashed and Super Bowl buzz",2/2/2024 8:00:00 PM
MCK,McKesson declares $0.62 dividend,2/1/2024 1:33:41 PM
MCK,3 Hidden Healthcare Stocks Poised for a Breakout This Year,1/30/2024 5:31:11 PM
MCK,Johnson & Johnson inks ~$150M deal with Washington State to settle opioid claims,1/24/2024 8:57:44 PM
MCK,Buy Rating for McKesson Corp. Amidst Favorable Economic Outlook and Strong Market Positioning,1/2/2024 3:05:39 PM
MCK,Silver Economy Successes: 3 Stocks Benefitting From an Aging Population,12/27/2023 7:37:23 PM
MCK,"Calliditas Therapeutics Scores Complete FDA Approval, Broader Label For Lead Kidney Disease Drug",12/21/2023 2:54:44 PM
MCK,Analysts Have Conflicting Sentiments on These Healthcare Companies: McKesson (MCK) and Ironwood Pharma (IRWD),12/14/2023 10:50:55 AM
MCK,What 5 Analyst Ratings Have To Say About McKesson,12/11/2023 4:00:27 PM
MCK,"Analysts Offer Insights on Healthcare Companies: Icon (ICLR), Becton Dickinson (BDX) and McKesson (MCK)",11/15/2023 1:30:51 PM
MCK,3 Biotech Stocks You’ll Regret Not Buying Soon: November 2023,11/14/2023 9:17:42 PM
MCK,3 Evergreen Stocks for Long-term Wealth Generation,11/9/2023 8:19:32 PM
MCK,Analyst Ratings for McKesson,11/3/2023 1:00:11 PM
MCK,"Analysts Offer Insights on Healthcare Companies: Moderna (MRNA), Humana (HUM) and McKesson (MCK)",11/2/2023 6:11:18 PM
MCK,"McKesson Corp. Q2 Profit Decreases, but beats estimates",11/1/2023 10:17:42 PM
MCK,McKesson earnings: here's what Wall Street expects,10/31/2023 3:01:13 PM
MCK,7 Healthcare Stocks That Can Cure a Lackluster Portfolio,10/19/2023 8:11:36 PM
MCK,"COWZ, SYLD: Two Unique ETFs with Scorching Returns ",10/7/2023 12:34:45 AM
MCK,Three stocks strategies heading into Q4 from Goldman,9/15/2023 10:46:50 AM
MCK,3 Defensive Stocks That Will Outperform the Market Over the Next 10 Years,9/12/2023 6:58:20 PM
MCK,2 Stocks Warren Buffett Is Loving (and One He Let Go),8/22/2023 3:20:55 PM
MCK,The 7 Most Undervalued Value Stocks to Buy Now: August 2023,8/18/2023 1:26:05 AM
MCK,Genpact Extends Relationship to Transform McKesson's Finance Operations for Enhanced Service and Competitive Growth,8/16/2023 10:30:00 PM
MCK,"Larry Robbins' Glenview Capital exits Alibaba in Q2, picks up stake in Warner Bros.",8/15/2023 8:57:12 PM
MCK,"Berkshire Hathaway Is Betting On US Housing Market: Buffett Bought These Stocks, Should You?",8/14/2023 11:41:55 PM
MCK,J.P. Morgan Keeps Their Buy Rating on McKesson (MCK),8/12/2023 12:15:30 PM
MCK,Amazon To Rally Over 66%? Here Are 10 Other Analyst Forecasts For Friday,8/11/2023 2:02:52 PM
MCK,Supreme Court to hear arguments on Purdue Pharma $6B bankruptcy settlement,8/10/2023 8:38:11 PM
MCK,Mizuho Securities Remains a Hold on McKesson (MCK),8/4/2023 7:55:19 AM
MCK,Expert Ratings for McKesson,8/3/2023 6:00:25 PM
MCK,"McKesson Corp. Q1 Profit Increases, beats estimates",8/2/2023 10:19:58 PM
MCK,McKesson is about to announce its earnings — here's what Wall Street expects,8/1/2023 3:01:13 PM
MCK,"Dividend Roundup: Wells Fargo, Visa, IBM, Hasbro, and more",7/28/2023 11:24:59 AM
MCK,7 Millionaire-Maker Healthcare Stocks to Buy Before the Window Closes,7/27/2023 1:42:27 PM
MCK,McKesson hikes dividend by 15% to $0.62,7/24/2023 12:02:21 PM
MCK,3 Healthcare Stocks Using AI to Deliver You Healthy Profits,7/18/2023 9:36:27 PM
MCK,"Analysts Offer Insights on Healthcare Companies: Oculis Holding (OCS), McKesson (MCK) and Silk Road Medical (SILK)",7/12/2023 1:03:08 AM
MCK,What 7 Analyst Ratings Have To Say About McKesson,6/29/2023 8:00:59 PM
MCK,Citi screens for most crowded short stocks with new model,6/28/2023 10:49:41 AM
MCK,The 3 Best Healthcare Stocks to Buy for June 2023,5/29/2023 7:13:25 PM
MCK,Hyatt Hotels To Rally Over 26%? Here Are 10 Other Analyst Forecasts For Friday,5/12/2023 2:22:06 PM
MCK,Where McKesson Stands With Analysts,5/9/2023 11:01:28 PM
MCK,"McKesson Corp. Q4 Profit Increases, beats estimates",5/8/2023 10:23:23 PM
MCK,Notable earnings after Monday's close,5/7/2023 9:35:00 PM
MCK,"Eli Lilly, Humana among best health care names in defensive environment - BofA",5/6/2023 8:00:00 PM
MCK,McKesson looks to strong fiscal 2023 Q4 results amid paltry YTD return,5/5/2023 6:20:06 PM
MCK,Morgan Stanley's Wilson screens for stocks as earnings stabilize but data disappoints,5/1/2023 12:33:59 PM
MCK,McKesson declares $0.54 dividend,4/27/2023 12:10:38 PM
MCK,Bipartisan agreement reached in Senate prescription drug price legislation,4/25/2023 3:38:42 PM
MCK,COWZ ETF: A Cash Cow for Your Portfolio,4/19/2023 1:24:40 AM
MCK,"Analysts Offer Insights on Healthcare Companies: McKesson (MCK), NeoGenomics (NEO) and Allakos (ALLK)",4/11/2023 10:20:16 AM
MCK,Analyst Expectations for McKesson's Future,3/31/2023 10:00:51 PM
MCK,7 Healthcare Stocks to Buy for Long-Term Growth and Stability,3/21/2023 8:13:55 PM
MCK,Sleep-at-night stocks for those hedging or risk averse,3/8/2023 11:41:29 AM
MCK,Top stock picks for 2023 from BofA - healthcare,2/8/2023 11:29:29 AM
MCK,Wall Street Analysts Are Bullish on Top Healthcare Picks,2/3/2023 12:20:08 PM
MCK,Barclays Remains a Buy on McKesson (MCK),2/2/2023 11:05:19 AM
MCK,McKesson Corp. Q3 Earnings Summary,2/1/2023 10:31:59 PM
MCK,McKesson Q3 2023 Earnings Preview,1/31/2023 10:35:31 PM
MCK,McKesson declares $0.54 dividend,1/26/2023 1:02:13 PM
MCK,The 5 Best Cloud Computing Stocks to Buy for 2023,1/19/2023 11:26:48 PM
MCK,Morgan Stanley Maintains Overweight Rating for McKesson: Here's What You Need To Know,1/6/2023 6:00:20 PM
MCK,"Walgreens, CVS, Walmart in opioid settlements with Oklahoma",1/4/2023 5:55:05 PM
MCK,McKesson Stock (NYSE:MCK) Gained 52% in 2022. Can Its Momentum Continue?,1/3/2023 10:16:37 PM
MCK,3 Stocks to Sell Ahead of a Recession in 2023,12/29/2022 4:07:30 PM
MCK,The 7 Best Bear Market Stocks to Buy Now,12/20/2022 5:00:22 PM
MCK,Citi lists the contrarian bull and bear stock calls for 2023,12/17/2022 11:38:17 PM
MCK,Why Invest In This European Bank? Jim Cramer Says 'We've Got So Many Good Banks In Our Country',11/16/2022 2:26:15 PM
MCK,"Healthcare stocks come off lows, worst performing sector among defensive losers (update)",11/11/2022 8:16:39 PM
MCK,Cardinal Health upgraded at Bank of America on pharma performance,11/4/2022 4:46:31 PM
MCK,CAH vs. MCK: These Healthcare Stocks are Hot and Can Stay Hot,11/3/2022 11:46:57 PM
MCK,5 Analysts Have This to Say About McKesson,11/2/2022 4:18:57 PM
MCK,McKesson Lifts FY Profit Outlook ,11/1/2022 10:39:08 PM
MCK,McKesson FQ2 2023 Earnings Preview,10/31/2022 9:35:58 PM
MCK,Pharma distributors shining bright ahead of earnings,10/30/2022 4:00:47 PM
MCK,McKesson declares $0.54 dividend,10/27/2022 12:34:13 PM
MCK,"'Right Now I Don't Want To Back Away From It,' Jim Cramer Says About This Stock Down Only 8% This Year",10/24/2022 1:58:47 PM
MCK,7 Warren Buffett Stocks to Buy and Hold for the Next Decade,10/17/2022 8:45:18 PM
MCK,"Use short-term rallies to boost high-momentum stock exposure, Wells Fargo says",10/5/2022 12:15:30 PM
MCK,McKesson extends distribution partnership with CVS Health,9/29/2022 8:22:28 PM
MCK,Biden administration allocates $1.5B to address U.S. opioid crisis,9/23/2022 11:08:24 AM
MCK,McKesson To Acquire Rx Savings Solutions - Quick Facts ,9/19/2022 2:39:49 PM
MCK,Where McKesson Stands With Analysts,9/12/2022 4:22:16 PM
MCK,Where McKesson Stands With Analysts,8/22/2022 7:30:18 PM
MCK,"Activist interest in Cardinal Health could unlock value, improve margins - Morgan Stanley",8/16/2022 4:13:18 PM
MCK,"Warren Buffett's Berkshire Hathaway increases stake in Ally, Activision",8/15/2022 9:00:03 PM
MCK,McKesson hits 52-week high; shares up 44% YTD,8/9/2022 5:28:42 PM
MCK,Credit Suisse Lifts Price Targets For Drug Distributors After Solid Q2 Performance,8/8/2022 8:06:45 PM
MCK,What 6 Analyst Ratings Have To Say About McKesson,8/4/2022 8:16:04 PM
MCK,"McKesson Q1 Profit Rises, Lifts FY22 EPS Outlook ",8/3/2022 11:19:30 PM
MCK,Notable earnings after Wednesday's close (updated),8/2/2022 9:35:54 PM
MCK,Drug distributors reach $400M opioid deal with West Virginia,8/1/2022 8:27:52 PM
MCK,"Teva Pharmaceutical in $4.35B opioid settlement with states, Native American tribes",7/27/2022 2:06:05 AM
MCK,McKesson raises dividend by 15% to $0.54/share,7/25/2022 12:02:22 PM
MCK,7 Best Cash Cow Stocks to Buy for Stable Returns,7/24/2022 3:00:43 PM
MCK,Goldman screens stocks most and least vulnerable to recession margin pressure,7/11/2022 3:29:42 PM
MCK,"Benzinga Before The Bell: Record Inflows In 'Short Bitcoin' Funds, Elon Musk's Trillionaire Possibility, Gmail's Political Bias And Other Top Financial Stories Tuesday, July 5",7/5/2022 2:38:02 PM
MCK,10 Warren Buffett Stocks to Buy for the Second Half of 2022,6/30/2022 4:51:00 PM
MCK,British Columbia reaches $150M settlement with Purdue Pharma over opioid damages,6/29/2022 5:00:41 PM
MCK,7 Warren Buffett Stocks to Buy for a Bear Market,6/27/2022 11:00:21 AM
MCK,"McKesson, HCA Healthcare To Form JV For Cancer Research ",6/23/2022 3:27:43 PM
MCK,5 Cash-Cow Stocks to Buy for a Turbulent Market,6/10/2022 12:01:26 PM
MCK,McKesson upgraded at Deutsche Bank as a defensive play amid recessionary risk,6/7/2022 6:49:51 PM
MCK,"Thomas Gayner Purchases 5,000 Shares of Cable One (CABO) For Markel",6/6/2022 5:00:15 PM
MCK,Executives Sell Over $100M Of 4 Stocks,6/1/2022 2:44:41 PM
MCK,"Q1 13F Roundup: How Buffett, Einhorn, Ackman And Others Adjusted Their Portfolios",5/17/2022 7:25:10 PM
MCK,4 Analysts Have This to Say About McKesson,5/11/2022 10:02:51 PM
MCK,7 Stock Picks to Play the Post-Pandemic Return of Dental Visits,5/9/2022 10:56:18 PM
MCK,McKesson target raised at Baird; says upper limit of outlook could be “lower end of reality”,5/6/2022 6:48:16 PM
MCK,"McKesson Corp. Q4 Profit Decreases, misses estimates",5/5/2022 10:21:06 PM
MCK,Notable earnings after Thursday's close,5/4/2022 9:35:55 PM
MCK,Distributors Reach $518 Mln Opioid-related Settlement With Washington State ,5/3/2022 3:04:36 PM
MCK,"Catalyst watch: Eyes on FOMC, OPEC meeting, jobs report and Dell",4/29/2022 7:00:52 PM
MCK,McKesson declares $0.47 dividend,4/28/2022 12:08:12 PM
MCK,"San Francisco To Start Opioid Epidemic Trial Against Teva, Walgreen: Reuters",4/25/2022 10:11:22 PM
MCK,Sustainability of strength in staples comes into question,4/21/2022 7:06:55 PM
MCK,"JNJ, McKesson, Endo Settle $275M Opioid Claims With Alabama: Reuters",4/20/2022 9:51:56 PM
MCK,"Cardinal Health upgraded, AmerisourceBergen downgraded at Morgan Stanley",4/12/2022 7:16:23 PM
MCK,10 Stocks That Have Moved Over 20% Since The Indices Plummeted,4/8/2022 8:52:36 PM
MCK,"West Virginia Says J&J, Teva, AbbVie Caused 'Tsunami' Of Opioid Addiction: Reuters",4/4/2022 9:09:14 PM
MCK,McKesson's sale of European businesses to Phoenix approved except for France,3/30/2022 5:47:59 PM
MCK,Appeal of Purdue Pharma $6B opioid settlement to be heard in late April,3/23/2022 4:52:39 PM
MCK,"Teva, AbbVie unit reach $107M opioid settlement with Rhode Island",3/21/2022 8:52:27 PM
MCK,Cardinal Health gains on vague takeover speculation,3/17/2022 4:24:13 PM
MCK,McKesson To Pay $1 Mln To Resolve Recordkeeping Violations: DoJ ,3/14/2022 10:47:17 PM
MCK,Johnson & Johnson to pay $5B as part of landmark opioid settlement,2/25/2022 2:17:56 PM
MCK,10 Biggest Price Target Changes For Tuesday,2/8/2022 2:22:28 PM
MCK,"McKesson downgraded at Deutsche Bank on potential COVID-related ""earnings hole""",2/4/2022 7:24:56 PM
MCK,McKesson climbs after earnings beat as Baird raises price target,2/3/2022 7:31:46 PM
MCK,McKesson Lifts FY Profit Outlook ,2/2/2022 11:12:47 PM
MCK,Notable earnings after Wednesday's close,2/1/2022 10:35:29 PM
MCK,McKesson declares $0.47 dividend,1/27/2022 1:11:44 PM
MCK,7 Low Labor-Cost Stocks to Buy for Solid Margins in 2022,1/21/2022 6:35:54 PM
MCK,3 New ETFs to Put on Your January Buy List,1/18/2022 7:57:17 PM
MCK,Where McKesson Stands With Analysts,1/7/2022 8:03:56 PM
MCK,N.Y. jury has found Teva guilty in opioid trial; pharma distributors not guilty (updated),12/30/2021 5:04:38 PM
MCK,Endo to pay $63M to settle Texas opioid claims,12/23/2021 8:53:48 PM
MCK,McKesson To Sell Its Austrian Business To Quadrifolia Management - Quick Facts ,12/20/2021 12:31:08 PM
MCK,10 Biggest Price Target Changes For Thursday,12/9/2021 4:28:22 PM
MCK,AbbVie division Allergan in $200M settlement with New York over role in opioid crisis,12/8/2021 5:37:40 PM
MCK,What 5 Analyst Ratings Have To Say About McKesson,12/6/2021 5:12:15 PM
MCK,Walgreens Agrees With McKesson To Take Full Control Of Joint German Pharma Wholesaling Operations ,11/30/2021 2:17:05 PM
MCK,2 Moonshots That Insiders Are Buying… and 3 They’re Not,11/9/2021 3:35:45 PM
MCK,10 Biggest Price Target Changes For Tuesday,11/2/2021 1:17:32 PM
MCK,McKesson Lifts FY Earnings Guidance ,11/1/2021 10:35:39 PM
MCK,McKesson FQ2 2022 Earnings Preview,10/31/2021 9:35:00 PM
MCK,McKesson declares $0.47 dividend,10/28/2021 12:18:10 PM
MCK,Johnson & Johnson to pay $290M in Texas as part of opioid settlement,10/26/2021 4:22:08 PM
MCK,"Cannabis Movers & Shakers: Dosist, Lantern, Hollister, Ascend Wellness, Volunteer Botanicals",10/20/2021 2:18:45 PM
MCK,Endo Shares Move Higher On Settlement Of New York State Opioid Cases,9/10/2021 1:31:21 PM
MCK,Johnson & Johnson strikes opioid settlement in DC,8/23/2021 6:08:51 PM
MCK,McKesson Corporation -- Moody's assigns Baa2 rating to McKesson Corporation's new senior unsecured bonds; outlook stable,8/9/2021 10:28:00 PM
MCK,McKesson Corp. Q1 adjusted earnings Beat Estimates,8/4/2021 10:16:40 PM
MCK,Notable earnings after Wednesday's close,8/3/2021 9:35:34 PM
MCK,Here's what Wall Street expects from McKesson's earnings report,8/2/2021 3:02:05 PM
MCK,McKesson raises dividend by 12% to $0.47 per share,7/26/2021 12:06:03 PM
MCK,McKesson to decide future of its U.K. pharmacy chain ‘within days’ – Sky News,7/23/2021 4:06:42 PM
MCK,Cardinal Health to record $140M pre-tax charge linked to opioid settlement,7/22/2021 12:36:22 PM
MCK,"Johnson & Johnson, Drug Distributors Settle $26 Bln Opioid Deal ",7/21/2021 11:44:50 PM
MCK,"JNJ, drug distributors favored on Street as they near $26B opioid settlement with U.S.",7/20/2021 5:06:36 PM
MCK,McKesson commences tender offer to buy up to $500M debt,7/8/2021 3:06:57 PM
MCK,McKesson To Divest Certain European Businesses To PHOENIX Group - Quick Facts ,7/7/2021 2:40:05 PM
MCK,The trend is your friend --  what worked in June,7/2/2021 1:32:21 PM
MCK,"New York Takes Drugmakers, Drug Retailers To Legal Trial Over Opioid",6/29/2021 9:24:57 PM
MCK,JNJ viewed favorably by analysts after opioid settlement with New York,6/28/2021 8:33:39 PM
MCK,J&J to stop selling opioid meds as part of $230M settlement with New York,6/26/2021 3:19:47 PM
MCK,"Gemini Therapeutics defended, Cassava Sciences price target lifted; in today’s analyst action",6/23/2021 1:18:32 PM
MCK,McKesson is exploring a sale of its European and U.K. businesses: Bloomberg,6/22/2021 8:16:24 PM
MCK,Mirion Technologies Gets SPAC Deal With GSAH: What Investors Should Know,6/17/2021 5:09:27 PM
MCK,Cerner Might Be an Acquisition Target Soon,6/2/2021 7:39:38 PM
MCK,Stocks That Hit 52-Week Highs On Monday,5/10/2021 5:26:20 PM
MCK,McKesson rebounds as fiscal 2022 outlook beats estimates,5/7/2021 3:54:21 PM
MCK,McKesson Corp. Q4 adjusted earnings Beat Estimates,5/6/2021 10:24:00 PM
MCK,McKesson Q4 2021 Earnings Preview,5/5/2021 9:35:54 PM
MCK,McKesson is about to announce earnings — here's what Wall Street expects,5/4/2021 3:02:12 PM
MCK,"The Daily Biotech Pulse: Quidel Slides On Negative Pre-Announcement, Roche Gets Positive EMA Committee Recommendation, 3 IPOs",4/23/2021 1:28:48 PM
MCK,Drugmakers go on trial for opioid epidemic in California,4/19/2021 10:45:46 AM
MCK,Stocks That Hit 52-Week Highs On Tuesday,3/30/2021 4:53:45 PM
MCK,"Sacklers raise opioid settlement offer to $4.3B, Reuters says",3/11/2021 7:37:14 PM
MCK,Baird settles more into upside view on pharma services,3/10/2021 12:34:24 AM
MCK,McKesson Corporation -- Moody's announces completion of a periodic review of ratings of McKesson Corporation,3/1/2021 8:51:00 PM
MCK,"McKesson hires bankers to sell UK operation, Sky News says",2/16/2021 2:21:40 PM
MCK,"McKesson top-line sees 6% growth in FQ3, revises fiscal 2021 guidance",2/2/2021 3:00:52 PM
MCK,McKesson FQ3 2021 Earnings Preview,2/1/2021 8:18:03 PM
MCK,McKesson earnings: here's what Wall Street expects,1/31/2021 3:01:27 PM
MCK,The InvestorPlace Q&A: Embrace the Food Revolution With the ANEW ETF,1/29/2021 2:36:29 PM
MCK,Pfizer/BioNTech COVID-19 vaccine supply to rise with FDA label change,1/24/2021 4:48:59 AM
MCK,10 Stocks That Earned Short Sellers The Most Profits In 2020,1/23/2021 7:12:35 PM
MCK,Biden Stocks: 16 Stocks to Watch for a Defense Production Act Boost,1/21/2021 4:25:23 PM
MCK,"Larry Robbins hedge fund indicates top fund holdings as 2021 picks, a mixed pack",12/31/2020 5:05:42 PM
MCK,Moderna’s COVID-19 vaccine goes under review,12/17/2020 2:36:53 PM
MCK,Moderna vaccine rollout far-reaching and double that of Pfizer,12/15/2020 10:46:11 AM
MCK,McKesson Corporation -- Moody's rates McKesson Corporation's new senior unsecured bonds at Baa2,11/30/2020 7:45:00 PM
MCK,Purdue Pharma pleads guilty to criminal opioid crisis charges,11/25/2020 8:49:37 AM
MCK,McCormick looks for some spice with Cholula acquisition,11/24/2020 7:32:13 AM
MCK,McKesson lands on Goldman's Conviction Buy List,11/18/2020 1:27:18 PM
MCK,"CVS, Walgreens, and Rite Aid are all tumbling after Amazon's Pharmacy launch",11/17/2020 12:23:10 PM
MCK,Drug wholesalers and J&J agree to tentative $26B deal to settle opioid lawsuits,11/6/2020 3:34:01 PM
MCK,McKesson Corp. Raises Earnings Guidance - Quick Facts ,11/3/2020 1:18:24 PM
MCK,McKesson Q2 2021 Earnings Preview,11/2/2020 6:09:18 PM
MCK,McKesson declares $0.42 dividend,10/29/2020 8:49:21 PM
MCK,OxyContin maker Purdue Pharma to plead guilty to three criminal charges,10/21/2020 2:10:42 PM
MCK,"Baird bullish, but 'patient,' on drug distributors heading into earnings",10/16/2020 2:16:04 AM
MCK,McKesson Corp. Raises 2021 Earnings Guidance - Quick Facts ,8/3/2020 1:17:27 PM
MCK,McKesson is about to announce its earnings — here's what to expect,8/2/2020 3:01:28 PM
MCK,A Single Exemplary Quarter Won’t  Fix Rite Aid’s Problems,7/6/2020 2:31:38 PM
MCK,New strategy chief at McKesson,6/4/2020 8:31:51 PM
MCK,Positive drug distributor trends will outlast pandemic impact - Baird,6/2/2020 11:32:37 PM
MCK,"4 Top Stock Trades for Thursday: LOW, TGT, MRNA, MCK",5/20/2020 8:44:43 PM
MCK,Notable earnings before Wednesday's open,5/19/2020 9:30:30 PM
MCK,McKesson Corporation -- Moody's announces completion of a periodic review of ratings of McKesson Corporation,4/6/2020 4:42:00 PM
MCK,McKesson business development chief to depart March 31,3/23/2020 8:54:33 PM
MCK,McKesson updates earnings guidance after exit from Change Healthcare,3/17/2020 8:59:32 PM
MCK,"Moody's – More opioid settlements likely in 2020, with mainly negative credit impact for defendants",3/12/2020 12:07:00 PM
MCK,Mixed shelf roundup - healthcare,3/2/2020 5:09:38 PM
MCK,Potholes Remain for Teva Pharmaceutical Stock,2/26/2020 3:02:08 PM
MCK,Google Stock Will Trend Higher via Diverse Opportunities,2/18/2020 1:07:01 PM
MCK,"3 Big Stock Charts for Thursday: MetLife, Henry Schein, and Sealed Air",2/13/2020 12:13:12 PM
MCK,Stock Alert: McKesson Corp. (MCK) Shares Hit New 52-Week High ,2/12/2020 10:05:40 AM
MCK,McKesson Launches Split-off Of Investment In Change Healthcare - Quick Facts ,2/10/2020 1:57:23 PM
MCK,Stock Alert: McKesson Corp. (MCK) Shares Hit 52-Week High ,2/7/2020 4:34:29 PM
MCK,3 Healthcare Stocks to Buy This Week Ahead of Earnings,2/4/2020 4:49:26 PM
MCK,McKesson earnings preview: what Wall Street is expecting,2/3/2020 3:01:44 PM
MCK,McKesson Corporation -- Moody's affirms McKesson's Baa2 senior unsecured rating; outlook stable,1/17/2020 10:30:00 PM
MCK,"3 Big Stock Charts for Thursday: Broadcom, Kimberly-Clark, and McKesson",1/16/2020 12:16:45 PM
MCK,"Debt, Not Regulation, Is the Biggest Problem for Teva Stock",1/2/2020 1:00:28 PM
MCK,McKesson Corp. Reaffirms FY20 Adj. Earnings Guidance - Quick Facts ,12/18/2019 2:45:40 PM
