Ticker,Title,Link
MCK,"Walgreens, McKesson To Combine Pharmaceutical Wholesale Businesses In Germany ",12/12/2019 10:37:59 AM
MCK,McKesson Reaffirms FY20 Adj. EPS Outlook - Quick Facts ,10/30/2019 12:35:36 PM
MCK,Stock Market Today: Stocks Rally Ahead of Big Earnings Week,10/21/2019 8:16:27 PM
MCK,"Opioid distributors soar after reportedly offering $18 billion to settle a swath of drug crisis lawsuits (MCK, ABC, CAH)",10/16/2019 3:18:06 PM
MCK,"3 Big Stock Charts for Wednesday: McKesson, O’Reilly Automotive and Seagate Technology",8/14/2019 11:35:07 AM
MCK,"Opioid distributors accused of fueling the national epidemic sink after offering a $10 billion settlement (ABC, MCK, CAH)",8/6/2019 10:45:05 PM
MCK,"AMRN'S Vascepa Hits Record Sales, ADMP Slumps On Stock Offering, SRDX On Watch… ",8/1/2019 10:04:07 AM
MCK,EARNINGS SUMMARY: Details of McKesson Corp. Q1 Earnings Report,7/31/2019 11:15:59 PM
MCK,Here's what to expect from McKesson's earnings,7/29/2019 3:02:47 PM
MCK,"3 Big Stock Charts for Tuesday: McKesson, Dish Network and Gilead Sciences",6/18/2019 12:30:02 PM
MCK,"3 Big Stock Charts for Monday: CenterPoint Energy, McKesson and Coca-Cola",6/10/2019 12:19:49 PM
MCK,McKesson Corporation -- Moody's announces completion of a periodic review of ratings of McKesson Corporation,5/17/2019 11:48:00 PM
MCK,"McKesson meets full-year profit estimates, renews partnership with CVS",5/8/2019 7:49:11 PM
MCK,Here's what Wall Street expects from McKesson's earnings,5/6/2019 3:02:38 PM
MCK,UPDATE 2-McKesson to pay $37 million to resolve West Virginia opioid lawsuit,5/2/2019 6:29:42 PM
MCK,McKesson Appoints Brian Tyler New CEO ,4/1/2019 2:26:48 PM
MCK,FDA Issues Warning Letter To Drug Distributor McKesson ,2/12/2019 10:51:09 PM
MCK,McKesson Corp. Updates FY19 Earnings Guidance - Quick Facts ,1/31/2019 10:38:34 PM
MCK,"Change Healthcare Holdings LLC -- Moody's downgrades Change Healthcare's CFR to B2, facility ratings to B1/Caa1; outlook stable",1/30/2019 11:35:00 PM
MCK,McKesson Corporation -- Moody's assigns Baa2 to McKesson's new senior unsecured notes,11/29/2018 12:58:00 AM
MCK,McKesson Corp.: Brian Tyler To Succeed Hammergren As CEO - Quick Facts ,11/1/2018 10:00:39 PM
MCK,McKesson Corp. Updates Earnings Guidance - Quick Facts ,10/25/2018 1:50:24 PM
MCK,What Wall Street expects from McKesson's earnings,10/23/2018 3:02:10 PM
MCK,McKesson Corp. Q1 adjusted earnings Beat Estimates,7/26/2018 1:24:22 PM
MCK,Here's what Wall Street expects from McKesson's earnings report,7/24/2018 3:02:12 PM
MCK,McKesson Affirms FY Adj. EPS Outlook; Issues Preliminary Q1 Guidance ,6/28/2018 3:08:03 PM
MCK,"Pharmapacks Raises $32.5 Million to Fund Expansion, Automation and Talent Acquisition",6/12/2018 3:00:00 PM
MCK,McKesson Corp. Q4 adjusted earnings Miss Estimates,5/24/2018 1:13:29 PM
MCK,BRIEF-McKesson Board Of Directors Elects Brad Lerman As New Independent Director,4/30/2018 3:23:50 PM
MCK,McKesson To Review Cost Structure; To Buy Medical Specialties Distributors ,4/25/2018 11:15:58 PM
MCK,McKesson Corporation -- Moody's assigns Baa2 to McKesson's new Euro and US notes,2/8/2018 12:42:00 AM
MCK,"McKesson Corporation Announces Offer to Purchase Up to $1,100,000,000 Combined Purchase Price of Outstanding 6.000% Notes due 2041, 7.650% Debentures due 2027, 4.883% Notes due 2044, 4.",2/7/2018 9:58:00 AM
MCK,McKesson Declares Dividend - Quick Facts ,2/1/2018 1:17:21 PM
MCK,"UPDATE 1-New Mexico adds Insys, Mallinckrodt to opioid epidemic lawsuit (JNJ, AGN, ENDP, TEVA, MCK, CAH, ABC)",12/20/2017 9:52:03 PM
MCK,"BRIEF-Mckesson Announces Departure Of James Beer, EVP And CFO (MCK)",12/18/2017 3:22:03 PM
MCK,McKesson unit wins $400 mln U.S. defense contract -Pentagon (MCK),12/15/2017 11:22:03 PM
MCK,BRIEF-Mckesson Medical-Surgical Says Signed Exclusive Agreement With Biomérieux To Serve U.S. Community Hospital Market​ (MCK),12/14/2017 2:27:09 PM
MCK,BRIEF-Manson Creek Says Non-Brokered Private Placement Of Up To 1 Million Units (MCK),12/5/2017 9:07:03 PM
MCK,"UPDATE 1-Trump administration proposes Medicare rules aimed at opioids, drug costs (ESRX, ABC, MCK)",11/17/2017 2:12:06 AM
MCK,McKesson To Buy RxCrossroads ,11/6/2017 10:33:15 PM
MCK,"BRIEF-MCKESSON SIGNS AGREEMENT WITH NRG TO INSTALL SOLAR ARRAYS AT MCKESSON FACILITY (MCK, NRG)",10/30/2017 1:42:06 PM
MCK,UPDATE 1-Drug distributor McKesson's quarterly profit beats estimates (MCK),10/26/2017 1:37:11 PM
MCK,"Patterson Companies Names Mark Walchirk President And CEO, Succeeding Wiltz ",10/24/2017 2:16:10 PM
MCK,"BRIEF-‍BIOLOGICS SAYS SELECTED BY ELI LILLY TO BE IN LIMITED DISTRIBUTION NETWORK FOR VERZENIO​ (LLY, MCK)",10/11/2017 5:47:03 PM
MCK,"BRIEF-NY A.G. Schneiderman, coalition of AGs expand investigation into opioid crisis (AGN, ENDP, JNJ, TEVA, ABC, CAH, MCK)",9/19/2017 6:42:09 PM
MCK,"UPDATE 1-New Mexico sues opioid drug manufacturers, distributors (JNJ, AGN, ENDP, TEVA, MCK, CAH, ABC)",9/7/2017 10:02:12 PM
MCK,"RPT-Wal-Mart, Walgreens, CVS turn up the heat on generic drugmaker deals (WMT, CAH, ABC, TEVA, ENDP, ESRX, CVS, MCK)",8/4/2017 1:17:05 PM
MCK,Allscripts Announces Upward Adjustments To Non-GAAP Revenue Target For 2017 ,8/3/2017 10:50:24 PM
MCK,"UPDATE 1-U.S. Senator expands opioid probe to distributors, drugmakers (ENDP, TEVA, AGN, JNJ, MYL, DEPO, MCK, ABC, CAH)",7/27/2017 9:12:08 PM
MCK,"UPDATE 1-McKesson shareholders vote against exec pay structure (MCK, ABC, CAH)",7/26/2017 6:58:03 PM
MCK,"UPDATE 1-Three US state treasurers seek change in McKesson exec pay policy (MCK, CAH, ABC)",7/25/2017 9:22:03 PM
MCK,Teamsters urge McKesson shareholders to vote against CEO pay (MCK),7/10/2017 6:12:03 PM
MCK,BRIEF-McKesson reaffirms fiscal 2018 guidance (MCK),6/28/2017 3:08:03 PM
MCK,"RPT-U.S. Supreme Court ruling threatens massive talc litigation against J&J (JNJ, BMY, BAYN, GSK, MCK)",6/21/2017 1:10:09 PM
MCK,BRIEF-Mckesson CEO John Hammergren's FY2017 total compensation was $20.1 mln (MCK),6/16/2017 2:48:05 PM
MCK,McKesson Remains Firmly Positive In Late-Day Trading ,5/19/2017 9:55:32 PM
MCK,McKesson Corp. Bottom Line Climbs 29% In Q4,5/18/2017 10:39:33 PM
MCK,BRIEF-Uniprix shareholders approve at 95% Mckesson Canada's bid to acquire Uniprix (MCK),5/16/2017 11:46:04 PM
MCK,UPDATE 1-Arkansas preparing for executions despite halts from courts (MCK),4/20/2017 8:05:08 PM
MCK,"UPDATE 2-Company sues Arkansas, charging fraud over lethal injection drugs (MCK)",4/19/2017 5:31:06 AM
MCK,"The makers of a lethal-injection drug have become leaders in Arkansas' death-penalty battle (PFE, MCK)",4/18/2017 2:44:09 AM
MCK,BRIEF-Mckesson Canada announces plan to acquire Uniprix (MCK),4/12/2017 10:15:07 PM
MCK,Big Data Poses Big Headaches as Health Care Industry Adopts HIT Systems,3/22/2017 1:30:00 PM
MCK,"Research Reports Initiation on Services Stocks -- GNC Holdings, Cardinal Health, AmerisourceBergen, and McKesson",3/17/2017 12:30:00 PM
MCK,BRIEF-Mckesson anticipates recording pre-tax gain of about $2.9 to $3.5 bln in Q4 (MCK),3/2/2017 5:36:22 PM
MCK,BRIEF-Manson Creek annouces new property acquisition (MCK),2/28/2017 3:50:13 PM
MCK,"UPDATE 3-Cardinal Health profit beats estimates on lower costs (MCK, ABC, CAH)",2/7/2017 6:40:11 PM
MCK,BRIEF-McKesson to acquire CoverMyMeds for about $1.1 bln (MCK),1/25/2017 10:24:05 PM
MCK,BRIEF-McKesson receives regulatory approval for Rexall Health acquisition (MCK),12/14/2016 5:30:03 PM
MCK,"BRIEF-Moody's says largest US drug distributors face pricing pressure as they court independent pharmacies (ABC, CAH, MCK)",11/29/2016 8:06:04 PM
MCK,"Drug wholesalers are getting slammed after McKesson warned that cost scrutiny is hurting its business (MCK, ABC, CAH)",10/29/2016 1:30:58 AM
MCK,BRIEF-McKesson sets regular quarterly dividend of $0.28per share (MCK),10/27/2016 11:20:20 PM
MCK,ISS urges vote against four McKesson directors over CEO pay,7/15/2013 7:34:29 AM
MCK,Investment adviser opposes McKesson CEO's re-election: WSJ,7/1/2013 8:25:42 AM
MCK,"Board of Directors Set for Eddie Bauer Holdings, Inc.",5/23/2005 4:07:00 PM
