Ticker,Title,Link
DDOG,"New Buy Rating for Datadog (DDOG), the Technology Giant",8/15/2024 7:16:15 AM
DDOG,"CDNS, DDOG, FSLR: Which Strong Buy-Rated Tech Stock’s a Better Buy?",8/14/2024 2:04:27 PM
DDOG,Datadog’s Growth Trajectory Bolstered by AI Tailwinds and Competitive Consolidation: A Buy Rating,8/13/2024 9:16:45 AM
DDOG,"Analysts Offer Insights on Technology Companies: Datadog (DDOG), Fidelity National Info (FIS) and Allegro MicroSystems (ALGM)",8/12/2024 6:32:03 AM
DDOG,Datadog (DDOG): New Buy Recommendation for This Technology Giant,8/9/2024 1:46:39 PM
DDOG,Kash Rangan Recommends Buy on Datadog Citing Strong Financials and Growth Potential,8/8/2024 5:45:42 PM
DDOG,3 Stocks to Dump as Investors Rotate to Dow Jones Components,8/7/2024 8:30:00 PM
DDOG,3 Cloud Computing Stocks Benefiting from Increased Demand,8/5/2024 7:34:00 PM
DDOG,"Dynatrace, Elastic, JFrog, SentinelOne, Zoom Video potential M&A targets - analyst",8/4/2024 1:00:41 PM
DDOG,"Catalyst Watch: Disney earnings, Costco sales update, MicroStrategy split, and eyes on AI patents",8/2/2024 7:00:00 PM
DDOG,Bank of America Securities Sticks to Its Buy Rating for Datadog (DDOG),8/1/2024 1:23:10 PM
DDOG,"Analysts’ Top Technology Picks: CyberArk Software (CYBR), Datadog (DDOG)",7/27/2024 9:05:46 AM
DDOG,"MU, INTU, DDOG: Which Tech Stock Is the Best Buy on Weakness?",7/26/2024 12:45:27 AM
DDOG,3 Hypergrowth AI Stocks Every Investor Must Own,7/25/2024 4:21:33 PM
DDOG,The 7 Most Undervalued Stocks in the Nasdaq-100 You Must Not Ignore,7/23/2024 2:30:00 PM
DDOG,Buy Rating Reiterated for Datadog Amid Strong Growth and Positive Market Outlook,7/18/2024 3:35:23 PM
DDOG,3 Cloud Computing Stocks That Could Be Multibaggers in the Making: July Edition,7/17/2024 8:19:11 PM
DDOG,Datadog (DDOG): New Buy Recommendation for This Technology Giant,7/15/2024 12:05:48 PM
DDOG,"New Buy Rating for Datadog (DDOG), the Technology Giant",7/12/2024 9:35:39 AM
DDOG,7 Solid Growth Stocks to Buy and Hold for the Next Decade,7/11/2024 7:30:20 PM
DDOG,7 Cloud-Computing Stocks That Can Rain Profits in Your Portfolio,7/9/2024 7:37:32 PM
DDOG,3 Overvalued Tech Stocks Heading for a Fall,7/7/2024 12:00:00 PM
DDOG,Here's Why Paycom is a Promising Portfolio Pick Now,7/5/2024 9:50:12 PM
DDOG,Datadog continues gains for seven straight sessions,7/1/2024 8:01:08 PM
DDOG,Datadog’s Market Leadership and Growth Prospects Reinforced by New Product Developments and Positive Customer Feedback,6/28/2024 11:55:33 AM
DDOG,Stifel Nicolaus Reaffirms Their Buy Rating on Datadog (DDOG),6/27/2024 12:25:09 PM
DDOG,Buy Rating Affirmed for Datadog on Strong Product Innovation and Market Share Growth,6/26/2024 10:15:16 PM
DDOG,"Catalyst Watch: Nike earnings, Datadog event, Norfolk Southern decision, and an oil field-crypto IPO",6/21/2024 7:00:42 PM
DDOG,Beyond Nvidia: 5 AI Stocks to Buy this June,6/19/2024 1:07:00 PM
DDOG,Analysts Offer Insights on Technology Companies: Dell Technologies (DELL) and Datadog (DDOG),6/18/2024 10:30:42 AM
DDOG,Mizuho Securities Remains a Hold on Datadog (DDOG),6/17/2024 10:30:15 AM
DDOG,3 Underappreciated Tech Stocks With Massive Long-Term Potential  ,6/15/2024 6:00:00 PM
DDOG,Cracking The Code: Understanding Analyst Reviews For Datadog,6/14/2024 3:01:00 PM
DDOG,Datadog: Dominating Cloud-Native Observability with Growth and Innovation,6/12/2024 10:06:28 AM
DDOG,5 Growth Stocks to Buy for Steady Returns in June,6/10/2024 7:18:06 PM
DDOG,Exit Strategy: 3 Overvalued Stocks to Sell Before They Deflate,6/6/2024 11:00:00 AM
DDOG,"DataDog Is The 'Next High-Quality Large-Cap Stock,' Says Analyst",5/30/2024 7:20:48 PM
DDOG,Is Datadog a Buy as Wall Street Analysts Look Optimistic?,5/24/2024 7:02:24 PM
DDOG,Snowflake Q1 earnings preview: Focus on AI strategy,5/21/2024 5:53:10 PM
DDOG,Datadog: A Strong Buy on Robust Consumption and Significant Growth Potential,5/20/2024 8:55:18 PM
DDOG,"'Playing The Rumor, Not The News': Reddit Users Speculate On Potential S&P 500 Inclusions",5/17/2024 5:18:28 PM
DDOG,Snowflake Analysts Remain Overweight: Potential Growth Despite Iceberg Adoption Concerns,5/16/2024 7:47:29 PM
DDOG,"Saudi Arabia sovereign fund Q1 moves include exiting JPMorgan, Home Depot, taking in Nu",5/15/2024 6:47:25 PM
DDOG,Analysts Conflicted on These Technology Names: Datadog (DDOG) and Bentley Systems (BSY),5/10/2024 6:20:55 AM
DDOG,Datadog (DDOG) Gets a Buy from Wedbush,5/9/2024 12:00:42 PM
DDOG,"Datadog's Strong Start To 2024: Analysts Optimistic About Ongoing Market Leadership, 'More/Faster Cloud Software Creation Is Better""",5/8/2024 8:26:47 PM
DDOG,Datadog’s Accelerating Growth and Operational Efficiency Underpin Buy Rating,5/7/2024 9:36:14 PM
DDOG,Peeling Back The Layers: Exploring Datadog Through Analyst Insights,5/6/2024 7:00:25 PM
DDOG,"Earnings week ahead: Disney, Palantir, Shopify, Uber, Plug Power and more",5/5/2024 12:00:00 PM
DDOG,"Catalyst Watch: Disney earnings, Apple iPad event and Fed speakers back on the circuit",5/3/2024 7:00:00 PM
DDOG,Maintaining Hold on Datadog: Balancing Growth Prospects with Economic Headwinds,5/2/2024 1:37:05 PM
DDOG,Analysts’ Opinions Are Mixed on These Technology Stocks: Datadog (DDOG) and CCC Intelligent Solutions Holdings (CCCS),5/1/2024 3:11:24 PM
DDOG,"Snowflake, MongoDB, Datadog, Dynatrace may benefit from cloud strength: Baird",4/29/2024 5:31:56 PM
DDOG,Analysts Conflicted on These Technology Names: Datadog (DDOG) and Toast Inc (TOST),4/24/2024 12:30:22 PM
DDOG,"Analysts Offer Insights on Technology Companies: Microsoft (MSFT), Jabil (JBL) and Datadog (DDOG)",4/19/2024 11:30:39 AM
DDOG,Evaluating Datadog: Insights From 17 Financial Analysts,4/17/2024 6:00:54 PM
DDOG,Analysts Conflicted on These Technology Names: Datadog (DDOG) and Salesforce (CRM),4/15/2024 6:40:20 AM
DDOG,Analysts Offer Insights on Technology Companies: Datadog (DDOG) and Apple (AAPL),4/11/2024 10:02:29 AM
DDOG,Cathie Wood's Ark Invest Buys More Shares Of This Meta Platforms Competitor,4/4/2024 4:17:47 AM
DDOG,3 Strong Buy Big Data Stocks to Add to Your Q2 Must-Watch List,4/1/2024 10:00:00 AM
DDOG,3 Cybersecurity Stocks to Buy for the Next Bull Run: March 2024,3/28/2024 10:00:00 AM
DDOG,3 AI Software Stocks With Skyrocketing Customer Growth to Buy in March 2024,3/27/2024 8:38:44 PM
DDOG,3 Sorry Cloud Computing Stocks to Sell in March While You Still Can,3/25/2024 9:15:29 PM
DDOG,Bubble Trouble: 3 Tech Stocks to Offload Before They Pop,3/23/2024 5:00:00 PM
DDOG,"Cramer Calls Datadog 'Dynamite,' Puts SoFi In Dog House: 'What The Heck Is Going On'",3/19/2024 2:55:15 PM
DDOG,Evaluating Datadog: Insights From 18 Financial Analysts,3/12/2024 4:00:26 PM
DDOG,The Top 3 Cybersecurity Stocks to Buy in March 2024,3/5/2024 10:06:33 PM
DDOG,"Snowflake melts as Wall Street worries over management change, weak guidance",2/29/2024 12:51:38 PM
DDOG,"Snowflake plunges as sales forecast slowdown, CEO change rattles investors",2/28/2024 9:28:22 PM
DDOG,Datadog (DDOG): New Buy Recommendation for This Technology Giant,2/27/2024 12:39:57 PM
DDOG,7 Stocks That Google’s Updated AI Wants You to Buy,2/26/2024 10:45:00 PM
DDOG,Jefferies Reaffirms Their Buy Rating on Datadog (DDOG),2/25/2024 10:55:13 PM
DDOG,Datadog’s Growth Trajectory: Observability Market Expansion and Revenue Potential,2/23/2024 12:36:04 PM
DDOG,3 Stocks Poised for Explosive Growth and Future Success,2/17/2024 12:01:00 PM
DDOG,Analysts Offer Insights on Technology Companies: Pagseguro Digital (PAGS) and Datadog (DDOG),2/16/2024 10:40:56 PM
DDOG,The Next Magnificent 7 Stock? 7 Growth Plays That Investors Shouldn’t Ignore,2/15/2024 12:14:00 PM
DDOG,These Analysts Boost Their Forecasts On Datadog Following Q4 Results,2/14/2024 7:15:43 PM
DDOG,Optimistic Growth and Strategic Advantages Underpin Buy Rating for Datadog,2/13/2024 11:45:19 PM
DDOG,"Datadog Q4 earnings preview: Focus on enterprise spending, growing AI workloads",2/12/2024 5:17:34 PM
DDOG,"Catalyst Watch: Coca-Cola earnings, Instacart lockup, 13F filings and more NYCB drama",2/9/2024 8:00:09 PM
DDOG,3 Strong Buy Big Data Stocks to Add to Your February Must-Watch List,2/8/2024 7:35:09 PM
DDOG,"Analysts Offer Insights on Technology Companies: Sensata (ST), Intapp (INTA) and Datadog (DDOG)",2/7/2024 1:30:45 PM
DDOG,Analysts Offer Insights on Technology Companies: Datadog (DDOG) and Monday.com (MNDY),2/5/2024 1:40:43 PM
DDOG,Millionaire’s Shortcut: 3 Stocks with Explosive Growth Potential,2/1/2024 10:11:00 AM
DDOG,Buy Rating on Datadog Amidst Favorable Growth Outlook and Valuation Concerns,1/28/2024 11:36:13 PM
DDOG,3 Disruptive Tech Stocks With 10X Growth Potential,1/25/2024 9:58:47 PM
DDOG,"3 Growth Stocks to Turn $100,000 Into $1 Million: January 2024",1/24/2024 9:35:08 PM
DDOG,"Let Bears Fret About Tech Valuations, Analyst Says: How AI Leaders Microsoft, Nvidia And Google Can Push Higher",1/23/2024 10:10:39 PM
DDOG,Uber To Rally Over 9%? Here Are 10 Top Analyst Forecasts For Monday,1/22/2024 1:20:15 PM
DDOG,Beyond Cloud Nine: 3 Cutting-Edge Tech Stocks Shaping the Future of Computing,1/18/2024 12:09:50 AM
DDOG,Fast-Track to Fortune: 3 Stocks to Buy to Get Rich Fast,1/16/2024 11:17:52 PM
DDOG,Data Dynamos: 3 Stocks Driving the Big Data Revolution,1/11/2024 9:49:07 PM
DDOG,Datadog (DDOG): New Buy Recommendation for This Technology Giant,1/10/2024 1:47:07 AM
DDOG,The 7 Best Growth Stocks to Buy Now,1/9/2024 5:02:00 PM
DDOG,Nasdaq 100 Snaps Longest Negative Streak In 14 Months As Tech Stocks Find Relief On Mixed Data,1/5/2024 10:34:06 PM
DDOG,Nasdaq 100 Marks Fifth Consecutive Negative Session In Worst Tech Stock Downturn In Nearly 14 Months,1/4/2024 11:06:32 PM
DDOG,BTIG Keeps Their Hold Rating on Datadog (DDOG),1/2/2024 2:14:54 PM
DDOG,Cloud Computing Kings: 7 Stocks Dominating the Digital Sky,12/28/2023 9:37:48 PM
DDOG,3 Disruptive Tech Stocks Set to Soar by 2025,12/22/2023 2:30:32 AM
DDOG,Datadog (DDOG) Receives a Hold from Wells Fargo,12/20/2023 11:06:55 AM
DDOG,Why These 7 Cloud Computing Stocks Should be on Your Radar in 2024,12/19/2023 7:10:09 PM
DDOG,"Datadog, Louisiana-Pacific And 2 Other Stocks Insiders Are Selling",12/15/2023 1:54:51 PM
DDOG,"3 Tech Stocks to Turn $200,000 Into $1 Million: December 2023",12/12/2023 10:56:31 PM
DDOG,Datadog Upgraded To Buy: Analyst Highlights Positive Customer Feedback And Growth Prospect,12/7/2023 9:37:12 PM
DDOG,Cloud Computing Kings: 3 Companies Outperforming AWS and Azure,12/6/2023 10:00:00 AM
DDOG,Analyst Ratings for Datadog,12/5/2023 3:00:48 PM
DDOG,"Datadog Adds Identity, Vulnerability and App-Level Findings to Security Inbox to Help DevOps and Security Teams Address Issues Quickly",11/27/2023 6:00:00 PM
DDOG,7 Steady Growth Stocks to Buy Before 2024,11/23/2023 3:53:00 PM
DDOG,Buy Rating Endorsed for Datadog: A Promising Outlook on Revenue Growth and AI Opportunities,11/16/2023 10:57:53 AM
DDOG,Datadog Releases 2023 State of Cloud Security Report,11/15/2023 6:30:00 PM
DDOG,3 Stocks to Buy Your Grandkids This Holiday Season,11/9/2023 11:51:59 PM
DDOG,Datadog Expands Strategic Partnership with Google Cloud and Integrates with Vertex AI,11/8/2023 10:05:00 PM
DDOG,Datadog to Present at Upcoming Investor Conferences,11/7/2023 10:05:00 PM
DDOG,Looking for High-Growth Tech Stocks to Buy? My Top 3 Picks,11/6/2023 11:54:56 PM
DDOG,"Datadog Announces 2023 Report on Real-World Container Use, Reveals Rise in Serverless Containers",11/2/2023 9:29:00 PM
DDOG,3 Top Tech Stocks with High Upside Potential,11/1/2023 6:21:57 PM
DDOG,Yet Another Stock Downgrade For Datadog - Analyst Sees Optimization Challenges Amis High Growth Expectations,10/30/2023 7:30:51 PM
DDOG,"Analysts Conflicted on These Technology Names: Texas Instruments (TXN), Datadog (DDOG) and Microsoft (MSFT)",10/25/2023 11:02:04 AM
DDOG,7 Stocks That AI Predicts Will Soar in 2024,10/24/2023 11:00:30 AM
DDOG,Datadog (DDOG): New Buy Recommendation for This Technology Giant,10/20/2023 12:05:54 PM
DDOG,Datadog Announces Date of Third Quarter Fiscal Year 2023 Earnings Call,10/17/2023 10:05:00 PM
DDOG,"Benzinga's Top Ratings Upgrades, Downgrades For October 9, 2023",10/9/2023 5:00:27 PM
DDOG,The Impact of Inflation on the Stock Market: 3 Things Investors Need to Know,10/8/2023 10:05:08 PM
DDOG,"Datadog Poised To Exceed Expectations Over Long-Term, Says Piper Sandler Analyst",10/2/2023 7:22:27 PM
DDOG,Ticking Time Bombs: 7 Growth Stocks to Dump Before the Damage Is Done,9/29/2023 1:30:30 AM
DDOG,Groundfloor Gems: 3 Hypergrowth Stocks Just Starting to Take Off,9/13/2023 12:41:14 PM
DDOG,Datadog to Present at Upcoming Investor Conferences,8/30/2023 10:05:00 PM
DDOG,Datadog Report Finds the Serverless Ecosystem Growing Across All Major Clouds,8/24/2023 6:00:00 PM
DDOG,Snowflake's Upcoming Earnings: Balancing Investor Optimism with Analyst Caution Ahead of 2Q,8/22/2023 9:03:46 PM
DDOG,"Benzinga's Top Ratings Upgrades, Downgrades For August 18, 2023",8/18/2023 5:00:37 PM
DDOG,"Market Sentiment Teeters As US Indices, Including S&P 500, Break Key Supports: Next Levels To Watch",8/17/2023 3:55:26 PM
DDOG,Analysts Offer Insights on Technology Companies: Datadog (DDOG) and Sea (SE),8/16/2023 8:30:32 AM
DDOG,"Nasdaq Suffers Second Straight Week of Losses, Breaks Key Support Level As Tech Bears Return: Is This Time Different?",8/11/2023 10:01:24 PM
DDOG,"Analysts Shift Datadog's Outlook After Q2 Print, See Resilience Amid Cloud Trends and Growth Concerns",8/9/2023 9:43:17 PM
DDOG,Datadog Stock (NASDAQ:DDOG): Don’t Punish the CEO’s Honesty,8/8/2023 7:48:00 PM
DDOG,Notable earnings before Tuesday's open,8/7/2023 3:20:35 PM
DDOG,"Analysts Are Bullish on Top Technology Stocks: Datadog (DDOG), Block (SQ)",8/5/2023 3:20:52 PM
DDOG,"Catalyst Watch: Wayfair and Kellogg events, Alibaba earnings and AI hacking test at Def Con",8/4/2023 7:00:42 PM
DDOG,Datadog Announces Historical Investigations for Cloud SIEM,8/3/2023 7:00:00 PM
DDOG,Buy Alert: 3 Growth Stocks Nearing Super Attractive Entry Points,8/1/2023 8:30:34 PM
DDOG,"Catalyst Watch: Amazon earnings, jobs report, and will Apple talk AI?",7/28/2023 6:00:40 PM
DDOG,"If You Can Only Buy One Tech Stock, It Better Be One of These 7 Names",7/26/2023 1:34:41 AM
DDOG,"Benzinga's Top Ratings Upgrades, Downgrades For July 25, 2023",7/25/2023 5:00:40 PM
DDOG,7 Top Analyst Picks That Are Actually Not Worth Your Attention,7/24/2023 12:55:19 PM
DDOG,"Analysts Conflicted on These Technology Names: Avnet (AVT), Datadog (DDOG) and NEXTracker, Inc. Class A (NXT)",7/21/2023 10:15:08 AM
DDOG,3 High-Growth Stocks That Could Double Your Money,7/20/2023 12:34:44 PM
DDOG,The Latest Analyst Ratings for Datadog,7/18/2023 10:00:38 PM
DDOG,"Jim Cramer Says This Cloud-Based Monitoring Company Was A Missed Early Buy, Now It's 'Best In Show'",7/14/2023 3:58:12 PM
DDOG,Datadog Announces Date of Second Quarter Fiscal Year 2023 Earnings Call,7/13/2023 10:05:00 PM
DDOG,Datadog Named a Leader in the 2023 Gartner® Magic Quadrant™ For Application Performance Monitoring And Observability,7/10/2023 8:14:00 PM
DDOG,Quant Ratings Updated on 90 Stocks,6/27/2023 8:28:14 PM
DDOG,7 Growth Stocks to Buy With Explosive Upside Potential,6/25/2023 5:17:44 PM
DDOG,"Cramer Says Datadog Will 'Put Up Some Good Numbers,' And 9 More Stock Takes From 'Mad Money' Host",6/23/2023 2:13:12 PM
DDOG,Datadog Announces Annual DASH Conference Set for San Francisco in August,6/13/2023 10:05:00 PM
DDOG,DDOG vs. DT: Which Cloud Stock is Better?,6/8/2023 7:12:52 PM
DDOG,"Datadog Extends Cloud Cost Management Capabilities with Container Cost Allocation, Cost Monitors and Support for Microsoft Azure",6/7/2023 10:05:00 PM
DDOG,Bank of America Securities Keeps Their Buy Rating on Datadog (DDOG),6/6/2023 11:35:06 AM
DDOG,Datadog Launches Workflow Automation for Faster Remediation of Application Issues,6/5/2023 10:05:00 PM
DDOG,"MongoDB soars 27% as analysts praise customer growth, Atlas strength",6/2/2023 6:10:44 PM
DDOG,"Analysts Are Bullish on These Technology Stocks: Autodesk (ADSK), Epam Systems (EPAM)",5/30/2023 2:20:24 AM
DDOG,Forget Nvidia: 3 Lesser-Loved Tech Stocks with AI Upside,5/25/2023 7:27:57 PM
DDOG,"Datadog's New Capabilities Help Azure Organizations Manage Costs, Migrate to the Cloud and Monitor AI Models",5/23/2023 10:05:00 PM
DDOG,7 Promising Growth Stocks to Buy Hand Over Fist,5/21/2023 7:14:50 PM
DDOG,Top 5 Tech Stocks That May Fall Off A Cliff,5/12/2023 1:49:04 PM
DDOG,"Datadog, Compass Diversified, Transocean And This Consumer Health Company: CNBC's 'Final Trades'",5/11/2023 2:28:12 PM
DDOG,Datadog to Present at Upcoming Investor Conferences,5/10/2023 10:05:00 PM
DDOG,"CrowdStrike, Fortinet shares rise in broad security tech rally",5/8/2023 5:58:08 PM
DDOG,Datadog (DDOG): New Buy Recommendation for This Technology Giant,5/6/2023 1:25:27 AM
DDOG,Analysts’ Opinions Are Mixed on These Technology Stocks: Datadog (DDOG) and Corsair Gaming (CRSR),5/5/2023 6:30:10 PM
DDOG,Why Synaptics Shares Are Trading Lower By 17%? Here Are Other Stocks Moving In Thursday's Mid-Day Session,5/4/2023 9:03:41 PM
DDOG,What Wall Street expects from Datadog A's earnings,5/3/2023 3:01:13 PM
DDOG,Analysts Offer Insights on Technology Companies: Datadog (DDOG) and WISeKey International Holding (WKEY),5/2/2023 12:00:31 PM
DDOG,Datadog Releases Data Streams Monitoring to Assess Streaming Data Pipeline Performance,4/27/2023 10:05:00 PM
DDOG,Why Chipotle Shares Are Trading Higher By 13%? Here Are Other Stocks Moving In Wednesday's Mid-Day Session,4/26/2023 8:12:51 PM
DDOG,Datadog's 2023 State of Application Security Report Presents Top AppSec Trends,4/25/2023 10:05:00 PM
DDOG,3 Stocks to Buy That Could Be the Next Cloud Computing Champion,4/20/2023 1:45:44 PM
DDOG,Datadog Launches New Data Center in Japan,4/19/2023 10:05:00 PM
DDOG,Datadog Expands Application Security Capabilities to Automatically Uncover Vulnerabilities in Production Code,4/18/2023 10:05:00 PM
DDOG,Analyst Expectations for Datadog's Future,4/17/2023 11:00:42 PM
DDOG,Datadog Announces Date of First Quarter Fiscal Year 2023 Earnings Call,4/13/2023 10:05:00 PM
DDOG,The 7 Best Growth Stocks to Buy for 2023,4/10/2023 6:41:02 PM
DDOG,"Benzinga's Top Ratings Upgrades, Downgrades For April 6, 2023",4/6/2023 5:00:37 PM
DDOG,"Datadog Is Beneficiary Of Multiple Long-Term Tailwinds, Well Braced To Execute Against Large Total Addressable Market: Analyst",3/31/2023 8:00:36 PM
DDOG,7 Growth Stocks That Are Poised to Boom in 2024,3/30/2023 6:34:28 PM
DDOG,Datadog stock slips as enterprise software names end mixed,3/24/2023 8:37:27 PM
DDOG,"Analysts Offer Insights on Technology Companies: Accenture (ACN), Datadog (DDOG) and WalkMe (WKME)",3/20/2023 4:40:25 PM
DDOG,"'Cinderella Story Over,' Says Analyst: 6 Potential Tech Losers From SVB's Dark Crash",3/14/2023 5:07:35 PM
DDOG,19 Analysts Have This to Say About Datadog,3/9/2023 4:01:19 PM
DDOG,Datadog (DDOG): New Buy Recommendation for This Technology Giant,3/2/2023 4:25:23 PM
DDOG,Datadog to Present at Upcoming Investor Conference,2/28/2023 10:05:00 PM
DDOG,7 Hot Stocks Worth a Look After Earnings,2/22/2023 10:06:40 PM
DDOG,Analyst Ratings for Datadog,2/21/2023 7:01:19 PM
DDOG,Datadog (DDOG): New Buy Recommendation for This Technology Giant,2/18/2023 1:45:17 AM
DDOG,AI Stocks: The ACTUAL Winners and Losers from the AI Revolution,2/17/2023 5:51:32 PM
DDOG,"New Buy Rating for Datadog (DDOG), the Technology Giant",2/16/2023 5:45:06 PM
DDOG,Cloud of caution hangs ahead of Datadog Q4 earnings and 2023 outlook,2/15/2023 3:48:12 PM
DDOG,"Druckenmiller's Duquesne adds Nvidia, AMD, exits Amazon, Microsoft",2/14/2023 9:54:34 PM
DDOG,Stocks 'disconnected from reality'; Morgan Stanley screens those 'unfairly punished',2/13/2023 4:43:45 PM
DDOG,"Catalyst watch: Inflation reads, Roblox and DoorDash in the spotlight",2/10/2023 7:30:55 PM
DDOG,Analysts Offer Insights on Technology Companies: Diodes (DIOD) and Datadog (DDOG),2/9/2023 11:20:12 AM
DDOG,"Buy Splunk, Sell Datadog: Analyst Lays Out 2023 Strategy For IT Investors",2/6/2023 5:40:04 PM
DDOG,7 Growth Stocks That Will Be Big Winners in 2023,1/29/2023 1:30:02 PM
DDOG,"Benzinga's Top Ratings Upgrades, Downgrades For January 27, 2023",1/27/2023 4:00:43 PM
DDOG,"Could Datadog's TAM Reach $62B — Maybe $70B? Yes, But It Depends On This: Analyst",1/26/2023 6:11:05 PM
DDOG,Why Is Datadog (NASDAQ:DDOG) Stock Down 5% Today?,1/25/2023 7:21:56 PM
DDOG,7 Cybersecurity Stocks to Sell ASAP,1/23/2023 6:37:49 PM
DDOG,Where Datadog Stands With Analysts,1/20/2023 10:00:28 PM
DDOG,Datadog Announces Date of Fourth Quarter and Fiscal Year 2022 Earnings Call,1/19/2023 10:05:00 PM
DDOG,7 Stocks for Beginners to Buy Now,1/2/2023 11:33:02 AM
DDOG,Buy the Dip on these 7 Most Hated Stocks,12/30/2022 6:46:26 PM
DDOG,"Datadog Analyst Highlights Steady Customer Behavior Given Anxiety Over Consumption Drop, Share Pullback",12/21/2022 9:34:44 PM
DDOG,Quant Ratings Updated on 68 Stocks,12/20/2022 9:30:32 PM
DDOG,"Analysts Offer Insights on Technology Companies: Adobe (ADBE), ServiceNow (NOW) and Datadog (DDOG)",12/19/2022 4:32:41 PM
DDOG,Datadog Named a Leader in AIOps by Independent Research Firm,12/15/2022 5:57:00 PM
DDOG,What 20 Analyst Ratings Have To Say About Datadog,12/14/2022 6:04:21 PM
DDOG,The 7 Hottest Cybersecurity Stocks to Own for 2023 and Beyond,12/13/2022 5:56:28 AM
DDOG,7 Cloud Stocks That Will Lift Your Portfolio Sky High,12/12/2022 12:06:25 PM
DDOG,2 Big-Data Stocks Capable of Big Gains in 2023,12/9/2022 5:44:04 PM
DDOG,Director Matthew Jacobson Is Betting Big on Datadog (DDOG) Stock,12/8/2022 7:28:40 PM
DDOG,$65 Million Bet On Iovance Biotherapeutics? Check Out These 3 Stocks Insiders Are Buying,12/5/2022 12:30:24 PM
DDOG,Datadog Launches Universal Service Monitoring,11/29/2022 10:05:00 PM
DDOG,Quant Ratings Updated on 77 Stocks,11/22/2022 9:30:37 PM
DDOG,3 Cybersecurity Stocks With Room to Run in 2023,11/16/2022 12:25:26 AM
DDOG,$20 Million Bet On Datadog? Check Out These 4 Stocks Insiders Are Buying,11/15/2022 2:30:04 PM
DDOG,"Druckenmiller's Duquesne adds Amazon, exits Westlake, lowers Microsoft stake",11/14/2022 9:02:09 PM
DDOG,7 Growth Stocks to Buy to Retire a Millionaire,11/12/2022 5:48:36 PM
DDOG,7 Tech Stocks to Buy at a Multi-Year Discount,11/9/2022 6:22:19 PM
DDOG,Datadog to Present at Upcoming Investor Conferences,11/8/2022 10:05:00 PM
DDOG,5 “Strong Buy” Stocks on Analysts’ Radars This Week,11/7/2022 10:00:08 PM
DDOG,"Analysts Are Bullish on These Technology Stocks: Datadog (DDOG), Mercury Systems (MRCY)",11/5/2022 1:51:25 AM
DDOG,"New Buy Rating for Datadog (DDOG), the Technology Giant",11/4/2022 1:08:15 PM
DDOG,JMP Securities Reaffirms Their Hold Rating on Datadog (DDOG),11/3/2022 5:55:16 PM
DDOG,"Macro, consumer headwinds loom ahead of Datadog Q3 earnings",11/2/2022 5:35:19 PM
DDOG,Monness Remains a Hold on Datadog (DDOG),10/31/2022 11:45:30 AM
DDOG,"Microsoft, Alphabet, Texas Instruments And Some Other Big Stocks Moving Lower In Today's Pre-Market Session",10/26/2022 1:22:28 PM
DDOG,Datadog (DDOG): New Buy Recommendation for This Technology Giant,10/25/2022 6:05:19 PM
DDOG,"Datadog Is A Top Observability Player Leveraging Its Scale, Analysts Hail Company After 5th Dash Conference",10/20/2022 9:47:13 PM
DDOG,Datadog Announces PCI Compliance for Log Management and APM,10/19/2022 6:00:00 PM
DDOG,What 20 Analyst Ratings Have To Say About Datadog,10/17/2022 10:04:11 PM
DDOG,Datadog Announces Date of Third Quarter Fiscal Year 2022 Earnings Call,10/13/2022 10:16:00 PM
DDOG,19 Analysts Have This to Say About Datadog,10/11/2022 4:07:09 PM
DDOG,7 Nasdaq Stocks to Buy To Tap Into a Hidden Bull Market,10/6/2022 7:16:36 PM
DDOG,Datadog Launches Certification Program to Strengthen and Validate Power-Users' Knowledge of the Datadog Platform,10/4/2022 10:05:00 PM
DDOG,"Benzinga's Top Ratings Upgrades, Downgrades For September 23, 2022",9/23/2022 4:14:25 PM
DDOG,Where Datadog Stands With Analysts,9/21/2022 3:56:27 PM
DDOG,Where Datadog Stands With Analysts,9/1/2022 7:06:10 PM
DDOG,Quant Ratings Updated on 62 Stocks,8/30/2022 8:06:32 PM
DDOG,Datadog Announces Upcoming Investor Meeting,8/26/2022 10:05:00 PM
DDOG,"Why Are Cloud Stocks SNOW, DDOG, MDB, ORCL Up Today?",8/25/2022 8:52:19 PM
DDOG,"DDOG, ABUS and MCRB are among after hour movers",8/24/2022 9:08:40 PM
DDOG,"Datadog Achieves AWS Security, Networking and Retail Competencies",8/23/2022 10:05:00 PM
DDOG,Datadog Announces Return of Dash Conference to New York City,8/18/2022 10:05:00 PM
DDOG,Datadog Extends Monitoring for Microsoft SQL Server and Microsoft Azure Database Platforms,8/16/2022 10:05:00 PM
DDOG,"'Investor Anxiety' On Software Stocks Prevails, But This Analyst Sees Hope In A Few Stocks, With Questions Around Others -- Like Palantir",8/15/2022 8:19:14 PM
DDOG,Technology Vs. Healthcare: These Stocks Are Leading Earnings Season,8/7/2022 11:22:04 PM
DDOG,Datadog's Q2 Beat & Conservative Forecast Earns It Price Target Cuts From Analysts,8/5/2022 8:27:16 PM
DDOG,Datadog Down 4% ,8/4/2022 4:05:22 PM
DDOG,Snowflake leads software stocks higher as risk-on appetite returns,8/3/2022 6:03:03 PM
DDOG,Datadog to Present at Upcoming Investor Conferences,8/2/2022 10:05:00 PM
DDOG,Today’s Biggest Pre-Market Stock Movers: 10 Top Gainers and Losers on Friday,7/29/2022 11:22:35 AM
DDOG,Analyst Ratings for Datadog,7/25/2022 5:05:18 PM
DDOG,Why Baker Hughes Shares Dropped 8%; Here Are 64 Biggest Movers From Yesterday,7/21/2022 10:40:37 AM
DDOG,"This Communication Services Stock Is Trading Higher By Over 82%, Here Are 45 Stocks Moving In Wednesday's Mid-Day Session",7/20/2022 6:50:33 PM
DDOG,Datadog Announces Date of Second Quarter Fiscal Year 2022 Earnings Call,7/14/2022 10:05:00 PM
DDOG,MongoDB gets a boost as Baird sets new outperform rating,7/13/2022 5:59:21 PM
DDOG,Where Datadog Stands With Analysts,7/7/2022 7:02:53 PM
