Ticker,Title,Link
DDOG,Snowflake (SNOW) Stock Pops on New $200 Price Target,6/28/2022 5:12:40 PM
DDOG,Datadog Launches Audit Trail to Help Businesses Achieve Their Compliance and Governance Objectives,6/23/2022 10:05:00 PM
DDOG,"Datadog Launches Observability Pipelines To Help Organizations Collect, Manage and Route Observability Data",6/16/2022 10:05:00 PM
DDOG,Needham Sees Dynamics Favoring Datadog,6/14/2022 7:00:20 PM
DDOG,"Snowflake, DocuSign lead another day of big cloud-software share losses",6/13/2022 7:41:52 PM
DDOG,Datadog Named a Leader in the 2022 Gartner® Magic Quadrant™ for Application Performance Monitoring and Observability,6/10/2022 8:31:00 PM
DDOG,Datadog's 2022 State of Serverless Report Finds Serverless Reaching Mainstream Adoption,6/2/2022 10:05:00 PM
DDOG,2 Top Cybersecurity Stocks to “Set It and Forget It”,5/27/2022 9:00:53 PM
DDOG,"Snowflake plunges 14% as Q1 earnings miss expectations, cloud software peers fall",5/26/2022 6:10:25 AM
DDOG,Datadog Achieves AWS Education Competency Status,5/25/2022 10:05:00 PM
DDOG,"Microsoft, Oracle among software stocks in Jefferies' wide price-target cuts",5/23/2022 8:09:24 PM
DDOG,71 Biggest Movers From Yesterday,5/20/2022 10:27:32 AM
DDOG,38 Stocks Moving In Thursday's Mid-Day Session,5/19/2022 6:31:22 PM
DDOG,Datadog to Present at Upcoming Investor Conferences,5/18/2022 10:05:00 PM
DDOG,IPOs experience their largest retracement since the dot-com bubble popped,5/17/2022 1:15:19 PM
DDOG,Datadog Enhances Monitoring and Security for Kubernetes,5/16/2022 2:00:00 PM
DDOG,18 Analysts Have This to Say About Datadog,5/5/2022 8:08:17 PM
DDOG,Notable earnings before Thursday's open,5/4/2022 3:07:51 PM
DDOG,"Here's How Rosenblatt Views Alteryx, Datadog, Dynatrace Ahead Of Earnings",5/2/2022 9:54:20 PM
DDOG,Datadog Launches Application Security Monitoring to Break Down Silos Between Security and Operations Teams,4/28/2022 10:05:00 PM
DDOG,Expert Ratings for Datadog,4/19/2022 10:09:02 PM
DDOG,Datadog Announces Date of First Quarter Fiscal Year 2022 Earnings Call,4/14/2022 10:05:00 PM
DDOG,Datadog Expands Its Watchdog AI Engine with Root Cause Analysis and Log Anomaly Detection,4/13/2022 10:05:00 PM
DDOG,7 Cloud Computing Stocks to Buy for April 2022,4/11/2022 11:00:13 AM
DDOG,Datadog Partners with Microsoft for the Azure Cloud Adoption Framework,3/30/2022 10:05:00 PM
DDOG,"20 Stocks Moving Toward VWAP Breakout: GameStop, Roku, Moderna And More",3/29/2022 10:12:10 PM
DDOG,"Benzinga's Top Ratings Upgrades, Downgrades For March 22, 2022",3/22/2022 3:03:27 PM
DDOG,What 12 Analyst Ratings Have To Say About Datadog,3/18/2022 6:02:08 PM
DDOG,Palantir Investors Should Shift Into Neutral Until Growth Picks Up,3/17/2022 10:56:18 AM
DDOG,"Cloudflare, MongoDB shares slump in broad cloud-management retreat",3/3/2022 8:44:51 PM
DDOG,Datadog to Present at Upcoming Investor Conference,3/1/2022 10:05:00 PM
DDOG,7 Analyst Upgrades That Smart Stock Investors Won’t Ignore,2/22/2022 6:11:49 PM
DDOG,S&P 500: Fed Risks Market Plunge With Aggressive Rate Hikes,2/18/2022 5:05:49 PM
DDOG,Insiders Sell More Than $92M Of 4 Stocks,2/17/2022 3:48:23 PM
DDOG,"Melvin Capital takes new stake in Uber; exits Mastercard, Activision Blizzard",2/14/2022 10:07:12 PM
DDOG,"Datadog Analyst Turns Bullish On The Cloud Play, Predicts 20% Upside In Shares",2/11/2022 9:15:43 PM
DDOG,Why did Datadog shares surge 12% Thursday? Strong earnings and outlook,2/10/2022 9:19:51 PM
DDOG,What to expect from Datadog's Q4 results?,2/9/2022 4:09:02 PM
DDOG,10 Biggest Price Target Changes For Tuesday,2/8/2022 2:22:28 PM
DDOG,"Benzinga's Top Ratings Upgrades, Downgrades For February 2, 2022",2/2/2022 4:05:51 PM
DDOG,7 Technology Stocks Reporting Earnings the Week of January 31,1/28/2022 6:15:32 PM
DDOG,Datadog shares rise postmarket on FedRAMP moderate-impact authorization,1/26/2022 10:11:07 PM
DDOG,Datadog Announces Date of Fourth Quarter and Fiscal Year 2021 Earnings Call,1/20/2022 10:05:00 PM
DDOG,Datadog Appoints Sean Walters as Chief Revenue Officer and Kerry Acocella as General Counsel,1/19/2022 11:40:00 PM
DDOG,"Cloudflare, CrowdStrike lead broad slate of tech losses",1/13/2022 9:47:38 PM
DDOG,Where Datadog Stands With Analysts,1/12/2022 8:03:51 PM
DDOG,Microsoft at $400 a share? The metaverse turns to Adobe? 11 tech predictions for 2022,1/9/2022 9:15:00 PM
DDOG,Datadog Announces Global Strategic Partnership with AWS for Observability and Security,1/5/2022 10:05:00 PM
DDOG,Our Stock Picks That Doubled Shareholders' Money In 2021 ,12/30/2021 3:20:41 PM
DDOG,"Read Why Adobe, Cloudflare Shares Fell On Tuesday",12/15/2021 12:15:15 PM
DDOG,"Benzinga's Top Ratings Upgrades, Downgrades For December 14, 2021",12/14/2021 4:03:42 PM
DDOG,New Nasdaq 100 tech stocks start week off with mild gains,12/13/2021 3:56:25 PM
DDOG,"Microsoft, Adobe among standouts in Morgan Stanley's 'gut check' look at software",12/11/2021 3:05:00 PM
DDOG,Datadog Launches Service to Protect Sensitive Data and Assist with Compliance Requirements,12/9/2021 10:05:00 PM
DDOG,Datadog Achieves AWS Graviton Ready Designation,12/1/2021 12:35:00 AM
DDOG,Datadog Achieves AWS Migration & Modernization Competency Status,11/30/2021 1:45:00 AM
DDOG,"Catalyst watch for next week: Amazon event, Glencore update and key OPEC meeting",11/26/2021 7:00:39 PM
DDOG,Goldman pinpoints rising and falling stars held by hedge funds,11/25/2021 10:04:37 PM
DDOG,"Benzinga's Top Ratings Upgrades, Downgrades For November 19, 2021",11/19/2021 4:08:55 PM
DDOG,Datadog Announces Real-Time Monitoring for Confluent Cloud,11/18/2021 10:05:00 PM
DDOG,6 ProShares ETFs Betting On the Future of Next-Gen Industries,11/11/2021 9:38:33 PM
DDOG,Datadog to Present at Upcoming Investor Conferences,11/9/2021 10:05:00 PM
DDOG,Why Datadog Shares Are Rising Today,11/8/2021 6:16:23 PM
DDOG,64 Stocks Moving In Friday's Mid-Day Session,11/5/2021 5:24:13 PM
DDOG,Datadog Completes Acquisition of Ozcode,11/4/2021 9:05:00 PM
DDOG,Here's what Wall Street expects from Datadog A's earnings,11/3/2021 3:01:13 PM
DDOG,What 11 Analyst Ratings Have To Say About Datadog,11/1/2021 5:22:23 PM
DDOG,DDOG Stock: 12 Things to Know About SaaS Play Datadog as Shares Pop,10/29/2021 5:58:39 PM
DDOG,What 10 Analyst Ratings Have To Say About Datadog,10/28/2021 6:22:14 PM
DDOG,Datadog Introduces Online Archives for Log Management to Support Historical Investigation and Analysis,10/26/2021 6:30:00 PM
DDOG,"Catalyst watch for next week: Tech giants report, eyes on Digital World Acquisition, events for Datadog, Facebook & HPE",10/22/2021 7:00:19 PM
DDOG,3 New ProShares ETFs Investing In the Technology of Tomorrow,10/20/2021 3:56:37 PM
DDOG,Datadog Announces Date of Third Quarter Fiscal Year 2021 Earnings Call,10/14/2021 10:05:00 PM
DDOG,Datadog Announces Virtual Investor Meeting,9/27/2021 10:05:00 PM
DDOG,Datadog to Present at Upcoming Investor Conferences,9/3/2021 10:05:00 PM
DDOG,Analyst Ratings For Datadog,8/21/2021 6:21:06 PM
DDOG,Datadog Announces Deep Database Monitoring,8/17/2021 11:43:00 PM
DDOG,Cisco to acquire Epsagon for $500 million,8/13/2021 12:39:05 PM
DDOG,99 Biggest Movers From Yesterday,8/6/2021 11:01:47 AM
DDOG,DataDog among top tech gainers; Robinhood Markets and CommScope among losers,8/5/2021 7:00:04 PM
DDOG,Datadog Launches Cloud Security Platform to Provide Security Teams with Unprecedented Observability Capabilities,8/4/2021 10:30:00 PM
DDOG,Datadog A earnings preview: what Wall Street is expecting,8/3/2021 3:02:13 PM
DDOG,Where Datadog Stands With Analysts,8/2/2021 7:19:00 PM
DDOG,Datadog Announces Availability on Google Cloud Marketplace to Support Customers' Cloud Migrations,7/29/2021 10:30:00 PM
DDOG,AI Stock Lacks a Catalyst For Liftoff,7/26/2021 10:00:01 AM
DDOG,Datadog Achieves AWS Government Competency Status,7/22/2021 10:30:00 PM
DDOG,"Mizuho Raises Price Target On Datadog, Fortinet, Rapid7, ServiceNow Betting On Economic Recovery, Cybersecurity Checks",7/16/2021 2:52:13 PM
DDOG,Datadog Announces Date of Second Quarter Fiscal Year 2021 Earnings Call,7/15/2021 10:10:00 PM
DDOG,"Benzinga's Top Ratings Upgrades, Downgrades For July 8, 2021",7/8/2021 4:03:41 PM
DDOG,Datadog Announces Real-Time Monitoring and Threat Detection for the Salesforce Platform,7/1/2021 10:10:00 PM
DDOG,"Big Data Stocks: What You Should Buy, What You Should Sell",6/14/2021 5:25:58 PM
DDOG,"Benzinga's Top Ratings Upgrades, Downgrades For May 21, 2021",5/21/2021 4:08:34 PM
DDOG,70 Biggest Movers From Friday,5/10/2021 11:24:38 AM
DDOG,56 Stocks Moving In Friday's Mid-Day Session,5/7/2021 6:07:06 PM
DDOG,Datadog Announces First Quarter Results,5/6/2021 10:10:00 PM
DDOG,Datadog Q1 2021 Earnings Preview,5/5/2021 9:35:44 PM
DDOG,Here's what to expect from Datadog A's earnings,5/4/2021 3:02:12 PM
DDOG,Analyst Ratings for Datadog,4/27/2021 5:39:29 PM
DDOG,7 Big Data Stocks Supporting All Aspects of Life,4/22/2021 2:54:41 PM
DDOG,"Zoom Video, Datadog stocks lead WFH names higher after JNJ vaccine pause",4/13/2021 7:09:04 PM
DDOG,Datadog completes acquisition of SaaS platform Sqreen,4/12/2021 8:13:10 PM
DDOG,"Dynatrace LLC -- Moody's upgrades Dynatrace to Ba3, outlook stable",3/16/2021 8:14:00 PM
DDOG,Unity Software’s Valuation Depends on High Free Cash Flow Margins,3/9/2021 2:47:30 PM
DDOG,Attention Reddit: Expiring PLTR Stock Lockups Provides a Second Buying Opportunity,2/22/2021 2:52:13 PM
DDOG,Datadog Announces Fourth Quarter and Full Year 2020 Results,2/11/2021 10:10:00 PM
DDOG,Datadog Q4 2020 Earnings Preview,2/10/2021 10:35:59 PM
DDOG,Datadog A earnings preview: what to expect,2/9/2021 3:02:01 PM
DDOG,These Long-Term Tailwinds Make Palantir Stock a Great Investment,2/4/2021 2:10:15 PM
DDOG,Schaeffer's Investment Research: Top 2 Contrarian Stock Picks For 2021,1/22/2021 2:36:51 PM
DDOG,"Datadog gains; earlier initiated at Truist with a buy rating, $120 Price Target",1/20/2021 5:30:32 PM
DDOG,"Benzinga's Top Upgrades, Downgrades For January 11, 2021",1/11/2021 4:06:08 PM
DDOG,7 Growth Stocks to Buy as We Head Into 2021,12/22/2020 7:45:39 PM
DDOG,CrowdStrike surges as UBS sees SolarWinds breach tailwind; DDOG stock dips despite positive mention,12/18/2020 5:53:28 PM
DDOG,7 ‘Trendy’ Growth Stocks That Could Make You Exponentially Richer,12/14/2020 5:30:11 PM
DDOG,"5 Top Stock Trades for Monday: TWLO, QCOM, DDOG, NLS, SPY",12/11/2020 10:16:25 PM
DDOG,7 Upcoming IPOs to Watch Heading Into 2021,11/23/2020 8:00:26 PM
DDOG,Datadog stock gains on news of Oracle Cloud Infrastructure integration,11/17/2020 4:32:45 PM
DDOG,3 Fallen Angels Stocks to Buy Into Vaccine Uncertainty,11/12/2020 6:29:29 PM
DDOG,"Datadog, Cronos Group leads premarket losers' pack",11/11/2020 1:25:06 PM
DDOG,Datadog Announces Third Quarter Results,11/10/2020 10:10:00 PM
DDOG,Notable earnings after Tuesday's close,11/9/2020 10:35:17 PM
DDOG,7 Data-Driven Stocks for a Wave of Innovation ,11/6/2020 6:40:11 PM
DDOG,"Datadog, DocuSign stocks among software gainers as election could table tax hikes",11/4/2020 8:29:45 PM
DDOG,"Vertex Pharmaceuticals, Infosys leads premarket losers' pack",10/15/2020 12:29:32 PM
DDOG,"ARWR, SNBR, FSLY and NET among after-hours movers",10/14/2020 9:33:09 PM
DDOG,7 Value Stocks to Buy That Are Outperforming Growth Plays,10/12/2020 3:19:06 PM
DDOG,Seeking Alpha Catalyst Watch,10/9/2020 7:00:01 PM
DDOG,Briefly Hot Snowflake Buyable on Deeper Pullback,10/8/2020 3:58:58 PM
DDOG,Snowflake Due to Settle Down Any Day Now,10/5/2020 4:41:27 PM
DDOG,"4 Top Stock Trades for Thursday: MU, DDOG, SPY, SSSS",9/30/2020 9:02:19 PM
DDOG,Snowflake IPO Goes into the Stratosphere,9/17/2020 5:05:54 PM
DDOG,10 Growth Stocks That Crashed Despite Strong Earnings,9/15/2020 1:24:18 PM
DDOG,7 Nasdaq Stocks You Need To Buy Before They Bounce Back Up,9/11/2020 5:29:59 PM
DDOG,BigCommerce Stock Is No Bargain,8/17/2020 6:48:04 PM
DDOG,"5 Top Stock Trades for Friday: FSLY, GOOGL, CSCO, DDOG, TLT",8/13/2020 8:39:10 PM
DDOG,"4 Top Stock Trades for Monday: FSLY, BABA, DDOG, S&P 500",8/7/2020 8:54:02 PM
DDOG,Datadog Announces Second Quarter Results,8/6/2020 10:10:10 PM
DDOG,Datadog A earnings: here's what to expect,8/5/2020 3:04:13 PM
DDOG,7 Cybersecurity Stocks Hard At Work While We Work From Home,7/28/2020 3:55:52 PM
DDOG,Workday Becomes Prosaic,7/22/2020 6:52:45 PM
DDOG,CrowdStrike Stock Looks Risky With a Super-High Valuation,7/20/2020 7:02:43 PM
DDOG,7 Software Stocks Surging Forward  ,7/14/2020 2:35:08 PM
DDOG,7 Big Data Stocks to Buy,7/13/2020 6:22:11 PM
DDOG,Best ETFs for 2020: The Renaissance IPO ETF Powers Higher in Q2,6/26/2020 5:57:22 PM
DDOG,There’s No Need to Let Go of DocuSign Stock Just Yet,6/25/2020 3:37:22 PM
DDOG,Datadog gains on Amazon EFS integration,6/17/2020 8:40:26 PM
DDOG,Investors Should Root for a Dip in Shopify Stock,6/12/2020 1:42:13 PM
DDOG,Datadog Announces Pricing of Upsized Offering of $650 Million Convertible Senior Notes,5/29/2020 12:30:10 PM
DDOG,Datadog proposes $550M convertible notes via private offering,5/28/2020 5:33:01 PM
DDOG,"Tiger Global adds Athene, exits Slack",5/15/2020 7:35:41 PM
DDOG,Stock Alert: Datadog Climbs 13% On Upbeat Q1 Results ,5/12/2020 4:01:03 PM
DDOG,Datadog Announces First Quarter Results,5/11/2020 10:10:10 PM
DDOG,Datadog Q1 2020 Earnings Preview,5/10/2020 9:35:57 PM
DDOG,Datadog gains bull on market exposure,3/27/2020 12:33:32 PM
DDOG,Splunk Stock a Great Pick for Growth Investors on the Dip,3/25/2020 5:51:10 PM
DDOG,"3 Big Stock Charts for Wednesday: Canopy Growth, Bank of America, and Roku",3/4/2020 12:09:41 PM
DDOG,Analysts raise Datadog targets after beats,2/14/2020 2:57:50 PM
DDOG,Datadog Announces Fourth Quarter and Full Year 2019 Results,2/13/2020 10:10:00 PM
DDOG,Datadog Q4 2019 Earnings Preview,2/12/2020 10:35:27 PM
DDOG,"3 Big Stock Charts for Friday: Wynn Resorts, Veeva Systems, and Zynga",12/27/2019 12:58:20 PM
DDOG,Cisco Stock May Be a Great Value Name,12/9/2019 11:36:04 AM
DDOG,Be Careful with Overvalued Okta Stock Ahead of Earnings,11/21/2019 1:17:40 PM
DDOG,"5 Top Stock Trades for Thursday: AMD, GOOS, FSLY, DDOG, DIS",11/13/2019 9:00:23 PM
DDOG,Datadog Announces Third Quarter 2019 Results,11/12/2019 10:10:00 PM
DDOG,Datadog Announces Date of Third Quarter 2019 Earnings Call,10/22/2019 10:10:05 PM
DDOG,"Splunk Stock Actually Is Cheap, But Why Is That?",10/16/2019 5:31:23 PM
DDOG,Stock Market Today: Stocks Hit Snooze Ahead of Earnings,10/14/2019 8:26:33 PM
DDOG,Buy These 7 Mid-Cap Stocks to Make a Profit,10/10/2019 3:29:25 PM
DDOG,7 Important IPO Stocks to Watch for the Long Run,10/2/2019 3:32:18 PM
DDOG,2 Main Reasons to Stick With the Rally of Splunk Stock,9/30/2019 1:27:10 PM
DDOG,Cloud company Datadog surges 50% in U.S. market debut,9/19/2019 7:57:00 PM
