Ticker,Title,Link
AVB,"Apartment, office REITs bounce up on vaccine hopes; home rental REITs fall",11/9/2020 4:20:16 PM
AVB,AvalonBay Communities Q3 adjusted earnings Beat Estimates,10/28/2020 9:32:56 PM
AVB,Notable earnings after Wednesday's close,10/27/2020 9:35:12 PM
AVB,"Realty Income and Duke Realty among buys, and Spirit Realty a sell as UBS launches coverage",10/16/2020 6:59:36 PM
AVB,"Revisiting models shows concerns seem overblown on residential REITs, JPM says",9/4/2020 11:00:51 PM
AVB,Weighing the Market Impact of the President’s Executive Orders,8/11/2020 7:55:54 PM
AVB,AvalonBay Communities Q2 adjusted earnings Beat Estimates,7/29/2020 10:29:23 PM
AVB,Here's what Wall Street expects from AvalonBay Communities's earnings report,7/28/2020 3:01:59 PM
AVB,Want To Buy The Best REITs? Here Are 5 New Picks from LaSalle,6/16/2020 6:48:28 PM
AVB,Make a Home for These 4 Real Estate Stocks in Your Portfolio,6/1/2020 8:39:41 PM
AVB,NYC apartment landlords feel the sting of COVID-19,5/20/2020 5:55:00 PM
AVB,AvalonBay Communities Q1 adjusted earnings Beat Estimates,5/6/2020 11:09:48 PM
AVB,Here's what Wall Street expects from AvalonBay Communities's earnings report,5/5/2020 3:01:45 PM
AVB,May apartment rent strike focuses on legislative relief during pandemic,4/27/2020 1:54:51 PM
AVB,Portland mayor calling for apartment rent dismissal,4/4/2020 4:24:15 PM
AVB,"AvalonBay Communities, Inc. -- Moody's announces completion of a periodic review of ratings of AvalonBay Communities, Inc.",3/31/2020 3:20:00 PM
AVB,Moody's  - US multifamily REITs’ strong credit metrics to buffer them from effects of Covid-19,3/30/2020 3:07:00 PM
AVB,AvalonBay takes actions related to Covid-19 impact,3/25/2020 8:52:41 PM
AVB,AvalonBay two-month EC rental revenue pacing ahead of plan,2/28/2020 9:25:03 PM
AVB,AvalonBay Communities Q4 adjusted earnings Beat Estimates,2/5/2020 10:37:45 PM
AVB,AvalonBay Communities is about to announce earnings — here's what Wall Street expects,2/4/2020 3:01:59 PM
AVB,AvalonBay Communities Q3 adjusted earnings of $2.34 per share,10/28/2019 9:26:10 PM
AVB,AvalonBay Communities Raises Earnings Guidance - Quick Facts ,7/31/2019 11:20:42 PM
AVB,AvalonBay Communities earnings preview: what Wall Street is expecting,7/29/2019 3:02:47 PM
AVB,"AvalonBay Communities, Inc. -- Moody's announces completion of a periodic review of ratings of AvalonBay Communities, Inc.",5/8/2019 10:55:00 PM
AVB,AvalonBay Communities Announces Rise In Q1 Bottom Line,4/24/2019 10:25:35 PM
AVB,Here's what to expect from AvalonBay Communities's earnings report,4/22/2019 3:01:36 PM
AVB,AvalonBay Communities Q4 Profit Up ,2/4/2019 11:09:23 PM
AVB,Here's what to expect from AvalonBay Communities's earnings report,2/2/2019 3:01:24 PM
AVB,AvalonBay Communities Q3 adjusted earnings Beat Estimates,10/29/2018 9:22:25 PM
AVB,AvalonBay Communities earnings: here's what to expect,10/27/2018 3:01:31 PM
AVB,AvalonBay Communities Q2 adjusted earnings Beat Estimates,7/30/2018 10:22:29 PM
AVB,Here's what to expect from AvalonBay Communities's earnings report,7/28/2018 3:01:31 PM
AVB,AvalonBay Communities Q1 adjusted earnings of $2.18 per share,4/25/2018 10:36:06 PM
AVB,BRIEF-Avalonbay Communities Says CEO Timothy Naughton's 2017 Total Compensation Was $7.9 Million,4/6/2018 8:38:09 PM
AVB,AvalonBay Communities Earnings Advance In Q4,1/31/2018 10:39:06 PM
AVB,AvalonBay Communities Updates Earnings Outlook - Quick Facts ,10/30/2017 10:22:30 PM
AVB,"Today's Research Report Coverage on REIT Stocks -- AvalonBay Communities, Capstead Mortgage, Camden Property Trust, and EdR",8/9/2017 12:30:00 PM
AVB,AvalonBay Communities Announces 4% Gain In Q2 Profit,8/2/2017 10:41:03 PM
AVB,BRIEF-Avalonbay Communities says size of board raised to eleven directors (AVB),7/25/2017 11:22:03 PM
AVB,"Stock Performance Review on REIT Industry -- AvalonBay Communities, Capstead Mortgage, Camden Property Trust, and EdR",6/27/2017 1:05:00 PM
AVB,BRIEF-Avalonbay Communities says rejected Ronald L Havner's offer to resign from board (AVB),6/22/2017 10:34:08 PM
AVB,BRIEF-Avalonbay says yield maintenance penalty to have no effect on core FFO/shr (AVB),6/12/2017 3:22:03 PM
AVB,BRIEF-Avalonbay sees Q2 total rental revenue for established communities to increase between 2.5 pct-2.6 pct (AVB),6/6/2017 2:12:04 PM
AVB,AvalonBay Communities Profit Climbs 6% In Q1,4/26/2017 10:40:35 PM
AVB,"Research Reports Coverage on REIT Stocks -- Two Harbors Investment, New York Mortgage Trust, Monogram Residential, and AvalonBay",4/20/2017 12:45:00 PM
AVB,BRIEF-Avalonbay Communities says CEO's 2016 total compensation was $6.7 mln vs $7.3 mln (AVB),4/5/2017 4:54:54 PM
AVB,"How These REIT Stocks are Faring? -- Two Harbors Investment, New York Mortgage, Monogram Residential, and AvalonBay Communities",3/16/2017 12:20:00 PM
AVB,BRIEF-Avalonbay Communities sees total rental revenue for established communities for quarter ending March to increase between 3.1-3.2 pct (AVB),3/6/2017 1:10:21 PM
AVB,"BRIEF-AvalonBay sells 684-unit Gaithersburg, Maryland, apartment complex for $117 mln (AVB)",3/2/2017 2:18:20 PM
AVB,"BRIEF-AvalonBay Communities reports on fire at Avalon Maplewood in Maplewood, New Jersey (AVB)",2/6/2017 10:30:09 PM
AVB,"AvalonBay Communities Announces Initial 2017 Outlook, Dividend Increase ",2/1/2017 11:14:21 PM
AVB,BRIEF-AvalonBay Communities Q3 core FFO per share $2.07 (AVB),10/24/2016 10:38:19 PM
AVB,"BRIEF-Avanco Resources says co to acquire gold project (AVB, JAG)",10/7/2016 10:20:23 AM
AVB,"BRIEF-Jaguar signs earn-in agreement to sell Gurupi project to Avanco resources (AVB, JAG)",10/5/2016 12:00:21 PM
