Ticker,Title,Link
AVB,"Real estate stocks surge in August, set to rebound after underperformance",8/31/2024 4:00:59 PM
AVB,AvalonBay: Hold Rating Maintained Amid Fair Valuation and Market Positioning,8/26/2024 8:35:50 PM
AVB,Rate-sensitive real estate stocks outperform broader markets,8/24/2024 4:00:15 PM
AVB,Justice Department sues apartment rent software firm for antitrust violations (updated),8/23/2024 3:22:02 PM
AVB,Real estate stocks eke out gains as the sector gears up for changes,8/17/2024 4:00:44 PM
AVB,3 Rental REITs to Buy to Ride the Renter Surge,8/15/2024 1:00:00 PM
AVB,Real estate stocks close a volatile week roughly flat,8/10/2024 4:00:33 PM
AVB,AvalonBay Communities: Strong Buy Rating on Positive Financial Outlook and Strategic Market Positioning,8/7/2024 8:36:03 PM
AVB,Real estate stocks advance even as hard landing fears impact major market averages,8/3/2024 4:00:34 PM
AVB,Piper Sandler Releases a Buy Rating on AvalonBay (AVB),8/2/2024 11:03:36 AM
AVB,Avalonbay Communities hosts conference call for investors,8/1/2024 2:45:00 PM
AVB,AvalonBay: A Strong Buy on Robust Q2 Performance and Positive Growth Outlook,7/31/2024 11:05:21 PM
AVB,AvalonBay Communities Q2 2024 Earnings Preview,7/30/2024 9:35:50 PM
AVB,Real estate stocks advance as sentiments favor possible rally,7/27/2024 4:00:52 PM
AVB,Real estate stocks gain as traders look for alternatives to tech stocks,7/20/2024 4:00:06 PM
AVB,Should You Retain AvalonBay Stock in Your Portfolio Now?,7/17/2024 6:53:18 PM
AVB,Most shorted S&P 500 real estate stocks in June,7/16/2024 2:07:00 PM
AVB,AvalonBay (AVB) Gets a Buy from Morgan Stanley,7/15/2024 12:25:44 PM
AVB,Real estate stocks post the largest gain among S&P 500 sectors,7/13/2024 4:00:00 PM
AVB,DOJ takes aim at software used by apartment landlords for rent pricing - report (updated),7/12/2024 8:09:01 PM
AVB,The Analyst Landscape: 15 Takes On AvalonBay Communities,7/9/2024 6:00:48 PM
AVB,Big real estate stocks kick off H2 with loss as state of the sector weighs on sentiment,7/6/2024 4:01:39 PM
AVB,"CoStar, Weyerhaeuser, Prologis in worst-performing Q2 S&P 500 real estate stocks",6/30/2024 3:19:00 PM
AVB,AvalonBay: A Strong Buy on Robust Growth and Solid Fundamentals,6/27/2024 9:48:06 AM
AVB,Micron To Rally Around 23%? Here Are 10 Top Analyst Forecasts For Monday,6/24/2024 2:25:06 PM
AVB,"Real estate stocks edge down, while major market averages gain marginally",6/22/2024 4:00:23 PM
AVB,Mortgage portability: A solution to the housing market's 'lock-in effect'?,6/21/2024 11:12:11 AM
AVB,J.P. Morgan Sticks to Its Hold Rating for AvalonBay (AVB),6/18/2024 12:15:10 PM
AVB,In-Depth Examination Of 14 Analyst Recommendations For AvalonBay Communities,6/17/2024 7:00:29 PM
AVB,Short interest in S&P 500 real estate names ticks up to 2.09%,6/13/2024 5:05:41 PM
AVB,7 REITs to Snap Up if the Fed Cuts Interest Rates,6/12/2024 7:17:55 PM
AVB,Real estate stocks gain after inflation report even as major market averages lose,6/1/2024 4:00:53 PM
AVB,Analysts Conflicted on These Real Estate Names: Brixmor Property (BRX) and AvalonBay (AVB),5/28/2024 10:41:14 AM
AVB,Real estate stocks fall after 4 weeks of gain as rate cut hopes dampen,5/25/2024 4:00:52 PM
AVB,Analyst Ratings For AvalonBay Communities,5/24/2024 4:00:20 PM
AVB,Apartment REITs see marginal increase in Q1 occupancy rates,5/21/2024 6:24:54 PM
AVB,Real estate stocks continue to surge as soft inflation reports fuel rate cut hopes,5/18/2024 4:00:35 PM
AVB,AvalonBay Communities declares $1.70 dividend,5/16/2024 8:24:33 PM
AVB,"AvalonBay, Equity Residential cut to In Line at Evercore ISI after post-Q1 rally",5/13/2024 3:10:33 PM
AVB,"Pipeline of office-to-apartment conversions is growing, RentCafe says",5/12/2024 5:26:00 PM
AVB,Real estate stocks continue to outperform broader markets with increased chances of rate cut,5/11/2024 4:00:40 PM
AVB,"Real estate stocks outperform major market averages as rate hikes ruled out, earnings continue to grow",5/4/2024 4:00:34 PM
AVB,"Analysts’ Opinions Are Mixed on These Real Estate Stocks: Boston Properties (BXP), Brixmor Property (BRX) and AvalonBay (AVB)",4/30/2024 9:34:30 AM
AVB,The Analyst Landscape: 10 Takes On AvalonBay Communities,4/29/2024 5:00:23 PM
AVB,"Real estate stocks finish in green as analysts turn positive, earnings surprise to upside",4/27/2024 4:00:55 PM
AVB,Analysts Offer Insights on Real Estate Companies: AvalonBay (AVB) and Annaly Capital (NLY),4/26/2024 12:20:18 PM
AVB,Analysts Offer Insights on Real Estate Companies: AvalonBay (AVB) and Cubesmart (CUBE),4/25/2024 10:52:10 PM
AVB,AvalonBay Communities Q1 2024 Earnings Preview,4/24/2024 9:35:24 PM
AVB,7 REITs to Buy Now: Q2 Edition,4/23/2024 8:30:00 PM
AVB,Real estate stocks continue on downward trajectory as market's April pullback intensifies,4/20/2024 4:00:59 PM
AVB,Short interest on S&P 500 real estate stocks advance in March,4/15/2024 3:39:26 PM
AVB,Real estate stocks continue to dip as earnings season kicks off,4/13/2024 4:00:27 PM
AVB,Real estate gets neutral health score by Seeking Alpha's Quant Rating ahead of Q1 earnings,4/11/2024 5:33:00 PM
AVB,UDR upgraded to Neutral at Piper on strength of Northeast presence,4/10/2024 12:18:21 PM
AVB,What 9 Analyst Ratings Have To Say About AvalonBay Communities,4/9/2024 8:00:16 PM
AVB,Real estate stocks decline as markets price in reduced hopes of near-term rate cut,4/6/2024 4:00:53 PM
AVB,AvalonBay (AVB) Receives a Buy from Piper Sandler,3/26/2024 11:05:26 AM
AVB,"Real estate stocks dip as economic data hamper rate cut hopes, positive news lack",3/16/2024 4:00:46 PM
AVB,Russell 1000 stocks with secured dividends that are not stretched - BofA,3/14/2024 5:43:27 PM
AVB,U.S. asking rents post biggest increase in over a year: Redfin,3/11/2024 2:30:53 PM
AVB,"Real estate stocks inch up, XLRE closes 2.12% higher",3/2/2024 5:00:00 PM
AVB,Mizuho Maintains Neutral Rating for AvalonBay Communities: Here's What You Need To Know,2/28/2024 6:00:20 PM
AVB,7 Defensive Stocks to Weather Any Downturn With Ease,2/26/2024 8:33:41 PM
AVB,"AvalonBay upgraded, Camden Property, UDR downgraded at Barclays",2/20/2024 3:25:16 PM
AVB,"Jim Cramer Says This Real Estate Stock Is 'Done Going Down, That's A Gutsy Call By Me'",2/7/2024 3:27:51 PM
AVB,AvalonBay: A Conservative Outlook Warrants Hold Rating Amid Moderate Growth Prospects,2/5/2024 9:16:02 AM
AVB,REITs see 3rd straight week of decline amid downturn at broader real estate sector,2/3/2024 5:00:39 PM
AVB,Peeling Back The Layers: Exploring AvalonBay Communities Through Analyst Insights,2/2/2024 5:01:01 PM
AVB,Mortgage Rates Fall: But Could Fed Pushback On March Rate Cut Dent Homeowner Hopes?,2/1/2024 9:08:18 PM
AVB,AvalonBay Communities Q4 FFO Rises ,1/31/2024 10:32:06 PM
AVB,Notable earnings after Wednesday's close,1/30/2024 10:35:49 PM
AVB,Where AvalonBay Communities Stands With Analysts,1/2/2024 6:00:49 PM
AVB,Janney Montgomery Reaffirms Their Hold Rating on AvalonBay (AVB),12/20/2023 12:46:15 PM
AVB,RBC Capital Remains a Hold on AvalonBay (AVB),12/16/2023 1:46:24 AM
AVB,Wells Fargo Sticks to Their Buy Rating for AvalonBay (AVB),12/11/2023 12:35:51 PM
AVB,Buy or Bye? 7 Key Housing Stocks to Buy or Sell in Today’s Market.,12/5/2023 12:30:00 PM
AVB,AvalonBay Poised for Superior Growth: A Strong Buy Recommendation,11/30/2023 11:15:59 AM
AVB,Micron To Rally Around 12%? Here Are 10 Top Analyst Forecasts For Wednesday,11/29/2023 1:46:27 PM
AVB,Where AvalonBay Communities Stands With Analysts,11/27/2023 6:00:28 PM
AVB,Positive Outlook and Strong Performance Drive Buy Rating for AvalonBay: A Comprehensive Analysis by David Toti,11/21/2023 9:25:43 PM
AVB,Wells Fargo Keeps Their Buy Rating on AvalonBay (AVB),11/7/2023 12:38:12 PM
AVB,"Real Estate REITs Pressured Amid Higher Interest Rate & Supply Woes, But Analyst Upgrades AvalonBay Communities: Here's Why",10/31/2023 7:38:20 PM
AVB,"Analysts’ Opinions Are Mixed on These NA Stocks: Tri Pointe (TPH), AvalonBay (AVB) and American Tower (AMT)",10/27/2023 10:30:35 AM
AVB,"Analysts Offer Insights on NA Companies: Century Communities (CCS), Equinix (EQIX) and AvalonBay (AVB)",10/26/2023 1:00:42 PM
AVB,AvalonBay Communities Q3 Profit Rises ,10/25/2023 11:12:08 PM
AVB,AvalonBay Communities earnings: here's what Wall Street expects,10/24/2023 3:01:13 PM
AVB,Smart Defense: 7 REITs to Shield Your Portfolio From Today’s Turbulence,10/5/2023 12:30:59 AM
AVB,"Benzinga's Top Ratings Upgrades, Downgrades For October 3, 2023",10/3/2023 5:00:55 PM
AVB,Sell Your House and Buy These 3 Real Estate Stocks???,9/14/2023 5:08:10 PM
AVB,5 Analysts Have This to Say About AvalonBay Communities,9/12/2023 3:01:40 PM
AVB,Apartment Rents Teeter On Negative Growth As Supply Set To Surge,9/8/2023 10:50:01 PM
AVB,AvalonBay says Q3 same-store residential rental revenue growth on track to top view,9/6/2023 8:51:45 PM
AVB,"Analysts Offer Insights on NA Companies: Kimco Realty (KIM), Rayonier (RYN) and AvalonBay (AVB)",8/30/2023 2:30:29 AM
AVB,What 7 Analyst Ratings Have To Say About AvalonBay Communities,8/21/2023 7:00:39 PM
AVB,AvalonBay (AVB) Receives a Buy from Wells Fargo,8/14/2023 8:35:24 AM
AVB,Expert Ratings for AvalonBay Communities,8/2/2023 6:00:57 PM
AVB,Piper Sandler Remains a Hold on AvalonBay (AVB),8/1/2023 11:36:15 AM
AVB,AvalonBay (AVB) Receives a Buy from BMO Capital,7/31/2023 10:05:06 PM
AVB,Notable earnings after Monday's close,7/30/2023 9:35:01 PM
AVB,AvalonBay Communities Q2 2023 Earnings Preview,7/28/2023 9:35:46 PM
AVB,Colliers Securities Sticks to Their Hold Rating for AvalonBay (AVB),7/24/2023 4:35:07 PM
AVB,The Latest Analyst Ratings for AvalonBay Communities,7/12/2023 3:00:32 PM
AVB,Goldman Sachs Predicts Extended Disinflation: These 3 Consumer Categories Could See Significant Price Drops,7/11/2023 2:46:45 PM
AVB,RBC Capital Sticks to Its Hold Rating for AvalonBay (AVB),6/17/2023 1:45:29 AM
AVB,The Latest Analyst Ratings for AvalonBay Communities,6/14/2023 8:02:27 PM
AVB,AvalonBay Communities rental revenue growth better than expected QTD,6/2/2023 8:57:17 PM
AVB,Microsoft To Rally Around 27%? Here Are 10 Other Analyst Forecasts For Wednesday,5/31/2023 2:51:12 PM
AVB,Morgan Stanley Keeps Their Hold Rating on AvalonBay (AVB),5/26/2023 12:35:24 PM
AVB,AvalonBay Communities declares $1.65 dividend,5/24/2023 8:42:59 PM
AVB,AvalonBay (AVB) Receives a Sell from J.P. Morgan,5/23/2023 12:15:21 PM
AVB,9 Analysts Have This to Say About AvalonBay Communities,5/19/2023 9:00:30 PM
AVB,Equity REITs' April capital offerings fall by 61.3% Y/Y,5/17/2023 2:49:37 PM
AVB,3 Housing Stocks That Are Resilient to Home Price Fluctuations,5/15/2023 6:46:49 PM
AVB,"Benzinga's Top Ratings Upgrades, Downgrades For May 1, 2023",5/1/2023 5:00:43 PM
AVB,Piper Sandler Sticks to Its Sell Rating for AvalonBay (AVB),4/27/2023 12:25:40 PM
AVB,"AvalonBay Communities Announces Retreat In Q1 Income, misses estimates",4/26/2023 10:34:30 PM
AVB,Notable earnings after Wednesday's close,4/25/2023 9:35:52 PM
AVB,RBC Capital Sticks to Its Hold Rating for AvalonBay (AVB),4/22/2023 1:45:34 AM
AVB,Analysts: REIT Upgrades Trounce Downgrades By 2 To 1 In April,4/12/2023 5:33:30 PM
AVB,"Benzinga's Top Ratings Upgrades, Downgrades For April 10, 2023",4/10/2023 5:00:37 PM
AVB,9 Analysts Have This to Say About AvalonBay Communities,3/29/2023 6:01:31 PM
AVB,Analysts Just Gave These REITs Strong Upside Price Bumps,3/15/2023 1:14:10 PM
AVB,February median monthly asking rents growth at slowest pace in two years: Redin,3/10/2023 6:24:37 PM
AVB,AvalonBay same-store rental revenue rises 10.5% in first two months of 2023,3/3/2023 10:15:57 PM
AVB,Morgan Stanley Keeps Their Hold Rating on AvalonBay (AVB),3/1/2023 4:25:58 PM
AVB,Average apartment size in U.S. sees largest decline in 2022,2/25/2023 8:10:00 PM
AVB,Wall Street Analysts Are Bearish on Top Financial Picks,2/23/2023 12:10:08 PM
AVB,"Land & Buildings Investment exits Prologis, Park Hotels during Q4",2/14/2023 11:32:16 PM
AVB,"Analysts Offer Insights on Financial Companies: AvalonBay (AVB), S&P Global (SPGI) and Fortress Transportation (FTAI)",2/10/2023 4:30:12 PM
AVB,BMO Capital Reaffirms Their Buy Rating on AvalonBay (AVB),2/9/2023 12:15:07 AM
AVB,"AvalonBay issues guidance within expectations, sees stabilized portfolio in 2023",2/8/2023 10:55:08 PM
AVB,AvalonBay Communities Q4 2022 Earnings Preview,2/7/2023 10:35:11 PM
AVB,"Self storage, residential drive REIT returns higher this week",2/4/2023 5:00:00 PM
AVB,"Merck, GM among BofA's latest Alpha Surprise picks",2/2/2023 6:12:11 PM
AVB,7 Dividend Stocks That Will Be Big Winners in 2023,1/25/2023 2:57:03 AM
AVB,"Truist expects REITs to outperform broader market; upgrades AvalonBay, Equity Residential",1/17/2023 6:20:46 PM
AVB,US asking rent grows at slowest pace in over a year: Redfin,1/12/2023 2:39:28 PM
AVB,7 Dividend-Paying Stocks Trading at a Discount,1/10/2023 7:16:29 PM
AVB,"'I Have Disliked This Stock For Ages, And I Reiterate That I Still Dislike It': Cramer On This Stock Down 32% Over Past Month",1/6/2023 4:49:36 PM
AVB,The Latest Analyst Ratings for AvalonBay Communities,1/4/2023 5:00:24 PM
AVB,Equity REIT returns see steepest decline in 2022 since financial crisis,12/31/2022 5:00:00 PM
AVB,"REITs November capital raising activity down Y/Y, but up from October",12/27/2022 3:21:19 PM
AVB,RBC Capital Remains a Hold on AvalonBay (AVB),12/17/2022 1:45:26 AM
AVB,"Benzinga's Top Ratings Upgrades, Downgrades For December 16, 2022",12/16/2022 4:01:20 PM
AVB,"Wall Street's Most Accurate Analysts Reshuffled Their Best Real Estate Picks, Here They Are",12/14/2022 1:20:06 PM
AVB,"Home sales set to drop to lowest level since 2011, Redfin predicts",12/11/2022 4:13:00 PM
AVB,AvalonBay Communities closes $350M senior note offering,12/7/2022 9:40:51 PM
AVB,"Benzinga's Top Ratings Upgrades, Downgrades For December 2, 2022",12/2/2022 4:00:50 PM
AVB,"U.S. rents for October see slowest growth in 14 months on economic uncertainty, inflation",11/16/2022 5:10:07 PM
AVB,Residential Versus Healthcare REITs: Why Bank Of America Changed Its Ratings On These 5 REITs,11/14/2022 6:49:31 PM
AVB,AvalonBay Communities declares $1.59 dividend,11/11/2022 2:23:40 AM
AVB,"Benzinga's Top Ratings Upgrades, Downgrades For November 10, 2022",11/10/2022 3:11:32 PM
AVB,"Benzinga's Top Ratings Upgrades, Downgrades For November 7, 2022",11/7/2022 3:25:14 PM
AVB,"Analysts Offer Insights on Financial Companies: AvalonBay (AVB), Federal Realty (FRT) and Global Medical REIT (GMRE)",11/3/2022 11:20:43 PM
AVB,Here's what Wall Street expects from AvalonBay Communities's earnings,11/2/2022 3:01:13 PM
AVB,"As Home Sales Plummet, These Apartment Stocks Could Make Money",10/25/2022 6:24:00 AM
AVB,Morgan Stanley Reaffirms Their Buy Rating on AvalonBay (AVB),10/21/2022 4:35:42 PM
AVB,From A to Z: All The REITs Hitting New 52-Week Lows This Week,10/14/2022 5:12:32 PM
AVB,What 10 Analyst Ratings Have To Say About AvalonBay Communities,10/7/2022 3:27:02 PM
AVB,7 Profitable Places to Hide Your Money as We Enter a Bear Market,9/27/2022 2:00:38 PM
AVB,Colliers Securities Sticks to Its Hold Rating for AvalonBay (AVB),9/26/2022 12:15:07 PM
AVB,Morgan Stanley Says These 3 Reliable Dividend Stocks Should Be on Your Buy List (Especially Right Now),9/21/2022 6:40:05 PM
AVB,Real estate stocks slump as Fed expected to raise rates on Wednesday,9/20/2022 6:32:26 PM
AVB,"This Analyst Cuts PT On  Adobe, Plus Barclays Predicts $240 For FedEx",9/19/2022 1:19:54 PM
AVB,AvalonBay Communities declares $1.59 dividend,9/16/2022 4:36:05 AM
AVB,Analyst Ratings for AvalonBay Communities,9/15/2022 9:11:36 PM
AVB,"BofA screens for dividends that are secure, not stretched",9/5/2022 11:40:16 PM
AVB,Commercial real estate saw healthy demand in Q2,9/3/2022 3:00:00 PM
AVB,"Micron, Intel among new ideas in BofA's Alpha Surprise screen",9/2/2022 10:00:00 PM
AVB,"Benzinga's Top Ratings Upgrades, Downgrades For August 24, 2022",8/24/2022 4:11:35 PM
AVB,U.S. median asking rent slows for second-straight month in July - Redfin,8/19/2022 1:14:01 PM
AVB,"Land & Buildings takes new stake in SmartRent, exits Blackstone, Jones Lang LaSalle",8/16/2022 2:32:20 PM
AVB,7 Undervalued REITs to Buy in August,8/14/2022 6:18:58 PM
AVB,Expert Ratings for AvalonBay Communities,8/11/2022 6:53:36 PM
AVB,Multifamily housing fundamentals to see slowdown in growth amid macro factors: Freddie Mac,8/2/2022 7:05:11 PM
AVB,AvalonBay Communities lifts 2022 core FFO target after Q2 earnings beat,7/27/2022 9:19:34 PM
AVB,Notable earnings after Wednesday's close,7/26/2022 9:35:37 PM
AVB,10 Analysts Have This to Say About AvalonBay Communities,7/15/2022 7:18:01 PM
AVB,Top ETFs To Gain Access To Alternative Investments,7/11/2022 11:21:30 PM
AVB,Morgan Stanley To $80? Here's The Biggest Price Target Changes For Tuesday,6/28/2022 2:04:51 PM
AVB,Expert Ratings for AvalonBay Communities,6/23/2022 8:27:26 PM
AVB,Wells Fargo unveils its recession stock portfolio,6/14/2022 1:57:38 PM
AVB,Redfin sees homes for sale accumulating with smallest drop in listings since January 2020,6/10/2022 6:56:14 PM
AVB,"Amazon, Domino's among additions to BofA's Alpha Surprise screen",6/3/2022 11:10:52 AM
AVB,AvalonBay Communities declares $1.59 dividend,5/19/2022 8:19:47 PM
AVB,Apartment REITs saw a drop last month amid April national multifamily rent growth trends showing slowdown,5/7/2022 3:07:00 PM
AVB,Expert Ratings for AvalonBay Communities,4/29/2022 8:13:30 PM
AVB,AvalonBay Community Revises FY22 Outlook ,4/27/2022 11:14:40 PM
AVB,AvalonBay Communities Q1 2022 Earnings Preview,4/26/2022 9:45:18 PM
AVB,AvalonBay priced 2M stock offering at $248.60,4/7/2022 5:45:26 AM
AVB,AvalonBay Communities announces public offering of 2M shares,4/6/2022 8:21:47 PM
AVB,U.S. home prices 'out of step' with market fundamentals: Dallas Fed,4/2/2022 3:03:00 PM
AVB,Avalonbay Communities announces $500M commercial paper note program,3/15/2022 8:26:57 PM
AVB,Analyst Ratings For AvalonBay Communities,3/7/2022 5:02:49 PM
AVB,Avalonbay Communities reports 7.3% rental revenue growth through February,3/4/2022 9:29:56 PM
AVB,AvalonBay Communities declares $1.59 dividend,2/17/2022 9:37:48 PM
AVB,Expert Ratings For AvalonBay Communities,2/7/2022 6:13:33 PM
AVB,AvalonBay Q1 And FY Outlook Comes Above Street Projection ,2/3/2022 12:19:45 AM
AVB,"AvalonBay Communities Q4 Profit Decreases, but beats estimates",2/2/2022 10:25:56 PM
AVB,Notable earnings after Wednesday's close,2/1/2022 10:35:29 PM
AVB,"Benzinga's Top Ratings Upgrades, Downgrades For January 18, 2022",1/18/2022 4:06:20 PM
AVB,Redfin indicates January to be most challenging and competitive for homebuyers,1/13/2022 4:37:36 PM
AVB,"Roblox, Starbucks and Block make BTIG's top picks list: Sector Watch",1/9/2022 7:24:46 PM
AVB,"Benzinga's Top Ratings Upgrades, Downgrades For January 3, 2022",1/3/2022 5:36:13 PM
AVB,7 Boring Stocks to Buy to Protect Against the Speculative Fallout,12/22/2021 3:02:08 PM
AVB,"Average monthly rents jump 7% in November; New York, Florida taking spotlight",12/20/2021 3:49:45 PM
AVB,"Benzinga's Top Ratings Upgrades, Downgrades For December 10, 2021",12/10/2021 6:41:32 PM
AVB,"Average monthly rents increase slows in October, but metro areas see Y/Y jumps",11/23/2021 10:16:52 PM
AVB,AvalonBay's current president to take on CEO role in January,11/22/2021 9:30:47 PM
AVB,7 Stocks That Could Get a Big Boost From Biden’s ‘Build Back Better’ Bill,11/19/2021 10:53:44 PM
AVB,AvalonBay Communities closes on $400M green bond offering,11/18/2021 10:06:30 PM
AVB,"AvalonBay upgraded to Overweight at Morgan Stanley, UDR cut to Equalweight",11/8/2021 4:41:54 PM
AVB,Where AvalonBay Communities Stands With Analysts,10/29/2021 6:10:07 PM
AVB,AvalonBay Communities Q3 adjusted earnings Beat Estimates,10/27/2021 10:36:03 PM
AVB,Notable earnings after Wednesday's close,10/26/2021 9:35:59 PM
AVB,AvalonBay Communities earnings: here's what to expect,10/25/2021 3:02:03 PM
AVB,"Apartment rents' strength should continue into 2022, NAR economist says",10/22/2021 5:25:13 PM
AVB,7 Housing Stocks to Buy to Keep You Ahead of Inflation,10/20/2021 5:21:11 PM
AVB,What 10 Analyst Ratings Have To Say About AvalonBay Communities,10/14/2021 6:41:05 PM
AVB,Expert Ratings For AvalonBay Communities,10/12/2021 6:31:25 PM
AVB,Where AvalonBay Communities Stands With Analysts,9/29/2021 7:23:01 PM
AVB,"Benzinga's Top Ratings Upgrades, Downgrades For September 23, 2021",9/23/2021 4:06:30 PM
AVB,"China fintech stocks collapse into the close, apartment REITs outshine financial sector",9/20/2021 8:49:01 PM
AVB,"Residential, Retail, Office, Industrial REITs initiated Overweight at Barclays",9/1/2021 7:52:08 PM
AVB,Apartment REITs gain after federal eviction moratorium ends,8/27/2021 6:21:11 PM
AVB,Expert Ratings For AvalonBay Communities,8/26/2021 6:33:14 PM
AVB,7 REITs to Buy if You’re Confident About the Economic Recovery,8/18/2021 4:34:16 PM
AVB,What's next for the housing market as foreclosure moratorium expires?,8/2/2021 9:03:45 AM
AVB,The Many Ways to Play Today’s Housing Boom,7/31/2021 9:35:33 PM
AVB,Where AvalonBay Communities Stands With Analysts,7/30/2021 6:26:19 PM
AVB,Multifamily REITs chug forward as Mizuho re-ups its favorites,7/29/2021 11:29:58 PM
AVB,AvalonBay Communities Q2 adjusted earnings Beat Estimates,7/28/2021 10:57:31 PM
AVB,AvalonBay Communities Q2 Earnings Preview,7/27/2021 9:35:23 PM
AVB,AvalonBay Communities earnings preview: what Wall Street is expecting,7/26/2021 3:01:46 PM
AVB,"Healthcare, tech highlight BTIG's midyear top stock picks: At the Open",7/6/2021 11:48:04 AM
AVB,Analyst Ratings For AvalonBay Communities,7/1/2021 8:22:11 PM
AVB,Apartment price growth eclipses industrial property price growth in May,6/30/2021 8:39:11 PM
AVB,Federal eviction moratoriums extended by a month for the last time,6/24/2021 5:46:36 PM
AVB,"Benzinga's Top Ratings Upgrades, Downgrades For June 15, 2021",6/15/2021 4:24:55 PM
AVB,"Benzinga's Top Ratings Upgrades, Downgrades For June 14, 2021",6/14/2021 4:47:14 PM
AVB,7 Apartment REITs to Buy as Rent Prices Get Set to Surge,6/9/2021 2:39:31 PM
AVB,FTSE Nareit All Equity REITs Index gains 18.1% in latest week; Retail contribution highest,6/7/2021 7:37:22 PM
AVB,AvalonBay occupancy rates continue to trend up in May,6/4/2021 8:30:42 PM
AVB,Fannie and Freddie extend multifamily forbearance programs through Sept. 30,6/3/2021 5:22:44 PM
AVB,Analyst Ratings for AvalonBay Communities,5/26/2021 2:54:33 PM
AVB,AvalonBay Communities declares $1.59 dividend,5/20/2021 8:42:43 PM
AVB,Jonathan Litt's Land & Buildings takes stakes in Six Flags. MGM Growth,5/17/2021 10:06:13 PM
AVB,Stocks That Hit 52-Week Highs On Monday,5/10/2021 5:26:20 PM
AVB,"Benzinga's Top Ratings Upgrades, Downgrades For May 3, 2021",5/3/2021 4:08:15 PM
AVB,"Benzinga's Top Ratings Upgrades, Downgrades For April 30, 2021",4/30/2021 4:04:14 PM
AVB,AvalonBay Communities Q1 adjusted earnings Beat Estimates,4/28/2021 10:42:00 PM
AVB,Notable earnings after Wednesday's close,4/27/2021 9:35:40 PM
AVB,Here's what Wall Street expects from AvalonBay Communities's earnings report,4/26/2021 3:02:04 PM
AVB,7 Excellent Index Funds With Juicy Dividends for Income Investors,4/9/2021 4:53:25 PM
AVB,"Benzinga's Top Ratings Upgrades, Downgrades For March 31, 2021",3/31/2021 4:03:29 PM
AVB,7 Sector Index Funds To Keep On Your Radar,3/26/2021 6:25:51 PM
AVB,"Equity Residential, AvalonBay cut to Sell at Deutsche Bank due to rich valuations",3/24/2021 12:09:15 PM
AVB,AvalonBay stock rises after CEO reports accelerating demand,3/8/2021 4:34:26 PM
AVB,AvalonBay same-store rent revenue falls 9.1% Y/Y for January-February period,3/5/2021 9:35:56 PM
AVB,"AvalonBay Communities, Inc. -- Moody's announces completion of a periodic review of ratings of AvalonBay Communities, Inc.",3/2/2021 5:32:00 PM
AVB,"Benzinga's Top Ratings Upgrades, Downgrades For February 22, 2021",2/22/2021 4:03:37 PM
AVB,Apartment REIT check-in from Mizuho finds Sun Belt still leading - but signs of life on coast,2/5/2021 12:27:35 AM
AVB,AvalonBay Communities Earnings Advance In Q4,2/3/2021 10:43:30 PM
AVB,Notable earnings after Wednesday's close,2/2/2021 10:35:57 PM
AVB,Here's what Wall Street expects from AvalonBay Communities's earnings report,2/1/2021 3:01:40 PM
AVB,"S&P CoreLogic Case-Shiller Index indicates 9.5% November gains, largest increase in six years",1/26/2021 8:16:59 PM
AVB,Real estate stocks gain as new administration begins,1/20/2021 6:43:16 PM
AVB,7 Hot Real Estate Stocks for 2021,1/6/2021 5:52:32 PM
AVB,Home prices and pending sales grow; active listings drop to all-time low,12/29/2020 5:38:13 PM
AVB,"JPMorgan analysts rejigger real estate, REIT ratings for 2021 outlook",12/21/2020 5:23:12 PM
AVB,"AvalonBay Communities, Inc. -- Moody's affirms AvalonBay's A3 rating; outlook stable",12/18/2020 10:13:00 PM
AVB,"Home price, home sales indicate hot housing November market; 2021 outlook strong",12/17/2020 7:44:40 PM
AVB,Freddie apartment investment market index rebounds in Q3,12/16/2020 3:43:15 PM
AVB,AvalonBay Communities appoints Benjamin W. Schall as president,12/10/2020 10:08:27 PM
AVB,"Not-yet-agreed-upon relief plan includes extended eviction moratorium, rental aid",12/9/2020 7:22:49 PM
AVB,Gundlach: 'There seems to be no end in sight' for strong home sales,12/8/2020 10:22:20 PM
AVB,Q3 REIT earnings stabilize; FFO reports sequential growth,11/19/2020 6:45:13 PM
AVB,"NYC switches to all-remote format; office, apartment REIT stocks fall",11/18/2020 9:08:31 PM
AVB,REITs get a premarket boost from COVID-19 vaccine news,11/16/2020 2:26:52 PM
AVB,5 Real Estate Stocks That Offer Opportunities for Both Yield and Gains,11/11/2020 10:01:57 AM
AVB,Mizuho's bullish take on residential REITs; Blue Wave could support California REITs,11/10/2020 7:35:33 PM
