Ticker,Title,Link
TRMB,"Analysts Are Bullish on These Technology Stocks: Onestream, Inc. Class A (OS), Trimble (TRMB)",8/19/2024 11:01:06 AM
TRMB,"Jana Partners top buys and sells in Q2 include Rapid7, Freshpet, others",8/14/2024 3:36:43 PM
TRMB,3 Tech Stocks to Buy Now for the Next Bull Market: August Edition,8/7/2024 8:10:04 PM
TRMB,Trimble Lifts FY24 Forecast As Q2 Beats Market; Stock Up - Update ,8/6/2024 3:39:27 PM
TRMB,Trimble Q2 2024 Earnings Preview,8/5/2024 4:22:36 PM
TRMB,Least shorted S&P 500 stocks in June,7/18/2024 2:06:53 PM
TRMB,"TRMB, CYBR, HUBS: Which “Strong Buy” Tech Stock Is Best?",7/9/2024 12:30:40 AM
TRMB,"Analysts Are Bullish on Top Technology Stocks: Microsoft (MSFT), Q2 Holdings (QTWO)",7/1/2024 11:30:17 AM
TRMB,Least shorted S&P 500 stocks in May,6/18/2024 2:34:48 PM
TRMB,The 3 Most Undervalued Software Stocks to Buy in May 2024,5/13/2024 10:09:00 AM
TRMB,J.P. Morgan Sticks to Its Hold Rating for Trimble (TRMB),5/9/2024 12:16:06 PM
TRMB,Trimble Buys Flashtract For Undisclosed Terms ,5/8/2024 1:07:15 PM
TRMB,Analysts Offer Insights on Technology Companies: Trimble (TRMB) and Robinhood Markets (HOOD),5/6/2024 2:10:11 PM
TRMB,"TRMB Stock Earnings: Trimble Beats EPS, Beats Revenue for Q1 2024",5/3/2024 3:54:08 PM
TRMB,Trimble Q1 2024 Earnings Preview,5/2/2024 3:54:24 PM
TRMB,Demystifying Trimble: Insights From 9 Analyst Reviews,5/1/2024 6:00:45 PM
TRMB,TipRanks’ ‘Perfect 10’ List: Unlocking 2 Top-Scoring Stocks Amidst Market Uncertainty,4/24/2024 11:19:00 AM
TRMB,"Analysts Are Bullish on Top Technology Stocks: Trimble (TRMB), Bitdeer Technologies (BTDR)",4/15/2024 11:10:38 AM
TRMB,What Analysts Are Saying About Trimble Stock,4/2/2024 2:00:54 PM
TRMB,"Cathie Wood's Ark Invest Continues To Double Down On Moderna, Sells Nvidia Shares",3/27/2024 3:30:42 AM
TRMB,"Analysts Offer Insights on Technology Companies: Zebra Tech (ZBRA), Wix (WIX) and Trimble (TRMB)",3/14/2024 11:40:54 AM
TRMB,Decoding 6 Analyst Evaluations For Trimble,3/12/2024 1:01:57 PM
TRMB,Top Picks: 3 Space Stocks That Are Out of This World,3/7/2024 4:34:30 PM
TRMB,Bernstein Reaffirms Their Buy Rating on Trimble (TRMB),3/4/2024 2:27:07 AM
TRMB,"Analysts Conflicted on These Technology Names: Alphawave IP Group (GB:AWE), Computacenter (GB:CCC) and Trimble (TRMB)",2/21/2024 9:01:13 AM
TRMB,"Jana Partners takes new stake in Trimble, buys more SPY, trims FIS",2/14/2024 4:35:02 PM
TRMB,Trimble's Growth Catalysts: Analyst Upgrades Stock On Strong Growth Potential Amid Debt Reduction And Buyback,2/13/2024 7:45:43 PM
TRMB,Trimble Q4 Earnings Fall But Revenue Climbs; Stock Down In Pre-market ,2/12/2024 1:39:37 PM
TRMB,Trimble Navigation is about to announce earnings — here's what Wall Street expects,2/11/2024 3:01:13 PM
TRMB,Trimble Q4 2023 Earnings Preview,2/9/2024 3:19:18 PM
TRMB,Trimble To Buy Back Up To $800 Mln Of Shares ,1/30/2024 12:47:43 PM
TRMB,The Analyst Verdict: Trimble In The Eyes Of 5 Experts,1/9/2024 4:00:16 PM
TRMB,3 Stocks at the Forefront of Precision Agriculture Technology,12/8/2023 1:26:56 AM
TRMB,Trimble to Provide Advanced Positioning Systems to Sabanto for Enhanced Autonomous Tractor Performance,12/7/2023 12:30:00 PM
TRMB,Robotics Stocks: Bot is Man’s Best Friend,11/30/2023 1:39:46 PM
TRMB,Trimble Contributes Inertial Navigation Solutions to the Indian Institute of Technology in Kanpur Supporting the Country's Commitment to Becoming a Leader in the UAV Industry,11/29/2023 12:30:00 PM
TRMB,The Future of Farming: 3 AgriTech Stocks to Grow Substantial Profits,11/22/2023 9:52:29 PM
TRMB,Trimble Introduces AI-Powered Capability to Automatic Invoicing Functionality with Microsoft Azure,11/6/2023 12:30:00 PM
TRMB,Goldman Sachs Keeps Their Buy Rating on Trimble Navigation (TRMB),11/1/2023 9:55:26 PM
TRMB,What Wall Street expects from Trimble Navigation's earnings,10/31/2023 3:01:13 PM
TRMB,3 Ag Stocks to Buy Instead of John Deere,10/19/2023 9:30:48 PM
TRMB,Trimble Opens Two Technology Labs at The Ohio State University to Advance the Next Generation of Agriculture and Construction Talent,10/18/2023 12:30:00 PM
TRMB,Analyst Expectations for Trimble's Future,10/16/2023 7:00:38 PM
TRMB,Trimble Announces FedRAMP Authorized Status for e-Builder Enterprise Government Edition,10/10/2023 12:30:00 PM
TRMB,Trimble and Mincon Offer Trimble Ready Drilling and Piling Solution for Solar Industry,10/5/2023 12:30:00 PM
TRMB,"Analysts’ Opinions Are Mixed on These Technology Stocks: Trimble Navigation (TRMB), Cognizant (CTSH) and BlackBerry (BB)",10/3/2023 6:21:13 AM
TRMB,"Trimble Could See Debt Reduction, Buyback Boost From AGCO Deal Proceeds, Analyst Upgrades Stock",9/29/2023 8:54:19 PM
TRMB,NIO Stock Alert: Nio Allegedly Is in Talks With Mercedes-Benz,9/28/2023 3:07:39 PM
TRMB,Trimble and Meta Bring SketchUp to Meta Quest VR Headsets,9/27/2023 9:30:00 PM
TRMB,"Trimble and Kyivstar Partner to Provide GNSS Correction Services for Agriculture, Construction and Geospatial Applications in Ukraine",9/26/2023 12:30:00 PM
TRMB,Trimble Leaders Highlight the Unique 'Journeys' of the Supply Chain During Opening Session of its 2023 Insight Tech Conference + Expo,9/25/2023 10:01:00 PM
TRMB,Purdue University to Launch Trimble Technology Lab with Focus on Construction Management Technology,9/21/2023 3:00:00 PM
TRMB,"Trimble Launches Cloud-Based Appian Daily Planner to Simplify Complex, Multi-Stop Routing",9/19/2023 12:30:00 PM
TRMB,The 3 Best Space Stocks to Buy Now: September 2023,9/18/2023 10:09:11 AM
TRMB,"Cogent Communications, Trimble And 2 Other Stocks Insiders Are Selling",9/15/2023 12:38:43 PM
TRMB,Trimble Releases 2022 Sustainability Report,8/31/2023 2:00:00 PM
TRMB,Dart Transit Selects Trimble Instinct and Video Intelligence Fleet Management Solutions for Improved Driver Experience and Safety,8/30/2023 12:30:00 PM
TRMB,7 Companies Leading the Way in Advanced AI and Robotics,8/8/2023 6:33:02 PM
TRMB,Trimble Navigation (TRMB) Receives a Hold from Piper Sandler,8/4/2023 3:07:03 PM
TRMB,Goldman Sachs Reaffirms Their Buy Rating on Trimble Navigation (TRMB),8/3/2023 11:05:10 PM
TRMB,Trimble Q2 2023 Earnings Preview,8/2/2023 5:42:34 PM
TRMB,Trimble Dimensions to Kick Off with a High-Performance Keynote Speaker,7/26/2023 2:00:00 PM
TRMB,Trimble Second Quarter 2023 Earnings Call and Webcast,7/21/2023 6:19:00 PM
TRMB,7 Growth Stocks to Buy With Explosive Upside Potential,6/25/2023 5:17:44 PM
TRMB,7 Tech Stocks to Buy With Explosive Upside Potential,6/20/2023 6:21:09 PM
TRMB,The 3 Best Agribusiness Stocks to Buy for June 2023,6/12/2023 3:00:15 PM
TRMB,The Ohio State University to Establish Trimble Technology Labs for Agriculture and Construction,5/23/2023 2:30:00 PM
TRMB,Trimble Announces Keynote Speaker for 2023 Insight Tech Conference + Expo,5/17/2023 2:30:00 PM
TRMB,Bargain Alert: 3 Stocks Worth Buying at 52-Week Lows,5/16/2023 10:00:53 AM
TRMB,"Magnetar Financial adds new stakes in Shake Shak, Ferrari, boosts Encompass Health",5/15/2023 10:37:02 PM
TRMB,Piper Sandler Keeps Their Hold Rating on Trimble Navigation (TRMB),5/4/2023 4:26:30 PM
TRMB,Trimble Q1 Net Income Rises; Revenue Down 3% On Organic Basis ,5/3/2023 1:09:10 PM
TRMB,Trimble Q1 2023 Earnings Preview,5/2/2023 4:40:41 PM
TRMB,Trimble and FHNW Establish Trimble Technology Lab in Switzerland,4/28/2023 12:30:00 PM
TRMB,"Trimble Breaks Ground On 1.7-Megawatt Solar Array at Westminster, Colorado Headquarters",4/21/2023 12:30:00 PM
TRMB,Trimble First Quarter 2023 Earnings Call and Webcast,4/20/2023 2:42:00 PM
TRMB,Trimble Opens First Trimble Technology Lab in New Zealand at the University of Auckland,4/12/2023 12:30:00 PM
TRMB,Launch of Trimble Unity AMS Provides Electric Utilities with Enterprise Asset Management Solution to Improve Reliability and Efficiency,4/11/2023 12:30:00 PM
TRMB,"Benzinga's Top Ratings Upgrades, Downgrades For April 5, 2023",4/5/2023 5:00:36 PM
TRMB,Trimble Completes Transporeon Acquisition,4/3/2023 12:45:00 PM
TRMB,3 IPOs to Watch Out for in 2023,4/1/2023 8:35:48 PM
TRMB,Trimble Launches First Industry Dwell Time Metrics for Fleet Management,3/30/2023 2:30:00 PM
TRMB,Trimble Joins ResponsibleSteel to Further Sustainability Efforts in the Steel Industry,3/24/2023 11:30:00 AM
TRMB,Tekla 2023 Structural BIM Software Raises the Bar for Automated and Connected Workflows Across Projects,3/15/2023 12:00:00 PM
TRMB,Trimble Introduces an All-In-One System for On-Machine Excavator Guidance and Site Surveying,3/14/2023 11:31:00 AM
TRMB,What 4 Analyst Ratings Have To Say About Trimble,3/7/2023 5:00:36 PM
TRMB,England's National Highways Extends Its Contract for Trimble's AgileAssets Cloud Software for Bridge Asset Management,3/2/2023 1:30:00 PM
TRMB,Trimble Partners with Engineers Without Borders USA to Support Climate Resiliency and Education Efforts,2/23/2023 1:30:00 PM
TRMB,Don't give up on these stocks punished by earnings - Goldman,2/20/2023 7:23:47 AM
TRMB,"Trimble Announces Advanced Path Planning Technology, Taking the Next Step Toward Fully Autonomous Equipment for a Variety of Industries",2/15/2023 12:30:00 PM
TRMB,3 Space Stocks to Buy as All Eyes Are on the Sky,2/13/2023 7:08:59 PM
TRMB,Trimble Technology to Help Power Nissan's Most Advanced Driver Assist System to Date,2/9/2023 1:00:00 PM
TRMB,"Trimble Q4 Net Down As Revenues Drop, Misses View; 2023 Guidance Below View ",2/8/2023 1:42:24 PM
TRMB,Trimble Q4 2022 Earnings Preview,2/7/2023 5:02:37 PM
TRMB,Trimble Engage Lane Provides First-of-its-Kind Dwell Time Metrics for Freight Procurement,1/31/2023 3:01:00 PM
TRMB,Trimble Fourth Quarter and Full Year 2022 Earnings Call and Webcast,1/25/2023 12:30:00 PM
TRMB,Trimble Navigation (TRMB) Receives a Buy from Credit Suisse,1/17/2023 1:15:23 AM
TRMB,The University of British Columbia Establishes Trimble Technology Lab Serving the Faculty of Forestry,1/12/2023 12:30:00 PM
TRMB,Norwegian Public Roads Administration Selects Trimble for Asset Lifecycle Management,1/10/2023 12:30:00 PM
TRMB,"Analysts Offer Insights on Technology Companies: Littelfuse (LFUS), Omnicell (OMCL) and Trimble Navigation (TRMB)",12/16/2022 5:30:33 AM
TRMB,The Robots Are Coming! 7 Stocks to Buy Before They Boom.,12/15/2022 5:21:22 PM
TRMB,"Analysts Remain Divided Over Trimble's Transporeon Acquisition's Debt, Valuation And Synergies",12/13/2022 9:21:39 PM
TRMB,Trimble To Buy Transporeon For €1.88 Bln ,12/12/2022 10:27:43 PM
TRMB,Trimble Announces 2022 Viewpoint Construction Award Winners,11/9/2022 10:00:00 PM
TRMB,Trimble and Hilti Announce Product Integration to Help Contractors Streamline Tool Tracking and Job Cost Allocation,11/8/2022 12:30:00 PM
TRMB,Trimble Construction Cloud Powered by Microsoft Azure Launches at Trimble Dimensions+ Conference,11/7/2022 12:32:00 PM
TRMB,"Analysts Offer Insights on Technology Companies: Trimble Navigation (TRMB), HubSpot (HUBS) and Dynatrace (DT)",11/3/2022 4:41:20 PM
TRMB,"Trimble Inc. Q3 Profit Drops, Inline With Estimates",11/2/2022 12:13:06 PM
TRMB,Trimble Q3 2022 Earnings Preview,11/1/2022 5:43:20 PM
TRMB,Trimble and General Motors Mark Historic Milestone: More Than 34 Million Hands-Free Miles on the Road,10/26/2022 12:30:00 PM
TRMB,"Trimble Introduces Horizontal Steering Control, Automatic Screed Width Control for Vögele Asphalt Pavers",10/25/2022 12:32:00 PM
TRMB,Trimble Third Quarter 2022 Earnings Call and Webcast,10/21/2022 12:30:00 PM
TRMB,"Trimble Observes World Food Day with $100,000 Donation to World Food Program USA",10/17/2022 3:00:00 PM
TRMB,"Trimble Changes Headquarters to Westminster, Colorado",10/6/2022 4:00:00 PM
TRMB,Trimble Announces Tekla Global BIM Awards 2022 Winners,10/4/2022 12:30:00 PM
TRMB,Trimble's New Agriculture Displays Provide Next-Generation Performance and Connectivity for In-Field Operations,10/3/2022 12:30:00 PM
TRMB,Trimble Ventures Invests in Civ Robotics--A Construction Tech Startup Focused on Autonomous Surveying Solutions,9/21/2022 3:05:00 PM
TRMB,Trimble Sets New Standard for Robotic Total Station Scalability,9/20/2022 12:30:00 PM
TRMB,Trimble Announces Keynote Speakers for 2022 Trimble Dimensions+ Conference,9/19/2022 6:15:00 PM
TRMB,Sydved Selects Trimble's CFHarvest to Digitalize its Forestry Harvesting Operations,9/15/2022 12:30:00 PM
TRMB,Trimble Acquires B2W Software For Undisclosed Terms ,9/14/2022 1:59:12 PM
TRMB,What To Know About Piper Sandler's Downgrade of Trimble,9/8/2022 6:17:37 PM
TRMB,Trimble to Host 2022 Investor Day,9/7/2022 12:30:00 PM
TRMB,"Catalyst watch: Key events for Apple, Moderna, Nike and Bausch + Lomb",9/2/2022 7:00:59 PM
TRMB,Trimble Sets Ambitious Climate Goals for Reducing Greenhouse Gas Emissions in Line with a Net-Zero Future,8/31/2022 12:30:00 PM
TRMB,Trimble To Buy Bilberry For Undisclosed Financial Terms ,8/30/2022 12:40:41 PM
TRMB,MiX Telematics to acquire Trimble's field service management business,8/25/2022 10:49:56 AM
TRMB,Trimble and CLAAS Strategic Alliance Develops Next-Generation Precision Farming System for CLAAS Agriculture Equipment,8/24/2022 12:30:00 PM
TRMB,Quant Ratings Updated on 77 Stocks,8/23/2022 6:21:02 PM
TRMB,Trimble Ventures Invests in Sabanto--an Autonomous Farming-as-a-Service Company,8/18/2022 3:05:00 PM
TRMB,"Benzinga's Top Ratings Upgrades, Downgrades For August 17, 2022",8/17/2022 4:15:36 PM
TRMB,Trimble Showcases Customer-Driven Platform Strategy to Open its Insight Tech Conference + Expo,8/15/2022 2:00:00 PM
TRMB,Trimble RTX Integrity Validates Positioning Data Accuracy to Support Safety-Critical Applications,8/11/2022 12:30:00 PM
TRMB,Trimble Inc. Bottom Line Advances In Q2,8/5/2022 1:15:18 PM
TRMB,Trimble Q2 2022 Earnings Preview,8/4/2022 5:32:47 PM
TRMB,Trimble Second Quarter 2022 Earnings Call and Webcast,7/27/2022 12:30:00 PM
TRMB,New Scanning and Imaging Solution from Trimble Simplifies 3D Deliverables,7/26/2022 12:30:00 PM
TRMB,5 Top Stocks Cathie Wood Bought This Week,7/21/2022 8:38:31 PM
TRMB,Tesla Bull Cathie Wood's Ark Loads Up Heavily On These 3 Autonomous Tech Stocks,7/19/2022 3:06:38 PM
TRMB,Analyst Ratings for Trimble,7/12/2022 5:18:00 PM
TRMB,Goldman screens stocks most and least vulnerable to recession margin pressure,7/11/2022 3:29:42 PM
TRMB,Goldman touts stable stocks for this market; here is their rebalanced portfolio,6/19/2022 7:22:30 PM
TRMB,Trimble to Host 2022 Investor Day,6/16/2022 12:30:00 PM
TRMB,Trimble Announces New Deployment of Applanix's POS LV to Enable Broader Autonomy Capabilities for IHI Corporation,6/15/2022 12:30:00 PM
TRMB,5 Cathie Wood Stocks to Buy in June,6/9/2022 3:00:28 PM
TRMB,Analyst Ratings for Trimble,5/23/2022 9:02:18 PM
TRMB,Stocks to buy as a recession approaches: UBS screens for high quality,5/19/2022 10:07:01 AM
TRMB,Trimble could unlock $3B in value by selling its agriculture business - analyst,5/16/2022 4:58:43 PM
TRMB,Precisional Completes Acquisition of Four Industrial Technology Businesses from Trimble,5/9/2022 3:03:00 PM
TRMB,Analyst Ratings for Trimble,5/5/2022 11:02:41 PM
TRMB,Trimble Q1 2022 Earnings Preview,5/4/2022 6:57:46 PM
TRMB,Notable earnings after Wednesday's close,5/3/2022 9:35:38 PM
TRMB,Trimble First Quarter 2022 Earnings Call and Web Cast,4/22/2022 12:30:00 PM
TRMB,Wabtec agrees to acquire Trimble's Beena Vision business,4/20/2022 11:21:15 AM
TRMB,"SketchUp for iPad Ushers in a New Way to Create in 3D, Anywhere",4/19/2022 12:30:00 PM
TRMB,Trimble To Sell 4 Businesses To Jordan Company; Terms Not Known ,4/13/2022 1:37:36 PM
TRMB,Trimble Opens Registration for its 2022 Insight Tech Conference + Expo,4/8/2022 2:00:00 PM
TRMB,"Trimble Underscores Commitment to Sustainability with New Five-Year, $1.25 Billion Revolving Credit Facility",3/31/2022 12:30:00 PM
TRMB,Expert Ratings For Trimble,3/28/2022 8:17:15 PM
TRMB,Qualcomm and Trimble Introduce Meter-Level Location Accuracy for Smartphones,3/22/2022 12:30:00 PM
TRMB,Trimble's Tekla 2022 Software Solutions Enable More Sustainable Construction,3/9/2022 12:30:00 PM
TRMB,Trimble Extends its Support for Empowered to Educate with Multi-Year Foundation Grant to Grow its Fellowship Program,3/8/2022 12:30:00 PM
TRMB,Trimble and CAMPUS SURSEE Establish Trimble Technology Lab,3/3/2022 12:30:00 PM
TRMB,Trimble Jobsite Connectivity Bundle Links 3D Models and Data Across Trimble Civil Construction Hardware and Software Solutions,2/28/2022 12:30:00 PM
TRMB,Trimble Announces FedRAMP In Process Status for e-Builder Enterprise Government Edition,2/23/2022 12:30:00 PM
TRMB,Best and worst stocks sensitive to Russia and Ukraine from J.P. Morgan,2/22/2022 1:08:16 PM
TRMB,Analyst Ratings For Trimble,2/10/2022 7:04:05 PM
TRMB,"Trimble Q4 Profit Misses View, But Sales Top; Sees FY Profit Below View ",2/9/2022 1:40:57 PM
TRMB,Notable earnings after Wednesday's close,2/8/2022 10:35:53 PM
TRMB,Trimble Q4 2021 Earnings Preview,2/7/2022 10:35:39 PM
TRMB,Trimble Dimensions+ 2022 Call for Speakers Now Open,2/2/2022 12:30:00 PM
TRMB,Trimble Introduces Next Generation 3D Paving Control System for Asphalt Compactors,2/1/2022 12:30:00 PM
TRMB,Trimble Introduces Mixed Reality for Construction Layout with FieldLink MR,1/31/2022 3:30:00 PM
TRMB,Trimble Fourth Quarter and Full Year 2021 Earnings Call and Web Cast,1/27/2022 12:30:00 PM
TRMB,Trimble Introduces Industry's First Horizontal Steering Control for Soil Compactors,1/18/2022 12:30:00 PM
TRMB,Thomas Sweet Joins Trimble's Board of Directors,1/13/2022 12:30:00 PM
TRMB,French Railway Authority SNCF Réseau Bases Enterprise Common Data Environment on Trimble Collaboration Software,12/21/2021 12:30:00 PM
TRMB,Cathie Wood's Ark Has Nearly Exited Its Boeing Position,12/15/2021 12:52:06 PM
TRMB,"Trimble's New GNSS Base Station Gives Users Improved Satellite Tracking and Remote Operation for Civil Construction, Geospatial and Agriculture Applications",12/7/2021 12:30:00 PM
TRMB,Tampere University in Finland Establishes Trimble Technology Lab for the Faculty of the Built Environment,11/30/2021 12:30:00 PM
TRMB,Ferguson Waterworks Partners with Trimble to Offer Utilities Greater Access to Technology for Digitizing Water and Wastewater Assets,11/18/2021 12:30:00 PM
TRMB,"Trimble Ventures Invests in Monarch Tractor--an Electric, Autonomous Smart Tractor Platform for Sustainable Farming",11/17/2021 3:38:00 PM
TRMB,Trimble Civil Construction Field Software Now Available Via Subscription Service Worldwide,11/15/2021 12:30:00 PM
TRMB,Trimble and Swinburne University of Technology Establish Trimble Technology Lab in the Departments of Civil and Construction Engineering,11/10/2021 12:30:00 PM
TRMB,Trimble Announces Breakthrough Performance Improvements to CenterPoint RTX Corrections Service for Precision Agriculture Solutions,11/9/2021 12:30:00 PM
TRMB,Trimble Establishes Dr. Gladys West Scholarship Program,11/8/2021 12:30:00 PM
TRMB,Trimble Announces Record Third Quarter 2021 Results,11/3/2021 9:05:00 PM
TRMB,Trimble Q3 2021 Earnings Preview,11/2/2021 9:35:55 PM
TRMB,Trimble and Microsoft Partner to Drive Digital Transformation Across Industries,10/27/2021 12:30:00 PM
TRMB,Trimble Connect Expands Capabilities with Support for Augmented Reality on Mobile Devices,10/26/2021 12:30:00 PM
TRMB,Trimble and Washington State University Establish Trimble Technology Lab at the Voiland College of Engineering and Architecture,10/21/2021 12:30:00 PM
TRMB,Trimble Third Quarter 2021 Earnings Call and Web Cast,10/20/2021 12:30:00 PM
TRMB,Trimble Releases Turnkey Autonomous Robotic Scanning Solution,10/19/2021 12:30:00 PM
TRMB,7 Tech Stocks Coming to the Rescue of the Construction Industry,10/18/2021 5:19:28 PM
TRMB,"Benzinga's Top Ratings Upgrades, Downgrades For October 15, 2021",10/15/2021 4:15:14 PM
TRMB,Trimble Introduces Connected Model-Based Estimating Workflow for Mechanical Piping and Electrical Contractors,10/14/2021 12:30:00 PM
TRMB,Trimble's eDriver Logs Certified as Compliant Solution for Canada's Electronic Logging Device Mandate,10/13/2021 2:00:00 PM
TRMB,Tests above Tel Aviv! Israel moves ahead with national drone network,10/12/2021 8:06:36 AM
TRMB,Trimble and One Click LCA Collaborate to Provide Embodied Carbon Calculations for Different Phases of Construction Projects,10/8/2021 12:30:00 PM
TRMB,Registration Now Open for Trimble Dimensions+ 2022 User Conference,10/5/2021 12:30:00 PM
TRMB,City of Toronto Selects Trimble Unity for Water Infrastructure Management,9/29/2021 12:30:00 PM
TRMB,Trimble Inc. -- Moody's announces completion of a periodic review of ratings of Trimble Inc.,9/27/2021 11:45:00 PM
TRMB,This Analyst Sees 17% Downside In Trimble - Read Why,9/23/2021 6:05:46 PM
TRMB,Trimble Announces Chief Platform and Chief Technology Officers,9/21/2021 1:00:00 PM
TRMB,Trimble and Procter & Gamble to Collaborate in Transforming Transportation Procurement,9/15/2021 2:00:00 PM
TRMB,Trimble Construction One Construction Management Platform Bridges Industry Gap Between Constructible Models and Project Financials,9/14/2021 4:30:00 PM
TRMB,"Spirit Aerosystems, Iridium, Trimble, Unity, Jaws Spitfire And More: These Are Cathie Wood's Key Trades From Friday",9/13/2021 6:03:58 AM
TRMB,Cathie Wood Sells $138.5M Tesla Shares In Two Straight Sessions,9/10/2021 4:26:02 AM
TRMB,"Amazon, Pfizer, Roku, Boeing And More: These Are Cathie Wood's Key Trades From Tuesday",9/8/2021 10:43:02 AM
TRMB,"Cathie Wood's Ark Completely Exits All Alibaba Positions, Continues Piling Up Stake In This Chinese Rival",9/7/2021 11:08:03 AM
TRMB,"Cathie Wood Continues Alibaba Selling With Just 40 Shares Left In Portfolio, Loads Up Heavily On These Chinese Rivals",9/3/2021 5:18:34 AM
TRMB,"Viewpoint Collaborate Conference Broadens Reach, Opens Registration for 10th Annual Event",8/11/2021 2:00:00 PM
TRMB,10 Stocks to Buy From Cathie Wood’s Fleet of ETFs ,8/6/2021 2:45:07 PM
TRMB,Trimble Announces Record Second Quarter 2021 Results,8/4/2021 10:05:00 PM
TRMB,Trimble Q2 2021 Earnings Preview,8/3/2021 9:35:36 PM
TRMB,Here's what Wall Street expects from Trimble Navigation's earnings,8/2/2021 3:02:05 PM
TRMB,Fundex Equipment to Offer Trimble Groundworks Machine Control System for Piling Rig Guidance,7/30/2021 12:30:00 PM
TRMB,Forget Meme Stocks! 7 Top Tech Stocks to Buy for Long-Term Growth,7/26/2021 3:16:42 PM
TRMB,Trimble Boosts Flagship RTX Correction Service Performance--Continuing to Raise the Bar for Geospatial Users,7/22/2021 12:30:00 PM
TRMB,Trimble Second Quarter 2021 Earnings Call and Web Cast,7/21/2021 12:30:00 PM
TRMB,Trimble MX50 LiDAR System Expands Mobile Mapping Portfolio,7/12/2021 12:30:00 PM
TRMB,The 7 Best Tech Stocks to Buy in July,7/9/2021 3:28:08 PM
TRMB,Anguilla Launches New Land Information System from Trimble,6/29/2021 12:30:00 PM
TRMB,What the qaunts want: here are the top 10 stocks: Sector Watch,6/27/2021 6:13:46 PM
TRMB,Trimble and Infotech to Streamline Inspection Measurement Workflows for Civil Infrastructure Projects,6/23/2021 12:30:00 PM
TRMB,Oslo Metropolitan University in Norway to Establish Trimble Technology Lab for Civil Engineering and Energy Technology,6/22/2021 12:30:00 PM
TRMB,Trimble and Doosan North America Announce Factory-Installed Machine Control Solution for Doosan Crawler Excavators,6/17/2021 12:30:00 PM
TRMB,Trimble offloads its Iron Solutions business to Randall-Reilly,6/16/2021 5:39:18 PM
TRMB,SPCE Stock: Virgin Galactic Soars as Investors Bet Big on Commercial Launch,5/24/2021 12:24:56 PM
TRMB,Trimble Unveils VRS Now Correction Services To Norway ,5/14/2021 12:47:27 PM
TRMB,7 of Elon Musk’s Favorite Stocks (And Why You Should Care),5/12/2021 2:01:51 PM
TRMB,Trimble Q1 2021 Earnings Preview,5/4/2021 9:35:34 PM
TRMB,Trimble Navigation earnings: here's what Wall Street expects,5/3/2021 3:01:44 PM
TRMB,ARKX: ARK Space Exploration & Innovation Is Another Bet on Cathie Wood,4/23/2021 9:01:40 AM
TRMB,The 7 Best-Performing ETFs Money Can Buy In 2021,4/21/2021 6:11:51 PM
TRMB,3 Reasons ARK Space Exploration & Innovation Could Be a Disaster,4/19/2021 12:18:13 PM
TRMB,7 Space Stocks Riding the New ARKX ETF Into the Stratosphere,4/15/2021 9:01:58 AM
TRMB,Seeking Alpha Catalyst Watch,4/9/2021 5:30:00 PM
TRMB,Cathie Wood's ARK Innovation adds more DraftKings and Palantir shares,4/8/2021 12:18:11 PM
TRMB,"LendingClub, Trimble, ICE, Fate Therapeutics — What Cathie Wood's Ark Bought And Sold On Tuesday",4/7/2021 4:01:50 AM
TRMB,"Twitter, Trimble, 908 Devices, Tencent, Pluristem — What Cathie Wood's Ark Bought And Sold On Monday",4/6/2021 4:04:56 AM
TRMB,Trimble hits 52-week high after ARK Innovation initiates position,4/5/2021 5:48:09 PM
TRMB,Why Is John Deere Part Of The New Ark Funds Space ETF?,4/3/2021 3:39:32 PM
TRMB,ARKX Isn't The First Space ETF: Here's How The Others Have Performed,4/1/2021 9:41:28 PM
TRMB,"Cathie Wood's Ark Space Exploration ETF Has 'No Reason' To Exist, Says Cramer",3/31/2021 7:54:00 AM
TRMB,What Will the Stock Market Do Today? 3 Big Stories to Watch.,3/30/2021 2:04:58 PM
TRMB,The First 39 Companies In Cathie Wood's Ark Invest Space ETF,3/29/2021 10:50:07 PM
TRMB,MRI Software to buy Trimble's real estate and workplace solutions division,2/17/2021 5:03:27 PM
TRMB,Trimble Q4 Profit Down ,2/10/2021 11:51:42 PM
TRMB,Notable earnings after Wednesday's close,2/9/2021 10:35:50 PM
TRMB,10 Infrastructure Stocks That May Benefit From Biden’s Plan,2/8/2021 6:31:28 PM
TRMB,"Trimble (TRMB) +2% on move to S&P 500; YETI, HTH shift indexes",1/15/2021 10:25:37 PM
TRMB,Space names take off as ARK Invest jumps into sector with ETF,1/14/2021 12:55:38 PM
TRMB,Stocks That Hit 52-Week Highs On Tuesday,1/5/2021 4:26:30 PM
TRMB,Stocks That Hit 52-Week Highs On Tuesday,12/29/2020 4:32:13 PM
TRMB,Stocks That Hit 52-Week Highs On Monday,12/28/2020 4:22:20 PM
TRMB,Stocks That Hit 52-Week Highs On Tuesday,12/22/2020 4:30:53 PM
TRMB,Stocks That Hit 52-Week Highs On Friday,12/18/2020 8:42:01 PM
