Ticker,Title,Link
TRMB,Morgan Stanley lifts view on networking equipment sector; LITE stock +6.5% on upgrade to Overweight,12/15/2020 7:27:28 PM
TRMB,Trimble Inc. -- Moody's announces completion of a periodic review of ratings of Trimble Inc.,11/9/2020 5:25:00 PM
TRMB,Trimble Q3 Profit Rises ,11/4/2020 11:20:19 PM
TRMB,Trimble Q3 2020 Earnings Preview,11/3/2020 10:35:50 PM
TRMB,7 AI Stocks to Buy as Automation Advances,10/28/2020 6:52:09 PM
TRMB,Trimble and Boston Dynamics announce strategic alliance to extend the use of autonomous robots in construction,10/20/2020 10:57:07 AM
TRMB,Here's what to expect from Trimble Navigation's earnings,8/4/2020 3:03:46 PM
TRMB,10 Robotics Stocks on the Technological Cutting Edge,6/18/2020 4:05:39 PM
TRMB,Trimble Sells REF TEK Seismic Monitoring Unit To Xeos; Terms Not Disclosed ,5/18/2020 12:53:28 PM
TRMB,"Trimble +7% after Q1 beats, suspends outlook",5/7/2020 1:59:47 PM
TRMB,Trimble Q1 Profit Beats Street View ,5/6/2020 11:31:27 PM
TRMB,Trimble Navigation earnings: here's what to expect,5/5/2020 3:01:45 PM
TRMB,Rocket Lab's CEO sees long 'slog' for space industry,5/3/2020 4:31:46 PM
TRMB,Trimble Inc. -- Moody's announces completion of a periodic review of ratings of Trimble Inc.,3/4/2020 9:31:00 PM
TRMB,Trimble Q4 Profit Tops Estimates; Issues Guidance ,2/12/2020 11:54:46 PM
TRMB,Trimble Navigation earnings preview: what Wall Street is expecting,2/11/2020 3:02:13 PM
TRMB,What Wall Street expects from Trimble Navigation's earnings,7/30/2019 3:03:13 PM
TRMB,Trimble Inc. -- Moody's announces completion of a periodic review of ratings of Trimble Inc.,5/17/2019 8:25:00 PM
TRMB,Trimble Navigation earnings preview: what to expect,4/29/2019 3:02:38 PM
TRMB,Trimble Navigation is about to announce its earnings — here's what to expect,2/4/2019 3:02:00 PM
TRMB,What Wall Street expects from Trimble Navigation's earnings,10/30/2018 3:03:29 PM
TRMB,Trimble Acquires Privately-held Veltec ,10/8/2018 3:12:30 PM
TRMB,Here's what Wall Street expects from Trimble Navigation's earnings report,7/31/2018 3:02:52 PM
TRMB,Trimble Enables Water Utilities to Reduce Water Loss and Operating Costs with Comprehensive IoT and Smart Water Monitoring Solution,6/12/2018 12:31:00 PM
TRMB,New Trimble Basis Software Captures Actual Workspace Utilization to Power Data-Driven Decisions,6/11/2018 12:30:00 PM
TRMB,Trimble Inc. -- Moody's rates Trimble's sr uns notes at Baa3,6/7/2018 4:08:00 PM
TRMB,"HarvestMark and iFood Partner to Offer a Comprehensive Food Safety, Traceability and Quality Management Platform",5/31/2018 12:30:00 PM
TRMB,Trimble to Host 2018 Investor Day,5/15/2018 12:30:00 PM
TRMB,Trimble Launches New Version of its Manhattan IWMS Software for Real Estate Portfolio Management,5/10/2018 12:31:00 PM
TRMB,Trimble Business Center Software Adds New Vertical Solutions Support and Streamlines Field-to-Office Productivity,5/9/2018 12:30:00 PM
TRMB,Trimble Adds Crop Health Imagery and Works Orders to its Agriculture Software,5/8/2018 12:30:00 PM
TRMB,Trimble Reports First Quarter 2018 Results,5/7/2018 10:05:00 PM
TRMB,Trimble First Quarter 2018 Earnings Call and Web Cast,4/26/2018 12:30:00 PM
TRMB,Redwood Trust Announces Timing For First Quarter 2018 Earnings Release And Earnings Call,4/25/2018 10:15:00 PM
TRMB,Hortonworks and Trimble Partner to Enhance Logistics and Transportation Industry with Data,4/24/2018 3:00:00 PM
TRMB,Trimble To Acquire Viewpoint From Bain Capital In $1.2 Bln Deal - Quick Facts ,4/23/2018 11:08:55 PM
TRMB,Trimble Acquires the Assets of FabSuite to Expand its Steel Fabrication Software Portfolio,4/20/2018 10:15:00 PM
TRMB,Trimble Adds New Distributor to its Global Vantage Network for Agriculture in Hungary,4/19/2018 12:30:00 PM
TRMB,Trimble Announces New Field Solutions for Land and Construction Surveying,4/18/2018 12:30:00 PM
TRMB,Trimble's Forensics Solution Enables Efficient Data Collection for Crash and Crime Scene Investigators,4/10/2018 12:31:00 PM
TRMB,"Coillte Completes ""Go-Live"" of Trimble's Connected Forest Solution",4/4/2018 12:30:00 PM
TRMB,Trimble Manhattan Software Certified for FASB ASC 842 and IASB IFRS 16 Lease Accounting Compliance,3/27/2018 12:30:00 PM
TRMB,Trimble Introduces Tekla 2018 BIM Software Solutions,3/22/2018 11:30:00 AM
TRMB,Trimble's Cloud-Based Seismic Monitoring Transforms Earthquake Event Reporting for Buildings,3/14/2018 11:30:00 AM
TRMB,Trimble Announces Call for Speakers for its 2018 Dimensions International User Conference,3/13/2018 11:30:00 AM
TRMB,Trimble Launches Trimble Foundation,3/8/2018 12:30:00 PM
TRMB,Trimble RTX Technology Plays Key Role in General Motors' Super Cruise,2/22/2018 12:30:00 PM
TRMB,"Swedish Train Operator SJ Selects Trimble Rail Systems for Remote Diagnostics, Condition Monitoring and Analytics",2/21/2018 12:30:00 PM
TRMB,Trimble Partners with Aquarius Spectrum to Add Leak Detection and Monitoring Solutions to its Smart Water Portfolio for Utilities,2/15/2018 12:30:00 PM
TRMB,Trimble Reports Fourth Quarter and Full Year 2017 Results,2/8/2018 10:05:00 PM
TRMB,Trimble Appoints New Board Member,2/6/2018 10:05:00 PM
TRMB,Trimble Inc. -- Moody's says Trimble's acquisition of e-Builder is a credit negative development,2/5/2018 5:06:00 PM
TRMB,Trimble Acquires e-Builder to Expand its Construction Management Solutions,2/2/2018 3:00:00 PM
TRMB,Trimble Introduces Next Generation GNSS Reference Receiver,1/31/2018 12:30:00 PM
TRMB,Trimble Fourth Quarter and Full Year 2017 Earnings Call and Web Cast,1/25/2018 12:31:00 PM
TRMB,Toronto Hydro aiming to improve electrical safety awareness,1/15/2018 5:19:00 PM
TRMB,VolkerWessels and Trimble Working Together to Drive BIM Technology Innovation,1/9/2018 12:30:00 PM
TRMB,Trimble Acquires Stabiplan - Quick Facts ,1/4/2018 12:39:23 PM
TRMB,"BRIEF-Trimble Partners With Calamp To Deliver Fleet And Asset Management Solutions (CAMP, TRMB)",1/3/2018 12:42:09 PM
TRMB,"New Trimble Technology Lab at the National College for High Speed Rail Expands Training and Research for Rail Design, Construction and Maintenance",12/7/2017 12:30:00 PM
TRMB,"PRESS DIGEST - Wall Street Journal - Nov 28 (9984, SIE, TRMB, MSFT, SAP, WFC)",11/28/2017 7:12:05 AM
TRMB,"UPDATE 1-U.S. charges 3 Chinese with hacking Siemens, Trimble, Moody's (SIE, TRMB)",11/27/2017 6:57:05 PM
TRMB,Trimble Adds Distributors to its Global Vantage Network for Agriculture,11/16/2017 12:30:00 PM
TRMB,Industry and Academic Veteran Kate Canales Joins College of Fine Arts as New Chair of the Department of Design,11/15/2017 3:00:00 PM
TRMB,Céline Dion Adds New 2018 Show Dates To Her Critically-Acclaimed Las Vegas Residency At The Colosseum At Caesars Palace,11/13/2017 7:00:00 PM
TRMB,Trimble Transforms Workspace Scheduling with LiveSign Pro Touch Panels,11/8/2017 12:30:00 PM
TRMB,Trimble Named a Leader in 2017 Green Quadrant for Integrated Workplace Management Systems,11/2/2017 11:30:00 AM
TRMB,Sciton Announces Collaboration with Michelson Diagnostics Ltd. to Develop OCT Image-Guided Laser Applications,11/1/2017 4:00:00 PM
TRMB,Flex Logix to Provide Embedded FPGA IP to 'DesignShare' for SiFive Freedom Platform,10/31/2017 1:00:00 PM
TRMB,Trimble Introduces ISOBUS-Compatible GFX-750 Display System with Advanced Guidance Controller for Agriculture Applications,10/30/2017 11:30:00 AM
TRMB,BRIEF-Trimble reports Q3 earnings $0.22/shr (TRMB),10/26/2017 11:17:08 PM
TRMB,Pedernales Electric Cooperative Goes Live with Trimble's Network Information System,10/23/2017 12:30:00 PM
TRMB,SITECH Technology Dealer Established in Japan to Serve Heavy Civil Construction Contractors,10/19/2017 12:30:00 PM
TRMB,Trimble Third Quarter 2017 Earnings Call and Web Cast,10/12/2017 12:30:00 PM
TRMB,"Trimble Begins Construction on Campus Expansion in Westminster, Colorado",10/5/2017 12:30:00 PM
TRMB,Trimble Enhances Optical Portfolio with the Next-Generation Mechanical Total Stations,9/26/2017 12:36:00 PM
TRMB,Trimble Registers FMCSA-Compliant ELD Solution,9/21/2017 12:30:00 PM
TRMB,Trimble Introduces Lower Power GNSS-Inertial Boards for High Precision and Control Applications,9/20/2017 12:30:00 PM
TRMB,Trimble Acquires Transportation Supply Chain Visibility Provider 10-4 Systems,9/13/2017 10:05:00 PM
TRMB,"How These Scientific Instruments Stocks are Performing? -- Coherent, Cognex, Trimble, and FLIR Systems",9/7/2017 1:00:00 PM
TRMB,Top Civic Leaders to Discuss the Intersection of Technology and Government at 2017 Women in STEM Conference,8/22/2017 9:07:00 PM
TRMB,Jetlore Named a Global Leader in Cloud Computing,8/17/2017 12:00:00 PM
TRMB,Zentera Systems Wins Best of Show Award at IoT Evolution Expo Las Vegas 2017,8/2/2017 11:54:00 PM
TRMB,Trimble Announces Factory-Fit Machine Control Solution for Sumitomo Excavators,8/1/2017 9:30:00 PM
TRMB,BRIEF-Trimble adds U.S. distributors to its Vantage distribution network (TRMB),7/31/2017 12:42:05 PM
TRMB,Trimble Introduces New Android Application for Field Surveying and Data Collection,7/26/2017 12:30:00 PM
TRMB,CNH Industrial and Trimble Announce Data Sharing Connectivity,7/25/2017 12:31:00 PM
TRMB,"BRIEF-Trimble and Komatsu collaborate to improve interoperability for mixed fleet earthworks customers (TRMB, 6301)",7/14/2017 1:00:09 PM
TRMB,BRIEF-Trimble and Propeller Aero collaborate to deliver professional quality unmanned aircraft system workflows (TRMB),7/13/2017 1:00:06 PM
TRMB,Applanix and the University of Waterloo Collaborate on Advanced Guidance and Control Technologies for Autonomous Vehicles,6/29/2017 2:00:00 PM
TRMB,Trimble Adds Galileo Support to its VRS Now Correction Service to Improve Network Positioning Performance in Europe,6/15/2017 12:30:00 PM
TRMB,"CORRECTED-Born-again BlackBerry: Canadian icon hopes to ride trucks to growth (TOM2, TRMB, VZ, T)",6/13/2017 7:02:03 PM
TRMB,"Born-again BlackBerry: Canadian icon hopes to ride trucks to growth (TOM2, TRMB, VZ, T)",6/9/2017 2:02:08 PM
TRMB,Trimble RTX Corrections Gets Boost in Performance from the Galileo Constellation,6/1/2017 12:30:00 PM
TRMB,Euromaint Rail Deploys Trimble's Real-Time Remote Diagnostic System to Enhance Fleet Reliability and Availability,5/31/2017 12:30:00 PM
TRMB,BRIEF-Trimble acquires NM Group to expand its energy portfolio to provide visual and 3D asset management (TRMB),5/30/2017 1:02:03 PM
TRMB,BRIEF-Trimble to acquire Müller-Elektronik (TRMB),5/24/2017 3:30:05 PM
TRMB,BRIEF-Trimble Fordaq SA to distribute trimble's collaborative software (TRMB),5/8/2017 12:58:10 PM
TRMB,Trimble and Yutong Bring Innovation to Dynamic Compaction,5/2/2017 12:30:00 PM
TRMB,BRIEF-Trimble reports Q1 non-GAAP earnings per share $0.33 (TRMB),4/27/2017 10:23:09 PM
TRMB,Harmonic Pushes OTT QoE to New Heights at the 2017 NAB Show,4/23/2017 2:30:00 AM
TRMB,BRIEF-Trimble announces new reporting segments (TRMB),4/13/2017 10:25:01 PM
TRMB,Trimble Introduces Industry-First Variable Rate Irrigation Pressure Regulating Technology for Center Pivots,4/11/2017 12:30:00 PM
TRMB,BRIEF-Trimble Inc says it has acquired Canadian-based BOS Forestry (TRMB),4/10/2017 1:03:11 PM
TRMB,"Research Reports on Scientific & Technical Instruments Equities -- Fitbit, Transgenomic, Sensata Technologies, and Trimble",4/6/2017 12:30:00 PM
TRMB,Trimble Unity Smart Water Management Software Adds Wireless Monitoring to Streamline Utility Operations,4/5/2017 12:30:00 PM
TRMB,PeopleNet First Major Fleet Management Provider to Offer 4G LTE Network Coverage for Fleets Operating in North America,3/30/2017 8:49:00 PM
TRMB,Trimble Adds Partners in Europe and North America to its Global Vantage Distribution Network for Agriculture,3/28/2017 12:30:00 PM
TRMB,BRIEF-Trimble says CEO Steven Berglund's 2016 total compensation $7.7 mln vs $8.8 mln in 2015 - SEC Filing (TRMB),3/23/2017 11:00:48 PM
TRMB,New Forests to Manage its Asian-Based AFI Investment with Trimble's Connected Forest Solution,3/22/2017 11:30:00 AM
TRMB,Valley Irrigation to Distribute Trimble Irrigation Solution,3/21/2017 11:30:00 AM
TRMB,BRIEF-Trimble partners with Railhead Corporation (TRMB),3/9/2017 12:56:22 PM
TRMB,"BRIEF-Caterpillar and Trimble partners to bring on-highway telematics to construction operations (CAT, TRMB)",3/8/2017 12:52:23 PM
TRMB,Trimble and K-Tec Earthmovers Introduce Trimble Ready Factory Option for Scrapers,3/7/2017 12:33:00 PM
TRMB,Loudoun Water Chooses Trimble Unity to Extend SAP Solutions and Esri GIS into the Field,3/6/2017 12:30:00 PM
TRMB,Trimble Acquires Savcor Oy and Silvadata to Expand its Global Reach and SaaS Solutions for the Forest Industry,3/3/2017 9:03:00 PM
TRMB,Trimble Introduces the Next Generation of Grade Control for Excavators and Dozers,3/1/2017 12:30:00 PM
TRMB,BRIEF-Trimble Q4 GAAP earnings per share $0.15 (TRMB),2/8/2017 10:26:09 PM
TRMB,BRIEF-Trimble to sell its ThingMagic RFID business to Novanta (TRMB),1/5/2017 11:56:04 PM
TRMB,"BRIEF-Trimble, Umbra to explore integration of technologies to optimize 3D data (TRMB)",12/14/2016 1:02:05 PM
TRMB,BRIEF-Trimble to acquire building data to expand constructible model and BIM content offering for construction (TRMB),11/7/2016 2:16:18 PM
TRMB,"BRIEF-Caterpillar and Trimble to expand mining technology collaboration (CAT, TRMB)",11/4/2016 12:42:18 PM
TRMB,BRIEF-Trimble sells its unmanned aircraft system business to Delair-Tech (TRMB),10/10/2016 9:20:20 PM
