Ticker,Title,Link
RGA,Piper Sandler Keeps Their Buy Rating on Reinsurance Group (RGA),9/4/2024 10:55:37 AM
RGA,"Insurance industry faces $151B of losses from natural catastrophes, Verisk says",9/3/2024 5:58:59 PM
RGA,RGA Enters Coinsurance Transaction With American National Insurance - Quick Facts ,8/27/2024 3:35:48 PM
RGA,Industrial and financial stocks with the largest net increases in hedge fund popularity - GS,8/21/2024 7:45:04 PM
RGA,Morgan Stanley Sticks to Its Hold Rating for Reinsurance Group (RGA),8/19/2024 1:08:36 PM
RGA,Buy Rating Affirmed for RGA on GLP-1 Drug Impact and Positive Growth Prospects,8/9/2024 12:13:45 PM
RGA,Buy Rating Affirmed on RGA for Strong Q2 Performance and Strategic Capital Deployment,8/5/2024 12:35:38 PM
RGA,Reinsurance Group America Inc hosts conference call for investors,8/2/2024 2:45:01 PM
RGA,"Reinsurance Group of America Non-GAAP EPS of $5.48 beats by $0.39, revenue of $4.88B misses by $260M",8/1/2024 8:47:06 PM
RGA,Reinsurance Group of America Q2 2024 Earnings Preview,7/31/2024 9:35:39 PM
RGA,Reasons Why Investors Should Retain Sun Life Stock Now,7/10/2024 5:18:08 PM
RGA,Should You Retain Trupanion Stock in Your Portfolio?,7/8/2024 6:26:45 PM
RGA,Piper Sandler Keeps Their Buy Rating on Reinsurance Group (RGA),6/28/2024 10:50:03 AM
RGA,New Strong Buy Stocks for June 17th,6/17/2024 7:01:09 PM
RGA,Reinsurance Group: Solid Growth and Strong Capital Position Balanced with Cautious Hold Rating,6/14/2024 10:19:01 AM
RGA,"Analysts Are Bullish on These Financial Stocks: PayPal Holdings (PYPL), Reinsurance Group (RGA)",6/10/2024 10:50:32 AM
RGA,"Analysts Offer Insights on Financial Companies: American Express (AXP), Hamilton Lane (HLNE) and Reinsurance Group (RGA)",6/6/2024 5:31:32 AM
RGA,Reinsurance Group Of America Says Axel Andre To Succeed Todd Larson As CFO ,5/29/2024 3:12:01 PM
RGA,Reinsurance Group (RGA) Gets a Buy from Piper Sandler,5/28/2024 11:06:25 AM
RGA,"Analysts Offer Insights on Financial Companies: Reinsurance Group (RGA), Truist Financial (TFC) and Upstart Holdings (UPST)",5/14/2024 11:20:09 AM
RGA,Wall Street Analysts Are Bullish on Top Financial Picks,5/11/2024 1:50:55 AM
RGA,"Analysts Offer Insights on Financial Companies: Mid Penn Bancorp (MPB), Ares Management (ARES) and Reinsurance Group (RGA)",5/3/2024 12:13:53 PM
RGA,"Reinsurance Group of America Non-GAAP EPS of $6.02 beats by $1.45, revenue of $6.34M misses by $4.54B",5/2/2024 8:34:49 PM
RGA,Reinsurance Group of America Q1 2024 Earnings Preview,5/1/2024 9:35:41 PM
RGA,RBC Capital Remains a Buy on Reinsurance Group (RGA),4/12/2024 10:46:11 AM
RGA,Reinsurance Group (RGA) Gets a Buy from Piper Sandler,4/5/2024 10:47:04 AM
RGA,Manulife agrees to reinsure $4.3B of policies with RGA Canada,3/25/2024 3:15:51 PM
RGA,Prudential Financial records seventh consecutive session of gains,3/13/2024 8:01:15 PM
RGA,"Prudential, Reinsurance Group of America nab $5.9B Verizon pension deal",3/6/2024 10:45:03 PM
RGA,RBC Capital Maintains Outperform Rating for Reinsurance Gr: Here's What You Need To Know,2/5/2024 6:00:25 PM
RGA,"Analysts Conflicted on These Financial Names: Reinsurance Group (RGA), PennyMac Financial (PFSI) and Aon (AON)",2/2/2024 1:10:11 PM
RGA,"Reinsurance Group of America Non-GAAP EPS of $4.73 beats by $0.27, revenue of $5.01B beats by $450M",2/1/2024 9:23:28 PM
RGA,Reinsurance Group of America Q4 2023 Earnings Preview,1/31/2024 10:35:35 PM
RGA,Where Reinsurance Gr Stands With Analysts,12/11/2023 4:00:13 PM
RGA,Reinsurance Group (RGA) Gets a Buy from Goldman Sachs,12/4/2023 1:55:31 PM
RGA,Analyst Ratings for Reinsurance Gr,11/15/2023 6:00:33 PM
RGA,"Analysts Conflicted on These Financial Names: Reinsurance Group (RGA), Swiss Re AG (OtherSSREF) and Federated Hermes (FHI)",11/6/2023 12:11:38 PM
RGA,"Analysts Offer Insights on Financial Companies: Intercontinental Exchange (ICE), Hanover Insurance (THG) and Reinsurance Group (RGA)",11/3/2023 10:50:43 AM
RGA,Analysts’ Opinions Are Mixed on These Financial Stocks: Thomson Reuters (TRI) and Reinsurance Group (RGA),11/2/2023 10:30:14 PM
RGA,Reinsurance Group America earnings: here's what to expect,11/1/2023 3:01:13 PM
RGA,Analyst Expectations for Reinsurance Gr's Future,10/6/2023 4:00:33 PM
RGA,Expert Ratings for Reinsurance Gr,9/14/2023 6:00:57 PM
RGA,Reinsurance Group of America goes ex-dividend on Monday,8/11/2023 7:30:00 PM
RGA,"Analysts Conflicted on These Financial Names: Reinsurance Group (RGA), Bank Of Montreal (BMO) and Rocket Companies (RKT)",8/9/2023 1:50:14 AM
RGA,Analysts’ Opinions Are Mixed on These Financial Stocks: JPMorgan Chase & Co. (JPM) and Reinsurance Group (RGA),8/7/2023 9:20:39 AM
RGA,9 Analysts Have This to Say About Reinsurance Gr,8/4/2023 10:00:20 PM
RGA,Wells Fargo Reaffirms Their Buy Rating on Reinsurance Group (RGA),8/3/2023 9:55:08 PM
RGA,Reinsurance Group America earnings: here's what Wall Street expects,8/2/2023 3:01:13 PM
RGA,RBC Capital Sticks to Their Buy Rating for Reinsurance Group (RGA),7/15/2023 1:47:30 AM
RGA,Analyst Ratings for Reinsurance Gr,6/23/2023 11:01:08 PM
RGA,"Analysts’ Top Financial Picks: Palomar Holdings (PLMR), Reinsurance Group (RGA)",6/20/2023 12:20:05 PM
RGA,Stocks ignored by the narrow rally: here are Goldman's top cyclical laggards,6/19/2023 7:00:00 PM
RGA,"Analysts Offer Insights on Financial Companies: Reinsurance Group (RGA), Discover Financial Services (DFS) and American Express (AXP)",6/16/2023 4:32:43 PM
RGA,Wells Fargo Sticks to Their Buy Rating for Reinsurance Group (RGA),6/15/2023 6:05:07 PM
RGA,"‘Load Up,’ Says Raymond James About These 3 ‘Strong Buy’ Stocks",6/12/2023 2:42:58 PM
RGA,11 Analysts Have This to Say About Reinsurance Gr,6/7/2023 9:02:16 PM
RGA,Reinsurance Group of America prices $400M senior notes,6/5/2023 8:39:43 PM
RGA,Citi Remains a Buy on Reinsurance Group (RGA),5/23/2023 4:25:06 PM
RGA,Wells Fargo Sticks to Their Buy Rating for Reinsurance Group (RGA),5/15/2023 8:25:31 PM
RGA,Piper Sandler Keeps Their Buy Rating on Reinsurance Group (RGA),5/5/2023 11:16:40 AM
RGA,Wells Fargo Sticks to Its Buy Rating for Reinsurance Group (RGA),5/4/2023 10:25:08 PM
RGA,Notable earnings after Thursday's close,5/3/2023 9:35:33 PM
RGA,"Benzinga's Top Ratings Upgrades, Downgrades For April 25, 2023",4/25/2023 5:00:39 PM
RGA,Analyst Expectations for Reinsurance Gr's Future,4/20/2023 5:01:39 PM
RGA,RBC Capital Keeps Their Buy Rating on Reinsurance Group (RGA),4/13/2023 12:35:10 PM
RGA,Corebridge stock upgraded to Buy at Goldman as valuation overstates risks,4/4/2023 3:15:14 PM
RGA,Apollo and Reinsurance Group of America unit collaborate on $500M notes product,3/30/2023 8:42:14 PM
RGA,5 Undervalued Insurance Stocks with High Dividend Yields and Low Payout Ratios,3/19/2023 2:44:52 AM
RGA,"Benzinga's Top Ratings Upgrades, Downgrades For March 15, 2023",3/15/2023 4:00:42 PM
RGA,"KBW outlines 11 financials stocks to buy after SIVB, SBNY fallout",3/13/2023 2:15:49 PM
RGA,"Everest Re tops the week's financial winners, while Lufax declines the most",2/11/2023 3:20:00 PM
RGA,RBC Capital Sticks to Their Buy Rating for Reinsurance Group (RGA),2/7/2023 1:45:14 AM
RGA,Wall Street Analysts Are Neutral on Top Financial Picks,2/6/2023 11:22:15 AM
RGA,Reinsurance Group of America declares $0.80 dividend,2/2/2023 9:46:33 PM
RGA,Notable earnings after Thursday's close,2/1/2023 10:35:38 PM
RGA,"Nearly half of U.S. consumers shop for life insurance online, undermining agents",1/14/2023 7:49:00 PM
RGA,Morgan Stanley Sticks to Their Hold Rating for Reinsurance Group (RGA),1/10/2023 4:25:38 PM
RGA,"Prudential, MetLife and Hartford Financial downgraded at Goldman Sachs",1/9/2023 4:55:37 PM
RGA,Where Reinsurance Group Stands With Analysts,1/5/2023 5:00:43 PM
RGA,Reinsurance Group of America closes $1.7B longevity swap deal,12/15/2022 10:20:46 PM
RGA,Reinsurance Group of America upped to Outperform at RBC on earnings growth potential,12/6/2022 9:30:20 PM
RGA,Reinsurance Group of America goes ex-dividend on Monday,11/11/2022 10:11:00 PM
RGA,Reinsurance Group of America to redeem debentures due 2042,11/10/2022 1:19:56 PM
RGA,Barclays Maintains Equal-Weight Rating for Reinsurance Group: Here's What You Need To Know,11/8/2022 5:15:18 PM
RGA,"Reinsurance Group of America Non-GAAP EPS of $5.20, revenue of $3.25B",11/3/2022 8:23:41 PM
RGA,Reinsurance Group of America Q3 2022 Earnings Preview,11/2/2022 9:35:32 PM
RGA,Expert Ratings for Reinsurance Group,10/31/2022 7:42:15 PM
RGA,Analyst Ratings for Reinsurance Group,10/14/2022 10:11:56 PM
RGA,"Citi picks best Buy and Sell stocks in all sectors, leaning to quality and momentum",9/18/2022 12:26:48 PM
RGA,"iRobot, Fox Factory, TripAdvisor And Some Other Big Gainers From Friday",8/8/2022 11:13:41 AM
RGA,"Why Cooper-Standard Is Trading Higher By 70%, Here Are 81 Stocks Moving In Friday's Mid-Day Session",8/5/2022 6:53:59 PM
RGA,Reinsurance Group of America raised dividend by 10% to $0.80,8/4/2022 9:31:16 PM
RGA,What 7 Analyst Ratings Have To Say About Reinsurance Group,8/3/2022 10:11:03 PM
RGA,UBS reveals its highest conviction stock picks for the rest of 2022,7/31/2022 6:57:28 PM
RGA,6 Analysts Have This to Say About Reinsurance Group,7/6/2022 6:06:20 PM
RGA,"Benzinga's Top Ratings Upgrades, Downgrades For June 2, 2022",6/2/2022 4:08:41 PM
RGA,Analyst Ratings for Reinsurance Group,5/24/2022 8:07:20 PM
RGA,"Benzinga's Top Ratings Upgrades, Downgrades For May 19, 2022",5/19/2022 4:03:58 PM
RGA,Reinsurance Group of America goes ex dividend tomorrow,5/13/2022 5:08:54 PM
RGA,"Unum leads week's gainers, while ICE falls after $13B deal: Financials roundup",5/7/2022 2:10:00 PM
RGA,"Reinsurance Group of America GAAP EPS of -$0.93 beats by $0.17, revenue of $3.93B beats by $40M",5/5/2022 8:28:18 PM
RGA,Reinsurance Group of America Q1 2022 Earnings Preview,5/4/2022 9:35:55 PM
RGA,Reinsurance Group of America buys minority stake in Velocity Capital Advisors,3/24/2022 8:47:02 PM
RGA,Reinsurance Group of America declares $0.73 dividend,2/3/2022 9:45:00 PM
RGA,Reinsurance Group of America Q4 2021 Earnings Preview,2/2/2022 10:35:15 PM
RGA,"Benzinga's Top Ratings Upgrades, Downgrades For January 26, 2022",1/26/2022 4:04:00 PM
RGA,"Benzinga's Top Ratings Upgrades, Downgrades For January 21, 2022",1/21/2022 4:04:17 PM
RGA,Reinsurance Group of America CEO sees short-term uncertainty prevailing amid Omicron spread,12/9/2021 1:52:22 PM
RGA,"Catalyst watch for next week: Rivian ratings pour in, big events for Southwest Airlines, McKesson and CVS Health",12/3/2021 8:00:27 PM
RGA,Chinese wealth management firm sinks the most of financial stocks in past week,11/27/2021 1:45:00 PM
RGA,Crypto stocks outshine the financial sector even as Bitcoin stalls,11/6/2021 12:45:00 PM
RGA,"Reinsurance Group of America, Inc. -- Moody’s affirms RGA’s ratings; changes outlook to stable",11/5/2021 5:51:00 PM
RGA,Reinsurance Group of America declares $0.73 dividend,11/4/2021 9:47:31 PM
RGA,Reinsurance Group of America Q3 2021 Earnings Preview,11/3/2021 9:35:58 PM
RGA,ERM Funding plc Series 2021-1 -- Moody's assigns provisional ratings to ERM Funding plc Series 2021-1 RMBS,10/29/2021 8:03:00 PM
RGA,"Reinsurance Group of America EPS beats by $2.78, beats on revenue",8/3/2021 8:29:42 PM
RGA,Notable earnings after Tuesday's close,8/2/2021 9:35:38 PM
RGA,Analyst Ratings For Reinsurance Group,7/15/2021 8:31:39 PM
RGA,"Benzinga's Top Ratings Upgrades, Downgrades For July 12, 2021",7/12/2021 4:03:00 PM
RGA,"Reinsurance Group of America, Inc. -- Moody's announces completion of a periodic review of ratings of Reinsurance Group of America, Inc.",6/29/2021 10:43:00 PM
RGA,Insurance Stocks Moving In Friday's Intraday Session,5/7/2021 6:52:44 PM
RGA,Reinsurance Group of America declares $0.70 dividend,5/6/2021 10:04:22 PM
RGA,Reinsurance Group of America Q1 2021 Earnings Preview,5/5/2021 9:35:56 PM
RGA,Reinsurance Group America is about to announce its earnings — here's what Wall Street expects,5/4/2021 3:02:12 PM
RGA,Reinsurance Group of America declares $0.70 dividend,2/8/2021 10:19:39 PM
RGA,Reinsurance Group of America Q4 2020 Earnings Preview,2/7/2021 10:35:00 PM
RGA,What Wall Street expects from Reinsurance Group America's earnings,2/6/2021 3:01:22 PM
RGA,"Benzinga's Top Ratings Upgrades, Downgrades For January 29, 2021",1/29/2021 4:04:37 PM
RGA,Reinsurance Group of America goes ex-dividend on Monday,11/13/2020 4:58:28 PM
RGA,Notable earnings after Thursday's close,11/4/2020 10:35:58 PM
RGA,UBS drills down on strategy for a Q3 to feature big beats - but a high bar,10/6/2020 11:16:37 PM
RGA,Stock Alert: Reinsurance Group Of America Shares Up 11% ,8/5/2020 4:13:32 PM
RGA,Here's what Wall Street expects from Reinsurance Group America's earnings report,8/3/2020 3:01:57 PM
RGA,"Reinsurance Group of America, Inc. -- Moody's announces completion of a periodic review of ratings of Reinsurance Group of America, Inc.",7/28/2020 5:29:00 PM
RGA,"Reinsurance Group of America gets BCR approval as controller, processor",6/18/2020 8:56:32 PM
RGA,Reinsurance Group of America prices $600M debt offering,6/5/2020 10:13:34 AM
RGA,"Reinsurance Group of America, Inc. -- Moody’s rates RGA’s senior notes Baa1; negative outlook",6/4/2020 11:07:00 PM
RGA,"LYFT, CRWD, MCHP and PGEN among after-hours movers",6/2/2020 9:33:57 PM
RGA,"Reinsurance Group of America, Inc. -- Moody’s rates RGA’s new shelf registration—senior debt at (P)Baa1",5/27/2020 1:49:00 AM
RGA,Reinsurance Group Of America Inc Q1 Adjusted Earnings Miss View ,5/6/2020 5:41:39 AM
RGA,What Wall Street expects from Reinsurance Group America's earnings,5/4/2020 3:01:31 PM
RGA,KBW's Kreuger calculates life insurers' Covid-19 risk,3/27/2020 3:30:20 PM
RGA,Reinsurance Group Of America Q4 Profit Misses Estimates - Quick Facts ,1/28/2020 11:50:22 PM
RGA,Here's what to expect from Reinsurance Group America's earnings report,1/27/2020 3:01:28 PM
RGA,RGA Reinsurance Company -- Moody’s rates RGA Global Funding program (P)A1; stable outlook,12/14/2019 10:32:00 PM
RGA,RGA Reinsurance Company -- Moody’s rates RGA Global Funding program (P)A1; stable outlook,12/13/2019 10:52:00 PM
RGA,RGA Global Funding -- Moody’s rates RGA Global Funding program (P)A1; stable outlook,12/12/2019 12:34:00 AM
RGA,RGA Global Funding -- Moody’s rates RGA Global Funding program (P)A1; stable outlook,12/11/2019 11:58:00 PM
RGA,"Reinsurance Group of America, Inc. -- Moody's announces completion of a periodic review of ratings of Reinsurance Group of America, Inc.",8/19/2019 4:10:00 PM
RGA,Here's what Wall Street expects from Reinsurance Group America's earnings,7/28/2019 3:01:56 PM
RGA,"Reinsurance Group of America, Inc. -- Moody’s rates RGA’s senior notes Baa1, stable outlook",5/8/2019 11:46:00 PM
RGA,Here's what Wall Street expects from Reinsurance Group America's earnings report,4/28/2019 3:02:09 PM
RGA,Here's what Wall Street expects from Reinsurance Group America's earnings,1/27/2019 3:01:29 PM
RGA,"Reinsurance Group of America, Inc. -- Moody's affirms RGA's ratings; outlook stable",12/12/2018 11:18:00 PM
RGA,Reinsurance Group America earnings preview: what Wall Street is expecting,10/24/2018 3:02:28 PM
RGA,What Wall Street expects from Reinsurance Group America's earnings,7/25/2018 3:02:27 PM
RGA,BRIEF-RGA Says It Announced Completion Of Asset And Longevity Risk Transaction With Liverpool Victoria Friendly Society (RGA),12/19/2017 3:37:04 PM
RGA,BRIEF-Reinsurance Group of America reports Q3 earnings per share $3.47 (RGA),10/26/2017 11:07:17 PM
RGA,BRIEF-Reinsurance Group Of America Q2 earnings per share $3.54 (RGA),7/27/2017 10:42:03 PM
RGA,"Reinsurance Group of America, Inc. -- Moody's rates RGA's shelf (senior debt at (P) Baa1); stable outlook",7/18/2017 11:22:00 PM
RGA,BRIEF-Reinsurance Group of America enters into a letter of credit reimbursement agreement (RGA),5/19/2017 11:26:05 PM
RGA,BRIEF-Zurich Insurance reinsures $2.3 bln book with Reinsurance Group of America (RGA),5/18/2017 6:42:05 PM
RGA,"Financial Stocks on Investors' Radar -- HomeStreet, Columbia Banking, Reinsurance, and Cowen",3/24/2017 12:25:00 PM
