Ticker,Title,Link
HRL,GO NUTS ON GAME DAY WITH THE PLANTERS® BRAND AS KEN JEONG AND JOEL MCHALE FEED THE #PLANTERSALLORONE DEBATE,2/8/2022 2:00:00 PM
HRL,Hormel Foods Corporation Announces First Quarter Earnings Conference Call and Webcast,2/7/2022 11:30:00 PM
HRL,"Hormel Foods Announces Retirement of Fred Halvin, Vice President of Corporate Development",2/4/2022 2:00:00 PM
HRL,THE MAKERS OF THE PLANTERS® BRAND CREATE FIRST-EVER PERSONUTALITY QUIZ TO REVEAL WHAT YOUR NUTTY SNACKING HABITS SAY ABOUT YOU,2/3/2022 2:00:00 PM
HRL,3 Plant-Based Stocks to Buy for a Healthier Portfolio,1/28/2022 7:49:19 PM
HRL,Hormel Foods Highlights Record Net Sales at its Annual Meeting of Stockholders,1/27/2022 8:23:00 PM
HRL,5 Meat Stocks to Watch on Biden’s Monopoly Beef,1/26/2022 11:00:16 AM
HRL,THE PLANTERS® BRAND RETURNS TO THE BIG GAME WITH COMEDIC DUO KEN JEONG AND JOEL MCHALE,1/24/2022 5:00:00 PM
HRL,"Hormel Foods and Justin's Donate $10,000 to Conscious Alliance to Help those Impacted by Colorado Wildfires",1/11/2022 2:00:00 PM
HRL,Kroger and Altria outperform on bruising market day,1/10/2022 3:22:30 PM
HRL,"Hormel Foods Donates More Than 93,000 Pounds of Ham to Convoy of Hope to Help Families in Kentucky, Texas",1/5/2022 2:00:00 PM
HRL,DO YOU HAVE WHAT IT TAKES TO BE A PLANTERS® BRAND PEANUTTER?,1/4/2022 2:00:00 PM
HRL,Forbes Names Hormel Foods One of the World's Top Female-Friendly Companies,12/28/2021 6:00:00 PM
HRL,Packaged food stocks slip after General Mills hits an inflation headwind,12/21/2021 4:47:27 PM
HRL,Hormel Foods To Hold Virtual Annual Meeting of Stockholders,12/16/2021 12:00:00 AM
HRL,Piper Sandler Bumps Up Hormel Foods Price Target By 9%,12/10/2021 6:21:51 PM
HRL,Hormel Foods stock gains after Q4 earnings beat; sees double-digit sales growth in every segment,12/9/2021 4:37:34 PM
HRL,Hormel Foods Q4 2021 Earnings Preview,12/8/2021 5:31:04 PM
HRL,Hormel Foods Named One of America's Most Responsible Companies by Newsweek,12/7/2021 2:00:00 PM
HRL,"The Perfect Charcuterie Bite Is Now In Reach, Thanks To Columbus Craft Meats",12/1/2021 2:00:00 PM
HRL,"MR. PEANUT® And Reginald VelJohnson Bring Nutstalgia Back To The Holidays With New Music Video And Original Song ""A Nutty Holiday""",11/30/2021 3:00:00 PM
HRL,Hormel Foods Annual Profit Sharing Continues,11/24/2021 2:43:00 PM
HRL,Hormel Foods Corporation Announces 56th Consecutive Increase to Annual Dividend,11/22/2021 11:04:00 PM
HRL,Hormel Foods Receives Numerous Accolades for its Internship Program,11/12/2021 2:00:00 PM
HRL,Hormel Foods Recognized as a Best for Vets Employer for Ninth Year in a Row,11/11/2021 7:00:00 PM
HRL,"The Makers of HORMEL® BLACK LABEL® Bacon Launch Limited-Edition, Bacon-Scented and Printed Wrapping Paper for the Holidays",11/9/2021 3:00:00 PM
HRL,Hormel Foods Corporation Announces Fourth Quarter Earnings Conference Call and Webcast,11/8/2021 11:00:00 PM
HRL,"Jennie-O Dances into Thanksgiving with ""The Turkey Dance"" Challenge",11/3/2021 6:32:00 PM
HRL,Jennie-O Turkey Store Returns to the 2021 Macy's Thanksgiving Day Parade®,11/2/2021 3:03:00 PM
HRL,"Hormel Foods Announces the Retirement of Luis Marconi, Group Vice President, Grocery Products; Names Jeff Frank Successor",11/1/2021 10:00:00 PM
HRL,Hormel Foods Names Jacinth Smiley New CFO ,10/29/2021 1:01:16 PM
HRL,Jennie-O Thanksgiving Hotline Opens Nov. 1,10/14/2021 2:00:00 PM
HRL,"Catalyst Watch for next week: JPMorgan leads out big bank earnings; eyes on Plug Power, Alibaba and HubSpot",10/8/2021 6:30:13 PM
HRL,Hormel In New Partnership For Developing Plant-Based Foods,10/6/2021 4:52:46 PM
HRL,"Hormel Foods Films Holds the World Premiere of Out of the Smoke during its Spirit Week events, celebrating the SPAM® brand connection to Smokejumpers",9/29/2021 2:00:00 PM
HRL,Hormel Foods Corporation Declares Quarterly Dividend,9/27/2021 11:00:00 PM
HRL,Hormel Foods Shares Food Journey Progress in 15th Annual Corporate Responsibility Report,9/22/2021 2:00:00 PM
HRL,Jennie-O Turkey Store Shares 2021 Thanksgiving Trends And Predictions As Consumers Prep For The Holiday Season,9/21/2021 3:15:00 PM
HRL,Hormel Health Labs Revolutionizes Dysphagia Diet Baking with new THICK & EASY® TEXTURE MODIFIED BREAD AND DESSERT MIX,9/16/2021 2:00:00 PM
HRL,Go Nuts! The MR. PEANUT® Character Is Renting His Iconic NUTMOBILE™ Vehicle To Overnight Guests For First Time Ever,9/14/2021 4:13:00 PM
HRL,Hormel Foods to Webcast Presentation at the Barclays Global Consumer Staples Virtual Conference,9/7/2021 11:00:00 PM
HRL,Marathon Oil And Occidental Lead The S&P 500,9/2/2021 10:14:43 PM
HRL,Notable earnings before Thursday's open,9/1/2021 4:28:29 PM
HRL,Hormel Foods earnings: here's what Wall Street expects,8/31/2021 3:01:18 PM
HRL,Food stocks stumble after inflation keeps popping up on earnings calls,8/26/2021 6:21:58 PM
HRL,Hormel Foods Corporation Announces Date of 2021 Virtual Investor Update Presentation,8/23/2021 10:30:00 PM
HRL,Jennie-O Launches New Turkey Barbacoa Innovation for Foodservice,8/18/2021 4:30:00 PM
HRL,The Makers of Happy Little Plants® Brand Launch Plant-Based Pepperoni Style Topping,8/17/2021 2:00:00 PM
HRL,Hormel Foods Corporation Third Quarter Earnings Conference Call,8/10/2021 1:13:00 AM
HRL,"Tyson Foods rallies off boosted guidance, PPC and BYND also higher",8/9/2021 3:09:10 PM
HRL,"Sanderson Farms is said near $4.5B sale to Cargill, Continental Grain",8/8/2021 10:53:14 PM
HRL,7 Best Stocks to Buy if You Don’t Like to Take Chances,8/6/2021 3:28:17 PM
HRL,Hormel® Chili Brand on the Hunt for Fans' Most Creative Chili Recipes,8/5/2021 2:00:00 PM
HRL,The 10 Best Dividend Income Growers in the S&P 500,7/22/2021 8:40:28 PM
HRL,"The MR. PEANUT® Character Is Giving Away $100,000 To Shellebrate His Move To Minnesota As The PLANTERS® Brand Joins Hormel Foods",7/14/2021 2:00:00 PM
HRL,"Hormel Foods Featured on Selling Power's ""50 Best Companies to Sell For"" List in 2021",7/13/2021 2:00:00 PM
HRL,IIROC Trading Halt - HRL,7/8/2021 10:59:00 PM
HRL,The 10 Best ‘Bigger-Than-Small-Cap’ ‘Smaller-Than-Midcap’ Stocks to Buy Now ,7/7/2021 7:30:00 PM
HRL,10 Best Stocks to Buy to Build Up Passive Income Streams,6/24/2021 2:26:07 PM
HRL,"The Makers of the NATURAL CHOICE® Brand Partner with BBQ Legend Moe Cason for the Launch of the 2021 ""Good Feeds Us All Tour"" Across America",6/23/2021 6:00:00 PM
HRL,"Hormel Foods Donating 100,000 Meals to Hunger Partners During Tonight's Virtual Concert of Hope and Thanks for its 20,000 Global Team Members",6/8/2021 8:03:00 PM
HRL,3 Best Food Stocks to Play the Growing Plant-Based Food Trend,5/26/2021 4:28:59 PM
HRL,Hormel Foods declares $0.245 dividend,5/24/2021 9:04:51 PM
HRL,Mid-Afternoon Market Update: Dow Rises 150 Points; VF Corp Shares Fall On Downbeat Earnings,5/21/2021 8:49:25 PM
HRL,Mid-Afternoon Market Update: Dow Jumps 230 Points; Kohl's Shares Plummet,5/20/2021 8:31:22 PM
HRL,Hormel Foods Q2 2021 Earnings Preview,5/19/2021 6:42:12 PM
HRL,Hormel Foods is about to announce its earnings — here's what to expect,5/18/2021 3:01:24 PM
HRL,7 Fair Trade Stocks to Buy If You Want to #BuildBackFairer,5/10/2021 2:36:11 PM
HRL,Consumer companies warn on higher prices,4/29/2021 7:57:26 PM
HRL,Hormel Foods declares $0.245 dividend,3/22/2021 9:05:32 PM
HRL,Hormel Foods Corporation -- Moody's announces completion of a periodic review of ratings of Hormel Foods Corporation,3/3/2021 3:17:00 PM
HRL,7 Bypassed Value Stocks to Buy Before Speculators Catch On,2/23/2021 7:22:00 PM
HRL,Hormel Foods Corp Announces Decline In Q1 Bottom Line,2/18/2021 12:43:11 PM
HRL,Hormel Foods FQ1 2021 Earnings Preview,2/17/2021 6:26:50 PM
HRL,Kraft Heinz Is Shrinking to Fit Its Dividend,2/16/2021 9:47:16 PM
HRL,"Kraft Foods Group, Inc. (OLD) -- Moody's affirms Kraft Heinz's Baa3 unsecured rating, outlook revised to stable",2/12/2021 9:11:00 PM
HRL,Kraft Heinz To Sell Planters Snack Nut Portfolio To Hormel Foods For $3.35 Mln Cash - Quick Facts ,2/11/2021 1:30:43 PM
HRL,Kraft Heinz Likely To Sell Planters Brand To Hormel Foods In $3 Bln Deal: WSJ ,2/3/2021 6:43:56 AM
HRL,Kraft Heinz gains on report of deal to sell Planters to Hormel for $3B,2/2/2021 6:59:33 PM
HRL,3 Dividend Stocks to Buy That Will DRIP Steady Income,1/29/2021 12:16:28 PM
HRL,7 Safe Stocks to Buy for Solid Returns in Tumultuous Times,1/28/2021 3:48:43 PM
HRL,Beyond Meat Stock Bull Vs. Bear: 3 Things to Know Before Investing,12/4/2020 3:29:10 PM
HRL,Hormel expected to have tough time growing earnings,11/25/2020 2:59:49 PM
HRL,Hormel Foods (HRL) shares slide on FQ4 earnings miss,11/24/2020 1:08:40 PM
HRL,Hormel Foods increases dividend by ~5% to $0.245,11/23/2020 10:03:14 PM
HRL,Why Beyond Meat Stock Remains Beyond Perilous,11/20/2020 3:54:35 PM
HRL,3 Safe Dividend Stocks in a Double-Dip Recession,11/18/2020 2:57:10 PM
HRL,Columbus Craft Meats Launches Premium Charcuterie Boxes For Holiday Season ,11/12/2020 3:29:25 PM
HRL,Hormel Black Label Breakfast Food Truck To Give Away Free-sample - Quick Facts ,9/25/2020 2:41:05 PM
HRL,7 Fitness Stocks That Will Give Your Portfolio Some Muscle,9/11/2020 12:30:55 PM
HRL,7 Safe Dividend Stocks for Investors to Buy Right Now,9/1/2020 2:32:50 PM
HRL,Hormel Foods Expects Q4 To Mirror Many Dynamics Of Q3 - Quick Facts ,8/25/2020 12:49:25 PM
HRL,Hormel Foods earnings preview: what Wall Street is expecting,8/24/2020 3:01:30 PM
HRL,Beyond Meat Stock Needs ‘Second-Mover’ Advantage to Be a Real Winner,7/2/2020 2:21:09 PM
HRL,10 Stocks With Little or No Debt to Own for the Next 50 Years ,6/12/2020 12:33:58 PM
HRL,Beyond Meat Stock Is Priced Far Beyond Its Fundamentals,6/11/2020 5:52:04 PM
HRL,Pass on Beyond Meat Stock as the Fad Will Eventually Fade,6/9/2020 2:48:17 PM
HRL,Hormel Foods Corporation -- Moody's assigns A1 rating to Hormel's $1 billion notes offering,6/4/2020 11:44:00 PM
HRL,"As Competition Heats up, Sell Beyond Meat Stock Above $100 While You Can",6/2/2020 12:01:24 PM
HRL,Investors lose their appetite for food stocks,5/21/2020 3:38:19 PM
HRL,Notable earnings before Thursday's open,5/20/2020 9:30:26 PM
HRL,Hormel Foods declares $0.2325 dividend,5/18/2020 9:09:35 PM
HRL,7 of the Best Consumer Stocks to Buy Right Now,5/8/2020 2:38:17 PM
HRL,Meat shortage update - now it's Costco,5/4/2020 10:23:31 PM
HRL,7 Businesses With Too Much Company Stock in Retirement Plans ,4/27/2020 5:25:01 PM
HRL,"""Depopulation"" of chickens in Delaware and Maryland begins",4/26/2020 4:05:09 PM
HRL,Surging meat prices coming a store near you,4/22/2020 7:18:11 PM
HRL,Hormel Foods' Rochelle Foods Halts Production For Period Of 14 Days ,4/19/2020 5:13:41 AM
HRL,Alma Foods Reports Facility Closure Until May 4 Due To A Positive COVID-19 Case ,4/18/2020 10:16:05 AM
HRL,Hormel Foods Corporation -- Moody's announces completion of a periodic review of ratings of Hormel Foods Corporation,4/13/2020 6:03:00 PM
HRL,Social distancing pair trade runs wild again,3/30/2020 2:37:43 PM
HRL,Stock Market Today: Time for Some Good News; Automotive Drama,3/18/2020 8:26:45 PM
HRL,7 of the Last Decade’s Fastest-Growing Dividend Stocks,3/17/2020 7:16:35 PM
HRL,Consumer - Top 5 Gainers / Losers,2/20/2020 5:02:11 PM
HRL,Hormel Foods is about to announce its earnings — here's what to expect,2/19/2020 3:01:51 PM
HRL,9 Super-Safe-Growth Stocks for Long-Lasting Dividends,1/21/2020 2:28:46 PM
HRL,What Lies Ahead for Beyond Meat Stock and the Faux Meat Craze?,1/15/2020 5:30:40 PM
HRL,"Whether Long or Short, Tread Carefully With Beyond Meat Stock",1/14/2020 3:16:51 PM
HRL,"Beyond Meat’s Rich Multiples, Looming Competitors Make It a Tough Buy",1/2/2020 6:14:42 PM
HRL,Meat Eaters Rejoice: It’s Time for Investors to Sell Beyond Meat,12/27/2019 2:56:06 PM
HRL,"Beyond Meat Stock Was a Great 2019 Story, But the Sizzle Is Gone",12/23/2019 3:25:40 PM
HRL,Beyond Meat Stock Is Worth At Least a Look,12/18/2019 6:50:29 PM
HRL,BYND Stock Could Fall Further as Competition Heats Up,12/10/2019 1:10:47 PM
HRL,7 Unsteady Stocks Investors Should Consider Selling Before 2020,11/26/2019 3:44:36 PM
HRL,Here's what Wall Street expects from Hormel Foods's earnings report,11/24/2019 3:01:17 PM
HRL,7 Top Stocks to Buy for 2020,11/22/2019 4:42:09 PM
HRL,Avoid Beyond Meat Stock and the Rising Fake Meat Market,11/19/2019 1:20:10 PM
HRL,7 Stocks to Sell in the Wake of Dying Tech Unicorns Like WeWork,11/4/2019 5:26:37 PM
HRL,7 Dividend Stocks to Buy (With Brands You Can Find In Your Kitchen),10/15/2019 6:30:35 PM
HRL,Hormel Foods Narrows FY19 EPS Outlook Range - Quick Facts ,10/10/2019 12:45:33 PM
HRL,Hormel Foods Launches Plant-based Meat Alternative 'Happy Little Plants' ,9/5/2019 3:26:29 PM
HRL,"Hormel Foods Trims FY19 Sales Outlook, Reaffirms EPS View - Quick Facts ",8/22/2019 12:47:58 PM
HRL,Hormel Foods is about to announce earnings — here's what Wall Street expects,8/20/2019 3:01:44 PM
HRL,Pumpkin Spice Spam? This Time It’s Not a Hoax,8/15/2019 6:03:55 PM
HRL,"3 Big Stock Charts for Tuesday: Centene, Hormel Foods and Advance Auto Parts",8/13/2019 12:22:04 PM
HRL,7 S&P 500 Stocks to Buy With Little Debt and Lots of Profits,6/20/2019 7:46:08 PM
HRL,Hormel Foods Cuts FY19 Outlook - Quick Facts ,5/23/2019 12:47:02 PM
HRL,Hormel Foods earnings preview: what Wall Street is expecting,5/21/2019 3:01:25 PM
HRL,Hormel Foods Corporation -- Moody's announces completion of a periodic review of ratings of Hormel Foods Corporation,5/9/2019 10:12:00 PM
HRL,Hormel Foods Signs Virtual Power Purchase Agreement For Wind Power - Quick Facts ,4/10/2019 2:16:06 PM
HRL,"Austin (City of) MN -- Moody's affirms Austin, MN's GO bonds at Aa2",3/1/2019 12:36:00 AM
HRL,"Hormel Foods Q1 Earnings Meet View, But Revenues Miss; Reaffirms FY19 Outlook ",2/21/2019 1:05:09 PM
HRL,Hormel Foods Agrees To Sell CytoSport To PepsiCo; Terms Not Disclosed ,2/20/2019 5:52:05 AM
HRL,Here's what Wall Street expects from Hormel Foods's earnings,2/19/2019 3:01:47 PM
HRL,Hormel Foods Corporation -- Moody's affirms Hormel Foods' A1 rating; outlook is stable,1/18/2019 6:48:00 PM
HRL,Hormel Foods Corp Bottom Line Rises In Q4,11/20/2018 12:40:40 PM
HRL,Hormel Foods earnings preview: what Wall Street is expecting,11/18/2018 3:01:18 PM
HRL,Jennie-O Turkey Recalls Turkey Products Due To Salmonella Reading Contamination ,11/16/2018 7:59:38 AM
HRL,UPDATE 1-Hormel Foods sees up to 6 cents tariff impact on annual profit,8/23/2018 5:01:40 PM
HRL,What Wall Street expects from Hormel Foods's earnings,8/21/2018 3:01:35 PM
HRL,Greedy Pigs: Pork Companies Accused Of Price-fixing ,6/29/2018 6:18:39 PM
HRL,"America's Best Firehouse Chili Contest Returns, Giving Firefighters Across the Country a Chance to Win $10,000 for Their Station",6/13/2018 3:10:00 PM
HRL,"Hormel Foods Corporation Announces Webcast Of 2018 dbAccess Global Consumer Conference Tuesday, June 12, 2018",6/1/2018 7:44:00 PM
HRL,Hormel Foods Climbs Off Worst Levels But Remains Negative ,5/24/2018 9:33:54 PM
HRL,Hormel Foods Corporation Declares Quarterly Dividend,5/21/2018 10:30:00 PM
HRL,"Charter to Participate in J.P. Morgan Global Technology, Media and Communications Conference",5/10/2018 9:24:00 PM
HRL,Hormel Foods Ranked No. 16 on 2018 100 Best Corporate Citizens List,5/7/2018 8:27:00 PM
HRL,Hormel Foods Corporation Second Quarter Earnings Conference Call,4/30/2018 8:50:00 PM
HRL,IIROC Trading Resumption - HRL,4/27/2018 10:47:00 PM
HRL,Moody's: Smaller US pork operators will bear the brunt of potential Chinese pork tariffs,4/16/2018 8:58:00 PM
HRL,"Applegate Farms, LLC Announces Appointment Of New President, Leadership Changes",4/9/2018 2:27:00 PM
HRL,Hormel Foods Honors 90 Suppliers with Spirit of Excellence Award,4/6/2018 2:00:00 PM
HRL,The Makers of Hormel® Natural Choice® Deli Meats Announce New National Ad Featuring Comedic Actress Judy Greer,4/5/2018 5:00:00 PM
HRL,Hormel Foods Corporation Declares Quarterly Dividend,3/26/2018 10:30:00 PM
HRL,IIROC Trading Halt - HRL,3/14/2018 7:06:00 PM
HRL,Hormel Foods Announces Leadership Appointments,3/6/2018 1:00:00 PM
HRL,"Hormel Foods Q1 Profit Tops View, But Sales Miss; Lifts 2018 Profit Outlook ",2/22/2018 1:26:02 PM
HRL,Hormel Foods Announces New Executive Role and Advancements,2/14/2018 2:00:00 PM
HRL,"Hormel Foods Announces the Retirement of Steve Binder, Executive Vice President and President, Hormel Business Units and the Advancement of Tom Day to Executive Vice President, Refrigerated Foods",2/6/2018 2:52:00 PM
HRL,Hormel Foods Receives Numerous Awards for Corporate Responsibility Report,1/16/2018 9:00:00 PM
HRL,Hormel Foods Names its Second Inspired Fan,1/12/2018 10:15:00 PM
HRL,Hormel Foods Launches HORMEL® ALWAYS TENDER® Dry Seasoned Loin Filets,1/11/2018 10:30:00 PM
HRL,SHAREHOLDER ALERT: Purcell Julie & Lefkowitz LLP Is Investigating Hormel Foods Corporation for Potential Breaches Of Fiduciary Duty By Its Board of Directors,1/9/2018 4:06:00 PM
HRL,Hormel Foods Teams up with Menchie's Frozen Yogurt to Launch Limited Edition Frozen Yogurt Flavor Featuring SKIPPY® Peanut Butter,1/2/2018 4:00:00 PM
HRL,BRIEF-Hormel Foods CEO James Snee's FY 2017 Total Compensation Was $6.3 Mln Vs $3.5 Mln In FY 2016 (HRL),12/20/2017 2:37:04 PM
HRL,"BRIEF-Hormel Foods Closes Columbus Manufacturing Deal, Raises Fiscal 2018 Outlook (HRL)",11/28/2017 12:17:03 AM
HRL,Hormel Foods and Jennie-O Turkey Store Help Provide Thanksgiving Meal for Those Affected by Hurricane Harvey,11/27/2017 11:30:00 PM
HRL,Hormel Foods Distributes Annual Profit Sharing,11/22/2017 2:00:00 PM
HRL,"US STOCKS-Tech gains help propel Wall Street to record highs (MDT, AAPL, URBN, HRL, SIG, TIF)",11/21/2017 10:52:10 PM
HRL,BRIEF-Hormel Foods announces increase to annual dividend (HRL),11/20/2017 11:02:03 PM
HRL,Hormel Foods Announces 2017 Hormel Heroes Scholarship Recipients,11/13/2017 2:00:00 PM
HRL,Hormel Foods Recognized by Forbes on Top Regarded Companies List,11/8/2017 2:00:00 PM
HRL,Hormel Foods Recognized by Forbes on World's Best Employers List,11/7/2017 2:00:00 PM
HRL,"UPDATE 1-Hormel to buy premium deli meat, salami maker for $850 mln (HRL)",10/31/2017 12:47:16 PM
HRL,Hormel Foods Corporation Fourth Quarter Earnings Conference Call,10/24/2017 2:23:00 PM
HRL,Hormel Foods Named one of the 50 Best Places to Intern in the U.S.,10/12/2017 2:00:00 PM
HRL,Hormel Foods Honored with Employer of the Year Award,10/3/2017 2:00:00 PM
HRL,Hormel Board Elects Jim Snee As Next Chairman Of Board - Quick Facts ,9/27/2017 12:37:55 PM
HRL,Hormel Foods Corporation Declares Quarterly Dividend,9/25/2017 10:30:00 PM
HRL,"Hormel Foods Announces Donations Totaling $300,000 to Fight Hunger Across the Country on Hunger Action Day",9/14/2017 2:00:00 PM
HRL,Hormel Foods Highlights Strategic Growth Initiatives at Barclays Global Consumer Staples Conference,9/7/2017 2:00:00 PM
HRL,Hormel Foods Lends a Helping Hand after Hurricane Harvey,8/31/2017 12:58:00 AM
HRL,Hormel Foods Climbs Off Worst Levels But Remains Firmly Negative ,8/24/2017 7:46:03 PM
HRL,"Hormel Foods Corporation Appoints Lisa Selk as Chief Executive Officer, CytoSport, Inc.",8/18/2017 6:00:00 PM
HRL,BRIEF-Hormel Foods adds to its foodservice portfolio with the acquisition of Fontanini Italian Meats and Sausages (HRL),8/17/2017 2:42:03 PM
HRL,Hormel Foods Announces Webcast of Barclays Global Consumer Staples Conference,8/14/2017 2:49:00 PM
HRL,Hormel Foods Announces New Leadership Hire,8/9/2017 2:00:00 PM
HRL,"Cars.com to Announce Second Quarter 2017 Financial Results on Wednesday, August 9, 2017",7/26/2017 8:07:00 PM
HRL,Hormel Foods Launches New On-The-Go Snacks,7/25/2017 5:00:00 PM
HRL,"UPDATE 1-UK Stocks-Factors to watch on July 17 (UKX, BBY, ITV, EZJ, CLLN, AZN, ULVR, HRL, RB., MIRA, MIN, ASH, UNA)",7/17/2017 10:36:06 AM
HRL,"Unilever vies with Hormel to buy Reckitt food unit -Sunday Times (ULVR, UNA, HRL, RB.)",7/16/2017 1:18:03 AM
HRL,"Stocks Under Scanner in the Consumer Goods Space -- BRF S.A., Hormel Foods, Tyson Foods, and Sanderson Farms",6/22/2017 12:50:00 PM
HRL,"U.S. meat processor Tyson to test new method to stun chickens (TSN, JBSS3, PNRA, SW, HRL, MCD)",6/21/2017 12:04:03 PM
HRL,Hormel Foods Announces Webcast of 2017 Investor Day Presentations,6/6/2017 2:59:00 PM
HRL,"INSIGHT-Canada beats US in pork sales to China - feet, elbows and all (SEB, LLY, TSN, HRL, 288)",6/5/2017 7:26:04 AM
HRL,"Reckitt's food sale kicked off without private equity - sources (RB., MJN, MKC, CAG, ULVR, HRL, CPB, UNA)",5/31/2017 6:40:18 PM
HRL,Hormel Sees Further Downside After Initial Decline ,5/25/2017 8:39:53 PM
HRL,Hormel Foods Corporation Second Quarter Earnings Conference Call,4/26/2017 2:45:00 PM
HRL,"Technical Reports on Consumer Goods Equities -- Tyson Foods, Hormel Foods, BRF S.A., and Dean Foods",4/24/2017 12:40:00 PM
HRL,Hormel Foods Announces Pollinator Garden Expansion,4/21/2017 2:00:00 PM
HRL,Hormel Foods in Top 10 on the 100 Best Corporate Citizens List,4/20/2017 8:33:00 PM
HRL,Hormel Foods Honors 89 Suppliers with Spirit of Excellence Awards,4/18/2017 2:00:00 PM
HRL,Hormel Foods Personnel Announcement,4/17/2017 2:00:00 PM
HRL,"UPDATE 1-Morgan Stanley bags big spots on Unilever, Reckitt deals - sources (ULVR, UNA, RB., MS, GS, JPM, DBK, MKC, HRL, 2802, MJN)",4/13/2017 6:25:04 PM
HRL,/C O R R E C T I O N -- Hormel Foods Corporation/,3/8/2017 3:09:00 PM
HRL,Danish Crown targets China's choosy pork eaters with plant for premium cuts (HRL),3/2/2017 9:34:19 AM
HRL,"Covered Call reports for ARRIS Group Inc., Edwards Lifesciences, Hormel Foods Corporation, TJX and Wayfair Inc. include trade ideas that offer high returns.",2/24/2017 3:31:00 PM
HRL,"Hormel Foods Under Pressure On Disappointing Q1 Earnings, Guidance ",2/23/2017 6:57:40 PM
HRL,Hormel stops operations at supplier farm after video shows animal abuse,1/31/2017 10:30:07 PM
HRL,BRIEF-Hormel Foods reports Q4 earnings per share of  $0.45 (HRL),11/22/2016 2:12:18 PM
HRL,BRIEF-Applegate Farms reports new vp of marketing Nicole Glenn (HRL),10/10/2016 11:20:21 PM
HRL,BRIEF-Hormel Foods recommends stockholders reject unsolicited below-market price mini-tender (HRL),9/29/2016 9:10:26 AM
