Ticker,Title,Link
HRL,"Food spotlight: Blockbuster M&A as Mars takes Kellanova private, pantry inflation up 1%",8/14/2024 12:42:16 PM
HRL,3 Undervalued Stocks Poised for a Comeback in 2024,8/12/2024 10:01:00 AM
HRL,Select food stocks weighed down by recessionary angst,8/5/2024 7:09:44 PM
HRL,"Retire Young, Retire Wealthy: 3 Dividend Kings to Pay You Forever",7/25/2024 8:45:00 PM
HRL,3 Dividend Stocks to Buy Now: Q3 Edition,7/20/2024 5:58:37 PM
HRL,7 ‘Death Cross’ Stocks That Could Be Contrarian Buys,7/17/2024 6:29:27 PM
HRL,3 Safe Dividend Kings to Recession-Proof Your Portfolio,7/16/2024 7:04:01 PM
HRL,Piper Sandler Keeps Their Hold Rating on Hormel Foods (HRL),7/11/2024 10:56:25 AM
HRL,3 Stocks to Buy for the Price of One Nvidia Share,6/26/2024 4:13:01 PM
HRL,3 Unloved and Undervalued Dividend Stocks to Snap Up Now,6/18/2024 7:08:04 PM
HRL,Dividend Delicacies: 3 Stocks That Will Whet Your Appetite for Consistent Payouts,6/10/2024 12:00:00 PM
HRL,3 Dangerous Stocks You Should Sell ASAP in June,6/6/2024 4:33:04 PM
HRL,Sell ideas in Staples and Health Care - Oppenheimer,6/3/2024 6:46:53 PM
HRL,This Hormel Foods Analyst Is No Longer Bearish; Here Are Top 5 Upgrades For Friday,5/31/2024 3:25:57 PM
HRL,Hormel Foods Sell Rating Affirmed Amid Performance and Valuation Concerns,5/30/2024 8:55:18 PM
HRL,Hormel Foods Q2 2024 Earnings Preview,5/29/2024 4:24:02 PM
HRL,"Earnings week ahead: Salesforce, Costco, Canopy Growth, Dell,  Dollar General, and more",5/26/2024 12:00:00 PM
HRL,Retailers on one side and Nvidia on the other - Earnings Scorecard,5/25/2024 6:45:00 PM
HRL,Don’t Panic. 3 Stocks to Own When Things Get Ugly,5/24/2024 3:11:19 PM
HRL,Hormel Foods: Overvalued and Underperforming – A Sell Rating Analysis,5/21/2024 10:35:19 PM
HRL,Hormel Foods declares $0.2825 dividend,5/20/2024 9:15:59 PM
HRL,"Lifeway Foods Q1 Earnings Miss, Sales Beat Estimates",5/15/2024 9:42:47 PM
HRL,3 S&P 500 Stocks to Sell in May Before They Crash & Burn,5/12/2024 8:00:00 PM
HRL,Planters Nuts Recall: Hormel Recalls Nuts Due to Listeria Contamination,5/7/2024 3:35:40 PM
HRL,"Hormel Foods Recalls Select Planters Peanuts, Mixed Nuts ",5/6/2024 7:46:35 AM
HRL,Hormel Foods Launches CORN NUTS Loaded Taco Flavor Corn Kernels ,4/30/2024 3:08:32 PM
HRL,Hormel Foods declares $0.2825 dividend,3/25/2024 9:04:43 PM
HRL,Dell To Rally Around 27%? Here Are 10 Top Analyst Forecasts For Friday,3/1/2024 2:14:37 PM
HRL,"Wall Street Takes A Breather As Inflation Stays Tamed, AMD Hits Record Highs, Apple Struggles: What's Driving Markets Thursday?",2/29/2024 8:30:14 PM
HRL,Hormel Foods Q1 2024 Earnings Preview,2/28/2024 6:27:33 PM
HRL,3 Stock Staples to Buy for a Decade of Growth,2/27/2024 5:39:07 PM
HRL,"Earnings week ahead: Salesforce, Plug Power, Zoom, Snowflake, AMC Entertainment and more",2/25/2024 1:00:00 PM
HRL,The 7 Best Dividend Stocks to Buy in February 2024,2/15/2024 2:05:58 PM
HRL,7 Dividend Stocks to Buy at a 52-Week Low ,2/12/2024 1:57:56 PM
HRL,7 Retirement Stocks to Buy at 52-Week Lows,2/7/2024 1:53:13 AM
HRL,"RTE Spiced Deli Ham Products, Pork Products Recalled ",2/5/2024 7:08:57 AM
HRL,7 Beaten-Down Value Stocks Poised for an Epic Turnaround,1/23/2024 10:06:38 PM
HRL,Piper Sandler Maintains Neutral Rating for Hormel Foods: Here's What You Need To Know,1/12/2024 6:00:11 PM
HRL,The 3 Best Dividend Stocks to Buy Now ,1/3/2024 5:56:49 PM
HRL,3 Safe Dividend Stocks With Low Payout Ratios,1/1/2024 3:09:30 PM
HRL,Newsweek Names Hormel Foods One of America's Greatest Workplaces for Diversity,12/20/2023 4:15:00 PM
HRL,Hormel Foods Once Again Named Category Captain by Progressive Grocer,12/18/2023 3:01:00 PM
HRL,Hormel Foods Named to Drucker Institute Management Top 250 List of America's Best-Run Companies,12/15/2023 2:00:00 PM
HRL,3 Stocks Facing Tax-Loss Selling That Will See a 2024 Rebound,12/12/2023 11:20:00 AM
HRL,The Sell List: Analysts Have Good Reason to Hate These 7 Stocks,12/10/2023 7:17:31 PM
HRL,HORMEL® Pepperoni is Making Spirits Bright This Holiday Season with the All-New Ultimate Pepperoni Bloody Mary Cocktail Kit,12/5/2023 2:00:00 PM
HRL,Hormel Foods Earns Perfect Score of 100 on the Human Rights Campaign Foundation's 2023-24 Corporate Equality Index,11/30/2023 9:55:00 PM
HRL,Hormel Foods Struggles with Earnings Growth Leading to Sell Rating,11/29/2023 11:15:39 PM
HRL,Here's what to expect from Hormel Foods's earnings,11/28/2023 3:01:13 PM
HRL,The Makers of the Planters® Brand Celebrate the Holidays with Magic in the Monocle Sweepstakes,11/27/2023 2:00:00 PM
HRL,Hormel Foods Corporation Announces 58th Consecutive Increase to the Annual Dividend,11/20/2023 11:00:00 PM
HRL,Paul Russell's 'Lil Boo Thang' Takes Center Stage on the Jennie-O® Brand's Macy's Thanksgiving Day Parade® Float,11/16/2023 2:00:00 PM
HRL,Jennie-O® Brand Breaks GUINNESS WORLD RECORDS™ Title for Most Turkeys Donated in 24 Hours,11/13/2023 7:28:00 PM
HRL,3 Thanksgiving Stocks You’ll Be Grateful You Bought,11/11/2023 7:00:00 PM
HRL,Hormel Foods Announces 2023 Class of Hormel Heroes Scholarship Recipients,11/10/2023 2:00:00 PM
HRL,Hormel Foods Named a Best for Vets Employer for 11th Year in a Row,11/7/2023 2:00:00 PM
HRL,Fans of the SPAM® Brand Come Together to Support Maui Relief Efforts,11/1/2023 2:00:00 PM
HRL,Hormel Foods Corporation to Hold Fourth Quarter Earnings Conference Call,10/30/2023 10:00:00 PM
HRL,Wall Street Analysts Are Neutral on Top Consumer Goods Picks,10/27/2023 10:41:39 AM
HRL,7 Top Dividend Stock Powerhouses That Can Make You Richer in 2023,10/25/2023 10:00:00 AM
HRL,Thanksgiving Meal Prep Questions? Jennie-O Turkey Store Has the Answers: Call 1-800-TURKEYS,10/18/2023 2:00:00 PM
HRL,"The Makers of HERB-OX® Bouillon Unveil a Decade's Worth of Innovation: Introducing Cold Water Dissolve Chicken Bouillon and Beef Bouillon, the First of their Kind on the Market",10/17/2023 4:19:00 PM
HRL,"Hormel Foods Donates 100,000 Meals for World Food Day",10/16/2023 2:16:00 PM
HRL,Voluntary Class 1 Recall Announced for Limited Number of Cases of Don Miguel® Carne Asada Burritos Sent to Convenience Stores in Select States,10/13/2023 11:14:00 PM
HRL,Why InMode Shares Are Trading Lower By 20%? Here Are Other Stocks Moving In Thursday's Mid-Day Session,10/12/2023 6:55:08 PM
HRL,Hormel Foods Announces Webcast of 2023 Investor Day Presentation,10/9/2023 3:25:00 PM
HRL,Unleash the Flavors of Fall with Hormel® Black Label® Apple Cider Bacon,10/4/2023 4:00:00 PM
HRL,"For Autumn Enthusiasts, the Hormel Gatherings® Trailhead Party Tray is the Perfect Snacking Centerpiece for Any Fall Get-Together",10/3/2023 5:00:00 PM
HRL,"Makers of Skippy® Peanut Butter Unveil Girl Scout Cookie™ Inspired P.B. Bites, Combining Two Iconic Brands Within a Single Bite",9/28/2023 4:00:00 PM
HRL,"Hormel Foods, Jennie-O Turkey Store Celebrate Completion of Latest Community Solar Project",9/27/2023 7:07:00 PM
HRL,Don’t Miss the Boom: 7 Dividend Stocks Set to Explode Higher,9/26/2023 4:15:11 PM
HRL,Hormel Foods Corporation Declares Quarterly Dividend,9/25/2023 11:00:00 PM
HRL,Hormel Foods Releases 17th Annual Global Impact Report,9/21/2023 2:00:00 PM
HRL,The Makers of the SPAM® Brand Launch Social Media Sweepstakes to Celebrate the First Day of Fall,9/20/2023 7:15:00 PM
HRL,Culinary Experts at Hormel Foods Offer Insight to Help Consumers Keep Their Holiday Turkeys Succulent and Flavorful,9/19/2023 2:00:00 PM
HRL,FSIS Warns Against Hormel Foods' SPAM Classic Canned Meat Product ,9/18/2023 11:49:27 AM
HRL,Hormel Foods Announces 2023 Class of 10 Under 20 Food Heroes,9/13/2023 4:00:00 PM
HRL,"For a Limited Time, Hormel Foodservice Offers Cure 81® Pumpkin Spice Ham",9/8/2023 5:11:00 PM
HRL,"Analysts Offer Insights on Consumer Goods Companies: Murphy USA (MUSA), Hormel Foods (HRL) and Brown-Forman B (BF.B)",9/5/2023 12:10:31 PM
HRL,Bank of America Securities Reaffirms Their Sell Rating on Hormel Foods (HRL),9/1/2023 11:35:07 AM
HRL,Goldman Sachs Remains a Sell on Hormel Foods (HRL),8/31/2023 9:55:08 PM
HRL,Here's what Wall Street expects from Hormel Foods's earnings,8/30/2023 3:01:13 PM
HRL,Culinary Experts at Hormel Foods Welcome the Fall Season with Flavorful Array of Autumn-Inspired Dishes,8/24/2023 2:00:00 PM
HRL,Hormel Foods Senior Cultural Anthropologist Dr. Tanya Rodriguez: 'My Job is to Question Everything',8/23/2023 2:58:00 PM
HRL,"In Celebration of the Fall Season, the Makers of the Planters® Brand Introduce New Flavored Cashew Innovation: Apple Cider Donut",8/22/2023 2:23:00 PM
HRL,The Bosses of Bacon at Hormel Foods Raise the Savory Delight to New Heights with Mouthwatering Bacon-Infused Recipes,8/18/2023 2:00:00 PM
HRL,The Makers of the SPAM® Brand Sending Resources to Aid Maui Wildfire Response,8/17/2023 2:00:00 PM
HRL,"Tudor Investment boosts stakes in Big Tech, exits VMware, BAH, HRL",8/15/2023 1:53:55 PM
HRL,The 3 Best Long-Term Stocks to Buy in August,8/7/2023 7:35:17 PM
HRL,"Goldman in, Microsoft out of BofA Alpha Surprise Portfolio",8/3/2023 11:40:27 AM
HRL,The Makers of WHOLLY® AVOCADO are Giving 10 Fans a Chance to Win One Year's Supply of products - and more - for National Avocado Day,8/1/2023 2:11:00 AM
HRL,Hormel Foods Corporation to Hold Third Quarter Earnings Conference Call,7/31/2023 11:00:00 PM
HRL,3 Long-Term Stocks You Better Be Buying on Each and Every Dip,7/27/2023 8:11:47 PM
HRL,Columbus Craft Meats Launches 'Search for the Perfect Bite' Original Film Series on YouTube,7/26/2023 2:39:00 PM
HRL,Hormel Foods Announces Free College Tuition for Team Members,7/20/2023 2:00:00 PM
HRL,The Makers of the SPAM® Brand Unveil Sweet and Savory New Variety: SPAM® Maple Flavored,7/18/2023 4:00:00 PM
HRL,The Makers of the Planters® Brand Launch Ad Campaign to Spotlight New Trio of Flavored Cashew Varieties,7/17/2023 9:40:00 PM
HRL,Hormel Foods Announces the Appointment of Scott Aakre as Group Vice President and Chief Marketing Officer of the Company's Retail Business,7/12/2023 11:00:00 PM
HRL,Hormel Foods Named One of Fast Company's Best Workplaces for Innovators,7/11/2023 7:41:00 PM
HRL,Elevate Your Summer Entertaining: Jennie-O® Brand and Registered Dietician Frances Largeman-Roth Introduce Tasty New Turkey Recipes Inspired by Latest Culinary Trends,6/29/2023 7:41:00 PM
HRL,Consumer jolt: General Mills CEO says there is no disinflation yet with food prices,6/28/2023 6:03:21 PM
HRL,"Jennie-O Turkey Store unveils chef-inspired recipes, celebrates successful School Cafeteria Takeover campaign in honor of National Turkey Lovers Month",6/16/2023 3:00:00 PM
HRL,Columbus Craft Meats enhances Father's Day feasts with expert-recommended charcuterie pairings,6/15/2023 8:43:00 PM
HRL,PLANTERS® BRAND TEAM INTRODUCES ITS 2023 CLASS OF PEANUTTERS TO THE SALTY STREETS OF AMERICA,6/14/2023 8:21:00 PM
HRL,Calling All Cookie Enthusiasts! Join the SKIPPY® Brand in Celebrating National Peanut Butter Cookie Day,6/12/2023 2:30:00 PM
HRL,Hormel Foods Recognized as One of America's Best Companies to Work For by U.S. News & World Report,6/9/2023 6:28:00 PM
HRL,Hormel Foods to Participate in Investor Conferences and Announces Date of 2023 Investor Day,6/5/2023 11:30:00 PM
HRL,HORMEL FOODS PRESENTS FOOD-FORWARD SOLUTIONS TO MEET CONSUMER ENTERTAINING NEEDS AT INTERNATIONAL DAIRY DELI BAKERY ASSOCIATION SHOW,6/2/2023 6:17:00 PM
HRL,The Latest Analyst Ratings for Hormel Foods,6/1/2023 10:01:56 PM
HRL,Hormel Foods Q2 2023 Earnings Preview,5/31/2023 3:05:02 PM
HRL,Hormel Foods Welcomes Newest Class of Inspired Summer Interns,5/30/2023 9:05:00 PM
HRL,"Earnings Week Ahead: Salesforce, Broadcom, Dollar General and more",5/26/2023 4:30:00 PM
HRL,Hormel Foods Brings Together Multiple Brands with Introduction of Columbus® Handcrafted Charcuterie Board,5/25/2023 2:00:00 PM
HRL,"PLANTERS® BRAND UNVEILS 3 NEW FLAVOR-FORWARD VARIETIES, EXPANDING ITS INNOVATIVE PORTFOLIO OF CASHEW SNACKS",5/24/2023 2:00:00 PM
HRL,Goldman Sachs picks top stocks in case of a hard landing,5/23/2023 11:39:57 AM
HRL,Hormel Foods Corporation Declares Quarterly Dividend,5/22/2023 11:00:00 PM
HRL,"SPAM® MUSEUM, INTERNATIONAL MUSEUM DAY GO HAND IN HAND",5/18/2023 2:00:00 PM
HRL,"HORMEL FOODS TO SHOWCASE INDUSTRY-LEADING BRANDS, INNOVATION AND SHOWSTOPPING MENU ITEMS AT NATIONAL RESTAURANT ASSOCIATION SHOW",5/17/2023 2:00:00 PM
HRL,"JENNIE-O TURKEY STORE AND CELEBRITY CHEF CARLA HALL HONOR DETROIT SCHOOL CAFETERIA WORKERS; CONCLUDES NATIONAL ""SCHOOL CAFETERIA TAKEOVER"" PARTNERSHIP",5/16/2023 2:05:00 PM
HRL,COLUMBUS CRAFT MEATS ENCOURAGES CHARCUTERIE FANS TO GET CREATIVE WITH MOM'S MOTHER'S DAY BOUQUET,5/11/2023 2:00:00 PM
HRL,7 Dividend Aristocrats to Buy and Hold Forever,5/10/2023 7:13:59 PM
HRL,What Does Bill Gates Know That You Don’t? 3 Stocks He Is Buying.,5/9/2023 10:00:44 AM
HRL,Tyson’s post-earnings plunge pulls down protein-producer peers,5/8/2023 5:17:15 PM
HRL,Hormel Foods Corporation to Hold Second Quarter Earnings Conference Call,5/1/2023 7:18:00 PM
HRL,GLOBAL FANS TO CELEBRATE ICONIC SPAM® BRAND IN WAIKIKI AS BELOVED SPAM JAM® FESTIVAL RETURNS,4/28/2023 5:36:00 PM
HRL,The makers of the CORN NUTS® brand introduce a bold new flavor to the snacking aisle - CORN NUTS® Mexican Street Corn flavored crunchy corn kernels,4/25/2023 2:00:00 PM
HRL,HORMEL FOODS RANKS IN TOP 100 FOR GREEN POWER USE,4/24/2023 6:00:00 PM
HRL,HORMEL FOODS LAUNCHES THE ORIGINATE INITIATIVE,4/21/2023 2:00:00 PM
HRL,Hormel Foods Pizza Experts Unveil Top-5 Topping Trends for 2023 and Beyond,4/14/2023 2:00:00 PM
HRL,"The Makers of the HERDEZ® Brand Introduce New Refrigerated Salsas Line, Available in Mild, Medium and Chipotle",4/12/2023 2:00:00 PM
HRL,HORMEL FOODS AGAIN NAMED ONE OF AMERICA'S MOST TRUSTWORTHY COMPANIES BY NEWSWEEK,4/4/2023 9:00:00 PM
HRL,HORMEL FOODS INTRODUCES ITS NEXT INSPIRED FAN - THE COMPANY AND ITS DINTY MOORE® BEEF STEW BRAND TEAM CELEBRATE NATIONAL AUTISM AWARENESS MONTH IN APRIL WITH POWERFUL STORY,3/30/2023 7:32:00 PM
HRL,"On National PB&J Day, the Makers of SKIPPY® Brand Peanut Butter Solve Great Debate Spoon or Knife and Crust On or Crust Off",3/29/2023 2:00:00 PM
HRL,Hormel Foods Corporation Declares Quarterly Dividend,3/27/2023 11:15:00 PM
HRL,Hormel Foods Provides Eight Elite Snacking Options as College Basketball Fans Get Ready for a Thrilling Weekend of Action,3/24/2023 1:00:00 PM
HRL,"Sit Back, Relax and Enjoy National Chip and Dip Day with Hormel Foods",3/22/2023 6:22:00 PM
HRL,Hormel Foods Brands Showcase Innovation and Sustainability Efforts at 2023 Natural Products Expo West,3/16/2023 6:43:00 PM
HRL,Celebrate National Peanut Lover's Day with America's Favorite Nut - Mr. Peanut®,3/15/2023 3:04:00 PM
HRL,Hormel Foods Launches HORMEL Sliced Chorizo ,3/14/2023 1:32:06 PM
HRL,HORMEL FOODS - THE MAKERS OF HORMEL® BLACK LABEL® BACON - CREATE FIRST-EVER SMOKED BACON USING ELITE MAPLE WOOD FROM COLLEGE BASKETBALL'S TOURNAMENT COURTS,3/13/2023 1:00:00 PM
HRL,Hormel Foods Named One of Barron's Most Sustainable U.S. Companies,3/10/2023 4:00:00 PM
HRL,Hormel Foods - the Makers of the Rosa Grande® Brand - and The World Pizza Champions™ Team Up to Bring Unmatched Innovation to Pizza Toppings!,3/9/2023 5:25:00 PM
HRL,Sleep-at-night stocks for those hedging or risk averse,3/8/2023 11:41:29 AM
HRL,Hormel Foods to Present at BofA Securities 2023 Consumer & Retail Conference,3/7/2023 2:00:00 PM
HRL,Analyst Expectations for Hormel Foods's Future,3/6/2023 3:01:19 PM
HRL,"Benzinga's Top Ratings Upgrades, Downgrades For March 3, 2023",3/3/2023 4:00:36 PM
HRL,"Nasdaq, S&P Futures Slide As Bond Yields Stay Above 4%: Economic Signals Ominous But Don't Panic Yet, Says Analyst",3/2/2023 12:52:37 PM
HRL,Hormel Foods Q1 2023 Earnings Preview,3/1/2023 4:23:21 PM
HRL,Hormel Foods Hosts Student Winners of its Annual Dr. Martin Luther King Jr. Essay Contest,2/28/2023 8:00:00 PM
HRL,"Catalyst watch: Tesla event, Microsoft talks OpenAI, Rivian earnings and Chevron",2/24/2023 7:00:00 PM
HRL,"JENNIE-O TURKEY STORE AND CELEBRITY CHEF CARLA HALL HONOR HOUSTON CAFETERIA STAFF THROUGH NATIONAL PARTNERSHIP, ""SCHOOL CAFETERIA TAKEOVERS""",2/21/2023 2:46:00 PM
HRL,Hormel Foods Wins Product of the Year Canada,2/20/2023 4:00:00 PM
HRL,Hormel Foods Corporation Sets Dates to Issue Recast Financial Information and Hold First Quarter Earnings Conference Call,2/8/2023 11:00:00 PM
HRL,Hormel Foods Announces Advancement of Henry Hsia to Vice President of Retail Marketing - Snacking and Entertaining,2/3/2023 11:00:00 PM
HRL,Hormel Foods Named to Fortune's World's Most Admired Companies List,2/1/2023 7:59:00 PM
HRL,Quant Ratings Updated on 80 Stocks,1/24/2023 9:31:05 PM
HRL,THE MAKERS OF THE SPAM® BRAND UNVEIL LIMITED-EDITION 'SPAM® BRAND x NOM LIFE COLLECTION' WITH FOOD AND TRAVEL CREATORS OF NOM LIFE,1/18/2023 4:00:00 PM
HRL,7 Under-the-Radar Retirement Stocks With 14% Upside Potential,1/14/2023 9:54:49 PM
HRL,Hormel Foods To Hold Virtual Annual Meeting of Stockholders,1/11/2023 2:00:00 PM
HRL,Do You Have What It Takes to Be a PLANTERS® Brand Peanutter?,1/10/2023 2:00:00 PM
HRL,The 10 Best Dividend Stocks of All Time ,1/4/2023 5:30:15 PM
HRL,Argus Research Maintains Buy Rating for Hormel Foods: Here's What You Need To Know,12/30/2022 6:01:35 PM
HRL,Egg prices said to hit records as bird flu thins poultry flocks,12/22/2022 1:38:47 PM
HRL,Hormel Foods Again Named Category Captain by Progressive Grocer,12/19/2022 2:00:00 PM
HRL,Hormel Foods makes minority investment in Garudafood,12/16/2022 7:54:33 AM
HRL,The 7 Hottest Food Stocks to Own for 2023 and Beyond,12/15/2022 6:07:02 PM
HRL,Hormel Foods Again Named to Annual Drucker Institute Management Top 250 List of America's Best-Run Companies,12/14/2022 11:30:00 PM
HRL,7 Consumer Stocks to Buy and Hold for Years,12/6/2022 10:35:49 AM
HRL,JP Morgan Maintains Neutral Rating for Hormel Foods: Here's What You Need To Know,12/1/2022 6:02:13 PM
HRL,"Hormel Foods Q4 Profit Beats Estimates, Organic Net Sales Up 2%; Sees High-cost Environment In FY23 ",11/30/2022 1:12:27 PM
HRL,Hormel Foods earnings preview: what to expect,11/29/2022 3:01:13 PM
HRL,Hormel Foods Distributes Profit Sharing To Employees ,11/23/2022 2:23:56 PM
HRL,Hormel Foods Corporation Announces 57th Consecutive Increase to the Annual Dividend,11/21/2022 11:00:00 PM
HRL,"JENNIE-O TURKEY STORE AND CELEBRITY CHEF CARLA HALL HONOR LOS ANGELES SCHOOL CAFETERIA STAFF THROUGH NATIONAL PARTNERSHIP, ""SCHOOL CAFETERIA TAKEOVERS""",11/17/2022 2:05:00 PM
HRL,THE MAKERS OF THE SPAM® Brand celebrate the 2022 Holiday Season with Limited Edition SPAM® Figgy Pudding,11/15/2022 3:00:00 PM
HRL,Hormel Foods Announces 2022 Hormel Heroes Scholarship Recipients,11/11/2022 2:00:00 PM
HRL,Hormel Foods CEO Jim Snee Receives Responsible CEO of the Year Honor,11/8/2022 2:41:00 PM
HRL,Hormel Foods Corporation Announces Fourth Quarter Earnings Conference Call and Webcast,11/7/2022 11:00:00 PM
HRL,"""Straight Up"" - Paula Abdul Makes 1st Appearance at Macy's Thanksgiving Day Parade® on This Year's Glamorous Jennie-O Turkey Store Float",11/3/2022 1:05:00 PM
HRL,To All A Good Nut! Make the Season Flavorful With PLANTERS® Limited-Edition Holiday Varieties,11/1/2022 3:00:00 PM
HRL,"JENNIE-O TURKEY STORE AND ICONIC CELEBRITY CHEF CARLA HALL KICK OFF NATIONAL ""SCHOOL CAFETERIA TAKEOVER"" PARTNERSHIP HONORING SCHOOL CAFETERIA WORKERS IN KNOXVILLE, TENN.",10/28/2022 2:05:00 PM
HRL,Hormel Foods Recognized Again for Leading Internship Program,10/26/2022 9:03:00 PM
HRL,Hormel Foods Recognized by Investor's Business Daily on 100 Best ESG Companies List,10/24/2022 11:15:00 PM
HRL,Hormel Foods Appoints Scott Aakre as Senior Vice President of Brand Fuel,10/12/2022 11:00:00 PM
HRL,Hormel Foods Appoints Katie Larson as Senior Vice President of Human Resources,10/10/2022 11:00:00 PM
HRL,Hormel Foods Provides Food for Hurricane Ian Relief Efforts,9/29/2022 10:37:00 PM
HRL,Hormel Foods Corporation Declares Quarterly Dividend,9/26/2022 11:00:00 PM
HRL,"General Mills Has Room For Further Guidance Boost, Says Credit Suisse",9/22/2022 7:04:58 PM
HRL,The Makers of the PLANTERS® Brand Elevates Snacking With New Packaging Redesign for PLANTERS® Dry Roasted Peanuts,9/21/2022 2:00:00 PM
HRL,"Findings Show that Despite all New Food Options, the Hamburger and Hot Dog Still Reign Supreme When it Comes to Football Tailgates",9/20/2022 2:00:00 PM
HRL,"Hormel Foods Unveils ""The Inspired People Plaza"" and 25-Foot-Tall Sculpture by International Artist Gordon Huether",9/16/2022 3:27:00 PM
HRL,"Inflation breakdown: Food prices run hot again, while apparel and sporting goods lag",9/13/2022 12:47:47 PM
HRL,7 Blue-Chip Stock Picks to Beat the September Market Slump,9/12/2022 5:48:40 PM
HRL,Take Action with Justin's for Hunger Action Month,9/7/2022 2:05:00 PM
HRL,Why Snap Shares Jumped 7%; Here Are 75 Biggest Movers From Yesterday,9/2/2022 11:29:23 AM
HRL,"Why Okta Is Trading Lower By Over 32%, Here Are 58 Stocks Moving In Thursday's Mid-Day Session",9/1/2022 6:47:16 PM
HRL,Hormel Foods Q3 2022 Earnings Preview,8/31/2022 7:29:58 PM
HRL,Hormel Foods Launches its 16th Annual Global Impact Report,8/30/2022 2:00:00 PM
HRL,Justin's Goes Nuts for Bees for National Honey Month,8/25/2022 12:05:00 PM
HRL,"Booking Holdings To $2,300? Here Are 5 Other Price Target Changes For Tuesday",8/23/2022 2:12:55 PM
HRL,Hormel Foods Transitioning To Three Strategic Operating Segments ,8/9/2022 12:57:58 PM
HRL,Tyson Foods (TSN) Q3 Earnings And Revenues Surpass Estimates,8/8/2022 4:50:18 PM
HRL,The Makers of the CORN NUTS® Brand Search to Find the Crunchiest Crunch with Musical Artist Sammy Arriaga,7/26/2022 2:00:00 PM
HRL,Hormel Foods Named to Selling Power's 50 Best Companies to Sell For List in 2022,7/13/2022 4:46:00 PM
HRL,BELOVED SPAM® BRAND CELEBRATES 85TH BIRTHDAY,7/5/2022 2:00:00 PM
HRL,Hormel Foods Details Changing Culinary Landscape in America,6/30/2022 3:35:00 PM
HRL,Hormel Foods EVP Deanna Brady Receives Top Women in Grocery Honor,6/29/2022 4:48:00 PM
HRL,Hormel Foods Announces New Regenerative Agriculture Initiatives,6/28/2022 9:05:00 PM
HRL,Hormel Foods Global Brands and Business Strategy on Stage at dbAccess Global Consumer Conference,6/25/2022 12:13:00 AM
HRL,The Makers of LLOYD'S® Barbeque Products and Pig Beach Showcase their Products with Two-Time World Barbeque Champions at the 30th Anniversary of the Giant BBQ Battle,6/22/2022 2:00:00 PM
HRL,"Hormel Foods Announces Retirement of Gary Jamison, Vice President and Treasurer, After 34 Years with the Company",6/21/2022 11:00:00 PM
HRL,Hormel Foods Sending its First Class of Planters® Peanutters to the Streets of America!,6/16/2022 3:00:00 PM
HRL,The Makers of PLANTERS® Peanuts Introduce Bold Flavor with NEW Sweet & Spicy Peanuts,6/14/2022 2:00:00 PM
HRL,Updated Time: Hormel Foods Corporation to Participate in the Deutsche Bank dbAccess Global Consumer Conference,6/8/2022 11:00:00 PM
HRL,Mid-Afternoon Market Update: Dow Surges Over 200 Points; Immunic Shares Slide,6/2/2022 8:30:24 PM
HRL,Hormel Foods Q2 2022 Earnings Preview,6/1/2022 6:46:33 PM
HRL,Hormel Foods Corporation to Participate in the Deutsche Bank dbAccess Global Consumer Conference,5/31/2022 2:00:00 PM
HRL,"Earnings Week Ahead: Salesforce, Gamestop, Lululemon and more",5/27/2022 8:05:57 PM
HRL,Hormel Foods Corporation Declares Quarterly Dividend,5/23/2022 11:00:00 PM
HRL,Updated Time: Hormel Foods Corporation Announces Second Quarter Earnings Conference Call and Webcast,5/19/2022 11:00:00 PM
HRL,Hormel Foods Named One of the Top Corporate Citizens in the United States,5/18/2022 2:00:00 PM
HRL,Hormel Foods Corporation Announces Second Quarter Earnings Conference Call and Webcast,5/9/2022 11:00:00 PM
HRL,6 Dividend Stocks That Will Maintain Their Payouts in an Economic Downturn,4/30/2022 10:42:59 AM
HRL,Iconic SPAM® Brand More Popular Than Ever Around the World,4/26/2022 2:57:00 PM
HRL,U.S. ENVIRONMENTAL PROTECTION AGENCY RANKS HORMEL FOODS IN TOP 100 FOR GREEN POWER USE,4/25/2022 10:46:00 PM
HRL,Hormel Foods on Track to Match 100% of Domestic Energy Use with Renewable Sourcing by End of 2022,4/21/2022 7:00:00 PM
HRL,3 DRIP Stocks for Dividend Growth Investors,4/20/2022 6:51:16 PM
HRL,Makers of America's No. 1 Selling Chili Brand Launch Hormel® Plant-Based Chili with Beans,4/19/2022 2:00:00 PM
HRL,The Most Hated Stock in 2022 Is Hormel Foods. Here’s Why the Haters Are Wrong.,4/11/2022 2:09:10 PM
HRL,Hormel Foods Pizza Expert Talks Toppings Trends,4/6/2022 4:01:00 PM
HRL,Skippy Peanut Butter Products Recalled Due To Presence Of Foreign Matter ,3/31/2022 4:04:49 AM
HRL,Hormel Foods Corporation Declares Quarterly Dividend,3/28/2022 11:30:00 PM
HRL,7 Reddit Stocks Likely to Withstand Any Recession in 2022,3/22/2022 11:06:45 PM
HRL,7 Recession-Proof Stocks for Nervous Investors to Buy in 2022,3/21/2022 11:30:12 AM
HRL,"Benzinga's Top Ratings Upgrades, Downgrades For March 15, 2022",3/15/2022 4:16:56 PM
HRL,"Benzinga's Top Ratings Upgrades, Downgrades For March 10, 2022",3/10/2022 4:02:39 PM
HRL,Enjoy Easy Comfort Meals in 30 Minutes with HORMEL® SQUARE TABLE™ Entrees,3/8/2022 2:00:00 PM
HRL,Analyst Ratings For Hormel Foods,3/2/2022 6:03:28 PM
HRL,Hormel jumps 5% on record Q1 sales,3/1/2022 4:10:30 PM
HRL,Hormel Foods Q1 2022 Earnings Preview,2/28/2022 7:28:13 PM
HRL,THE MAKERS OF COLUMBUS® CRAFT MEATS LAUNCH BOLD NEW INTEGRATED MARKETING CAMPAIGN FEATURING EASY CHARCUTERIE BUILDS THAT IMPRESS,2/24/2022 2:00:00 PM
HRL,The Makers of the Happy Little Plants® Brand to Partner with The World Pizza Champions™ to Bring Plant-Based Proteins to a Pizzeria Near You,2/17/2022 2:00:00 PM
HRL,Here Are All The Companies With Super Bowl LVI Commercials,2/14/2022 5:50:25 PM
HRL,Inflation 2022: 20 Stocks to Watch as Companies Hike Consumer Prices,2/10/2022 7:16:44 PM
