Ticker,Title,Link
FN,"Nvidia results offer 'positive' read-throughs for Dell, Super Micro, HP Enterprise: JPM",8/29/2024 12:14:21 PM
FN,"Catalyst Watch: Nvidia's blockbuster earnings, CrowdStrike on the hot seat, and PCE inflation watch",8/23/2024 7:00:15 PM
FN,"Biggest stock movers today: LLY, PANW, FN, and more",8/20/2024 1:50:43 PM
FN,Fabrinet Announces Fourth Quarter and Fiscal Year 2024 Financial Results,8/19/2024 10:15:00 PM
FN,Fabrinet Q4 2024 Earnings Preview,8/18/2024 9:35:00 PM
FN,"Catalyst Watch: Eyes on Jackson Hole, Target earnings, and Canadian rails disruption",8/16/2024 7:00:27 PM
FN,"Fabrinet to Announce Fourth Quarter and Fiscal Year 2024 Financial Results on August 19, 2024",7/29/2024 10:15:00 PM
FN,Cash Cow Alert: 3 Small-Cap Stocks Making Big Profits  ,7/15/2024 10:16:00 AM
FN,"Inflation Slows Small Cap Rally, But SMCP ETF Offers Strategic Entry Point",6/28/2024 2:56:17 PM
FN,Protecting Your Portfolio In The Event Russia Retaliates Against The U.S. For The Sevastopol Attack,6/26/2024 5:34:46 PM
FN,Nvidia’s Golden Handshake: 3 Stocks Reaping the Rewards of an NVDA Alliance,6/5/2024 10:26:00 AM
FN,The All-Weather ETF Trifecta: 3 Funds to Buy and Hold Forever,5/29/2024 12:11:03 AM
FN,From The Viewpoint Of Calamity--Investing With The Next Financial Crisis In Mind,5/22/2024 3:32:16 PM
FN,Rally Rockets: 3 Stocks Benefitting From the Market’s Unstoppable Surge,5/17/2024 6:44:34 PM
FN,7 Cheap Russell 2000 Stocks to Buy Now: May 2024,5/16/2024 10:00:00 AM
FN,"Analysts Offer Insights on Technology Companies: ON24 (ONTF), Fabrinet (FN) and Envestnet (ENV)",5/9/2024 12:30:29 PM
FN,"FN Stock Earnings: Fabrinet Beats EPS, Beats Revenue for Q3 2024",5/7/2024 1:54:11 AM
FN,"Fabrinet Non-GAAP EPS of $2.39 beats by $0.28, revenue of $731.54M beats by $16.44M",5/6/2024 8:21:04 PM
FN,Fabrinet Q3 2024 Earnings Preview,5/5/2024 9:35:00 PM
FN,3 5G Technology Stocks With the Potential to Make You an Overnight Millionaire,5/2/2024 6:19:30 PM
FN,The Analyst Verdict: Fabrinet In The Eyes Of 5 Experts,5/1/2024 8:00:30 PM
FN,Why Is Amesite (AMST) Stock Up 74% Today?,4/24/2024 2:23:24 PM
FN,The Analyst Verdict: Fabrinet In The Eyes Of 5 Experts,4/11/2024 3:01:22 PM
FN,Buy Rating for Fabrinet: A Conservative Estimate Amid Telecom Headwinds and AI Growth Opportunities,3/22/2024 9:55:35 AM
FN,"Fabrinet stock jumps after Northland upgrades to Outperform, raises PT",3/21/2024 7:54:15 PM
FN,Silicon Valley’s Secret Sauce: 3 Tech Stocks With Breakout Potential,3/6/2024 8:13:38 PM
FN,Tomorrow’s Titans: The 3 Most Promising Stocks Predicted to Skyrocket,2/27/2024 10:22:20 PM
FN,Get Rich Quick With These 7 Tech Stocks to Buy Now,2/13/2024 8:49:58 PM
FN,Unlocking Value in AI Stocks: Strategic Insights Amidst Market Rotation,2/7/2024 11:47:17 PM
FN,Why FMC Shares Are Trading Lower By Around 10%? Here Are Other Stocks Moving In Tuesday's Mid-Day Session,2/6/2024 7:17:47 PM
FN,"Fabrinet Non-GAAP EPS of $2.08 beats by $0.05, revenue of $712.7M beats by $17.31M",2/5/2024 9:22:45 PM
FN,Notable earnings after Monday's close,2/4/2024 10:35:52 PM
FN,Why These 7 Russell 2000 Stocks Should Be on Your Radar in 2024,12/21/2023 1:46:44 PM
FN,The 3 Best Tech Stocks to Buy in December,12/6/2023 4:19:37 AM
FN,The 3 Best Russell 2000 Stocks to Buy in December,12/5/2023 10:54:03 PM
FN,3 Stocks to Buy for Their Proximity to Nvidia,11/8/2023 7:35:50 PM
FN,"Analysts Are Bullish on These Technology Stocks: Fabrinet (FN), Teradata (TDC)",11/7/2023 2:20:24 PM
FN,Fabrinet earnings preview: what Wall Street is expecting,11/6/2023 3:01:14 PM
FN,7 Secret Semiconductor Stocks Ready to Grab the Spotlight,11/2/2023 1:24:52 PM
FN,The Latest Analyst Ratings for Fabrinet,10/5/2023 11:00:24 PM
FN,Stocks to Watch: 3 Smaller Tech Players Ready for a Breakout,9/7/2023 7:32:48 PM
FN,The Latest Analyst Ratings for Fabrinet,8/30/2023 9:00:20 PM
FN,Top 5 Tech Stocks That May Plunge This Quarter,8/25/2023 2:39:23 PM
FN,Crude Oil Falls; Dick's Sporting Goods Earnings Miss Views,8/22/2023 9:07:14 PM
FN,"Fabrinet Non-GAAP EPS of $1.86 beats by $0.06, revenue of $655.87M beats by $14.46M",8/21/2023 8:18:22 PM
FN,Notable earnings after Monday's close,8/20/2023 9:35:44 PM
FN,Why Fabrinet's New AI Customer Could Bring in Over $100M Business: An Analyst's Perspective,6/12/2023 8:39:06 PM
FN,"Booz Allen Hamilton, Workday, Marvell Technology And Other Big Stocks Moving Higher On Friday",5/26/2023 4:46:55 PM
FN,Lake Street Reaffirms Their Buy Rating on Fabrinet (FN),5/9/2023 1:05:15 PM
FN,"Fabrinet Non-GAAP EPS of $1.94 beats by $0.07, revenue of $665.28M beats by $14.75M",5/8/2023 8:48:54 PM
FN,Fabrinet Q3 2023 Earnings Preview,5/7/2023 9:35:00 PM
FN,"Benzinga's Top Ratings Upgrades, Downgrades For April 21, 2023",4/21/2023 5:00:47 PM
FN,J.P. Morgan Sticks to Its Buy Rating for Fabrinet (FN),4/19/2023 4:25:49 PM
FN,Top 5 Tech Stocks That Are Preparing To Pump In April,4/17/2023 1:48:20 PM
FN,Why Levi Strauss Shares Are Trading Lower By Around 13%? Here Are Other Stocks Moving In Thursday's Mid-Day Session,4/6/2023 7:24:18 PM
FN,JD.com To Rally Over 49%? Here Are 10 Other Analyst Forecasts For Tuesday,2/7/2023 3:15:31 PM
FN,"Fabrinet Q2 Profit Increases, beats estimates",2/6/2023 10:33:11 PM
FN,Notable earnings after Monday's close,2/5/2023 10:35:20 PM
FN,Analysts Have Conflicting Sentiments on These Technology Companies: Fabrinet (FN) and Northrop (NOC),1/27/2023 10:50:29 AM
FN,7 Tech Stocks to Buy as a New Bull Market Emerges ,1/24/2023 3:04:48 AM
FN,"Benzinga's Top Ratings Upgrades, Downgrades For December 20, 2022",12/20/2022 4:01:25 PM
FN,"DuPont, Expeditors International, Planet Fitness And Other Big Gainers From Tuesday",11/9/2022 8:53:42 AM
FN,Fabrinet To Surge 26%? Here Are 5 Other Price Target Changes For Tuesday,11/8/2022 12:56:19 PM
FN,"Fabrinet Non-GAAP EPS of $1.97, revenue of $655.4M",11/7/2022 9:43:33 PM
FN,Notable earnings after Monday's close,11/6/2022 9:35:11 PM
FN,Fabrinet Q1 2023 Earnings Preview,10/28/2022 9:35:14 PM
FN,J.P. Morgan Sticks to Their Hold Rating for Fabrinet (FN),10/15/2022 12:16:17 PM
FN,Needham Remains a Buy on Fabrinet (FN),10/3/2022 10:05:15 AM
FN,This Technology Stock Jumped 55% Following Q2 Results; Here Are 96 Biggest Movers From Yesterday,8/17/2022 11:40:04 AM
FN,Fabrinet's Upbeat Q2 & Guidance Prompts 4% Price Target Hike By This Analyst,8/16/2022 8:01:09 PM
FN,"Fabrinet Non-GAAP EPS of $1.68 beats by $0.14, revenue of beats by $6.39M with bullish outlook",8/15/2022 8:19:46 PM
FN,Notable earnings after Monday's close,8/14/2022 9:35:50 PM
FN,Fabrinet Q4 2022 Earnings Preview,8/12/2022 9:35:00 PM
FN,80 Biggest Movers From Yesterday,5/4/2022 11:04:58 AM
FN,41 Stocks Moving In Tuesday's Mid-Day Session,5/3/2022 6:14:47 PM
FN,"Fabrinet Non-GAAP EPS of $1.50 misses by $0.02, revenue of $564.4M misses by $10.91M",5/2/2022 8:23:33 PM
FN,Fabrinet Q3 2022 Earnings Preview,5/1/2022 9:45:00 PM
FN,"Benzinga's Top Ratings Upgrades, Downgrades For April 26, 2022",4/26/2022 4:04:16 PM
FN,52 Biggest Movers From Yesterday,2/2/2022 10:40:03 AM
FN,34 Stocks Moving In Tuesday's Mid-Day Session,2/1/2022 7:46:32 PM
FN,"Fabrinet Non-GAAP EPS of $1.50 beats by $0.04, revenue of $566.6M beats by $11.63M",1/31/2022 9:26:37 PM
FN,Notable earnings after Monday's close,1/30/2022 10:35:30 PM
FN,10 Stellar Small-Cap Tech Stocks to Buy Before the Market Catches On,11/16/2021 5:57:41 PM
FN,71 Biggest Movers From Yesterday,11/3/2021 8:40:30 AM
FN,Analysts Raise Fabrinet Price Target Post Q1 Beat,11/2/2021 10:26:23 PM
FN,"Fabrinet EPS beats by $0.12, beats on revenue",11/1/2021 9:32:27 PM
FN,Fabrinet earnings: here's what Wall Street expects,10/31/2021 3:01:13 PM
FN,Fabrinet Q1 2022 Earnings Preview,10/29/2021 9:35:46 PM
FN,Alfi tops tech gainers; WidePoint and Kubient among losers,8/17/2021 7:03:46 PM
FN,First National Financial Corporation Announces August Dividend payment,8/16/2021 11:00:00 PM
FN,Notable earnings after Monday's close,8/15/2021 9:35:00 PM
FN,Here's what Wall Street expects from Fabrinet's earnings report,8/14/2021 3:01:20 PM
FN,First National Financial Corporation Reports 2021 Second Quarter Results,7/27/2021 11:00:00 PM
FN,10 Biggest Price Target Changes For Monday,7/19/2021 1:46:52 PM
FN,First National Financial Corporation Announces July Dividend Payment,7/15/2021 11:00:00 PM
FN,"First National Financial Corporation to Host Second Quarter 2021 Results Conference Call on July 28, 2021",6/23/2021 2:00:00 PM
FN,First National Financial Corporation Announces June Dividend Information,6/15/2021 11:00:00 PM
FN,FDA grants accelerated review to BeyondSpring's plinabulin combo application; shares up 8%,6/1/2021 12:59:12 PM
FN,Notable earnings after Monday's close,5/2/2021 9:35:00 PM
FN,Fabrinet earnings preview: what to expect,5/1/2021 3:01:19 PM
FN,Fabrinet reports record-breaking FQ2 with strong guidance,2/2/2021 3:39:39 PM
FN,A Peek Into The Markets: US Stock Futures Surge Ahead Of Manufacturing Data,2/1/2021 12:25:56 PM
FN,Notable earnings after Monday's close,1/31/2021 10:35:00 PM
FN,Here's what to expect from Fabrinet's earnings,1/30/2021 3:01:18 PM
FN,Fabrinet Q2 Earnings Preview,1/29/2021 10:35:16 PM
FN,Stocks That Hit 52-Week Highs On Tuesday,1/5/2021 4:26:30 PM
FN,Stocks That Hit 52-Week Highs On Friday,12/18/2020 8:42:01 PM
FN,Phononic and Fabrinet collaborates to enhance production of high-performance Thermoelectrics,12/7/2020 1:47:37 PM
FN,"Needham reviews the names stealing Cisco's share, and high-upside optical networkers",11/24/2020 11:54:40 PM
FN,"Fabrinet reports record quarterly revenue in Q1, guides EPS higher",11/3/2020 10:00:33 AM
FN,Fabrinet Q1 Earnings Preview,11/1/2020 10:35:54 PM
FN,"No bubble for networking/IT hardware stocks, but be selective - J.P. Morgan",10/12/2020 9:58:32 PM
FN,Here's what to expect from Fabrinet's earnings report,8/16/2020 3:01:18 PM
FN,3 High-Performing Fiber Optic Stocks to Watch,7/13/2020 7:26:59 PM
FN,"LB, HTZ, UNM and CHGG among after-hours movers",5/4/2020 9:37:32 PM
FN,Fabrinet Q3 Earnings Preview,5/3/2020 9:35:51 PM
FN,Stock Alert: Fabrinet Shares Up After Earnings Surpass Estimates ,2/4/2020 4:43:02 PM
FN,Fabrinet earnings preview: what Wall Street is expecting,2/2/2020 3:01:24 PM
FN,"3 Big Stock Charts for Tuesday: Roku, Fabrinet, and Realty Income",12/17/2019 12:14:24 PM
FN,First National Financial Corporation Announces Secondary Offering of Its Common Shares,11/25/2019 10:58:29 PM
FN,Here's what to expect from Fabrinet's earnings report,8/17/2019 3:01:18 PM
FN,Fabrinet earnings preview: what Wall Street is expecting,5/4/2019 3:01:24 PM
FN,Fabrinet earnings: here's what Wall Street expects,2/2/2019 3:01:24 PM
FN,Here's what to expect from Fabrinet's earnings report,11/3/2018 3:01:32 PM
FN,Fabrinet earnings preview: what to expect,8/18/2018 3:01:19 PM
FN,First National Financial Corporation Announces June Dividend Information,6/15/2018 11:00:00 PM
FN,First National Financial Corporation Announces May Dividend Payment,5/15/2018 11:00:00 PM
FN,First National Financial Corporation Announces Election of Board of Directors,5/8/2018 9:00:00 PM
FN,BRIEF-Fabrinet Q3 GAAP Earnings Per Share $0.55,5/7/2018 10:22:20 PM
FN,First National Financial Corporation Reports First Quarter 2018 Results,5/1/2018 11:00:00 PM
FN,First National Financial Corporation Announces April Dividend Payment,4/16/2018 11:00:00 PM
FN,"First National Financial Corporation to Host First Quarter 2018 Results Conference Call on May 2, 2018",4/9/2018 2:37:00 PM
FN,First National Financial Corporation Announces March Dividend Information,3/15/2018 10:00:00 PM
FN,Food Recall Warning - Certain Smoked Rainbow Trout products manufactured by Tarini Brothers Meat and Fish Market recalled due to potential presence of dangerous bacteria,3/3/2018 9:56:00 PM
FN,First National Financial Corporation Reports Fourth Quarter and Annual 2017 Results,2/27/2018 11:00:00 PM
FN,First National Financial Corporation Announces February Dividend Payment,2/15/2018 11:00:00 PM
FN,New Holland presents NHDrive autonomous T4.110F vineyard tractor ready for pilot project deployment at E. & J. Gallo Winery,2/13/2018 8:46:00 PM
FN,"First National Financial Corporation to Host Fourth Quarter 2017 Results Conference Call on February 28, 2018",2/1/2018 7:11:00 PM
FN,First National Financial Corporation Announces January Dividend Payment,1/15/2018 11:00:00 PM
FN,First National Financial Corporation Announces December Dividend Information,12/15/2017 11:00:00 PM
FN,"Clearford Signs Contracts for Two New Clearford One Systems in India, and Update on Tata and Essel MOUs",12/7/2017 2:00:00 PM
FN,"SDX Energy Inc. (""SDX"" or the ""Company"") - Updates on the Sebou and Gharb Centre permits",11/20/2017 8:00:00 AM
FN,Horizons ETFs Opens the Market,11/17/2017 4:54:00 PM
FN,First National Financial Corporation Announces November and Special Dividend Payment,11/15/2017 11:00:00 PM
FN,Dollarama to Report Third Quarter Fiscal 2018 Results,11/13/2017 9:23:00 PM
FN,BRIEF-Fabrinet posts Q1 adj. earnings per share $0.75 (FN),11/6/2017 10:57:06 PM
FN,Blood service workers deliver 89 per cent strike vote,11/3/2017 7:19:00 PM
FN,BRIEF-First National Financial reports qtrly ‍shr $0.96​ (FN),10/25/2017 12:17:17 AM
FN,"First National Financial Corporation Reports Third Quarter 2017 Results, Declares Special Common Share Dividend",10/24/2017 11:01:00 PM
FN,BRIEF-Fabrinet says former CEO David Mitchell‍​'s FY 2017 total compensation was $10.5 mln -SEC Filing (FN),10/20/2017 1:22:18 PM
FN,Governor General to Attend the Royal Cremation of the King of Thailand,10/19/2017 8:48:00 PM
FN,Leagold Reports Infill Drilling Results from Bermejal Program,10/18/2017 2:00:00 PM
FN,BRIEF-First National Financial comments on revised B-20 mortgage rules (FN),10/17/2017 11:47:03 PM
FN,First National Financial Corporation Announces October Dividend Payment,10/16/2017 11:00:00 PM
FN,First National Financial Corporation surpasses $100 billion in mortgages under administration,10/12/2017 2:00:00 PM
FN,New Flyer Industries Inc. Introduces NFI Parts™ Brand,10/8/2017 6:00:00 PM
FN,Summit Industrial Income REIT Announces Timing of Third Quarter 2017 Results & Conference Call,10/5/2017 11:02:00 PM
FN,Rockwell announces voting results of the annual general and special meeting of shareholders,10/3/2017 5:17:00 PM
FN,BRIEF-Fabrinet names Seamus Grady CEO (FN),9/25/2017 11:07:14 PM
FN,Canadians Teaching the World,9/20/2017 10:02:00 PM
FN,"Initiating Research Reports on Electronic Equipment Equities -- Energous, Apple, Fabrinet, and Philips",9/15/2017 12:40:00 PM
FN,"Investors: Covered-call reports for Box, Foot Locker, Fabrinet, Intellia Therapeutics and Tenet Healthcare",8/22/2017 3:31:00 PM
FN,BRIEF-Fabrinet Q4 non-GAAP earnings per share $0.86 (FN),8/21/2017 10:27:16 PM
FN,"Pre-Market Technical Recap on Electronic Equipment Stocks -- Apple, Fabrinet, Philips, and Sony",8/11/2017 12:05:00 PM
FN,"CANADA STOCKS-Futures edge higher as commodity prices rise (POT, CPG, CVE, COP, AGT, FN)",7/27/2017 1:28:06 PM
FN,"CANADA STOCKS-Futures rise as oil hovers near eight-week high (L, CNR, AGT, FN)",7/26/2017 1:30:05 PM
FN,BRIEF-First National Financial Corp Q2 earnings per share C$1.13 (FN),7/25/2017 11:52:03 PM
FN,"Stocks Under Scanner in the Electronic Equipment Space -- Apple, Koninklijke Philips, Sony, and Fabrinet",6/30/2017 12:50:00 PM
FN,BRIEF-Fabrinet Q3 non-GAAP earnings per share $0.80 (FN),5/8/2017 10:38:05 PM
FN,"A fund manager with $13.6 billion in assets shares his simple strategy for picking stocks (FN, NTRS)",4/26/2017 3:15:32 PM
FN,BRIEF-First National Financial Corp reports Q1 earnings per share $0.58 (FN),4/25/2017 11:13:08 PM
FN,"Technical Reports on Electronic Equipment Equities -- Apple, Koninklijke Philips, Fabrinet, and Sony",4/10/2017 12:15:00 PM
FN,"Consumer Goods Stocks on Investors' Radar -- Church & Dwight, Ecolab, Harman, and Fabrinet",3/1/2017 1:55:00 PM
FN,BRIEF-Fabrinet sees Q3 revenue $360 mln-$364 mln (FN),2/6/2017 10:36:08 PM
FN,BRIEF-Fabrinet announces Q1 fiscal-year 2017 financial results (FN),11/7/2016 11:46:18 PM
FN,BRIEF-First National Financial Corp reports Q3 2016 results (FN),10/25/2016 11:28:21 PM
FN,"CANADA STOCKS-Futures rise tracking gains in global markets (ARX, FN, IMG)",10/20/2016 3:18:22 PM
FN,BRIEF-First National Financial comments on new mortgage rules (FN),10/11/2016 4:10:28 PM
