Ticker,Title,Link
GME,3 Stocks to Buy for a Massive Short-Squeeze Rally,3/14/2023 4:15:20 PM
GME,GME Stock Alert: Can Bank Stocks Crash Squeeze GameStop Higher?,3/13/2023 4:54:41 PM
GME,Michael Burry Drops Cryptic Tweet: 'Possible Today We Found Our Enron',3/10/2023 1:35:20 PM
GME,Why AMC Stock Is a ‘Zombie’ in the Market Right Now,3/8/2023 9:29:13 PM
GME,3 Meme Stocks That Are a Must-Sell in March,3/7/2023 3:48:30 AM
GME,"Charles Schwab Sentiment Survey: Traders Getting More Bullish But How Do They Feel About Meme Stocks, Bitcoin?",3/3/2023 5:09:18 PM
GME,I Asked ChatGPT for 10 Meme Stocks to Buy. Here’s What It Recommended.,3/2/2023 4:37:16 PM
GME,Pitney Bowes continues to rise amid increased activist attention,2/27/2023 1:45:48 PM
GME,"Benzinga Bulls And Bears: Apple, Tesla, Meta, Gamestop And Why Nvidia's CEO Calls ChatGPT 'Wonderful'",2/25/2023 11:04:25 PM
GME,I ‘Tricked’ ChatGPT Into Picking Stocks to Buy. Here’s What It Said.,2/17/2023 6:35:08 PM
GME,"Meme Stocks Are Back, Short Sellers Beware: The Quick-Hit Playbook For 2023",2/16/2023 7:41:13 PM
GME,Steve Cohen's Point72 fund built a $108 million Tesla stake last quarter - and made a surprise bet on GameStop,2/15/2023 5:06:01 PM
GME,3 Stocks to Sell Now According to Analysts,2/14/2023 7:41:25 PM
GME,"10 Stocks That Are Crushing Short Sellers In 2023: Where Do Tesla, Apple, Lucid Motors Rank?",2/13/2023 6:24:10 PM
GME,Vanguard Is Doubling Down on GameStop (GME) Stock,2/10/2023 8:16:20 PM
GME,7 Out-Dated Meme Stocks to Sell Before It’s Too late,2/9/2023 12:00:41 PM
GME,AI stocks are soaring in a meme-like frenzy. Here's why investors won't have to rely on Reddit enthusiasm to sustain the rally.,2/8/2023 7:55:30 PM
GME,"BBBY, UBER, GOOGL Predictions: 3 Hot Stocks for Tomorrow",2/7/2023 10:00:35 PM
GME,What's Going On With AMC Shares Skyrocketing Monday?,2/6/2023 9:55:18 PM
GME,Nordstrom Stock: Ryan Cohen Just Created the Newest Meme Stock,2/3/2023 8:21:40 PM
GME,Short squeeze rallies may be firing up again - watch these stocks,2/2/2023 3:14:23 PM
GME,EXCLUSIVE: StockTwits CEO Rishi Khanna On Main St. Vs. Wall St. And Why This Sector Will Trend In 2023,2/1/2023 3:16:10 PM
GME,3 Sorry Meme Stocks to Sell in February Before It’s Too Late,1/30/2023 6:04:40 PM
GME,3 Short-Squeeze Stocks to Sell Before Investors Cash Out,1/29/2023 12:39:01 PM
GME,Genius (GNS) and Helbiz (HLBZ) Are Fighting Short Sellers. It’s the Wrong Battle.,1/25/2023 1:00:07 PM
GME,Why Is GameStop (NYSE:GME) Stock Up 10% Today?,1/23/2023 7:08:41 PM
GME,AMC Stock: Adam Aron Backs Cash Raises as Regal Closes Theaters,1/20/2023 8:02:15 PM
GME,Friday Predictions: 3 Hot Stocks for Tomorrow,1/19/2023 10:30:48 PM
GME,Thursday Predictions: 3 Hot Stocks for Tomorrow,1/18/2023 9:30:09 PM
GME,"'When I Find Things I Have A Lot Of Conviction In, I Go All-in': Ryan Cohen's Stake In Alibaba And History Of Activism",1/17/2023 8:32:27 PM
GME,Meme traders are battling shorts again - watch these stocks,1/14/2023 2:46:20 PM
GME,PRTY… BBBY… MULN… There’s a Meme Stocks Investor in All of Us,1/13/2023 9:32:16 PM
GME,GameStop Stock Is Up 25% This Week: What's Going On?,1/12/2023 11:02:46 PM
GME,What's Going On With AMC Entertainment Stock?,1/11/2023 8:10:09 PM
GME,"Exclusive: Top 10 Most Searched Tickers On Benzinga Pro In 2022 — Where Do SPY, Tesla, Apple And AMC Rank?",1/9/2023 10:34:34 PM
GME,Is Ryan Cohen Going to Save Bed Bath & Beyond (BBBY) Stock?,1/6/2023 6:55:49 PM
GME,"Retail stocks slump after Bed, Bath & Beyond warning, ICR Conference jitters",1/5/2023 4:51:13 PM
GME,"Dear BBBY Stock Fans, Mark Your Calendars for Jan. 10",1/3/2023 3:52:07 PM
GME,7 Stocks That Are About to Get Absolutely Crushed,1/2/2023 6:13:56 PM
GME,3 Video Game Stocks to Sell on Slowing Sales,12/30/2022 1:16:03 PM
GME,7 Hot Meme Stocks of 2022 to Sell Before 2023,12/25/2022 8:58:29 PM
GME,Three Pharma Stocks to Sell Before They Die,12/24/2022 10:20:28 PM
GME,Why Meme Stocks Investors Are Worried About Ken Griffin and Elon Musk,12/19/2022 5:53:31 PM
GME,Why Now Is NOT the Time to Buy GME Stock,12/16/2022 9:00:34 PM
GME,"This Toy Is Selling For 15,900% More Than Its Original Price Ahead of Christmas",12/15/2022 10:39:22 PM
GME,Hardware gains drive November videogame sales to first growth in a year,12/10/2022 3:31:00 PM
GME,EXCLUSIVE: Benzinga Moneymaker Series: Top 5 Stocks For Investors To Watch,12/9/2022 10:55:37 PM
GME,"S&P 500 breaks five-session losing streak; Nasdaq, Dow also rise",12/8/2022 9:06:13 PM
GME,GameStop posts wider than expected loss as sales slow (update),12/7/2022 11:48:04 PM
GME,Notable earnings after Wednesday's close,12/6/2022 10:35:49 PM
GME,Wedbush Keeps Their Sell Rating on GameStop (GME),12/5/2022 4:15:15 PM
GME,GME Stock: 3 Things to Watch When GameStop Reports Earnings,12/2/2022 9:24:51 PM
GME,NWBO Stock Alert: Northwest Bio Slams Citadel Securities in New Lawsuit,12/1/2022 9:00:21 PM
GME,Elon Musk Needs to Buy GameStop Next. Seriously.,11/30/2022 4:15:11 PM
GME,"Dear GME Stock Fans, Mark Your Calendars for Dec. 7",11/29/2022 8:43:30 PM
GME,GameStop Short Sellers May Be 'Running Out Of Bullets': Analyst,11/23/2022 6:31:07 PM
GME,Billionaire Investor Carl Icahn Betting Against GameStop Stock ,11/22/2022 10:14:24 PM
GME,Why Is Bed Bath & Beyond (BBBY) Stock Down Today?,11/16/2022 5:13:49 PM
GME,What Is Going on With GameStop (GME) Stock Today?,11/15/2022 8:39:38 PM
GME,"The Bear Market Could Go On For Longer If History Proves Right, But 1 Sector Is Bucking The Downturn",11/14/2022 4:31:31 PM
GME,7 Penny Stocks Smart Investors Shouldn’t Touch With a 10-Foot Pole,11/13/2022 5:07:27 PM
GME,"Videogame sales fell 5% in third quarter, with content and mobile declining",11/10/2022 8:55:23 PM
GME,Why RumbleON Shares Are Trading Higher By Around 28%? Here Are 84 Stocks Moving In Wednesday's Mid-Day Session,11/9/2022 6:33:20 PM
GME,The Profit and Protection Quantitative Stock-Picking System,11/8/2022 1:00:53 PM
GME,Robinhood Traders Beat The S&P 500: Is The Retail Investor Back?,11/4/2022 7:33:08 PM
GME,Why Investors Should Bet $100 on GameStop (GME) Stock,11/2/2022 3:10:06 PM
GME,PERF Stock Soars 21% on First Trading Day,10/31/2022 4:04:57 PM
GME,Why did GameStop stock rally today? Highly-shorted stocks are catching bids,10/28/2022 7:48:20 PM
GME,GameStop Gossip Makes GME Stock One to Watch,10/27/2022 10:15:39 AM
GME,Mullen (MULN) Stock Heats Up on Expanded Promotional Tour,10/26/2022 5:07:38 PM
GME,5 Investors Betting Big on GameStop (GME) Stock,10/25/2022 6:25:32 PM
GME,"Huadi: Big News Coming, or Just Another China Meme Stock?",10/24/2022 5:52:30 PM
GME,Videogame sales fall for 11th straight month in September,10/22/2022 3:03:00 PM
GME,"GameStop Shares Pop Tuesday On A Tweet From Ryan Cohen, Here's Why",10/18/2022 5:47:35 PM
GME,The One Stock That Could Soar in a Market Crash,10/12/2022 3:51:02 PM
GME,AMC Stock: Perhaps the Apes WERE Right about AMC Entertainment After All,10/11/2022 6:47:01 PM
GME,3 Reddit Stocks That Are Too Cheap to Ignore,10/10/2022 10:08:44 PM
GME,'I Want You To Bet Against Me': Jim Cramer Calls Out New Inverse ETF With His 42 Years Of Success,10/7/2022 4:18:19 PM
GME,Want to Short Jim Cramer? Now You Can with the SJIM ETF.,10/6/2022 2:01:05 PM
GME,After the Wipeout: What’s Next for the Meme Mania?,10/1/2022 8:47:06 AM
GME,Everything You Need To Know Before Bed Bath & Beyond Reports Q2 Earnings This Week,9/27/2022 9:24:22 PM
GME,"KB Home, Darden Restaurants And Other Big Losers From Thursday",9/23/2022 11:03:36 AM
GME,7 Meme Stocks to Buy During a Stock Market Crash,9/22/2022 11:15:11 AM
GME,"Videogame sales slip again in August, but top 2020 numbers",9/21/2022 11:02:00 AM
GME,Short Interest Sector Focus: Consumer Cyclical Sector,9/20/2022 5:12:49 PM
GME,7 Stocks Reporting Earnings the Week of Sept. 19,9/19/2022 2:55:38 AM
GME,Beware! GME Stock Is Still a Long Shot Despite Crypto Deal.,9/15/2022 3:36:59 PM
GME,What Is the Next Big Meme Stock to Buy? Our 3 Top Picks.,9/13/2022 3:39:03 PM
GME,3 Meme Stocks to Buy With Surprisingly Superior Fundamentals,9/12/2022 4:01:20 PM
GME,Why ShiftPixy Surged Around 177%; Here Are 71 Biggest Movers From Yesterday,9/9/2022 10:14:31 AM
GME,7 Growth Stocks to Sell Now,9/8/2022 8:05:48 PM
GME,"GameStop Corp. Q2 Loss Increases, but beats estimates",9/7/2022 10:10:52 PM
GME,Notable earnings after Wednesday's close,9/6/2022 9:35:58 PM
GME,"Was Bed Bath & Beyond A 'Pump And Dump'? Ryan Cohen, Deceased CFO Named In Shareholder Lawsuit",9/5/2022 7:19:47 PM
GME,GME Stock: 3 Things to Watch When GameStop Reports Earnings Sept. 7,9/2/2022 8:38:54 PM
GME,3 Picks That Could Be the Next Meme Stock Champion,8/31/2022 8:05:11 PM
GME,What's Going On With Bed Bath & Beyond Stock?,8/30/2022 5:35:44 PM
GME,Bed Bath & Beyond Stock Pops Ahead Of Strategic Update: What Investors Need To Know,8/29/2022 3:46:03 PM
GME,"Dear BBBY Stock Fans, Mark Your Calendars for Aug. 31",8/26/2022 3:40:09 PM
GME,The 3 Most Popular Meme Stocks to Sell While You Can,8/25/2022 10:30:07 AM
GME,Short Interest Sector Focus: Consumer Cyclical Sector,8/24/2022 4:36:36 PM
GME,"Can AMC, APE Stocks Recover After Major Plunge?",8/23/2022 2:27:16 PM
GME,Could Bed Bath & Beyond Declare Bankruptcy? These 2 Recent Developments Suggest Yes,8/22/2022 9:36:07 PM
GME,7 Stocks to Sell Before the Next Black Swan Event,8/21/2022 10:15:21 PM
GME,GME vs. BBBY: Which Meme Stock is Less Risky?,8/20/2022 10:57:59 PM
GME,S&P 500 Snaps 4-Week Winning Streak As Investors Anticipate Higher Interest Rates,8/19/2022 10:07:48 PM
GME,After-Hours Alert: Why Bed Bath & Beyond Stock Is Plunging,8/18/2022 11:10:35 PM
GME,Why Is Bed Bath & Beyond Stock Tanking After Hours?,8/17/2022 11:53:06 PM
GME,"Fubo Shares Took Off, Then Dropped, Then Reversed: What Happened To The Sports Streaming Platform On Its Investor Day",8/16/2022 11:50:06 PM
GME,Why Revlon Stock Is Soaring Today,8/15/2022 10:00:04 PM
GME,"Bulls and Bears Of The Week: NVIDIA, Tesla, GameStop, AMC, And Why Disney Could Run 40% Higher",8/13/2022 5:48:02 PM
GME,Is Bed Bath & Beyond (BBBY) Stock the Next Big Squeeze?,8/12/2022 4:45:26 PM
GME,Judge rules meme-stock traders can sue Robinhood after 2021 trading restrictions,8/11/2022 7:25:10 PM
GME,"Jim Cramer Sides With The Apes, Says AMC Entertainment Stock Is A 'Terrible Short': 5 Other Short Squeeze Candidates On His Radar",8/10/2022 6:33:15 PM
GME,Why Bed Bath & Beyond Stock Is Plunging Today,8/9/2022 5:58:31 PM
GME,AMTD Digital falls 44%% as meme darling continues swing into the red,8/8/2022 8:18:56 PM
GME,"Videogame sales tumble 13% in Q2, with mobile again leading way down",8/5/2022 6:20:45 PM
GME,Is Red-Hot AMTD Digital (HKD) Stock Really a Meme?,8/4/2022 4:36:52 PM
GME,"Institutions Trade Millions Worth Of This Fund That Tracks AMD, Nvidia, Intel, Texas Instruments Stocks",8/1/2022 7:22:54 PM
GME,A Guide to How the Stock Market Works,7/28/2022 5:55:21 PM
GME,Exela Technologies Lures APES Investors With Gorilla Fund Partnership,7/26/2022 10:40:07 PM
GME,Will Snap Stock Split? Bizarre 2-for-1 Split Plans Put Pressure on SNAP Stock to Skyrocket.,7/25/2022 8:58:47 PM
GME,7 Meme Stocks Trading at a Massive Discount Right Now,7/24/2022 2:00:55 PM
GME,"This Consumer Defensive Stock Is Trading Higher By Around 49%, Here Are 46 Stocks Moving In Friday's Mid-Day Session",7/22/2022 6:49:30 PM
GME,7 Surprising Meme Stocks to Buy and Hold in 2022,7/21/2022 10:19:34 AM
GME,What Institution Traded An Unusual Amount of Trump-Based Digital World Stock In A Dark Pool?,7/20/2022 10:24:36 PM
GME,These stocks are on the most crowded shorts list - watch out above,7/19/2022 4:15:57 PM
GME,Loopring Price Predictions: Where Will the Red-Hot LRC Crypto Go Next?,7/18/2022 2:30:12 PM
GME,Should You Buy GOOG on Monday After Its Big Split?,7/15/2022 9:22:21 PM
GME,GME Stock Rallies Ahead of July 22 GameStop Stock Split,7/14/2022 4:45:13 PM
GME,Citron's Andrew Left Calls Crypto A 'Complete Fraud': Is The Short Seller Talking His Own Book?,7/12/2022 6:24:42 PM
GME,A More Positive Outlook Ahead of Q2 Earnings,7/11/2022 8:06:31 PM
GME,AMC Stock Climbs Higher as CEO Adam Aron Rolls Out NFT Incentives,7/8/2022 7:28:28 PM
GME,"GME Stock Falls on GameStop Layoffs, CFO Termination",7/7/2022 9:54:36 PM
GME,"GameStop Approves 4-for-1 Stock Split, Stock Up 4% ",7/6/2022 10:33:49 PM
GME,The One 5x Financial Stock to Watch,7/5/2022 8:58:19 PM
GME,What Do They Know That We Don't? Institutions Just Bet $18M On The U.S. Oil Fund Via Dark Pools,7/1/2022 6:13:22 PM
GME,'It's Game Over': Loop Capital Analyst Warns That Bed Bath & Beyond's Days Are Limited,6/29/2022 10:42:23 PM
GME,House Report Shows Robinhood Was Unprepared for Meme Stocks Frenzy,6/28/2022 4:15:26 PM
GME,GameStop Stock Remains an Oddity In This Volatile Market,6/27/2022 11:40:07 AM
GME,Stocks Rebound From 2022 Lows As Market Digests Fed Chair Powell's Congressional Testimony,6/24/2022 9:53:16 PM
GME,It’s Not All Fun and Games Anymore With GameStop Stock,6/23/2022 10:00:40 AM
GME,"Gamestop Won’t Make You Rich Here, But It Could Break You",6/21/2022 1:00:52 PM
GME,Why GameStop Stock Is Not Unsinkable,6/18/2022 10:20:01 AM
GME,The 5 Top Profit & Protection Stocks to Buy for 2022,6/17/2022 8:23:52 PM
GME,Cryptocurrency Has Crashed: Here’s Dogecoin’s Silver Lining,6/15/2022 4:13:44 PM
GME,Market Mania: Revlon (REV) Stock Soars 100% Despite Bankruptcy Risk,6/14/2022 8:43:09 PM
GME,5 Investors Betting Big on Redbox (RDBX) Stock,6/13/2022 7:42:47 PM
GME,Are Stock Splits Bad for Investors?,6/11/2022 4:30:44 PM
GME,2 Cheap Stocks Trading at “Deal of the Century” Prices,6/10/2022 8:13:17 PM
GME,"Beyond Meat, Peloton and GameStop fall as risk-off trading picks up amid macro anxiety",6/9/2022 4:56:43 PM
GME,SEC Announcement Sees Regulators Targeting Payment for Order Flow,6/8/2022 7:19:59 PM
GME,What's In Ryan Cohen's Portfolio? Just These Two Stocks,6/7/2022 10:38:05 PM
GME,"5 Short Squeeze Candidates To Watch This Week: Cassava Sciences Tops List, GameStop Short Interest And Cost To Borrow Rise",6/6/2022 5:40:58 PM
GME,4 Stocks That the Rich and Powerful Bought in Q1,6/5/2022 1:00:25 PM
GME,GameStop Stock Looks to Be Entering a Short Squeeze Set Up,6/3/2022 11:00:01 AM
GME,Jefferies Says GameStop (GME) Stock Is Still a ‘Hold’,6/2/2022 8:33:18 PM
GME,"GameStop Corp. Q1 Loss Decreases, but misses estimates",6/1/2022 10:12:07 PM
GME,Notable earnings after Wednesday's close,5/31/2022 9:35:43 PM
GME,Cathie Wood Is Bucking the Trend With Robinhood,5/30/2022 12:30:43 PM
GME,"4 Top Stock Trades for Tuesday: Ethereum, ARKK, BB, DELL",5/27/2022 8:28:56 PM
GME,7 Big Stock Splits to Watch in 2022,5/26/2022 8:57:41 PM
GME,The 3 Best Meme Stocks That May Be Worth a Speculative Buy,5/25/2022 11:10:22 PM
GME,"TradeZero Halted Trading in Meme Stocks AMC, GME, KOSS. Now It Owes the SEC $100,000.",5/24/2022 9:22:46 PM
GME,7 of the Best Reddit Stocks to Buy if You Have $100 to Spare,5/23/2022 10:09:00 PM
GME,3 Stocks to Buy the Dip Now,5/20/2022 8:58:52 PM
GME,The rise and fall of Melvin Capital — a timeline,5/19/2022 7:28:53 PM
GME,"Like Terra Before It, Dogecoin Could Plummet to Zero. Do Not Buy It.",5/18/2022 9:42:06 PM
GME,The Perpetual Money Machine Strategy,5/17/2022 9:04:02 PM
GME,GME Stock Falls 6% as GameStop Names New COO,5/16/2022 4:30:04 PM
GME,90 Biggest Movers From Yesterday,5/13/2022 11:44:50 AM
GME,Return of the Memes: AMC Stock Pops More Than 30%,5/12/2022 6:21:20 PM
GME,Avoid Redbox as the Acquisition Puts It Out of Its Misery,5/11/2022 6:20:56 PM
GME,This Could Be Your Last Chance to Sell GameStop,5/10/2022 5:01:31 PM
GME,Bitcoin has plummeted 53% from its all-time high as crypto follows broader markets lower amid investors' fears of tighter Fed policy,5/9/2022 6:26:30 PM
GME,ApeCoin Is the Cryptocurrency America Deserves,5/6/2022 8:09:51 PM
GME,Meme Stocks Like GameStop Aren’t Immune to a Bear Market,5/5/2022 2:14:38 PM
GME,The Short-Selling Party at GameStop Is Over,5/4/2022 10:48:49 AM
GME,"Hold Your Shiba Inu, But Make Sure You Have Perspective",5/3/2022 7:03:17 PM
GME,There’s Little Reason to Hold GameStop Stock Going Into the Summer,5/2/2022 3:23:22 PM
GME,What Was Your 'A-Ha' Moment In The Markets?,4/29/2022 10:00:12 PM
GME,GameStop Might Again Confound Wall Street With Its Stock Split,4/28/2022 1:32:50 PM
GME,Don’t Expect a Short Squeeze Rally for GameStop,4/27/2022 4:52:22 PM
GME,"Videogame sales tumble 15% as spending moves on, hardware hurdles remain",4/26/2022 7:19:38 PM
GME,GameStop Stock Is Still a Noob Investment,4/23/2022 10:30:21 AM
GME,The Positive Buzz for SoFi Stock Continues Despite 57% Decline,4/21/2022 5:59:43 PM
GME,A Stock Split Won’t Save the Day For GameStop,4/20/2022 9:43:20 PM
GME,GameStop Stock Continues to Confound Wall Street,4/19/2022 4:03:10 PM
GME,3 Fast Moving Stocks to Buy on Dips Into Support,4/18/2022 3:52:59 PM
GME,Could This $4 Stock Be the Next GameStop?,4/15/2022 8:32:22 PM
GME,The No. 1 Robinhood Crypto to Buy Now,4/14/2022 8:31:19 PM
GME,The Picture Is Mixed for Newegg Stock,4/13/2022 6:06:34 PM
GME,Aterian’s Short Squeeze Is Unlikely to Continue,4/12/2022 9:52:23 PM
GME,When Is the Shopify Stock Split Date? What Will Happen to SHOP Stock?,4/11/2022 3:35:19 PM
GME,Recession Fears are Creating a Golden Opportunity for Biotech Stocks,4/8/2022 9:02:24 PM
GME,"Gamestop Stock Could Be a Long-Term Buy, but Avoid It for Now",4/7/2022 2:42:33 PM
GME,What Are Dark Pools? 10 Things to Know.,4/6/2022 7:49:30 PM
GME,Is Following Elon Musk A Viable Investment Strategy?,4/5/2022 7:23:14 PM
GME,GameStop Stock Cooling After Recent Spike From Insider Buying,4/4/2022 2:43:15 PM
GME,These Were The 20 Most Searched Tickers On Benzinga In The First Quarter: Did Your Favorite Stock Make The List?,4/3/2022 9:53:05 PM
GME,"10 Most Searched Tickers On Benzinga Pro In March: SPY, Tesla Top List; See Where AMC and Hycroft Mining Rank",4/2/2022 3:43:19 PM
GME,Is There a Silver Lining to Inflation Woes?,4/1/2022 10:23:36 PM
GME,GameStop Stock Jumps 20% As It Plans Stock Split ,3/31/2022 11:13:52 PM
GME,The Bullish and Bearish Case for Robinhood Still Comes Down to Crypto,3/30/2022 10:00:00 PM
GME,"20 Stocks Moving Toward VWAP Breakout: GameStop, Roku, Moderna And More",3/29/2022 10:12:10 PM
GME,Why Is Newegg (NEGG) Stock Up Today?,3/28/2022 9:22:02 PM
GME,Robinhood Stock Is Cheap Enough to Warrant a Speculative Buy,3/25/2022 10:15:25 PM
GME,Is The Recent Rally In GameStop Really A 'Classic Dead-Cat Bounce'?,3/24/2022 8:01:20 PM
GME,8 Top Stocks Trending on Reddit WallStreetBets Today,3/23/2022 5:25:40 PM
GME,Peabody Energy: War Turns BTU Stock Hot,3/22/2022 10:45:00 PM
GME,Meme Stock Favorites Fall Out of Favor,3/21/2022 1:38:02 PM
GME,"Top News In Fintech And Beyond For March 21, 2022",3/20/2022 7:12:15 PM
GME,Top Crypto News: This Week’s Biggest Cryptocurrency Headlines,3/18/2022 6:28:52 PM
GME,"GameStop Q4 Highlights: Earnings Plunge Year-Over-Year, Revenue Beats Street Estimates, NFT Marketplace Update",3/17/2022 9:25:39 PM
GME,"GameStop Stock Made History, But It’s Not a Buy",3/16/2022 10:50:15 PM
GME,7 Meme Stocks That Will Survive the Reddit Investor Exodus,3/15/2022 10:20:48 PM
GME,Why Is GameStop (GME) Stock Down Today?,3/14/2022 9:40:58 PM
GME,Videogame sales drop for fourth month amid hardware slowdown,3/13/2022 7:56:52 PM
GME,Forget AMC And GameStop: Could Shorts Get Smoked On Cinemark Stock?,3/12/2022 4:31:18 PM
GME,7 Meme Stocks Still Making a Lot of Noise,3/11/2022 11:45:14 PM
GME,7 Stocks Reporting Earnings the Week of March 14,3/10/2022 8:32:51 PM
GME,2 Diamond-in-the-Rough Cryptos Destined to Shine,3/9/2022 10:05:24 PM
GME,Why This Bed Bath & Beyond Analyst Thinks Ryan Cohen's Plan May Not Work: 'Pivot In Strategy Won't Fix This Business',3/8/2022 6:25:42 PM
GME,GameStop's Downward Trend Continues: Will Key Support Zone Hold?,3/7/2022 8:35:34 PM
GME,"Benzinga's Daily Brief On Trending Tickers For March 4, 2022: Teucrium Wheat Fund, JPMorgan Chase, Tesla And More",3/4/2022 3:25:06 PM
GME,One Canadian Moonshots Rising on Insider Interest,3/3/2022 4:51:35 PM
GME,"Benzinga's Daily Brief On Trending Tickers For March 2, 2022: VanEck Russia ETF, AMC Entertainment, SoFi Technologies And More",3/2/2022 3:42:19 PM
GME,"Benzinga's Daily Brief On Trending Tickers For March 1, 2022: Forestar Group, VanEck Russia ETF, Target And More",3/1/2022 3:55:37 PM
GME,3 Oil Stocks to Avoid on This Mega Demand Rally,2/28/2022 4:36:15 PM
GME,SEC proposes new rules for more disclosure on short sales,2/25/2022 4:54:15 PM
GME,Big Opportunity as Crypto Goes Mainstream,2/24/2022 9:43:52 PM
GME,"Benzinga's Daily Brief On Trending Tickers For Feb. 23, 2022: Palantir, GameStop, Tesla, And More",2/23/2022 4:43:53 PM
GME,Robinhood Is a Fintech Pioneer with Several Problems in Tow,2/22/2022 6:36:09 PM
GME,Growth stocks rule in Goldman screen of biggest retail investor buys and sells,2/21/2022 4:12:25 PM
GME,Gamestop Suffers From a Rising Volatility Index and Market Efficiency,2/18/2022 9:28:34 PM
GME,"What Did Charlie Munger Say About Bitcoin, Crypto and Venereal Disease?",2/17/2022 6:40:57 PM
GME,"Charlie Munger touts Apple and Alibaba, slams Bitcoin at Daily Journal annual meeting",2/16/2022 8:40:22 PM
GME,TSLA Stock Just Popped Despite Hedge Fund Diss. Here’s Why.,2/15/2022 10:01:15 PM
GME,"Benzinga's Daily Brief On Trending Tickers For Feb. 14, 2022: GameStop, Nvidia, AMD And More",2/14/2022 4:57:28 PM
GME,"Benzinga's Daily Brief On Trending Tickers For Feb. 11, 2022: Cassava Sciences, Cleveland Cliffs, GameStop, and More",2/11/2022 6:03:14 PM
GME,10 Companies That Now Accept Shiba Inu And Dogecoin As Payment,2/10/2022 11:52:38 PM
GME,GME Stock Continues to Rise on Rumors of a Microsoft Partnership,2/9/2022 6:18:34 PM
GME,AMC Stock Alert: The Theater News Sending AMC Entertainment Soaring Today,2/8/2022 9:30:09 PM
GME,Loopring Was Another Too Speculative Lesson With Victims All-Around,2/4/2022 9:58:23 PM
GME,My Top 2 Moonshot Cryptos to Buy,2/3/2022 10:22:08 PM
GME,Opportunity in GameStop Stock Lingers Despite Poor Fundamentals,2/2/2022 7:02:55 PM
GME,3 Stocks For the “Great Rotation to Quality”,2/1/2022 10:27:12 PM
GME,7 Reddit Stocks to Add to Your February Buy List,1/31/2022 5:53:13 PM
GME,7 Technology Stocks Reporting Earnings the Week of January 31,1/28/2022 6:15:32 PM
GME,"Slowly Deflating, Expect AMC Stock To Fall Back to Single Digit Prices",1/27/2022 8:24:45 PM
GME,3 Cryptos to Buy the Dip,1/26/2022 10:00:52 PM
GME,BNTX Stock Alert: The Omicron Vaccine News That Has BioNTech Shooting Higher Today,1/25/2022 5:13:39 PM
GME,Why did GameStop stock drop today? Investors are pressing the sell button on retail favorites,1/24/2022 8:41:36 PM
GME,3 Cheap Stocks Thriving Despite America’s Inflation Issues,1/21/2022 4:41:32 PM
GME,Dogecoin Benefits From Old News to the Detriment of Investors,1/20/2022 4:11:55 PM
GME,7 Memorable Times Elon Musk Moved Stocks and Crypto in 2021,1/19/2022 8:31:34 PM
GME,"With Few Reasons to Buy, ContextLogic Is a Safe Haven for Bears",1/18/2022 9:44:30 PM
GME,Don’t Expect a Sequel in AMC Stock,1/17/2022 4:40:18 PM
GME,"4 Top Stock Trades for Tuesday: JPM, LCID, GME, UNP",1/14/2022 10:21:21 PM
GME,10 Quotes From Movies That Explain GameStop’s Irrational Price Swings,1/13/2022 9:17:39 PM
GME,GameStop Shows It Isn’t Immune to Economic Laws,1/12/2022 11:00:52 AM
GME,Saitama Crypto News: What Is SaitaMask and How Can You Make an Account?,1/11/2022 10:06:59 PM
GME,"Short Squeeze Stocks: ISIG, RELI and 3 Others Experts Think Are Ready to Pop",1/10/2022 6:34:05 PM
GME,Is GameStop's NFT Plan A 'Dead End'?,1/7/2022 10:25:59 PM
GME,GameStop surges 30% on report of new NFT project,1/6/2022 10:16:48 PM
GME,"Rumble Announces 'Exclusive' Content From AMC Ape Matt Kohrs And Rand Paul, Record Site Numbers Revealed",1/5/2022 11:51:40 PM
GME,The “Best of” 2021: Don’t Scour Reddit for Your Next Profit Opportunity,1/4/2022 9:56:40 PM
GME,AMC Stock and AABB Stock — The ABCs of Meme Investor Buying,1/3/2022 10:00:04 PM
GME,"Top 10 Most Searched Tickers On Benzinga Pro In 2021: Tesla, Apple, AMC, GameStop And More",1/2/2022 11:19:00 PM
GME,IINN Stock Alert: Is a Big Short Squeeze Brewing for Inspira Technologies?,12/31/2021 4:29:14 PM
GME,Best Stocks for 2022: Deep Value Tech Stock POSaBIT Is A Can’t Miss Cannabis Play,12/30/2021 7:36:14 PM
GME,8 Top Video Game Stories Of 2021 And How Developer Stocks Performed This Year,12/29/2021 9:16:41 PM
GME,"Despite AMC, GameStop, Analyst Says Death Of Short Selling 'Highly Exaggerated'",12/28/2021 5:32:58 PM
GME,"Missed Out On AMC, GameStop And Dogecoin In 2021? Here's Why That's OK",12/27/2021 4:31:58 PM
GME,Goldman pinpoints stocks with the biggest analyst disparity: Alpha Tactics,12/24/2021 2:39:00 PM
GME,Peak Meme? GameStop Stock in Focus with Launch of New Meme ETF.,12/23/2021 7:31:23 PM
GME,Top 5 Moonshots for 2022 Countdown: My No. 5 Pick,12/22/2021 9:52:14 PM
GME,Loopring Wallet Sends LRC Crypto Prices and GameStop Rumors Surging,12/21/2021 8:52:57 PM
GME,"5 Short Squeeze Candidates To Watch: Petros Pharmaceuticals, iSpecimen Top The List Again",12/20/2021 5:50:07 PM
GME,"Benzinga's Bulls And Bears Of The Past Week: Pfizer, Bank Of America, Beyond Meat, GameStop, AMC, Overstock And More",12/18/2021 7:54:18 PM
GME,GME Stock Alert: What Is Going on With GameStop Today?,12/17/2021 9:58:26 PM
GME,How Does Reddit Make Money? 6 Things to Know Ahead of Reddit IPO.,12/16/2021 10:29:46 PM
GME,2 Crypto Stocks To Watch on Meme Coin Madness – And a Crypto to Buy,12/15/2021 10:01:53 PM
GME,"DraftKings Stock Has Game to Recover, Right?",12/14/2021 9:14:25 PM
GME,"4 Top Stock Trades for Tuesday: Bitcoin, F, AMC, GME",12/13/2021 10:32:59 PM
