Ticker,Title,Link
GME,GameStop Announces Release Date for Second Quarter Fiscal 2024 Results,8/27/2024 11:37:18 PM
GME,3 Meme Stocks to Sell Before They Slide Even Further,8/14/2024 4:19:56 PM
GME,The Perils of Betting on GameStop: Why This Meme Stock Is a Sell,8/8/2024 7:19:08 PM
GME,GameStop Shuts Down Magazine Game Informer After 33 Years ,8/2/2024 9:29:08 PM
GME,GameStop’s Silence Speaks Volumes: Why You Should Be Wary of GME Stock,7/31/2024 10:00:00 AM
GME,Get Your Money Out of These 3 Meme Stocks by Q4,7/29/2024 10:28:00 AM
GME,GME Red Alert: Sell GameStop Stock Now Before It’s Too Late,7/27/2024 11:05:00 AM
GME,Toxic Influencer Marketing: How Roaring Kitty Brought Social Media to the Stock Market,7/25/2024 8:53:29 PM
GME,7 Meme Mania Stocks: Which Are FOMO and Which Are Free Money?,7/23/2024 10:45:00 AM
GME,Warning! 3 Stocks to Sell Before Losses Compound.,7/22/2024 5:00:00 PM
GME,"Catalyst watch: Earnings deluge, Farnborough Airshow, Paris Olympics, and Trump talks crypto",7/19/2024 7:00:00 PM
GME,3 Robinhood Stocks to Sell Before Gen Z Moves On,7/18/2024 11:25:00 AM
GME,3 Meme Stocks to Sell in July Before They Crash & Burn,7/17/2024 11:15:00 AM
GME,GameStop continues gain for seven straight sessions,7/16/2024 8:01:15 PM
GME,Get Out Now! 3 Meme Stocks Primed for a Painful Correction.,7/15/2024 11:40:00 AM
GME,The 7 Most Undervalued Meme Stocks to Buy in July 2024,7/12/2024 11:00:00 AM
GME,Legendary Investor Bill Gross Says Tesla Stock Is Now a Meme. Be Warned.,7/10/2024 5:12:28 PM
GME,Bill Gross: Tesla is acting like a meme stock,7/9/2024 7:01:05 PM
GME,3 Gaming Stocks to Sell in July Before They Crash & Burn,7/8/2024 8:19:13 PM
GME,GameStop vs. Chewy: The Surprising Winner in This Battle of Meme Stocks,7/7/2024 12:30:00 PM
GME,3 Stocks Wall Street Just Soured On (You Should Too),7/5/2024 5:49:14 PM
GME,GameStop Stock Analysis: Why Both Bulls and Bears Might Get Burned in 2024,7/4/2024 10:00:00 AM
GME,From Roaring Kitty to Whimpering Kitten: GameStop’s $2.14 Billion Gamble,7/3/2024 10:40:00 AM
GME,GameStop drama: It is not just retail investors along for the ride,7/2/2024 6:57:26 PM
GME,GME Stock Alert: Ryan Cohen Raises GameStop Frenzy With Mobile App Tweet,7/1/2024 8:53:37 PM
GME,From Pump to Dump: 3 Meme Stocks Headed for a Massive Crash,6/30/2024 12:00:00 PM
GME,These retail traders lost big in the first meme stock episode. Here's why they won't stop betting on GameStop.,6/29/2024 2:32:01 PM
GME,Does ‘I Like the Stock’ Mean ‘I Should Buy It’? Not Necessarily.,6/28/2024 4:54:58 PM
GME,Can Roaring Kitty Make Petco (WOOF) Stock the Newest Meme Craze?,6/27/2024 7:32:28 PM
GME,3 Meme Stocks to Buy on the Dip: June 2024,6/25/2024 8:37:07 PM
GME,GameStop Stock Lovers Beware! GME Is Unpredictable and Uninvestable.,6/24/2024 10:20:00 AM
GME,Elon’s Golden Handcuffs: Why Tesla’s Pay Package Is Even Worse Than the GameStop ATM,6/23/2024 12:30:00 PM
GME,"Nvidia Shorts 'Are Down Big': AI Chipmaker Is Most Shorted Stock, 'Hedge To The Overall Market And The Tech Sector'",6/21/2024 7:13:21 PM
GME,Eject Now 3 Stocks Too Toxic to Touch When the Market Melts Down,6/20/2024 8:44:11 PM
GME,Judgement Day for Roaring Kitty? 3 Meme Stocks to Sell ASAP.,6/19/2024 6:43:07 PM
GME,GameStop Stock’s Annual Meeting Produced More Questions Than Answers,6/18/2024 1:39:08 PM
GME,3 Meme Stocks to Sell Before E-Trade Gives Roaring Kitty the Boot,6/17/2024 9:05:23 PM
GME,This Is Why Ryan Cohen Should Short GameStop Stock (if It Were Legal) ,6/16/2024 12:54:04 PM
GME,The 7 Best Under $20 Stocks to Buy in June 2024,6/15/2024 10:42:00 AM
GME,"Inflation Cools In May, Fed Hints At Slower Pace Of Rate Cuts, Stocks Hit New Record Highs: This Week In The Market",6/14/2024 10:06:27 PM
GME,GameStop Announces Updated Time and Date for Annual Meeting of Stockholders,6/13/2024 11:26:23 PM
GME,GameStop Analyst Lowers Price Target After 'Rambling Presentation By Roaring Kitty': Does Video Game Company Have 'Enough Runway To Appease Its Cult-Like Shareholders'?,6/12/2024 7:40:58 PM
GME,GameStop Completes At-The-Market Equity Offering Program,6/11/2024 10:29:21 PM
GME,J.P. Morgan’s Kolanovic says stocks appear to be ‘ignoring’ numerous risks,6/10/2024 9:40:58 PM
GME,The Next Meme Stock Sensations? 3 Ready to Join the Rally,6/9/2024 4:00:00 PM
GME,"Stocks Reclaim Record Highs As Jobs Data Fuels Growth Optimism; Gold, Bonds Tumble As Yields Rise: What's Driving Markets Friday?",6/7/2024 7:54:58 PM
GME,The Rally Is Over: 3 Meme Stocks to Sell While You Still Can,6/6/2024 8:32:12 PM
GME,10 Principles to Fast-Track Profitable Investing,6/5/2024 9:25:53 PM
GME,'Roaring Kitty's' GameStop trades come under probe by Massachusetts regulator - report,6/4/2024 8:11:50 PM
GME,"BARK sales miss expectations, sets downbeat guidance",6/3/2024 9:00:38 PM
GME,Shop for Profits: 3 Retail Stocks That Are Adapting and Succeeding in 2024,6/1/2024 10:44:00 AM
GME,Why Following RFK Jr.’s GameStop Stock Play Is a Losing Strategy,5/31/2024 4:43:29 PM
GME,GameStop Announces Release Date for First Quarter Fiscal 2024 Results,5/30/2024 10:07:00 PM
GME,"Wall Street Moves From T+2 To T+1 Settlement: How It Could Affect Investments, Trading, Tax Decisions",5/29/2024 7:13:08 PM
GME,"US Stocks Waver, Nvidia Lifts Chipmakers, GameStop Spikes, Moderna Tumbles: What's Driving Markets Tuesday?",5/28/2024 7:52:50 PM
GME,Trump Media Stock: The Controversial Social Media Play Is More Than Just a Meme,5/27/2024 10:25:00 AM
GME,"Nvidia, Tech Stocks Propel Nasdaq 100 To Record High; Solar Sector Shines, Meme Stock Bubble Bursts: This Week In The Market",5/24/2024 10:29:26 PM
GME,The Summer Stock Exodus: 3 Companies to Ditch Before the Heat Hits,5/23/2024 7:29:20 PM
GME,Post-Bitcoin Halving Disappointment: 3 Meme Coins on the Verge of Collapse,5/22/2024 8:00:00 PM
GME,"Is the Meme Stocks Rally Already Dead? AMC, GME Investors Lost $13 Billion Last Week.",5/21/2024 6:46:54 PM
GME,"Stocks, Gold Reach New Record Highs, Cruise Stocks Rally, GameStop Sinks: What's Driving Markets Monday?",5/20/2024 7:34:02 PM
GME,"Wall Street Jumps Back To Record Highs, Dow Hits 40,000 As Inflation Fears Recede, Meme Stock Frenzy Returns: This Week In The Market",5/17/2024 10:07:41 PM
GME,"Renaissance Technologies stocked up on meme-stocks AMC, GameStop in Q1",5/16/2024 8:39:50 PM
GME,GameStop's Shares Decline As Meme Rally Loses Momentum ,5/15/2024 9:38:52 PM
GME,ETFs to Ride Meme Mania Resurgence: Will the Rally Last?,5/14/2024 9:21:33 PM
GME,Infamous User Roaring Kitty Sends Reddit (RDDT) Stock Surging,5/13/2024 9:08:27 PM
GME,7 F-Rated Stock Picks to Avoid Like the Plague in May,5/10/2024 11:30:43 AM
GME,"AMC, GME, TSLA: 3 Stocks to Sell ASAP as Consumer Spending Starts to Crumble",5/9/2024 7:56:20 PM
GME,"Stocks On Track For Third Green Session, Palantir Ignites Rally In Chipmakers, Commodities Rebound: What's Driving Markets Monday?",5/6/2024 7:33:04 PM
GME,Another meme rally? GameStop launched 51% higher in two-day rally,5/3/2024 8:40:56 PM
GME,Cut Your Losses: Dump These 3 Meme Stocks Right This Minute,5/2/2024 8:29:54 PM
GME,3 Retail Stock Rejects to Avoid at All Costs,4/30/2024 10:29:00 AM
GME,7 Stocks That Could Be Heading Six-Feet Under,4/25/2024 11:10:00 AM
GME,Can You Afford to Ignore These 3 Stocks Up Over 200% in 2024?,4/20/2024 10:58:00 AM
GME,3 Stocks No One in Their Right Mind Would Own Right Now,4/19/2024 2:50:00 PM
GME,The 3 Most Volatile Stocks for Short-Term Traders: April 2024,4/17/2024 7:10:34 PM
GME,April Price Target Cuts: 3 Stocks That Analysts Are Losing Faith In,4/16/2024 3:53:49 PM
GME,GME Stock Analysis: GameStop Profits Mean Nothing When Your Business Is Dying,4/11/2024 1:07:39 PM
GME,"Insider Larry Cheng Just Bought $112,000 of GameStop (GME) Stock",4/10/2024 4:07:42 PM
GME,GME Stock Alert: GameStop COO Nir Patel Steps Down,4/5/2024 4:44:43 PM
GME,Betting on the Squeeze: 3 Stocks to Capitalize on Short Seller Pain,4/4/2024 6:28:09 PM
GME,The Hype Machine Trash Bin: 3 Overrated Stocks to Dump Immediately,4/3/2024 7:43:48 PM
GME,The 3 Most Undervalued Robinhood Stocks to Buy in April 2024,4/2/2024 7:00:00 PM
GME,GameStop shares continue to slide as disappointing Q4 results weigh,4/1/2024 6:51:59 PM
GME,3 Lagging Consumer Discretionary Stocks to Kick to the Curb,3/30/2024 2:31:40 PM
GME,Short Sellers Are Betting Against Reddit (RDDT) Stock in Big Numbers,3/28/2024 6:43:40 PM
GME,"Small Caps Rally, Magnificent 7 Ease, Gold Eyes $2,200, Bitcoin Falls Below $69,000: What's Driving Markets Wednesday?",3/27/2024 6:51:44 PM
GME,"GameStop Corp. Q4 Profit Increases, but misses estimates",3/26/2024 9:14:28 PM
GME,Notable earnings after Tuesday's close,3/25/2024 9:35:00 PM
GME,Come and Get It! Why Reddit Stock’s Debut Could Be 2024’s Most Important IPO.,3/24/2024 2:05:57 PM
GME,"Catalyst Watch: Walgreens earnings, UPS analyst day and Xiaomi's luxury EV debut",3/22/2024 7:00:00 PM
GME,3 Stocks to Buy as Crypto Frenzy Picks Up Ahead of the Bitcoin Halving,3/21/2024 5:47:31 PM
GME,Should You Buy the Reddit (RDDT) Stock IPO?,3/19/2024 9:02:14 PM
GME,3 Meme Stocks to Sell in March Before They Crash & Burn,3/15/2024 10:15:00 AM
GME,Eyes on the Prize: 3 Stocks Set for a Short Squeeze,3/14/2024 7:20:37 PM
GME,The Meme Team: 3 Stocks Turning Hype into Profits,3/13/2024 4:15:44 PM
GME,GameStop Announces Release Date for Fourth Quarter and Full Year Fiscal 2023 Results,3/12/2024 9:05:00 PM
GME,Meme Stocks Madness: 3 Stocks Fueling the Reddit Crowd,3/11/2024 5:37:40 PM
GME,3 Meme Stocks that r/WallStreetBets Loves (but Shouldn’t!),3/10/2024 8:00:00 PM
GME,Stocks to Avoid: 3 Companies You Have No Business Buying Today,3/7/2024 6:00:14 PM
GME,The Short List: 3 Meme Stock Battlegrounds to Keep on Your Radar,3/6/2024 10:13:29 PM
GME,3 Overhyped Stocks to Avoid in March 2024,3/5/2024 7:19:36 PM
GME,Do You Like Movies? 3 Stocks that Are Better Buys Than AMC,3/4/2024 9:18:01 PM
GME,Meme Stock Meltdowns: 3 Names to Sell Before They Crash,2/26/2024 9:34:37 PM
GME,"Reddit invites users to invest in its IPO, but warns they could increase volatility",2/23/2024 2:58:32 PM
GME,Reddit IPO Alert: Everything Potential RDDT Stock Investors Need to Know Today,2/22/2024 9:44:08 PM
GME,It’s Time! 7 Lackluster Meme Stocks to Sell in February,2/20/2024 7:54:58 PM
GME,Children's Place skyrockets 90% - here's who called it,2/15/2024 3:41:28 PM
GME,3 Meme Stocks to Buy on the Dip: February 2024,2/11/2024 8:09:29 PM
GME,"MARA Stock Short-Squeezes Higher as Bitcoin Takes $45,000",2/8/2024 8:51:18 PM
GME,3 Doomed Meme Stocks to Dump Before They Dive: February 2024,2/7/2024 9:31:38 PM
GME,The Next GameStop? 3 Undiscovered Meme Stocks to Watch.,2/2/2024 7:17:16 PM
GME,The New GameStop Meme Coin Is Trying to Recreate GME Stock’s 2021 Surge,1/30/2024 9:37:13 PM
GME,7 Over-Hyped Stocks to Sell Before They Plunge,1/25/2024 11:52:00 AM
GME,Want to Lose Your Money? Meme Stocks and Groupthink Can Help.,1/24/2024 9:27:40 PM
GME,Donald Trump wins again as SPAC skyrockets,1/22/2024 6:36:23 PM
GME,3 Consumer Stocks to Sell in January Before They Crash and Burn,1/18/2024 6:47:17 PM
GME,Are You Kidding Me? 3 Meme Stocks You Should Have Already Sold,1/15/2024 9:05:41 PM
GME,Meme Coin Resurgence: Polkadot Community Prepares for DED Airdrop,1/12/2024 4:17:31 AM
GME,Twitch Layoffs 2024: What to Know About the Latest AMZN Job Cuts,1/10/2024 3:51:35 PM
GME,3 Meme Stocks to Sell in January Before They Crash and Burn,1/8/2024 5:58:23 AM
GME,GameStop’s Final Scene: Why It’s Time to Exit This Meme Stock Saga,1/5/2024 11:30:00 AM
GME,The Stealth Wealth Portfolio: 3 Stocks Flying Under the Radar,1/4/2024 5:31:00 PM
GME,Risky Retail: 3 Stocks Investors Should Avoid in 2024,1/3/2024 11:39:26 PM
GME,Meme Stock Meltdown: 3 Perilous Picks Primed for a Deep Drop,1/2/2024 8:55:57 PM
GME,3 Meme Stocks that Have Nowhere to Go But Down in 2024,1/1/2024 8:22:46 PM
GME,7 Stocks that Multiple AI Bots Predict Will Soar in the Near Future,12/29/2023 12:00:00 PM
GME,Smart Shorts: 7 Meme Stocks to Bet Against in 2024,12/28/2023 11:45:00 AM
GME,"Carvana Is 1 Of The 20-Most Shorted Stocks On The Market, But Share Prices Keep Going Up",12/21/2023 10:49:24 PM
GME,3 of the Best Meme Stocks to Double Down On in 2024,12/18/2023 9:21:13 PM
GME,Social Media Star Erika Kullberg Shares How to Avoid TikTok Scams and Get Rich the Right Way,12/14/2023 7:22:21 PM
GME,Meme Stocks Alert: Hedge Funds Are Suing the SEC Over Short-Selling Rules,12/13/2023 5:20:48 PM
GME,3 Meme Stocks I Wouldn’t Touch With a 10-Foot Pole,12/12/2023 10:54:33 PM
GME,3 Retail Stocks to Sell as Consumers Tighten Their Belts,12/11/2023 9:15:57 PM
GME,3 Stocks That Ryan Cohen Should Buy for GameStop ASAP,12/8/2023 9:45:07 PM
GME,Meme King Ryan Cohen Now Able To Trade Stocks With GameStop Funds,12/7/2023 9:22:33 PM
GME,GameStop Corp. Q3 Earnings Summary,12/6/2023 10:13:45 PM
GME,"DOGE, GME: What the Latest Meme Surge Says About Broke Millennials",12/5/2023 11:47:46 PM
GME,What Happened With GameStop Stock Today?,12/4/2023 10:21:17 PM
GME,7 Sorry Meme Stocks to Sell in December,12/1/2023 2:26:56 PM
GME,Meme Stocks Rally: To The Moon Or Failure To Launch?,11/30/2023 11:01:39 PM
GME,5 Investors Betting Big on GameStop (GME) Stock,11/29/2023 8:31:00 PM
GME,"Dear GME Stock Fans, Mark Your Calendars for Dec. 6",11/28/2023 8:51:54 PM
GME,Feeling Lucky? 5 ‘Jackpot’ Stocks to Buy for 2024.,11/27/2023 6:02:32 PM
GME,GameStop Announces Release Date for Third Quarter Fiscal 2023 Results,11/22/2023 10:05:00 PM
GME,Safe and Green Development (SGD) Stock Soars on AI Integration News,11/21/2023 9:37:11 PM
GME,Pricey Problems: 3 Overvalued Stocks to Sell Today,11/20/2023 1:25:40 PM
GME,The Relative Strength Index (RSI) Indicator: Does It Work?,11/17/2023 5:23:20 PM
GME,Get Out Now! 7 Stocks That Are Destined to Die,11/11/2023 10:00:00 AM
GME,Don’t Touch It! Treat GameStop Stock Like a Hot Potato.,11/10/2023 7:13:48 PM
GME,3  Meme Stocks to Sell Immediately,11/8/2023 2:05:48 PM
GME,7 Doomed Stocks With Nowhere to Go But Down ,10/27/2023 12:38:22 AM
GME,3 Stocks to Buy Today and Sell Tomorrow,10/25/2023 10:15:00 AM
GME,Jared Dillian Is Bracing for a 10-Year Stock Market Slump. Here’s How to Prepare.,10/20/2023 4:50:10 PM
GME,7 Cryptocurrencies to Invest in for the Future of Digital Currency,10/19/2023 11:03:11 PM
GME,Why Streamline Health Solutions Shares Are Trading Lower By Over 68%? Here Are Other Stocks Moving In Monday's Mid-Day Session,10/16/2023 7:09:54 PM
GME,GME Stock Is Headed for Zero… Even with Ryan Cohen in the CEO Seat,10/15/2023 6:00:47 PM
GME,3 Short-Squeeze Stocks to Keep an Eye on in Q4,10/14/2023 12:00:21 PM
GME,Will GameStop Go Up in 2024? Here’s Our Take.,10/10/2023 4:21:21 PM
GME,Spooky Season: 7 Stocks Scaring Away Gains This October,10/9/2023 9:09:59 PM
GME,3 Momentum Stocks to Sell Before the Magic Is Gone,10/6/2023 12:33:36 PM
GME,3 Stocks That You Should Short No Matter What Social Media Says,10/5/2023 4:00:02 PM
GME,3 Stocks Headed Toward Zero as Meme Mania Fades to Black,10/4/2023 7:50:41 PM
GME,"'Airbnb Has Foundational Cracks', Disney+ Follows Netflix On Subscription Sharing Crackdown, Microsoft's Nadella Criticizes Google's Exclusive Content Deals: Today's Top Stories",10/3/2023 4:11:21 PM
GME,Is GameStop stock doomed? This analyst sees 60% downside from current levels,10/2/2023 7:13:45 PM
GME,Ticking Time Bombs: 3 Meme Stocks to Dump Before the Damage Is Done,10/1/2023 6:00:43 PM
GME,Is It Too Late for Ryan Cohen to Save Bed Bath & Beyond (BBBYQ) Stock?,9/29/2023 6:35:36 PM
GME,GME Stock: Wedbush Slams GameStop’s Decision to Make Ryan Cohen CEO,9/28/2023 5:57:52 PM
GME,3 Retail Stocks to Sell Before Student Debt Comes Due,9/27/2023 5:51:26 PM
GME,Here’s Why You Should Give Up on AMC Stock ASAP,9/22/2023 10:30:42 AM
GME,Bullish Signs: 3 Insiders Snapping Up Company Stock,9/21/2023 5:43:54 PM
GME,"WallStreetBets Retail Traders Take Aim At Tech With Tesla, Nvidia, Apple Among Most-Mentioned Stocks",9/20/2023 9:00:52 PM
GME,3 Meme Stocks That Should Still Be on Every Investor’s Radar This Fall,9/19/2023 7:30:40 PM
GME,Warp Speed: 3 High Velocity Stocks Set to Dominate the Market,9/18/2023 1:33:22 PM
GME,"Ken Griffin Doesn't Want You To See 'Dumb Money' Movie, Screenwriters Say That's Why You Should",9/15/2023 6:44:25 PM
GME,BBBYQ Stock Alert: Bed Bath & Beyond Still Owes $1.5 BILLION to Creditors,9/14/2023 5:13:19 PM
GME,"Dear AMC Stock Fans, Mark Your Calendars for Sept. 15",9/13/2023 5:20:53 PM
GME,"Traders Should Go To AMC, Bring Stuff From Bed Bath & Beyond, Carry BlackBerry Phones: 'Dumb Money' Author",9/12/2023 9:53:01 PM
GME,Why Is Crinetics Pharmaceuticals (CRNX) Stock Up 64% Today?,9/11/2023 12:04:23 PM
GME,"Oil Climbs, iPhone Faces China Ban, UAW Strike Looms: The Week In The Markets",9/8/2023 10:15:41 PM
GME,Why Is Palisade Bio (PALI) Stock Down 46% Today?,9/7/2023 2:28:39 PM
GME,"GameStop Corp. Q2 Loss Decreases, beats estimates",9/6/2023 10:15:22 PM
GME,Notable earnings after Wednesday's close,9/5/2023 9:35:42 PM
GME,"Earnings week ahead: Zscaler, GameStop, DocuSign, Kroger and more",9/3/2023 12:00:00 PM
GME,"Catalyst Watch: Roblox event, GameStop earnings, DWAC deadline and VinFast volatility",9/1/2023 7:00:48 PM
GME,Short Sellers Just Made $522 Million Betting Against AMC Stock,8/30/2023 8:46:07 PM
GME,These Are the ONLY 3 Meme Stocks to Consider in August 2023,8/28/2023 9:45:58 AM
GME,"Dear GME Stock Fans, Mark Your Calendars for Sept. 6",8/25/2023 5:00:01 PM
GME,3 Short Squeeze Stocks up 50% or More in 2023,8/24/2023 8:00:24 PM
GME,GameStop Announces Release Date for Second Quarter Fiscal 2023 Results,8/23/2023 10:05:00 PM
GME,Legendary Investor Bill Gross Says GameStop (GME) Stock Is Ready to Crash,8/18/2023 6:34:07 PM
GME,5 Investors Betting Big on GameStop (GME) Stock in Q2,8/17/2023 5:38:50 PM
GME,3 Stocks to Watch if Meme Stocks Return,8/16/2023 8:09:17 PM
GME,"Coatue Management takes new stake in Oracle, exits GameStop, trims Tesla, adds to Amazon",8/15/2023 7:06:54 PM
GME,The 7 Best Penny Stocks to Buy Now,8/14/2023 3:53:27 PM
GME,WeWork Shares Rocket And Get The Meme-Stock Treatment: Did Streaming Networks Attacking Company Inspire A Rally Cry?,8/12/2023 8:36:51 PM
GME,"Microsoft Faces Scrutiny Amid Government Email Breach, WeWork Is The Latest Meme Stock, ChatGPT's Popularity Surges Despite Restrictions By Tech Giants: Today's Top Stories",8/11/2023 4:51:34 PM
GME,"Meme Stocks Alert: Robinhood Wins Case Over AMC, GME Stock Halts",8/10/2023 7:05:04 PM
GME,TTOO vs. RAD Stock: Which New Meme Stock Is the Worst Buy?,8/9/2023 8:47:53 PM
GME,Is Joann (JOAN) Stock the Next Big Short Squeeze?,8/8/2023 3:29:09 PM
GME,"Largest Ever Chinese Russian Warship Group Approached Alaska, Earnings Drop, Meme Stocks Resurgent",8/7/2023 5:14:21 PM
GME,GME Stock Alert: GameStop Will Remove Crypto Wallets Feature,8/2/2023 3:01:42 PM
GME,"GameStop to stop supporting crypto wallets, citing 'regulatory uncertainty'",8/1/2023 7:10:11 PM
GME,7 Consumer Stocks I Wouldn’t Touch With a 10-Foot Pole,7/27/2023 11:10:04 AM
GME,"Why Are Meme Stocks GME, KOSS, AMC Up Today?",7/24/2023 3:12:02 PM
GME,Meta Materials Exposes the Dangers of Meme Stock Investing,7/21/2023 7:59:56 PM
GME,"GME Stock Spotlight: Insider Selling, Rumors and Shorts, Oh My!",7/20/2023 10:10:54 AM
GME,7 Doomed Meme Stocks Destined for Disaster,7/16/2023 4:29:34 PM
GME,Caution! Don’t Get Greedy With These 3 Growth Stocks.,7/14/2023 5:19:53 PM
GME,3 Doomed Gaming Stocks Destined for Disaster,7/12/2023 4:22:55 PM
GME,3 Cryptos to Sell Before They Damage Your Portfolio,7/11/2023 3:48:39 PM
GME,"Dear BBBYQ Stock Fans, Mark Your Calendars for July 11",7/10/2023 7:10:03 PM
GME,7 Meme Stocks to Sell in July Before They Crash and Burn,7/5/2023 10:00:16 AM
GME,3 Meme Stocks to Sell Before They Do Your Portfolio In,7/4/2023 9:07:31 PM
GME,Nintendo's 'Zelda' pushes videogame sales to healthy rebound in May,7/1/2023 2:03:00 PM
GME,Hold Your Joysticks: Why Cohen’s $10M GameStop Buy Is Not Game-On,6/28/2023 7:21:38 PM
GME,"Ryan Cohen Sparks GME, BBBYQ Stock Interest With ERP Tweet",6/27/2023 4:52:28 PM
GME,"Benzinga Buzz: San Diego Comic-Con In Trouble, Bud Light Is Desperate, MrBeast Hits 160M",6/24/2023 5:39:30 AM
GME,7 Millionaire-Maker Penny Stocks to Buy And Hold Forever,6/23/2023 12:58:49 PM
GME,3 Stocks to Short Before They Sink 75% (or More!),6/20/2023 12:38:13 PM
GME,Cut Your Losses: Say Goodbye to These 3 Struggling Stocks,6/19/2023 12:45:30 PM
GME,"3 Meme Stocks to Sell before You Lose Your Shirt, Shorts and Shoes",6/18/2023 9:12:40 PM
GME,BBBYQ Stock Alert: Sixth Street Considers Bid for Bed Bath & Beyond,6/16/2023 8:37:24 PM
GME,Ryan Cohen Drives GME Stock Hype at GameStop Shareholder Meeting,6/15/2023 8:09:51 PM
GME,The Meme Stock Frenzy is Over: Sell These Seven Now,6/14/2023 11:30:54 PM
GME,"US Stocks Climb, Dollar Drops As Falling Inflation Raises Optimism On The End of Fed Tightening: What's Driving Markets Today",6/13/2023 7:10:36 PM
GME,Cardano Price Predictions: What Will Robinhood Delisting Mean for ADA?,6/12/2023 4:12:24 PM
GME,"GameStop Stock Is ‘Doomed,’ Says Analyst Who Sees 70% Downside",6/8/2023 11:42:00 PM
GME,"GameStop Corp. Q1 Loss Decreases, but misses estimates",6/7/2023 10:21:11 PM
GME,Notable earnings after Wednesday's close,6/6/2023 9:35:54 PM
GME,"Earnings Week Ahead: NIO, DocusSgn, GameStop, FuelCell and more",6/3/2023 10:00:00 AM
GME,BBBYQ Stock Alert: Bed Bath & Beyond Extends Stalking Horse Deadline to June 8,6/2/2023 7:10:35 PM
GME,Why Is Fisker (FSR) Stock Up 3% Today?,6/1/2023 1:37:46 PM
GME,The Cost to Borrow AMC Stock Just Jumped 30%,5/31/2023 7:21:01 PM
GME,5 Investors Betting Big on GameStop (GME) Stock,5/30/2023 6:38:23 PM
GME,3 Secrets to Finding the Next Short-Squeeze Stocks,5/29/2023 2:53:34 PM
GME,Ignore Ray Dalio? Why GameStop Stock Deserves a Second Chance.,5/25/2023 2:37:52 PM
GME,GME Stock Alert: GameStop Overhauls Reward Program,5/22/2023 6:39:49 PM
GME,GME Stock: SEC Proposes New Margin Call Plan in Response to GameStop Halts,5/19/2023 7:45:20 PM
GME,‘Pulte’ Ignites GME Stock Hype With GameStop Tweet,5/17/2023 6:48:08 PM
GME,3 Meme Stocks With Too Much Potential to Be Trending on r/WallStreetBets,5/16/2023 5:22:11 PM
GME,MULN Stock Alert: Mullen Could Short Squeeze This Week,5/15/2023 7:14:45 PM
GME,GME Stock Fans Pin Hope on GameStop’s Big Zelda Release,5/12/2023 5:44:44 PM
GME,9 Hot Stocks to Watch… And Their AI Price Predictions,5/11/2023 8:03:56 PM
GME,The Top 10 Meme Stocks Right Now,5/9/2023 9:07:51 PM
GME,"Dear GME Stock Fans, Mark Your Calendars for June 15",5/8/2023 7:13:29 PM
GME,GME Price Prediction: My GameStop Price Target for 2025,5/5/2023 8:41:36 PM
GME,MULN Stock Alert: The MULN Army Is Betting on the Next Meme Stock,5/4/2023 9:07:00 PM
GME,How the Internet Turned Us Into Horrible Investors,5/3/2023 3:37:23 PM
GME,How to Profit From GameStop Stock? The Key Is Timing Your Sale.,5/1/2023 3:48:58 PM
GME,GameStop Forecast: Can GME Stock Prove the Skeptics Wrong in 2023?,4/30/2023 12:47:49 PM
GME,Why GameStop Stock Investors Probably Won’t Win the Game,4/29/2023 1:22:41 PM
GME,Bed Bath & Beyond Goes Belly Up,4/28/2023 8:30:59 PM
GME,Cost to Borrow GameStop (GME) Stock Briefly Spikes,4/27/2023 7:11:50 PM
GME,3 Stocks for a 100% Short Squeeze Rally,4/25/2023 10:15:44 AM
GME,Wait for GameStop Stock to Hit $16… Then Buy!,4/24/2023 5:53:40 PM
GME,Stock Market Alert: 5 Things to Know as Investors Turn Bearish,4/23/2023 7:30:21 PM
GME,Short Interest Sector Focus: Consumer Cyclical Sector,4/20/2023 3:04:20 PM
GME,GME Stock Outlook: GameStop Risks Becoming the Next Blockbuster,4/19/2023 4:57:44 PM
GME,"MULN, BBBY, MMAT: 3 Penny Stocks to Forget About ASAP",4/18/2023 9:56:31 PM
GME,Trump SPAC Cut From Legendary Hedge Funder's 'Dirty Dozen': 'Wary Of Picking Up Pennies In Front Of A Steamroller',4/14/2023 9:50:33 PM
GME,BBBY Stock: Is Ryan Cohen Getting Involved With Bed Bath & Beyond Again?,4/13/2023 4:42:04 PM
GME,WISH Stock: What a 1-for-30 Reverse Split Means for ContextLogic,4/12/2023 7:19:13 PM
GME,GameStop Director Larry Cheng Just Doubled Down on GME Stock,4/11/2023 5:00:43 PM
GME,"EXCLUSIVE: Top 10 Most Searched Tickers On Benzinga Pro In March – Including Tesla, Apple, AMC And More",4/10/2023 9:02:48 PM
GME,3 Tech ETFs to Sell Now Before They Lose More Value,4/9/2023 10:21:39 PM
GME,"Gaming Industry Analyst Nick McKay Discusses EA, GameStop, Nintendo, Take-Two Interactive And More: Insights And Predictions For The Future Of Video Games",4/6/2023 1:49:44 AM
GME,Does a Swing to Profitability Make GME Stock a Buy on Fundamentals?,4/5/2023 12:41:56 PM
GME,Around $3M Bet On This Communication Services Stock? Check Out These 3 Stocks Insiders Are Buying,4/3/2023 3:22:43 PM
GME,There May Be Hope on the Horizon for GameStop Stock,3/31/2023 10:00:00 AM
GME,3 Short-Squeeze Stocks That Could Skyrocket in 2023,3/30/2023 7:20:39 PM
GME,GME Stock: GameStop Launches V2 of Its ‘GMERICA’,3/29/2023 8:52:09 PM
GME,"Dear GME Stock Fans, Mark Your Calendars for March 29",3/28/2023 5:11:39 PM
GME,AMC Stock Alert: AMC Announces Record Food Revenue,3/27/2023 8:29:55 PM
GME,GME Stock Alert: The Cost to Borrow GameStop Is Up 200% This Week,3/24/2023 3:53:57 PM
GME,AMC Stock Price Predictions: Will AMC Plunge to $1.60?,3/23/2023 1:32:35 PM
GME,"S&P 500, Nasdaq, Dow slide as Fed hikes rates, keeps hawkish stance",3/22/2023 8:04:36 PM
GME,GameStop Corp. Q4 Earnings Summary,3/21/2023 9:11:28 PM
GME,Notable earnings after Tuesday's close,3/20/2023 9:35:07 PM
GME,"Catalyst watch: Spotlight on the Fed meeting, Nvidia, Nike And Foot Locker",3/17/2023 7:00:22 PM
GME,GameStop (GME) Receives a Sell from Wedbush,3/16/2023 6:45:10 PM
