Ticker,Title,Link
GME,3 Celebrated and Hated Most-Shorted Stocks to Trade,12/10/2021 7:40:08 PM
GME,"4 Top Stock Trades for Friday: Bitcoin, GME, LULU, CHWY",12/9/2021 10:10:21 PM
GME,GameStop Posts Wider-than-expected Q3 Loss; Shares Down 6% ,12/8/2021 10:58:08 PM
GME,Notable earnings after Wednesday's close,12/7/2021 10:35:07 PM
GME,2 Big Stock Bets That Are Insiders Are Buying Now,12/6/2021 10:00:50 PM
GME,"Catalyst watch for next week: Rivian ratings pour in, big events for Southwest Airlines, McKesson and CVS Health",12/3/2021 8:00:27 PM
GME,7 Best Robinhood Stocks to Buy That Pay Monthly Dividends,12/2/2021 7:42:53 PM
GME,The Clover Health Dilemma: Is it a Good Buy or Goodbye?,12/1/2021 8:57:23 PM
GME,Holiday sales look strong but retail stocks slump amid Powell-Omicron double whammy,11/30/2021 4:40:53 PM
GME,GameStop Is a Tale of Visionaries and Guessing Games,11/29/2021 10:42:16 PM
GME,Tiger King Coin and 6 Other Weird Cryptos to Watch in 2022,11/26/2021 4:00:11 PM
GME,10 Cryptocurrencies Wrestling For a Place in the Metaverse,11/24/2021 5:26:48 PM
GME,How to Rinse and Repeat With Tilray Stock for an Easy Win,11/23/2021 2:02:49 PM
GME,"5 Short Squeeze Candidates For The Week: AGC SPAC Rejoins, Digital Ally, Tattooed Chef Join Leaderboard",11/22/2021 4:53:44 PM
GME,GME Stock Is Rising Because ConstitutionDAO Lost Its Bid… to Ken Griffin,11/19/2021 10:20:36 PM
GME,Could It Finally Be Time to Step Up to The Plate With GameStop?,11/18/2021 8:45:13 PM
GME,2 More Stocks Set to 2x… 5x… 10x in 2022,11/17/2021 9:54:26 PM
GME,Ocugen Needs More Than Covaxin to Boost Its Falling Shares,11/16/2021 8:18:30 PM
GME,GameStop’s Latest Gimmick Won’t Lift GME Stock,11/15/2021 8:14:40 PM
GME,"Videogame sales speed up, rising for sixth month aided by hardware and 'Far Cry 6'",11/12/2021 9:12:48 PM
GME,AMC Stock is Still Doomed to Drop,11/11/2021 8:20:29 PM
GME,Top 17 meme stocks this week on Reddit: DoorDash and Pubmatic spike after blowout earnings reports while AMD and Nvidia take off,11/10/2021 7:13:30 PM
GME,7 Meme Stocks Ready to Regain Their Lost Momentum,11/9/2021 4:52:25 PM
GME,"Short Squeeze Stocks: PROG, SAVA and 3 Others Experts Think Are Ready to Pop",11/8/2021 9:48:14 PM
GME,5 Stocks Set to 10x Next Year,11/5/2021 7:31:58 PM
GME,Bitcoin Miner Greenidge Generation Is Too Speculative to Truly Trust Yet,11/4/2021 8:19:53 PM
GME,54 Stocks Moving In Wednesday's Mid-Day Session,11/3/2021 5:03:49 PM
GME,Cassava Sciences adds nearly a third - most since February,11/2/2021 7:11:23 PM
GME,"GME Stock Surges 9% on Meme Momentum, Loopring NFT Speculation",11/1/2021 9:53:03 PM
GME,GameStop COO Jenna Owens Leaves The Company ,10/30/2021 8:20:55 PM
GME,7 Retail Stocks to Buy Regardless of Supply Shortages,10/29/2021 2:36:03 PM
GME,Why a Wait-and-See Approach May Not Work With ContextLogic Stock,10/28/2021 9:33:53 PM
GME,"Tesla Remains Top WallStreetBets Interest; AMD, Ocugen, Facebook And These Are Other Top Trends Today",10/27/2021 11:38:35 AM
GME,7 Robinhood Stocks That Could Blow Up in 2022,10/26/2021 6:11:59 PM
GME,7 Meme Stocks to Buy That Are Even Better Than Floki Inu,10/25/2021 5:11:07 PM
GME,9 Moonshot Bets to Beat Hedge Funds at Their Own Game,10/22/2021 8:59:48 PM
GME,7 Robinhood Stocks You Shouldn’t Touch With a 10-Foot Pole,10/21/2021 4:35:39 PM
GME,AMC or GME Stock: Which Is the Better Long-Term Investment?,10/20/2021 7:10:19 PM
GME,3 Big Takeaways From the SEC Report on GameStop (GME) Stock,10/19/2021 8:07:03 PM
GME,"Videogame sales rise for fifth straight month, paced by consoles",10/18/2021 9:11:52 PM
GME,Why Tilray Stock’s Epic Slide Will Eventually Reverse,10/15/2021 3:09:09 PM
GME,GameStop Stock Is Showing Signs of Weakness as Short-Sellers Lose Interest,10/14/2021 10:48:07 AM
GME,"Katapult Is Primed, But The Target Is Unknown",10/13/2021 10:19:09 PM
GME,"Despite Uncertain Prospects, ContextLogic Stock Could Still Bounce Back",10/12/2021 6:33:56 PM
GME,HYLN Stock: Why EV Play Hyliion Holdings Is Taking a Huge Hit Today,10/11/2021 5:04:22 PM
GME,"Lyft, Plug Power make latest Piper Sandler top 20 short squeeze list: Alpha Tactics",10/9/2021 6:34:49 PM
GME,3 of the Most Shorted Stocks to Buy for Big-Time Growth,10/8/2021 7:47:40 PM
GME,Groundbreaking Tech Makes Bionano Genomics Look Better Than Ever,10/7/2021 7:55:29 PM
GME,Ginkgo Bioworks Stock Drops 20% After Short Sellers Call Company A 'Colossal Scam',10/6/2021 6:38:48 PM
GME,CEI Stock and 4 Other Big Names Kerrisdale Capital Has Sold Short,10/5/2021 7:48:18 PM
GME,GameStop Stock Is Stuck in a Rut ,10/4/2021 4:33:23 PM
GME,The One Investment Bet You’d Be Crazy to Miss,10/1/2021 8:48:46 PM
GME,"SmileDirectClub Shares Are Retreating, but There May Be Hope for Bulls",9/30/2021 8:46:45 PM
GME,7 Meme Stocks With Short-Squeeze Potential In October,9/29/2021 7:56:03 PM
GME,ChargePoint Is Shaping Up for a Second Look,9/28/2021 6:55:04 PM
GME,3 Cheap Reddit Stocks to Snap Up Before This Week’s OTC Shakeout,9/27/2021 8:59:53 PM
GME,"Why The New Generation Of Investors Is More Serious, Informed Than It May Appear",9/25/2021 8:32:10 PM
GME,Avoid GameStop as Weakening Catalysts Dampen Share Prices,9/24/2021 8:31:12 PM
GME,Can Reddit Save the Faltering Price Action in BlackBerry Stock?,9/23/2021 6:44:49 PM
GME,Is Clover Health Stock a Prescription for Bears?,9/22/2021 6:43:47 PM
GME,The Absurdists Must Be Behind the Market Value of Gamestop,9/21/2021 6:55:47 PM
GME,"5 Short Squeeze Candidates To Watch: BBIG Tops List With Katapult, Aterian Right Behind",9/20/2021 3:37:13 PM
GME,The retail trading frenzy may have plateaued: Alpha Tactics,9/18/2021 9:49:48 PM
GME,What US Stocks Are The Largest Gainers In 2021?,9/17/2021 7:00:17 PM
GME,The Coiled Spring Strategy for Moonshot Investing in Short Squeezes,9/16/2021 9:19:30 PM
GME,"4 Top Stock Trades for Thursday: TSLA, AMC, TGT, WEBR",9/15/2021 9:35:29 PM
GME,The Moonshot Investor: Golden Rule Investing for Penny Stocks,9/14/2021 7:57:14 PM
GME,"5 Short Squeeze Candidates To Watch: Support.com, Takung, Among Others",9/13/2021 10:11:34 PM
GME,The Boring Reaction to Gamestop’s Q2 Earnings Is Actually Good News,9/10/2021 8:27:46 PM
GME,An Upcoming Meme Stock ETF Is Great News for GameStop,9/9/2021 8:58:09 PM
GME,GameStop Corp. Q2 adjusted earnings Miss Estimates,9/8/2021 10:24:36 PM
GME,Notable earnings after Wednesday's close,9/7/2021 9:35:15 PM
GME,"These 5 stocks offer the most short-squeeze potential for retail investors this week as Support.com continues to generate buzz, according to Fintel",9/6/2021 4:31:11 PM
GME,"GameStop Remains the Never-Ending Story, But Still Stay Away",9/3/2021 2:14:34 PM
GME,Reddit reportedly looking to hire advisers for IPO at $15B+ valuation (update),9/2/2021 8:28:41 PM
GME,It’s Time to Face the Truth — Gamestop Stock Is Unstoppable,9/1/2021 9:12:42 PM
GME,3 Ways to Play GameStop Into Earnings,8/31/2021 6:32:24 PM
GME,MMAT Stock: What Is Going on With Red-Hot Meta Materials Today?,8/30/2021 6:35:45 PM
GME,5 Under-$10 Stocks Will Survive The Great Meme Bubble of 2021,8/27/2021 8:28:20 PM
GME,GameStop’s Biggest Advantage Could Become Its Worst Enemy,8/26/2021 7:56:44 PM
GME,GameStop Announces Second Quarter Fiscal 2021 Earnings Release Date,8/25/2021 10:05:00 PM
GME,Express Stock Moves Higher On Retail Trader Interest: Technical Levels To Watch,8/24/2021 10:47:44 PM
GME,"These 5 stocks offer the most short-squeeze potential for retail investors this week, according to Fintel",8/23/2021 7:54:34 PM
GME,Citadel To Pull About $500M From Melvin Capital Following Bad Short Bet On GameStop,8/21/2021 7:39:31 PM
GME,3 Hypergrowth Stocks in Fallen Angel Industries,8/20/2021 8:59:44 PM
GME,"GameStop Keeps Lowering Costs, Should Be a Buy Closer to $100",8/19/2021 7:41:48 PM
GME,How To Put Warren Buffett In Charge Of Your Retirement Investing,8/18/2021 10:00:19 AM
GME,"Top 14 meme stocks this week on Reddit: AMC and GameStop stay strong, but surprising names like ContextLogic and SoFi Technologies make the cut",8/17/2021 6:18:03 PM
GME,The Case For A Stock Market Bubble: 'Speculation Pervading Society',8/16/2021 9:30:06 PM
GME,2 Moonshot Stocks Under $10 Following the Golden Rule,8/13/2021 8:59:22 PM
GME,3 Post-Earnings Stocks to Buy Right Now,8/12/2021 8:44:02 PM
GME,Robinhood Stock Isn’t Just for Apes,8/11/2021 6:45:36 PM
GME,My Thoughts on AMC’s Second-Quarter Earnings Report,8/10/2021 10:35:49 PM
GME,AMC Accepting Bitcoin? What to Know About the Crypto News Lifting AMC Stock,8/9/2021 10:06:37 PM
GME,Palantir Stock Is Stuck in a Trading Range. Here’s How It Could Spark Higher.,8/6/2021 8:48:49 PM
GME,Avoid Robinhood Stock Like the Plague,8/5/2021 6:24:39 PM
GME,"Robinhood Soars After Becoming Latest Meme Stock Darling, AMC & GameStop Tumble",8/4/2021 11:58:04 PM
GME,"Genius Brands Stock Holds Critical Level, Looks Set To Break",8/3/2021 10:01:28 PM
GME,3 Stocks to Buy for Profits From Earnings Season Pin Action,8/2/2021 8:10:24 PM
GME,Should You Invest in Robinhood?,7/30/2021 9:12:33 PM
GME,"Move Over AMC, GameStop: Could Retail Traders Smoke Shorts On These 4 Stocks?",7/29/2021 8:32:29 PM
GME,What Did the Stock Market Do Today? 3 Big Stories to Catch Up On.,7/28/2021 9:09:58 PM
GME,"GXO Logistics, Victoria's Secret & GameStop Set to Join S&P MidCap 400; Strategic Education, World Fuel Services & Lakeland Financial to Join S&P SmallCap 600",7/27/2021 11:50:00 PM
GME,Why Meta Materials Is a Cash Cow for Bears,7/26/2021 6:09:24 PM
GME,Videogame sales in Q2 pull off surprising 2% gain against tough pandemic comparison,7/25/2021 3:02:07 PM
GME,Housing Prices Are Absurd. Don’t Get Mad — Get Even.,7/23/2021 6:37:50 PM
GME,GME Stock: What We Know About Ryan Cohen’s Plans to Upgrade GameStop Stores,7/22/2021 5:47:40 PM
GME,$375 Million Guidance Should Lead to Positive Free Cash Flow for Skillz,7/21/2021 7:17:14 PM
GME,What Did the Stock Market Do Today? 3 Big Stories to Catch Up On.,7/20/2021 9:06:46 PM
GME,7 Growth Stocks to Buy As Meme Stock Mania Fades,7/19/2021 9:06:09 PM
GME,'Bad Omen' For Meme Stocks And The Retail Trading Boom? Here's What The Data Says,7/16/2021 10:45:07 PM
GME,AMD And Biogen Lead The QQQ Lower Thursday,7/15/2021 10:12:42 PM
GME,Traders Wonder if Nano Dimension Is a Whale’s Tale,7/14/2021 6:38:09 PM
GME,The One-Day Pop Is Back: What That Means for 3 Discord Stocks,7/13/2021 7:20:46 PM
GME,7 Names That Could Be The Next Short-Squeeze Stocks,7/12/2021 8:58:53 PM
GME,"The Latest Barron's Picks And Pans: Meme Stocks, AstraZeneca, Citigroup And More",7/11/2021 3:43:08 PM
GME,"Chewy, First Solar make Piper Sandler's top 20 short squeeze list: Alpha Tactics",7/10/2021 7:07:12 PM
GME,"Wall Street Thinks Dogecoin Is Dead, But These 3 Cryptos Can Live Forever",7/9/2021 8:32:21 PM
GME,7 Short-Squeeze Stocks To Buy In July For Contrarian Investors,7/8/2021 8:44:31 PM
GME,How to Cope With the Steep Price of Admission for AMC Stock,7/7/2021 6:13:59 PM
GME,What Did the Stock Market Do Today? 3 Big Stories to Catch Up On.,7/6/2021 9:03:22 PM
GME,Stay Away from Aspiring Squeeze Play Workhorse Stock,7/5/2021 10:00:37 AM
GME,Robinhood IPO: Six big risks to consider before buying HOOD stock,7/4/2021 4:07:56 PM
GME,Ignore Near-Sighted Apes and Own Senseonics,7/1/2021 7:18:47 PM
GME,What Did the Stock Market Do Today? 3 Big Stories to Catch Up On.,6/30/2021 8:37:01 PM
GME,Sell AMC Stock Before the Herd Dumps the Shares,6/29/2021 7:18:55 PM
GME,It’s Too Late to Ride Blackberry’s Meme Stock Wave,6/28/2021 6:24:58 PM
GME,This Stock Looks To Be Breaking Out As Redditors Take Charge,6/25/2021 9:40:07 PM
GME,Institutional investors still on the short-interest bandwagon: BofA survey,6/24/2021 6:53:12 PM
GME,Former Wall Street Floor Trader: Tesla Is Going To $700,6/23/2021 6:03:33 PM
GME,34 Stocks Moving In Tuesday's Mid-Day Session,6/22/2021 6:00:15 PM
GME,4 Stocks to Boost Your Portfolio (In an Unintuitive Way),6/21/2021 9:19:23 PM
GME,Buy WISH Stock Before It Joins GME and AMC as a Retail Favorite,6/18/2021 11:34:23 PM
GME,"Look at the Books, Not the Memes, When It Comes to Sundial Stock",6/17/2021 9:28:16 PM
GME,GameStop Shares Just Don’t Deliver on Value,6/16/2021 7:56:20 PM
GME,Reality Is Setting in for GameStop — $200 Is Too High,6/15/2021 8:25:35 PM
GME,Petco Options Traders Bet An Epic Short Squeeze Is In The Cards,6/14/2021 9:42:20 PM
GME,"AHT CEO Rob Hays Thanks Retail Traders, Gives Shoutouts Live On CNBC",6/11/2021 9:59:03 PM
GME,What Did the Stock Market Do Today? 3 Big Stories to Catch Up On.,6/10/2021 9:39:59 PM
GME,Here’s What Happens When the Value “Rally” Fizzles,6/9/2021 11:22:56 PM
GME,What Did the Stock Market Do Today? 3 Big Stories to Catch Up On.,6/8/2021 9:43:13 PM
GME,What Did the Stock Market Do Today? 3 Big Stories to Catch Up On.,6/7/2021 10:13:51 PM
GME,How The AMC Squeeze Compares To The GameStop Run: Are Buyers Just Playing A Game?,6/5/2021 2:23:57 PM
GME,Short Squeeze? Workhorse Group Stock Again A Retail Trader Plaything,6/4/2021 10:18:04 PM
GME,What Did the Stock Market Do Today? 3 Big Stories to Catch Up On.,6/3/2021 9:33:12 PM
GME,"What Happened With AMC, GameStop, Koss, Nokia And Palantir Today?",6/2/2021 11:06:27 PM
GME,Set Your Short-Term Sights on AMC Stock and You Won’t Be Disappointed,6/1/2021 8:58:20 PM
GME,Beyond Meat Stock Is Beyond Overbought and Overvalued After Earnings Miss,5/31/2021 10:00:09 AM
GME,What Did the Stock Market Do Today? 3 Big Stories to Catch Up on,5/28/2021 8:32:03 PM
GME,What Did the Stock Market Do Today? 3 Big Stories to Catch Up On.,5/27/2021 9:27:54 PM
GME,What Did the Stock Market Do Today? 3 Big Stories to Catch Up On.,5/26/2021 9:29:06 PM
GME,What Did the Stock Market Do Today? 3 Big Stories to Catch Up On.,5/25/2021 9:06:17 PM
GME,3 Most-Shorted Stocks Ready to Buy Today,5/21/2021 7:18:14 PM
GME,"GameStop Never Went Back Down, So Profit Off of Those Who Think It Will",5/20/2021 1:40:19 PM
GME,Zomedica Stock Is At Serious Risk Unless Bulls Commit,5/19/2021 3:49:38 PM
GME,Here’s How to Avoid Wall Street Buzzkill,5/18/2021 9:09:51 PM
GME,"BitTorrent Might Make You Returns, But Don’t Fall For It",5/17/2021 8:12:22 PM
GME,Earnings to Buy on Today’s Most-Shorted Stocks,5/14/2021 7:46:11 PM
GME,AMC Stock Alert: 16 Things to Know as #AMCSqueeze Trends on Twitter Today,5/13/2021 3:12:43 PM
GME,Investors Should Hold Off on Ideanomics Until Its Value Is More Clear,5/12/2021 4:46:18 PM
GME,7 Stocks Most at Risk of a Capital Gains Tax Selloff ,5/10/2021 5:08:11 PM
GME,3 Most-Shorted Stocks to Trade,5/7/2021 8:28:25 PM
GME,What Did the Stock Market Do Today? 3 Big Stories to Catch Up On.,5/6/2021 9:34:58 PM
GME,What Did the Stock Market Do Today? 3 Big Stories to Catch Up On.,5/5/2021 10:05:52 PM
GME,Robinhood Dogecoin Error: Robinhood Reports Crypto Issues as DOGE Climbs,5/4/2021 5:42:34 PM
GME,4 Heavily Shorted Stocks Primed For a Big Move,5/3/2021 8:56:23 PM
GME,Videogame sales party rolls on - for now - with Q1 spending up 30%,5/1/2021 10:31:00 PM
GME,What Are The Best Penny Stocks To Buy On Reddit?,4/30/2021 10:30:32 PM
GME,"Dogecoin May Remain Popular, but Don’t Buy the Pullback",4/28/2021 8:12:30 PM
GME,Reddit’s r/WallStreetBets Wants to Send MVIS to $100. Short Sellers Are Playing with Fire.,4/27/2021 8:47:22 PM
GME,"4 Top Stock Trades for Tuesday: AMZN, GE, OTIS, GME",4/26/2021 11:04:16 PM
GME,Too Soon to Be Contrarian,4/23/2021 7:52:11 PM
GME,"If You Invested $1,000 In Zomedica Stock 1 Year Ago, Here's How Much You'd Have Now",4/22/2021 8:35:56 PM
GME,MVIS Stock: Why Redditors Are Helping MicroVision Drive Higher Today,4/21/2021 8:45:56 PM
GME,C-Suite Shakeup and Debt Elimination Plan Make GameStop Worth Considering,4/20/2021 8:51:51 PM
GME,7 Big Companies Powerful Enough to Pivot Their Business,4/19/2021 7:28:22 PM
GME,3 Stocks That Prove We’re in a Bubble,4/16/2021 9:27:38 PM
GME,7 IPOs to Set Your Sights on Now That Coinbase Is in the Rearview Mirror,4/15/2021 7:00:09 PM
GME,What Did the Stock Market Do Today? 3 Big Stories to Catch Up On.,4/14/2021 9:43:26 PM
GME,GameStop Announces Voluntary Early Redemption of Senior Notes,4/13/2021 10:05:00 PM
GME,"Philosopher Slavoj Žižek says Wall Street Bets' GameStop squeeze was revolutionary because of how it focused on deliberately creating chaos, rather than anything fundamental",4/12/2021 10:21:02 PM
GME,What Did the Stock Market Do Today? 3 Big Stories to Catch Up On.,4/9/2021 9:36:36 PM
GME,What Did the Stock Market Do Today? 3 Big Stories to Catch Up On.,4/8/2021 9:22:14 PM
GME,DISCB and 6 Other Reddit Stocks Waiting for a Short Squeeze,4/7/2021 6:10:27 PM
GME,It’s Game on for GameStop Stock,4/6/2021 6:05:13 PM
GME,35 Stocks Moving In Monday's Mid-Day Session,4/5/2021 6:02:53 PM
GME,Asensus Surgical Can’t Support This Valuation and Won’t Anytime Soon,4/4/2021 12:30:05 PM
GME,"Castor Maritime Isn’t Just a Meme Play, but It’s Still a High-Risk Proposition",4/3/2021 2:01:20 PM
GME,3 of Today’s Most-Shorted Stocks Ready to Trade,4/2/2021 6:17:17 PM
GME,"Redditors Brought Express Back From the Brink of Death, but That’s Not a Reason to Buy",4/1/2021 7:36:20 PM
GME,What Did the Stock Market Do Today? 3 Big Stories to Catch Up On.,3/31/2021 8:53:28 PM
GME,What Did the Stock Market Do Today? 3 Big Stories to Catch Up On.,3/30/2021 9:26:11 PM
GME,Is It Game Over for GameStop After Earnings?,3/29/2021 7:04:08 PM
GME,"Benzinga's Bulls And Bears Of The Week: Amazon, Citigroup, Facebook, GameStop, Intel And More",3/28/2021 1:31:50 PM
GME,The Coolest Vending Machine Ever,3/27/2021 9:30:43 PM
GME,What Did the Stock Market Do Today? 3 Big Stories to Catch Up On.,3/26/2021 8:56:42 PM
GME,What Did the Stock Market Do Today? 3 Big Stories to Catch Up On.,3/25/2021 8:53:41 PM
GME,Mid-Afternoon Market Update: Dow Surges 270 Points; GameStop Shares Drop After Q4 Earnings,3/24/2021 7:32:36 PM
GME,6 Stocks Moving In Tuesday's After-Hours Session,3/23/2021 10:40:52 PM
GME,'Stimmy' Checks And The Stock Market: Will The Retail Trading Frenzy Continue?,3/22/2021 11:45:08 PM
GME,"Barron's Latest Picks And Pans: Space Race Picks, Eli Lilly, GameStop, Splunk And More",3/21/2021 4:18:05 PM
GME,They Aren’t Laughing at My Bold Cryptocurrency Prediction Anymore,3/20/2021 9:30:16 PM
GME,"GameStop's stock price likely to see limited impact from $1,400 stimulus checks, says Bank of America",3/19/2021 9:15:03 PM
GME,What Did the Stock Market Do Today? 3 Big Stories to Catch Up On.,3/18/2021 9:22:12 PM
GME,Why Rocket Stock Should Be on Your Watchlist,3/17/2021 5:52:22 PM
GME,What Did the Stock Market Do Today? 3 Big Stories to Catch Up On.,3/16/2021 8:48:07 PM
GME,"Retail investors could buy a record $3 billion of US stocks the day they get their stimulus money, one research firm says",3/15/2021 6:54:04 PM
GME,Investors Go Looking for a ‘Why’ To Justify Buying Ideanomics Stock,3/14/2021 12:31:27 PM
GME,Short bets against GameStop are the lowest they've been in 2021 as the stock finds renewed life,3/12/2021 9:02:02 PM
GME,How The Dave Portnoy-Backed Social Sentiment ETF Actually Works,3/11/2021 9:35:05 PM
GME,The Reddit Army: What Happens When Bonnie and Clyde Come to Wall Street,3/10/2021 10:07:43 PM
GME,GameStop Announces Fourth Quarter and Fiscal Year 2020 Earnings Release Date,3/9/2021 10:05:00 PM
GME,10 of the Hottest ETFs To Buy Right Now,3/8/2021 9:44:18 PM
GME,What Did the Stock Market Do Today? 3 Big Stories to Catch Up On.,3/5/2021 9:50:33 PM
GME,"More GameStop-like short squeezes could be up ahead in the 'fragile' stock market, says a market research veteran",3/4/2021 10:15:02 PM
GME,Melvin Capital posts modest February bounce after January plunge,3/3/2021 9:58:56 PM
GME,Detroit's Mortgage Giants Rocket Higher Amid Latest WallStreetBets-Sparked Short Squeeze,3/2/2021 9:30:14 PM
GME,"Reddit Stocks: Why GME, BB, NOK and AMC Stock Gained Again on Monday",3/1/2021 10:22:44 PM
GME,"When You Buy A Stock, Here's How Much Cash The Company Actually Receives",2/28/2021 7:02:11 PM
GME,Why GameStop Stock Traders Should Beware The 'Law Of Twos And Threes',2/27/2021 12:31:10 AM
GME,What Did the Stock Market Do Today? 3 Big Stories to Catch Up On.,2/26/2021 9:19:07 PM
GME,GMBL Stock: How Andrew Left Is Giving Esports Entertainment a Huge Boost,2/25/2021 10:24:54 PM
GME,GameStop spikes 104% in late-day surge as buying frenzy resumes,2/24/2021 10:33:02 PM
GME,GameStop CFO To Resign,2/23/2021 11:46:18 PM
GME,The Next Cryptocurrency to Explode in 2021? 5 Names to Consider as Bitcoin Plunges,2/22/2021 10:08:20 PM
GME,'Roaring Kitty' doubles down on GameStop stake,2/20/2021 7:25:12 PM
GME,3 Reasons Cannabis Stocks May Be Headed Lower,2/19/2021 10:22:50 PM
GME,Reddit trader Keith Gill told Congress he'd still buy GameStop stock at its current price,2/18/2021 8:57:02 PM
GME,Congressional Hearing On GameStop Ahead: What Investors Need To Know,2/17/2021 9:46:54 PM
GME,"Meme Stock Predictions for 2021: Where Will GME, BB, AMC and Bitcoin Go?",2/16/2021 8:42:01 PM
GME,Bitcoin Is Going to Crash. The Big Question Is When,2/15/2021 5:30:13 PM
GME,"This Week In Cannabis: Tilray, Aphria, Sundial Go For A Ride; ETFs Pop With CNBS Advancing 99%",2/14/2021 6:52:57 PM
GME,"Videogame sales jump again, up 42% to January-record $4.7B",2/13/2021 11:31:00 PM
GME,Seeking Alpha Catalyst Watch,2/12/2021 8:15:29 PM
GME,"If You Have a Profit With Sundial Growers, Now Is the Time to Take It",2/11/2021 9:59:59 PM
GME,4 Retail Stocks Hoping For a Boost From r/WallStreetBets,2/10/2021 10:52:01 PM
GME,5 Things To Consider When Choosing A Cryptocurrency Exchange,2/9/2021 9:46:12 PM
GME,"Robinhood trading volume keeps snowballing, even amid controversy",2/8/2021 4:56:54 PM
GME,DeFi Trend: The Solution — and Huge Opportunity — to the Robinhood Fiasco,2/6/2021 10:30:26 PM
GME,TSNP Stock: What’s Going on With Blockchain Play Tesoro Enterprises?,2/5/2021 10:33:51 PM
GME,APPS Stock: Why This Under-the-Radar Name Is Surging to New Highs,2/4/2021 9:57:40 PM
GME,"After the GameStop Frenzy Fizzles, Here’s One Move to Make",2/3/2021 11:24:33 PM
GME,Here's how one SPAC-focused Reddit group is trying to prevent pump and dumps as retail traders throw markets into turmoil,2/2/2021 11:18:03 PM
GME,"'This Is Not The Market Participant's Problem': Volatility Arbitrage Trader Talks GameStop, Market Microstructure, Regulation",2/1/2021 11:15:15 PM
GME,Schwab updates investors this week with brokers in the crosshairs: Sector Watch,1/31/2021 6:51:59 PM
GME,"Trading Platform Company IG Group Joins In Halting Of New Trades in GameStop, AMC",1/30/2021 8:31:40 PM
GME,"Robinhood Expands Trading Restrictions To 50 Stocks, Including GameStop, General Motors, Starbucks, Several SPACs",1/29/2021 11:52:41 PM
GME,"GME, BB, AMC Drop 50% on Robinhood Ban — But One Will Recover 100%",1/28/2021 9:50:07 PM
GME,"Discord bans Reddit's WallStreetBets from its server, The Verge says (update)",1/27/2021 11:50:10 PM
GME,Why Virgin Galactic Shares Were Gaining Altitude Tuesday,1/26/2021 11:21:20 PM
GME,"4 Top Stock Trades for Tuesday: GME, CLX, JNJ, MCD",1/25/2021 10:21:16 PM
GME,"Inside GameStop's chaotic week in the stock market, which saw Reddit day-traders revolt against a renowned short-seller and send shares spiking",1/24/2021 2:50:02 PM
GME,GameStop's Power Surge: Will WallStreetBets Or The Short Sellers Come Out On Top?,1/22/2021 9:45:39 PM
GME,7 Stocks With Clues From Insider Trading,1/21/2021 9:14:23 PM
GME,4 Growth Stocks That Are Better Than Bitcoin,1/19/2021 5:02:18 PM
GME,"Pandemic, new consoles push videogame sales to new December record $7.7B",1/15/2021 7:13:38 PM
GME,52 Stocks Moving In Thursday's Mid-Day Session,1/14/2021 6:08:06 PM
GME,"4 Top Stock Trades for Thursday: AMZN, PLUG, GME, REGN",1/13/2021 10:36:36 PM
GME,5 Companies With More Store Closings on the Way,1/12/2021 7:21:48 PM
GME,"GameStop Shares Rally On Holiday Sales, Board Reshuffle",1/11/2021 10:47:23 PM
GME,"Barron's Picks And Pans: Dividend Aristocrats, Alibaba, GameStop, Walmart And More",1/10/2021 4:41:08 PM
GME,Seeking Alpha Catalyst Watch,1/8/2021 8:30:57 PM
GME,Remember stimulus? Huge gains in retail sector after Georgia Senate election,1/6/2021 6:31:48 PM
GME,Delos Capital Advisors' Analyst Shares His Stock Picks,1/5/2021 11:51:59 PM
GME,"Benzinga's 2020 Year In Review: Coronavirus Mayhem, Historic Crash And Recovery, EV Surge And More",12/31/2020 8:45:00 PM
GME,10 Best and Worst Calls of 2020,12/28/2020 2:39:17 PM
GME,"Notable Insider Buys In The Week Of Christmas: Foot Locker, GameStop, NetApp And More",12/26/2020 7:53:46 PM
GME,88 Biggest Movers From Yesterday,12/24/2020 10:48:18 AM
GME,Jon Najarian Sees Unusual Option Activity in GameStop And FuelCell,12/23/2020 7:01:26 PM
GME,"4 Top Stock Trades for Wednesday: SHOP, WMT, GME, FB",12/22/2020 9:42:24 PM
GME,"GameStop rallies with Chewy founder raising stake, pressing board even harder",12/21/2020 1:49:59 PM
GME,Get Out of GameStop Stock While You Still Can,12/14/2020 6:57:55 PM
GME,New console launches pace a record $7B November for videogame sales,12/11/2020 3:52:04 PM
GME,"4 Top Stock Trades for Thursday: CHWY, GME, ADBE, RH",12/9/2020 10:01:09 PM
GME,"GME, QS, ICHR and RCKT among after-hours movers",12/8/2020 11:04:18 PM
GME,GameStop Q3 2020 Earnings Preview,12/7/2020 10:35:52 PM
GME,Seeking Alpha Catalyst Watch,12/4/2020 8:30:00 PM
GME,Stock Alert: GameStop Touches New 52-week High ,11/30/2020 4:43:08 PM
GME,Stock Alert: GameStop Adds 11% On Black Friday ,11/27/2020 4:46:36 PM
GME,GameStop Announces Third Quarter Fiscal 2020 Earnings Release Date,11/24/2020 10:06:00 PM
GME,Game console hunters have bigger Black Friday challenge: Finding a PlayStation or Xbox in stock,11/23/2020 9:04:13 PM
GME,GameStop Announces Next Level of Black Friday Deals,11/20/2020 3:00:00 PM
