Ticker,Title,Link
GME,"With new consoles, gaming industry faces question: Staying power, or a flash in the pandemic pan?",11/15/2020 4:01:20 PM
GME,October videogame sales +14% as preview of new-generation holiday season,11/13/2020 3:04:41 PM
GME,Sony Stock: Today’s PlayStation 5 Launch and 2 Other Investing Takeaways,11/12/2020 6:04:34 PM
GME,Videogame spending hits Q3 record as blockbuster 2020 rolls on,11/11/2020 5:18:32 PM
GME,GameStop +4% on early redemption of senior notes,11/10/2020 10:44:12 PM
GME,9 Cyclical Stocks With Further Gains to Come,11/9/2020 2:26:33 PM
GME,Seeking Alpha Catalyst Watch,10/23/2020 7:30:23 PM
GME,7 Smart Ways To Buy Cheap Stocks With Confidence,10/22/2020 1:24:33 PM
GME,GameStop Releases its ‘Ready. Set. Gift.’ 2020 Holiday Gift Guide,10/19/2020 4:00:10 PM
GME,September videogame sales rise at moderate pace ahead of new consoles,10/16/2020 3:05:12 PM
GME,"4 Top Stock Trades for Friday: ZM, DKNG, VRTX, GME",10/15/2020 8:31:35 PM
GME,"NIO, BBBY GME and GRUB among premarket gainers",10/14/2020 12:21:04 PM
GME,"MDRX, VOXX, ENZ and FLWS among after-hours movers",10/13/2020 9:42:58 PM
GME,Get a Head Start on Holiday Shopping by Taking Advantage of GameStop’s ‘1Up’ 48-Hour and PRO Days Sale Events,10/12/2020 7:37:09 PM
GME,Blockbuster bull vs. bear battle setting up on GameStop,10/10/2020 1:26:10 PM
GME,Seeking Alpha Catalyst Watch,10/9/2020 7:00:01 PM
GME,"After Market Hours: GameStop, NXP, GenMark, Selecta Biosciences And Extreme Networks Gain ",10/8/2020 11:30:31 PM
GME,7 Sizzling Hot Stocks to Buy Now Amid Even Hotter Politics,10/5/2020 1:00:54 PM
GME,Why GameStop Stock Is Soaring 19% Today,9/22/2020 2:38:24 PM
GME,GameStop Now Taking Pre-Orders for Sony PlayStation®5 and Sony PlayStation®5 Digital Edition,9/17/2020 1:02:27 AM
GME,"5 Top Stock Trades for Thursday: ADBE, GE, BA, GLD, GME",9/16/2020 8:58:28 PM
GME,CSFB Commercial Mortgage Trust 2005-C4 -- Moody's downgrades one class of CSFB 2005-C4,9/11/2020 11:04:00 PM
GME,"After Hours Market: Sonoma Pharmaceuticals, RH, SelectQuote Gain; GameStop, Quotient Slip ",9/10/2020 1:15:25 AM
GME,"GameStop Q2 Results Miss Wall Street, Shares Down 8% ",9/9/2020 11:01:37 PM
GME,Gamestop A is about to announce its earnings — here's what to expect,9/8/2020 3:01:32 PM
GME,GameStop News: GME Stock Gets Goosed 30% by Chewy Co-Founder Stake,8/31/2020 6:58:39 PM
GME,GameStop Announces Second Quarter Fiscal 2020 Earnings Release Date,8/26/2020 10:06:10 PM
GME,"Famed 'Big Short' investor Michael Burry's top 5 portfolio holdings include a massive bet on Alphabet (GOOGL, FB, BKNG, GME, GS)",8/19/2020 6:48:12 PM
GME,3 Stocks That Look Like They’re Headed to Bankruptcy,8/18/2020 10:05:05 AM
GME,6 Retail Stocks Racing Against Bankruptcy,8/14/2020 12:22:27 PM
GME,10 Gaming Stocks That Will Power Through the New Normal,7/29/2020 1:11:04 PM
GME,GameStop Now Requiring All Customers to Wear Face Coverings in U.S. Stores,7/17/2020 7:10:10 PM
GME,"GameStop Corp. -- Moody's upgrades GameStop's CFR to B3, outlook changed to stable",7/8/2020 6:27:00 PM
GME,GameStop Announces Expiration and Final Results of the Exchange Offer and Consent Solicitation,7/2/2020 12:45:10 PM
GME,"Game Informer Says Goodbye to Editor-in-Chief, Andy McNamara",6/30/2020 6:00:10 PM
GME,10 Cheap Stocks to Buy Under $10,6/26/2020 11:59:59 PM
GME,GameStop Announces Receipt of the Requisite Consents for the Exchange Offer and Consent Solicitation and the Extension of the Early Tender Date for the Exchange Offer ,6/18/2020 1:07:34 PM
GME,GameStop Reports Preliminary Voting Results from Annual Meeting of Stockholders,6/12/2020 5:01:55 PM
GME,Retail reeling as COVID-19 risk priced back in,6/11/2020 2:50:06 PM
GME,"Stocks Making Big Moves After Hours: Plus Therapeutics, Lakeland Industries, Gamestop ",6/10/2020 12:47:00 AM
GME,GameStop Corp. Q1 adjusted earnings Miss Estimates,6/9/2020 11:43:21 PM
GME,Notable earnings after Tuesday's close,6/8/2020 9:35:27 PM
GME,"GameStop Corp. -- Moody's places GameStop's ratings, including its Caa1 CFR, under review for upgrade",6/5/2020 7:24:00 PM
GME,Proxy firms back GameStop activists,6/3/2020 7:30:44 PM
GME,"GameStop Announces Change of Location of Annual Meeting of Stockholders to Be Held on June 12, 2020",6/2/2020 10:06:10 PM
GME,"GameStop Recommends Stockholders Vote the BLUE Proxy Card to Support ALL of GameStop’s Independent, Experienced and Highly Qualified Directors",6/1/2020 5:15:10 PM
GME,GameStop Announces First Quarter Fiscal 2020 Earnings Release Date,5/28/2020 10:06:10 PM
GME,GameStop Highlights the Strengths of its Board of Directors and the Limitations of Hestia Capital and Permit Capital’s Inexperienced Nominees,5/26/2020 10:05:10 PM
GME,Interesting longs from the Big Short guy,5/22/2020 4:08:10 PM
GME,GameStop Highlights the Progress Made Executing Its Innovative Business Transformation Plan,5/18/2020 11:30:10 PM
GME,"Online sales have spiked over 1,500% at struggling video game retail giant GameStop, according to a new report (GME, NTDOY, ATVI)",5/15/2020 8:06:04 PM
GME,"GameStop briefly had Nintendo Switch consoles back in stock. They sold out almost immediately. (GME, NTDOY)",5/14/2020 6:15:04 PM
GME,"GameStop Recommends Stockholders Vote the BLUE Proxy Card to Support ALL of GameStop’s Independent, Experienced and Highly Qualified Directors",5/11/2020 11:15:10 PM
GME,It Is Very Likely TSLA Stock Will See $1000 by the End of the Summer,4/29/2020 12:32:17 PM
GME,GameStop Corp. -- Moody's announces completion of a periodic review of ratings of GameStop Corp.,4/28/2020 4:34:00 PM
GME,GameStop soars after activist action,4/27/2020 7:35:30 PM
GME,Struggling video game retailer GameStop has argued it's 'essential.' Now it's preparing to fully re-open some stores even as most of the US remains in quarantine. (GME),4/22/2020 10:27:08 PM
GME,GameStop Provides Business Update Related to COVID-19,4/21/2020 10:05:10 PM
GME,"GameStop +2.5% as CEO buys 25,000 shares",4/17/2020 9:22:36 PM
GME,GameStop cools off after mini-winning streak,4/15/2020 2:47:18 PM
GME,"AAL, UAL, GME and SGMO among after-hours movers",4/14/2020 9:32:34 PM
GME,GameStop reportedly told employees to wrap their hands in plastic bags while they continued working during the coronavirus outbreak (GME),3/29/2020 4:18:06 PM
GME,GameStop looks to navigate through pandemic,3/27/2020 11:04:53 AM
GME,"GME, AI, MFA and PACB among after-hours movers",3/26/2020 9:38:02 PM
GME,GameStop Q4 2020 Earnings Preview,3/25/2020 9:35:19 PM
GME,Investor Group Nominates Candidates To GameStop Board - Quick Facts ,3/23/2020 1:29:24 PM
GME,GameStop To Close All US Retail Stores Amid Coronavirus Outbreak ,3/22/2020 4:03:26 AM
GME,GameStop Provides US Store Operations and Customer Service Update,3/21/2020 11:55:00 PM
GME,GameStop News: GME Stock Hit 10% After Defying State Orders to Close,3/20/2020 7:55:07 PM
GME,GameStop pushes to keep stores open,3/19/2020 8:23:44 PM
GME,Videogame sales fall for seventh month,3/13/2020 4:40:24 PM
GME,GameStop Announces Fourth Quarter and Fiscal 2019  Earnings Release Date,3/12/2020 9:06:00 PM
GME,"NVAX, GME, GLNG and GOGO among after hour movers",3/11/2020 9:35:33 PM
GME,"GameStop Appoints Reginald Fils-Aimé, William Simon and James Symancyk to Board of Directors and Enhances Corporate Governance to Drive Ongoing Business Transformation",3/9/2020 9:10:00 PM
GME,"GameStop Redesigns PowerUp Rewards Loyalty Program, Providing Pro-Level Members More Benefits and Flexibility",2/24/2020 3:00:00 PM
GME,Videogame sales fall for sixth straight month,2/14/2020 5:23:36 PM
GME,Activision Blizzard Stock Still Has a Serious Growth Problem,2/11/2020 2:16:43 PM
GME,GameStop Offers ‘For the Love of the Game’ Deals to Help Gamers Celebrate Valentine’s Day with Their ‘Player 2’,2/6/2020 5:02:07 PM
GME,GameStop Corp. -- Moody's downgrades GameStop's CFR to B2,1/30/2020 10:13:00 PM
GME,"GameStop Holiday Sales Tank 28%, Shares Fall ",1/14/2020 12:21:15 AM
GME,GameStop Reports 2019 Holiday Sales Results,1/13/2020 10:06:00 PM
GME,The 7 Most Important Companies That Didn’t Survive the 2010s,1/9/2020 4:30:37 PM
GME,"GameStop Announces Participation at 2020 ICR Conference on January 14, 2020",1/8/2020 12:55:00 PM
GME,7 Investing Resolutions to Follow in 2020,1/6/2020 5:18:24 PM
GME,Attention All Gamers: Get What You Really Wanted for the Holidays During GameStop’s Winter Sale,12/26/2019 12:00:10 PM
GME,GameStop Sprinkles Retail Joy and Savings with Annual Game Days Holiday Sale,12/12/2019 3:00:00 PM
GME,UPDATE 2-GameStop shares slump 20% as weak console demand prompts forecast cut,12/11/2019 12:48:34 AM
GME,"UPDATE 1-GameStop cuts full-year profit forecast, shares slump 21%",12/10/2019 10:47:25 PM
GME,GameStop Announces Cyber Monday Deals,12/2/2019 12:00:00 AM
GME,GameStop Announces Third Quarter Fiscal 2019 Earnings Release Date,11/25/2019 10:30:10 PM
GME,GameStop Announces 2019 Black Friday Deals,11/22/2019 12:00:00 PM
GME,GameStop Celebrates Veterans Day by Introducing New Military Discount Program,11/11/2019 3:00:00 PM
GME,GameStop Kicks-Off the Holiday Shopping Season With Last PRO Day Sale of the Year,11/8/2019 2:00:00 PM
GME,GameStop Reveals Its 2019 Thanksgiving Day and Black Friday Store Hours,11/5/2019 7:00:00 PM
GME,Sentiment and a Reinvigorated Sector Make ATVI Stock a Smart Buy,11/4/2019 1:40:43 PM
GME,5 Cheap Stocks Welcoming Insider Buying,11/1/2019 3:08:00 PM
GME,GameStop and Activision Team Up to Celebrate the Launch of Call of Duty®: Modern Warfare®,10/23/2019 4:19:30 PM
GME,8 Penny Stocks That Have Fallen From Grace,10/21/2019 12:31:38 PM
GME,"At This Point, Going Retail Would Be a Tailwind for Activision Stock",10/18/2019 1:55:59 PM
GME,4 Turnaround Plays to Buy Now,10/17/2019 6:00:21 PM
GME,10 Hot Stocks Staging Huge Reversals,10/14/2019 6:11:51 PM
GME,"4 Top Stock Trades for Wednesday: CHK, TGT, GME, DPZ",10/8/2019 7:45:49 PM
GME,GameStop and Extra Life Kick-Off In-Store Donation Campaign Benefiting Children’s Miracle Network Hospitals®,10/7/2019 1:00:00 PM
GME,7 Stocks the Insiders Are Buying on Sale,10/1/2019 6:13:23 PM
GME,7 Beaten-Up Value Stocks on the Rebound,9/27/2019 3:58:36 PM
GME,7 Stocks to Buy Under $10,9/23/2019 3:27:55 PM
GME,GameStop Celebrates 72-Hour PRO DAY Sale with Hot Deals,9/19/2019 3:00:00 PM
GME,"The world's biggest video game retailer, GameStop, has a major problem: It has way too many stores (GME)",9/16/2019 11:03:04 PM
GME,Up to 200 GameStop Stores Closing in 2019,9/12/2019 4:57:55 PM
GME,"The world's biggest video game retailer, GameStop, is closing hundreds of stores as it attempts to stay afloat — and that's just the first wave of closures (GME)",9/11/2019 10:45:03 PM
GME,UPDATE 1-GameStop results disappoint as console loses to online games,9/10/2019 10:52:44 PM
GME,It’s Still Too Risky to Bet on Rite Aid Stock,9/9/2019 6:51:12 PM
GME,Here's what to expect from Gamestop A's earnings report,9/8/2019 3:01:18 PM
GME,"Surprisingly, There Is a Bull Case for Gamestop Stock Ahead of Earnings",9/6/2019 7:23:26 PM
GME,GameStop Kicks-Off the Holiday Season with No Fee Layaway Program,9/4/2019 3:00:00 PM
GME,The Big Short’s Michael Burry Is Going Long GameStop Stock: Should You?,9/3/2019 1:48:18 PM
GME,The Selling Has Stopped In Gamestop Stock: Time To Be A Player Again,8/30/2019 1:59:07 PM
GME,UPDATE - GameStop Invites Customers to Explore New Redesigned Website,8/29/2019 5:03:47 PM
GME,GameStop Kicks Off Wish Power Donation Campaign to Benefit Make-A-Wish® with Live Wish Reveal,8/28/2019 10:01:13 PM
GME,GameStop Announces Second Quarter Fiscal 2019 Earnings Release Date,8/27/2019 10:06:00 PM
GME,GameStop soars after 'Big Short' investor Michael Burry says it still has big upside (GME),8/22/2019 6:00:09 PM
GME,"GameStop, the world’s largest video game retailer, laid off over 120 more people in the latest sign that it’s struggling to adapt to a changing market (GME)",8/21/2019 7:24:05 PM
GME,10 Heavily Shorted Stocks to Sell — Because the Bears Are Right,7/25/2019 6:40:19 PM
GME,Fortnite Isn’t the Only Thing Killing EA Stock,7/22/2019 10:01:30 AM
GME,Amazon Prime Day’s Secret Weapon,7/17/2019 3:50:03 PM
GME,GameStop Announces Final Results of its Modified Dutch Auction Tender Offer,7/15/2019 10:59:24 PM
GME,GameStop Announces Preliminary Results of its Modified Dutch Auction Tender Offer,7/11/2019 2:00:00 PM
GME,"Move Over Summer, Christmas Arrives Early with Hot Deals and Deep Discounts at GameStop’s Two-Week Summer Sale ",7/3/2019 3:00:00 PM
GME,GameStop Reports Inducement Awards Under NYSE Rule 303A.08,7/1/2019 10:06:00 PM
GME,GameStop’s Esports Roster Continues to Grow with Addition of Professional Fighting Game Legend Justin Wong,6/26/2019 3:00:00 PM
GME,Post E3: GameStop Reveals Top 10 Video Games Based on Customer Demand,6/19/2019 6:30:00 PM
GME,CSFB Commercial Mortgage Trust 2005-C4 -- Moody's affirms one class of CSFB 2005-C4,6/18/2019 12:41:00 AM
GME,GameStop Announces Intention to Launch a Modified Dutch Auction Tender Offer,6/10/2019 2:00:00 PM
GME,GameStop and Children’s Miracle Network Hospitals® Unite with Human Claw Machine Experience at E3 2019,6/6/2019 4:00:00 PM
GME,"5 Top Stock Trades for Thursday: SHOP, MU, KO, AEO",6/5/2019 8:06:55 PM
GME,"GameStop revenue misses estimates as Xbox, PlayStation sales fall",6/4/2019 10:35:42 PM
GME,Here's what Wall Street expects from Gamestop A's earnings,6/2/2019 3:01:18 PM
GME,GameStop Announces New Leadership Appointments and Enhanced Leadership Structure,5/30/2019 10:05:00 PM
GME,GameStop Corp. -- Moody's announces completion of a periodic review of ratings of GameStop Corp.,5/29/2019 9:25:00 PM
GME,GameStop Announces First Quarter Fiscal 2019 Earnings Release Date,5/22/2019 10:06:00 PM
GME,April Showers Have Bloomed GameStop's Biggest May PRO DAY Sale,5/17/2019 3:00:00 PM
GME,"GameStop Corp. -- Moody's downgrades GameStop to Ba2, outlook negative",5/16/2019 11:11:00 PM
GME,GameStop Appoints Raul Fernandez and Lizabeth Dunn to Board of Directors,4/24/2019 2:39:46 PM
GME,GameStop Reports Inducement Awards Under NYSE Rule 303A.08,4/16/2019 12:24:20 AM
GME,See Your Savings Blossom During GameStop’s Two-Week Spring Sale Event,4/5/2019 3:11:17 PM
GME,"10 things you need to know before the opening bell (SPY, SPX, QQQ, DIA, BA, APRN, GME)",4/3/2019 12:57:06 PM
GME,GameStop Corp. Q4 adjusted earnings Beat Estimates,4/2/2019 10:20:04 PM
GME,GameStop Announces Agreement with Hestia Capital and Permit Enterprise Capital Partners,4/1/2019 3:00:00 PM
GME,Here's what to expect from Gamestop A's earnings,3/31/2019 3:01:19 PM
GME,GameStop Comments on Director Nominations,3/29/2019 2:05:00 PM
GME,GameStop Earns Top Marks in 2019 Corporate Equality Index; Yielding a Perfect Scorecard on The Annual LGBTQ Workplace Survey,3/28/2019 5:30:00 PM
GME,"GameStop Makes a Play with Multiple Esports Partners, Supporting Amateur Players Nationwide",3/27/2019 2:00:00 PM
GME,GameStop Appoints George Sherman As CEO ,3/21/2019 10:08:37 PM
GME,"Permit Enterprise, Hestia Request GameStop Board To Appoint New Board Members ",3/14/2019 11:28:39 AM
GME,"GameStop Declares Quarterly Cash Dividend, Announces Intent to Retire 2019 Notes and Approves New $300 Million Share Repurchase Authorization",3/4/2019 10:06:00 PM
GME,Cha-Ching: GameStop Offers Savings Relief with Hot Deals,2/21/2019 3:00:00 PM
GME,"10 things you need to know before the opening bell (SPY, SPX, QQQ, DIA, AAPL, AMD, GME)",1/30/2019 1:00:05 PM
GME,GameStop crashes to 14-year low after board terminates plans to sell the company (GME),1/29/2019 6:21:05 PM
GME,"GameStop drops sharply — then recovers — after report says Apple is exploring a 'Netflix for games' (GME, AAPL)",1/28/2019 5:21:06 PM
GME,GameStop Holiday Period Comps. Up 1.5%; Reiterates Annual Earnings Guidance ,1/18/2019 2:19:30 PM
GME,GameStop Completes Sale of Spring Mobile Division,1/16/2019 10:05:00 PM
GME,GameStop Offers Last-Minute Shoppers Big Savings during Game Days,12/12/2018 3:30:00 PM
GME,"UPDATE 1-GameStop cuts full-year profit forecast, shares fall 11 pct",11/30/2018 12:22:29 AM
GME,"GameStop cuts full-year adjusted profit forecast, shares fall",11/29/2018 11:16:30 PM
GME,"GameStop and Autism Speaks award up to $250,000 in NXT GEN Coders Program Grants to increase employment readiness of people with autism",11/28/2018 2:30:00 PM
GME,Here's what Wall Street expects from Gamestop A's earnings report,11/27/2018 3:01:25 PM
GME,GameStop Announces Cyber Monday Deals,11/26/2018 2:30:00 PM
GME,GameStop surges after announcing it's selling its AT&T Wireless stores for $700 million (GME),11/21/2018 7:48:03 PM
GME, GameStop Announces Third Quarter Fiscal 2018 Earnings Release Date,11/20/2018 10:06:00 PM
GME,CORRECTING and REPLACING – GameStop Reveals Its Official 2018 Black Friday Deals,11/19/2018 3:26:42 PM
GME,Beat the Black Friday Madness with These Amazing Early Black Friday Deals From GameStop,11/13/2018 3:30:00 PM
GME,Beat the Black Friday Rush with Unbeatable PRO DAYS Deals at GameStop this Weekend,11/7/2018 3:00:00 PM
GME,GameStop Releases Its 2018 Holiday Gift Guide; Oh What Fun It Is…,11/1/2018 3:00:00 PM
GME,GameStop Celebrates The Halloween Season With Exclusive Product Line of DC Super-Villains,10/18/2018 4:09:42 PM
GME,Nintendo Switch Bundle and Nintendo Switch Pro Controller with Diablo III: Eternal Collection – Available Exclusively at GameStop,10/15/2018 4:01:53 PM
GME,"GameStop Plans To Hire More Than 15,000 Associates This Holiday ",10/11/2018 5:10:00 PM
GME,"GameStop Gives, Call of Duty™ Endowment Unite to Place Veterans in Jobs",10/4/2018 4:10:21 PM
GME,"The Weather is Cooling Down, but PRO DAY Deals Are Hotter than Ever",9/14/2018 4:16:25 PM
GME,GameStop unites the gaming community on National Video Games Day to raise $100K for Children’s Charities,9/11/2018 6:58:29 PM
GME,GameStop slides after missing on earnings and saying it's still looking into a sale (GME),9/7/2018 2:54:04 PM
GME,"UPDATE 1-GameStop misses profit estimate, shares fall",9/6/2018 10:46:23 PM
GME,GameStop Launches 2018 Layaway Program Earlier Than Ever Before,8/30/2018 4:00:00 PM
GME,"Make-A-Wish®, Children’s Miracle Network Hospitals®, GameStop® Partners to Help Local Kids",8/29/2018 4:40:38 PM
GME,GameStop Announces Second Quarter Fiscal 2018 Earnings Release Date,8/22/2018 10:06:00 PM
GME,GameStop Appoints Carrie Teffner to Board of Directors,8/16/2018 10:06:00 PM
GME,GameStop could be the next hot stock — if it ditches video games (GME),7/9/2018 3:12:03 PM
GME,Summer Fun Has Just Begun at GameStop with Unbeatable Game Days DealsGamers Can Take Advantage of Awesome Prices and Special Offers on the Latest Gaming Gear during Two-Week Sale,6/29/2018 7:21:23 PM
GME,GameStop Announces New Vice President of ThinkGeek,6/20/2018 3:30:00 PM
GME,UPDATE 1-GameStop says in talks for possible transaction,6/19/2018 2:26:57 PM
GME,GameStop surges after a report says it could be taken private (GME),6/18/2018 9:42:03 PM
GME,"GameStop Announces Participation at Oppenheimer’s 18th Annual Consumer Conference on June 19, 2018",6/15/2018 10:06:00 PM
GME,"GameStop Announces Participation at Baird’s Global Consumer, Technology & Services Conference on June 5, 2018",6/1/2018 1:00:00 PM
GME,"REFILE-UPDATE 1-GameStop same-store sales miss estimates, shares fall",5/31/2018 10:44:30 PM
GME,GameStop and Extra Life Host First-Ever Charity Event at E3 Benefiting Children’s Miracle Network Hospitals®GameStop and Children’s Miracle Network Hospitals® announce new partnership,5/30/2018 5:12:29 PM
GME,ABIOMED Set to Join S&P 500; Others to Join S&P MidCap 400 and S&P SmallCap 600,5/25/2018 11:55:00 PM
GME,CSFB Commercial Mortgage Trust 2005-C4 -- Moody's Affirms One Class of CSFB 2005-C4,5/24/2018 7:38:00 PM
GME,GameStop Announces First Quarter Fiscal 2018 Earnings Release Date,5/22/2018 10:15:00 PM
GME,"Gear Up for an Epic Summer of Gaming with Unbeatable PRO DAY DealsGameStop Reveals PRO DAY Offers—More than $2,200 in Savings",5/18/2018 2:00:00 PM
GME,Hedge fund asks GameStop to conduct strategic review - CNBC,5/16/2018 2:29:01 PM
GME,GameStop Appoints Daniel DeMatteo As Interim CEO ,5/11/2018 3:19:28 PM
GME,GameStop and Autism Speaks® Launch NXT Gen Coders Program Aimed at Increasing Employment Opportunities for People With AutismGameStop raising funds for NXT Gen Coders Program through its third...,4/30/2018 6:41:32 PM
GME,GameStop Climbs Off Worst Levels But Remains Firmly Negative ,3/29/2018 7:09:46 PM
GME,GameStop Q4 Results Top Wall Street Estimates ,3/28/2018 10:25:31 PM
GME,"Spring Has Sprung at GameStop with Unbeatable PLAY DAYS DealsTwo-Week Sale Event Gives Gamers the Chance to Come Outside and Save, then Stay Inside and Play",3/16/2018 10:10:42 PM
GME,"Game Informer magazine celebrates 300th issueWorld’s leading video game publication has evolved over 27 years, along with its readers",3/7/2018 2:00:00 PM
GME,"A Statement from Mike Mauler, GameStop CEOEntire GameStop family mourns the loss of former CEO J. Paul Raines",3/5/2018 7:00:00 PM
GME,Get the Biggest Bang for Uncle Sam’s Buck at GameStopTax Season Kicks Off with Unbeatable PRO DAY Offers—and the Deals Keep Coming during Two-Week Refund Sale Event  ,2/23/2018 2:00:00 PM
GME,GameStop Declares Quarterly Cash DividendAnnounces Fourth Quarter and Full Fiscal Year 2017 Earnings Release Date,2/21/2018 10:05:00 PM
GME,"GameStop Appoints Michael Mauler CEO, Effective Immediately ",2/7/2018 5:19:20 AM
GME,GameStop Names Michael K. Mauler as its New Chief Executive Officer,2/6/2018 10:05:00 PM
GME,Bear Stearns Commercial Mortgage Securities Trust 2005-TOP18 -- Moody's Affirms Six Classes of BSCMS 2005-TOP18,1/19/2018 3:57:00 PM
GME,GameStop 9-week Comps. Up 11.8%; Issues Guidance Update - Quick Facts ,1/12/2018 2:16:34 PM
GME,The Holiday Deals Keep Rolling Out From GameStopGameStop giving up to $500 cash trade-in value on the Apple iPhone 8,12/26/2017 3:00:00 PM
GME,Last-Minute Shoppers Have No Fear – GAME DAYS Are HereGameStop Offers Unbeatable Deals on Must-Have Gamer Gear,12/16/2017 3:00:00 PM
GME,25 Gifts Under $25 and Stocking Stuffers Galore at GameStopA last-minute shoppers guide to affordable gifts for everyone on your list,12/7/2017 7:05:43 PM
GME,"GameStop’s Deals Go Digital for Cyber MondayRetailer Offers Santa-Sized Savings on Games, Consoles and Collectibles with FREE Shipping",11/27/2017 1:00:00 PM
GME,GameStop Posting Significant Gain In Afternoon Trading ,11/22/2017 7:00:04 PM
GME,GameStop spikes after the Nintendo Switch boosts sales (GME),11/21/2017 10:51:03 PM
GME,"GameStop Confirms Its Unbeatable Black Friday DealsRetailer Offers Holiday Shoppers the Lowest Prices Available on Consoles, Games, Toys and Collectibles",11/20/2017 2:00:00 PM
GME,Pokémon Center: Arriving at GameStop and ThinkGeek Stores NationwideRetailer Brings Fans the Most Authentic Pokémon Gear for the FIRST Time Outside of Japan,11/17/2017 2:00:00 PM
GME,BRIEF-GameStop appoints Daniel Dematteo as interim CEO (GME),11/14/2017 3:32:03 PM
GME,"Why Wait Until Black Friday? Shop Unbeatable Deals at GameStop This WeekendPRO DAYS offer more than $2,300 in pre-Black Friday savings",11/9/2017 2:00:00 PM
GME,GameStop Director Jerome L. Davis Recognized by Savoy Magazine as One of 2017’s ‘Most Influential Corporate Directors’,11/6/2017 4:00:00 PM
GME,GameStop’s Guide for Gifters: 5 Tips for Picking the Best Video Games for Every AgeGaming Retailer Helps Shoppers Take the Guesswork out of Holiday Game-Giving,11/2/2017 7:06:03 PM
GME,GameStop Salutes Military Heroes,11/1/2017 6:14:48 PM
GME,"GS Mortgage Securities Corporation II, Commercial Mortgage Pass-Through Certificates, Series 2006-GG8 -- Moody's Downgrades Two And Affirms Four Classes of GSMS 2006-GG8",10/27/2017 8:22:00 PM
GME,Round Two Xbox One X Pre-Orders Kick Off at GameStopGameStop Offers Unbeatable Trade-In Values and Layaway Options,9/19/2017 9:07:03 PM
GME,"Spring Mobile and Simply Mac Now Taking Pre-Orders for the New Apple iPhonesOnly at Spring Mobile can customers receive up to $100 worth of free accessories with every iPhone 8, iPhone 8 Plus, or...",9/13/2017 3:45:00 PM
GME,"GameStop Helps Customers Fund the Purchase of the New Apple iPhonesGameStop offers up to $400 cash trade-in value on current generation smartphones, helping consumers purchase the newly announced...",9/12/2017 8:45:00 PM
GME,"The Road to Hell is Paved with Good Intentions - So is AB 485, Comments National Animal Interest Alliance",9/5/2017 3:00:00 PM
GME,GameStop Remains Firmly Negative After Early Sell-Off ,8/25/2017 7:32:47 PM
GME,BRIEF-GameStop Corp reports qtrly earnings per share of $0.22 (GME),8/24/2017 10:52:08 PM
GME,"Stocks Under Scanner in the Services Space -- Best Buy, GameStop, Arrow Electronics, and Avnet",8/10/2017 12:50:00 PM
GME,"InvestorsObserver releases covered-call reports for Advanced Micro Devices, Facebook, Gamestop Corporation, Marvell Technology and Snap Inc.",5/30/2017 3:31:00 PM
GME,"US STOCKS-Wall St drifts before long weekend, but consumer stocks up (COST, ULTA, GME)",5/26/2017 10:50:05 PM
GME,GameStop posts first sales increase in five quarters (GME),5/25/2017 10:36:03 PM
GME,Pariveda Migrates GameStop Retail Data Center to AWS,5/3/2017 11:00:00 AM
GME,BRIEF-GameStop CEO J. Paul Raines' total compensation for 2016 was $7.8 mln (GME),4/28/2017 11:01:10 PM
GME,"BRIEF-Gamestop announces new supply of Nintendo switch systems (GME, 7974)",4/26/2017 4:05:10 PM
GME,Gamestop Looking Into Possible Data Breach ,4/10/2017 6:17:18 PM
GME,BRIEF-Gamestop.com investigating possible data breach on its website- KrebsonSecurity (GME),4/7/2017 9:18:52 PM
GME,GameStop Shutters 150 Stores As Retail Carnage Continues ,3/27/2017 5:51:46 PM
