Ticker,Title,Link
GMED,"AKAO Slumps On FDA Panel Vote, ESPR Awaits Data In May, STAA Shines ",5/3/2018 7:07:13 AM
GMED,Globus Medical Reports First Quarter 2018 Results,5/2/2018 10:15:00 PM
GMED,Globus Medical Schedules First Quarter 2018 Earnings Release and Conference Call,4/17/2018 10:24:50 PM
GMED,Globus Medical Announces Launch of ELSA® Expandable Lateral Spacer System,4/5/2018 10:15:00 PM
GMED,Globus Medical Enters Trauma MarketTo Showcase Portfolio of Orthopedic Trauma Products at AAOS,3/6/2018 10:15:00 PM
GMED,"ACIP Backs HEPLISAV-B, GMED Hits New High, GWPH's Focal Seizures Trial Fails ",2/22/2018 6:55:22 AM
GMED,Globus Medical Reports Full Year and Fourth Quarter 2017 Results,2/21/2018 10:15:00 PM
GMED,Globus Medical Schedules Fourth Quarter and Full Year 2017 Earnings Release and Conference Call,2/9/2018 2:30:00 PM
GMED,Globus Medical Reports Preliminary Fourth Quarter and Full Year Sales Results,1/9/2018 2:30:00 PM
GMED,"BGNE Well Stocked, APVO On A Roll, GMED Hits ALL-time High ",12/5/2017 2:47:02 AM
GMED,Globus Medical Announces Clinical Results Showing Superiority of its SECURE-C® to ACDF at Seven YearsSECURE-C® long-term data confirms earlier clinical outcomes and maintains superiority,12/1/2017 1:30:35 AM
GMED,Globus Medical to Participate in the Piper Jaffray 29th Annual Healthcare Conference,11/20/2017 10:15:00 PM
GMED,Globus Medical Reports Third Quarter 2017 Results,11/8/2017 10:30:00 PM
GMED,Globus Medical Schedules Third Quarter 2017 Earnings Release and Conference Call,10/17/2017 10:30:00 PM
GMED,Globus Medical Announces First Spine Surgeries Using ExcelsiusGPS™ExcelsiusGPS™ – Robotic Trajectory Guidance and Navigation for Surgery,10/10/2017 10:30:00 PM
GMED,Globus Medical Announces First Case in Orthopedic TraumaANTHEM™ – Distal Radius Fracture System,9/14/2017 10:15:00 PM
GMED,"Stocks Under Scanner in the Medical Equipment Space -- Globus Medical, Invacare, ResMed, and Zimmer Biomet",9/6/2017 12:50:00 PM
GMED,Eagle Creek Renewable Energy Acquires Hydro Facilities in Maine from Madison Paper Industries,8/8/2017 1:30:00 PM
GMED,"Medical Equipment Stock Performance Review -- Align Technology, Invacare, Globus Medical, and ResMed",8/3/2017 12:15:00 PM
GMED,"Technical Reports on Medical Equipment Equities -- Hologic, Wright Medical, Globus Medical, and Edwards Lifesciences",6/19/2017 12:25:00 PM
GMED,"How These Medical Equipment Stocks are Faring? -- Zimmer Biomet, ZELTIQ Aesthetics, Stryker, and Globus Medical",3/29/2017 1:00:00 PM
