Ticker,Title,Link
GMED,Globus Medical Launches ADIRA™ XLIF™ Plate System,8/21/2024 10:15:00 PM
GMED,Small-cap and mid-cap Health Care has room to rally - Roth MKM,8/19/2024 7:07:33 PM
GMED,"Analysts Offer Insights on Healthcare Companies: Globus Medical (GMED), Avidity Biosciences (RNA) and Veeva Systems (VEEV)",8/16/2024 10:19:25 AM
GMED,"Buy Rating Upheld for Globus Medical Amid Overreaction to FDA Warning, Growth Potential Strong in Robotics Segment",8/14/2024 12:35:25 PM
GMED,Globus Medical slips after FDA warning,8/13/2024 3:24:13 PM
GMED,"J&J, Stryker among potential suitors for Nevro: Wolfe",8/8/2024 6:46:23 PM
GMED,Roth MKM Remains a Buy on Globus Medical (GMED),8/7/2024 12:38:51 PM
GMED,Globus Medical Reports Second Quarter 2024 Results,8/6/2024 10:15:00 PM
GMED,Globus Medical Q2 2024 Earnings Preview,8/5/2024 9:35:37 PM
GMED,Quest Diagnostics' Haystack Oncology Forges New MRD Deal,7/24/2024 6:16:21 PM
GMED,Intuitive Surgical Gains 26% Year to Date: Here's Why,7/18/2024 9:34:30 PM
GMED,Globus Medical gets FDA approval for two knee replacement products,7/17/2024 6:52:43 PM
GMED,Globus Medical Schedules Second Quarter Earnings Release and Conference Call,7/16/2024 10:30:00 PM
GMED,Where Globus Medical Stands With Analysts,7/15/2024 9:01:14 PM
GMED,"Piper downgrades Zimmer to neutral, cites lack of catalysts",7/1/2024 4:35:40 PM
GMED,Buy Rating Affirmed: Globus Medical’s Strategic Entry into Joint Reconstruction Robotics and Growth Potential,6/27/2024 1:29:33 AM
GMED,Globus Medical: Hold Rating Amid Modest Short-Term Impact from ExcelsiusFlex Approval,6/26/2024 12:26:36 AM
GMED,Globus Medical (GMED) Gets a Buy from RBC Capital,6/25/2024 1:46:42 AM
GMED,"Analysts Offer Insights on Healthcare Companies: Qiagen (QGEN), Globus Medical (GMED) and Merck & Company (MRK)",6/18/2024 10:10:17 AM
GMED,"Analysts’ Opinions Are Mixed on These Healthcare Stocks: Alcon (ALC), Aerovate Therapeutics (AVTE) and Globus Medical (GMED)",6/17/2024 11:50:38 PM
GMED,"Soft Inflation Data Boosts Small Caps, Real Estate, Regional Banks; Traders Anticipate Fed Rate Cuts As Stocks React",6/12/2024 4:09:19 PM
GMED,"Analysts’ Opinions Are Mixed on These Healthcare Stocks: Veeva Systems (VEEV), Globus Medical (GMED) and Alnylam Pharma (ALNY)",6/10/2024 12:30:24 PM
GMED,Deep Dive Into Globus Medical Stock: Analyst Perspectives (7 Ratings),5/29/2024 8:01:18 PM
GMED,This Micron Technology Analyst Is No Longer Bearish; Here Are Top 5 Upgrades For Today,5/20/2024 8:50:38 PM
GMED,"Analysts Offer Insights on Healthcare Companies: Teva Pharmaceutical (TEVA), Globus Medical (GMED) and DENTSPLY SIRONA (XRAY)",5/13/2024 10:51:15 AM
GMED,Key Takeaways From Globus Medical Analyst Ratings,5/9/2024 8:01:20 PM
GMED,Globus Medical Up 23% As Q1 Results Beat Street; Raises FY Outlook ,5/8/2024 4:33:32 PM
GMED,Globus Medical Reports First Quarter 2024 Results,5/7/2024 10:15:00 PM
GMED,Globus Medical Q1 2024 Earnings Preview,5/6/2024 9:35:44 PM
GMED,"Analysts Offer Insights on Healthcare Companies: Gilead Sciences (GILD), Globus Medical (GMED) and Merck & Company (MRK)",4/26/2024 10:30:52 AM
GMED,RBC Capital Sticks to Its Buy Rating for Globus Medical (GMED),4/17/2024 8:00:20 AM
GMED,Globus Medical Schedules First Quarter Earnings Release and Conference Call,4/16/2024 10:30:00 PM
GMED,"Don't expect pandemic backlog to fuel orthopedic sales, says Needham",3/31/2024 11:46:03 PM
GMED,From Six Figures to Seven: 3 Robotics Stocks Set to Make Millionaires,3/24/2024 7:50:51 PM
GMED,The Latest Analyst Ratings For Globus Medical,3/18/2024 4:01:12 PM
GMED,7 Robotic Surgery Stocks to Buy for the Future of Healthcare,3/13/2024 8:30:00 PM
GMED,"Needham sees orthopedics market slowing; favors Enovis, Paragon 28",2/25/2024 11:50:34 PM
GMED,"Analysts Offer Insights on Healthcare Companies: Globus Medical (GMED), Cochlear Limited (OtherCHEOF) and Nurix Therapeutics (NRIX)",2/23/2024 1:50:06 AM
GMED,Barclays Remains a Buy on Globus Medical (GMED),2/22/2024 10:06:52 AM
GMED,Analysts Conflicted on These Healthcare Names: Globus Medical (GMED) and Crispr Therapeutics AG (CRSP),2/21/2024 3:30:31 PM
GMED,Globus Medical Reports Fourth Quarter and Full Year 2023 Results,2/20/2024 10:15:00 PM
GMED,Notable earnings after Tuesday's close,2/19/2024 10:35:09 PM
GMED,Stifel Nicolaus Sticks to Their Buy Rating for Globus Medical (GMED),2/16/2024 1:07:03 PM
GMED,Globus Medical Schedules Fourth Quarter and Full Year 2023 Earnings Release and Conference Call,2/13/2024 11:17:08 PM
GMED,Globus Medical Promotes Keith Pfeil to COO and CFO,2/6/2024 10:02:17 AM
GMED,Globus Medical promotes Keith Pfeil to Chief Operating Officer and Chief Financial Officer,2/5/2024 10:30:00 PM
GMED,Anti-obesity meds can expand the market for weight loss surgery: Bernstein,1/21/2024 5:00:01 PM
GMED,7 Healthcare Stocks Taking Medicine to the Next Level,1/14/2024 5:54:56 PM
GMED,The Analyst Verdict: Globus Medical In The Eyes Of 6 Experts,1/11/2024 7:00:58 PM
GMED,Globus Medical Reports Preliminary Record Fourth Quarter and Full Year Sales Results,1/10/2024 10:30:00 PM
GMED,Globus Medical (GMED) Gets a Buy from Barclays,1/4/2024 1:15:07 AM
GMED,BTIG Reaffirms Their Hold Rating on Globus Medical (GMED),1/2/2024 2:24:38 PM
GMED,"Analysts Are Bullish on These Healthcare Stocks: Globus Medical (GMED), DocGo (DCGO)",12/28/2023 12:40:58 PM
GMED,Assessing Globus Medical: Insights From 5 Financial Analysts,12/20/2023 3:00:46 PM
GMED,Wells Fargo Sticks to Its Hold Rating for Globus Medical (GMED),12/13/2023 12:58:22 PM
GMED,3 Stocks at the Forefront of Medical Robotics,12/10/2023 7:31:09 PM
GMED,RBC Capital Reaffirms Their Buy Rating on Globus Medical (GMED),11/24/2023 12:05:26 PM
GMED,Analysts Offer Insights on Healthcare Companies: Globus Medical (GMED) and LAVA Therapeutics (LVTX),11/22/2023 5:31:18 AM
GMED,"Hold Rating on Globus Medical: Post-Merger Challenges, Sales Force Integration, and Future Growth Prospects",11/9/2023 5:10:29 PM
GMED,Expert Ratings for Globus Medical,11/8/2023 7:00:41 PM
GMED,Globus Medical Reports Third Quarter 2023 Results,11/7/2023 10:15:00 PM
GMED,Globus Medical A earnings: here's what Wall Street expects,11/6/2023 3:01:14 PM
GMED,"Analysts Offer Insights on Healthcare Companies: Globus Medical (GMED), HCA Healthcare (HCA) and Danaher (DHR)",10/25/2023 10:40:47 AM
GMED,Globus Medical Schedules Third Quarter Earnings Release and Conference Call,10/24/2023 10:30:00 PM
GMED,"Benzinga's Top Ratings Upgrades, Downgrades For October 20, 2023",10/20/2023 5:00:53 PM
GMED,Twenty Years of the NuVasive XLIF Procedure Celebrated at the Society for Minimally Invasive Spine Surgery 2023 Annual Forum,10/10/2023 1:00:00 PM
GMED,Globus Medical and NuVasive to Sponsor and Participate at EUROSPINE 2023,9/27/2023 1:00:00 PM
GMED,Globus Medical's Untapped Potential Beyond The NUVA Transaction; Analyst Turns Bullish,9/19/2023 8:16:32 PM
GMED,"Analysts Offer Insights on Healthcare Companies: PTC Therapeutics (PTCT), Align Tech (ALGN) and Globus Medical (GMED)",9/18/2023 10:50:40 AM
GMED,NuVasive Specialized Orthopedics Launches Precice Bone Transport in International Markets,9/7/2023 1:00:00 PM
GMED,The Latest Analyst Ratings for Globus Medical,9/5/2023 8:00:40 PM
GMED,Globus Medical Completes Merger with NuVasive,9/1/2023 2:33:33 PM
GMED,NuVasive/Globus Medical spread widens amid notice of FTC meeting (update),8/30/2023 8:46:25 PM
GMED,"Jackson Financial, Goosehead Insurance to join S&P SmallCap 600",8/29/2023 12:37:32 AM
GMED,Goosehead Insurance and Jackson Financial Set to Join S&P SmallCap 600,8/28/2023 11:41:00 PM
GMED,NuVasive/Globus deal spread narrows amid report on optimism for regulatory approval,8/18/2023 8:47:19 PM
GMED,Barclays Sticks to Their Buy Rating for Globus Medical (GMED),8/7/2023 9:16:22 AM
GMED,RBC Capital Sticks to Their Buy Rating for Globus Medical (GMED),8/5/2023 1:46:20 AM
GMED,Where Globus Medical Stands With Analysts,8/4/2023 9:00:54 PM
GMED,"Globus Medical Non-GAAP EPS of $0.63 beats by $0.04, revenue of $291.62M beats by $11.84M",8/3/2023 8:45:15 PM
GMED,Here's what Wall Street expects from Globus Medical A's earnings report,8/2/2023 3:01:13 PM
GMED,Nuvasive/Globus Medical deal spread widens amid report FTC considering lawsuit,7/20/2023 7:34:31 PM
GMED,Globus Medical (GMED) Receives a Hold from Truist Financial,7/17/2023 2:25:24 AM
GMED,RBC Capital Reaffirms Their Buy Rating on Globus Medical (GMED),7/15/2023 1:46:58 AM
GMED,BTIG Sticks to Its Hold Rating for Globus Medical (GMED),6/20/2023 9:25:05 AM
GMED,Expert Ratings for Globus Medical,5/31/2023 3:02:33 PM
GMED,Analysts Have Conflicting Sentiments on These Healthcare Companies: Globus Medical (GMED) and Oncolytics Biotech (ONCY),5/23/2023 8:20:08 PM
GMED,Globus Medical wins FDA approval of scoliosis correction system,5/15/2023 9:17:50 PM
GMED,Globus Medical (GMED) Receives a Buy from RBC Capital,5/6/2023 1:46:25 AM
GMED,Analyst Expectations for Globus Medical's Future,5/5/2023 6:00:54 PM
GMED,"Globus Medical Non-GAAP EPS of $0.53 beats by $0.02, revenue of $276.7M beats by $22.65M",5/4/2023 8:31:15 PM
GMED,Globus Medical Q1 2023 Earnings Preview,5/3/2023 9:35:36 PM
GMED,NuVasive merger with Globus Medical approved by shareholders,4/27/2023 9:06:24 PM
GMED,"Catalyst watch: Earnings blitz, Mobileye lockup expiration and the new one-day VIX debut",4/21/2023 7:00:36 PM
GMED,7 Stocks to Buy with Bulletproof Balance Sheets,4/17/2023 11:22:34 PM
GMED,"Leading Independent Proxy Advisory Firm ISS Recommends NuVasive Shareholders Vote ""FOR"" the Proposed Merger with Globus Medical",4/14/2023 8:21:00 PM
GMED,"SHAREHOLDER UPDATE: Halper Sadeh LLC Investigates TA, GMED, CBIO, AQUA",4/13/2023 10:33:00 PM
GMED,"Analysts Offer Insights on Healthcare Companies: Alkermes (ALKS), Globus Medical (GMED) and Prothena (PRTA)",4/4/2023 1:10:08 PM
GMED,"SHAREHOLDER INVESTIGATION: Halper Sadeh LLC Investigates GMED, PRVB, INFI",3/30/2023 5:55:00 PM
GMED,What 8 Analyst Ratings Have To Say About Globus Medical,3/28/2023 7:00:21 PM
GMED,Analysts Offer Insights on Healthcare Companies: Altimmune (ALT) and Globus Medical (GMED),3/21/2023 1:20:12 PM
GMED,"Analysts Offer Insights on Healthcare Companies: BioMarin Pharmaceutical (BMRN), Quest Diagnostics (DGX) and Globus Medical (GMED)",3/17/2023 9:20:23 AM
GMED,Top 5 Health Care Stocks That May Rocket Higher In Q1 2023,2/27/2023 12:52:03 PM
GMED,RBC Capital Reaffirms Their Buy Rating on Globus Medical (GMED),2/24/2023 1:45:20 AM
GMED,Analysts Offer Insights on Healthcare Companies: Globus Medical (GMED) and PTC Therapeutics (PTCT),2/22/2023 2:20:43 PM
GMED,"Globus Medical Non-GAAP EPS of $0.59 beats by $0.03, revenue of $274.5M misses by $1.9M, guidance below consensus",2/21/2023 9:25:41 PM
GMED,Globus Medical Q4 2022 Earnings Preview,2/20/2023 10:35:56 PM
GMED,Globus Medical (GMED) Receives a Buy from RBC Capital,2/14/2023 1:45:08 AM
GMED,"Benzinga's Top Ratings Upgrades, Downgrades For February 13, 2023",2/13/2023 4:00:36 PM
GMED,"SHAREHOLDER INVESTIGATION: Halper Sadeh LLC Investigates SUMO, NUVA, GMED",2/10/2023 5:17:00 PM
GMED,Analysts’ Opinions Are Mixed on These Healthcare Stocks: Globus Medical (GMED) and Mainz Biomed B.V. (MYNZ),2/9/2023 9:30:59 PM
GMED,Globus Medical (GMED) Receives a Buy from RBC Capital,1/13/2023 1:57:05 AM
GMED,7 Analysts Have This to Say About Globus Medical,1/6/2023 6:00:32 PM
GMED,What 5 Analyst Ratings Have To Say About Globus Medical,12/12/2022 7:03:00 PM
GMED,RBC Capital Remains a Buy on Globus Medical (GMED),11/11/2022 1:46:14 AM
GMED,Analysts Offer Insights on Healthcare Companies: Globus Medical (GMED) and Rezolute (RZLT),11/10/2022 5:50:36 AM
GMED,Needham Reaffirms Their Buy Rating on Globus Medical (GMED),11/9/2022 10:35:11 AM
GMED,Globus Medical Reports Third Quarter 2022 Results,11/8/2022 10:15:00 PM
GMED,Here's what to expect from Globus Medical A's earnings,11/7/2022 3:01:13 PM
GMED,Globus Medical Schedules Third Quarter Earnings Release and Conference Call,10/19/2022 10:30:00 PM
GMED,"Benzinga's Top Ratings Upgrades, Downgrades For October 18, 2022",10/18/2022 4:21:58 PM
GMED,"Benzinga's Top Ratings Upgrades, Downgrades For October 12, 2022",10/12/2022 4:02:53 PM
GMED,Expert Ratings for Globus Medical,10/11/2022 11:02:20 PM
GMED,Analyst Ratings for Globus Medical,8/5/2022 4:51:11 PM
GMED,Globus Medical Reports Second Quarter 2022 Results,8/4/2022 10:15:00 PM
GMED,Globus Medical Q2 2022 Earnings Preview,8/3/2022 9:35:50 PM
GMED,Globus Medical Schedules Second Quarter Earnings Release and Conference Call,7/18/2022 10:30:00 PM
GMED,What 5 Analyst Ratings Have To Say About Globus Medical,7/15/2022 11:44:21 PM
GMED,Globus Medical Announces First Surgeries Using Excelsius3D™,5/18/2022 10:30:00 PM
GMED,What 6 Analyst Ratings Have To Say About Globus Medical,5/11/2022 3:37:26 PM
GMED,Globus Medical Reports First Quarter 2022 Results,5/10/2022 10:15:00 PM
GMED,Notable earnings after Tuesday's close,5/9/2022 9:35:19 PM
GMED,56 Biggest Movers From Friday,4/25/2022 10:23:56 AM
GMED,35 Stocks Moving In Friday's Mid-Day Session,4/22/2022 6:25:04 PM
GMED,Globus Medical Schedules First Quarter Earnings Release and Conference Call,4/21/2022 10:17:00 PM
GMED,Where Globus Medical Stands With Analysts,3/28/2022 10:24:03 PM
GMED,Globus Medical Announces the Expansion of its Share Repurchase Program,3/4/2022 10:57:00 PM
GMED,Expert Ratings For Globus Medical,2/18/2022 5:05:10 PM
GMED,Globus Medical Reports Fourth Quarter and Full Year 2021 Results,2/17/2022 10:20:00 PM
GMED,Notable earnings after Thursday's close,2/16/2022 10:35:45 PM
GMED,"The Week Ahead In Biotech (Feb. 13-19): Agios FDA Meeting, Avenue Adcom, Earnings And More",2/13/2022 2:32:29 PM
GMED,Globus Medical Schedules Fourth Quarter and Full Year 2021 Earnings Release and Conference Call,1/27/2022 10:30:00 PM
GMED,UBS maintains buy for Globus Medical on survey indicating market share growth,1/26/2022 12:17:32 PM
GMED,"Benzinga's Top Ratings Upgrades, Downgrades For January 4, 2022",1/4/2022 4:14:14 PM
GMED,Why Did BofA Securities Give Globus Medical A Double Upgrade?,12/13/2021 5:09:18 PM
GMED,Globus Medical Reports Third Quarter 2021 Results,11/4/2021 9:15:00 PM
GMED,Here's what Wall Street expects from Globus Medical A's earnings,11/3/2021 3:01:13 PM
GMED,"The Week Ahead In Biotech (Oct. 31-Nov. 6): Earnings Pick Up Pace, Eton Awaits Seizure Drug Approval, Kidney Conference, More IPOs In The Pipeline",10/31/2021 7:23:54 PM
GMED,Globus Medical Premieres ANTHEM® Mini Fragment Fracture System at Orthopaedic Trauma Association Meeting,10/19/2021 10:30:00 PM
GMED,Globus Medical Schedules Third Quarter Earnings Release and Conference Call,10/14/2021 11:01:21 PM
GMED,Globus Medical Files Suit Against Life Spine for IP Infringement,10/13/2021 10:30:00 PM
GMED,Globus Medical to Participate in North American Spine Society Annual Meeting,9/28/2021 4:11:14 PM
GMED,Globus Medical Announces First ExcelsiusGPS® Cranial Surgery,9/27/2021 10:30:00 PM
GMED,"The Daily Biotech Pulse: Cellect Jumps On First Apograft Transplantation, AstraZeneca, European Commission Bury Legal Hatchet, Cassava Defends Itself",9/3/2021 1:31:13 PM
GMED,Globus Medical Announces FDA 510(k) Clearance for Excelsius3D™,8/16/2021 10:30:00 PM
GMED,Globus Medical Reports Second Quarter 2021 Results,8/4/2021 10:15:00 PM
GMED,Notable earnings after Wednesday's close,8/3/2021 9:35:34 PM
GMED,Here's what to expect from Globus Medical A's earnings report,8/2/2021 3:02:05 PM
GMED,"The Daily Biotech Pulse: Erytech Jumps On Fast Track Designation, GlaxoSmithKline FDA Nod, Alnylam's Clinical Collaboration, 4 IPOs",7/30/2021 1:53:58 PM
GMED,"The Daily Biotech Pulse: Merck's Disappointing Q2, Atreca Falls On Data, FDA Nod For Viatris, Nuvalent, Icosavax IPOs",7/29/2021 2:18:48 PM
GMED,Globus Medical Schedules Second Quarter Earnings Release and Conference Call,7/16/2021 2:30:00 PM
GMED,"Globus Medical Announces Completion of 20,000 Procedures Utilizing ExcelsiusGPS®",7/15/2021 10:30:00 PM
GMED,"The Daily Biotech Pulse: Equillium Issues Positive Regulatory Update, Biogen In-Licenses Multiple Sclerosis Drug, Aridis Releases COVID-19 Antibody Cocktail Data",7/13/2021 2:05:06 PM
GMED,"The Daily Biotech Pulse: Priority Review For Amgen's Asthma Treatment, Evaxion Reports Positive Skin Cancer Readout, Quidel Recalls Lyra COVID-19 Test",7/8/2021 1:45:17 PM
GMED,"The Daily Biotech Pulse: Iterum's Regulatory Setback, Decision Day For Provention Bio, Cidara & Outset Medical Announce CFO Departures",7/2/2021 1:38:37 PM
GMED,"The Daily Biotech Pulse: Sanofi Bets Big On mRNA Tech, Decision Day For MediWound, DiaMedica Issues Kidney Disease Data Readout",6/29/2021 2:17:44 PM
GMED,"The Daily Biotech Pulse: Merck's Keytruda Snags Another FDA Approval, Moderna Slips On Revenue Miss, Chemocentryx Adcom",5/6/2021 1:49:39 PM
GMED,Globus Medical Reports First Quarter 2021 Results,5/4/2021 10:15:00 PM
GMED,Globus Medical Q1 2021 Earnings Preview,5/3/2021 9:35:38 PM
GMED,"Week Ahead In Biotech (May 2-8): ChemoCentryx Adcom, Ophthalmology Conference Presentations, Earnings Deluge",5/1/2021 7:19:25 PM
GMED,"The Daily Biotech Pulse: Quidel Slides On Negative Pre-Announcement, Roche Gets Positive EMA Committee Recommendation, 3 IPOs",4/23/2021 1:28:48 PM
GMED,"The Daily Biotech Pulse: KemPharm Receives $10M Milestone Payment, Zymergen, Neuropace Debut On Nasdaq, Renalytix Wins US Government Contract, 2 IPOs",4/22/2021 2:08:59 PM
GMED,Globus Medical Schedules First Quarter Earnings Release and Conference Call,4/21/2021 10:30:00 PM
GMED,"The Daily Biotech Pulse: Precision Biosciences Regains Rights To CAR T Candidates, CFO Changes, 2 IPOs",4/16/2021 2:00:59 PM
GMED,Globus Medical Announces First Surgeries with Revolutionary CREO ONE™ Robotic Screw,4/15/2021 10:30:00 PM
GMED,"The Daily Biotech Pulse: Lily-Rigel Licensing Deal, vTv Starts Early Stage Psoriasis Study, Immunic Data Readout",2/18/2021 2:14:38 PM
GMED,Globus Medical Reports Fourth Quarter and Full Year 2020 Results,2/17/2021 10:15:00 PM
GMED,Notable earnings after Wednesday's close,2/16/2021 10:35:34 PM
GMED,Here's what to expect from Globus Medical A's earnings,2/15/2021 3:01:29 PM
GMED,"The Week Ahead In Biotech: FDA Decision On G1 Therapeutics, Earnings In The Mix For Light Calendar Week",2/14/2021 2:10:15 PM
GMED,Globus Medical Schedules Fourth Quarter and Full Year 2020 Earnings Release and Conference Call,1/28/2021 10:30:00 PM
GMED,"The Daily Biotech Pulse: Sarepta Gene Therapy Study Readout, Novavax Vaccine Supply Deal, 2 IPOs",1/8/2021 1:25:06 PM
GMED,"The Daily Biotech Pulse: CureVac COVID-19 Vaccine Deal, Argenx Out-Licenses Neuromuscular Disorder Drug, Xencor's Oncology Collaboration",1/7/2021 2:20:50 PM
GMED,Stocks That Hit 52-Week Highs On Wednesday,12/23/2020 4:57:31 PM
GMED,Stocks That Hit 52-Week Highs On Friday,12/18/2020 8:42:01 PM
GMED,Globus Medical Trauma Division Awarded Purchasing Agreement with Premier Inc.,12/9/2020 10:30:00 PM
GMED,Globus Medical Announces First Surgeries with ExcelsiusGPS® Interbody Solutions,11/12/2020 10:30:00 PM
GMED,Globus Medical share scales on Q3 smasher,10/29/2020 4:38:07 PM
GMED,Globus Medical Reports Third Quarter 2020 Results,10/28/2020 9:15:10 PM
GMED,Notable earnings after Wednesday's close,10/27/2020 9:35:12 PM
GMED,Needham picks spine technology positives from expert check-in,10/26/2020 10:52:51 PM
GMED,Globus Medical Schedules Third Quarter 2020 Earnings Release and Conference Call,10/16/2020 10:30:10 PM
GMED,Spinal Elements to issue 7.7M shares in IPO at $13-$15 per share,10/8/2020 11:28:38 AM
GMED,Globus Medical to Participate as Platinum Sponsor at North American Spine Society Annual Meeting,10/5/2020 10:30:10 PM
GMED,Globus Medical Reports Second Quarter 2020 Results,8/5/2020 10:15:10 PM
GMED,Globus Medical A earnings preview: what Wall Street is expecting,8/4/2020 3:03:46 PM
GMED,Globus Medical Schedules Second Quarter 2020 Earnings Release and Conference Call,7/21/2020 10:15:10 PM
GMED,10 Robotics Stocks on the Technological Cutting Edge,6/18/2020 4:05:39 PM
GMED,Stock Alert: Bullish Momentum Continues For Globus Medical ,5/22/2020 11:41:28 AM
GMED,Globus Medical Reports First Quarter 2020 Results,5/7/2020 10:15:10 PM
GMED,Globus Medical Schedules First Quarter 2020 Earnings Release and Conference Call,4/16/2020 10:30:10 PM
GMED,3 Healthcare Stocks to Buy for AI and Big Data,3/26/2020 5:15:39 PM
GMED,Globus Medical Announces $200 Million Share Repurchase Program,3/11/2020 10:40:22 PM
GMED,Globus Medical Reports Fourth Quarter and Full Year 2019 Results,2/20/2020 10:15:00 PM
GMED,What Wall Street expects from Globus Medical A's earnings,2/19/2020 3:01:51 PM
GMED,Stock Alert: Globus Medical (GMED) ,2/13/2020 6:42:35 AM
GMED,Globus Medical Schedules Fourth Quarter and Full Year 2019 Earnings Release and Conference Call,2/6/2020 10:30:00 PM
GMED,Globus Medical Announces First Case with Next Generation 3D Printed Spine Implant,2/4/2020 10:30:00 PM
GMED,Globus Medical Reports Preliminary Record Fourth Quarter and Full Year Sales Results,1/8/2020 10:30:00 PM
GMED,Globus Medical Announces Board of Director Addition and Departure,12/13/2019 10:15:00 PM
GMED,Globus Medical's (GMED) Got A Spine... ,12/9/2019 6:28:18 AM
GMED,"Healthcare Stocks That Hit New Highs (SEM, GMED, TMO...) ",11/20/2019 9:01:10 AM
GMED,Globus Medical Reports Third Quarter 2019 Results,11/6/2019 10:15:00 PM
GMED,Globus Medical Schedules Third Quarter 2019 Earnings Release and Conference Call,10/16/2019 10:15:00 PM
GMED,Globus Medical Launches AUTOBAHN® Intramedullary Nailing Platform at 2019 OTA Annual Meeting,9/24/2019 2:30:00 PM
GMED,Globus Medical Showcases Latest Innovations at NASS 2019 ,9/19/2019 10:15:00 PM
GMED,Globus Medical Reports Second Quarter 2019 Results,8/1/2019 10:15:00 PM
GMED,Globus Medical A is about to announce earnings — here's what Wall Street expects,7/30/2019 3:03:13 PM
GMED,Globus Medical Schedules Second Quarter 2019 Earnings Release and Conference Call,7/15/2019 2:00:00 PM
GMED,Globus Medical Appoints Keith Pfeil as Senior Vice President and CFO,6/27/2019 10:30:00 PM
GMED,Globus Medical Launches First Expandable Interspinous Fixation – AERIAL™,5/30/2019 10:15:00 PM
GMED,New clinical data demonstrates the versatility of Globus Medical’s ExcelsiusGPS®,5/23/2019 10:15:00 PM
GMED,Globus Medical Reports First Quarter 2019 Results,5/2/2019 10:15:00 PM
GMED,Here's what Wall Street expects from Globus Medical A's earnings,4/30/2019 3:02:46 PM
GMED,Globus Medical Schedules First Quarter 2019 Earnings Release and Conference Call,4/17/2019 11:01:05 PM
GMED,Globus Medical Launches FORTIFY Variable Angle Expandable Corpectomy Spacer System,4/15/2019 10:30:00 PM
GMED,Globus Medical Reports Full Year and Fourth Quarter 2018 Results,2/21/2019 10:15:00 PM
GMED,Here's what Wall Street expects from Globus Medical A's earnings report,2/19/2019 3:01:47 PM
GMED,Globus Medical Schedules Fourth Quarter and Full Year 2018 Earnings Release and Conference Call,2/5/2019 10:15:00 PM
GMED,Globus Medical’s SECURE®C Cervical Artificial Disc Receives Expanded Insurance Coverage,1/24/2019 10:15:00 PM
GMED,Japan Approves Amgen/UCB's Osteoporosis Drug - Will U.S. Follow Suit? ,1/9/2019 8:22:53 AM
GMED,Globus Medical Reports Preliminary Record Fourth Quarter and Full Year Sales Results,1/8/2019 10:15:00 PM
GMED,"MYOK Falls On Sanofi Deal Update, YMAB On Track, EQ Braces For Busy Year Ahead ",1/3/2019 4:44:10 AM
GMED,Globus Medical Enters International Market with ExcelsiusGPS® Robotic Guidance and Navigation System,12/6/2018 10:30:00 PM
GMED,Globus Medical Reports Third Quarter 2018 Results,11/8/2018 10:15:00 PM
GMED,Globus Medical A earnings: here's what Wall Street expects,11/6/2018 3:03:09 PM
GMED,Globus Medical Schedules Third Quarter 2018 Earnings Release and Conference Call,10/19/2018 10:30:00 PM
GMED,Globus Medical Supporting Resident and Surgeon Education Workshops at OTA 2018,10/17/2018 10:30:00 PM
GMED,Study Demonstrating Globus Medical’s Expandable Technology Improves Lordosis and Reduces Subsidence Awarded Best Paper at SMISS,10/4/2018 10:30:00 PM
GMED,"Globus Medical Sponsors NASS 2018, Hosts In-Booth Presentations on ExcelsiusGPS®",9/25/2018 11:37:31 PM
GMED,Globus Medical Acquires Surgimap®,9/13/2018 10:30:00 PM
GMED,Globus Medical to Exhibit Latest Advancements in MIS Spine Surgery at SMISS Annual Forum,8/29/2018 2:30:00 PM
GMED,Globus Medical Reports Second Quarter 2018 Results,8/1/2018 10:15:00 PM
GMED,What Wall Street expects from Globus Medical A's earnings,7/30/2018 3:02:45 PM
GMED,Globus Medical Schedules Second Quarter 2018 Earnings Release and Conference Call,7/16/2018 10:15:00 PM
GMED,Globus Medical Features Latest Innovative Technologies at Scoliosis Research Society’s International Meeting on Advanced Spine Technologies,7/11/2018 5:15:15 PM
GMED,Globus Medical Adds Two Innovative Solutions to Growing Trauma PortfolioIntroducing ANTHEM® Ankle Fracture and Proximal Humerus Plate Systems,7/3/2018 2:30:00 PM
GMED,"Globus Medical Announces ExcelsiusGPS® Milestone: 3,000 screws implantedStudy demonstrates potential to improve spine surgery techniques by combining robotics and navigation",6/26/2018 10:15:00 PM
GMED,Globus Medical Launches Cement Augmented Pedicle Screw System,6/13/2018 10:15:00 PM
GMED,Globus Medical Announces Appointment of Orthopedic Trauma Division’s Vice President of Sales,5/21/2018 10:15:00 PM
GMED,Globus Medical Announces Positive Clinical Results for Lateral Expandable TechnologyData Show Expandable Interbody Lateral Spacers More Resistant to Subsidence,5/15/2018 10:15:00 PM
GMED,Globus Medical Announces Corporate Alliance Partnership with the Society of Lateral Access Surgery,5/10/2018 10:15:00 PM
