Ticker,Title,Link
JXN,Jackson Financial Incorporation (JXN) Receives a Hold from Morgan Stanley,8/19/2024 1:07:12 PM
JXN,Analysts Offer Insights on Financial Companies: Jackson Financial Incorporation (JXN) and Bitfarms (BITF),8/12/2024 3:21:17 PM
JXN,Jackson Financial hosts conference call for investors,8/8/2024 2:45:00 PM
JXN,Jackson Financial declares $0.70 dividend,8/7/2024 9:12:05 PM
JXN,Jackson Financial Q2 2024 Earnings Preview,8/6/2024 9:35:57 PM
JXN,Morgan Stanley Reaffirms Their Hold Rating on Jackson Financial Incorporation (JXN),7/10/2024 12:37:15 PM
JXN,Jackson Financial declares $0.70 dividend,5/9/2024 12:52:52 PM
JXN,"Jackson Financial Non-GAAP EPS of $4.23, revenue of $322M",5/8/2024 8:39:10 PM
JXN,Notable earnings after Wednesday's close,5/7/2024 9:35:59 PM
JXN,Jackson Financial goes ex dividend Monday,3/8/2024 4:12:50 PM
JXN,4 Analysts Assess Jackson Finl: What You Need To Know,3/1/2024 8:01:16 PM
JXN,Jackson Financial upgraded to Market Outperform at KBW,2/28/2024 2:59:36 PM
JXN,KBW Reaffirms Their Hold Rating on Jackson Financial Incorporation (JXN),2/22/2024 6:26:08 AM
JXN,Jackson Financial announces retirement of CFO Marcia Wadsten,2/21/2024 9:33:12 PM
JXN,Jackson Financial Q4 2023 Earnings Preview,2/20/2024 10:35:04 PM
JXN,3 Financial Services Stocks to Bank on for a Prosperous 2024,1/24/2024 11:32:31 PM
JXN,The 3 Most Undervalued Russell 2000 Stocks to Buy in January,1/17/2024 10:16:16 PM
JXN,Breaking Down Jackson Finl: 4 Analysts Share Their Views,1/9/2024 4:00:44 PM
JXN,What 4 Analyst Ratings Have To Say About Jackson Finl,11/15/2023 4:00:41 PM
JXN,Why AMC Entertainment Shares Are Trading Lower By Around 14%? Here Are Other Stocks Moving In Thursday's Mid-Day Session,11/9/2023 7:13:06 PM
JXN,Here's what Wall Street expects from Jackson Financial's earnings,11/7/2023 3:01:13 PM
JXN,Jefferies Maintains Buy Rating for Jackson Finl: Here's What You Need To Know,9/14/2023 7:00:28 PM
JXN,Why NIO Are Trading Lower By Over 7%? Here Are Other Stocks Moving In Tuesday's Mid-Day Session,8/29/2023 6:51:55 PM
JXN,Goosehead Insurance and Jackson Financial Set to Join S&P SmallCap 600,8/28/2023 11:41:00 PM
JXN,Seeking up to 9% Dividend Yield? Here Are 2 Dividend Stocks Billionaire Bill Miller Is Holding for Income Growth,8/22/2023 11:59:19 PM
JXN,"Upstart, other fintechs among week's biggest financial losers",8/12/2023 2:30:32 PM
JXN,Jefferies Sticks to Their Buy Rating for Jackson Financial Incorporation (JXN),8/10/2023 12:15:45 PM
JXN,Jackson Financial declares $0.62 dividend,8/8/2023 9:11:22 PM
JXN,What Wall Street expects from Jackson Financial's earnings,8/7/2023 3:01:13 PM
JXN,Jackson Financial says up to 800K customers hit by MOVEit breach,6/26/2023 9:38:21 PM
JXN,Analyst Ratings for Jackson Finl,6/9/2023 9:01:50 PM
JXN,"First Citizens Bancshares tops week's financial gainers, while PayPal falls the most",5/13/2023 2:11:00 PM
JXN,Expert Ratings for Jackson Finl,5/10/2023 9:01:22 PM
JXN,Jackson Financial earnings preview: what Wall Street is expecting,5/8/2023 3:01:13 PM
JXN,The 3 Most Undervalued Stocks to Buy in May 2023,5/5/2023 9:30:26 AM
JXN,Jackson Financial Incorporation (JXN) Gets a Hold from Morgan Stanley,4/12/2023 4:25:28 PM
JXN,Net Interest Margin (NIM) - What Happened At Silicon Valley Bank And SVB ETF Exposure,3/13/2023 2:41:03 PM
JXN,Jackson Financial prices $550M depositary stock offering,3/6/2023 11:22:45 PM
JXN,Jackson Financial raises dividend by 12.7% to $0.62,3/1/2023 11:20:04 AM
JXN,"Jackson Financial boosts stock buyback program by $450M, increases dividend",2/28/2023 10:11:53 PM
JXN,Here's what Wall Street expects from Jackson Financial's earnings,2/27/2023 3:01:13 PM
JXN,Top 5 Financial Stocks That May Crash,2/10/2023 1:20:54 PM
JXN,The 7 Most Undervalued Dividend Stocks to Buy in February 2023,2/1/2023 9:38:09 PM
JXN,"Ally Financial leads financial winners in holiday-shortened week, Kinsale tops losers",1/21/2023 3:41:00 PM
JXN,Morgan Stanley Sticks to Their Hold Rating for Jackson Financial Incorporation (JXN),1/10/2023 4:26:26 PM
JXN,Jackson Financial Incorporation (JXN) Receives a Hold from Morgan Stanley,11/17/2022 4:35:33 PM
JXN,"Analysts Conflicted on These Financial Names: Vacasa (VCSA), Jackson Financial Incorporation (JXN) and Corebridge Financial, Inc. (CRBG)",11/10/2022 4:42:42 PM
JXN,"Jackson Financial Non-GAAP EPS of $4.24 beats by $1.34, revenue of $4.02B beats by $2.59B",11/9/2022 9:50:42 PM
JXN,Jackson Financial earnings: here's what Wall Street expects,11/8/2022 3:01:13 PM
JXN,Q3 results help determine the week's financial stock winners and losers,11/5/2022 2:37:00 PM
JXN,Jefferies Maintains Buy Rating for Jackson Finl: Here's What You Need To Know,9/8/2022 6:22:31 PM
JXN,"Jim Cramer Is Staying Away From This Stock, Says It's The 'Best One Of A Bad Neighborhood'",8/23/2022 2:06:27 PM
JXN,Where Jackson Finl Stands With Analysts,8/17/2022 6:25:00 PM
JXN,"Insurers top financial gainers in week's trading, Carlyle, XP decline the most",8/13/2022 2:04:00 PM
JXN,"Coinbase, Trade Desk, H&R Block And Some Other Big Gainers From Wednesday",8/11/2022 10:22:48 AM
JXN,"United Insurance, Bread Financial leads financial gainers; TOP Financial, Argo among major losers",8/10/2022 3:55:04 PM
JXN,Jackson Financial declares $0.55 dividend,8/9/2022 8:50:41 PM
JXN,Jackson Financial is about to announce earnings — here's what Wall Street expects,8/8/2022 3:01:13 PM
JXN,6 Analysts Have This to Say About Jackson Finl,7/6/2022 6:06:27 PM
JXN,Where Jackson Finl Stands With Analysts,6/6/2022 3:08:40 PM
JXN,Jackson prices $750M notes offering,6/3/2022 6:10:37 AM
JXN,7 Value Stocks to Buy Priced at Less Than Their Book Value,6/2/2022 10:44:21 AM
JXN,Where Jackson Finl Stands With Analysts,5/12/2022 10:48:24 PM
JXN,"United Insurance, PropertyGuru leads financial gainers; Redbox Entertainment, Atlanticus among major losers",5/11/2022 4:12:01 PM
JXN,"Jackson Financial Non-GAAP EPS of $3.94, revenue of $4.3B",5/10/2022 9:24:28 PM
JXN,Jackson Financial subsidiary forges distribution deal with Producers Choice Network,3/23/2022 8:48:26 PM
JXN,Where Jackson Financial Stands With Analysts,3/3/2022 9:02:14 PM
JXN,Jackson raises dividend by 10% to $0.55,3/2/2022 9:39:26 PM
JXN,"Benzinga's Top Ratings Upgrades, Downgrades For January 26, 2022",1/26/2022 4:04:00 PM
JXN,Jackson Announces $125 Mln Share Buyback; Names Scott Romine President Of JNLD - Quick Facts ,12/13/2021 1:10:26 PM
JXN,"Benzinga's Top Ratings Upgrades, Downgrades For December 7, 2021",12/7/2021 4:03:07 PM
JXN,"Offerpad Solutions leads financial gainers, Nam Tai Property and Waterdrop among losers",12/6/2021 6:15:45 PM
JXN,"Benzinga's Top Ratings Upgrades, Downgrades For December 3, 2021",12/3/2021 4:17:42 PM
JXN,4 Stocks Insiders Are Buying,11/17/2021 7:40:34 PM
JXN,Jackson Financial initiates quarterly dividend of $0.50; approves $300M share buyback,11/9/2021 10:24:05 PM
JXN,"Benzinga's Top Ratings Upgrades, Downgrades For September 27, 2021",9/27/2021 4:04:32 PM
JXN,"Benzinga's Top Ratings Upgrades, Downgrades For September 22, 2021",9/22/2021 4:05:14 PM
JXN,Prudential sells Jackson equity stake to Apollo-backed Athene for $500 million,6/18/2020 4:39:22 PM
JXN,"Pandemic hits Prudential Asia, sources say Jackson on block",5/14/2020 6:37:44 PM
JXN,"James Bell, Laban Jackson to retire from JPMorgan board",3/19/2020 10:04:17 PM
