Ticker,Title,Link
VMI,"Valmont Industries Appoints Thomas Liguori As CFO, EVP ",8/22/2024 2:53:31 PM
VMI,Valmont (VMI) Gets a Buy from D.A. Davidson,8/20/2024 12:25:46 PM
VMI,Valmont declares $0.60 dividend,7/29/2024 8:23:57 PM
VMI,Valmont (VMI) Receives a Rating Update from a Top Analyst,7/25/2024 1:26:48 PM
VMI,"Valmont GAAP EPS of $4.91 beats by $0.83, revenue of $1.04B in-line",7/24/2024 8:54:30 PM
VMI,Notable earnings after Wednesday's close,7/23/2024 9:35:48 PM
VMI,Stifel Nicolaus Keeps Their Buy Rating on Valmont (VMI),7/12/2024 11:05:32 AM
VMI,Here's Why You Should Add Cintas Stock to Your Portfolio,6/25/2024 6:26:48 PM
VMI,MRC Global Gets PVF Deal From ExxonMobil in North America,6/14/2024 7:44:41 PM
VMI,Wall Street Analysts Are Bullish on Top Industrial Goods Picks,6/11/2024 12:31:00 PM
VMI,Valmont (VMI) Receives a Rating Update from a Top Analyst,5/9/2024 2:07:22 AM
VMI,Valmont declares $0.60 dividend,5/6/2024 8:45:42 PM
VMI,"Earnings help Carpenter Technology to top industrial gainer of week, while dragging down MYR Group",5/4/2024 4:35:00 PM
VMI,"Analysts Are Bullish on These Industrial Goods Stocks: Generac Holdings (GNRC), CNH Industrial (CNHI)",5/2/2024 12:32:39 PM
VMI,"Valmont GAAP EPS of $4.32 beats by $1.07, revenue of $1B beats by $13.02M",5/1/2024 8:36:31 PM
VMI,Here's what Wall Street expects from Valmont Industries's earnings report,4/30/2024 3:01:13 PM
VMI,"Analysts Are Bullish on Top Industrial Goods Stocks: Valmont (VMI), Ameresco (AMRC)",4/11/2024 11:30:53 AM
VMI,Analysts Offer Insights on Industrial Goods Companies: Clean Harbors (CLH) and Valmont (VMI),3/25/2024 11:50:06 AM
VMI,DA Davidson Maintains Buy Rating for Valmont Industries: Here's What You Need To Know,2/27/2024 6:00:19 PM
VMI,"Analysts Conflicted on These Industrial Goods Names: Clean Harbors (CLH), Valmont (VMI) and CaesarStone Sdot-Yam (CSTE)",2/22/2024 1:06:15 PM
VMI,"Valmont Non-GAAP EPS of $3.18 beats by $0.14, revenue of $1B misses by $40M",2/21/2024 9:50:02 PM
VMI,Valmont Q4 2023 Earnings Preview,2/20/2024 10:35:45 PM
VMI,Stifel Nicolaus Keeps Their Buy Rating on Valmont (VMI),1/11/2024 12:55:06 PM
VMI,Valmont To Buy Back $120 Mln Of Shares ,11/29/2023 2:43:09 PM
VMI,"Analysts Have Conflicting Sentiments on These Industrial Goods Companies: Valmont (VMI), MSA Safety (MSA) and Stanley Black & Decker (SWK)",10/30/2023 2:10:46 AM
VMI,D.A. Davidson Remains a Hold on Valmont (VMI),10/27/2023 12:46:53 PM
VMI,Why Harley-Davidson Shares Are Trading Lower By Around 10%? Here Are Other Stocks Moving In Thursday's Mid-Day Session,10/26/2023 7:27:42 PM
VMI,Valmont Industries is about to announce its earnings — here's what Wall Street expects,10/24/2023 3:01:13 PM
VMI,Stifel Nicolaus Sticks to Its Buy Rating for Valmont (VMI),10/20/2023 2:05:33 AM
VMI,Valmont declares $0.60 dividend,8/1/2023 6:12:37 AM
VMI,"Rising Stars, Falling Trends: July's Industry ETF Winners And Losers",7/31/2023 5:03:19 PM
VMI,Why Willis Towers Watson Shares Are Trading Lower By 9%? Here Are Other Stocks Moving In Thursday's Mid-Day Session,7/27/2023 6:53:15 PM
VMI,"Valmont Non-GAAP EPS of $4.37 beats by $0.26, revenue of $1.05B misses by $110M",7/26/2023 8:32:37 PM
VMI,Valmont Q2 2023 Earnings Preview,7/25/2023 9:35:49 PM
VMI,Valmont CEO Stephen Kaniewski Steps Down ,7/11/2023 2:32:46 PM
VMI,Valmont declares $0.60 dividend,4/24/2023 8:38:22 PM
VMI,"Valmont Non-GAAP EPS of $3.61 beats by $0.28, revenue of $1.06B beats by $20M",4/20/2023 9:00:17 PM
VMI,Notable earnings after Thursday's close,4/19/2023 9:35:37 PM
VMI,Valmont goes ex dividend tomorrow,3/29/2023 5:48:50 PM
VMI,D.A. Davidson Reaffirms Their Hold Rating on Valmont (VMI),2/24/2023 6:15:20 PM
VMI,"Valmont GAAP EPS of $1.86 misses by $1.56, revenue of $1.1B beats by $40M",2/22/2023 9:27:03 PM
VMI,Valmont Q4 2022 Earnings Preview,2/21/2023 10:35:47 PM
VMI,Stifel Nicolaus Sticks to Their Buy Rating for Valmont (VMI),1/30/2023 2:07:54 AM
VMI,7 Best Water Stocks to Buy Now,12/28/2022 11:45:45 AM
VMI,"Analysts’ Top Industrial Goods Picks: Emcor Group (EME), Valmont (VMI)",12/21/2022 2:10:16 AM
VMI,Valmont Industries To Divest Offshore Wind Business To Euro Steel ,11/14/2022 2:16:11 PM
VMI,7 Strong Tech Stocks to Buy Now for the Upcoming Bull Market,11/10/2022 2:47:42 PM
VMI,Valmont declares $0.55 dividend,11/1/2022 8:19:04 PM
VMI,"Valmont Non-GAAP EPS of $3.49 beats by $0.09, revenue of $1.09B beats by $50M",10/26/2022 8:43:39 PM
VMI,Valmont Q3 2022 Earnings Preview,10/25/2022 9:35:57 PM
VMI,Stifel Maintains Buy Rating for Valmont Industries: Here's What You Need To Know,10/11/2022 6:03:21 PM
VMI,Valmont declares $0.55 dividend,7/26/2022 8:32:49 PM
VMI,"Valmont Industries stock rises on Q2 earnings beat, raised FY 2022 guidance",7/21/2022 4:04:54 PM
VMI,Valmont Industries Lifts FY22 Outlook ,7/20/2022 11:02:44 PM
VMI,Notable earnings after Wednesday's close,7/19/2022 9:35:41 PM
VMI,"Benzinga's Top Ratings Upgrades, Downgrades For June 3, 2022",6/3/2022 4:08:02 PM
VMI,Valmont declares $0.55 dividend,4/26/2022 8:26:59 PM
VMI,"Valmont Industries stock hits record high after Q1 results beat, FY guidance raise",4/21/2022 4:17:56 PM
VMI,Valmont Industries Raises FY22 Guidance ,4/20/2022 10:42:59 PM
VMI,Valmont Q1 2022 Earnings Preview,4/19/2022 9:35:49 PM
VMI,Valmont declares $0.55 dividend,2/22/2022 9:54:39 PM
VMI,Valmont Industries Lifts FY22 Outlook ,2/16/2022 11:18:31 PM
VMI,Valmont Q4 2021 Earnings Preview,2/15/2022 10:35:47 PM
VMI,Notable earnings after Monday's close,10/24/2021 9:35:00 PM
VMI,"Valmont Q3 Profit Beats Street On Better Revenues, Revises Outlook ",10/21/2021 12:40:17 AM
VMI,Notable earnings after Wednesday's close,10/19/2021 9:35:40 PM
VMI,Valmont Industries earnings: here's what Wall Street expects,10/18/2021 3:01:24 PM
VMI,Valmont declares $0.50 dividend,7/27/2021 8:29:09 PM
VMI,"Valmont EPS beats by $0.56, beats on revenue",7/21/2021 8:26:15 PM
VMI,Notable earnings after Wednesday's close,7/20/2021 9:35:29 PM
VMI,Valmont Industries earnings preview: what Wall Street is expecting,7/19/2021 3:01:28 PM
VMI,Valmont boosts full-year EPS guidance; provides long term financial targets,5/20/2021 11:36:46 AM
VMI,"Valmont Industries, Inc. -- Moody's announces completion of a periodic review of ratings of Valmont Industries, Inc.",5/18/2021 3:50:00 PM
VMI,Seeking Alpha Catalyst Watch,5/14/2021 7:30:08 PM
VMI,Stocks That Hit 52-Week Highs On Monday,5/10/2021 5:26:20 PM
VMI,Valmont To Acquire Prospera Technologies - Quick Facts ,5/5/2021 2:21:14 PM
VMI,Valmont Industries Q1 Profit Rises ,4/22/2021 5:37:10 AM
VMI,Notable earnings after Wednesday's close,4/20/2021 9:35:25 PM
VMI,Valmont Industries earnings: here's what Wall Street expects,4/19/2021 3:01:29 PM
VMI,"Benzinga's Top Ratings Upgrades, Downgrades For February 22, 2021",2/22/2021 4:03:37 PM
VMI,Notable earnings after Wednesday's close,2/16/2021 10:35:34 PM
VMI,Valmont Industries earnings preview: what to expect,2/15/2021 3:01:29 PM
VMI,Stocks That Hit 52-Week Highs On Monday,1/4/2021 6:58:02 PM
VMI,Stocks That Hit 52-Week Highs On Friday,12/18/2020 8:42:01 PM
VMI,Valmont declares $0.45 dividend,12/7/2020 9:18:10 PM
VMI,7 Infrastructure Stocks to Buy for Coast-to-Coast Improvements ,11/20/2020 4:04:08 PM
VMI,8 Infrastructure Stocks to Buy Before the Election,11/2/2020 4:11:26 PM
VMI,Valmont Q3 2020 Earnings Preview,10/20/2020 9:35:04 PM
VMI,"Valmont Industries, Inc. -- Moody's announces completion of a periodic review of ratings of Valmont Industries, Inc.",8/25/2020 10:13:00 PM
VMI,Valmont Industries Q2 Adj. Profit Rises; Issues Q3 Sales Outlook ,7/22/2020 11:22:32 PM
VMI,Valmont Industries is about to announce earnings — here's what Wall Street expects,7/21/2020 3:01:34 PM
VMI,More on Valmont Industries Q1 results,4/23/2020 11:40:32 AM
VMI,"Valmont EPS beats by $0.63,  revenue in-line",4/22/2020 9:41:21 PM
VMI,Notable earnings after Wednesday's close,4/21/2020 9:35:41 PM
VMI,"Valmont Industries, Inc. -- Moody's affirms Valmont Industries ratings (including Baa3 senior unsecured debt rating); outlook stable",3/11/2020 7:33:00 PM
VMI,Industrial - Top 5 Gainers / Losers,2/20/2020 6:03:54 PM
VMI,"Valmont EPS misses by $0.18, misses on revenue",2/19/2020 10:43:08 PM
VMI,What Wall Street expects from Valmont Industries's earnings,2/18/2020 3:01:37 PM
VMI,9 Hot Stocks to Buy Now,12/30/2019 6:14:02 PM
VMI,9 Hot Stocks to Buy Now,12/13/2019 3:18:22 PM
VMI,"Valmont Industries, Inc. -- Moody's announces completion of a periodic review of ratings of Valmont Industries, Inc.",10/24/2019 11:04:00 PM
VMI,Valmont Industries is about to announce its earnings — here's what to expect,10/21/2019 3:01:19 PM
VMI,Valmont Industries Cuts 2019 Outlook ,7/24/2019 3:20:39 AM
VMI,Valmont Industries is about to announce earnings — here's what Wall Street expects,7/21/2019 3:01:26 PM
VMI,Valmont Industries Q1 Profit Down; Narrows 2019 EPS View ,4/24/2019 3:07:36 AM
VMI,Here's what Wall Street expects from Valmont Industries's earnings report,4/21/2019 3:01:29 PM
VMI,Here's what to expect from Valmont Industries's earnings,2/18/2019 3:01:37 PM
VMI,What Wall Street expects from Valmont Industries's earnings,10/21/2018 3:01:25 PM
VMI,Valmont Acquires Majority Ownership Stake In Convert Italia - Quick Facts ,8/3/2018 3:07:52 PM
VMI,Here's what to expect from Valmont Industries's earnings report,7/21/2018 3:01:19 PM
VMI,"Valmont Industries, Inc. -- Moody's says Valmont's revised guidance is credit negative, ratings are unaffected",7/13/2018 1:12:00 AM
VMI,Valmont Reduces Full-Year Outlook - Quick Facts ,7/12/2018 1:21:36 PM
VMI,"Valmont Industries, Inc. -- Moody's assigns Baa3 rating to Valmont's new senior unsecured notes",6/9/2018 1:01:00 AM
VMI,"Valmont Industries, Inc. Announces Sale of $255 Million of Senior Notes",6/8/2018 10:10:00 PM
VMI,Valmont Board Declares Quarterly Dividend,6/5/2018 5:00:00 AM
VMI,U-Haul Migration Trends: Las Vegas Ranks as No. 6 U.S. Destination,5/18/2018 3:00:00 PM
VMI,Valmont Completes Divestiture of Donhad Pty. Ltd.,4/30/2018 11:30:00 PM
VMI,BRIEF-Valmont Industries Reports Q1 Adj EPS $1.87,4/19/2018 12:15:21 AM
VMI,"Valmont Industries, Inc. First Quarter 2018 Earnings Conference Call",4/12/2018 5:00:00 AM
VMI,"Valmont Hosts Investor Day Today, March 6, 2018 in New York City",3/6/2018 1:00:00 PM
VMI,"Valmont Industries, Inc. Announces Continuation of Fourth Quarter 2017 Earnings Conference Call",2/22/2018 4:23:00 PM
VMI,"Valmont Industries, Inc. Announces Fourth Quarter 2017 Earnings Conference Call",2/15/2018 6:00:00 AM
VMI,"Valmont to Host Investor Day March 6, 2018 in New York City",2/6/2018 11:30:00 PM
VMI,BRIEF-Valmont Appoints Two New Members To Its Board Of Directors And Announces Lead Director Succession (VMI),12/21/2017 12:07:04 AM
VMI,Valmont Appoints Two New Members to Its Board of Directors and Announces Lead Director Succession,12/20/2017 11:30:00 PM
VMI,Valmont Board Declares Quarterly Dividend,12/5/2017 5:00:00 AM
VMI,Cenveo Announces Conference Call for Third Quarter Results,10/30/2017 9:01:00 PM
VMI,BRIEF-Valmont Industries Inc says co and subsidiaries entered into a first amended and restated credit agreement​ (VMI),10/20/2017 11:07:05 PM
VMI,BRIEF-Valmont Industries reports Q3 earnings per share $1.55 (VMI),10/18/2017 11:47:06 PM
VMI,"Valmont Industries, Inc. Third Quarter 2017 Earnings Conference Call",10/12/2017 6:00:00 AM
VMI,BRIEF-Valmont Industries declared a quarterly dividend of 37.5 cents per share (VMI),9/6/2017 7:02:03 AM
VMI,BRIEF-Valmont Industries to sell Australian mining consumables business to Moly-Cop (VMI),8/25/2017 7:02:04 AM
VMI,BRIEF-Valmont reports Q2 earnings per share $2.01 (VMI),7/20/2017 12:22:03 AM
VMI,"Valmont Names Stephen Kaniewski CEO, Effective Dec. 31 ",6/27/2017 7:00:57 AM
VMI,BRIEF-Valmont appoints Stephen Kaniewski as CEO (VMI),6/26/2017 11:54:06 PM
VMI,Valmont Board Declares Quarterly Dividend,6/6/2017 5:30:00 AM
VMI,CollabNet Named Visionary in Gartner Enterprise Agile Planning Tools Magic Quadrant,5/1/2017 4:50:00 PM
VMI,Valmont Coatings Wins 5 Excellence in Hot-Dip Galvanizing Awards,4/24/2017 11:30:00 PM
VMI,BRIEF-Valmont Q1 earnings per share $1.72 (VMI),4/20/2017 12:01:03 AM
VMI,Valmont Reports First Quarter 2017 Results,4/19/2017 11:30:00 PM
VMI,"Valmont Industries, Inc. First Quarter 2017 Earnings Conference Call",4/12/2017 5:00:00 AM
VMI,Valley Irrigation to Distribute Trimble Irrigation Solution,3/21/2017 11:30:00 AM
VMI,BRIEF-Valmont Industries Q4 GAAP earnings per share $3.10 (VMI),2/22/2017 12:18:12 AM
VMI,BRIEF-Valmont Q3 earnings per share $1.24 excluding items (VMI),10/20/2016 12:18:19 PM
