Ticker,Title,Link
FUL,H.B. Fuller declares $0.2225 dividend,7/17/2024 3:51:56 PM
FUL,"Analysts Offer Insights on Materials Companies: H.B. Fuller Company (FUL), Freeport-McMoRan (FCX) and First Quantum Minerals (OtherFQVLF)",7/4/2024 7:01:33 AM
FUL,Hold Rating on H.B. Fuller Company Amid Positive Growth but Valuation Concerns,6/28/2024 8:08:13 AM
FUL,H. B. Fuller Co. hosts conference call for investors,6/27/2024 2:45:00 PM
FUL,"H.B. Fuller Non-GAAP EPS of $1.12 beats by $0.09, revenue of $917M beats by $2.78M",6/26/2024 8:10:10 PM
FUL,Notable earnings after Wednesday's close,6/25/2024 9:35:23 PM
FUL,Seaport Global Initiates a Buy Rating on H.B. Fuller Company (FUL),6/24/2024 1:15:05 PM
FUL,"Earnings week ahead: FedEx, Nike, Carnival, Micron, BlackBerry, Walgreens Boots, and more",6/23/2024 12:00:00 PM
FUL,H.B. Fuller acquires specialty adhesives company ND Industries,5/20/2024 1:04:06 PM
FUL,"Dividend Roundup: Procter & Gamble, Caterpillar, CVS Health, Cintas, and more",4/12/2024 11:58:22 AM
FUL,H.B. Fuller raises dividend by 8.5% to $0.2225,4/11/2024 3:19:31 PM
FUL,Expert Ratings For H.B. Fuller,4/1/2024 8:00:30 PM
FUL,H.B. Fuller Company: Hold Rating with Limited Upside Potential,3/29/2024 8:16:28 AM
FUL,H.B. Fuller Company (FUL) Gets a Buy from Stifel Nicolaus,3/28/2024 10:55:27 AM
FUL,"H.B. Fuller Non-GAAP EPS of $0.67 beats by $0.04, revenue of $810.42M misses",3/27/2024 8:12:50 PM
FUL,Notable earnings after Wednesday's close,3/26/2024 9:35:12 PM
FUL,"Catalyst Watch: Walgreens earnings, UPS analyst day and Xiaomi's luxury EV debut",3/22/2024 7:00:00 PM
FUL,Seaport Global Reaffirms Their Buy Rating on H.B. Fuller Company (FUL),3/20/2024 12:25:49 PM
FUL,H.B. Fuller declares $0.205 dividend,1/24/2024 4:35:34 PM
FUL,Notable earnings after Wednesday's close,1/23/2024 10:35:36 PM
FUL,H B Fuller earnings: here's what Wall Street expects,1/16/2024 3:01:13 PM
FUL,Top 5 Materials Stocks That May Crash This Quarter,12/8/2023 2:37:11 PM
FUL,"Benzinga's Top Ratings Upgrades, Downgrades For October 17, 2023",10/17/2023 5:00:55 PM
FUL,Stifel Nicolaus Remains a Buy on H.B. Fuller Company (FUL),10/4/2023 2:05:10 AM
FUL,Buy Rating for H.B. Fuller Despite Volume Decrease and Uncertain FY24 Outlook: An Analysis of Margin Expansion and Cost Savings Program,9/29/2023 6:26:27 AM
FUL,Here's what Wall Street expects from H B Fuller's earnings report,9/26/2023 3:01:13 PM
FUL,"Benzinga's Top Ratings Upgrades, Downgrades For September 11, 2023",9/11/2023 5:00:28 PM
FUL,3 of the Safest Dividend Kings,8/4/2023 7:35:57 PM
FUL,H.B. Fuller To Close Three Manufacturing Facilities ,7/21/2023 3:26:31 AM
FUL,"Dividend Roundup: Unilever, PNC Financial, Oracle, AbbVie, and more",7/7/2023 11:04:22 AM
FUL,H.B. Fuller declares $0.205 dividend,7/6/2023 4:27:26 PM
FUL,Analyst Ratings for H.B. Fuller,6/30/2023 9:00:36 PM
FUL,"H.B. Fuller Non-GAAP EPS of $0.93 misses by $0.11, revenue of $898.24M misses by $71.42M",6/28/2023 8:14:02 PM
FUL,Notable earnings after Wednesday's close,6/27/2023 9:35:03 PM
FUL,"Earnings week ahead: Nike, Micron Technology, BlackBerry, Walgreens Boots Alliance and more",6/23/2023 7:22:26 PM
FUL,"Catalyst Watch: Earnings season picks up steam, housing data due",4/14/2023 5:30:11 PM
FUL,"PriceSmart, WD-40 Company And 3 Stocks To Watch Heading Into Monday",4/10/2023 10:14:11 AM
FUL,H.B. Fuller raises quarterly dividend by 7.9% to  $0.205/share,4/6/2023 8:08:59 PM
FUL,H.B. Fuller Company (FUL) Gets a Buy from Robert W. Baird,4/5/2023 6:55:07 AM
FUL,"H.B. Fuller Non-GAAP EPS of $0.55 misses by $0.04, revenue of $809M misses by $16.42M",3/29/2023 8:29:51 PM
FUL,Notable earnings after Wednesday's close,3/28/2023 9:35:26 PM
FUL,"Earnings week ahead: Micron, Lululemon, Carnival, RH and more",3/24/2023 5:48:26 PM
FUL,H.B. Fuller's Valuations And Margins Driven By EV Momentum Earns It Analyst Conviction,2/3/2023 6:45:41 PM
FUL,H.B. Fuller declares $0.19 dividend,1/24/2023 9:23:45 PM
FUL,Robert W. Baird Keeps Their Buy Rating on H.B. Fuller Company (FUL),1/20/2023 4:05:10 AM
FUL,Why Jupiter Wellness Shares Are Trading Lower By Around 40%? Here Are Other Stocks Moving In Thursday's Mid-Day Session,1/19/2023 7:33:14 PM
FUL,"H.B. Fuller Non-GAAP EPS of $1.04 misses by $0.20, revenue of $958M misses by $52M",1/18/2023 9:12:27 PM
FUL,H.B. Fuller Q4 2022 Earnings Preview,1/17/2023 10:35:53 PM
FUL,3 Stocks Primed for High Dividend Growth,1/9/2023 9:06:05 PM
FUL,"PPG, Sherwin-Williams plunge 5% as RPM results disappoint",1/5/2023 4:57:14 PM
FUL,H.B. Fuller declares $0.19 dividend,10/6/2022 3:02:11 PM
FUL,Robert W. Baird Remains a Buy on H.B. Fuller Company (FUL),9/23/2022 4:35:29 AM
FUL,"H.B. Fuller, Lennar And Some Other Big Stocks Moving Higher In Today's Pre-Market Session",9/22/2022 1:27:05 PM
FUL,H.B. Fuller Q3 Profit Rises ,9/21/2022 10:35:52 PM
FUL,Notable earnings after Wednesday's close,9/20/2022 9:35:48 PM
FUL,"Earnings week ahead: FedEx, Costco, AutoZone, General Mills, Lennar, KB Home and more",9/16/2022 4:29:13 PM
FUL,H.B. Fuller declares $0.19 dividend,6/30/2022 4:13:15 PM
FUL,"Benzinga's Top Ratings Upgrades, Downgrades For June 24, 2022",6/24/2022 5:17:22 PM
FUL,"H.B. Fuller Non-GAAP EPS of $1.11 beats by $0.04, revenue of $993.26M beats by $27.95M",6/22/2022 8:07:47 PM
FUL,H.B. Fuller Q2 2022 Earnings Preview,6/21/2022 9:35:51 PM
FUL,"Benzinga's Top Ratings Upgrades, Downgrades For April 18, 2022",4/18/2022 4:04:01 PM
FUL,"Benzinga's Top Ratings Upgrades, Downgrades For April 14, 2022",4/14/2022 4:03:32 PM
FUL,H.B. Fuller raises dividend by 13% to $0.19,4/7/2022 2:19:32 PM
FUL,What 4 Analyst Ratings Have To Say About H.B. Fuller,3/28/2022 7:02:12 PM
FUL,A Peek Into The Markets: US Stock Futures Rise Ahead Of Economic Reports,3/24/2022 10:20:00 AM
FUL,H.B. Fuller Q1 Profit Rises ,3/23/2022 9:59:27 PM
FUL,Notable earnings after Wednesday's close,3/22/2022 9:35:49 PM
FUL,H.B. Fuller picks industry veteran for COO role,2/23/2022 9:51:02 PM
FUL,"H.B. Fuller Buys Apollo, Adhesive Formulator Fourny For $211 Mln ",1/27/2022 3:11:39 PM
FUL,H.B. Fuller declares $0.1675 dividend,1/26/2022 2:49:57 PM
FUL,"Benzinga's Top Ratings Upgrades, Downgrades For January 21, 2022",1/21/2022 4:04:17 PM
FUL,H.B. Fuller Q4 Profit Rises ,1/19/2022 11:17:15 PM
FUL,H.B. Fuller Q4 2021 Earnings Preview,1/18/2022 10:35:20 PM
FUL,H.B. Fuller Company -- Moody's Upgrades H.B. Fuller's ratings to Ba2,10/22/2021 6:06:00 PM
FUL,58 Biggest Movers From Yesterday,9/24/2021 11:11:19 AM
FUL,38 Stocks Moving In Thursday's Mid-Day Session,9/23/2021 6:01:03 PM
FUL,H.B. Fuller Q3 Profit Down ,9/22/2021 10:47:45 PM
FUL,Notable earnings after Wednesday's close,9/21/2021 9:35:00 PM
FUL,H B Fuller is about to announce earnings — here's what Wall Street expects,9/20/2021 3:01:16 PM
FUL,H.B. Fuller Company -- Moody's announces completion of a periodic review of ratings of H.B. Fuller Company,9/9/2021 11:07:00 PM
FUL,H.B. Fuller To Implement 11% Surcharge On Product Shipments Globally - Quick Facts ,8/30/2021 2:34:34 PM
FUL,H.B. Fuller Company declares $0.1675 dividend,7/1/2021 2:18:35 PM
FUL,H.B. Fuller announces strategic partnership with Jubilant Industries,6/29/2021 6:07:33 AM
FUL,H.B. Fuller cut at Citi in near-term price-cost pinch,6/25/2021 7:53:06 PM
FUL,H.B. Fuller FQ2 revenue up 22.7% Y/Y as demand rose amid raw material shortage,6/24/2021 6:35:48 PM
FUL,H.B. Fuller Q1 Profit Rises ,6/23/2021 11:23:04 PM
FUL,What Wall Street expects from H B Fuller's earnings,6/21/2021 3:01:17 PM
FUL,Stocks That Hit 52-Week Highs On Monday,5/10/2021 5:26:20 PM
FUL,Olin upgraded at Citi as commodity chemical names set for record Q2,4/15/2021 7:43:55 PM
FUL,H.B. Fuller raises dividend by 3%,4/8/2021 2:24:38 PM
FUL,"H.B. Fuller EPS beats by $0.19, beats on revenue",3/24/2021 8:10:32 PM
FUL,H.B. Fuller Q1 2021 Earnings Preview,3/23/2021 9:35:25 PM
FUL,H.B. Fuller Q4 Profit Rises ,1/26/2021 12:18:03 AM
FUL,"H.B. Fuller EPS beats by $0.20, beats on revenue",1/25/2021 9:07:32 PM
FUL,Notable earnings after Monday's close,1/24/2021 10:35:00 PM
FUL,Here's what Wall Street expects from H B Fuller's earnings,1/23/2021 3:01:16 PM
FUL,H.B. Fuller declares $0.1625 dividend,1/21/2021 4:06:49 PM
FUL,"Benzinga's Top Upgrades, Downgrades For January 4, 2021",1/4/2021 4:04:49 PM
FUL,"Benzinga's Top Upgrades, Downgrades For December 18, 2020",12/18/2020 4:10:30 PM
FUL,H.B. Fuller Company -- Moody's announces completion of a periodic review of ratings of H.B. Fuller Company,10/7/2020 9:27:00 PM
FUL,H.B. Fuller Company -- Moody's assigns B2 to H.B. Fuller's new senior unsecured notes,10/6/2020 5:36:00 PM
FUL,"After Market Hours: SPI Energy, Jefferies Financial, H.B. Fuller Gain; Kubient Slips ",9/23/2020 11:43:16 PM
FUL,H B Fuller earnings: here's what Wall Street expects,9/22/2020 3:01:20 PM
FUL,H B Fuller earnings preview: what Wall Street is expecting,6/24/2020 11:54:06 AM
FUL,Stock Alert: H.B. Fuller To Report Results Today ,3/25/2020 8:55:50 AM
FUL,Notable earnings after Wednesday's close,3/24/2020 9:35:44 PM
FUL,H.B. Fuller Q4 Results Miss Street ,1/22/2020 11:10:12 PM
FUL,H.B. Fuller Company -- Moody's announces completion of a periodic review of ratings of H.B. Fuller Company,11/12/2019 8:39:00 PM
FUL,"H.B. Fuller Q3 Results Miss Street, Cuts FY Outlook, Shares Tank 8% ",9/25/2019 10:27:26 PM
FUL,Here's what to expect from H B Fuller's earnings report,6/24/2019 3:01:17 PM
FUL,H.B. Fuller Q1 Results Miss Street View ,3/27/2019 9:19:47 PM
FUL,H B Fuller earnings preview: what Wall Street is expecting,3/25/2019 3:01:29 PM
FUL,Here's what to expect from H B Fuller's earnings report,1/14/2019 3:01:19 PM
FUL,H.B. Fuller to Present at the Morgan Stanley Global Chemicals and Agriculture Conference,11/6/2018 11:00:00 PM
FUL,H.B. Fuller to Present at the Baird 2018 Global Industrial Conference,10/30/2018 10:34:23 PM
FUL,H.B. Fuller Announces Quarterly Dividend,10/4/2018 9:10:14 PM
FUL,H.B. Fuller Reports Third Quarter 2018 Results,9/27/2018 2:53:24 AM
FUL,H B Fuller is about to announce its earnings — here's what Wall Street expects,9/24/2018 3:01:17 PM
FUL,"H.B. Fuller Announces North America Price Increase on Hot Melt, Reactive, Water-based Adhesives and Related Products",9/14/2018 1:00:00 PM
FUL,H.B. Fuller Announces North America Price Increase on Polymer and Water-based Adhesives,7/31/2018 11:00:00 PM
FUL,H.B. Fuller Named Strategic Supplier by Faurecia,7/26/2018 12:38:07 AM
FUL,H.B. Fuller Announces 2018 Analyst and Investor Day,7/19/2018 4:42:27 AM
FUL,H.B. Fuller Elects Daniel Florness to Board of Directors Experienced Executive to Strengthen Company’s Execution of Profitable Growth Strategy  ,7/12/2018 7:10:17 PM
FUL,H.B. Fuller Reports Second Quarter 2018 ResultsSecond Quarter Diluted EPS $0.86 and Adjusted Diluted EPS $0.89(1); Fiscal Year 2018 Adjusted Diluted EPS Guidance Narrowed to between $3.15 and $3.40,6/28/2018 2:31:19 AM
FUL,BRIEF-H.B. Fuller Increases Quarterly Dividend,4/12/2018 11:43:00 PM
FUL,BRIEF-H.B. Fuller Q1 Adjusted Earnings Per Share $0.35,3/29/2018 12:24:08 AM
FUL,H.B. Fuller Announces Integration Related Restructuring Charges,3/2/2018 6:51:49 PM
FUL,H.B. Fuller Announces Global Price Increase on Adhesives,2/27/2018 3:00:00 PM
FUL,CORRECTING and REPLACING  – H.B. Fuller Reports Fourth Quarter and Fiscal Year 2017 Results,1/24/2018 4:20:14 PM
FUL,"Earnings In Focus: Jan. 23 (FUL, ATI, JNJ, PG, VZ) ",1/23/2018 9:13:41 AM
FUL,H.B. Fuller Announces Quarterly Dividend,1/18/2018 4:46:16 PM
FUL,H.B. Fuller Announces Price Increase on Adhesives Sold in North America,1/16/2018 11:00:00 PM
FUL,"Greater St. Charles, IL CVB Spreads ""Holiday Cheer""",12/8/2017 6:36:00 PM
FUL,H.B. Fuller’s New Site in Germany Accelerates Business Growth GloballyAutomotive Competence Center is now in place in the heart of the European automotive industry.,11/28/2017 2:00:00 PM
FUL,"H.B. Fuller Awarded LEED® Gold Certification for Sustainable DevelopmentH.B. Fuller plant in Surabaya, Indonesia, receives prestigious green building award",11/13/2017 2:00:00 AM
FUL,SHAREHOLDER ALERT: Purcell Julie & Lefkowitz LLP Is Investigating H.B. Fuller Company for Potential Breaches Of Fiduciary Duty By Its Board of Directors,10/26/2017 1:19:00 PM
FUL,American Securities Closes Sale Of Royal Adhesives & Sealants To H.B. Fuller ,10/23/2017 2:56:53 AM
FUL,BRIEF-HB Fuller Co entered into term loan credit agreement ‍on Oct. 20​ (FUL),10/20/2017 10:42:10 PM
FUL,H.B. Fuller Announces Quarterly Dividend,10/5/2017 7:07:55 PM
FUL,H.B. Fuller Company -- Moody's downgrades H.B. Fuller to Ba3; outlook stable,10/2/2017 4:45:00 PM
FUL,BRIEF-HB Fuller expects to amend credit facility to permit Royal Adhesives & Sealants deal (FUL),9/28/2017 5:02:03 PM
FUL,H.B. Fuller Company -- Moody's places H.B. Fuller Baa3 ratings under review for downgrade,9/5/2017 10:25:00 PM
FUL,H.B. Fuller To Buy Adecol In Brazil - Quick Facts ,7/18/2017 3:15:31 PM
FUL,BRIEF-HB Fuller sets regular quarterly cash dividend of $0.15/share (FUL),7/13/2017 8:12:05 PM
FUL,BRIEF-H.B. Fuller reports Q2 adjusted earnings per share $0.62 (FUL),6/29/2017 2:46:10 AM
FUL,"BRIEF-HB Fuller says co, foreign units enter into credit agreement (FUL)",4/18/2017 9:59:03 PM
FUL,H.B. Fuller Gives Back Ground After Reaching Record Intraday High ,3/30/2017 8:49:31 PM
FUL,BRIEF-HB Fuller Co says CEO James J. Owens 2016 total compensation was $4.6 mln (FUL),2/22/2017 8:06:12 PM
FUL,BRIEF-H.B. Fuller announces pricing of $300 mln debt offering (FUL),2/9/2017 11:10:09 PM
FUL,"BRIEF-HB FULLER FILES FOR MIXED SHELF, SIZE UNDISCLOSED (FUL)",2/6/2017 8:44:08 PM
FUL,BRIEF-H.B. Fuller company acquires Wisdom Worldwide Adhesives (FUL),1/30/2017 2:50:07 PM
FUL,BRIEF-H.B. Fuller announces proactive restructuring initiative (FUL),12/10/2016 6:04:07 PM
FUL,BRIEF-Bank of America declares quarterly dividend of $0.075/share (BAC),10/27/2016 10:20:20 PM
