Ticker,Title,Link
PRGO,"Analysts Have Conflicting Sentiments on These Healthcare Companies: Perrigo Company (PRGO), Cue Biopharma (CUE) and United Therapeutics (UTHR)",8/20/2024 11:01:09 AM
PRGO,Perrigo Company: A Strong Buy on Strategic Growth and Market Positioning,8/15/2024 10:58:05 AM
PRGO,"Perrigo recalls baby formula sold at CVS, H-E-B stores",8/9/2024 3:07:02 PM
PRGO,"PRGO Stock Earnings: Perrigo Beats EPS, Misses Revenue for Q2 2024",8/2/2024 2:54:12 PM
PRGO,Perrigo Q2 2024 Earnings Preview,8/1/2024 3:51:54 PM
PRGO,Perrigo’s Market Advantage and Operational Upside Prompt Buy Rating,7/30/2024 10:57:06 AM
PRGO,Abbott Labs (ABT) Stock Falls on Baby Formula Ruling. What to Know.,7/29/2024 2:50:19 PM
PRGO,Perrigo Company: A Strong Buy on Robust Brand Growth and Strategic Retail Expansion,7/24/2024 11:09:15 AM
PRGO,Analysts Offer Insights on Healthcare Companies: Perrigo Company (PRGO) and CVRx (CVRX),7/11/2024 11:10:27 AM
PRGO,Buy Rating Affirmed for Perrigo on Opill’s Market Potential and Supreme Court Backing,6/14/2024 12:16:13 PM
PRGO,"Analysts’ Top Healthcare Picks: Perrigo Company (PRGO), Teva Pharmaceutical (TEVA)",6/13/2024 10:42:34 AM
PRGO,Perrigo Company: Strong Buy on Effective Debt Reduction and Business Transformation Potential,6/5/2024 11:35:28 AM
PRGO,Perrigo Company (PRGO) Gets a Buy from Piper Sandler,6/3/2024 10:55:52 AM
PRGO,"Perrigo Q1 Earnings Surpass, Sales Miss Estimates",5/9/2024 4:41:03 PM
PRGO,Perrigo’s Resilience Amidst Challenges: A Buy Rating Based on Recovery Prospects and Growth Opportunities,5/8/2024 11:31:34 AM
PRGO,"PRGO Stock Earnings: Perrigo Beats EPS, Misses Revenue for Q1 2024",5/7/2024 2:53:49 PM
PRGO,Notable earnings before Tuesday's open,5/6/2024 3:08:27 PM
PRGO,Perrigo declares $0.276 dividend,5/1/2024 2:17:52 PM
PRGO,Piper Sandler Sticks to Its Buy Rating for Perrigo Company (PRGO),4/29/2024 10:49:19 AM
PRGO,Perrigo’s Strategic Divestiture Prompts Buy Rating from Analyst Susan Anderson,4/26/2024 12:07:13 PM
PRGO,Esteve Healthcare To Buy Perrigo's HRA Pharma Rare Diseases Business For Up To EUR 275 Mln ,4/25/2024 12:35:28 PM
PRGO,Disney To Rally Around 10%? Here Are 10 Top Analyst Forecasts For Monday,4/8/2024 2:00:37 PM
PRGO,Piper Sandler Remains a Buy on Perrigo Company (PRGO),4/5/2024 10:47:16 AM
PRGO,CVS Health to cover Perrigo OTC birth control pill,4/4/2024 7:36:46 PM
PRGO,"Perrigo launches Opill, first OTC birth control pill in U.S.",3/19/2024 3:15:23 PM
PRGO,Reckitt unsure how many cases have been filed over Enfamil: report,3/18/2024 5:04:35 PM
PRGO,"Perrigo has no exposure to infant formula litigation, CG says",3/15/2024 10:00:41 PM
PRGO,Perrigo’s Strategic Shift to Self-Care and Infant Formula Sector Poised for Growth Beyond 2024,3/14/2024 11:16:30 AM
PRGO,Teva upgraded at J.P. Morgan on upcoming catalysts,3/8/2024 3:21:57 PM
PRGO,Perrigo starts shipments of first OTC birth control pill,3/4/2024 10:30:25 PM
PRGO,Hidden Gems: 3 Market Underdogs to Buy at Rock-Bottom Prices,3/3/2024 3:32:48 PM
PRGO,Around $2M Bet On Tile Shop Holdings? Check Out These 4 Stocks Insiders Are Buying,3/1/2024 2:48:40 PM
PRGO,Why Helix Energy Solutions Shares Are Trading Lower By 11%? Here Are Other Stocks Moving In Tuesday's Mid-Day Session,2/27/2024 7:18:56 PM
PRGO,Perrigo raises quarterly dividend by 1.1% to  $0.276/share,2/26/2024 9:38:40 PM
PRGO,Emergent surges 66% as it brings in Bausch + Lomb vet Papa as CEO,2/21/2024 6:11:49 PM
PRGO,Watch GSK amid evidence hearing on Zantac litigation,1/23/2024 8:00:40 PM
PRGO,Piper Sandler Remains a Buy on Perrigo Company (PRGO),1/12/2024 12:37:32 PM
PRGO,Piper Sandler Issues a Buy Rating on Perrigo Company (PRGO),1/3/2024 12:51:25 PM
PRGO,Personal Care Industry Poised For Growth: Analyst Initiates Coverage On These 3 Stocks,11/17/2023 8:54:40 PM
PRGO,Perrigo Company’s Stock: A Buy Rating Amid Margin Improvements and Potential Upside from Opill Launch,11/8/2023 12:43:34 PM
PRGO,Perrigo Cuts FY23 Adj. Earnings View Below Market; Stock Down In Premarket - Update ,11/7/2023 12:57:53 PM
PRGO,Here's what Wall Street expects from Perrigo Company's earnings report,11/6/2023 3:01:14 PM
PRGO,"Perrigo to Release Third Quarter 2023 Financial Results on November 7, 2023",10/24/2023 3:54:00 PM
PRGO,Cramer Says This AI Company 'Actually Lived Up To Their Hype': Stock Is Up 148% This Year,10/3/2023 2:23:08 PM
PRGO,Three stocks strategies heading into Q4 from Goldman,9/15/2023 10:46:50 AM
PRGO,"Perrigo, Reckitt receive FDA warning letters over baby formula",8/30/2023 9:43:06 PM
PRGO,Perrigo Company plc Q2 Earnings Summary,8/8/2023 12:36:58 PM
PRGO,Perrigo Q2 2023 Earnings Preview,8/7/2023 4:46:53 PM
PRGO,PERRIGO ANNOUNCES QUARTERLY DIVIDEND,8/2/2023 4:19:00 PM
PRGO,PRGO Stock Alert: Perrigo Climbs on Landmark FDA Birth Control Decision,7/14/2023 2:48:42 PM
PRGO,"FDA Approves Perrigo's Opill, The First Over-the-counter Birth Control Pill ",7/13/2023 3:16:21 PM
PRGO,Biden to sign executive order broadening access to contraception,6/23/2023 12:16:47 PM
PRGO,Perrigo Appoints Patrick Lockwood-Taylor As President And CEO ,6/8/2023 1:54:13 PM
PRGO,"COUNTRY STAR MITCHELL TENPENNY AND PREVACID ANNOUNCE ""BEAT THE BURN"" - A LIVE TIK TOK CONCERT TO SING AWAY STRESS",5/16/2023 5:43:00 PM
PRGO,GSK says Canadian court dismisses potential Zantac class suit,5/12/2023 8:56:41 AM
PRGO,FDA Panel Votes In Favor Of Perrigo's Birth Control Pill For OTC Use ,5/11/2023 5:26:33 AM
PRGO,Perrigo OTC birth control pill endorsed by FDA committees,5/10/2023 6:14:30 PM
PRGO,"Perrigo: Murray Kessler To Retire; Delivers Double-digit Top Line Growth In Q1, Reaffirms Outlook ",5/9/2023 12:51:21 PM
PRGO,Perrigo Q1 2023 Earnings Preview,5/8/2023 4:37:54 PM
PRGO,"Earnings Week Ahead: Fox Corporation, Disney, Airbnb, and more",5/5/2023 6:00:36 PM
PRGO,Perrigo declares $0.273 dividend,5/4/2023 1:30:36 PM
PRGO,Perrigo says IRS throws out $843M tax adjustment,4/25/2023 2:01:22 PM
PRGO,Firefly® Expands Its Commitment to Sustainability with Free Recycling Program,4/6/2023 2:00:00 PM
PRGO,"Perrigo: FDA Reschedules Joint Meeting Of NDAC, And ORUDAC To Review Application For Opill OTC Use ",3/28/2023 3:21:45 PM
PRGO,GSK stock falls after California court ruling on Zantac; company disagrees with decision,3/24/2023 11:29:58 AM
PRGO,Perrigo gains amid new long call at Hedgeye,3/20/2023 2:47:34 PM
PRGO,Insiders Selling Perrigo And 3 Other Stocks,3/10/2023 3:07:21 PM
PRGO,"Perrigo a new buy at Canaccord Genuity with focus on self-care products, cost savings",3/7/2023 5:27:30 PM
PRGO,Raymond James Reaffirms Their Buy Rating on Perrigo Company (PRGO),3/5/2023 12:45:24 PM
PRGO,Perrigo : FDA Approves Store Brand OTC Equivalent Of Advil Dual Action Tablets ,3/1/2023 3:41:27 PM
PRGO,Perrigo Company expects 2023 non-GAAP EPS below consensus,2/28/2023 1:28:12 PM
PRGO,Perrigo Company plc Q4 Earnings Summary,2/27/2023 11:08:59 PM
PRGO,Notable earnings after Monday's close,2/26/2023 10:35:56 PM
PRGO,"Catalyst watch: Tesla event, Microsoft talks OpenAI, Rivian earnings and Chevron",2/24/2023 7:00:00 PM
PRGO,Perrigo raises dividend by 5% to $0.273/share,2/21/2023 1:33:09 PM
PRGO,Imported baby formula to face US tariffs again in 2023 - WSJ,12/28/2022 4:45:41 PM
PRGO,7 Perfect Presents to Gift Your 2023 Stock Portfolio ,12/21/2022 9:57:02 PM
PRGO,GSK ready to defend claims at state level after federal judge dismisses Zantac suits,12/7/2022 9:51:40 AM
PRGO,Why did Sanofi stock jump up today? Zantac litigation tossed out by judge,12/6/2022 9:23:30 PM
PRGO,‘Long-term investors should turn back toward stocks’: J.P. Morgan says inflation has peaked and suggests 2 stocks to buy,11/10/2022 3:12:53 PM
PRGO,Why Party City Holdco Shares Tumbled Over 40%; Here Are 98 Biggest Movers From Yesterday,11/9/2022 11:08:43 AM
PRGO,Why TaskUs Shares Are Trading Higher By 37%? Here Are 77 Stocks Moving In Tuesday's Mid-Day Session,11/8/2022 6:51:49 PM
PRGO,Notable earnings before Tuesday's open,11/7/2022 4:03:42 PM
PRGO,Perrigo declares $0.26 dividend,11/3/2022 4:05:40 PM
PRGO,Perrigo Announces Strategic Investment to Expand and Strengthen U.S. Manufacturing of Infant Formula,11/1/2022 9:01:00 PM
PRGO,Perrigo: FDA Postpones Meeting To Review Additional Information Requested Related To Opill ,10/26/2022 3:14:58 PM
PRGO,"Benzinga's Top Ratings Upgrades, Downgrades For September 14, 2022",9/14/2022 4:07:37 PM
PRGO,Perrigo: FDA Schedules Joint Advisory Committee Meeting To Review Application For Opill For OTC Use ,9/12/2022 3:50:26 PM
PRGO,"Benzinga's Top Ratings Upgrades, Downgrades For September 6, 2022",9/6/2022 4:09:04 PM
PRGO,"Sanofi, GSK gains as Citi sees limited impact from Zantac claims",8/26/2022 2:12:25 PM
PRGO,Perrigo responds to 'misleading and inaccurate information' on Zantac claims,8/17/2022 9:12:23 PM
PRGO,Perrigo Expects To Achieve FY22 Constant Currency Adj. EPS Range Outlook ,8/9/2022 1:01:52 PM
PRGO,Perrigo Q2 2022 Earnings Preview,8/8/2022 6:17:38 PM
PRGO,Perrigo declares $0.26 dividend,8/2/2022 1:26:18 PM
PRGO,"The Daily Biotech Pulse: Europe Approves Second Round Of Booster Doses of mRNA COVID-19 Vaccines, Perrigo Seeks Approval For First OTC Birth Control Pill, MacroGenics Closes Head & Cancer Study...",7/11/2022 2:56:25 PM
PRGO,Endo International up 99% on more than 26x normal volume,6/28/2022 7:05:20 PM
PRGO,This $5B Pharmaceutical Could Benefit From Over-The-Counter Contraceptives And Plan B Alternatives,6/27/2022 11:06:46 PM
PRGO,Perrigo's omeprazole mini capsules for heartburn gets FDA nod,5/26/2022 1:44:07 PM
PRGO,Danone ramps up baby formula shipments to U.S. after Abbott recall - Reuters,5/20/2022 1:09:55 PM
PRGO,"U.S. to offer transport, logistics support to baby formula makers to overcome shortage",5/16/2022 5:04:30 PM
PRGO,Perrigo CEO Kessler says to expect baby formula shortage through rest of year - Reuters,5/13/2022 5:44:27 PM
PRGO,Perrigo Company plc Q1 Earnings Summary,5/11/2022 12:36:51 PM
PRGO,Perrigo Q1 2022 Earnings Preview,5/10/2022 4:19:47 PM
PRGO,Perrigo declares $0.26 dividend,5/5/2022 12:38:27 PM
PRGO,"Cannabis Movers & Shakers: MedMen's New CEO, TerrAscend, FoliuMed, Charlotte's Web & Proof Announce Appointments",4/29/2022 3:24:13 PM
PRGO,Perrigo Company launches syndication of new senior credit facilities,3/28/2022 11:46:55 AM
PRGO,Perrigo CFO Ray Silcock to retire,3/24/2022 8:29:43 PM
PRGO,Perrigo granted FDA approval for over-the-counter use of Nasonex Allergy,3/17/2022 8:59:37 PM
PRGO,Here's what to expect from Perrigo Company's earnings,3/1/2022 3:01:13 PM
PRGO,Perrigo Q4 2021 Earnings Preview,2/28/2022 7:39:01 PM
PRGO,Perrigo raises dividend by 8.3% to $0.26/share,2/16/2022 6:01:20 PM
PRGO,Perrigo Expands Occupational Health Program with Premise Health's Digital Wellness Center,2/3/2022 3:05:00 PM
PRGO,4 Stocks Insiders Are Buying,12/20/2021 10:04:05 AM
PRGO,Top stocks that may be tax loss selling bargains,12/4/2021 11:33:25 PM
PRGO,Perrigo to delist from Tel Aviv Stock Exchange,11/22/2021 2:11:02 PM
PRGO,76 Biggest Movers From Yesterday,11/11/2021 11:29:59 AM
PRGO,55 Stocks Moving In Wednesday's Mid-Day Session,11/10/2021 6:05:54 PM
PRGO,Perrigo Q3 2021 Earnings Preview,11/9/2021 6:10:22 PM
PRGO,Perrigo Company Plans To Name Orlando Ashford Chairman - Quick Facts ,11/8/2021 2:40:10 PM
PRGO,Earnings to watch: where Wall Street is most bullish and bearish,11/5/2021 8:28:34 PM
PRGO,Perrigo declares $0.24 dividend,11/2/2021 4:00:01 PM
PRGO,"Perrigo To Release Third Quarter 2021 Financial Results On November 10, 2021",10/27/2021 2:34:00 PM
PRGO,"Benzinga's Top Ratings Upgrades, Downgrades For October 14, 2021",10/14/2021 5:18:23 PM
PRGO,51 Biggest Movers From Yesterday,10/1/2021 10:44:15 AM
PRGO,36 Stocks Moving In Thursday's Mid-Day Session,9/30/2021 6:09:37 PM
PRGO,8 F-Rated Stocks to Sell in September,9/10/2021 12:56:38 PM
PRGO,54 Biggest Movers From Yesterday,9/9/2021 10:49:38 AM
PRGO,Perrigo To Acquire HRA Pharma For Approx. $2.1 Bln - Quick Facts ,9/8/2021 12:57:06 PM
PRGO,Why Are Match Group Shares Trading Higher Today?,9/7/2021 3:29:16 PM
PRGO,"Match Group, Ceridian HCM and Brown & Brown Set to Join S&P 500; Others to Join S&P MidCap 400 and S&P SmallCap 600",9/4/2021 12:55:00 AM
PRGO,The trend is your friend -- what stock market strategy worked in August,9/1/2021 4:56:12 PM
PRGO,3 Undervalued Dividend Stocks to Buy For High Total Returns,8/17/2021 11:14:26 AM
PRGO,66 Biggest Movers From Yesterday,8/12/2021 11:27:10 AM
PRGO,"What Did the Stock Market Do Today, Aug. 11? 3 Big Stories to Catch Up On.",8/11/2021 8:59:30 PM
PRGO,Notable earnings before Wednesday's open,8/10/2021 1:55:31 PM
PRGO,Here's what Wall Street expects from Perrigo Company's earnings,8/9/2021 3:02:04 PM
PRGO,Perrigo Announces Quarterly Dividend,8/3/2021 4:39:00 PM
PRGO,7 F-Rated Stocks to Avoid for the Rest of 2021,8/2/2021 2:52:07 PM
PRGO,FTC drops antitrust complaint against AbbVie after Supreme Court declines case review,7/30/2021 6:35:26 PM
PRGO,"Perrigo To Release Second Quarter 2021 Financial Results On August 11, 2021",7/28/2021 3:00:00 PM
PRGO,Perrigo rises as analyst calls news on Irish tax claim 'clearly a plus',7/14/2021 6:22:37 PM
PRGO,Perrigo trims the estimated Irish tax bill,7/13/2021 9:06:22 PM
PRGO,Stay Away From Low-Growth Organon,7/8/2021 4:27:00 PM
PRGO,Perrigo Completes Divestiture Of Generic Rx Business For $1.55 Billion,7/6/2021 10:33:00 PM
PRGO,Supreme Court declines to hear Abbvie challenge over AndroGel patent,6/21/2021 3:43:05 PM
PRGO,Perrigo To Divest Latin American Businesses To Advent Int'l For Undisclosed Terms - Quick Facts ,5/18/2021 2:44:25 PM
PRGO,Perrigo slips as Irish authorities reject settlement of €1.6B tax bill,5/13/2021 12:49:45 PM
PRGO,Perrigo in discussions to settle $1.9B Irish tax bill,5/11/2021 7:51:38 PM
PRGO,Perrigo Q1 2021 Earnings Preview,5/10/2021 5:27:59 PM
PRGO,Undervalued Perrigo Is A Dividend Stock to Have And to Hold,5/4/2021 7:17:26 PM
PRGO,Perrigo declares $0.24 dividend,4/19/2021 2:36:17 PM
PRGO,"The Past Week's Notable Insider Buys Include Coupang, Keurig Dr Pepper, IPOs And More",3/21/2021 12:39:46 PM
PRGO,Perrigo stock surges despite Q4 beats consensus,3/1/2021 4:10:05 PM
PRGO,Perrigo Company PLC hosts conference call for investors,2/28/2021 2:59:32 PM
PRGO,Perrigo Company earnings preview: what Wall Street is expecting,2/27/2021 3:01:20 PM
PRGO,Perrigo Q4 2020 Earnings Preview,2/26/2021 7:54:11 PM
PRGO,Perrigo declares $0.24 dividend,2/23/2021 5:18:13 PM
PRGO,"Notable Insider Buys Of The Past Week: Howard Hughes, Party City, Perrigo And More",1/9/2021 10:34:10 PM
PRGO,"Benzinga's Top Upgrades, Downgrades For January 6, 2021",1/6/2021 4:14:45 PM
PRGO,Perrigo stock surges despite Q3 skipping beat,11/5/2020 4:59:32 PM
PRGO,Perrigo Company plc Q3 adjusted earnings Beat Estimates,11/4/2020 10:16:36 PM
PRGO,Perrigo Q3 Earnings Preview,11/3/2020 5:36:07 PM
PRGO,Perrigo declares $0.225 dividend,10/22/2020 3:05:13 PM
PRGO,Perrigo Recalls Albuterol Sulfate Inhalation Aerosols Due To Clogging Concerns ,9/17/2020 2:03:17 PM
PRGO,Perrigo To Acquire Three Eastern European OTC Self-Care Brands From Sanofi - Quick Facts ,8/11/2020 3:42:47 PM
PRGO,Perrigo Reaffirms FY20 Adj. Earnings Guidance - Quick Facts ,8/5/2020 2:20:09 PM
PRGO,What Wall Street expects from Perrigo Company's earnings,8/4/2020 3:03:46 PM
PRGO,Perrigo To Divest U.K-based Generic Prescription Pharmaceuticals Business - Quick Facts ,6/19/2020 2:28:21 PM
PRGO,Perrigo Enters CBD Business With $50 Mln Strategic Investment In Kazmira ,6/18/2020 7:00:04 AM
PRGO,Perrigo Enters Into Cannabidiol Market Through Investment In Kazmira ,6/17/2020 2:38:16 PM
PRGO,Perrigo readies debt offering,6/16/2020 1:18:01 PM
PRGO,States go after generic drugmakers for alleged price-fixing,6/10/2020 3:39:35 PM
PRGO,"SLNO Fails To Whet Investors' Appetite, OPNT And EBS Slump On Court Ruling, ENOB On Track ",6/9/2020 6:33:18 AM
PRGO,J.P. Morgan picks spec pharma favorites after earnings,5/19/2020 8:07:51 PM
PRGO,Perrigo Company plc Q1 adjusted earnings Beat Estimates,4/30/2020 12:41:49 PM
PRGO,Perrigo Company earnings: here's what Wall Street expects,4/29/2020 3:02:39 PM
PRGO,COVID-19 demand stoked Q1 growth for Perrigo,4/7/2020 10:01:35 PM
PRGO,Perrigo: FDA Approves Voltaren Arthritis Pain For Nonprescription ,4/6/2020 2:57:09 PM
PRGO,Ranitidine products to be removed from U.S. market - FDA,4/1/2020 3:52:27 PM
PRGO,Piper Sandler likes Gilead ahead of expected FDA nod for remdesivir for Covid-19,3/20/2020 11:12:31 AM
PRGO,Perrigo Company Down 14% ,2/28/2020 10:06:16 AM
PRGO,Perrigo slips 5% premarket on Q4 results,2/27/2020 1:02:39 PM
PRGO,Here's what Wall Street expects from Perrigo Company's earnings report,2/26/2020 3:02:11 PM
PRGO,"NIO, FCEL among premarket gainers",2/25/2020 2:24:15 PM
PRGO,Perrigo to buy High Ridge Brands' oral care assets,2/24/2020 6:07:41 PM
PRGO,Stock Alert: Perrigo Shares Up After Preliminary Results ,1/15/2020 11:34:35 AM
PRGO,10 Small-Cap Stocks to Buy Before They Grow Up,12/17/2019 11:05:37 AM
PRGO,"3 Big Stock Charts for Thursday: Facebook, Perrigo, and Alteryx",11/21/2019 12:23:46 PM
PRGO,Perrigo Posts Q3 Profit; Lifts 2019 Adj. Profit View ,11/6/2019 12:14:53 PM
PRGO,"Drug Companies Issue Recalls For Ranitidine, Zantac In US ",10/24/2019 5:46:20 PM
PRGO,Perrigo Recalls Ranitidine Due To Possible Presence Of NDMA ,10/23/2019 10:28:38 PM
PRGO,Perrigo Settles Patent Litigation On Generic Version Of Nascobal Nasal Spray ,8/21/2019 2:59:16 PM
PRGO,Perrigo Reaffirms FY19 Adj. EPS Outlook - Quick Facts ,8/8/2019 12:45:31 PM
PRGO,Here's what Wall Street expects from Perrigo Company's earnings,8/6/2019 3:03:04 PM
PRGO,Perrigo Raises 2019 Adj. Profit View; Stock Up ,7/2/2019 3:15:09 PM
PRGO,Perrigo Recalls Baby Formula Sold Only At Walmart Due To Metal Contamination ,6/23/2019 9:30:21 PM
PRGO,Perrigo To Buy Privately-held Ranir Global Holdings For $750 Mln ,5/9/2019 1:34:49 PM
PRGO,Perrigo Co. Q1 adjusted earnings Beat Estimates,5/8/2019 11:30:22 PM
PRGO,Here's what Wall Street expects from Perrigo Company's earnings,5/6/2019 3:02:38 PM
PRGO,"Perrigo Settles Patent Litigation For Generic Version Of Finacea Foam, 15% ",4/2/2019 2:12:22 PM
PRGO,Perrigo Appoints Ray Silcock As CFO ,3/20/2019 11:02:28 PM
PRGO,Perrigo Gets FDA Approval For Generic Version Of Finacea Foam ,3/18/2019 11:14:43 PM
PRGO,Perrigo Company Q4 Earnings Miss Street ,2/27/2019 10:17:50 PM
PRGO,Here's what Wall Street expects from Perrigo Company's earnings report,2/25/2019 3:01:48 PM
PRGO,Perrigo Shares Up 10% As Appeal Deadline For €1.6 Bln Irish Tax Bill Nears ,12/26/2018 8:00:16 PM
PRGO,Perrigo Remains Sharply Lower After Early Sell-Off ,12/21/2018 8:55:10 PM
PRGO,Perrigo Receives FDA's First To File Generic Version Of Ultravate Lotion ,11/26/2018 3:41:10 PM
PRGO,"MDXG Delisted, ENDP Boosts Outlook, AKAO Hits New Low, ReShape Deflated ",11/9/2018 3:35:23 AM
PRGO,Perrigo Co. Q3 adjusted earnings Beat Estimates,11/8/2018 12:27:18 PM
PRGO,Perrigo Company earnings preview: what Wall Street is expecting,11/6/2018 3:03:08 PM
PRGO,Perrigo Climbs Off Worst Levels But Remains Firmly Negative ,10/9/2018 8:09:28 PM
PRGO,Perrigo Settles Patent Litigation On Generic Version Of Picato Gel ,9/28/2018 3:12:22 PM
PRGO,Perrigo : FDA Oks Store Brand OTC Equivalent Of Imodium Multi-Symptom Relief ,9/7/2018 3:12:22 PM
PRGO,"Perrigo Profit Tops View, Cuts FY18 Forecast; Plans To Separate Rx Unit ",8/9/2018 6:46:52 AM
PRGO,Perrigo Company earnings preview: what to expect,8/7/2018 3:03:39 PM
PRGO,"Hikma Pharma Signs Licensing, Distribution Agreement With Omega Pharma ",7/9/2018 10:27:02 AM
PRGO,Perrigo to Present at the Jefferies 2018 Healthcare Conference,5/30/2018 2:30:00 PM
PRGO,"Perrigo Confirms First To File Patent Challenge For Generic Version Of Ultravate® Lotion, 0.05%",5/14/2018 3:25:00 PM
PRGO,Perrigo Expects Complete Response Letter On Generic Version Of ProAir®,5/11/2018 10:01:00 PM
PRGO,Perrigo Co. Q1 adjusted earnings of $1.26 per share,5/8/2018 6:37:58 AM
PRGO,Perrigo Announces Quarterly Dividend,5/3/2018 3:41:00 PM
PRGO,Amneal And Impax Receive FTC Clearance For Business Combination,4/28/2018 12:50:00 AM
PRGO,"Perrigo To Release First Quarter Calendar Year 2018 Financial Results On May 8, 2018",4/24/2018 2:53:00 PM
PRGO,Perrigo Launches Novel Omeprazole Orally Disintegrating Tablet to Treat Frequent Heartburn,4/11/2018 3:41:00 PM
PRGO,"Impax Launches a Generic Version of Estrace® Cream (estradiol vaginal cream, USP, 0.01%)",4/6/2018 1:33:00 PM
PRGO,Perrigo Announces Final FDA Approval and Planned Launch for the Store Brand OTC Equivalent of Mucinex® DM Maximum Strength Extended Release Tablets,3/7/2018 2:49:00 PM
PRGO,Perrigo Co. Q4 Income Climbs,3/1/2018 11:09:18 PM
PRGO,Perrigo 2017 Net Sales Decline 6.3% - Quick Facts ,2/27/2018 7:33:24 AM
PRGO,"Perrigo Confirms Patent Challenge For Generic Version Of Finacea® Foam, 15%",2/20/2018 2:17:00 PM
PRGO,Perrigo Announces Quarterly Dividend,2/15/2018 3:18:00 PM
PRGO,"Perrigo To Release Fourth Quarter And Calendar Year 2017 Financial Results On February 27, 2018",2/8/2018 2:14:00 PM
PRGO,"Perrigo Announces Tentative FDA Approval For The Generic Version Of Soolantra® Cream, 1%",1/30/2018 2:17:00 PM
PRGO,Perrigo Announces Tentative FDA Approval For The Generic Version Of Onexton® Gel,1/26/2018 6:53:00 PM
PRGO,Perrigo Launches AB Rated Generic Version Of Epiduo Gel ,1/24/2018 2:16:43 PM
PRGO,"Perrigo Appoints Gerresheimer's Former CEO Uwe Röhrhoff As President, CEO ",1/8/2018 7:26:55 AM
PRGO,Perrigo Announces Tentative FDA Approval For The Generic Version Of Prolensa® Ophthalmic Solution 0.07%,1/3/2018 2:09:00 PM
PRGO,Perrigo Announces the Launch of an AB Rated Generic Version of Mycolog® II Cream,11/27/2017 3:24:00 PM
PRGO,Perrigo Company Completes Divestiture Of API Business For $110 Million,11/21/2017 2:36:00 PM
PRGO,Perrigo Company to Present at the Stifel 2017 Healthcare Conference,11/10/2017 7:20:00 PM
PRGO,Perrigo Co. Earnings Advance 12% In Q3,11/9/2017 7:22:37 AM
PRGO,Perrigo Company plc Announces Quarterly Dividend,11/2/2017 6:09:00 PM
PRGO,"Perrigo To Release Third Quarter 2017 Financial Results On November 9, 2017",10/26/2017 3:18:00 PM
PRGO,Perrigo Announces Tentative FDA Approval For A First-To-File Generic Version Of Picato® Gel .015%,10/24/2017 3:08:00 PM
PRGO,Perrigo Announces First-To-Market Launch Of The OTC Store Brand Equivalent Of Nexium® 24HR Capsules,9/27/2017 2:30:00 PM
PRGO,Perrigo:FDA Oks AB Rated Generic Version Of Exalgo 32mg Extended Release Tablets ,9/21/2017 3:38:31 PM
PRGO,Perrigo Announces Tentative FDA Approval For The Generic Version Of Acanya® Gel,9/18/2017 2:45:00 PM
PRGO,Perrigo Company To Present At Upcoming Investor Conferences,8/30/2017 3:01:00 PM
PRGO,Perrigo Announces Final FDA Approval And Settlement For The Store Brand OTC Equivalent Of Nexium® 24HR Capsules,8/21/2017 3:00:00 PM
PRGO,Perrigo: FDA Approves AB Rated Generic Version Of Mycolog II Cream ,8/16/2017 3:00:54 PM
PRGO,"""FCA Replay"" Wraps the Week",8/11/2017 5:00:00 PM
PRGO,SK Capital To Buy Perrigo's Active Pharma Ingredients Business ,8/10/2017 4:44:44 PM
PRGO,Perrigo Company plc Announces Quarterly Dividend,8/8/2017 4:51:00 PM
PRGO,"AQB Reaps A Bounty, CLSN Ends Dual Listing, MNK Opens Wallet, OMER On Watch ",8/7/2017 7:08:33 AM
PRGO,Perrigo Announces Tentative FDA Approval For Generic Version Of Mirvaso® Gel,8/4/2017 3:20:00 PM
PRGO,"Today's Research Report Coverage on Healthcare Stocks -- Perrigo, Immune Pharma, Tonix Pharma, and United Therapeutics",8/1/2017 12:20:00 PM
PRGO,"Perrigo : FDA Oks AB Rated Generic Version Of DermOtic Oil, 0.01% Ear Drops ",7/19/2017 3:08:09 PM
PRGO,Perrigo Company Retains Spencer Stuart for CEO Search,6/21/2017 3:50:00 PM
PRGO,Perrigo Announces the Launch of Hydrocodone Bitartrate and Homatropine Methylbromide Oral Solution,6/19/2017 3:13:00 PM
PRGO,Perrigo Company plc Announces Pricing for its Cash Tender Offer,6/14/2017 7:38:00 PM
PRGO,Perrigo CEO John Hendrickson To Retire ,6/6/2017 4:34:34 AM
PRGO,Perrigo Announces Forthcoming Retirement Of CEO John Hendrickson,6/5/2017 10:55:00 PM
PRGO,Perrigo Company To Present At The Jefferies 2017 Healthcare Conference,6/2/2017 2:03:00 PM
PRGO,Perrigo Unveils $1.4 Bln Cash Tender Offer For Certain Notes ,5/31/2017 1:45:53 PM
PRGO,Perrigo Co. Announces 21% Decline In Q1 Profit,5/30/2017 11:25:48 PM
PRGO,Perrigo Announces Two New Independent Directors,5/8/2017 2:16:00 PM
PRGO,Perrigo Alert: J&W Investigates Perrigo Company plc after U.S. Department of Justice Issues Search Warrants; All Investors Encouraged to Contact Firm,5/3/2017 5:23:00 PM
PRGO,Perrigo To Restate Certain Financial Statements ,4/26/2017 5:32:57 AM
PRGO,Perrigo Announces Restatement Of Previously Issued Forms 10-K And 10-Q Financial Statements; Announces Select Preliminary Unaudited First Quarter 2017 Financial Results,4/25/2017 10:03:00 PM
PRGO,Perrigo Completes Divestiture Of Tysabri® Royalty Stream For Up To $2.85 Billion,3/27/2017 10:01:00 PM
PRGO,"Lifshitz & Miller LLP Announces Investigation of Aratana Therapeutics, Inc., FXCM Inc., Innocoll Holdings plc, Momenta Pharmaceuticals, Inc., Omnicom Group Inc., Perrigo Company plc, Santander...",3/25/2017 12:01:00 AM
PRGO,"How These Healthcare Stocks are Faring? -- BioScrip, Community Health Systems, Perrigo, and Health Insurance Innovations",3/24/2017 12:35:00 PM
PRGO,Perrigo Provides Update On 2016 Form 10-K Filing,3/16/2017 9:01:00 PM
PRGO,Perrigo Announces First-To-Market Launch Of The OTC Store Brand Equivalent To Women's Rogaine® Foam,3/8/2017 2:35:00 PM
PRGO,Perrigo Provides 2016 Form 10-K Update,3/7/2017 10:03:00 PM
