Ticker,Title,Link
NKE,Time100 Most Influential Companies: What 61 Publicly Traded Companies Are On The Inaugural List?,4/28/2021 8:23:40 PM
NKE,"Benzinga's Top Ratings Upgrades, Downgrades For April 20, 2021",4/20/2021 4:04:33 PM
NKE,7 Big Companies Powerful Enough to Pivot Their Business,4/19/2021 7:28:22 PM
NKE,ESG Investing: Ultimate Guide to ESG Stocks,4/16/2021 7:51:15 PM
NKE,It Looks as If the Reddit Party Is Over for Naked Brands Group,4/15/2021 1:38:47 PM
NKE,'Nike Refurbished' To Help Reduce Its Waste Footprint ,4/14/2021 7:46:25 PM
NKE,The Dow Jones Was Mixed Today. Here's Why.,4/12/2021 10:51:55 PM
NKE,"Exclusive: Roundhill MVP First Pure-Play Sports ETF Offers Growth, SPACs, Exposure To NFTs",4/8/2021 4:40:05 PM
NKE,Moody's - Apparel industry: increasing environmental and social scrutiny to create long term challenges,4/7/2021 10:57:00 AM
NKE,7 Cheap Stocks That Won’t Be on Discount for Long,4/6/2021 3:50:56 PM
NKE,"Two Words Scream, “Avoid Castor Maritime Stock”",4/1/2021 6:31:45 PM
NKE,7 of the Most Active Stocks on the Market (And Why),3/31/2021 4:04:00 PM
NKE,7 Recession-Proof Safe Stocks to Keep Close At All Times,3/29/2021 5:45:11 PM
NKE,"Is Now The Time To Buy Stock In Microsoft, Disney, Apple Or Nike?",3/27/2021 2:56:38 PM
NKE,The S&P 500 Soared Today. Here's Why.,3/26/2021 9:30:44 PM
NKE,Nike falls following boycott calls in China over statement about forced labor of Uyghurs,3/25/2021 2:30:05 PM
NKE,"NIKE, Inc. -- Moody's announces completion of a periodic review of ratings of NIKE, Inc.",3/23/2021 10:45:00 PM
NKE,50 Biggest Movers From Friday,3/22/2021 8:27:06 AM
NKE,30 Stocks Moving In Friday's Mid-Day Session,3/19/2021 5:16:52 PM
NKE,Nike Inc Profit Rises In Q3,3/18/2021 9:20:39 PM
NKE,Nike Q3 2021 Earnings Preview,3/17/2021 9:35:56 PM
NKE,7 Stocks for Neanderthals to Stack Up and Buy,3/16/2021 3:23:20 PM
NKE,Redditors: AMC Stock’s Chinese Owners Just Brought $20 Back Into View,3/15/2021 6:43:21 PM
NKE,7 Stocks to Buy That Are Cheering for March Madness,3/10/2021 6:22:32 PM
NKE,"Big Gains Are Still to Come at Bed, Bath and Beyond",3/3/2021 6:32:17 PM
NKE,What Are NFTs? 13 Things to Know About Non-Fungible Tokens.,2/26/2021 8:34:43 PM
NKE,"Benzinga's Top Ratings Upgrades, Downgrades For February 25, 2021",2/25/2021 4:03:18 PM
NKE,7 of the Best Stocks To Buy as a New Investor,2/23/2021 10:11:49 AM
NKE,Nike brand impresses across the board in BTIG survey,2/22/2021 4:37:58 PM
NKE,9 Sports and Entertainment Stocks to Consider as Covid Numbers Drop,2/18/2021 4:53:27 PM
NKE,"Q4 13F Roundup: How Buffett, Einhorn, Ackman And Others Adjusted Their Portfolios",2/17/2021 8:44:10 PM
NKE,"GME, AMC and DOGE: Stop Worrying and Love the Bubble",2/12/2021 4:03:15 PM
NKE,Nike declares $0.275 dividend,2/11/2021 10:07:46 PM
NKE,7 Fidelity Index Funds That Belong on Your Shortlist,2/10/2021 9:07:31 PM
NKE,"Calceus Acquisition, Inc. -- Moody's downgrades Cole Haan's CFR to B3; negative outlook",2/8/2021 8:30:00 PM
NKE,7 Safe Growth Stocks to Put In Your Buy-and-Hold Portfolio,2/4/2021 10:46:47 AM
NKE,9 Mega-Cap Stocks Offering Hefty Opportunities,2/2/2021 1:44:27 PM
NKE,10 Biggest Price Target Changes For Monday,1/25/2021 2:22:10 PM
NKE,The 7 Best Stocks To Buy In The Dow Jones Today,1/19/2021 8:48:27 PM
NKE,"The Recovery Has Stalled, but the Technochasm Has Not",1/15/2021 10:15:29 PM
NKE,7 Fitness Stocks to Help You Meet Your New Year’s Resolution ,1/13/2021 7:24:40 PM
NKE,Ever-Glory Stock Is a Dark Horse in the Multi-Billion-Dollar Chinese Retail Market,1/7/2021 8:11:59 PM
NKE,"Tesla leads list of 2020's biggest winners on both S&P 500, Nasdaq 100",1/1/2021 12:30:56 AM
NKE,"Even if Hyliion’s Claims Are True, It Can’t Juke the Economy",12/29/2020 6:15:53 PM
NKE,"Benzinga's Bulls And Bears Of Christmas Week: Airbnb, Apple, Netflix, Nike, Tesla And More",12/26/2020 6:46:05 PM
NKE,Best Stocks For 2021: Bed Bath & Beyond (BBBY),12/22/2020 9:24:28 PM
NKE,9 Strong-Performing Stocks To Sell Before The End of The Year,12/21/2020 7:52:10 PM
NKE,"Klarna Could Follow Affirm Holdings In Delaying Anticipated 'Buy Now, Pay Later' Fintech IPO",12/19/2020 3:00:57 PM
NKE,Nike Inc Reports Advance In Q2 Bottom Line,12/18/2020 10:19:02 PM
NKE,Nike Q2 2021 Earnings Preview,12/17/2020 10:35:30 PM
NKE,3 Blue-Chip Stocks to Sell,12/16/2020 7:54:19 PM
NKE,Seeking Alpha Catalyst Watch,12/11/2020 8:30:29 PM
NKE,7 Cyclical Stocks That Likely Won’t Rise Again,12/9/2020 6:15:15 PM
NKE,7 Blue-Chip Stocks You Can Trust,12/8/2020 7:03:42 PM
NKE,"UPS Imposes Temporary Shipping Restrictions On Some Big Retailers Such As Nike, Macy's : Reports ",12/3/2020 4:51:02 AM
NKE,Dick’s Sporting Goods: The Prize for Survival,11/30/2020 4:38:42 PM
NKE,Cowen stares into at-home stocks (and Internet enablers) to find permanent winners,11/26/2020 12:32:20 AM
NKE,Nike is the Perfect Athleisure Play,11/20/2020 2:52:16 PM
NKE,Investment Trend Alert: Don’t Slip Into This Abyss,11/19/2020 2:17:57 PM
NKE,"Melvin Capital trims Microsoft, Amazon stakes, raises in Alphabet, Nike; enters Visa, Square",11/17/2020 5:14:50 PM
NKE,7 Cyclical Stocks To Buy Ahead Of An Economic Recovery,11/16/2020 9:18:54 PM
NKE,7 Electric Car Stocks Counting on Biden To Rev Up,11/10/2020 1:08:48 PM
NKE,"2 Pros, 2 Cons for China Nano-cap Ever-Glory International Group",11/9/2020 10:31:37 AM
NKE,Plug Power Is Likely to Win in a Biden Presidency,11/5/2020 11:01:10 PM
NKE,7 Top Stocks to Buy for November,11/3/2020 7:35:23 PM
NKE,Buy Under Armour Stock as the Turnaround Takes Hold,11/2/2020 10:17:02 PM
NKE,A Volatile Retail Sector Means More Income on Nike,10/30/2020 2:01:25 PM
NKE,"Peloton, Apple and Lululemon dominate in Evercore survey of young adults/teens",10/29/2020 4:08:43 PM
NKE,10 Consumer Stocks for a Reliable Portfolio,10/27/2020 5:31:06 PM
NKE,7 Thematic Mutual Funds to Add Some Spice to Your Portfolio,10/23/2020 4:32:10 PM
NKE,Why Under Armour Stock Is Due for a Monster 2021,10/22/2020 8:30:29 PM
NKE,The Next Stop for Crocs Shares Is $60,10/19/2020 4:26:55 PM
NKE,Biden Town Hall: 4 Key Investing Takeaways,10/16/2020 11:58:35 AM
NKE,9 Stocks to Buy for a Wild Ride in October,10/15/2020 11:30:19 PM
NKE,Now Is the Time to Find and Buy Your ‘Forever Stocks’,10/13/2020 6:00:40 PM
NKE,Q3 earnings ringing in; FactSet sees drop in earnings across sectors,10/12/2020 8:17:47 PM
NKE,Jump on These Nike Put Writes,10/9/2020 1:26:15 PM
NKE,"Crocs Are the World’s Biggest Fashion Trend, So Buy CROX Stock",10/7/2020 11:10:44 AM
NKE,"Nike, Beyond Meat and Ulta Beauty some of the brand winners with teens",10/6/2020 12:36:02 PM
NKE,7 Sizzling Hot Stocks to Buy Now Amid Even Hotter Politics,10/5/2020 1:00:54 PM
NKE,Best Stocks for 2020: Disney Stock Offers a Magical Blend of Risk and Reward,10/2/2020 2:52:00 PM
NKE,The 7 Top Robinhood Stocks for October,10/1/2020 4:40:21 PM
NKE,The Run In Nike Stock Has Come to An End,9/29/2020 3:22:15 PM
NKE,3 Stocks to Buy that Won on Earnings,9/25/2020 8:19:11 PM
NKE,7 Hot Stocks to Buy on Robinhood Now,9/24/2020 4:01:03 PM
NKE,"4 Top Stock Trades for Thursday: NKE, CHWY, JNJ, WORK",9/23/2020 8:57:04 PM
NKE,Nike Inc Announces Gain In Q1 Profit,9/22/2020 10:18:49 PM
NKE,3 Sports Stocks Robinhood Investors Are Buying,9/21/2020 1:17:30 PM
NKE,Nike is Setting New Highs Ahead of Earnings,9/18/2020 1:17:41 PM
NKE,7 Fitness Stocks to Buy for the Pandemic and Beyond,9/17/2020 1:48:59 PM
NKE,7 Fitness Stocks That Will Give Your Portfolio Some Muscle,9/11/2020 12:30:55 PM
NKE,3 Retail Stocks to Buy on the Dip,9/9/2020 6:41:08 PM
NKE,The 10 Best Long-Term Growth Stocks to Buy for the Next 10 Years,9/3/2020 1:15:56 PM
NKE,"Naked Brand Group Isn’t a Buy, But a Barometer",9/2/2020 10:15:52 AM
NKE,adidas AG -- Moody's assigns A2 rating to adidas' new senior unsecured notes,9/1/2020 9:45:00 AM
NKE,Trump Doesn’t Want You to Invest in Alibaba Stock,8/27/2020 4:39:53 PM
NKE,Mixed Messaging Leaves Under Armour Stock Floundering,8/26/2020 10:30:18 AM
NKE,15 Stocks to Buy Now for a ‘Vaxtober Surprise’,8/25/2020 12:04:54 PM
NKE,20 Stable Stocks to Buy If You’re Still Betting on America to Thrive,8/24/2020 11:19:04 PM
NKE,20 Best Blue-Chip Stocks for 2020 and Beyond,8/21/2020 8:56:38 PM
NKE,Invest in Fluz App to Get MLM Fun Without the Sleaze,8/17/2020 4:42:05 PM
NKE,3 of the Best Options Trades to Enter Now,8/14/2020 4:10:00 PM
NKE,Lululemon Athletica Is a Powerful Backstop for Your Portfolio,8/10/2020 5:12:53 PM
NKE,Invest in SoleSavy Stock to Get in on a Multi-Billion-Dollar Sneaker Niche,8/7/2020 9:01:03 AM
NKE,Under Armour Is Finally Fixing Its Branding Problem,8/6/2020 10:25:06 AM
NKE,3 Fitness Stocks for a Fit Portfolio,8/4/2020 6:35:20 PM
NKE,How to Invest in AllTheBelts Stock,8/3/2020 10:05:03 AM
NKE,Did $600 a Week Save the Stock Market?,7/30/2020 3:13:38 PM
NKE,Buy Alphabet Stock If It Dips After Q2 Earnings,7/29/2020 12:33:29 PM
NKE,9 Stocks for Beginners to Buy to Start Their Investing Experience,7/28/2020 6:23:45 PM
NKE,9 Cyclical Stocks Whose Time Is Coming Around,7/17/2020 2:36:42 PM
NKE,3 Great Stocks for Beginners During These Tough Times,7/13/2020 4:39:59 PM
NKE,Stick With Nike Stock for the Long Haul,7/10/2020 12:46:56 PM
NKE,Nike Stock has Recovered and is Probably Fully Priced Here,7/9/2020 9:16:54 AM
NKE,10 Sports Stocks to Buy When Games Return,7/7/2020 2:17:46 PM
NKE,Buy Chewy Stock on the Dip for 3 Major Reasons,7/6/2020 1:47:07 PM
NKE,Does Mirror Acquisition Make Lululemon Stock a Buy Again?,7/2/2020 5:20:51 PM
NKE,Don’t Chase Dying Retail Stocks Like J.C. Penney,7/1/2020 6:58:01 PM
NKE,Nike Stock Is Still a Buy Despite Rare Earnings Loss,6/29/2020 2:24:59 PM
NKE,7 U.S. Stocks to Buy on Renewed Coronavirus Weakness,6/26/2020 11:57:12 PM
NKE,EARNINGS SUMMARY: Details of Nike Inc Q4 Earnings Report,6/25/2020 10:17:19 PM
NKE,Here's what to expect from Nike's earnings report,6/24/2020 11:54:06 AM
NKE,Don’t Let Inevitably Ugly Earnings Dissuade You From Nike Stock,6/22/2020 2:33:40 PM
NKE,Lululemon Stock Will Thrive Regardless of Coronavirus Woes,6/18/2020 7:38:05 PM
NKE,Nike seen benefiting from long-term lifestyle changes,6/17/2020 4:22:19 PM
NKE,"Slow return of major sports could hit media giants, retailers and betting shops",6/16/2020 2:59:39 PM
NKE,7 China Stocks to Invest in as Economies Restart,6/15/2020 6:12:12 PM
NKE,It’s Time to Take a Bite Out of PepsiCo,6/11/2020 4:58:41 PM
NKE,15 Large-Cap Stocks Leading Wall Street’s Biggest Rally Ever,6/10/2020 11:22:48 AM
NKE,7 Apparel Stocks to Buy as Consumer Spending Recovers,6/8/2020 10:26:14 AM
NKE,7 Retail Stocks to Buy as Businesses Reopen,6/3/2020 12:47:29 PM
NKE,Nationwide protests force retail closures,6/1/2020 7:11:50 AM
NKE,NBA planning July 31 return - report,5/29/2020 8:03:53 PM
NKE,Investors give exercise stocks a workout,5/26/2020 6:10:39 PM
NKE,"Prepare to Profit, No Matter What the Market Does",5/21/2020 3:16:33 PM
NKE,3 Reasons to Buy the Post-Earnings Dip in Urban Outfitters Stock,5/20/2020 5:21:28 PM
NKE,"Dow Jones Today: Powell and Retail Do No Harm, Nor Much Help",5/19/2020 9:03:53 PM
NKE,"If You’re Bullish on the Internet, Be Bullish on Shopify Stock",5/18/2020 1:13:47 PM
NKE,Nike warns of fourth-quarter hit from virus-related store closures,5/14/2020 11:28:49 PM
NKE,10 Blue-Chip Stocks to Buy for Long-Term Safety,5/12/2020 5:44:32 PM
NKE,3 Reasons for Investors to Navigate the New Normal With Alibaba Stock,5/7/2020 6:32:59 PM
NKE,"NIKE, Inc. -- Moody's announces completion of a periodic review of ratings of NIKE, Inc.",5/6/2020 11:48:00 PM
NKE,Stock Alert: Nike Inc. ,5/5/2020 9:21:30 PM
NKE,"Calceus Acquisition, Inc. -- Moody's downgrades Cole Haan's CFR to B2",5/1/2020 9:26:00 PM
NKE,Stock Market Today: Jobless Claims Top 30 Million; Boeing Bonds Bonanza,4/30/2020 8:22:53 PM
NKE,Q1 Earnings Risks Exposing Under Armour’s Irrelevance,4/28/2020 3:55:26 PM
NKE,Adidas sees strong recovery for sporting goods,4/27/2020 9:03:56 AM
NKE,Earnings Highlight the Core Problem With Alcoa Stock,4/24/2020 5:27:40 PM
NKE,30 Consumer Stocks to Buy Once the Coronavirus Pandemic Passes,4/23/2020 6:32:19 PM
NKE,NBA looking to start next season around Christmas,4/21/2020 9:37:29 PM
NKE,3 Reasons to Stay the Course With Nike,4/20/2020 4:54:36 PM
NKE,Stock Alert: NIKE Rises 3% ,4/17/2020 4:28:26 PM
NKE,Dow Jones Today: Stocks Doomed By Dour Economic Data,4/15/2020 8:43:43 PM
NKE,Put Shares of Nike to Work and Collect Income,4/14/2020 1:21:46 PM
NKE,4 Fitness Stocks to Buy Now for a Fit Portfolio,4/9/2020 2:19:20 PM
NKE,Stock Market Today: Teens’ Favorite Brands Are Here,4/8/2020 8:17:54 PM
NKE,A Toxic Environment Forces UA Stock to Run in Place,4/7/2020 4:57:51 PM
NKE,Dow Jones Today: Signs of Virus Easing Spark Wall Street Rally,4/6/2020 8:46:16 PM
NKE,3 Reasons to Be Bullish on Alibaba Stock,4/3/2020 3:21:40 PM
NKE,7 Stocks to Sell That Need a Quick End to the Stay-at-Home Orders,4/2/2020 8:22:25 PM
NKE,Investors dress down the apparel sector,4/1/2020 5:21:23 PM
NKE,"Calceus Acquisition, Inc. -- Moody's changes Cole Haan's outlook to negative from stable; affirms ratings",3/27/2020 9:39:00 PM
NKE,7 Buyout Targets to Watch for in 2020,3/26/2020 2:53:50 PM
NKE,"4 Top Stock Trades for Thursday: AAPL, NKE, SPY, BA",3/25/2020 8:41:46 PM
NKE,Nike Inc Q3 Earnings Drop,3/24/2020 9:23:18 PM
NKE,Notable earnings after Tuesday's close,3/23/2020 9:35:52 PM
NKE,Lululemon Stock Has the Legs to Run Higher,3/20/2020 6:28:42 PM
NKE,Apparel stocks bounce back from lows,3/19/2020 6:28:16 PM
NKE,7 of the Last Decade’s Fastest-Growing Dividend Stocks,3/17/2020 7:16:35 PM
NKE,Stock Market Today: Trading Halt; Retail Folds as Apple Closes Up ,3/16/2020 8:25:12 PM
NKE,"Nike, Under Armour to close all U.S. stores due to coronavirus",3/15/2020 10:21:20 PM
NKE,Shockwaves in the sports world rattle investors,3/12/2020 3:41:20 PM
NKE,Sports stocks slammed as major event cancellations rise,3/11/2020 2:31:18 PM
NKE,Nike -7% amid market turmoil,3/9/2020 1:04:32 PM
NKE,Dow Jones Today: So Bad Nearly 10 Stocks Fell 4% or More,3/6/2020 9:24:26 PM
NKE,5 Big Reasons Stocks Will Rebound From the Coronavirus Selloff,3/4/2020 3:42:35 PM
NKE,Nike temporarily closes European HQ in the Netherlands due to coronavirus case,3/2/2020 2:56:23 PM
NKE,Athletics-Nike shoe debate rages as runners weigh advantages at U.S. Olympic trials,2/29/2020 2:16:38 AM
NKE,Stock Market Today: Buy These Stocks on Coronavirus Fears,2/27/2020 9:23:45 PM
NKE,8 of the Best Stocks to Buy for ESG Investors,2/25/2020 3:42:04 PM
NKE,7 Retail Stocks to Buy to Embrace Experiential Approaches,2/24/2020 7:40:09 PM
NKE,It Can Absolutely Get Worse for Under Armour Stock,2/20/2020 8:26:53 PM
NKE,"Stock Market Today: GE Tries to Skirt Boeing Issues; Buy Tesla, Nvidia?",2/19/2020 9:16:09 PM
NKE,UPDATE 2-Celebrity lawyer Michael Avenatti is found guilty in Nike extortion case,2/14/2020 9:25:28 PM
NKE,Under Armour Isn’t Protecting UAA Stock or Investors’ Houses,2/13/2020 3:39:48 PM
NKE,Dow Jones Today: Easing Coronavirus Concerns Propel Stocks Higher,2/12/2020 9:27:40 PM
NKE,"UPDATE 1-U.S. says Michael Avenatti shook down Nike, defense disagrees as extortion trial nears end",2/11/2020 10:00:00 PM
NKE,Collect on Coca-Cola’s New Highs,2/10/2020 2:26:37 PM
NKE,"UPDATE 2-Coach who hired Michael Avenatti says he wanted to expose Nike, not in press conference",2/7/2020 11:09:54 PM
NKE,Nike Introduces Air Zoom Mercurial ,2/6/2020 6:10:07 PM
NKE,REFILE-Nike warns of financial impact from coronavirus outbreak,2/4/2020 11:24:36 PM
NKE,"Dow Jones Today: A Coronavirus Rebound in the U.S., But Not China",2/3/2020 9:24:25 PM
NKE,UPDATE 4-Athletics-Nike prototype Vaporfly shoe banned but current version going to Olympics,2/1/2020 12:29:59 AM
NKE,7 Stocks to Buy for February Contrarians,1/30/2020 3:43:38 PM
NKE,"At trial, U.S. says Avenatti's greed fueled Nike extortion; defense says tenacity is no crime",1/29/2020 11:32:35 PM
NKE,Stock Market Today: Earnings Season Gets Intense; Buy Uber?,1/28/2020 9:35:01 PM
NKE,"UPDATE 1-Focus on Avenatti, U.S. judge says, as Trump critic's Nike extortion trial begins",1/27/2020 8:00:25 PM
NKE,Dow Jones Today: Coronavirus Vexes Stocks,1/24/2020 9:39:59 PM
NKE,Nike is Breaking Out,1/23/2020 1:57:32 PM
NKE,Judge excludes Trump critic Avenatti's financial strains from Nike extortion trial,1/22/2020 7:59:56 PM
NKE,Nike Stock Could Hit $120 in 2020,1/17/2020 3:45:59 PM
NKE,UPDATE 5-Trump antagonist Avenatti's bail is revoked; unhappy NY judge delays Nike extortion trial,1/15/2020 11:19:47 PM
NKE,9 Up-and-Coming Small-Cap Stocks to Watch,1/14/2020 5:06:24 PM
NKE,U.S. rejects Avenatti claim that 'document dump' justifies Nike trial delay,1/13/2020 10:00:33 PM
NKE,UPDATE 1-U.S. judge orders Michael Avenatti to face fraud charge as Nike trial looms,1/9/2020 6:49:25 PM
NKE,Soccer-Liverpool agree new kit deal with Nike,1/7/2020 9:56:31 AM
NKE,A 2019 Review of Dow Jones Stocks (And What 2020 May Bring),1/6/2020 7:03:48 PM
NKE,Avenatti says evidence he's cash-strapped doesn't belong in Nike extortion trial,1/3/2020 11:04:20 PM
NKE,Nike seeks to keep marketing executives out of Michael Avenatti trial,1/2/2020 9:16:43 PM
NKE,Stock Market Today: Nio Stock Doubles; NFL Ratings Climb,12/30/2019 9:29:11 PM
NKE,"Dow Jones Today: A Rally Boosted by Nike, Coca-Cola and More",12/27/2019 9:56:50 PM
NKE,Buying Nike Stock on Current Weakness Will Pay off Big,12/26/2019 7:06:19 PM
NKE,The 10 Greatest Investing Stories of the 2010s,12/23/2019 7:13:11 PM
NKE,Dow Jones Today: Data Does It Again,12/20/2019 9:28:54 PM
NKE,"Nike quarterly results beat, but North America disappoints",12/19/2019 10:40:11 PM
NKE,Dow Jones Today: Stocks Took a Pre-Holiday Breather,12/18/2019 9:27:08 PM
NKE,Michael Avenatti pleads not guilty to new Nike extortion indictment,12/17/2019 9:45:46 PM
NKE,Dow Jones Today: Lots of Headlines to Digest,12/16/2019 9:35:50 PM
NKE,Dow Jones Today: A Trade-Induced Hangover,12/13/2019 9:29:34 PM
NKE,Is Shopify Stock Going Back to All-Time Highs?,12/12/2019 2:56:51 PM
NKE,2 Big Reasons Why Under Armour Stock Could Rebound In 2020,12/11/2019 3:49:09 PM
NKE,Skechers' 'cool' value gives it room to run like Nike - Barron's,12/9/2019 3:48:37 AM
NKE,Dow Jones Today: Jobs Jubilee Sends Stocks Soaring,12/6/2019 9:21:50 PM
NKE,Dow Jones Today: Trade Influenced Stocks More Than Impeachment News,12/5/2019 9:29:26 PM
NKE,Dow Jones Today: A Terrible Tuesday,12/3/2019 9:31:08 PM
NKE,Stock Market Today: Holiday Shopping Records; Trade Tensions Renewed,12/2/2019 9:24:08 PM
NKE,Dick’s Sporting Goods Stock Could Rise on Strong Q3 Earnings,11/25/2019 7:03:08 PM
NKE,5 Strong Value Stocks to Buy As Treasury Yields Rise,11/22/2019 7:22:36 PM
NKE,Nike’s Strong Brand Will Help its Holiday Performance,11/18/2019 2:07:27 PM
NKE,Dow Jones Today: Stocks Climb on U.S.-China Trade Developments,11/15/2019 9:31:39 PM
NKE,Stock Market Today: Cannabis Gets Crushed,11/14/2019 9:25:58 PM
NKE,Dow Jones Today: Disney Was the Star of the Show Again,11/13/2019 9:35:57 PM
NKE,"Dow Jones Today: Disney Dominates, But It’s Not Enough",11/8/2019 9:26:59 PM
NKE,Dow Jones Today: Investors Wonder What Could Have Been,11/7/2019 9:32:25 PM
NKE,Electronic Arts’ Return to Steam Makes Total Sense for EA Stock,11/6/2019 6:59:34 PM
NKE,"NIKE, Inc. To Sell Hurley Brand - Quick Facts ",10/29/2019 10:31:09 PM
NKE,10 Stocks to Buy Regardless of Q3 Earnings,10/28/2019 3:38:45 PM
NKE,"UPDATE 6-Pence backs Hong Kong protests in China speech, slams NBA and Nike",10/25/2019 4:02:32 AM
NKE,"UPDATE 5-Pence backs Hong Kong protests in China speech, slams NBA and Nike",10/24/2019 11:46:24 PM
NKE,"Wall Street treads water as chip stocks, Nike fall",10/23/2019 9:13:42 PM
NKE,"NIKE CEO Mark Parker To Step Down In January, John Donahoe To Succeed ",10/22/2019 10:55:26 PM
NKE,3 Earnings Reports to Watch Next Week,10/18/2019 3:30:03 PM
NKE,Is All the Good News Priced Into Apple Stock?,10/17/2019 3:30:58 PM
NKE,"3 Big Stock Charts for Tuesday: Darden Restaurants, Nike and Apple",10/15/2019 11:36:02 AM
NKE,Dow Jones Today: Plenty of Trade Questions Need to be Answered,10/14/2019 8:46:30 PM
NKE,Athletics-Shutting down Nike Oregon Project the 'right thing' - USADA,10/12/2019 12:52:52 AM
NKE,"Dow Jones Today: A Partial, But Powerful Deal",10/11/2019 8:22:34 PM
NKE,3 Strong Stocks to Buy,10/10/2019 6:49:19 PM
NKE,10 Winning Stocks to Buy and Stick With for the Long Haul,10/9/2019 5:46:39 PM
NKE,Dow Jones Today: The Blacklist Buries Stocks,10/8/2019 8:43:18 PM
NKE,Constellation’s Involvement Still Is the Best Hope for CGC Stock,10/4/2019 1:10:11 PM
NKE,"Stock Market Roundup: NKE, NBEV Stocks Move With Help From Asian Countries",9/26/2019 7:59:35 PM
NKE,"Nike just blew past Wall Street's expectations, and experts say it's thanks to tech and taking risks like its Colin Kaepernick campaign (NKE)",9/25/2019 11:18:05 PM
NKE,UPDATE 1-Michael Avenatti withdraws request to subpoena Nike in U.S. extortion case,9/24/2019 11:45:24 PM
NKE,Stock Market Today: Sleepy Session as Earnings Lurk Ahead,9/23/2019 8:24:53 PM
NKE,lululemon & 2 Other Apparel Maker Stocks to Buy for Solid Returns,9/20/2019 1:39:00 PM
NKE,"NFL star Antonio Brown ""not a Nike athlete"", says company",9/19/2019 8:28:58 PM
NKE,"Dow Jones Today: Oil Slides, Investors Wait on Fed",9/17/2019 8:23:42 PM
NKE,7 Dow Titans Breaking Higher,9/16/2019 3:46:30 PM
NKE,Should Investors Buy Nike Stock Ahead of NKE’s Q1 Earnings?,9/10/2019 11:39:00 PM
NKE,"Calceus Acquisition, Inc. -- Moody's upgrades Cole Haan's CFR to B1",9/9/2019 10:12:00 PM
NKE,Nike is naming its new 'advanced innovation' building in its Oregon world headquarters after LeBron James (NKE),9/6/2019 6:33:06 PM
NKE,Supreme Nike SB Dunk Lows: 11 Things to Know About the Release,9/5/2019 4:49:18 PM
NKE,7 Triple Threat Growth Stocks to Buy for the Long Term,9/3/2019 7:13:14 PM
NKE,The 8 Worst Stocks to Buy Before the Trade Turmoil Cools Off,8/29/2019 3:51:43 PM
NKE,Nike Stock Is Outpacing the Market: What You Should Know,8/28/2019 9:45:23 PM
NKE,"3 Stocks to Trade Ahead of Earnings: ULTA, BBY, WDAY",8/27/2019 4:28:59 PM
NKE,Nike Stock Is a Long-Term Buy That Calls for Short-Term Patience,8/26/2019 12:49:58 PM
NKE,"Dow Jones Today: Hello Darkness, My Old Friend",8/23/2019 8:15:10 PM
NKE,"5 Top Stock Trades for Friday: SPLK, F, ULTA, TSLA, DKS",8/22/2019 7:58:26 PM
NKE,Dow Jones Today: Let’s Make a Deal,8/21/2019 8:13:35 PM
NKE,3 Big Reasons to Buy the Dip in Nike Stock,8/20/2019 5:20:21 PM
NKE,Avenatti says he did nothing wrongful in Nike extortion case,8/19/2019 10:32:12 PM
NKE,Dow Jones Today: A Fantastic Friday,8/16/2019 8:20:49 PM
NKE,UPDATE 2-Lawyer Avenatti seeks to end 'vindictive' Nike prosecution he blames on Trump feud,8/15/2019 4:46:19 PM
NKE,Nike Stock Is Set to Survive the Trade War,8/14/2019 4:02:05 PM
NKE,Dow Jones Today: It Was a Good Day…Finally,8/13/2019 8:13:47 PM
NKE,Stock Market Today: The Merger That Cried Wolf,8/12/2019 8:34:58 PM
NKE,Dow Jones Today: We’ve Seen This Movie Before,8/9/2019 8:11:58 PM
NKE,The Next Canopy Growth CEO Could Bring Stability to CGC Stock,8/8/2019 10:40:36 AM
NKE,NIKE Buys Celect - Quick Facts ,8/6/2019 11:25:18 PM
NKE,Using Nike to Increase Our Focus on Consumer Stocks,8/5/2019 1:32:39 PM
NKE,Dow Jones Today: Trade Trouble is a Real Problem,8/2/2019 8:21:03 PM
NKE,Under Armour sales growth in North America trails Nike again; shares sink,7/30/2019 6:57:57 PM
NKE,Report: Nike May Sell Hurley Brand ,7/25/2019 11:54:07 PM
NKE,"Nike shoes race to $437,500 world record auction price for sneakers",7/23/2019 11:54:45 PM
NKE,7 Stocks to Buy This Summer Earnings Season,7/22/2019 3:55:13 PM
NKE,LULU Stock Stretches to New All-Time Highs,7/17/2019 4:53:43 PM
NKE,Nike x Stranger Things: 11 Things to Know About the OG Collection,7/12/2019 4:27:10 PM
NKE,Nike stocks ended on a high note after controversy over 'Betsy Ross flag' sneaker (NKE),7/7/2019 12:03:03 AM
NKE,Dow Jones Today: What’s Good Can Sometimes Be Bad,7/5/2019 8:52:25 PM
NKE,3 Athletics Retail Stocks to Buy,7/3/2019 3:38:48 PM
NKE,Arizona cancels incentive for Nike plant after 'terrible decision' to recall sneaker: governor,7/2/2019 10:27:06 PM
NKE,Nike Stock Continues to Show Us That It’s Still a King,6/28/2019 2:32:00 PM
NKE,"Nike Q4 Earnings Miss Street, Revenue Tops ",6/27/2019 11:11:56 PM
NKE,"Dow Jones Today: Steady, But Some Patches of Excitement",6/26/2019 8:40:29 PM
NKE,"Dow Jones Today: A Sleepy Start to the Week, But Hold On",6/24/2019 8:28:13 PM
NKE,6 Stocks to Sell in the Back Half of 2019,6/21/2019 2:08:32 PM
NKE,The 7 Best Dow Jones Stocks to Buy for the Rest of 2019,6/20/2019 6:20:55 PM
NKE,6 Stocks Ready to Bounce on a Trade Deal,6/19/2019 4:12:59 PM
NKE,UPDATE 1-Michael Avenatti gets trial date over alleged Nike extortion,6/18/2019 10:40:13 PM
NKE,3 Consumer Discretionary ETFs That Could Heat Up This Summer,6/13/2019 6:48:32 PM
NKE,6 Growth Stocks That Could Be the Next Big Thing,6/12/2019 6:35:32 PM
NKE,7 Stocks to Buy As They Hit 52-Week Lows,6/7/2019 7:05:50 PM
NKE,Nike 'very concerned' about rape accusation against Brazilian soccer star Neymar,6/6/2019 10:18:21 PM
NKE,"Dow Jones Today: Finally, The Markets See Some Relief",6/4/2019 8:19:32 PM
NKE,"UPDATE 4-Avenatti pleads not guilty to extorting Nike, ripping off Stormy Daniels",5/29/2019 12:06:59 AM
NKE,"UPDATE 3-Avenatti pleads not guilty to extorting Nike, ripping off Stormy Daniels",5/28/2019 11:35:04 PM
NKE,"UPDATE 1-Tennis-Nike learned from their pregnancy mistake, says Williams",5/27/2019 9:43:10 PM
NKE,Nike to waive performance targets for pregnant athletes - report,5/25/2019 12:52:07 PM
