Ticker,Title,Link
NKE,"UPDATE 5-Trump antagonist Avenatti indicted for ripping off Stormy Daniels, extorting Nike",5/22/2019 11:51:33 PM
NKE,"Nike, Adidas Beg Trump: Please, No Tariffs ",5/21/2019 4:21:29 PM
NKE,"UPDATE 1-Nike, Under Armour, among others, urge Trump to remove footwear from tariff list",5/20/2019 9:06:55 PM
NKE,Nike Says Change Pregnancy Policy In Athlete Contracts ,5/18/2019 11:18:44 AM
NKE,Athletics-British runner Pavey says Nike froze sponsorship when pregnant,5/17/2019 2:32:55 AM
NKE,Nike reveals a new form of tech to find shoppers' perfect shoe size (NKE),5/9/2019 1:39:03 PM
NKE,"Washington (County of) OR -- Moody's assigns Aaa to Washington County, OR's Full Faith and Credit Refunding Obligations, Series 2019",5/3/2019 12:40:00 AM
NKE,Nike founder Phil Knight only hired accountants and lawyers to lead the company in its early days — here's why (NKE),4/16/2019 4:15:03 PM
NKE,Tiger Woods' Masters win gives Nike investors another reason to cheer,4/15/2019 4:20:39 PM
NKE,Beyoncé's collaboration with Adidas could help the company win over a key customer — and Nike should be terrified (NKE),4/13/2019 3:27:05 PM
NKE,Tennis-World number one Osaka signs with Nike,4/5/2019 6:57:54 AM
NKE,"Lululemon soars on menswear, online push; inches into Nike turf",3/28/2019 5:02:48 PM
NKE,CORRECTED-UPDATE 8-Trump foe Avenatti charged with trying to extort $20 mln from Nike,3/26/2019 3:30:00 PM
NKE,UPDATE 5-Trump critic Michael Avenatti arrested in $20 mln Nike 'shakedown' -prosecutors,3/25/2019 10:48:33 PM
NKE,Nike shares dip on North America weakness but Wall Street remains upbeat,3/22/2019 2:39:31 PM
NKE,"Nike misses North America revenue estimates, shares drop",3/21/2019 9:38:55 PM
NKE,Here's what Wall Street expects from Nike's earnings report,3/20/2019 3:01:30 PM
NKE,UPDATE 1-Soccer-Nike unveils 14 national kits in women's World Cup push,3/11/2019 5:54:11 PM
NKE,Nike to sponsor China's League of Legends esports league,2/28/2019 7:21:13 PM
NKE,Nike stumbles into social media storm after basketball star's shoe splits,2/21/2019 7:59:49 PM
NKE,Nike says it's working to fix the problem that's causing its new $350 self-lacing sneakers to break (NKE),2/20/2019 11:09:04 PM
NKE,A popular Nike sneaker is facing backlash from Muslims who say its logo looks like the Arabic script for 'Allah' (NKE),1/31/2019 5:39:03 PM
NKE,"Calceus Acquisition, Inc. -- Moody's upgrades Cole Haan's CFR to B2; assigns B2 to proposed First Lien Term Loan",1/23/2019 11:06:00 PM
NKE,Nike has revealed a futuristic new self-lacing sneaker that's half the price of its original model as it charts a course for 'footwear to firmware' (NKE),1/15/2019 10:00:03 PM
NKE,"Nike, Lululemon, and Gap want to cash in on a major trend of men caring more about their appearance (NKE, LULU, GPS)",1/13/2019 4:39:03 PM
NKE,"Nike has a monster rally ahead as it appears to be solving biggest problem, analyst says (NKE)",1/10/2019 6:48:04 PM
NKE,"Nike says it's going to make cooler, cheaper sneakers as sales soar (NKE)",12/21/2018 6:12:08 PM
NKE,Nike Q2 Results Beat Wall Street; Shares Up 8% ,12/20/2018 11:49:33 PM
NKE,Nike is about to announce its earnings — here's what to expect,12/19/2018 3:01:18 PM
NKE,Nike gave us a glimpse into the store of the future this year (NKE),12/18/2018 10:45:04 PM
NKE,"Nike Posting Notable Gain After Citi Calls Stock ""Best Idea"" For 2019 ",12/3/2018 7:03:08 PM
NKE,"Nike is opening a 68,000-square-foot flagship store of the future in New York City (NKE)",11/14/2018 10:36:04 PM
NKE,Nike hires former Coca-Cola executive as Jordan Brand president,11/13/2018 11:34:55 PM
NKE,Flex Ltd. -- Moody's says reduced revenue and cash flow expectations for Flex are credit negative; no immediate impact on ratings or outlook,11/6/2018 12:12:00 AM
NKE,Moody's: Outlook for US apparel and footwear industry changed to positive on higher-than-expected earnings,10/31/2018 5:12:00 PM
NKE,"Calceus Acquisition, Inc. -- Moody's changes Cole Haan's outlook to positive from stable; affirms B3 CFR",10/25/2018 9:03:00 PM
NKE,UPDATE 2-USA Gymnastics interim CEO quits after anti-Nike tweet,10/17/2018 12:59:00 AM
NKE,REFILE-UPDATE 1-Sponsors EA and Nike say concerned about Ronaldo rape claims,10/5/2018 9:41:18 AM
NKE,"Amazon and Nike are charting a course for the store of the future (AMZN, NKE)",9/29/2018 3:57:03 PM
NKE,Nike shares dip after forecast disappoints,9/26/2018 9:30:16 PM
NKE,UPDATE 2-Nike profit tops targets but margins disappoint some,9/25/2018 11:56:55 PM
NKE,What Wall Street expects from Nike's earnings,9/24/2018 3:01:17 PM
NKE,"Walmart's Jet.com Redesigns Website, Launches Grocery Service ",9/13/2018 4:48:27 PM
NKE,Nike is 'marching back to top form' — and its Kaepernick ad shows its renewed strength (NKE),9/12/2018 1:36:07 PM
NKE,"Colin Kaepernick's ""Just Do It"" Campaign Boosts Nike Sales ",9/7/2018 8:42:26 PM
NKE,A new poll suggests that Nike's reputation is taking a beating over its Colin Kaepernick ad (NKE),9/6/2018 9:06:04 PM
NKE,"Nike's Colin Kaepernick ad doesn't show him doing what made him controversial, and it's a brilliant strategic move (NKE)",9/5/2018 8:48:04 PM
NKE,Trump says Nike ad featuring Colin Kaepernick sends 'a terrible message' (NKE),9/4/2018 11:42:04 PM
NKE,UPDATE 2-NFL's Kaepernick to be face of Nike 'Just Do It' campaign,9/3/2018 11:41:15 PM
NKE,Nike stores in South Africa reopen following backlash over racist video,8/24/2018 5:15:54 PM
NKE,"A new sneaker deal shows how important Nike is becoming to Foot Locker  — and it could be a boom for both companies (FL, NKE)",8/23/2018 5:54:06 PM
NKE,Nike stores closed in South Africa amid outcry over racist web post,8/22/2018 2:24:10 PM
NKE,"Nike and Whole Foods are following Walmart's lead and signaling a new era for online shopping (NKE, AMZN, WMT)",8/19/2018 4:00:05 PM
NKE,"Nike's new, high-tech store takes a page out of Walmart's and Target's playbook (NKE)",8/16/2018 5:48:04 PM
NKE,2 former employees are suing Nike over alleged pay discrimination at the company (NKE),8/10/2018 5:30:08 PM
NKE,UPDATE 4-Adidas shares jump as North America growth outpaces Nike,8/9/2018 3:38:28 PM
NKE,"Nike To Give 7,000 Employees Salary Hike ",7/23/2018 11:58:41 PM
NKE,"Foot Locker, Inc. -- Moody's affirms Foot Locker's Ba1 CFR",7/19/2018 10:59:00 PM
NKE,Nike just opened a brand-new store that could change sneaker buying forever (NKE),7/12/2018 10:45:03 PM
NKE,UPDATE 1-Nike favored to beat soccer juggernaut Adidas at World Cup,7/4/2018 12:10:53 AM
NKE,Nike favored to beat soccer juggernaut Adidas at World Cup,7/3/2018 6:50:08 PM
NKE,UPDATE 4-Tennis-Federer faces ID crisis in switch from Nike to Uniqlo,7/2/2018 7:02:07 PM
NKE,Wall Street ekes out gain as Nike surges,6/29/2018 11:32:59 PM
NKE,Nike beats revenue estimates on new launches,6/28/2018 10:22:55 PM
NKE,Ahead Of Nike's Q4 Results ,6/27/2018 1:13:42 PM
NKE,Nike is winning over new customers and it could 'dramatically increase prices' (NKE),6/21/2018 6:48:03 PM
NKE,Bob Evans Restaurants® Declares July National Road Trip Month,6/20/2018 2:00:00 PM
NKE,One telling data point shows Nike is dominating Adidas in sneakers (NKE),6/12/2018 4:30:06 PM
NKE,UPDATE 1-Adidas takes 12-10 lead over Nike in World Cup shirt deals,6/2/2018 11:16:49 AM
NKE,Adidas takes 12-10 lead over Nike in World Cup shirt deals,5/30/2018 2:57:04 PM
NKE,UPDATE 1-Four more Nike executives exit as harassment inquiry continues,5/8/2018 6:31:54 PM
NKE,Nike CEO Reportedly Apologizes To Employees For Toxic Corporate Culture ,5/4/2018 5:22:18 AM
NKE,"BRIEF-Nike Announces Amy Montagne As New VP, GM Of Global Categories",5/1/2018 12:01:46 AM
NKE,Nike reportedly spent millions on a canceled ad that featured men in sports bras and a woman pole dancing (NKE),4/30/2018 8:15:04 PM
NKE,Urban Ashes Receives Top Honor in University of Michigan Positive Business Competition,4/26/2018 3:00:00 PM
NKE,"CORRECTED-BRIEF-Nike Says Greg Thompson, Vice President Of Express Lane Footwear, Has Left The Company (April 18)",4/19/2018 7:18:33 PM
NKE,BRIEF-Nike Inc's VP Of Diversity And Inclusion Antoine Andrews Has Left Company- Spokeswoman,4/16/2018 9:55:17 PM
NKE,NIKE Buys Invertex ,4/10/2018 6:20:57 AM
NKE,BRIEF-Nike Inc Acquires Computer Vision Leader Invertex,4/9/2018 10:31:30 PM
NKE,"Nike exec says co needs to step up promotion of women, minorities",4/5/2018 3:20:01 AM
NKE,"BRIEF-NFL, Nike Announce Long-Term Extension For On-Field Rights‍​",3/27/2018 11:10:29 PM
NKE,Nike Remains Firmly Positive After Gapping Open Higher ,3/23/2018 6:20:18 PM
NKE,BRIEF-Nike Expects Q4 Revenue To Grow In High Single-Digit Range- Conf. Call‍​,3/22/2018 11:08:31 PM
NKE,Glassdoor reviews of Nike's headquarters allege there's a 'boys-club' atmosphere — and now a second exec is out (NKE),3/16/2018 5:54:05 PM
NKE,Nike is showing 3 signs it can turn around its sneaker slump (NKE),3/12/2018 6:51:04 PM
NKE,"Here's the best way to play the 'rise of sneaker culture' (FL, NKE)",3/2/2018 9:15:04 PM
NKE,"Nike defeats appeal over iconic Michael Jordan photo, Jumpman logo",2/27/2018 9:01:51 PM
NKE,"Under Armour and Nike are stealing a page out of Adidas' playbook — and it's a brilliant move (NKE, UAA, ADIDAS)",2/19/2018 4:15:04 PM
NKE,Nike is dominating Adidas in the sneaker war (NKE),2/9/2018 8:15:04 PM
NKE,"Calceus Acquisition, Inc. -- Moody's upgrades Cole Haan to B3, stable outlook",2/2/2018 9:21:00 PM
NKE,Nike pops after billionaire activist Bill Ackman says he owns a stake (NKE),1/26/2018 3:57:04 PM
NKE,Nike at two-year high as analysts tout margin benefits of direct sales,1/19/2018 8:02:26 PM
NKE,Nike is going into 'battleship' mode to launch itself to the top of the hot athletic apparel market (NKE),1/11/2018 5:30:06 PM
NKE,Soccer-Nike advertise Coutinho name on Barcelona shirt (NKE),1/1/2018 7:02:03 AM
NKE,"GLOBAL MARKETS-Wall St wanes ahead of holiday; Catalan vote hits euro, Spanish stocks (NKE, UNH, BANMEDICA, UKX)",12/22/2017 11:02:04 PM
NKE,UPDATE 1-Nike's profit tops estimates but margins dip on weak N. America demand (NKE),12/21/2017 10:57:08 PM
NKE,Nike is leaving its iconic Niketown property — and the fact that Trump owns it is reportedly a factor (NKE),12/6/2017 8:39:03 PM
NKE,"Adidas expects big boost from soccer World Cup (ADS, NKE, PUM)",12/2/2017 1:07:03 PM
NKE,Nike's SNKRS App Raises Internet Ire ,11/21/2017 4:50:02 PM
NKE,"Shiekh Shoes owner says retailer seeks financing to avoid bankruptcy (NKE, PUM, ADS)",11/18/2017 2:47:03 AM
NKE,"US STOCKS-Wall St slips on worries over tax plan's progress (CMCSA, VZ, ANF, GPS, FL, SCVL, HIBB, NKE)",11/17/2017 7:02:03 PM
NKE,Nike and Adidas have entirely different ideas of how to take over the US (NKE),11/15/2017 8:57:03 PM
NKE,"Calceus Acquisition, Inc. -- Moody's says Cole Haan's Q1 fiscal year 2018 results are credit positive; no current ratings impact",11/10/2017 1:31:00 AM
NKE,"Adidas reports more strong growth in N.America, China (ADS, NKE)",11/9/2017 8:07:06 AM
NKE,"RPT-BUZZ-U.S. stocks weekly: More treats than tricks (T, TWX, NKE, ADS, HD, LOW, AAPL, TSLA, MSFT, AMZN, NFLX)",11/6/2017 1:27:06 PM
NKE,"BUZZ-U.S. stocks weekly: More treats than tricks (T, TWX, NKE, ADS, HD, LOW, AAPL, TSLA, MSFT, AMZN, NFLX)",11/3/2017 9:22:03 PM
NKE,"US STOCKS-Mondelez, tech stocks lift S&P, Nasdaq (K, PFE, NKE, QCOM, AAPL)",10/31/2017 3:12:12 PM
NKE,"Tiger Woods is expected to plead guilty to reckless driving in Florida (5108, NKE)",10/27/2017 12:02:15 PM
NKE,"GLOBAL MARKETS-Euro drops after ECB trims stimulus; Treasury yields higher (F, NKE)",10/26/2017 9:27:13 PM
NKE,"Nike gives upbeat forecast at investor conference, shares rise",10/25/2017 10:03:27 PM
NKE,Nike’s biggest sneaker advantage could become its biggest liability (NKE),10/24/2017 4:39:03 PM
NKE,"London the starting line as Adidas laces up robotic shoe run (NKE, ADS)",10/20/2017 2:47:16 PM
NKE,There's a simple formula that explains how Nike lost its sneaker mojo (NKE),10/19/2017 9:15:08 PM
NKE,"UPDATE 1-Puma raises outlook for third time this year (PUM, ADS, NKE)",10/18/2017 4:47:03 PM
NKE,Nike's 'unprecedented' 40% off sale reveals how big the brand's problems are (NKE),10/12/2017 6:51:03 PM
NKE,Soccer-Ronaldo and Messi make it safely to World Cup but no U.S. (NKE),10/11/2017 2:27:03 PM
NKE,Nike's youth basketball league has reportedly been hit with subpoenas in connection with the college basketball bribery scandal (NKE),9/28/2017 5:15:04 PM
NKE,"US STOCKS-Wall St gains on financials boost, tax hopes (BAC, GS, NKE)",9/27/2017 10:17:08 PM
NKE,"UPDATE 1-Nike's quarterly profit beats on strong China demand (NKE, AMZN, ADS, PUM)",9/26/2017 10:52:56 PM
NKE,BRIEF-Nike recasts segment financials in connection with the Consumer Direct Offense (NKE),9/25/2017 11:32:07 PM
NKE,"BRIEF-Nike says ‍phyllis Wise, director, notified co of her decision not to stand for re-election as director at co's 2017 annual meeting of shareholders​ (NKE)",9/22/2017 10:37:21 PM
NKE,"WELLS FARGO: The athletic apparel boom is over - here's who will be hit hardest (UAA, NKE, LULU, FINL)",9/19/2017 7:03:04 PM
NKE,"NIKE EXEC: 'We've elevated the Amazon experience' (NKE, AMZN)",9/14/2017 8:42:16 PM
NKE,"Steph Curry slams Under Armour haters: 'you can’t tell me nobody wants to wear our shoes' (UA, NKE)",9/11/2017 5:48:03 PM
NKE,"Lululemon is leaning toward men to bolster growth (LULU, NKE, GPS, DKS)",9/1/2017 6:12:05 PM
NKE,"US STOCKS-Wall St ends higher as fear over North Korea dissipates (BBY, UTX, COL, NKE)",8/29/2017 10:27:07 PM
NKE,"Daily Technical Summary Reports on Textile Stocks -- NIKE, Coach, Foot Locker, and Skechers",8/28/2017 12:25:00 PM
NKE,"U.S. retailers hit as immigration worries weigh on Hispanic spending (ORLY, TGT, NLSN, BBY, NKE, SKX, VFC, WMT)",8/24/2017 1:02:04 PM
NKE,"US STOCKS-S&P 500 index gains after recent selloff; energy stocks fall (NKE, FL, JCI, HLF)",8/21/2017 11:57:07 PM
NKE,"US STOCKS-Wall St ends down after more White House turmoil (DE, NKE, FL, HIBB)",8/18/2017 11:42:10 PM
NKE,"BRIEF-Soros Fund Management dissolves share stake in IBM (IBM, NKE)",8/15/2017 12:02:07 AM
NKE,The Growth of Sales in Sportswear,8/10/2017 8:31:00 PM
NKE,"UPDATE 6-Soccer-Neymar signs five-year deal to complete world record PSG move (NKE, 6752)",8/3/2017 11:57:03 PM
NKE,"In rare bipartisan display, U.S. Democrats back Trump on China trade probe (NKE, FLIR, SCHN, NUE, X)",8/2/2017 9:02:03 PM
NKE,"Athletics-Bolt ready to race, and really ready to retire (ADS, PUM, NKE)",8/1/2017 9:02:03 PM
NKE,"UPDATE 1-Adidas sells ice hockey brand to Birch Hill for $110 million (ADS, NKE)",7/27/2017 5:08:03 PM
NKE,BRIEF-Nike CEO Mark Parker's 2017 total compensation $13.9 mln vs $47.6 mln in 2016 - SEC filing (NKE),7/26/2017 12:18:03 AM
NKE,Morgan Stanley predicts this will be Nike's next billion dollar shoe (NKE),7/20/2017 7:32:06 PM
NKE,"BRIEF-Nike Inc appoints Monique Matheson as new EVP, global human resources (NKE)",7/18/2017 11:08:03 PM
NKE,Nike's New High-Tech Sports Bra ,7/14/2017 11:32:36 PM
NKE,BRIEF-Nike's Philip Knight reports acquisition co's stock as a result of a private pro rata distribution from Swoosh (NKE),7/7/2017 10:44:03 PM
NKE,Nike's core business is facing a 'disturbing' decline (NKE),7/3/2017 7:40:08 PM
NKE,Nike-Amazon deal may hurt sporting goods retailers: analysts,6/30/2017 8:13:12 PM
NKE,"UPDATE 1-Nike's profit, revenue top estimates on lower costs (NKE)",6/29/2017 10:52:03 PM
NKE,Nike is taking a page right out of its biggest rival's playbook (NKE),6/26/2017 6:06:06 PM
NKE,Oil's drop could leave a stain on earnings,6/25/2017 7:04:03 PM
NKE,Wall St Week Ahead-Oil's drop could leave a stain on earnings (NKE),6/23/2017 7:04:08 PM
NKE,Nike Reportedly Agrees To Sell Some Items Directly To Amazon ,6/22/2017 4:36:02 AM
NKE,Nike designed a shoe just for dads — and it's flying off the shelves (NKE),6/21/2017 7:54:25 PM
NKE,"US STOCKS-Wall St dips as Amazon-Whole Foods deal slams retailers (COST, KR, WFM, IBM, AAPL, BAH, NKE)",6/16/2017 4:14:03 PM
NKE,"US STOCKS-Tech sputters again, dragging Wall Street lower (AAPL, AMZN, NKE, KR)",6/15/2017 10:28:03 PM
NKE,"SHAREHOLDER ALERT: Bronstein, Gewirtz & Grossman, LLC Announces Investigation of NIKE, Inc. (NIKE)",6/14/2017 10:46:00 PM
NKE,"Millennials would love to work for these 9 companies (GOOGL, NKE, DIS, AMZN, MSFT, NFLX, AAPL, SNE)",6/12/2017 9:12:08 PM
NKE,"Technical Research on Textile Equities -- NIKE, Skechers, Coach, and Wolverine World Wide",6/9/2017 12:00:00 PM
NKE,"Adidas optimistic new shoe models will drive U.S. recovery (ADS, NKE)",6/8/2017 7:44:10 PM
NKE,Nike Keeps Football Star From Running To Adidas ,5/24/2017 7:39:42 PM
NKE,"Hedge fund Hoplite pitches Nike as long bet, sees shares doubling (NKE)",5/18/2017 10:10:09 PM
NKE,"BRIEF-J C Penney CEO -""Have no great optimism we'll be able to swing overall apparel to positive (in 2017)"" (JCP, ADS, NKE)",5/12/2017 4:56:05 PM
NKE,"UPDATE 1-Adidas sells golf unit Taylormade to buyout group KPS (ADS, NKE, PP, ELY)",5/10/2017 9:36:05 PM
NKE,"BRIEF-AIK Fotboll starts new cooperation with Nike from 2018 (AIK , NKE)",5/9/2017 12:38:02 PM
NKE,"UPDATE 1-Athletics-Kipchoge runs fastest marathon but misses sub-2hr goal (NKE, ADS)",5/6/2017 10:54:03 PM
NKE,"Strong Adidas quarter driven by N. America, ecommerce (ADS, NKE)",5/4/2017 8:00:07 AM
NKE,"RPT-FEATURE-Athletics-Nike's African trio target sub-two hour marathon (ADS, NKE)",5/3/2017 6:58:07 AM
NKE,"FEATURE-Athletics-Nike's African trio target sub-two hour marathon (NKE, ADS)",5/2/2017 12:04:05 PM
NKE,"Athletics-Bekele was not wearing 'Breaking2 shoes', say Nike (NKE)",4/25/2017 1:11:08 PM
NKE,BRIEF-Nike says board approved amendments to company's third restated bylaws (NKE),4/24/2017 1:11:08 PM
NKE,"Research Reports on Textile Equities -- NIKE, Coach, Skechers, and Fossil",4/20/2017 12:05:00 PM
NKE,"Guthy-Renker Ventures Invests In DERMAFLASH, The Inventor Of At-Home Dermaplaning",4/18/2017 12:00:00 PM
NKE,"RPT-'Trump Trade' winners switch into battered retail, biotech shares (NKE, WFT, WLL, RF, AAPL, TSLA, PLI)",4/13/2017 1:05:18 PM
NKE,"Under Armour stock could rise more than 30 pct in a year -Barron's (KSS, NKE, ADS)",4/3/2017 5:28:53 AM
NKE,"Options Trading Reports: Advanced Micro Devices, Hewlett Packard Enterprise Company, Netflix, Nike, and Dave & Buster's, include trade ideas that offer returns of 20% or more",3/30/2017 3:31:00 PM
NKE,"Stock Options Reports: Covered Call Trades for American Airlines, Mattel Inc, Nike, NVIDIA and Walmart Stores Inc.",3/23/2017 2:31:00 PM
NKE,Nike's business is 'going to get darker before the dawn' (NKE),3/22/2017 9:50:14 PM
NKE,BRIEF-Nike posts Q3 earnings per share $0.68 (NKE),3/21/2017 9:40:47 PM
NKE,CREDIT SUISSE: Here are 5 reasons to like Nike (NKE),3/17/2017 8:15:40 PM
NKE,"Options Trades: Covered Call reports for Coca-Cola, Nike, Oracle Corporation, Snap Inc., and Twitter",3/16/2017 2:31:00 PM
NKE,"UPDATE 1-China consumer day show skewers Nike shoes, Muji foods (NKE, AAPL, VOW3, 7453, 2229)",3/15/2017 4:34:47 PM
NKE,CREDIT SUISSE: Here are 5 reasons to like Nike (NKE),3/14/2017 4:35:02 PM
NKE,Nike to launch high-tech hijab for female Muslim athletes (NKE),3/8/2017 10:16:22 PM
NKE,Nike created a brand-new running shoe to break a huge marathon record (NKE),3/7/2017 10:23:37 PM
NKE,ServiceNow appoints former eBay executive as CEO,2/27/2017 9:38:13 PM
NKE,"UPDATE 1-Doping-Farah coach used prohibited drug infusions, says newspaper (NKE)",2/26/2017 5:16:13 PM
NKE,Women in sports ad strikes nerve in Arab world (NKE),2/23/2017 8:14:12 AM
NKE,BRIEF-Nike declares $0.18 quarterly dividend (NKE),2/16/2017 10:50:05 PM
NKE,"Pernod Ricard CEO warns a U.S. border tax would hit consumer (MC, RI, DGE, NKE, WMT)",2/14/2017 3:34:10 PM
NKE,UPDATE 1-Under Armour-sponsored athletes oppose CEO's pro-Trump comments (NKE),2/10/2017 12:26:09 AM
NKE,NBA star Stephen Curry opposes Under Armour chief's Trump comment,2/9/2017 7:56:09 PM
NKE,"UPDATE 1-Under Armour quarterly results miss estimates; gives bleak forecast (ADS, NKE)",1/31/2017 2:06:06 PM
NKE,"UPDATE 1-Trump travel ban stirs faint corporate outcry beyond Silicon Valley (BX, GM, AGN, NKE, WFC, F, C, BA, XOM, GE, AAPL, JPM, BAC, GS, SBUX, MS, TSLA)",1/30/2017 3:12:09 PM
NKE,Golf-Woods now a TaylorMade man (NKE),1/25/2017 5:22:05 PM
NKE,"BRIEF-Perry Ellis International enters into distribution agreements for Nike Swim in Latin America (PERY, NKE)",1/20/2017 3:28:04 PM
NKE,"UPDATE 1-Canada's Lululemon Athletica narrows Q4 forecast (LULU, NKE)",1/9/2017 12:50:05 PM
NKE,"Nike beats on earnings and sales, stock spikes (NKE)",12/21/2016 2:32:21 PM
NKE,Nike made a $720 pair of futuristic sneakers that can lace themselves up — here's what they're like to wear (NKE),12/14/2016 9:10:43 PM
NKE,China top court rules in favour of Michael Jordan in trademark case (NKE),12/8/2016 12:04:05 PM
NKE,"BRIEF-Nike signs a 400 mln stg, 12-year extension to its existing deal with FA - Sky News, citing sources (NKE)",12/6/2016 3:14:03 PM
NKE,"UPDATE 1-Athletics-Asics to take over from Adidas as IAAF sponsor (ADS, 7936, NKE)",12/3/2016 12:08:05 AM
NKE,"Athletics-Adidas ends IAAF sponsorship deal (ADS, NKE)",12/2/2016 7:06:08 PM
NKE,What the Trump presidency could mean for sneaker prices (NKE),11/21/2016 4:59:38 PM
NKE,"Olympics-Kenyan officials ""embezzled money meant for Rio team"" - govt report (NKE)",11/20/2016 3:50:18 PM
NKE,"10 things you need to know before the opening bell (SPY, SPX, QQQ, DIA, CRM, TSLA, SCTY, NKE)",11/18/2016 12:36:43 PM
NKE,"Business calls for Trump, world leaders to support Paris climate pact (NKE, K, ULVR, UNA, SU, SBUX, GPS, GE, GIS)",11/16/2016 3:00:18 PM
NKE,"UPDATE 2-Puma sees year profits hitting top end of targeted range (PUM, PP, NKE, ADS)",11/10/2016 12:52:18 PM
NKE,"China firms eye 'Made in Vietnam' windfall - if Obama's TPP survives (NKE, ADS, ITX, 066570, 005930)",11/7/2016 12:10:20 PM
NKE,"UPDATE 4-New Adidas CEO acts to reshape Reebok, support growth (ADS, NKE, UA)",11/3/2016 9:00:20 PM
NKE,"BRIEF-Apple says 'Apple Watch Nike+' will be available Friday, Oct. 28 (AAPL, NKE)",10/24/2016 2:54:18 PM
NKE,BRIEF-Nike files for potential two-part dollar-denominated notes offering (NKE),10/18/2016 6:20:24 PM
NKE,"UPDATE 1-Soccer-Chelsea agree long-term kit deal with Nike (NKE, ADS)",10/13/2016 9:20:25 PM
NKE,"UPDATE 1-Hurricane Matthew disrupts stores, plants and transport (DE, BMW, 7267, NKE, LUV, UAL, DAL, BA, WMT, CAT, WBC, SPLS, AMZN, GD, CMI)",10/7/2016 11:50:22 PM
NKE,"UPDATE 1-China golf out of the rough? PGA, club maker Honma bet on post-Olympic boom (ADS, NKE)",10/6/2016 1:50:24 PM
NKE,"New Adidas CEO sets off in pursuit of Nike (ADS, HEN3, NKE, UA, VFC)",9/29/2016 1:30:21 PM
NKE,BRIEF-Nike Q1 earnings per share $0.73 (NKE),9/28/2016 6:00:22 AM
NKE,"Nike sales, forecast disappoint as Adidas gains ground",6/28/2016 10:20:56 PM
NKE,"Nike expands, adds to its paid family leave",5/11/2016 10:41:40 PM
NKE,Nike quarterly sales rise 7.6 percent,3/22/2016 9:23:12 PM
NKE,Nike sales rise 4.1 percent as demand jumps in North America,12/22/2015 10:43:53 PM
NKE,Stock futures edge higher; Nike jumps on buyback,11/20/2015 1:33:50 PM
NKE,Nike profit rises as sales of higher-margin products jump,9/24/2015 10:25:00 PM
NKE,Nike outlines Chairman Knight's succession plan,6/30/2015 10:47:08 PM
NKE,Nike profit rises 24 percent,6/25/2015 10:27:35 PM
NKE,U.S. probes Nike payments under Brazil soccer deal: WSJ,6/13/2015 2:23:00 AM
NKE,Nike settles with designers it accused of stealing secrets,6/9/2015 11:35:37 PM
NKE,Nike seen avoiding charges in football bribery probe - lawyers,5/30/2015 12:10:16 AM
NKE,"Nike backs Obama on trade with pledge to create 10,000 U.S. jobs",5/8/2015 12:02:29 PM
NKE,"Wall St. rises on Nike, lower dollar; snaps three-week string of losses",3/20/2015 9:43:29 PM
NKE,"Nike profit up 16 percent on higher demand for apparel, shoes",3/19/2015 9:36:57 PM
NKE,"Blackberry, Nike among most active before opening bell",9/26/2014 2:13:00 PM
NKE,Adidas marketing push an uphill battle against 'cool' Nike,8/8/2014 5:05:40 PM
NKE,Adidas 2 Nike 0 in World Cup final but competition goes on,7/10/2014 2:10:33 PM
NKE,"Stock futures dip, but Nike rises in premarket",6/27/2014 1:53:28 PM
NKE,"Nike gets leg-up from strong sales in North America, Europe",6/26/2014 11:21:16 PM
NKE,Nike and Adidas get personal in battle over soccer World Cup,5/28/2014 1:16:57 AM
NKE,Nike CEO says could shift China production over labor strife,5/1/2014 9:29:19 PM
NKE,Nike profit rises; future orders soar 14 percent,3/20/2014 9:32:02 PM
NKE,Adidas names brand chief to take up battle with Nike,1/8/2014 5:21:25 PM
NKE,"Nike profit rises, futures orders up 13 percent",12/19/2013 10:28:28 PM
NKE,Nike and Adidas square off for Brazil World Cup in ongoing brand battle,12/8/2013 9:01:56 AM
NKE,Nike revenue surges in North America and Europe,9/26/2013 10:33:20 PM
NKE,"Goldman, Nike, Visa to join Dow; Alcoa, HP, BofA out",9/10/2013 2:49:08 PM
NKE,"Nike profit rises, North American orders jump",6/28/2013 1:37:13 AM
NKE,"Nike profit rises, North American orders jump",6/27/2013 11:40:10 PM
NKE,"Wall St bounces as Cyprus fears ease, Nike up",3/22/2013 8:35:54 PM
NKE,"Nike profit tops Wall Street estimates, shares rise",3/21/2013 10:56:38 PM
NKE,Nike wins trademark case in Supreme Court,1/9/2013 9:39:18 PM
NKE,Adidas claims victory in 'knitted' shoe row with Nike,10/24/2012 7:12:16 PM
