Ticker,Title,Link
NKE,Nike (NKE) Gets a Hold from Jefferies,8/29/2024 12:37:53 PM
NKE,"Analysts Are Bullish on Top Consumer Cyclical Stocks: Nike (NKE), Collins Foods Limited (CLLFF)",8/23/2024 6:50:41 AM
NKE,"NKE, ADDYY: Which Apparel Stock Is the Better Buy Post-Olympics?",8/22/2024 2:31:21 PM
NKE,Analysts’ Opinions Are Mixed on These Consumer Cyclical Stocks: Nike (NKE) and Li Ning Company (OtherLNNGF),8/21/2024 5:20:24 PM
NKE,Trending stocks this week as U.S. equities notch their best week of 2024,8/17/2024 2:09:07 PM
NKE,Nike’s Resurgence Through Strategic Personnel Changes: A Shift to Buy Rating,8/16/2024 10:46:33 AM
NKE,Pershing Square doesn't expect Chipotle to miss a step with CEO's departure,8/15/2024 5:07:49 PM
NKE,"Pershing Square reveals Nike stake among Q2 moves, shoe giant's shares rise 4% after hours",8/14/2024 9:37:43 PM
NKE,3 Underperforming Dividend Stocks to Sell Now,8/13/2024 9:00:00 PM
NKE,3 S&P 500 Stocks to Sell Before the Losses Compound,8/12/2024 7:03:19 PM
NKE,Nike (NKE) Gets a Hold from RBC Capital,8/9/2024 7:06:14 AM
NKE,3 Contrarian Stock Picks to Buy Against the Market Consensus,8/5/2024 7:23:30 PM
NKE,7 Dynamite Long-Term Stocks to Buy on the Dip,8/3/2024 7:00:00 PM
NKE,"Dividend Roundup: Coca-Cola, IBM, Nike, Ford, and more",8/2/2024 12:07:46 PM
NKE,Nike declares $0.37 dividend,8/1/2024 10:19:03 PM
NKE,Bank of America Securities Keeps Their Buy Rating on Nike (NKE),7/31/2024 1:49:57 PM
NKE,Q3’s Rising Stars: 8 Dividend Stocks for Your Must-Watch List,7/30/2024 7:32:17 PM
NKE,Footwear sector gets a lift on upbeat outlook from Deckers and Skechers,7/26/2024 3:01:54 PM
NKE,"Deckers beats FQ1 estimates on gains in HOKA and UGG, raises guidance",7/25/2024 9:05:22 PM
NKE,3 ‘Forever Hold’ Stocks for Generational Wealth: July 2024,7/23/2024 7:02:19 PM
NKE,Earnings growth expectations ‘too aggressive’ for Q2 - JPM,7/22/2024 7:35:39 PM
NKE,The 3 Cheapest Blue-Chip Stocks Worth Buying Today,7/20/2024 10:17:00 AM
NKE,"Catalyst watch: Earnings deluge, Farnborough Airshow, Paris Olympics, and Trump talks crypto",7/19/2024 7:00:00 PM
NKE,3 Blue-Chip Stocks to Buy If the Dow Crashes,7/18/2024 3:00:00 PM
NKE,Stocks to Buy: 7 Founder-Led Companies Set to Outperform,7/17/2024 11:55:00 AM
NKE,3 Dow Jones Stocks to Buy at 52-Week Lows in July,7/16/2024 11:00:00 AM
NKE,3 of the Safest Stocks to Buy Now: July 2024,7/14/2024 1:00:00 PM
NKE,3 Beaten-Down Stocks Ready for a Jaw-Dropping Rebound,7/12/2024 2:03:54 PM
NKE,Nike (NYSE:NKE) Was Caught Flat-Footed. The Stock Is Deeply Discounted,7/11/2024 4:08:00 AM
NKE,"3 High-Risk, Sky-High Reward Stocks to Buy for Under $1",7/10/2024 8:08:34 PM
NKE,3 Metaverse Stocks to Buy on the Dip: Summer 2024,7/9/2024 6:04:26 PM
NKE,Lululemon Takes a Down Road in a Month: Should You Buy?,7/5/2024 10:24:06 PM
NKE,Nike (NKE) Receives a Buy from Goldman Sachs,7/4/2024 10:05:56 AM
NKE,"Nike Confronts Market And Product Transition Risks, Analyst Warns",7/3/2024 7:53:14 PM
NKE,3 Blue-Chip Stocks to Sell in July Before They Crash & Burn,7/2/2024 1:30:00 PM
NKE,Nike (NKE) was downgraded to a Hold Rating at UBS,7/1/2024 8:25:29 AM
NKE,Earnings Scorecard: Nike loses air after shocker results send shares sliding,6/29/2024 6:45:00 PM
NKE,"Inflation Reaches Over 3-Year Lows, Rate Cuts Are Getting Closer, Trump Dominates Debate: This Week In The Market",6/28/2024 10:00:01 PM
NKE,Nike cuts revenue growth forecasts as macro headwinds to have 'pronounced' impact,6/27/2024 10:37:39 PM
NKE,Notable earnings after Thursday's close,6/26/2024 9:35:56 PM
NKE,3 Dow Stocks to Buy on the Dip: June 2024,6/24/2024 2:20:00 PM
NKE,"Earnings week ahead: FedEx, Nike, Carnival, Micron, BlackBerry, Walgreens Boots, and more",6/23/2024 12:00:00 PM
NKE,Most S&P names post earnings beat during Juneteenth week - Earnings Scorecard,6/22/2024 6:45:00 PM
NKE,"Catalyst Watch: Nike earnings, Datadog event, Norfolk Southern decision, and an oil field-crypto IPO",6/21/2024 7:00:42 PM
NKE,Wall Street Analysts Are Neutral on Top Consumer Cyclical Picks,6/20/2024 11:30:16 AM
NKE,3 Dow Stocks to Sell in June Before They Crash & Burn,6/19/2024 5:11:23 PM
NKE,Nike Exceeds Market Returns: Some Facts to Consider,6/18/2024 7:16:55 PM
NKE,Will Top Line Contraction Hinder Jabil's Q3 Earnings?,6/17/2024 9:38:30 PM
NKE,The 3 Best Metaverse Stocks to Buy in June 2024,6/14/2024 10:15:00 AM
NKE,Buy Rating on Nike: Anticipated Innovation Cycle and Favorable Valuation Set Stage for Growth,6/12/2024 8:55:50 PM
NKE,Is Nike a Buy as Wall Street Analysts Look Optimistic?,6/10/2024 9:49:22 PM
NKE,Why Is Moving iMage Technologies (MITQ) Stock Up 60% Today?,6/5/2024 3:14:35 PM
NKE,Wall Street Analysts Are Bullish on Top Consumer Cyclical Picks,6/4/2024 9:40:29 AM
NKE,Jefferies Sticks to Its Hold Rating for Nike (NKE),6/3/2024 6:25:35 PM
NKE,Blue-Chip Blunders: 7 Stocks to Sell as Management Missteps Mount,6/2/2024 10:30:00 AM
NKE,3 Controversial Stocks to Buy Before They Rebound to Pre-Scandal Status,6/1/2024 10:03:00 PM
NKE,Blue-Chip Boomerangs: 3 Oversold Stocks Poised for a Mighty Rebound,5/31/2024 5:15:30 PM
NKE,The Golden Years Trifecta: 3 Stocks to Fund Your Dream Retirement,5/30/2024 5:10:18 PM
NKE,Dick's Sporting Goods soars to an all-time high as it shows that pockets of retail are still strong,5/29/2024 2:17:25 PM
NKE,"On Holding Has Meaningful Growth Opportunities, Says Bullish Analyst",5/28/2024 5:49:55 PM
NKE,3 Value Stocks to Buy at a 52-Week Low in May,5/27/2024 10:15:00 AM
NKE,RBC Capital Remains a Hold on Nike (NKE),5/24/2024 6:37:00 AM
NKE,The 3 Most Undervalued Retail Stocks to Buy in May 2024,5/23/2024 1:15:49 PM
NKE,3 Retirement Stocks to Buy at 52-Week Lows,5/22/2024 12:45:00 PM
NKE,Sell in May and Run Away: 3 Retail Stocks on the Brink of Collapse,5/21/2024 8:04:00 PM
NKE,Under Armour Is Lagging Behind Peers Like Nike & Lululemon! Analyst Explains Why,5/17/2024 6:41:09 PM
NKE,3 Stocks to Sell in May Before They Crash & Burn,5/15/2024 10:32:00 AM
NKE,Consumer Staples Stocks Prove That the ‘Strong Consumer’ Is Just a Myth,5/13/2024 7:13:08 PM
NKE,Bernstein Reaffirms Their Buy Rating on Nike (NKE),5/10/2024 2:05:29 PM
NKE,Second Chance Investments: 3 Top Stocks on Sale Now,5/5/2024 10:15:00 AM
NKE,"NIKE, Inc. declares $0.37 dividend",5/2/2024 8:55:48 PM
NKE,Stock Market Crash Warning: Don’t Get Caught Holding These 3 Blue-Chip Stocks,5/1/2024 7:15:17 PM
NKE,A Glimpse Into The Expert Outlook On Nike Through 29 Analysts,4/30/2024 6:00:31 PM
NKE,7 Retirement Stocks to Buy at a 52-Week Low in April,4/29/2024 2:03:13 PM
NKE,3 Fashion Stocks to Buy Before Summer 2024 Heats Up,4/27/2024 10:30:00 AM
NKE,Wells Fargo Keeps Their Buy Rating on Nike (NKE),4/25/2024 11:28:42 AM
NKE,3 Blue-Chip Stocks to Buy at a 52-Week Low in April,4/23/2024 10:00:00 AM
NKE,LI Stock Alert: Li Auto Crumbles as Competition Forces Price Cuts,4/22/2024 2:50:17 PM
NKE,7 Budget-Friendly Retail Plays Due for a Tax Refund Spending Boost,4/21/2024 12:48:09 PM
NKE,"Skechers USA Unlikely To Raise Outlook Due To Eurozone Hurdles, Says Analyst",4/19/2024 7:44:56 PM
NKE,Summer’s Coming: 3 Exciting Stocks to Buy That Aren’t Disney,4/17/2024 9:00:24 PM
NKE,Bernstein Reaffirms Their Buy Rating on Nike (NKE),4/16/2024 7:25:55 AM
NKE,3 Brands That Should Sign Caitlin Clark After Her Viral March Madness Run,4/15/2024 7:00:00 PM
NKE,"Energy, tech, comms among top-rated S&P 500 sectors as Q1 earnings kicks off",4/12/2024 1:53:40 PM
NKE,"Stocks Bounce Back With Tech, Gold Gaining After Modest Producer Inflation Data: What's Driving Markets Thursday?",4/11/2024 8:13:19 PM
NKE,Analysts Offer Insights on Consumer Cyclical Companies: Tesla (TSLA) and Nike (NKE),4/8/2024 11:30:49 AM
NKE,Maintaining a Buy Rating for Nike: A Balanced View on Long-term Growth and Short-term Challenges,4/5/2024 7:35:24 PM
NKE,3 Tech Stock Titans Grappling With Fresh China Challenges,4/4/2024 9:35:00 PM
NKE,Analyst Issues Sell Rating on Nike Due to Lackluster Product Launch and Innovation Challenges,4/3/2024 4:26:29 PM
NKE,Is It Time to Buy the Dow’s Worst-Performing Stocks of 2024? 3 to Consider,4/2/2024 4:11:09 PM
NKE,3 Dow Stocks to Sell in April Before They Crash & Burn,4/1/2024 5:12:52 PM
NKE,3 Lagging Consumer Discretionary Stocks to Kick to the Curb,3/30/2024 2:31:40 PM
NKE,RBC Capital Keeps Their Hold Rating on Nike (NKE),3/28/2024 2:25:05 PM
NKE,"Nike's Successful Air Max DN Launch Gets Off On The Right Foot, Says Analyst",3/27/2024 6:46:09 PM
NKE,Bernstein Sticks to Their Buy Rating for Nike (NKE),3/26/2024 2:55:55 PM
NKE,Hold Rating on Nike Amid Digital Growth and Market Challenges,3/25/2024 7:58:49 AM
NKE,Maintaining Buy Rating on Nike Amidst Margin Recovery and Cost Control Efforts,3/23/2024 2:25:44 PM
NKE,Why Cutera Shares Are Trading Lower By Over 26%? Here Are Other Stocks Moving In Friday's Mid-Day Session,3/22/2024 7:39:16 PM
NKE,"Nike Inc Q3 Profit Falls, but beats estimates",3/21/2024 9:20:20 PM
NKE,Notable earnings after Thursday's close,3/20/2024 9:35:09 PM
NKE,What Retail Apocalypse? 7 Stocks Proving the Doomsayers Wrong.,3/19/2024 5:57:51 PM
NKE,Analysts Offer Insights on Consumer Cyclical Companies: Vail Resorts (MTN) and Nike (NKE),3/18/2024 12:31:09 PM
NKE,"Earnings week ahead: FedEx, Nike, XPeng, Tencent, General Mills and more",3/17/2024 12:20:00 PM
NKE,"Catalyst Watch: Fed rates meeting, Nvidia CEO speaks at GTC 2024, Reddit IPO",3/15/2024 7:16:36 PM
NKE,Maintaining a Buy: Navigating Market Challenges with Nike’s Resilient Brand Strength,3/14/2024 10:15:59 AM
NKE,The 3 Most Undervalued Athleisure Stocks to Buy in March 2024,3/13/2024 8:37:06 PM
NKE,What's In Store For Nike In Q3 Earnings? Analyst Sees Revenue Decline In North America & EMEA,3/12/2024 7:21:36 PM
NKE,"Analysts Have Conflicting Sentiments on These Consumer Cyclical Companies: Choice Hotels (CHH), Dick’s Sporting Goods (DKS) and Nike (NKE)",3/11/2024 11:40:17 AM
NKE,The 3 Best Stocks to Buy If You Only Have $100 to Invest: March Edition,3/10/2024 7:00:00 PM
NKE,"Analysts Offer Insights on Consumer Cyclical Companies: Thor Industries (THO), Nike (NKE) and Lowe’s (LOW)",3/7/2024 2:31:05 PM
NKE,FL Stock Alert: Why Foot Locker Is Plummeting 30% Today,3/6/2024 10:14:28 PM
NKE,2024 Refresh: 3 Stocks With New Potential After Layoffs News,3/4/2024 8:31:25 PM
NKE,3 Promising Stocks to Buy With 50% Upside Potential,3/2/2024 6:00:00 PM
NKE,Analysts Alert: 3 Stocks to Sell While You Can,2/29/2024 6:28:47 PM
NKE,Cathie Wood’s Big Ideas: 3 Stock Picks for the $50B Digital Wallet Windfall,2/27/2024 11:05:00 AM
NKE,RBC Capital Keeps Their Buy Rating on Nike (NKE),2/26/2024 2:35:07 PM
NKE,3 Retail Stocks at Risk as Consumers Cut Back on Spending,2/24/2024 2:00:00 PM
NKE,Foot Locker ticks higher amid activist speculation,2/21/2024 5:05:11 PM
NKE,Q4 2023 earnings beats tread water while misses fade lower - Wells Fargo,2/20/2024 8:06:03 PM
NKE,Looming Layoffs? 3 Companies That May Be the Next to Drop the Axe.,2/19/2024 9:33:18 PM
NKE,Exit Now! 3 Dow Stocks to Sell in February 2024,2/16/2024 6:39:13 PM
NKE,The Next Procter & Gamble? 3 Consumer Stocks That Investors Shouldn’t Ignore,2/14/2024 6:47:10 PM
NKE,Wealth Explosion: 3 Blue-Chip Stocks With Triple-Your-Money Potential,2/13/2024 9:06:22 PM
NKE,The Next Nike? 3 Apparel Stocks That Investors Shouldn’t Ignore,2/12/2024 5:00:13 PM
NKE,AAPL Stock Forecast: Surprise! Why Apple Is In Better Shape Than People Realize.,2/9/2024 11:00:00 AM
NKE,Nike declares $0.37 dividend,2/8/2024 9:50:03 PM
NKE,7 Dow Stocks to Buy on the Dip: February 2024,2/7/2024 4:51:44 PM
NKE,Companies with profit warnings after negative earnings season - JPM,2/2/2024 3:15:19 PM
NKE,Markets Believe The Fed Got It Wrong: Rate Cut Reluctance  Rattles Investors,2/1/2024 6:57:13 PM
NKE,Lululemon extends 2024 share price decline amid new data,1/31/2024 5:33:42 PM
NKE,3 Stocks to Sell Before a Market Correction,1/30/2024 7:28:46 PM
NKE,3 Top Athleisure Stocks That Still Have Room to Run,1/29/2024 4:50:57 PM
NKE,The Top 3 Stocks to Sell Before They Tank in 2024,1/26/2024 7:03:03 PM
NKE,3 Consumer Stocks to Sell in January Before They Crash and Burn,1/18/2024 6:47:17 PM
NKE,Bernstein Reaffirms Their Buy Rating on Nike (NKE),1/16/2024 1:35:08 PM
NKE,"If You Can Only Buy One Blue-Chip Stock in January, It Better Be One of These 7 Names",1/15/2024 2:54:48 PM
NKE,Analysts’ Opinions Are Mixed on These Consumer Cyclical Stocks: Yum! Brands (YUM) and Nike (NKE),1/12/2024 12:30:20 PM
NKE,Nike (NKE) Receives a Buy from Bernstein,1/10/2024 4:25:20 PM
NKE,A Dovish Fed Could Reinvigorate Nike Stock (NYSE:NKE),1/9/2024 7:11:25 PM
NKE,Nike Stock (NYSE:NKE): Can It Run Higher in 2024?,1/8/2024 6:39:52 PM
NKE,Nike Stock (NYSE:NKE) Looks Enticing Despite Post-Earnings Dip,1/4/2024 8:08:01 PM
NKE,The 3 Best Blue-Chip Stocks to Buy Now,1/3/2024 7:43:03 PM
NKE,Holiday Showdown: Black Friday Reigns Over Christmas As Top Brands Steal the Shopping Spotlight,1/2/2024 7:54:05 PM
NKE,Home Fitness Phenomena: 3 Stocks Capitalizing on the Workout-from-Home Trend,1/1/2024 10:25:00 AM
NKE,AI and Automation Leaders for 2024: 7 Stocks to Stay Ahead of the Robot Uprising,12/30/2023 5:09:08 AM
NKE,Retail Trends Unwrapped: Analyst Unveils Surprising Shifts In Consumer Spending As 2023 Looms,12/29/2023 7:21:07 PM
NKE,Beyond The Numbers: 17 Analysts Discuss Nike Stock,12/28/2023 8:00:14 PM
NKE,Nike (NYSE:NKE) Sees Its Worst Q2 In 14 Years,12/26/2023 7:42:00 PM
NKE,Dow Edges Lower; Nike Sales Miss Estimates,12/22/2023 8:47:48 PM
NKE,"Nike Inc Announces Increase In Q2 Profit, Beats estimates",12/21/2023 10:22:51 PM
NKE,What Wall Street expects from Nike's earnings,12/20/2023 3:01:13 PM
NKE,TD Cowen Remains a Buy on Nike (NKE),12/19/2023 11:17:04 AM
NKE,Nike (NKE) Receives a Buy from Bernstein,12/18/2023 3:25:50 PM
NKE,Micron Technology To Rally Over 15%? Here Are 10 Top Analyst Forecasts For Friday,12/15/2023 2:15:33 PM
NKE,"Nike's Set Up For Q2 Remains ""More Balanced"": Analyst Sees Less Negative Retailer Commentary",12/14/2023 8:34:10 PM
NKE,The 7 Most Undervalued Growth Stocks to Buy in December,12/13/2023 9:42:25 PM
NKE,"Analysts Offer Insights on NA Companies: Graphic Packaging (GPK), Ulta Beauty (ULTA) and Nike (NKE)",12/12/2023 12:40:18 PM
NKE,3 Retail Stocks to Sell as Consumers Tighten Their Belts,12/11/2023 9:15:57 PM
NKE,Nike Layoffs 2023: What to Know About the Latest NKE Job Cuts,12/7/2023 7:58:09 PM
NKE,Bargain Buys: 7 Stocks Lagging the S&P 500 With Big Potential,12/6/2023 1:56:21 PM
NKE,"Nike Has 'Stronger Revenue Growth Ahead,' Says Bullish Goldman Sachs",12/5/2023 5:40:59 PM
NKE,Wells Fargo Keeps Their Buy Rating on Nike (NKE),12/4/2023 12:05:46 PM
NKE,What Are the Top Stocks to Buy Right Now? 7 Picks.,11/30/2023 11:20:00 AM
NKE,3 Sad Dow Stocks to Sell in December,11/29/2023 3:50:34 AM
NKE,Bernstein Remains a Buy on Nike (NKE),11/28/2023 3:35:10 PM
NKE,Analysts Highlight Healthy Traffic And Discounts On Black Friday - How's The Trend?,11/27/2023 7:55:57 PM
NKE,NKE and PTON: Can These 2 Beaten-Down Stocks Recover?,11/25/2023 1:54:18 AM
NKE,3 Consumer Goods Stocks That Will Define the Next Decade,11/21/2023 4:49:23 PM
NKE,"Dick's Sporting Goods Emerges As A Promising Buy: Analyst Cites Strong Ties With Nike, On Holding & More",11/17/2023 9:27:22 PM
NKE,The 7 Most Overlooked Wide-Moat Stocks,11/16/2023 10:07:01 PM
NKE,3 Dow Stocks You’ll Regret Not Buying Soon: November 2023,11/13/2023 9:22:23 PM
NKE,"Analysts’ Opinions Are Mixed on These NA Stocks: Nike (NKE), Kura Sushi USA (KRUS) and Topgolf Callaway Brands (MODG)",11/9/2023 11:33:59 AM
NKE,The Importance of Brand Power: 3 Stocks to Consider,11/3/2023 4:56:15 PM
NKE,Billionaire’s Playbook: Top 3 George Soros Stock Picks for 2024,10/31/2023 9:22:52 PM
NKE,Nike’s Stock: Anticipated Multi-Year Margin Recovery and Growth Prospects Bolster Buy Rating,10/30/2023 9:28:00 AM
NKE,The 3 Most Undervalued Blue-Chip Stocks to Buy: October 2023,10/25/2023 12:35:00 PM
NKE,3 Sizzling Stocks That Are Breaking Out Right Now,10/24/2023 4:55:49 PM
NKE,What's Going On With Foot Locker Stock Thursday?,10/19/2023 8:31:59 PM
NKE,7 ETFs Primed to Profit From the Coming Holiday Season,10/15/2023 1:00:10 PM
NKE,"Cooking at Home And Spending Less On Clothing: How Gen Z's Response to Financial Chaos May Affect Restaurant, Apparel And Retail Stocks",10/14/2023 9:42:36 PM
NKE,Iran's Involvement In Israel-Hamas Conflict Is Key For The Future Of US Inflation,10/12/2023 11:46:01 PM
NKE,"Buy Low, Sell High: 7 Blue-Chip Stocks to Snatch Up",10/11/2023 7:56:31 PM
NKE,Driving Nike's Competitive Edge: Analyst Highlights Industry-Leading Growth And Ad Spend,10/10/2023 8:44:07 PM
NKE,Nike Stock: Robust Growth Predicted Amid Gross Margin Expansion and Stable Revenue – An In-Depth Analysis by Robert Drbul,10/9/2023 10:15:50 PM
NKE,RBC Capital Remains a Buy on Nike (NKE),10/6/2023 10:35:12 AM
NKE,This Nike Insider Just Bought $1.3 Million Worth of NKE Stock,10/4/2023 5:57:43 PM
NKE,Analysts Offer Insights on NA Companies: EasyJet (OtherEJTTF) and Nike (NKE),10/3/2023 6:50:17 AM
NKE,"Stocks Tumble, Tech Stands Firm, Treasuries Enter Turmoil As Jerome Powell Speaks: What's Driving Markets Monday?",10/2/2023 8:21:54 PM
NKE,Telsey Advisory Keeps Their Buy Rating on Nike (NKE),9/30/2023 8:25:18 AM
NKE,"ChatGPT Portfolio Slips This Week Alongside Funds, ETFs In Benzinga Challenge",9/29/2023 9:50:47 PM
NKE,Nike Inc Q1 Profit  beats estimates,9/28/2023 10:19:38 PM
NKE,Here's what Wall Street expects from Nike's earnings report,9/27/2023 3:01:13 PM
NKE,Foot Locker's Inventory Woes and Uncertain Path: Analyst Calls It Fairly Valued,9/26/2023 10:01:34 PM
NKE,"Nike, Foot Locker, And Urban Outfitters Tread Carefully As Analyst Predict Sales Headwinds",9/25/2023 5:53:32 PM
NKE,"Fed Holds But Signals Hawkish Path Ahead, Treasury Yields Rise: The Week In The Markets",9/22/2023 10:06:56 PM
NKE,Nike Shares Are Down 22% This Year: Why 2 Analysts Are Going Long,9/21/2023 8:41:44 PM
NKE,"Wow, ChatGPT Can Pick Stocks: Benzinga's AI Portfolio Now In 5th Place",9/20/2023 8:18:34 PM
NKE,16 Analysts Have This to Say About Nike,9/18/2023 4:01:19 PM
NKE,"Don't Call It A Comeback, But ChatGPT's Stock Picks Are Bouncing In Benzinga Experiment",9/15/2023 10:10:07 PM
NKE,Bernstein Sticks to Their Buy Rating for Nike (NKE),9/12/2023 4:15:09 PM
NKE,Analysts Offer Insights on NA Companies: BRP (DOOO) and Nike (NKE),9/11/2023 10:50:24 AM
NKE,From Le Tigre To Nike: Analyst Sees Bright Spots For Designer Brands Amid Concerns,9/8/2023 8:16:09 PM
NKE,AI Vs. Wall Street: ChatGPT Portfolio Slips To Eighth As Benzinga Experiment Nears End,9/6/2023 11:09:40 PM
NKE,Wall Street Analysts Are Bullish on Top NA Picks,9/5/2023 10:20:32 AM
NKE,Analysts’ Opinions Are Mixed on These NA Stocks: Nike (NKE) and MasterCraft Boat Holdings (MCFT),9/1/2023 12:20:20 PM
NKE,7 Growth Stocks the Big Money Is Buying Now,8/31/2023 10:36:44 PM
NKE,Moneyball For Millennials: ChatGPT Is In The Big Leagues But Takes A Detour,8/30/2023 6:22:18 PM
NKE,The Story Of Sharply Different Retail Fates Continues,8/29/2023 8:20:14 PM
NKE,Market Crash Coming? 3 Stocks to Buy for a Soft Landing,8/28/2023 11:41:03 PM
NKE,3 Very Oversold Dow Stocks to Buy Right Now,8/24/2023 11:19:12 PM
NKE,"Wall Street Titans, AI Duel In Investment Showdown",8/23/2023 10:59:01 PM
NKE,On Holding Stock (NYSE:ONON): Time to Buy the Dip?,8/22/2023 11:34:39 PM
NKE,Analysts Offer Insights on NA Companies: The Estée Lauder Companies (EL) and Nike (NKE),8/21/2023 10:11:20 AM
NKE,5 Blue-Chip Stocks AI Thinks Will Double Your Money by 2027,8/16/2023 4:42:18 PM
NKE,The 3 Best Metaverse Stocks to Buy in August,8/15/2023 1:40:11 PM
NKE,Could Nike Stock (NYSE:NKE) Double From Here? This UBS Analyst Thinks So,8/14/2023 10:17:08 PM
NKE,The 7 Best Momentum Stocks to Buy in August,8/9/2023 9:01:34 PM
NKE,Nike declares $0.34 dividend,8/3/2023 9:23:04 PM
NKE,Women’s World Cup 2023: 3 Surprising Stocks That Are Set to Score Big-Time,8/2/2023 11:57:37 AM
NKE,Guggenheim Remains a Buy on Nike (NKE),8/1/2023 6:55:12 PM
NKE,"Analysts Conflicted on These NA Names: Nike (NKE), TrueCar (TRUE) and Barnes & Noble Education (BNED)",7/31/2023 12:40:09 PM
NKE,7 Dow Stocks to Buy as Recession Fears Roll Back,7/30/2023 7:24:28 PM
NKE,"Benzinga's Top Ratings Upgrades, Downgrades For July 25, 2023",7/25/2023 5:00:40 PM
NKE,"Analysts Offer Insights on NA Companies: ACELYRIN, INC. (SLRN), Deckers Outdoor (DECK) and Nike (NKE)",7/24/2023 12:40:32 PM
NKE,Wall Street Traders May Be Replaced By AI If ChatGPT Keeps This Up,7/19/2023 8:26:16 PM
NKE,3 Blue-Chip Stocks to Part Ways with ASAP,7/18/2023 5:09:30 PM
NKE,Bernstein Sticks to Their Buy Rating for Nike (NKE),7/17/2023 2:25:06 PM
NKE,Beyond Nike: 3 Footwear Stocks That Are Crushing the Market,7/14/2023 11:08:04 PM
NKE,Why These 7 Stocks Are the Best Ways to Play Retail Right Now,7/13/2023 4:31:28 PM
NKE,3 Explosive Cryptos to Buy in July 2023,7/12/2023 6:40:40 PM
NKE,'90s TV Star Topanga Is A Sneaker Head: Her 5 Favorites,7/7/2023 7:43:50 PM
NKE,7 Dying Stocks to Sell in July While You Still Can,7/6/2023 10:46:07 PM
NKE,Triple Threat: 3 Mighty Brands Poised for 30% Upside (or More) ,7/5/2023 10:32:24 PM
NKE,Lululemon Stock (NASDAQ:LULU): Does Its Strong Brand Justify Its Hefty Valuation?,7/4/2023 11:18:20 PM
NKE,Baird Maintains Outperform Rating for Nike: Here's What You Need To Know,7/3/2023 7:00:49 PM
NKE,Analyst Expectations for Nike's Future,6/30/2023 11:01:22 PM
NKE,"Nike Inc Profit Declines In Q4, misses estimates",6/29/2023 10:20:46 PM
NKE,Notable earnings after Thursday's close,6/28/2023 9:35:00 PM
NKE,Here’s 2023’s Best-Performing Actively-Managed ETF,6/27/2023 9:13:52 PM
NKE,"Over half of Fortune 100 firms are betting on blockchain, Coinbase finds",6/24/2023 7:54:00 PM
NKE,"Earnings week ahead: Nike, Micron Technology, BlackBerry, Walgreens Boots Alliance and more",6/23/2023 7:22:26 PM
NKE,"Analysts Offer Insights on NA Companies: Nike (NKE), Adtalem Global Education (ATGE) and Dollar Tree (DLTR)",6/22/2023 10:04:26 AM
NKE,Telsey Advisory Group Maintains Outperform Rating for Nike: Here's What You Need To Know,6/21/2023 7:00:48 PM
NKE,"Nike Faces Potential Headwinds, But Long-Term Outlook Remains Positive: Morgan Stanley",6/20/2023 6:47:36 PM
NKE,Discover Hidden Growth Potential of These 3 Blue-Chip Stocks,6/16/2023 10:00:10 AM
NKE,RBC Capital Sticks to Its Buy Rating for Nike (NKE),6/15/2023 7:55:10 AM
NKE,What 26 Analyst Ratings Have To Say About Nike,6/14/2023 8:02:01 PM
NKE,Analysts’ Opinions Are Mixed on These NA Stocks: Nike (NKE) and Revolve Group (RVLV),6/13/2023 10:40:30 AM
NKE,Guggenheim Sticks to Their Buy Rating for Nike (NKE),6/9/2023 10:25:08 AM
NKE,7 Growth Stocks That Could Skyrocket in the Next 12 Months,6/7/2023 11:39:32 PM
NKE,"DICK'S Sporting Goods Partners with Nike, Jordan Brand and Athletes For Next Phase of ""Sports Change Lives"" Campaign",6/6/2023 7:30:00 PM
NKE,Student loan consumers likely to defer buying soft goods as debt repayment resumes - UBS,6/5/2023 11:13:09 PM
NKE,3 High-Growth Cryptos to Buy in June 2023,6/2/2023 11:12:56 AM
NKE,Lululemon soars after beat-and-raise report defies retail sector trends,6/1/2023 8:29:17 PM
NKE,The 25 Best Growth Stocks for the Next 5 Years,5/30/2023 7:50:00 PM
NKE,3 Household-Name Stocks to Buy on the Dip,5/27/2023 3:51:46 PM
NKE,Hibbett cut from Buy to Sell at Bank of America,5/26/2023 7:21:20 PM
NKE,Dick's Sporting Goods stock drives higher on earnings beat,5/23/2023 11:23:55 AM
NKE,Foot Locker's Issues Are 'Self-Inflicted': 3 Analysts Review Q1 Print,5/22/2023 8:09:43 PM
NKE,Hot Stocks: CTLT rises on cost-cutting plan; BE gains on analyst upgrade; DIS and NKE fall,5/19/2023 6:11:04 PM
NKE,Surprise! These 7 Retail Stocks Are Ready for Their Comeback.,5/18/2023 12:12:11 PM
NKE,RBC Capital Sticks to Its Buy Rating for Nike (NKE),5/17/2023 10:25:30 AM
NKE,Warning! 3 Stocks That Are Waving Big Red Flags,5/14/2023 8:03:15 PM
NKE,Bank of America Securities Keeps Their Hold Rating on Nike (NKE),5/12/2023 9:35:09 AM
NKE,Is ChatGPT A Better Financial Advisor? We're Going To Find Out,5/10/2023 8:33:44 PM
NKE,7 Dividend Stocks That Will Pay You Through Any Market Turmoil,5/9/2023 12:17:23 AM
NKE,WNBA Legend Sheryl Swoopes Joins DICK'S Sporting Goods and Nike for Third Annual It's Her Shot Tour Designed to Empower Young Female Athletes to Take Their Place on the Court,5/8/2023 4:33:00 PM
NKE,Nike declares $0.34 dividend,5/4/2023 8:39:02 PM
NKE,Morgan Stanley's Wilson screens for stocks as earnings stabilize but data disappoints,5/1/2023 12:33:59 PM
NKE,Nike Expands Relationship with Cognizant to Manage its Global Technology Operations,4/25/2023 3:00:00 PM
NKE,Stock Market Alert: 5 Things to Know as Investors Turn Bearish,4/23/2023 7:30:21 PM
NKE,DBS Sticks to Its Buy Rating for Nike (NKE),4/22/2023 5:55:14 AM
NKE,Bud Light Controversy: History Suggests Anheuser-Busch (NYSE:BUD) Will Overcome It,4/19/2023 7:57:36 PM
NKE,Analyst Ratings for Nike,4/18/2023 11:01:41 PM
NKE,Guggenheim Reaffirms Their Buy Rating on Nike (NKE),4/13/2023 6:35:10 PM
NKE,3 Retail Stocks to Buy on Sale Before They Hit All-Time Highs,4/12/2023 1:14:32 AM
NKE,3 Overvalued Blue-Chip Stocks Not Worth Your Green,4/11/2023 10:45:46 AM
NKE,Why Is Anheuser-Busch (BUD) Stock Down Today?,4/10/2023 5:31:31 PM
NKE,"Morgan Stanley cuts Comcast, adds Becton Dickinson to its model portfolio",4/6/2023 3:09:09 PM
NKE,Credit Suisse Remains a Buy on Nike (NKE),4/4/2023 1:15:09 AM
NKE,7 Hydrogen Stocks Sitting in the Sweet Spot,4/3/2023 6:07:04 PM
NKE,5 Retail Stocks Sitting in the Sweet Spot,3/30/2023 5:40:20 PM
NKE,"4 Retail Stocks Downgraded, But 3 Are Best Positioned: Why UBS Has A Bearish View",3/29/2023 6:01:07 PM
