Ticker,Title,Link
NKE,Analyst Ratings for Nike,3/28/2023 4:01:09 PM
NKE,This Analyst With 87% Accuracy Rate Sees Around 23% Upside In Alphabet - Here Are 5 Stock Picks For Last Week From Wall Street's Most Accurate Analysts,3/27/2023 1:49:40 PM
NKE,TikTok Ban – Chinese Stocks in the Crosshairs?,3/26/2023 12:13:00 PM
NKE,"S&P 500 Rebounds; Tech, Gold, Bitcoin Rally As Investors Bet On Fed Pause In May",3/23/2023 11:49:41 AM
NKE,Nike's Momentum Confirmed In Earnings Report: Are Analysts Remaining Bullish?,3/22/2023 9:31:52 PM
NKE,"Nike Inc Announces Drop In Q3 Bottom Line, but beats estimates",3/21/2023 9:19:06 PM
NKE,Notable earnings after Tuesday's close,3/20/2023 9:35:07 PM
NKE,Nike attracts bull/bear debate ahead of earnings,3/19/2023 4:00:17 PM
NKE,Raymond James Remains Bullish On Nike's FY24 Margin Setup Despite Likely Mixed Q3,3/17/2023 7:12:09 PM
NKE,"Benzinga's Top Ratings Upgrades, Downgrades For March 16, 2023",3/16/2023 4:00:39 PM
NKE,3 “Strong Buy” Stocks Analysts Still Believe In,3/15/2023 6:39:47 PM
NKE,Analysts Offer Insights on Consumer Goods Companies: Nike (NKE) and Walmart (WMT),3/14/2023 11:10:33 PM
NKE,Moderna To Rally Around 30%? Here Are 10 Other Analyst Forecasts For Monday,3/13/2023 12:51:44 PM
NKE,3 Blue-Chip Stocks to Sell in March,3/12/2023 10:20:39 PM
NKE,22 Analysts Have This to Say About Nike,3/10/2023 7:00:42 PM
NKE,3 Reasons EV ETFs Are Better Stocks to Buy Than Tesla,3/7/2023 8:35:22 PM
NKE,7 Stocks to Buy for the Worrying Climate Change Crisis,3/6/2023 10:07:52 PM
NKE,"Catalyst watch: General Electric, Apple, Chevron, Black Knight and Ethereum in the spotlight",3/3/2023 8:30:02 PM
NKE,What are the Best Hydrogen Stocks to Buy Now? Our 3 Top Picks.,3/1/2023 7:06:13 PM
NKE,7 Well-Known Consumer Brands Worth a Spot in Your Portfolio,2/21/2023 10:23:26 PM
NKE,3 Overlooked Industrial Stocks Worth Your Attention,2/17/2023 9:46:59 PM
NKE,ETSY Stock Alert: Citron Research Says ‘Crime’ Is Obvious for Etsy,2/16/2023 9:21:09 PM
NKE,"Soros Fund Management exits Zoom, Elanco, boosts Alphabet, Disney in Q4",2/13/2023 10:47:20 PM
NKE,Nike declares $0.34 dividend,2/9/2023 9:40:27 PM
NKE,Capri Holdings crash drags on apparel industry peers,2/8/2023 4:02:28 PM
NKE,Political tension between the U.S. and China ratcheted up again - these stocks are trading lower,2/6/2023 4:26:49 PM
NKE,Starbucks earnings preview: China reopening and U.S. resiliency could be the coffee buzz,2/1/2023 7:00:23 PM
NKE,Chinese consumers are back out in the streets - watch these stocks,1/28/2023 3:45:25 PM
NKE,The Best Time to Buy “Forever” Stocks Is…,1/26/2023 7:48:48 PM
NKE,Goldman tips stocks poised to best benefit from China's reopening,1/23/2023 10:47:07 AM
NKE,"Morgan Stanley Says Timing Is Tricky & Demand The Key Unknown For Specialty Retail, Department Stores And Brands",1/18/2023 8:08:09 PM
NKE,RBC Capital Reaffirms Their Buy Rating on Nike (NKE),1/17/2023 12:45:07 PM
NKE,Goldman picks 50 top return-on-equity stocks for a tough ROE year,1/16/2023 3:23:03 PM
NKE,"Tech Roundup: Apple, Disney lead week's activity as investors ease into action",1/14/2023 5:00:00 PM
NKE,The Latest Analyst Ratings for Nike,1/12/2023 6:00:24 PM
NKE,"Disney taps Nike's Parker as new board chairman, urges vote against Peltz",1/11/2023 9:18:00 PM
NKE,Analysts Offer Insights on Consumer Goods Companies: Nike (NKE) and Dutch Bros Inc (BROS),1/10/2023 2:10:37 PM
NKE,5 Best Stocks to Buy if You Have $250 to Spend,1/6/2023 6:05:41 PM
NKE,7 Seriously Undervalued Large-Cap Stocks to Buy Now,1/5/2023 5:50:56 PM
NKE,"PYPL's Outgoing Traffic From Prominent Merchants Stabilized, Analyst Says",1/4/2023 5:56:37 PM
NKE,7 Undervalued Blue-Chip Stocks to Buy Now,1/3/2023 5:25:17 PM
NKE,"Skechers USA Has Favorable Secular Tailwinds Of Comfort, Says Analyst",12/29/2022 7:33:26 PM
NKE,China is ditching Zero-Covid policies - watch these stocks,12/27/2022 7:30:31 PM
NKE,"Catalyst watch: Nio event, Ivanhoe Electric lockup expiration and Cal-Maine earnings",12/23/2022 6:30:25 PM
NKE,"Nike Earnings Top Estimates, Here's A Look At Price Target Changes By The Most Accurate Analysts",12/22/2022 1:25:36 PM
NKE,"Dow, S&P 500, Nasdaq rise as FedEx, Nike earnings encourage bargain hunting",12/21/2022 9:07:06 PM
NKE,Nike Inc Q2 Profit  beats estimates,12/20/2022 10:20:46 PM
NKE,Notable earnings after Tuesday's close,12/19/2022 10:35:43 PM
NKE,"Catalyst watch: Tesla looks to end skid, Nike earnings, Rocket Lab launch and Broadcom-VMware review",12/16/2022 8:00:08 PM
NKE,Nike (NKE) Receives a Buy from Guggenheim,12/14/2022 4:05:10 PM
NKE,"Nike's Inventory In Focus & Slight Beat In Q2 Likely, Says Analyst",12/13/2022 7:06:03 PM
NKE,These 4 Retail Stocks Shine with Holiday Glamour,12/11/2022 7:55:26 AM
NKE,China's reopening hits a higher gear - these stocks are ripping gains,12/8/2022 2:01:40 PM
NKE,7 Dow Stocks to Sell Before They Dive in 2023,12/7/2022 10:00:24 PM
NKE,3 Growth Stocks Hedge Funds Are Buying Now,11/30/2022 5:44:26 PM
NKE,"5 Things You Might Not Know About Soccer Legend, Portugal Star Cristiano Ronaldo",11/24/2022 2:49:45 PM
NKE,3 Undervalued Dow Stocks to Buy Before Wall Street Catches On,11/22/2022 11:59:07 PM
NKE,7 Best Shipping Stocks to Buy,11/21/2022 6:44:22 PM
NKE,7 Hot Hydrogen Stocks With Room to Run in 2023,11/19/2022 2:35:01 AM
NKE,Jefferies Sticks to Its Buy Rating for Nike (NKE),11/18/2022 6:25:15 PM
NKE,"Foot Locker Needs More Time To Adapt To Recent Abrupt Industry Challenges, Says Credit Suisse Analyst",11/16/2022 6:55:33 PM
NKE,"If You Invested $1,000 In The Tesla Bear Daily ETF At IPO, Here's How Much You'd Have Now",11/15/2022 10:41:37 PM
NKE,"Steve Cohen's Point72 enters Dell, EOG, Intuit, exits Nike, McDonald's, Coca-Cola",11/14/2022 11:10:01 PM
NKE,"Retail, e-commerce stocks soar, consumer staples sag as risk-on mood persists",11/11/2022 6:55:47 PM
NKE,These 3 Stocks Could Boom on Holiday Retail Sales,11/9/2022 2:34:48 AM
NKE,23 Penny Stocks to Buy for a MASSIVE Bull Market in 2023,11/7/2022 5:36:36 PM
NKE,Dump These 10 Stocks Immediately,11/5/2022 1:00:23 PM
NKE,Hurry! 7 Pitiful Dow Stocks to Sell Before 2022 Ends.,11/2/2022 5:44:39 PM
NKE,China ramps up COVID restrictions - watch these stocks in the retail sector,10/28/2022 1:14:44 PM
NKE,Here’s Why Nike and Lululemon Stocks are Rallying,10/26/2022 4:11:51 PM
NKE,7 Dow Stocks to Sell Before They Tumble,10/25/2022 4:04:05 PM
NKE,"Nike stock slides sharply after Adidas warning on China sales, elevated inventory",10/20/2022 4:24:35 PM
NKE,5 Top Stocks Cathie Wood Is Buying This Week,10/17/2022 5:10:07 PM
NKE,Analyst Ratings for Nike,10/13/2022 9:07:36 PM
NKE,"Joe Biden Vows Consequences Against Saudi Arabia, Philips Warns Lower Sales & Profit, Intel Explores Substantial Job Cuts: Top Stories Wednesday, Oct. 12",10/12/2022 2:23:06 PM
NKE,Why Lululemon Stock Traded Higher Today,10/11/2022 11:12:13 PM
NKE,Cathie Wood says Fed hikes could be ‘a policy error that will cause deflation’,10/10/2022 5:35:01 PM
NKE,Nike Stock (NYSE:NKE): Compelling Value after Historic Plunge,10/6/2022 7:50:28 PM
NKE,The Short List Of Dow Jones Stocks That Are Actually Up This Year: Hint — It's Very Short,10/3/2022 11:56:59 PM
NKE,"Analysts Offer Insights on Consumer Goods Companies: Nike (NKE), Mercedes-Benz Group (OtherMBGAF) and Lordstown Motors (RIDE)",9/30/2022 8:11:21 PM
NKE,NIKE Q1 Profit Drops ,9/29/2022 10:43:22 PM
NKE,Notable earnings after Thursday's close,9/28/2022 9:35:46 PM
NKE,Trading Opportunities: Beating the Bears As We Approach Q4,9/27/2022 6:28:41 PM
NKE,"This Analyst Slashes PT On Lyft By 68%, Plus Telsey Advisory Group Predicts $125 For Nike",9/26/2022 2:28:36 PM
NKE,S&P 500 Circles New 2022 Lows Following Latest Fed Rate Hike: Is A Recession Inevitable?,9/23/2022 8:47:17 PM
NKE,Morgan Stanley Bats For Nike's Outlook Cut Due To Unfavorable Environment,9/22/2022 8:33:10 PM
NKE,Beyond Meat To Dip Over 50%? Also This Analyst Slashes PT On NIKE,9/21/2022 3:10:06 PM
NKE,Charting Nike's Pullback: 'It Has To Hold $100',9/20/2022 11:01:35 PM
NKE,UBS Remains a Buy on Nike (NKE),9/19/2022 2:15:29 PM
NKE,NKE vs. LULU vs. ATZAF: Which Apparel Stock is Best?,9/13/2022 5:37:43 AM
NKE,Where Nike Stands With Analysts,9/12/2022 9:08:42 PM
NKE,Game On: These Stocks Could Benefit Big-Time from the NFL Season,9/8/2022 1:12:45 PM
NKE,7 Stocks to Buy on the Dip — or You’ll Be Kicking Yourself Later!,9/7/2022 6:37:34 PM
NKE,6 Alternative Cryptos to Consider for the High Roller,9/6/2022 8:26:48 PM
NKE,"Catalyst watch: Key events for Apple, Moderna, Nike and Bausch + Lomb",9/2/2022 7:00:59 PM
NKE,Think Bitcoin Will Go Down? New ETF Bets Against Bitcoin Bull Michael Saylor And MicroStrategy,8/31/2022 12:23:48 AM
NKE,Why These 3 Foot Locker Analysts Are More Excited About New CEO Than Q2 Results,8/22/2022 4:32:48 PM
NKE,Foot Locker (FL) Stock Soars 20% on New CEO News,8/19/2022 5:01:52 PM
NKE,5 Companies Most at Risk of Biden’s Stock Buyback Tax,8/18/2022 10:45:42 AM
NKE,3 Stock Winners and Losers of Biden’s Inflation Reduction Act,8/15/2022 8:24:18 PM
NKE,7 Retail Stocks Reporting Earnings the Week of August 15,8/12/2022 10:15:08 AM
NKE,Super Bullish Or Bearish On Tesla Or Apple? These New ETFs Are For You,8/9/2022 5:03:53 PM
NKE,What companies are most exposed to the Inflation Reduction Act?,8/8/2022 9:38:29 AM
NKE,These 2 Under-The-Radar Stocks Traded More Than $1B Each Last Month,8/5/2022 10:10:00 PM
NKE,Nike declares $0.305 dividend,8/4/2022 8:16:49 PM
NKE,7 Blue-Chip Stocks to Buy on the Dip,7/27/2022 2:22:20 PM
NKE,7 Dow Stocks Trading at a Huge Discount Right Now,7/26/2022 10:41:39 PM
NKE,UBS lists top conviction stock ideas for its favorite sectors,7/23/2022 6:55:04 PM
NKE,7 Best Consumer Stocks to Buy Now,7/22/2022 11:00:13 AM
NKE,"Benzinga's Top Ratings Upgrades, Downgrades For July 21, 2022",7/21/2022 4:07:00 PM
NKE,3 Most Undervalued Consumer Stocks to Buy Now,7/20/2022 10:00:40 AM
NKE,Consumer discretionary stocks gain as investors dabble with beat-up names,7/19/2022 2:07:35 PM
NKE,"Super Bearish On Tesla Or Nvidia? Inverse, Leveraged ETFs Offer Investors New Opportunities",7/15/2022 11:56:08 PM
NKE,Want to Short TSLA Stock? Check Out the New TSLQ ETF.,7/14/2022 4:06:08 PM
NKE,Cboe's Weekly Market Recap: July 5th to July 8th,7/12/2022 8:46:43 PM
NKE,Joe Terranova Slams Jefferies Lululemon Downgrade: 'I Completely Disagree With The Report',7/11/2022 8:53:44 PM
NKE,Roblox Stock Is Still Not Cheap at Two-Thirds Off,7/4/2022 10:20:33 AM
NKE,"Only 8 Of The 30 Dow Jones Stocks Were Positive In The First Half Of 2022: Chevron Leads, But Who Else Was Up?",7/1/2022 10:45:50 PM
NKE,3 Stocks to Sell Now,6/30/2022 3:02:39 PM
NKE,Amazon To $140? Here's The Biggest Price Target Changes For Wednesday,6/29/2022 2:06:10 PM
NKE,Nike's Fourth Quarter 'Not As Bad As Feared': Why 3 Analysts Are Lowering Price Targets,6/28/2022 5:02:26 PM
NKE,NIKE Q4 Profit Beats Street View Driven By Europe Sales ,6/27/2022 11:14:18 PM
NKE,Notable earnings after Monday's close,6/26/2022 9:35:00 PM
NKE,Stocks Rebound From 2022 Lows As Market Digests Fed Chair Powell's Congressional Testimony,6/24/2022 9:53:16 PM
NKE,"4 Stocks Reporting Earnings the Week of June 27, 2022",6/23/2022 9:26:04 PM
NKE,Telsey Advisory Cuts Nike Price Target - Read Why,6/22/2022 8:51:02 PM
NKE,Earnings expectations for Nike leave analysts divided,6/21/2022 6:19:39 PM
NKE,"7 Stocks to Buy If You Have $1,000 to Invest",6/20/2022 10:00:07 AM
NKE,Is the Stock Market Closed for Juneteenth 2022?,6/17/2022 7:31:12 PM
NKE,Nike And 3 Other Stocks Insiders Are Selling,6/16/2022 2:11:51 PM
NKE,7 of the Hottest ETFs to Buy Right Now,6/9/2022 10:15:05 AM
NKE,7 High-Quality Dividend Stocks With High Yields,6/7/2022 1:27:49 PM
NKE,Here's Why Stifel Slashed Price Target On Nike,6/6/2022 3:01:20 PM
NKE,7 Massively Undervalued Stocks to Buy Before They Go Parabolic,6/2/2022 11:10:21 AM
NKE,17 Analysts Have This to Say About Nike,6/1/2022 3:18:10 PM
NKE,"Kohl’s, conference call commentary carry Dick’s shares over 30% off lows",5/25/2022 3:07:41 PM
NKE,7 Large-Cap Stocks to Avoid Until the Market Crashes Again,5/24/2022 10:40:01 AM
NKE,Invest Like An NBA Owner: Exploring Your Options In The Chinese Market,5/23/2022 11:06:01 PM
NKE,"Q1 13F Roundup: How Buffett, Einhorn, Ackman And Others Adjusted Their Portfolios",5/17/2022 7:25:10 PM
NKE,What to Do When the Stock Market Drops,5/16/2022 6:40:35 PM
NKE,Where Nike Stands With Analysts,5/12/2022 6:11:20 PM
NKE,Gear Up for a Dip-Buy as Nike Stock Posts Steep Consecutive Losses,5/9/2022 4:52:34 PM
NKE,"4 Top Stock Trades for Friday: SQ, DLTR, NET, UAA",5/6/2022 8:35:28 PM
NKE,Nike declares $0.305 dividend,5/5/2022 8:47:17 PM
NKE,A “Divergence” in Marine Shipping Stocks Could Spell Big Profits,4/22/2022 9:17:56 PM
NKE,3 Retail Stocks Making a Swift Recovery,4/15/2022 3:31:56 PM
NKE,Why We Need Web3: Elon and Zuck Just Proved It Again,4/14/2022 8:30:08 PM
NKE,3 Direct-To-Consumer Stocks to Sell Before They Sink,4/13/2022 11:00:26 AM
NKE,"Top Stock Trades for the Week of April 11, 2022",4/11/2022 7:26:38 PM
NKE,Cautious Optimism as We Await Earnings Reports,4/8/2022 9:43:22 PM
NKE,Two Reasons to Buy Peloton and One Reason to Sell,4/5/2022 2:36:54 PM
NKE,Prepping for Earnings Reports,4/4/2022 8:47:47 PM
NKE,Investors Should Use Weakness in Roblox as an Opportunity,4/1/2022 11:32:03 PM
NKE,"2 Reasons to Buy Amazon Stock Before the Big Split, 1 Reason to Avoid",3/31/2022 11:13:48 AM
NKE,"4 Top Stock Trades for Wednesday: HOOD, F, GME, NKE",3/29/2022 8:35:24 PM
NKE,There’s Too Much Uncertainty in Peloton to Consider a Buy Right Now,3/26/2022 11:54:13 AM
NKE,The New 'Return On Character' ETF Doesn't Include Musk Or Zuckerberg: Who Made The Cut?,3/25/2022 10:23:10 PM
NKE,10 Biggest Price Target Changes For Thursday,3/24/2022 5:07:46 PM
NKE,"5 Nike Analysts Praise Q3 Earnings Beat, Booming North American Sales Growth",3/22/2022 6:13:39 PM
NKE,"Nike Inc Profit Falls In Q3, but beats estimates",3/21/2022 9:19:57 PM
NKE,Notable earnings after Monday's close,3/20/2022 9:35:00 PM
NKE,China Says “Go” For Tech… And 4 Other Surprises This Week,3/18/2022 9:03:09 PM
NKE,3 Cryptos to Buy as NFTs Flop,3/17/2022 8:55:42 PM
NKE,10 Biggest Price Target Changes For Wednesday,3/16/2022 1:22:21 PM
NKE,10 Biggest Price Target Changes For Tuesday,3/15/2022 12:52:24 PM
NKE,"Catalyst watch for next week: Eyes on FueCell Energy, Dutch Bros, GameStop and FedEx",3/11/2022 8:00:09 PM
NKE,After Amazon these 20 companies could follow a stock split wave,3/10/2022 3:35:56 PM
NKE,2 Diamond-in-the-Rough Cryptos Destined to Shine,3/9/2022 10:05:24 PM
NKE,Where Nike Stands With Analysts,3/8/2022 8:05:31 PM
NKE,The Silver Lining Amidst Relentless Volatility,3/7/2022 11:14:49 PM
NKE,"10 Most Searched Tickers On Benzinga In February: SPY, Tesla, Nvidia (And A Crypto Hits Top 20)",3/2/2022 2:52:34 PM
NKE,Staying the Course in the Face of Volatility,2/28/2022 9:38:58 PM
NKE,Nike's online shadow hangs over Foot Locker and peers,2/25/2022 2:53:22 PM
NKE,Roblox Stock Is a Buy-and-Hold for the Long Term After Its Q4 Beating,2/24/2022 3:31:18 PM
NKE,Peloton Isn’t the ONLY Takeover Target. What Companies Could Be Bought Out in 2022?,2/23/2022 8:07:14 PM
NKE,Roblox Is a Metaverse Stock That You Genuinely Shouldn’t Miss,2/22/2022 11:00:10 AM
NKE,Growth stocks rule in Goldman screen of biggest retail investor buys and sells,2/21/2022 4:12:25 PM
NKE,Want To Bet Against Tesla? There Could Be A New Inverse ETF For Traders,2/17/2022 11:34:50 PM
NKE,3 Roblox Analysts React To Q4 Earnings As Investors Pull Back,2/16/2022 8:38:57 PM
NKE,3 Little-Known NFT Cryptos Coming on the Scene,2/14/2022 11:00:32 AM
NKE,Why This Activist Peloton Investor Wants The Company Put Up For Sale,2/11/2022 9:27:42 PM
NKE,Nike declares $0.305 dividend,2/10/2022 9:37:40 PM
NKE,Peloton Stock Still Has No Place in a Legitimate Growth Portfolio,2/9/2022 2:02:34 PM
NKE,Is PTON Stock a Buy Right Now? 2 Analysts Weigh In on Peloton Price Predictions.,2/8/2022 7:27:06 PM
NKE,Why did Peloton stock rocket today? Shares jump nearly 20% as M&A chatter heats up,2/7/2022 6:47:43 PM
NKE,Apple is called a favorite to bid for Peloton Interactive,2/6/2022 10:22:22 PM
NKE,"Peloton jumps 40% as suitors including Amazon, Nike circle company (update)",2/4/2022 10:24:18 PM
NKE,7 Stocks to Buy as the Market Shakes Off Omicron Fears ,2/3/2022 6:25:20 PM
NKE,The 3 Worst NFTs to Buy Right Now,2/2/2022 9:38:58 PM
NKE,Can A New CEO Help Turn Around ContextLogic?,2/1/2022 10:33:30 PM
NKE,Could BBY Stock Be the Next Big Metaverse Bet? One Analyst Thinks So.,1/31/2022 9:44:50 PM
NKE,7 Technology Stocks Reporting Earnings the Week of January 31,1/28/2022 6:15:32 PM
NKE,10 Stocks to Buy That Could Make You a Millionaire in 2022,1/26/2022 7:12:38 PM
NKE,"3 Reasons Why NFTs Suck, But Two Projects Are Going Up Anyway",1/25/2022 9:27:33 PM
NKE,PTON Stock Alert: 7 Things to Know as Peloton Trips (And Falls) Again,1/24/2022 4:06:50 PM
NKE,Welcome robot masters: Honeywell could gain as warehouse automation grows,1/22/2022 9:05:00 PM
NKE,The 10 Best Consumer Cyclical Stocks to Buy for 2022,1/21/2022 11:00:59 AM
NKE,"4 Top Stock Trades for Friday: AMD, SOFI, PTON, NKE",1/20/2022 10:04:02 PM
NKE,Vault NFTs Launches Digital Sneakers Ahead of Highly Anticipated StockX IPO,1/19/2022 10:36:02 PM
NKE,What 9 Analyst Ratings Have To Say About Nike,1/18/2022 5:05:25 PM
NKE,Citi screens for most and least crowded stocks poised for big moves,1/16/2022 11:15:09 AM
NKE,Investment Opportunity Breakdown: Fitness Stocks,1/12/2022 4:58:22 PM
NKE,Why Nike Shares Are Trading Lower Today,1/10/2022 4:07:56 PM
NKE,Why Roblox Stock Will Rise in 2022,1/5/2022 8:45:36 PM
NKE,Nike Price Predictions: One Analyst Thinks NKE Stock Is the ‘Best Idea’ of 2022,1/3/2022 9:15:38 PM
NKE,"7 Tech Predictions For 2022: Apple-Facebook Face-Off In Metaverse, Tesla Reigns Supreme, Quantum Takes A Big Leap, And More",1/1/2022 4:26:36 PM
NKE,Why Nike Stock Keeps Proving the Skeptics Wrong,12/23/2021 7:27:34 PM
NKE,Is Under Armour the Next Big Metaverse Stock? Steph Curry NFTs Put UA Stock in Focus.,12/22/2021 7:44:06 PM
NKE,Why Alibaba Shares Rallied Today,12/21/2021 10:36:15 PM
NKE,"Nike Inc Bottom Line Climbs In Q2, Beats estimates",12/20/2021 10:20:06 PM
NKE,Notable earnings after Monday's close,12/19/2021 10:35:00 PM
NKE,"Catalyst watch for next week: Nike and Micron earnings, SPAC votes and Peloton action",12/17/2021 8:00:01 PM
NKE,"Benzinga's Top Ratings Upgrades, Downgrades For December 16, 2021",12/16/2021 4:13:40 PM
NKE,"10 Stocks to Buy if You Have $5,000 in Starter Money",12/14/2021 7:27:38 PM
NKE,Nike acquires virtual sneakers creator RTFKT; terms not disclosed,12/13/2021 9:25:27 PM
NKE,The metaverse is set to be the biggest disruption society has faced: should you invest?,12/11/2021 3:33:00 PM
NKE,3 Cryptos to Buy in December for Gains in 2022,12/6/2021 5:06:25 PM
NKE,Investors Need To View Amazon as More Than Just One Business,12/3/2021 11:00:54 AM
NKE,7 Top Companies Reveal Their Plans for Metaverse Mania,12/2/2021 6:22:26 PM
NKE,'Wednesday's With Wedbush' On PreMarket Prep Plus: How Is The Retail Sector Looking?,12/1/2021 7:11:40 PM
NKE,"Key Black Friday Takeaways For Academy Sports, Dick's & Other Leisure Brands",11/30/2021 12:35:44 AM
NKE,7 Stocks to Buy On the Heels of the Biden-Xi Virtual China Summit,11/23/2021 6:33:33 PM
NKE,Nike Teams Up With Roblox To Create Virtual World ,11/18/2021 10:41:40 PM
NKE,10 Stellar Small-Cap Tech Stocks to Buy Before the Market Catches On,11/16/2021 5:57:41 PM
NKE,Chinese Stocks: Why Are BABA and JD Stocks Both Gaining Today?,11/11/2021 5:41:45 PM
NKE,Chipotle Mexican Grill Stock Looks Pricey as Labor Problems Bubble to the Surface,11/8/2021 11:00:16 AM
NKE,Facebook wants to rule the metaverse. What's the metaverse?,11/7/2021 4:02:00 PM
NKE,Can NVDA Stock Dethrone Facebook? What to Know About Nvidia’s Metaverse Plans.,11/4/2021 8:14:35 PM
NKE,DICK'S Sporting Goods and NIKE Create Connected Partnership,11/3/2021 12:00:00 PM
NKE,10 Long-term Stocks to Buy for the Next 15 Years,10/28/2021 7:42:10 PM
NKE,Crocs just flipped the script on the woes in the apparel sector,10/21/2021 2:33:02 PM
NKE,"Nike's Brand Legacy Continues To Outweigh China Headwinds, Goldman Sachs Says",10/12/2021 7:45:59 PM
NKE,What 9 Analyst Ratings Have To Say About Nike,10/5/2021 6:25:39 PM
NKE,"4 Top Stock Trades for Tuesday: NIO, FB, NKE, PENN",10/4/2021 9:39:25 PM
NKE,"The Latest Picks And Pans From Barron's Include Airlines, Energy, Steel And More",10/2/2021 7:56:05 PM
NKE,BofA Bearish On Foot Locker After Nike Warns Of Supply Chain Issues,9/30/2021 10:33:21 PM
NKE,"Foot Locker, Inc. -- Moody's assigns Ba2 to Foot Locker's senior unsecured notes; affirms Ba1 CFR",9/29/2021 4:35:00 PM
NKE,"4 Top Stock Trades for Tuesday: ACB, F, RIDE, NKE",9/27/2021 9:43:08 PM
NKE,Large-caps could be a 'raging short' if earnings estimates are right: Alpha Tactics,9/25/2021 8:03:57 PM
NKE,Mid-Afternoon Market Update: Dow Rises 40 Points; Meredith Shares Spike Higher,9/24/2021 9:06:30 PM
NKE,"NIKE Q1 Profit Beats Street View, But Revenue Misses ",9/23/2021 10:49:22 PM
NKE,Notable earnings after Thursday's close,9/22/2021 9:35:55 PM
NKE,What Wall Street expects from Nike's earnings,9/21/2021 3:01:18 PM
NKE,What 16 Analyst Ratings Have To Say About Nike,9/20/2021 6:15:33 PM
NKE,"Analysts Downgraded Nike, Fisker, Lordstown And Beyond Meat",9/19/2021 11:18:18 PM
NKE,ONON Stock: 9 Things to Know as On Holding (ONON) Starts Trading Today,9/15/2021 2:14:18 PM
NKE,ONON Stock IPO: When Does On Holding Go Public? What Is the ONON IPO Price Range?,9/14/2021 5:40:30 PM
NKE,"Benzinga's Top Ratings Upgrades, Downgrades For September 13, 2021",9/13/2021 4:17:54 PM
NKE,10 Biggest Price Target Changes For Tuesday,9/7/2021 2:33:21 PM
NKE,7 Stocks for Beginners to Buy This Back-to-School Season,9/1/2021 4:48:52 PM
NKE,Nike Gives Employees A Week To De-stress And Unwind ,8/31/2021 10:33:59 PM
NKE,The 7 Best Stocks to Buy for September,8/30/2021 6:28:04 PM
NKE,Welcome Home: Manchester United Stock Spikes After Signing Superstar Cristiano Ronaldo,8/27/2021 7:31:39 PM
NKE,"Q2 13F Roundup: How Buffett, Einhorn, Ackman And Others Adjusted Their Portfolios",8/17/2021 6:50:26 PM
NKE,"Rox Financial planning REIT IPOs to invest in sites leased to Amazon, Nike and Walgreens",8/11/2021 10:24:59 PM
NKE,7 Consumer Discretionary Stocks to Buy That Are Booking Record Profits,8/10/2021 6:10:15 PM
NKE,Under Armour Comeback Is Fueled by Lower Ambitions,8/9/2021 10:00:24 AM
NKE,3 Dividend Stocks to Buy for 10%-Plus Annual Dividend Growth,8/3/2021 5:35:12 PM
NKE,Could Under Armour's Stock Be Positioned For Significant Upside Ahead Of Earnings?,8/2/2021 6:12:44 PM
NKE,UBS names 14 retail stocks to buy as back-to-school shopping ramps up amid red-hot consumer spending - including one with 76% upside,7/31/2021 2:15:04 PM
NKE,Does Big Business Provide A Better Look Into Cannabis Reform Than Capitol Hill? Operators Believe So.,7/29/2021 3:20:59 PM
NKE,How the Wealth Gap Became an Abyss,7/27/2021 7:30:20 PM
NKE,"Price War or Not, Rocket’s a Steal at $15",7/26/2021 6:11:10 PM
NKE,"Snap, Twitter Earnings Impress, Potentially Setting Table For Facebook Next Week",7/23/2021 4:16:35 PM
NKE,What Did the Stock Market Do Today? 3 Big Stories to Catch Up On.,7/19/2021 9:01:36 PM
NKE,7 Tech Stocks to Buy With Breakout Potential for the Second Half of the Year,7/16/2021 8:38:22 PM
NKE,Gap pares declines on speculation of potential Athleta spinoff after Fabletics IPO report,7/15/2021 2:11:00 PM
NKE,Kate Hudson-backed athleisure brand Fabletics is said to hire banks for IPO,7/14/2021 9:19:14 PM
NKE,7 Stocks to Buy That Are Immune to the U.S. Labor Shortage,7/12/2021 6:32:21 PM
NKE,7 Strong Stocks to Buy for July 2021,7/2/2021 10:31:27 AM
NKE,7 Stocks That Could Be Big Winners From Increasing Interest Rates,6/30/2021 2:45:15 PM
NKE,55 Biggest Movers From Friday,6/28/2021 11:12:46 AM
NKE,"Nike Has Long Runway Growth With Focus On Direct Sales, Margin Growth: Analyst React To Q4",6/25/2021 10:28:53 PM
NKE,7 Stocks Moving In Thursday's After-Hours Session,6/24/2021 11:35:14 PM
NKE,Notable earnings after Thursday's close,6/23/2021 9:35:07 PM
NKE,Here's what to expect from Nike's earnings,6/22/2021 3:01:18 PM
NKE,7 Retail Stocks That Could See an Amazon Prime Day Boost ,6/21/2021 1:57:05 PM
NKE,Seeking Alpha Catalyst Watch,6/18/2021 7:30:24 PM
NKE,"Benzinga's Top Ratings Upgrades, Downgrades For June 17, 2021",6/17/2021 4:02:07 PM
NKE,Expert Ratings for Nike,6/16/2021 6:03:15 PM
NKE,"4 Top Stock Trades for Thursday: F, NKE, ZS, WYNN",5/26/2021 9:45:36 PM
NKE,3 Apparel Stocks to Try On As Consumers Buy New Clothes Again,5/24/2021 2:28:59 PM
NKE,"Naked Brand Group Stock Will Split Eventually, and Then You’ll Really Be Stuck",5/21/2021 11:29:25 AM
NKE,"Q1 13F Roundup: How Buffett, Einhorn, Ackman And Others Adjusted Their Portfolios",5/18/2021 6:39:22 PM
NKE,5 Best Celebrity Spokespersons Of All Time,5/15/2021 3:23:44 PM
NKE,10 Highest Paid Athletes And How They Made Their Money,5/14/2021 10:37:29 PM
NKE,7 Fitness Stocks Hoping to Take Peloton’s Crown,5/13/2021 4:28:43 PM
NKE,"Nike Just Does It: Analyst Likes Favorable Risk Reward, Shift From Wholesale To DTC",5/11/2021 11:22:56 PM
NKE,"Ethereum Is Great, Buying ETH Today Isn’t",5/10/2021 5:08:38 PM
NKE,Nike And Disney Lead The Dow Jones Higher To Close The Week,5/7/2021 11:00:47 PM
NKE,7 Stocks You May Not Know Depend on Semiconductors,5/5/2021 7:18:01 PM
NKE,7 Fitness Stocks for the New Normal in Exercise ,5/3/2021 4:31:03 PM
NKE,Swiss shoe company ON Running to prepare for IPO as early as September,4/30/2021 5:41:48 PM
