Ticker,Title,Link
ANET,"Nvidia results offer 'positive' read-throughs for Dell, Super Micro, HP Enterprise: JPM",8/29/2024 12:14:21 PM
ANET,Evercore ISI Remains a Buy on Arista Networks (ANET),8/14/2024 12:05:29 PM
ANET,3 Artificial Intelligence Stocks with Promising Applications,8/9/2024 10:56:00 AM
ANET,Arista Networks: A Strong Buy on AI Networking Growth and Market Expansion Potential,8/7/2024 11:55:44 AM
ANET,3 High-Growth Cloud Computing Stocks to Buy on the Dip,8/6/2024 11:45:00 AM
ANET,"Earnings week ahead: Disney, Duke Energy, Palantir, Shopify, Uber and more",8/4/2024 12:00:00 PM
ANET,"Catalyst Watch: Disney earnings, Costco sales update, MicroStrategy split, and eyes on AI patents",8/2/2024 7:00:00 PM
ANET,Get Your Money Out of These 3 AI Stocks by 2025,7/31/2024 5:52:17 PM
ANET,"Arista Networks, Inc. Q2 Profit Increases, Beats Estimates ",7/30/2024 10:38:19 PM
ANET,Notable earnings after Tuesday's close,7/29/2024 9:35:49 PM
ANET,3 Semiconductor Stocks to Bet On for Market-Crushing Returns,7/26/2024 12:53:34 PM
ANET,3 Top-Performing Stocks Beating the Big Names in 2024,7/25/2024 6:29:01 PM
ANET,Get Your Money Out of These 3 Overhyped Stocks by 2025,7/24/2024 10:30:00 AM
ANET,AudioEye to Report Q2 Earnings: What's in the Cards?,7/23/2024 9:38:59 PM
ANET,Arista Networks: Poised for Growth with Strong Enterprise Sales and AI Market Expansion,7/22/2024 10:36:52 AM
ANET,3 Edge Computing Stocks That Could Be Multibaggers in the Making: July Edition,7/19/2024 10:30:00 AM
ANET,"New Buy Rating for Arista Networks (ANET), the Technology Giant",7/18/2024 12:35:23 PM
ANET,5 Tech Stocks Set To Gain From US Chip Crackdown On China: JPMorgan,7/17/2024 10:23:57 PM
ANET,"If You Can Only Buy One Machine Learning Stock in July, It Better Be One of These 3 Names",7/16/2024 7:44:13 PM
ANET,Arista Networks (ANET) Gets a Hold from Piper Sandler,7/15/2024 10:45:24 AM
ANET,AI wave: Tech remains top-rated Quant pick as Q2 earnings near,7/10/2024 1:45:00 PM
ANET,3D Systems Expands Portfolio With Precision Partnership,7/9/2024 9:27:01 PM
ANET,Nvidia Gets Rare Downgrade Over Concerns That Demand Is Normalizing 'In Line With Expectations:' Stock 'Getting Fully Valued',7/6/2024 6:16:15 AM
ANET,Assessing SMART Global Stock Ahead of Its Q3 Earnings,7/5/2024 6:50:19 PM
ANET,Nokia Optimizes Network Infrastructure in Saudi Arabia,7/3/2024 9:52:24 PM
ANET,"Nokia, Telefonica Unite to Boost Spain's Private Network",7/2/2024 9:12:35 PM
ANET,Globant Introduces New AI Agents to Advance SDLC,7/1/2024 6:52:24 PM
ANET,Garmin Boosts Fitness Offerings With Edge 1050 Launch,6/28/2024 9:09:41 PM
ANET,3 Hardware Stocks to Buy for the Artificial Intelligence Era,6/27/2024 3:15:58 PM
ANET,3 Stocks to Buy That Are Up 100% Over the Past 52 Weeks,6/26/2024 12:48:09 AM
ANET,Ericsson Solution to Help Optimize Energy Consumption,6/25/2024 6:22:35 PM
ANET,Pure Storage's SLAs Bolster Cyber Resilient Services,6/24/2024 9:32:59 PM
ANET,Alphabet Rides on Strong Google Services Segment,6/21/2024 7:09:41 PM
ANET,Itron Stock Soars 36.1% YTD: Will the Rally Continue?,6/20/2024 6:23:19 PM
ANET,Seagate Collaborates With eBay to Boost Sustainability,6/19/2024 7:14:53 PM
ANET,Viasat Boosts Grupo Connectivity in Remote Locations,6/18/2024 9:49:03 PM
ANET,3 AI and Data Stocks Set to Leave Big Tech in the Dust,6/17/2024 7:11:09 PM
ANET,"Nasdaq 100, S&P 500 Close At Record Highs As Tech Stocks Reclaim Dominance: Thursday's Gainers & Losers",6/13/2024 10:38:57 PM
ANET,3 AI Stocks to Buy Next After the Nvidia Stock Split,6/12/2024 11:50:00 AM
ANET,BCE Subsidiary Bell Media Partners TikTok for Pulse Premiere,6/10/2024 7:31:03 PM
ANET,"Samsara's Q1 Earnings Beat Estimates, Revenues Up Y/Y",6/7/2024 9:24:45 PM
ANET,Pure Storage Invests in LandingAI to Boost Vision AI,6/6/2024 6:40:54 PM
ANET,Arista Networks: A Strong Buy on AI Networking Innovation and Strategic Industry Partnerships,6/5/2024 10:55:35 PM
ANET,"Science Applications Q1 Earnings Miss, Shares Fall 12%",6/4/2024 9:37:11 PM
ANET,Analysts Conflicted on These Technology Names: Arista Networks (ANET) and Autodesk (ADSK),6/3/2024 11:10:45 AM
ANET,Analysts Offer Insights on Technology Companies: Arista Networks (ANET) and Maxeon Solar Technologies (MAXN),5/31/2024 1:10:08 PM
ANET,The 3 Best Computer Hardware Stocks to Buy Now: May 2024,5/30/2024 7:40:25 PM
ANET,Netlist Wins $445 Million in Patent Violation Case,5/28/2024 6:56:23 PM
ANET,The 2030 Millionaire’s Club: 3 AI Stocks to Buy Now,5/26/2024 7:00:00 PM
ANET,"Intuit Q3 Earnings Beat Estimates, Revenues Rise Y/Y",5/24/2024 9:44:40 PM
ANET,Nvidia Just Issued a Possible Death Sentence for Arista Networks (ANET) Stock,5/23/2024 6:21:55 PM
ANET,Keysight Q2 Earnings Beat Estimate Despite Lower Revenues,5/21/2024 10:04:15 PM
ANET,Arista Networks: Sustained Growth and Market Expansion Fuel Buy Rating,5/20/2024 9:56:12 AM
ANET,"SONY's Q4 Earnings and Revenues Up Y/Y, 2024 Outlook Issued",5/15/2024 9:37:09 PM
ANET,3 Data Infrastructure Stocks Poised to Soar on Skyrocketing Demand,5/14/2024 1:00:00 PM
ANET,Broker Bets: The 3 Most Notable Analyst Upgrades to Know About Now,5/10/2024 8:37:29 PM
ANET,J.P. Morgan Reaffirms Their Buy Rating on Arista Networks (ANET),5/9/2024 12:26:16 PM
ANET,"Stocks Falter As Fed Signals Need For Higher-For-Longer Rates; Uber Crashes, Energy Sector Loses Ground: What's Driving Wednesday's Market?",5/8/2024 7:26:22 PM
ANET,"Arista Networks, Inc. Q1 Profit Increases, beats estimates",5/7/2024 11:08:26 PM
ANET,Arista Networks Vs. Globalfoundries: Which AI Stock Is The Better Buy Ahead Of Q1 Earnings?,5/6/2024 9:52:05 PM
ANET,"Earnings week ahead: Disney, Palantir, Shopify, Uber, Plug Power and more",5/5/2024 12:00:00 PM
ANET,"Analysts Offer Insights on Technology Companies: Arista Networks (ANET), Fortinet (FTNT) and Sprout Social (SPT)",5/3/2024 9:24:21 AM
ANET,Arista Networks: A Buy Opportunity Amid Sector Challenges,5/1/2024 10:07:00 AM
ANET,Nvidia’s Woes Are Your Windfall: 3 AI Stocks to Grab Now,4/29/2024 8:00:00 PM
ANET,"With rate cuts pushed out, Goldman looks at quality stocks",4/28/2024 7:24:54 PM
ANET,DoorDash to Report Q1 Earnings: What's in Store?,4/26/2024 10:33:51 PM
ANET,3 Stocks to Avoid According to Wall Street Analysts: April 2024,4/17/2024 8:21:54 PM
ANET,Why JPMorgan Shares Are Trading Lower By Around 5%? Here Are Other Stocks Moving In Friday's Mid-Day Session,4/12/2024 8:47:24 PM
ANET,"Nvidia Stock Trades At 13% Discount To Long-Term Average, Other AI Stocks At 52% Premium",4/11/2024 10:20:46 PM
ANET,3 Top Growth Stocks to Double Your Portfolio in the Next 24 Months,4/2/2024 5:56:48 PM
ANET,Arista Networks (NYSE:ANET): Betting on Innovation to Outpace Rivals,4/1/2024 8:46:01 PM
ANET,"Agilent, Shoe Carnival And 2 Other Stocks Insiders Are Selling",3/28/2024 1:21:42 PM
ANET,Computer hardware is the top Q1 industry performer but is shunned by benchmark indices,3/27/2024 3:45:36 PM
ANET,Silicon Valley’s Secret Sauce: 3 Tech Stocks With Breakout Potential,3/6/2024 8:13:38 PM
ANET,"Invest Like Wall Street, Not r/WallStreetBets: 3 Standout Stocks You Can Count On",3/4/2024 11:56:53 PM
ANET,3 Revolutionary Tech Stocks Set to Rocket in 2024,2/29/2024 7:06:36 PM
ANET,AI Innovators: 3 Future Stock Leaders to Watch Now,2/28/2024 4:31:26 PM
ANET,Tomorrow’s Titans: The 3 Most Promising Stocks Predicted to Skyrocket,2/27/2024 10:22:20 PM
ANET,Cream of the Crop: 3 Must-Buy Stocks From IBD’s Top 50,2/15/2024 8:54:18 PM
ANET,"Tepper's Appaloosa takes fresh stakes in Oracle, UPS; exits JD.com, EPD, ANET",2/14/2024 9:31:59 PM
ANET,Get Rich Quick With These 7 Tech Stocks to Buy Now,2/13/2024 8:49:58 PM
ANET,"Arista Networks tumbles despite strong guidance, Q4 results",2/12/2024 9:11:00 PM
ANET,Arista Q4 2023 Earnings Preview,2/11/2024 10:35:00 PM
ANET,Notable earnings after Monday's close,2/10/2024 10:35:58 PM
ANET,"Catalyst Watch: Coca-Cola earnings, Instacart lockup, 13F filings and more NYCB drama",2/9/2024 8:00:09 PM
ANET,Large and in Charge: 3 Large-Cap Stocks Ready for Lift-Off,2/8/2024 1:45:54 PM
ANET,Unlocking Value in AI Stocks: Strategic Insights Amidst Market Rotation,2/7/2024 11:47:17 PM
ANET,"Move Over, Tesla: 5 Stocks That Could Take Its Place in the Magnificent Seven",2/6/2024 8:33:01 PM
ANET,8 Analysts Have This To Say About Arista Networks,2/5/2024 10:00:22 PM
ANET,"Meta's AI development efforts could benefit Nvidia, AMD, others: Wells Fargo",2/2/2024 2:45:50 PM
ANET,This Year’s Magnificent 7 Stocks: 7 Names to Buy Now,2/1/2024 5:35:40 PM
ANET,3 AI Stocks Primed for Unprecedented Growth in 2024,1/31/2024 6:13:29 PM
ANET,3 Edge AI Stocks to Profit From Technology’s Next Big Thing,1/26/2024 4:14:20 PM
ANET,AMD gains as New Street Research upgrades on AI hopes,1/24/2024 5:02:13 PM
ANET,3 Stocks That Could Outperform the Magnificent 7 Stocks in 2024,1/22/2024 4:55:37 PM
ANET,S&P 500 Shatters Records: The Top-Performing Stocks In January 2024,1/19/2024 10:03:58 PM
ANET,What Analysts Are Saying About Arista Networks Stock,1/18/2024 7:00:29 PM
ANET,3 Stocks to Buy Now for the Coming AI-Fueled Bull Market,1/17/2024 8:30:06 PM
ANET,The 7 Most Undervalued Growth Stocks to Buy in January,1/16/2024 10:01:00 AM
ANET,‘Likely Windfall Moment’: JPMorgan Says AI-Driven Growth Will Lift These 3 IT Hardware Stocks,1/11/2024 10:35:28 AM
ANET,Don’t Bet on Tech M&A Wave Following HPE-JNPR Deal,1/10/2024 8:45:52 PM
ANET,The Age of AI: Picking the Next Winners,1/8/2024 12:57:35 PM
ANET,"SNPS, MDB, ANET: Which “Strong Buy” Tech Infrastructure Stock is Best?",1/5/2024 3:28:40 AM
ANET,The 3 Hottest AI Stocks to Watch in 2024,1/2/2024 10:25:26 PM
ANET,3 Top Computer Networking Stocks to Buy for 2024,1/1/2024 8:00:00 PM
ANET,3 AI-Backed Stocks That Could Deliver Massive Gains by 2028,12/20/2023 10:08:59 PM
ANET,Analysts Offer Insights on Technology Companies: Arista Networks (ANET) and Dell Technologies (DELL),12/14/2023 11:20:32 AM
ANET,Arista Networks Poised for Growth on Broadcom’s AI Networking Surge: A Buy Rating Justification,12/8/2023 10:25:39 AM
ANET,Arista Networks CFO Ita Brennan Quits; Names Chantelle Breithaupt Replacement ,12/1/2023 3:31:14 PM
ANET,"Arista Networks: Poised for Growth in AI Networking and Campus Sales, Earning a Buy Rating",11/30/2023 10:37:34 AM
ANET,Caution! These 3 Stocks Are Overbought After the November Rally.,11/29/2023 6:09:52 PM
ANET,3 Stocks That Will Make the Perfect Stocking Stuffers,11/25/2023 2:00:00 PM
ANET,3 Edge Computing Stocks Accelerating the Data Revolution,11/23/2023 3:11:42 AM
ANET,"Can Marvell Technology's AI Strengths Balance Persistent Industry Headwinds, This Analyst Has Answer",11/21/2023 7:38:11 PM
ANET,Jim Cramer: Avoid This Conglomerate — 'So Much Bad News Encapsulated The Stock',11/20/2023 3:01:48 PM
ANET,"Analysts Offer Insights on Technology Companies: Arista Networks (ANET), Kinetik (KNTK) and Amazon (AMZN)",11/13/2023 10:41:04 AM
ANET,Piper Sandler Sticks to Its Hold Rating for Arista Networks (ANET),11/10/2023 3:16:14 PM
ANET,7 AI Ecosystem Stocks That Are About to Explode,11/7/2023 12:19:48 PM
ANET,Dive into Investing With These 3 Top Generative AI Stocks,11/2/2023 2:05:17 PM
ANET,Catch the AI Boom: 3 Stocks to Watch Now,11/1/2023 8:55:39 PM
ANET,These Analysts Boost Their Forecasts On Arista Networks After Strong Q3 Results,10/31/2023 7:22:29 PM
ANET,"Arista Networks, Inc. Q3 Profit Increases, beats estimates",10/30/2023 9:30:31 PM
ANET,"Mattel, Meta, Align Technology And Other Big Stocks Moving Lower In Thursday's Pre-Market Session",10/26/2023 12:10:57 PM
ANET,Why Arista Networks Shares Are Dipping Today,10/11/2023 7:08:16 PM
ANET,Cisco Stock (NASDAQ:CSCO): Splunk Acquisition Signals Desperation,9/28/2023 6:42:20 AM
ANET,Don’t Miss the Boom: 3 Cybersecurity Stocks Set to Explode Higher,9/25/2023 8:00:32 PM
ANET,Jim Cramer Calls This Stock 'An Unbelievable Infrastructure Play': It's Up 43% In Past Year,9/21/2023 2:35:02 PM
ANET,The 3 Most Undervalued Forever Stocks to Buy in September 2023,9/16/2023 1:00:32 PM
ANET,Marathon Oil To Rally Around 70%? Here Are 10 Other Analyst Forecasts For Thursday,9/14/2023 2:07:09 PM
ANET,B of A Securities Maintains Buy Rating for Arista Networks: Here's What You Need To Know,9/13/2023 7:00:23 PM
ANET,The 3 Best Growth Stocks to Buy Now: September 2023,9/8/2023 11:46:29 PM
ANET,3 No-Brainer Growth Stocks to Buy Before It’s Too Late,9/1/2023 1:15:13 PM
ANET,7 Up-and-Coming AI Stocks to Put on Your Must-Buy List,8/31/2023 11:14:40 PM
ANET,Don’t Sleep on These 7 Tech Stocks That Will Mint Millionaires,8/28/2023 2:12:31 PM
ANET,Cramer Gives Auto Semiconductor Company A Thumbs Down: 'Self-Driving Has Hit A Snag',8/25/2023 3:05:58 PM
ANET,Revolutionizing Tech: 7 Growth Stocks to Grab for Dynamic Returns,8/23/2023 10:00:36 AM
ANET,These Are the ONLY 7 AI Stocks to Consider in August 2023,8/22/2023 1:08:46 PM
ANET,Cisco rises as Wall Street praises rising orders after strong Q4 results,8/17/2023 12:00:25 PM
ANET,Cisco earnings look-ahead: Improved enterprise spending to support revenue growth,8/15/2023 7:12:06 PM
ANET,3 Stocks You Should Buy for Growth Today,8/14/2023 11:16:18 PM
ANET,3 Emerging Companies Poised to Be Tech Stock Giants,8/2/2023 3:01:39 PM
ANET,"Arista Networks Shows Strong Growth Engine in 2Q23, Fueled by Enterprise Demand Surge: Analysts",8/1/2023 10:14:54 PM
ANET,"Arista Networks, Inc. Q2 Profit Increases, beats estimates",7/31/2023 10:14:33 PM
ANET,Notable earnings after Monday's close,7/30/2023 9:35:01 PM
ANET,"Catalyst Watch: Amazon earnings, jobs report, and will Apple talk AI?",7/28/2023 6:00:40 PM
ANET,"New Buy Rating for Arista Networks (ANET), the Technology Giant",7/27/2023 7:55:30 AM
ANET,JMP Securities Maintains Market Outperform Rating for Arista Networks: Here's What You Need To Know,7/26/2023 7:00:16 PM
ANET,7 Tech Stocks for Getting Rich in 2023,7/24/2023 12:09:53 PM
ANET,The 3 Best Value AI Stocks to Buy Right Now,7/23/2023 8:00:54 PM
ANET,"Benzinga's Top Ratings Upgrades, Downgrades For July 20, 2023",7/20/2023 5:00:43 PM
ANET,Analyst Ratings for Arista Networks,7/17/2023 8:00:45 PM
ANET,"Paycom, Chipotle highlight Goldman's Rule of 10 stock screens",7/4/2023 5:00:00 PM
ANET,Goldman Sachs Reveals Winning Portfolio: 'Rule of 10' Unlocks S&P 500's Future Top Performers,7/3/2023 3:24:56 PM
ANET,"Benzinga's Top Ratings Upgrades, Downgrades For June 30, 2023",6/30/2023 5:02:13 PM
ANET,3 AI Stocks That Could Get an Amazon-AMD Deal Boost,6/26/2023 9:52:06 AM
ANET,7 Hypergrowth Stocks to Buy for a New Bull Market,6/23/2023 12:37:38 PM
ANET,7 AI Stocks That Need to Be on Your Must-Watch List,6/20/2023 10:10:45 AM
ANET,The 3 Most Promising Edge Computing Stocks to Buy in June 2023,6/12/2023 11:00:42 AM
ANET,"Guess, Ralph Lauren, DISH Network, NVIDIA And Other Big Stocks Moving Higher On Thursday",5/25/2023 4:15:33 PM
ANET,Betting On AI? The 12 Stocks That Should Be On Your Radar,5/22/2023 7:21:56 PM
ANET,Why Analysts Maintain Caution On Cisco Systems After Better-Than-Expected Fiscal Q3 Earnings,5/18/2023 5:54:45 PM
ANET,Hero or Zero? 3 High-Risk AI Stocks That Could Make You Rich … or Broke.,5/16/2023 12:56:27 PM
ANET,7 Top-Rated Tech Stocks Worth Taking a Risk On,5/14/2023 6:00:11 PM
ANET,"New Buy Rating for Arista Networks (ANET), the Technology Giant",5/12/2023 12:15:36 PM
ANET,3 Overvalued S&P 500 Stocks to Dump Now,5/3/2023 1:03:14 PM
ANET,Where Arista Networks Stands With Analysts,5/2/2023 9:01:41 PM
ANET,"Arista Networks, Inc. Q1 Profit Increases, beats estimates",5/1/2023 10:25:44 PM
ANET,Notable earnings after Monday's close,4/30/2023 9:35:40 PM
ANET,"New Buy Rating for Arista Networks (ANET), the Technology Giant",4/28/2023 1:15:22 PM
ANET,"Analysts’ Opinions Are Mixed on These Technology Stocks: Arista Networks (ANET), Block (SQ) and Tenable Holdings (TENB)",4/25/2023 12:21:12 PM
ANET,"New Buy Rating for Arista Networks (ANET), the Technology Giant",4/19/2023 4:25:47 PM
ANET,Baidu To Rally Around 25%? Here Are 10 Other Analyst Forecasts For Friday,4/14/2023 2:04:52 PM
ANET,Expert Ratings for Arista Networks,4/5/2023 5:00:34 PM
ANET,"Congressman Michael McCaul’s Recent Trades: COP, ANET & PYPL",3/24/2023 11:39:56 AM
ANET,3 AI Stocks to Buy Sitting in the Sweet Spot,3/23/2023 10:45:19 AM
ANET,Arista Networks Is Poised To Benefit From Cloud Data Growth: Goldman Sachs Analyst,3/7/2023 4:49:06 PM
ANET,"Cisco (NASDAQ:CSCO) Stock: Great Value, but Competition is Heating Up",2/20/2023 11:21:42 PM
ANET,"Cisco leaps as Q2 results, guidance blow past expectations",2/15/2023 9:27:58 PM
ANET,Arista Networks (ANET): New Buy Recommendation for This Technology Giant,2/14/2023 12:05:20 PM
ANET,"Arista Networks, Inc. Q4 Profit Increases, beats estimates",2/13/2023 10:25:06 PM
ANET,Notable earnings after Monday's close,2/12/2023 10:35:26 PM
ANET,"Catalyst watch: Inflation reads, Roblox and DoorDash in the spotlight",2/10/2023 7:30:55 PM
ANET,"Meta's spending cuts could impact Arista, Nvidia and Pure Storage",2/5/2023 4:00:00 PM
ANET,Credit Suisse expands 'Top of the Crop' list to five stocks,1/16/2023 4:01:01 PM
ANET,The 7 Best Edge Computing Stocks to Buy for the Coming Boom,12/31/2022 8:10:35 PM
ANET,7 ‘Next Big Things’ for Investors to Buy for 2023,12/13/2022 6:16:45 PM
ANET,Microsoft among Credit Suisse's latest 'Top of the Crop' ideas,12/12/2022 3:22:32 PM
ANET,7 Tech Stocks to Take Seriously in 2023,12/2/2022 11:59:30 AM
ANET,What 15 Analyst Ratings Have To Say About Arista Networks,11/21/2022 7:00:41 PM
ANET,"Cisco pops as tech giant raises full-year guidance, Q1 results surpass expectations (updated)",11/16/2022 9:40:40 PM
ANET,7 Strong Tech Stocks to Buy Now for the Upcoming Bull Market,11/10/2022 2:47:42 PM
ANET,Which Semiconductor Stock Is Wall Street’s Favorite Pick Amid the Current Pullback?,11/8/2022 8:48:39 PM
ANET,"Analysts Offer Insights on Technology Companies: Arista Networks (ANET), Liberty Broadband (LBRDK) and DoorDash (DASH)",11/7/2022 4:30:54 PM
ANET,"Benzinga's Top Ratings Upgrades, Downgrades For November 4, 2022",11/4/2022 3:41:38 PM
ANET,Arista Networks rises 3% as analysts look to Investor Day,11/1/2022 4:29:12 PM
ANET,"Arista Networks, Inc. Q3 Profit Increases, beats estimates",10/31/2022 9:23:54 PM
ANET,Notable earnings after Monday's close,10/30/2022 9:35:00 PM
ANET,Arista Q3 2022 Earnings Preview,10/28/2022 3:42:03 PM
ANET,Rosenblatt Securities Sticks to Their Buy Rating for Arista Networks (ANET),10/27/2022 9:25:18 PM
ANET,3 Tech Stocks to Consider amid Tough Times,10/26/2022 12:17:33 AM
ANET,"Benzinga's Top Ratings Upgrades, Downgrades For October 25, 2022",10/25/2022 4:19:00 PM
ANET,Arista Networks (ANET): New Buy Recommendation for This Technology Giant,10/15/2022 12:16:13 PM
ANET,16 Analysts Have This to Say About Arista Networks,10/11/2022 4:06:39 PM
ANET,"Use short-term rallies to boost high-momentum stock exposure, Wells Fargo says",10/5/2022 12:15:30 PM
ANET,The 7 Best 5G Stocks to Buy Now for the Long Haul,10/3/2022 10:30:35 AM
ANET,"Benzinga's Top Ratings Upgrades, Downgrades For September 22, 2022",9/22/2022 4:41:29 PM
ANET,18 Analysts Have This to Say About Arista Networks,9/21/2022 4:05:41 PM
ANET,Credit Suisse 'Top of the Crop' list down to one name,9/18/2022 10:15:20 PM
ANET,Tesla Fame's Robot-Run ETF Sold Its Entire Apple Stake In August — Here's What It Bought,9/9/2022 1:14:39 PM
ANET,"Benzinga's Top Ratings Upgrades, Downgrades For August 24, 2022",8/24/2022 4:11:35 PM
ANET,"Cisco Systems shares climb 6%; analysts praise outlook, supply chain execution",8/18/2022 2:27:54 PM
ANET,Cisco set for results amid some cautious optimism on Wall Street,8/17/2022 11:00:00 AM
ANET,3 Best Funds for Aggressive Investors,8/11/2022 8:44:15 PM
ANET,"Aspen's (AZPN) Q4 Earnings Beat Estimates, Revenues Up Y/Y",8/9/2022 5:49:45 PM
ANET,Where Arista Networks Stands With Analysts,8/2/2022 5:28:31 PM
ANET,"Arista Networks, Inc. Q2 Profit Increases, beats estimates",8/1/2022 10:38:51 PM
ANET,Notable earnings after Monday's close,7/31/2022 9:35:52 PM
ANET,Needham Sees Comm & Enterprise Infra Budgets Intact; Priorities Shifting to Security and Cloud,7/25/2022 6:18:55 PM
ANET,"Why This Analyst Is Upgrading Check Point Software, Downgrading These 3 Networking, Security Stocks",7/20/2022 6:01:21 PM
ANET,Why This Arista Networks Analyst Has Turned Bullish,7/19/2022 6:06:51 PM
ANET,"Benzinga's Top Ratings Upgrades, Downgrades For July 13, 2022",7/13/2022 4:07:16 PM
ANET,"Apple, HP Enterprise at risk of a huge downside if a recession happens",7/10/2022 4:05:00 PM
ANET,Expert Ratings for Arista Networks,6/14/2022 3:33:38 PM
ANET,Executives Sell More Than $61M Of 4 Stocks,6/8/2022 1:56:11 PM
ANET,"Thomas Gayner Purchases 5,000 Shares of Cable One (CABO) For Markel",6/6/2022 5:00:15 PM
ANET,"Cisco takes a dive on weak Q3 results, guidance; analysts see more trouble ahead",5/19/2022 1:56:13 PM
ANET,Cisco's Robbins says guidance 'not a reflection of demand issue',5/18/2022 9:04:31 PM
ANET,More boxes checked off in stock market bottom checklist,5/17/2022 11:00:29 AM
ANET,Analyst Ratings for Arista Networks,5/3/2022 3:00:13 PM
ANET,"Arista Networks, Inc. Q1 Profit Increases, beats estimates",5/2/2022 10:12:44 PM
ANET,Notable earnings after Monday's close,5/1/2022 9:35:12 PM
ANET,Arista Networking slumps 7% as tech stocks sell off following Fed minutes,4/6/2022 7:07:19 PM
ANET,"Why This Apple, Qualcomm Analyst Says The Stocks Are Vulnerable To Shift In Consumer Spending",4/1/2022 6:12:38 PM
ANET,"Why Wells Fargo Is Turning Bullish On Arista Networks, Neutral On Cisco",3/10/2022 6:43:03 PM
ANET,Insiders Sell More Than $400M Of 5 Stocks,3/8/2022 1:48:20 PM
ANET,"Insiders Including Co-founder Joe Gebbia, Selling Airbnb (ABNB) Despite The Recent Pullback",3/7/2022 3:45:29 PM
ANET,Why This Analyst Believes In Credo Technology,2/22/2022 4:37:36 PM
ANET,55 Biggest Movers From Yesterday,2/16/2022 10:52:02 AM
ANET,4 Arista Networks Analysts Weigh In On Sustainability Of Strong Growth Following Q4 Print,2/15/2022 9:22:57 PM
ANET,"Arista Networks, Inc. Q4 Profit Increases, beats estimates",2/14/2022 10:10:04 PM
ANET,Notable earnings after Monday's close,2/13/2022 10:35:00 PM
ANET,Arista Q4 2021 Earnings Preview,2/11/2022 10:35:19 PM
ANET,Analysts Cut F5 Price Target Following Lack-Lustre Outlook,1/26/2022 5:56:06 PM
ANET,"Benzinga's Top Ratings Upgrades, Downgrades For January 24, 2022",1/24/2022 4:04:07 PM
ANET,10 Biggest Price Target Changes For Wednesday,1/19/2022 1:27:38 PM
ANET,3 New ETFs to Put on Your January Buy List,1/18/2022 7:57:17 PM
ANET,Read Why Morgan Stanley Sees 26% Upside In II-VI,12/15/2021 2:00:09 PM
ANET,"Cisco, Apple pace Evercore's top IT picks as 2022 maintains 'roaring '20s'",12/14/2021 6:49:58 PM
ANET,Arista Networks Could Rise 25% Based on Its Huge Free Cash Flow,12/10/2021 7:18:16 PM
ANET,Grading 7 Big 5G Stocks as 2022 Looms,12/9/2021 2:15:41 PM
ANET,The 3-Week Slide in Arista Network Stock Is an Opportunity,12/8/2021 4:09:15 PM
ANET,Invest in the Future of Cloud Technology With Arista Networks,12/6/2021 5:53:13 PM
ANET,Cybersecurity Play Arista Networks Looks More Attractive After Its Share Split,11/30/2021 3:06:54 PM
ANET,10 Biggest Price Target Changes For Monday,11/29/2021 1:27:46 PM
ANET,Arista Networks sheds 2% after Morgan Stanley downgrade,11/19/2021 2:33:34 PM
ANET,CVS Store Closings: 6 Things for CVS Stock Investors to Know About Plan to Close 900 Locations,11/18/2021 5:30:15 PM
ANET,71 Biggest Movers From Yesterday,11/3/2021 8:40:30 AM
ANET,Analysts Bump Up Arista Networks Price Target Post Q3 Results,11/2/2021 9:36:07 PM
ANET,Arista Networks announces additional $1B stock buyback authorization,11/1/2021 9:36:47 PM
ANET,Arista Q3 2021 Earnings Preview,10/31/2021 9:35:00 PM
ANET,"Catalyst watch for next week: FOMC and OPEC meetings, Beyond Meat hits McDonald's stores and more eyes on crypto",10/29/2021 7:00:57 PM
ANET,"Nvidia, Arista rise amid enthusiasm for Facebook's spending plans",10/26/2021 3:05:28 PM
ANET,4 Stocks Insiders Are Selling,10/18/2021 11:23:06 AM
ANET,Where Arista Networks Stands With Analysts,8/3/2021 6:34:33 PM
ANET,"Arista Networks, Inc. Q2 adjusted earnings Beat Estimates",8/2/2021 10:20:37 PM
ANET,Arista Q2 2021 Earnings Preview,8/1/2021 9:35:00 PM
ANET,Arista Networks earnings preview: what Wall Street is expecting,7/31/2021 3:01:21 PM
ANET,What the qaunts want: here are the top 10 stocks: Sector Watch,6/27/2021 6:13:46 PM
ANET,BTIG's best and worst stocks for Operation Grand Slam,6/1/2021 3:34:46 PM
ANET,The 'new momentum' stocks to watch: Alpha Tactics,5/15/2021 10:45:29 PM
ANET,Analyst Ratings for Arista Networks,5/5/2021 3:46:26 PM
ANET,"Arista Networks, Inc. Q1 adjusted earnings Beat Estimates",5/4/2021 10:25:21 PM
ANET,Arista Q1 2021 Earnings Preview,5/3/2021 9:35:45 PM
ANET,What Wall Street expects from Arista Networks's earnings,5/2/2021 3:01:32 PM
ANET,10 Biggest Price Target Changes For Friday,2/19/2021 1:45:25 PM
ANET,12 Stocks Moving In Thursday's After-Hours Session,2/18/2021 11:21:32 PM
ANET,Notable earnings after Thursday's close,2/17/2021 10:35:43 PM
ANET,Here's what Wall Street expects from Arista Networks's earnings report,2/16/2021 3:01:35 PM
ANET,"Cisco Analysts On COVID-19 Recovery, Challenges, Valuation After Q2 Print",2/10/2021 6:00:58 PM
ANET,Barclays edges more positive on IT hardware - but sees 10% downside for one giant,1/15/2021 12:28:19 AM
ANET,"Benzinga's Top Upgrades, Downgrades For January 7, 2021",1/7/2021 6:10:07 PM
ANET,"Benzinga's Top Upgrades, Downgrades For January 6, 2021",1/6/2021 4:14:45 PM
ANET,Morgan Stanley lifts view on networking equipment sector; LITE stock +6.5% on upgrade to Overweight,12/15/2020 7:27:28 PM
ANET,Nokia Needs a Win Now or Risks Serious Hemorrhaging,12/4/2020 8:53:20 PM
