Ticker,Title,Link
ANET,"Needham reviews the names stealing Cisco's share, and high-upside optical networkers",11/24/2020 11:54:40 PM
ANET,7 5G ETFs to Invest In As the World Switches Over,11/5/2020 5:04:42 PM
ANET,Arista Networks and MicroVision among tech gainers; SolarEdge Technologies and Intelligent Systems among losers,11/3/2020 8:00:51 PM
ANET,"ANET, JAKK, PACB and SEDG among after-hours movers",11/2/2020 10:48:33 PM
ANET,Arista Q3 2020 Earnings Preview,11/1/2020 10:35:45 PM
ANET,Seeking Alpha Catalyst Watch,10/23/2020 7:30:23 PM
ANET,"No bubble for networking/IT hardware stocks, but be selective - J.P. Morgan",10/12/2020 9:58:32 PM
ANET,Arista Networks Stock Boosted 5% by Analyst Upgrade,10/8/2020 7:47:25 PM
ANET,Arista Networks To Acquire Awake Security - Quick Facts ,9/28/2020 3:13:11 PM
ANET,"Arista Networks, Inc. Q2 adjusted earnings Beat Estimates",8/4/2020 10:39:18 PM
ANET,Here's what Wall Street expects from Arista Networks's earnings,8/3/2020 3:01:57 PM
ANET,"Despite spending slowdown, Nomura sees cloud computing boost in pandemic",5/13/2020 10:58:14 PM
ANET,"Arista Networks, Inc. Q1 adjusted earnings Beat Estimates",5/5/2020 10:26:50 PM
ANET,Arista Q1 2020 Earnings Preview,5/4/2020 9:35:52 PM
ANET,Barron's doubles down on 12 YTD winners,4/13/2020 5:12:58 PM
ANET,7 Tarnished Blue-Chip Stocks to Ditch Now,4/8/2020 1:25:49 PM
ANET,Teladoc Health and Glu Mobile among Tech gainers;  TELUS and Covetrus among losers,3/18/2020 7:01:44 PM
ANET,Arista unveils compact optical line system,3/9/2020 8:29:44 PM
ANET,Risk-on VMware Stock Isn’t The Play For Coronavirus Markets,3/5/2020 4:55:24 PM
ANET,VMware Is a Very Profitable and Cheap Cloud Stock,3/3/2020 2:46:45 PM
ANET,"AEM, CARG among premarket losers",2/14/2020 2:09:52 PM
ANET,"NVDA, ANET, EXPE and TLND among after hours movers",2/13/2020 10:56:41 PM
ANET,Arista Q4 2019 Earnings Preview,2/12/2020 10:35:48 PM
ANET,Earnings Need to Re-Inspire Confidence in Cisco Stock,2/4/2020 2:57:00 PM
ANET,Look for This Recovery in Cisco Stock to Carry Well into 2020,1/3/2020 1:03:14 PM
ANET,"3 Big Stock Charts for Friday: 3M, Arista Networks, and Gap",12/20/2019 12:13:53 PM
ANET,"If You Own Nokia Stock, Prepare for More of the Same Disappointments",11/22/2019 11:40:27 AM
ANET,"After Cisco Stock’s Post-Results Battering, is it Time for a Long-Term Buy?",11/21/2019 1:05:40 PM
ANET,7 Earnings Reports to Watch Next Week,11/14/2019 7:53:31 PM
ANET,Cisco Stock Is Waiting for the 5G Storm,11/6/2019 4:08:07 PM
ANET,Was Wall Street Wrong About Arista Network Stock?,11/4/2019 6:59:24 PM
ANET,Arista Networks Earnings: ANET Stock Plummets 24% on Dismal Outlook,11/1/2019 8:40:01 PM
ANET,"Buy Cisco Stock for the Bargain, Stick With it for the Stability",9/9/2019 5:49:59 PM
ANET,Cisco Stock May Go Nowhere for a While,9/3/2019 1:49:49 PM
ANET,Stock Market Today: Fight the Fed or Fight the President? ,8/2/2019 8:10:23 PM
ANET,Here's what Wall Street expects from Arista Networks's earnings,7/30/2019 3:03:13 PM
ANET,10 Tech Stocks That Are Still Worth Your Time (And Money),7/18/2019 7:18:44 PM
ANET,Nasdaq Today: M&A Fuels Stocks; Streaming Wars to Heat Up,7/9/2019 8:30:00 PM
ANET,"Nasdaq Today: iQiyi Surges on Award; Intel, Cisco Struggle",6/27/2019 8:22:09 PM
ANET,Arista Networks earnings preview: what Wall Street is expecting,4/30/2019 3:02:46 PM
ANET,Arista Networks earnings preview: what Wall Street is expecting,2/12/2019 3:03:10 PM
ANET,Arista Networks is about to announce its earnings — here's what Wall Street expects,10/30/2018 3:03:29 PM
ANET,REFILE-BRIEF-Arista Networks To Pay Cisco $400 Mln To Resolve Pending Litigation,8/6/2018 5:13:56 PM
ANET,What Wall Street expects from Arista Networks's earnings,7/31/2018 3:02:53 PM
ANET,"BRIEF-Arista Networks Says ‍On March 23, Administrative Law Judge At International Trade Commission Issued A Recommended Determination​",3/28/2018 12:29:00 PM
ANET,"Technical Insights on Computer Systems Stocks -- Arista Networks, Diebold Nixdorf, Dell Technologies, and Hewlett Packard Enterprise",8/30/2017 12:55:00 PM
ANET,"Cisco once created a 'Tiger Team' to attack a hated rival (CSCO, ANET)",8/17/2017 9:00:06 PM
ANET,"Cisco has scored a victory over a major rival: Arista's products are banned from entering the US (CSCO, ANET)",7/6/2017 2:48:09 AM
ANET,"Stocks Under Scanner in the Diversified Computer Systems Space -- Hewlett Packard Enterprise, Dell Technologies, Diebold Nixdorf, and Arista Networks",6/8/2017 12:50:00 PM
ANET,"Research Reports Coverage on Computer Systems Stocks -- Dell Technologies, Diebold Nixdorf, Arista Networks, and Cray",4/20/2017 1:10:00 PM
ANET,"Glance Technologies Appoints Former VP of Cisco Systems, Inc. to Board of Directors",4/19/2017 2:46:00 PM
ANET,Arista Networks Holding On To Strong Gain In Afternoon Trading ,2/17/2017 8:39:50 PM
ANET,"Cisco's hated rival Arista has won a big victory in court (ANET, CSCO)",12/15/2016 12:15:47 AM
