Ticker,Title,Link
NARI,Inari Medical Announces PEERLESS Data to be Presented During the Late-Breaking Clinical Trial Sessions at TCT 2024,8/29/2024 10:05:00 PM
NARI,Inari Medical’s Resilience and Market Potential Affirm Buy Rating,8/26/2024 10:36:02 AM
NARI,Inari Medical to Present at Upcoming Investor Conferences,8/21/2024 10:05:00 PM
NARI,Inari Medical (NARI) Receives a New Rating from Deutsche Bank,8/9/2024 2:00:27 PM
NARI,7 Leading MedTech Stocks for Next-Gen Health Solutions,7/31/2024 6:30:32 PM
NARI,Inari Medical Announces Chief Financial Officer Retirement and Succession Plan,7/30/2024 10:10:00 PM
NARI,Inari Medical Q2 2024 Earnings Preview,7/29/2024 9:35:29 PM
NARI,"Needham cuts Inari to hold, cites competitive concerns",7/18/2024 6:32:10 PM
NARI,Inari Medical to Announce Second Quarter 2024 Financial Results,7/16/2024 10:05:00 PM
NARI,Analysts Offer Insights on Healthcare Companies: Inari Medical (NARI) and Health Catalyst (HCAT),6/7/2024 9:10:24 AM
NARI,Inari's Expanding Product Portfolio Offsets Competition,6/4/2024 6:32:37 PM
NARI,Inari Medical: A Strong Buy on Robust 2024 Outlook and Market Expansion Strategies,5/31/2024 6:46:14 PM
NARI,"Analysts Offer Insights on Healthcare Companies: Inari Medical (NARI), Biogen (BIIB) and SOPHiA GENETICS (SOPH)",5/28/2024 10:50:08 AM
NARI,Inari Medical Files Patent Infringement Lawsuit Against Imperative Care and Truvic Medical,5/23/2024 2:00:00 PM
NARI,Inari Medical: A Strong Buy on Growth and Market Expansion Potential,5/13/2024 10:57:12 AM
NARI,"Novo Nordisk, Flagship to develop next-generation obesity drugs",5/9/2024 5:22:28 PM
NARI,Inari Medical to Participate in the 2024 Bank of America Securities Healthcare Conference,5/6/2024 1:00:00 PM
NARI,"Analysts Are Bullish on Top Healthcare Stocks: Qiagen (QGEN), Inari Medical (NARI)",5/2/2024 6:45:15 AM
NARI,"Analysts Offer Insights on Healthcare Companies: Inari Medical (NARI), Exelixis (EXEL) and Merit Medical Systems (MMSI)",5/1/2024 3:11:46 PM
NARI,Inari Medical Reports First Quarter 2024 Financial Results,4/30/2024 10:05:00 PM
NARI,Notable earnings after Tuesday's close,4/29/2024 9:35:36 PM
NARI,Inari Medical to Announce First Quarter 2024 Financial Results,4/17/2024 10:05:00 PM
NARI,"Needham sees BSX, CNMD, RMD beating Street, despite medtech slow down",4/14/2024 9:56:08 PM
NARI,What 8 Analyst Ratings Have To Say About Inari Medical,4/12/2024 7:01:40 PM
NARI,Inari Medical Announces the Release of 2023 Ethos and Sustainability Report,4/11/2024 10:05:00 PM
NARI,Analysts Have Conflicting Sentiments on These Healthcare Companies: Inari Medical (NARI) and Roivant Sciences (ROIV),4/3/2024 9:03:28 AM
NARI,Inari Medical Strengthens Senior Leadership Team with Addition of Two Executives,4/2/2024 10:05:00 PM
NARI,"AppFolio set to join S&P MidCap 400, shares rise",3/26/2024 2:39:43 PM
NARI,Forecasting The Future: 7 Analyst Projections For Inari Medical,3/22/2024 3:01:04 PM
NARI,Inari Medical Announces Interim Two-Year Results from the ClotTriever CLOUT Registry,3/12/2024 9:05:00 PM
NARI,"Catalyst Watch: Oracle earnings, Arm IPO lockup, and triple-witching day",3/8/2024 8:00:00 PM
NARI,Inari Medical Buy Rating Justified by Industry-Standard Physician Payments and Resilient Sector Trends,3/6/2024 10:35:15 AM
NARI,"Piper Sandler cuts Inari to neutral; cites slowing growth, DOJ probe",3/1/2024 9:03:07 PM
NARI,Why Butterfly Network Shares Are Trading Lower By 22%? Here Are Other Stocks Moving In Thursday's Mid-Day Session,2/29/2024 8:00:01 PM
NARI,"WW, DUOL and VYGR are among after hour movers",2/28/2024 10:48:46 PM
NARI,Inari Medical Q4 2023 Earnings Preview,2/27/2024 10:35:13 PM
NARI,Inari Medical to Announce Fourth Quarter and Full Year 2023 Financial Results,2/14/2024 10:05:00 PM
NARI,Inari Medical (NARI) Receives a Hold from Truist Financial,1/31/2024 2:25:38 AM
NARI,"FIVN, HLIT and SANM are among after hour movers",1/29/2024 9:59:37 PM
NARI,"Needham starts Inari at buy, citing improving operating margins",1/23/2024 9:32:02 PM
NARI,Inari Medical: Strong Q4 Performance and Promising Growth Trajectory Justify Buy Rating,1/10/2024 10:40:28 AM
NARI,Inari Medical Expects 22% Increase In Q4 Revenue ,1/9/2024 1:11:37 PM
NARI,BTIG Remains a Buy on Inari Medical (NARI),1/7/2024 10:38:54 AM
NARI,Piper Sandler Keeps Their Buy Rating on Inari Medical (NARI),1/5/2024 12:55:46 PM
NARI,BTIG Keeps Their Buy Rating on Inari Medical (NARI),1/2/2024 2:28:40 PM
NARI,Inari Medical to Present at the 42nd Annual J.P. Morgan Healthcare Conference,12/20/2023 10:01:00 PM
NARI,Piper Sandler Remains a Buy on Inari Medical (NARI),12/19/2023 11:37:54 AM
NARI,Analysts Offer Insights on Healthcare Companies: Tactile Systems Technology (TCMD) and Inari Medical (NARI),12/12/2023 9:30:34 PM
NARI,Inari Medical Announces First Patient Enrollment in PEERLESS II Randomized Controlled Trial (RCT),11/27/2023 10:20:00 PM
NARI,Inari Medical Closes Acquisition of LimFlow,11/15/2023 10:05:00 PM
NARI,Travis Steed’s Buy Rating on Inari Medical: Strong Q3 Performance and Confidence in Surpassing 2024 Market Growth Estimates,11/6/2023 10:27:47 AM
NARI,Why STAAR Surgical Shares Are Trading Lower By Around 16%? Here Are Other Stocks Moving In Thursday's Mid-Day Session,11/2/2023 7:26:27 PM
NARI,Inari Medical is about to announce earnings — here's what Wall Street expects,10/31/2023 3:01:13 PM
NARI,Inari Medical (NARI) Gets a Buy from BTIG,10/16/2023 9:46:38 AM
NARI,Inari Medical (NARI) Receives a Hold from Truist Financial,8/7/2023 2:26:35 AM
NARI,"Analysts Offer Insights on Healthcare Companies: Blueprint Medicines (BPMC), Inari Medical (NARI) and Sarepta Therapeutics (SRPT)",8/4/2023 7:40:29 AM
NARI,"Clorox, Boot Barn, Herbalife, Upwork And Other Big Stocks Moving Higher On Thursday",8/3/2023 4:57:55 PM
NARI,"Inari Medical GAAP EPS of $0.04 beats by $0.16, revenue of $119M beats by $2.28M",8/2/2023 8:25:15 PM
NARI,Inari Medical Q2 2023 Earnings Preview,8/1/2023 9:35:57 PM
NARI,"Benzinga's Top Ratings Upgrades, Downgrades For July 19, 2023",7/19/2023 5:00:50 PM
NARI,The 3 Best Hidden Gem Stocks to Buy in May Before They Breakout,5/9/2023 6:45:24 PM
NARI,Analyst Expectations for Inari Medical's Future,5/4/2023 9:00:24 PM
NARI,Inari Medical beats Q1 top and bottom line estimates; raises FY23 outlook,5/3/2023 9:01:19 PM
NARI,Inari Medical Q1 2023 Earnings Preview,5/2/2023 9:35:39 PM
NARI,Inari gains as FlowTriever cuts mortality risk by 90% in pulmonary embolism,3/6/2023 2:11:07 PM
NARI,Bank of America Securities Keeps Their Buy Rating on Inari Medical (NARI),2/28/2023 12:35:09 PM
NARI,"Inari Medical GAAP EPS of -$0.11 beats by $0.06, revenue of $107.8M beats by $2.95M, guidance reaffirmed",2/27/2023 9:11:35 PM
NARI,Notable earnings after Monday's close,2/26/2023 10:35:56 PM
NARI,Inari Medical Q4 2022 Earnings Preview,2/24/2023 10:35:12 PM
NARI,Analyst Ratings for Inari Medical,2/21/2023 8:01:30 PM
NARI,Stocks 'disconnected from reality'; Morgan Stanley screens those 'unfairly punished',2/13/2023 4:43:45 PM
NARI,BTIG Sticks to Its Buy Rating for Inari Medical (NARI),2/8/2023 10:05:10 PM
NARI,Analysts Offer Insights on Healthcare Companies: Inari Medical (NARI) and Axsome Therapeutics (AXSM),2/6/2023 12:20:33 PM
NARI,Analyst Expectations for Inari Medical's Future,1/31/2023 2:01:49 PM
NARI,Penumbra's new thrombosis system will drive growth in underpenetrated markets: Wells Fargo,1/19/2023 7:22:20 PM
NARI,Inari Medical gains as outlook exceeds forecasts,1/10/2023 3:43:04 PM
NARI,Morgan Stanley Keeps Their Buy Rating on Inari Medical (NARI),1/6/2023 4:26:37 PM
NARI,Med-tech companies could make sense for health care investors in 2023 as defensive sector,12/24/2022 9:00:00 PM
NARI,What 6 Analyst Ratings Have To Say About Inari Medical,12/20/2022 6:00:35 PM
NARI,Wall Street Analysts Are Bullish on Top Healthcare Picks,11/21/2022 2:02:06 AM
NARI,Analyst Ratings for Inari Medical,11/3/2022 8:37:31 PM
NARI,"Inari Medical GAAP EPS of -$0.19 beats by $0.06, revenue of $96.2M beats by $5.37M",11/2/2022 8:12:33 PM
NARI,What Wall Street expects from Inari Medical's earnings,11/1/2022 3:01:13 PM
NARI,Where Inari Medical Stands With Analysts,10/17/2022 6:10:58 PM
NARI,Inari Medical (NARI) Receives a Buy from BTIG,10/14/2022 2:05:09 PM
NARI,"Benzinga's Top Ratings Upgrades, Downgrades For October 12, 2022",10/12/2022 4:02:53 PM
NARI,Where Inari Medical Stands With Analysts,9/29/2022 6:06:33 PM
NARI,Study assessing Inari Medical's blood clot removal system shows low rate of adverse events,9/19/2022 6:29:31 PM
NARI,Inari initiated Hold at Truist; notes competition overshadows market potential,9/13/2022 4:56:03 PM
NARI,"Catalyst watch: Amgen data, Starbucks & Roblox events and Twitter vote on Elon Musk deal",9/9/2022 7:00:17 PM
NARI,Inari Medical has best day in over a year as shares climb as much as 14% at one point,8/31/2022 8:19:02 PM
NARI,"VNDA On Watch, NUVA Q2 Results Miss Estimates, MRTX Awaits FDA Decision... ",8/4/2022 11:25:05 AM
NARI,Inari Medical stock falls as Q2 sees net loss; COO to helm company next year,8/3/2022 10:10:29 PM
NARI,Notable earnings after Wednesday's close (updated),8/2/2022 9:35:54 PM
NARI,Morgan Stanley Maintains Overweight Rating for Inari Medical: Here's What You Need To Know,7/15/2022 6:08:01 PM
NARI,Inari draws Overweight rating as Piper Sandler launches coverage,6/21/2022 5:47:31 PM
NARI,"ARWR, GDRX and ESPR among after hour movers.",6/15/2022 9:24:08 PM
NARI,OKAMI MEDICAL ANNOUNCES FDA 510(k) CLEARANCE OF THE LOBO-7 and LOBO-9 VASCULAR OCCLUDERS TO ADDRESS A WIDE RANGE OF PERIPHERAL EMBOLIZATION CASES,6/7/2022 3:00:00 PM
NARI,"Inari Medical GAAP EPS of -$0.06 beats by $0.04, revenue of $86.75M beats by $3.14M",5/4/2022 8:29:23 PM
NARI,Notable earnings after Wednesday's close,5/3/2022 9:35:38 PM
NARI,"Finch, Zymeworks top healthcare gainers; while Accolade, Aldeyra leads losers' pack",4/29/2022 2:04:33 PM
NARI,"FNCH, NARI are among afterr hour movers",4/28/2022 9:19:13 PM
NARI,Johnson & Johnson’s MedTech performance rallies industry,4/19/2022 5:21:14 PM
NARI,Inari Medical raises $162M equity capital,3/11/2022 10:58:06 AM
NARI,"Kala, Natera top healthcare gainers; Sunshine Biopharma, Myomo lead losers' pack",3/10/2022 3:07:15 PM
NARI,"Inari Medical GAAP EPS of $0.02 in-line, revenue of $83.22M beats by $3.45M",2/23/2022 9:05:26 PM
NARI,Notable earnings after Wednesday's close,2/22/2022 10:35:57 PM
NARI,"The Week Ahead In Biotech (Feb. 20-26): Reata Awaits FDA Decision, Bausch Health, Moderna Lead Earnings News Flow",2/20/2022 2:06:46 PM
NARI,Inari begins enrolling in trial of FlowTriever system for pulmonary embolism patients,2/15/2022 2:41:07 PM
NARI,30 Stocks Moving In Tuesday's Mid-Day Session,1/11/2022 6:01:59 PM
NARI,"Accolade, Inari Medical lead postmarket gainers; Patrick Industries among losers",1/10/2022 10:08:36 PM
NARI,Wells Fargo picks high-quality small-caps for 2022: Alpha Tactics,1/1/2022 8:39:17 PM
NARI,"The Daily Biotech Pulse: Valneva Inks COVID-19 Vaccine Supply Contract In Europe, I-Mab Spikes On China Deal, DermTech Sinks On Guidance",11/10/2021 2:19:29 PM
NARI,"UPST, PUBM and VERI among after hour movers",11/9/2021 11:00:41 PM
NARI,Inari Medical Q3 2021 Earnings Preview,11/8/2021 10:35:18 PM
NARI,Inari Medical's FlowTriever device benefits patients with pulmonary embolism in study,10/28/2021 12:52:07 PM
NARI,66 Biggest Movers From Yesterday,8/12/2021 11:27:10 AM
NARI,"Inari Medical Plunged 15% After Mixed Q2 Earnings, Lifting FY21 Sales Guidance",8/11/2021 11:03:04 PM
NARI,"MedTech, hospital stocks slump after Texas Governor asked to delay elective procedures (Updated)",8/10/2021 3:54:54 PM
NARI,Notable earnings after Tuesday's close,8/9/2021 9:35:05 PM
NARI,"The Week Ahead In Biotech (Aug. 8-14): Jazz Pharma FDA Decision, Earnings Deluge and IPOs In The Spotlight",8/8/2021 4:11:24 PM
NARI,"Inari Medical EPS beats by $0.08, beats on revenue",5/11/2021 8:10:47 PM
NARI,Notable earnings after Tuesday's close,5/10/2021 9:35:04 PM
NARI,"The Week Ahead In Biotech (May 9-15): Heron, Apellis FDA Decisions, Presentations and Earnings",5/9/2021 4:20:33 PM
NARI,"GIFI, SCOR, CTLP and FUTU among after-hours movers",4/19/2021 9:54:07 PM
NARI,"The Daily Biotech Pulse: Novavax Vaccine Data, ContraFect Secures BARDA Funding, 2 IPOs",3/12/2021 1:36:15 PM
NARI,"The Daily Biotech Pulse: Contrasting COVID-19 Treatment Readouts From Roche, Vir, Delay In Kadmon's FDA Review, Alzheimer's Data From Prothena",3/11/2021 2:19:03 PM
NARI,44 Stocks Moving In Wednesday's Mid-Day Session,3/10/2021 7:36:43 PM
NARI,"MNOV, OM, NARI and AVID among after-hours movers",3/9/2021 10:43:21 PM
NARI,Inari Medical Q4 2020 Earnings Preview,3/8/2021 10:35:39 PM
NARI,The Week Ahead In Biotech (March 7-13): Conference Presentations And More Earnings,3/6/2021 4:57:58 PM
NARI,"The Daily Biotech Pulse: Novartis Funding For Gene Therapy Research, Priority Review For Amgen Cancer Drug, Pfizer-BioNTech Vaccine Supply Deal",2/17/2021 1:26:55 PM
NARI,"The Daily Biotech Pulse: DermTech Soars On Contract, Fluidigm Plunges On Earnings, Decision Day For Regeneron, Bioventus Debuts",2/11/2021 1:26:22 PM
NARI,"The Daily Biotech Pulse: Lilly COVID-19 Antibody Cocktail Approved for Emergency Use, Gamida, Genfit Jump On Data, 2 IPOs",2/10/2021 1:34:43 PM
NARI,"The Daily Biotech Pulse: Dynavax Poaches GSK Vaccine Exec, KalVista Jumps On Data Readout, Corcept Issues Negative Preannouncement",2/9/2021 2:10:28 PM
NARI,"The Daily Biotech Pulse: J&J Files For COVID-19 Vaccine Approval, Zimmer Biomet's Spin-Off, IPO Deluge Hits Street",2/5/2021 1:44:38 PM
NARI,"The Daily Biotech Pulse: Sorrento, Immutep Surge On COVID-19 Study Data, T2 Biosystems Sinks On Preannouncement",1/27/2021 1:35:59 PM
NARI,"The Daily Biotech Pulse: Novartis Misses, J&J Beats In Big Pharma Earnings, Vaccine Developer CureVac Taps Equity Market",1/26/2021 2:07:40 PM
NARI,Inari Medical Announces Presentation of Positive Chronic Clot Subanalysis Results from Real World CLOUT Registry at LINC 2021,1/25/2021 2:00:00 PM
NARI,"The Daily Biotech Pulse: Fluidigm's Saliva-Based COVID Test Approved In Europe, China Backs Amarin's Vascepa",1/22/2021 1:22:34 PM
NARI,"The Daily Biotech Pulse: Addex Jumps On Positive Data For Out-Licensed Drug, COVID-19 Vaccine Developer Inovio Announces $150M Follow-On Offering, Boston Scientific Goes Shopping",1/21/2021 2:05:24 PM
NARI,"The Daily Biotech Pulse: FDA Greenlights Merck's Heart Failure Drug, Histogen Hit With Clinical Hold, Aptorum Gets Nod For Commencing Human Study",1/20/2021 1:32:35 PM
NARI,"The Daily Biotech Pulse: Alexion Pauses COVID-19 Study, NantKwest Readout, Organogenesis Jumps On Guidance, Trial Updates",1/14/2021 1:56:59 PM
NARI,Inari Medical trades high as Q4 preliminary sales exceeds expectation,1/13/2021 2:28:52 PM
NARI,Inari Medical’s FlowTriever System Receives FDA 510(k) Clearance for Treatment of Right Atrial Clot in Transit,1/8/2021 2:00:00 PM
NARI,Inari Medical Appoints Venkat Tummala as VP of Medical Affairs and Justin Crockett as VP of Inari Solutions Group,1/5/2021 2:00:00 PM
NARI,Stocks That Hit 52-Week Highs On Thursday,12/31/2020 4:15:08 PM
NARI,Stocks That Hit 52-Week Highs On Wednesday,12/30/2020 4:21:57 PM
NARI,Stocks That Hit 52-Week Highs On Tuesday,12/29/2020 4:32:13 PM
NARI,Stocks That Hit 52-Week Highs On Monday,12/28/2020 4:22:20 PM
NARI,7 Upcoming IPOs to Watch Heading Into 2021,11/23/2020 8:00:26 PM
NARI,Inari Medical Announces Presentation of Positive 30-Day Follow-Up Results from First Patients in Real World FLASH Registry,11/13/2020 4:00:00 PM
NARI,Inari Medical Appoints Kevin Strange as VP of Strategy and Business Development and Angela Ahmad as General Counsel,11/12/2020 10:01:00 PM
NARI,Notable earnings after Thursday's close,11/11/2020 10:35:46 PM
NARI,Inari Medical to Participate at the Canaccord Genuity Virtual MedTech & Diagnostics Forum,11/6/2020 11:45:00 PM
NARI,Inari Medical to Announce Third Quarter 2020 Financial Results,10/29/2020 9:01:10 PM
NARI,Inari Medical Announces Presentation of Positive Results from First Patients in Real World FLASH Registry,10/19/2020 2:00:10 PM
NARI,Inari Medical Prospective Clinical Data on the FlowTriever System to be Presented in Late-Breaking Session at TCT Connect,9/21/2020 10:01:10 PM
NARI,Inari Medical Announces Promotion of Drew Hykes to Chief Operating Officer,9/17/2020 10:01:10 PM
NARI,Inari Medical to Participate in Upcoming Investor Conferences,8/27/2020 10:01:10 PM
NARI,Inari Medical Reports Second Quarter 2020 Financial Results,8/11/2020 10:05:10 PM
NARI,Inari Medical to Present at the Canaccord Genuity 40th Annual Growth Conference,7/29/2020 10:01:10 PM
NARI,Inari Medical to Announce Second Quarter 2020 Financial Results,7/28/2020 10:01:10 PM
NARI,Inari Medical Announces Closing of Initial Public Offering and Full Exercise of the Underwriters’ Option to Purchase Additional Shares,5/27/2020 6:48:53 PM
NARI,Inari Medical Announces Pricing of Its Upsized Initial Public Offering,5/22/2020 4:48:17 AM
NARI,Inari Medical To Make U.S. Trading Debut On May 22 ,5/21/2020 7:30:52 AM
