Ticker,Title,Link
IPGP,IPG Photonics Announces Sale of its Russian Operations,8/29/2024 10:00:00 PM
IPGP,IPG Photonics (IPGP) Gets a Sell from Bank of America Securities,7/31/2024 1:49:33 PM
IPGP,Needham Sticks to Their Hold Rating for IPG Photonics (IPGP),7/30/2024 6:46:05 PM
IPGP,IPG Photonics Q2 2024 Earnings Preview,7/29/2024 5:10:46 PM
IPGP,IPG Photonics to Announce Second Quarter 2024 Financial Results on July 30,7/16/2024 2:00:00 PM
IPGP,IPG Photonics Launches LightWELD® 2000 XR,5/23/2024 3:00:00 PM
IPGP,IPG Photonics Launches Cobot Laser Welding and Cleaning System,5/8/2024 3:00:00 PM
IPGP,IPG Photonics Receives Sell Rating Amid Competitive Pressures and Diminished Demand Outlook,5/2/2024 10:21:53 AM
IPGP,What Analysts Are Saying About IPG Photonics Stock,5/1/2024 3:00:16 PM
IPGP,Needham Reaffirms Their Hold Rating on IPG Photonics (IPGP),4/30/2024 6:45:22 PM
IPGP,IPG Photonics Q1 2024 Earnings Preview,4/29/2024 4:51:52 PM
IPGP,IPG Photonics to Announce First Quarter 2024 Financial Results on April 30,4/16/2024 2:00:00 PM
IPGP,"Analysts Offer Insights on Technology Companies: OneConnect Financial Technology (OCFT), Cisco Systems (CSCO) and IPG Photonics (IPGP)",3/19/2024 10:30:42 AM
IPGP,"Analysts Offer Insights on Technology Companies: Ciena (CIEN), IPG Photonics (IPGP) and CrowdStrike Holdings (CRWD)",3/6/2024 11:20:47 AM
IPGP,Deep Dive Into IPG Photonics Stock: Analyst Perspectives (4 Ratings),2/14/2024 3:00:41 PM
IPGP,IPG Photonics: Hold Rating Maintained Amid Financial Shortfalls and Challenging Outlook,2/13/2024 9:35:25 PM
IPGP,IPG Photonics Q4 2023 Earnings Preview,2/12/2024 4:55:32 PM
IPGP,IPG Photonics to Announce Fourth Quarter 2023 Financial Results on February 13,1/30/2024 2:00:00 PM
IPGP,"IPG Presents New Technologies, Products and Solutions for E-mobility Manufacturing, Materials Processing and Specialized Applications at Photonics West 2024",1/29/2024 3:00:00 PM
IPGP,Breaking Down IPG Photonics: 4 Analysts Share Their Views,1/25/2024 1:00:35 PM
IPGP,"Analysts Offer Insights on Technology Companies: IPG Photonics (IPGP), MongoDB (MDB) and Infineon Technologies AG (OtherIFNNF)",12/4/2023 12:11:23 PM
IPGP,Miller Electric Mfg. LLC and IPG Photonics Announce Strategic Technology Collaboration to Deliver Leading Laser Solutions to the Handheld Welding Market,11/7/2023 10:15:00 PM
IPGP,"Analysts Offer Insights on Technology Companies: Match Group (MTCH), IPG Photonics (IPGP) and Bio-Techne (TECH)",11/1/2023 10:10:26 AM
IPGP,"IPG Photonics Sees Q4 Earnings, Revenues Below Market - Update ",10/31/2023 1:49:03 PM
IPGP,IPG Photonics earnings: here's what to expect,10/30/2023 3:01:13 PM
IPGP,IPG Photonics to Announce Third Quarter 2023 Financial Results on October 31,10/17/2023 2:00:00 PM
IPGP,3 Semiconductor Stocks Set to Explode Higher,10/1/2023 7:24:08 PM
IPGP,The 3 Most Undervalued Robotics Stocks to Buy in September 2023,9/18/2023 11:26:36 AM
IPGP,"IPG Photonics Launches New Dual-Beam Laser with the Highest Single-Mode Core Power at The Battery Show in Novi, Michigan",9/11/2023 3:00:00 PM
IPGP,The 7 Best Robotics Stocks to Buy Now: September 2023,9/10/2023 7:39:22 PM
IPGP,"Benzinga's Top Ratings Upgrades, Downgrades For August 18, 2023",8/18/2023 5:00:37 PM
IPGP,"IPG's Investor Conference Unveils Expansion Strategies in Battery Welding, Medical, and Emerging Laser Markets: Analyst",8/14/2023 8:17:05 PM
IPGP,"Benzinga's Top Ratings Upgrades, Downgrades For August 2, 2023",8/2/2023 5:00:31 PM
IPGP,Why Aaron's Shares Are Trading Lower By Over 9%? Here Are Other Stocks Moving In Tuesday's Mid-Day Session,8/1/2023 9:05:37 PM
IPGP,IPG Photonics Q2 2023 Earnings Preview,7/31/2023 5:12:46 PM
IPGP,Dow Tumbles 400 Points After Fed Keeps Rates Unchanged,6/14/2023 8:31:13 PM
IPGP,4 Analysts Have This to Say About IPG Photonics,5/9/2023 4:00:52 PM
IPGP,"Analysts Offer Insights on Technology Companies: IPG Photonics (IPGP), Omnicell (OMCL) and Telus (TU)",5/3/2023 10:30:31 AM
IPGP,IPG Photonics Guides Q2 In Line With View; Q1 Results Top Estimates ,5/2/2023 2:25:08 PM
IPGP,IPG Photonics Q1 2023 Earnings Preview,5/1/2023 4:53:31 PM
IPGP,"As Interest in AI Surges, Check Out This ETF",2/17/2023 8:42:37 PM
IPGP,"IPG Photonics Likely To Gain From China's Recovery, Medical And EV Applications Analyst Says Post Q4",2/15/2023 6:22:17 PM
IPGP,IPG Photonics (IPGP) Gets a Hold from Needham,2/14/2023 9:25:04 PM
IPGP,IPG Photonics Q4 2022 Earnings Preview,2/13/2023 5:53:55 PM
IPGP,The 7 Best Mid-Cap Stocks to Buy Right Now,12/28/2022 6:29:41 PM
IPGP,7 Game-Changing Tech Stocks to Buy to Retire a Millionaire,11/12/2022 5:26:57 PM
IPGP,"Benzinga's Top Ratings Upgrades, Downgrades For November 2, 2022",11/2/2022 3:06:35 PM
IPGP,What Wall Street expects from IPG Photonics's earnings,11/1/2022 3:01:13 PM
IPGP,IPG Photonics Q3 2022 Earnings Preview,10/31/2022 6:44:44 PM
IPGP,IPG Photonics to Announce Third Quarter 2022 Financial Results on November 1,10/18/2022 2:00:00 PM
IPGP,7 Robotic Stocks to Buy for the Coming Robot Boom,10/12/2022 12:38:20 PM
IPGP,"Citi picks best Buy and Sell stocks in all sectors, leaning to quality and momentum",9/18/2022 12:26:48 PM
IPGP,IPG Photonics Announces Sale of its Telecom Transmission Product Lines,8/15/2022 3:00:00 PM
IPGP,"IPG Photonics Corporation Q2 Profit Retreats, misses estimates",8/2/2022 2:20:15 PM
IPGP,IPG Photonics Q2 Earnings Preview,8/1/2022 5:01:29 PM
IPGP,IPG Photonics to Announce Second Quarter 2022 Financial Results on August 2,7/19/2022 2:00:00 PM
IPGP,These 3 Stock Are Joining the S&P 500 In June,6/6/2022 4:54:20 PM
IPGP,"Keurig Dr Pepper, VICI Properties and ON Semiconductor Set to Join S&P 500; Others to Join S&P MidCap 400, and S&P SmallCap 600",6/4/2022 1:21:00 AM
IPGP,"ON Semi, VICI, Keurig Dr Pepper jump on S&P 500 additions (updated)",6/3/2022 9:26:33 PM
IPGP,Citi screens for quality growth stocks in this pullback,5/22/2022 5:57:08 PM
IPGP,More boxes checked off in stock market bottom checklist,5/17/2022 11:00:29 AM
IPGP,80 Biggest Movers From Yesterday,5/4/2022 11:04:58 AM
IPGP,41 Stocks Moving In Tuesday's Mid-Day Session,5/3/2022 6:14:47 PM
IPGP,"IPG Photonics Q1 consensus EPS, revenue estimates down",5/2/2022 4:13:25 PM
IPGP,IPG Photonics to Announce First Quarter 2022 Financial Results on May 3,4/19/2022 2:00:00 PM
IPGP,IPG Photonics Announces Addition of New Directors to the Board,3/28/2022 10:05:00 PM
IPGP,"Benzinga's Top Ratings Upgrades, Downgrades For March 14, 2022",3/14/2022 4:03:08 PM
IPGP,IPG Photonics slammed as Needham downgrades on Russian exposure,3/3/2022 4:24:30 PM
IPGP,"Benzinga's Top Ratings Upgrades, Downgrades For February 16, 2022",2/16/2022 4:01:52 PM
IPGP,IPG Photonics Q4 Results Top Estimates; Stock Down 9% On Weak Outlook - Quick Facts ,2/15/2022 2:26:21 PM
IPGP,IPG Photonics Q4 2021 Earnings Preview,2/14/2022 4:22:05 PM
IPGP,IPG Photonics to Announce Fourth Quarter 2021 Financial Results on February 15,2/1/2022 2:00:00 PM
IPGP,"Benzinga's Top Ratings Upgrades, Downgrades For November 11, 2021",11/11/2021 4:01:39 PM
IPGP,"Benzinga's Top Ratings Upgrades, Downgrades For November 4, 2021",11/4/2021 3:20:04 PM
IPGP,IPG Photonics Q3 Results Top Estimates; Guides Q4 Revenues Below Estimates - Quick Facts ,11/2/2021 1:30:52 PM
IPGP,IPG Photonics Q3 2021 Earnings Preview,11/1/2021 4:39:30 PM
IPGP,"IPG Photonics Announces the Passing of Founder Dr. Valentin Gapontsev, Unique Combination of Scientist, Entrepreneur and Leader",10/25/2021 1:00:00 PM
IPGP,IPG Photonics to Announce Third Quarter 2021 Financial Results on November 2,10/19/2021 2:00:00 PM
IPGP,"Benzinga's Top Ratings Upgrades, Downgrades For October 11, 2021",10/11/2021 4:51:48 PM
IPGP,The trend is your friend -- what stock market strategy worked in August,9/1/2021 4:56:12 PM
IPGP,"Pixelworks led gainers, IPG top decliner among semiconductor stocks in August",8/31/2021 5:53:03 PM
IPGP,"Benzinga's Top Ratings Upgrades, Downgrades For August 6, 2021",8/6/2021 4:06:00 PM
IPGP,75 Biggest Movers From Yesterday,8/4/2021 11:06:01 AM
IPGP,SolarEdge Technologies and Robinhood Markets among tech gainers; IPG Photonics and Kopin among losers,8/3/2021 7:00:18 PM
IPGP,IPG Photonics Q2 2021 Earnings Preview,8/2/2021 6:49:36 PM
IPGP,Here's what Wall Street expects from IPG Photonics's earnings report,8/1/2021 3:01:51 PM
IPGP,IPG Photonics to Announce Second Quarter 2021 Financial Results on August 3,7/20/2021 2:00:00 PM
IPGP,Top stocks with pricing power for a sputtering reflation trade: Alpha Tactics,6/12/2021 9:36:53 PM
IPGP,IPG Photonics to Participate in Upcoming Investor Conference,6/2/2021 2:00:00 PM
IPGP,"IPG Photonics stock slides after inline guidance, CEO transition",5/4/2021 5:23:45 PM
IPGP,IPG Photonics Q1 2021 Earnings Preview,5/3/2021 7:25:10 PM
IPGP,Here's what Wall Street expects from IPG Photonics's earnings,5/2/2021 3:01:32 PM
IPGP,IPG Photonics Corporation Q1 adjusted earnings Beat Estimates,4/28/2021 1:47:39 PM
IPGP,IPG Photonics to Announce First Quarter 2021 Financial Results on May 4,4/20/2021 2:00:00 PM
IPGP,IPG Photonics to Participate in Upcoming Investor Conferences,2/24/2021 2:00:00 PM
IPGP,Palo Alto Networks To Buy Bridgecrew For About $156 Mln In Cash ,2/16/2021 2:32:52 PM
IPGP,IPG Photonics Q4 2020 Earnings Preview,2/12/2021 7:19:08 PM
IPGP,NeoPhotonics gains after MKS Instruments makes competing bid for Coherent,2/8/2021 3:11:55 PM
IPGP,IPG Photonics to Announce Fourth Quarter 2020 Financial Results on February 16,2/2/2021 2:30:00 PM
IPGP,"Benzinga's Top Ratings Upgrades, Downgrades For January 19, 2021",1/19/2021 4:04:22 PM
IPGP,IPG Photonics Further Strengthens Board with Addition of Jeanmarie Desmond and Natalia Pavlova,1/7/2021 10:05:00 PM
IPGP,QS Stock Is Down 60%. Treat Yourself to a Delayed Christmas Gift.,1/5/2021 4:26:12 PM
IPGP,Stocks That Hit 52-Week Highs On Monday,1/4/2021 6:58:02 PM
IPGP,Stocks That Hit 52-Week Highs On Wednesday,12/30/2020 4:21:57 PM
IPGP,Stocks That Hit 52-Week Highs On Tuesday,12/29/2020 4:32:13 PM
IPGP,Stocks That Hit 52-Week Highs On Monday,12/28/2020 4:22:20 PM
IPGP,Stocks That Hit 52-Week Highs On Thursday,12/24/2020 4:15:22 PM
IPGP,Stocks That Hit 52-Week Highs On Wednesday,12/23/2020 4:57:31 PM
IPGP,Stocks That Hit 52-Week Highs On Tuesday,12/22/2020 4:30:53 PM
IPGP,Stocks That Hit 52-Week Highs On Friday,12/18/2020 8:42:01 PM
IPGP,IPG Photonics CEO sells 68.8K shares of common stock,11/17/2020 11:21:48 AM
IPGP,IPG Photonics to Participate in Upcoming Investor Conference,11/5/2020 2:30:00 PM
IPGP,IPG Photonics gains after Northland upgrade joined Raymond James downgrade,11/3/2020 4:33:12 PM
IPGP,IPG Photonics share slumps despite Q3 earnings beat,10/30/2020 2:03:00 PM
IPGP,IPG Photonics Q3 2020 Earnings Preview,10/29/2020 4:45:02 PM
IPGP,IPG Photonics to Announce Third Quarter 2020 Financial Results on October 30,10/16/2020 3:00:10 PM
IPGP,IPG Photonics Guides Q3 In Line With Estimates - Quick Facts ,8/4/2020 2:13:00 PM
IPGP,IPG Photonics earnings preview: what Wall Street is expecting,8/3/2020 3:01:57 PM
IPGP,IPG Photonics to Participate in Upcoming Investor Conference,7/29/2020 2:00:10 PM
IPGP,IPG Photonics to Announce Second Quarter 2020 Financial Results on August 4,7/21/2020 2:00:10 PM
IPGP,IPG Photonics Launches New Record-Breaking Ultra-Compact Laser Series,7/15/2020 2:00:10 PM
IPGP,IPG Photonics to Participate in Upcoming Investor Conference,6/1/2020 2:00:10 PM
IPGP,IPG Photonics Guides Q2 In Line With Estimates - Quick Facts ,5/5/2020 2:25:53 PM
IPGP,IPG Photonics earnings: here's what Wall Street expects,5/4/2020 3:01:31 PM
IPGP,IPG Photonics to Announce First Quarter 2020 Financial Results on May 5,4/21/2020 2:00:10 PM
IPGP,"IPG Photonics Introduces Single-Fiber, Bi-Directional Coherent Modules Operating at Extended Temperatures",3/5/2020 2:00:00 PM
IPGP,IPG Photonics to Participate in Upcoming Investor Conference,2/19/2020 2:00:00 PM
IPGP,"3 Big Stock Charts for Friday: Dollar General, IPG Photonics, and American Eagle",2/14/2020 12:19:02 PM
IPGP,IPG Photonics Guides Q1 Below Estimates - Quick Facts ,2/13/2020 2:25:32 PM
IPGP,IPG Photonics earnings: here's what to expect,2/12/2020 3:03:08 PM
IPGP,IPG Photonics to Announce Fourth Quarter 2019 Financial Results on February 13,1/30/2020 2:00:00 PM
IPGP,IPG Photonics to Participate in Upcoming Investor Conference,1/7/2020 2:00:00 PM
IPGP,IPG Photonics Announces Third Quarter 2019 Financial Results,10/29/2019 1:00:05 PM
IPGP,IPG Photonics to Participate in Upcoming Investor Conference,10/22/2019 2:00:05 PM
IPGP,IPG Photonics to Announce Third Quarter 2019 Financial Results on October 29,10/15/2019 2:00:00 PM
IPGP,Dr. Valentin Gapontsev and IPG Settle Litigation with US Treasury over Congressional Report,9/11/2019 11:13:00 PM
IPGP,IPG Photonics Announces Second Quarter 2019 Financial Results,7/30/2019 2:00:00 PM
IPGP,Here's what to expect from IPG Photonics's earnings,7/28/2019 3:01:56 PM
IPGP,IPG Photonics to Participate in Upcoming Investor Conferences,7/23/2019 2:00:00 PM
IPGP,IPG Photonics to Announce Second Quarter 2019 Financial Results on July 30,7/16/2019 2:00:00 PM
IPGP,IPG Photonics to Participate in Upcoming Investor Conferences,5/28/2019 2:00:00 PM
IPGP,IPG Photonics Announces First Quarter 2019 Financial Results,4/30/2019 2:00:00 PM
IPGP,Here's what Wall Street expects from IPG Photonics's earnings report,4/28/2019 3:02:09 PM
IPGP,IPG Photonics to Announce First Quarter 2019 Financial Results on April 30,4/16/2019 2:00:00 PM
IPGP,IPG Photonics Honored with Multiple Awards in 2019 Lightwave Innovation Reviews Program,3/4/2019 2:00:00 PM
IPGP,IPG Photonics to Participate in Upcoming Investor Conference,2/19/2019 2:00:00 PM
IPGP,IPG Photonics Announces Fourth Quarter 2018 Financial Results,2/12/2019 2:00:00 PM
IPGP,IPG Photonics earnings: here's what Wall Street expects,2/10/2019 3:01:47 PM
IPGP,IPG Photonics Appoints Greg Dougherty to Board of Directors,1/25/2019 10:05:00 PM
IPGP,IPG Photonics Announces Agreement to Acquire Padtec Submarine Networks Division,1/22/2019 1:00:00 PM
IPGP,IPG Photonics to Participate in Upcoming Investor Conference,1/3/2019 2:00:00 PM
IPGP,IPG Photonics Announced Winner of 2018 Fierce Innovation Award for Next Gen Network Deployment,11/13/2018 2:00:00 PM
IPGP,IPG Photonics Announces Agreement to Acquire Genesis Systems Group,11/5/2018 2:00:00 PM
IPGP,IPG Photonics Announces New Generation of High Power Fiber Lasers,11/2/2018 2:00:00 PM
IPGP,IPG Photonics Announces Third Quarter 2018 Financial Results,10/30/2018 1:00:00 PM
IPGP,IPG Photonics is about to announce its earnings — here's what Wall Street expects,10/28/2018 3:02:08 PM
IPGP,IPG Photonics to Participate in Upcoming Investor Conferences,10/24/2018 2:00:00 PM
IPGP,IPG Photonics Announces Preliminary Third Quarter 2018 Financial Results,10/5/2018 2:00:00 PM
IPGP,IPG Photonics Announces Record Second Quarter 2018 Financial Results,7/31/2018 2:00:00 PM
IPGP,What Wall Street expects from IPG Photonics's earnings,7/29/2018 3:02:00 PM
IPGP,IPG Photonics to Participate in Upcoming Investor ConferencesEvents to be webcast live on the IPG Photonics investor relations website,7/25/2018 2:00:00 PM
IPGP,IPG Photonics to Announce Second Quarter 2018 Financial Results on July 31,7/17/2018 2:00:00 PM
IPGP,IPG Photonics to Participate in Upcoming Investor ConferencesEvents to be webcast live on the IPG Photonics investor relations website,5/16/2018 2:00:00 PM
IPGP,BRIEF-IPG Photonics Q1 Earnings Per Share $1.93,5/1/2018 2:12:24 PM
IPGP,IPG Photonics to Announce First Quarter 2018 Financial Results on May 1,4/17/2018 2:00:00 PM
IPGP,"IPG Photonics Set to Join S&P 500; ALLETE and LendingTree to Join S&P MidCap 400; New York Mortgage Trust, Global Net Lease and Finisar to Join S&P SmallCap 600",3/3/2018 12:30:00 AM
IPGP,IPG Photonics to Participate in Upcoming Investor ConferenceEvent to be webcast live on the IPG Photonics investor relations website,2/20/2018 2:00:00 PM
IPGP,IPG Photonics Announces 40% Revenue Growth for Full Year 2017,2/16/2018 2:00:00 PM
IPGP,IPG Photonics to Announce Fourth Quarter 2017 Financial Results on February 16,1/26/2018 2:00:00 PM
IPGP,IPG Photonics to Participate in Upcoming Investor ConferenceEvent to be webcast live on the IPG Photonics investor relations website,1/3/2018 2:00:00 PM
IPGP,BRIEF-IPG Photonics Announces Acquisition Of Laser Depth Dynamics (IPGP),12/4/2017 2:12:03 PM
IPGP,BRIEF-IPG Photonics Q3 earnings per share $2.11 (IPGP),10/31/2017 1:47:19 PM
IPGP,"U.S. earnings calls zero in on automation, lose Trump focus (SKX, CLW, STI, IPGP, CGNX, ROK)",10/26/2017 7:57:08 PM
IPGP,IPG Photonics to Announce Third Quarter 2017 Financial Results on October 31,10/17/2017 2:00:00 PM
IPGP,"RPT-UPDATE 1-Wall St Week Ahead-Tax-cut plan prompts fund managers to bet on automation (CGNX, FARO, AVAV, IPGP, ROK, EMR, MIDD)",10/8/2017 7:02:04 PM
IPGP,"UPDATE 1-Wall St Week Ahead-Tax-cut plan prompts fund managers to bet on automation (CGNX, FARO, AVAV, IPGP, ROK, EMR, MIDD)",10/6/2017 6:37:03 PM
IPGP,BRIEF-Generation Growth Capital announces sale of Innovative Laser Technologies (IPGP),7/11/2017 7:58:14 PM
IPGP,BRIEF-IPG Photonics reports agreement to acquire Innovative Laser Technologies (IPGP),6/19/2017 2:22:06 PM
IPGP,BRIEF-IPG Photonics reports Q4 earnings per share $1.39 (IPGP),2/14/2017 2:48:10 PM
IPGP,BRIEF-IPG Photonics sees Q4 revenue about $280 million (IPGP),1/30/2017 3:12:09 PM
IPGP,BRIEF-IPG Photonics says sees Q4 earnings per share $1.17 to $1.32 (IPGP),10/27/2016 3:14:20 PM
