Ticker,Title,Link
BOKF,Wells Fargo Sticks to Its Hold Rating for Bok Financial (BOKF),7/26/2024 8:53:31 AM
BOKF,Unveiling 6 Analyst Insights On BOK Financial,7/24/2024 3:00:18 PM
BOKF,BOK Financial: Hold Rating Affirmed Amid Balanced Prospects and Valuation,7/23/2024 11:05:35 AM
BOKF,Notable earnings after Monday's close,7/21/2024 9:35:01 PM
BOKF,"Synovus Q2 Earnings Beat Estimates, Revenues Fall Y/Y",7/18/2024 6:41:58 PM
BOKF,Wells Fargo Keeps Their Hold Rating on Bok Financial (BOKF),7/9/2024 9:42:25 AM
BOKF,Where BOK Financial Stands With Analysts,7/8/2024 5:00:46 PM
BOKF,Demystifying BOK Financial: Insights From 12 Analyst Reviews,6/10/2024 8:00:35 PM
BOKF,BOK Financial goes ex dividend tomorrow,5/13/2024 2:27:17 PM
BOKF,Bok Financial: Hold Rating Justified by Mixed Financial Performance and Market Valuation,4/26/2024 9:24:14 AM
BOKF,Key Takeaways From BOK Financial Analyst Ratings,4/25/2024 4:01:02 PM
BOKF,BOK Financial: A Stable Hold Amid Solid Performance and Prudent Growth Expectations,4/24/2024 7:35:27 PM
BOKF,Here's what Wall Street expects from BOK Financial's earnings,4/23/2024 3:01:13 PM
BOKF,"Popular leads mid-cap banks in readiness for extended high-rate climate, analyst says",4/15/2024 3:30:12 PM
BOKF,Bok Financial (BOKF) Receives a Hold from Wells Fargo,4/10/2024 9:55:48 AM
BOKF,"BOK Financial, Old Second Bancorp upped, Texas Capital cut at Raymond James",4/4/2024 3:37:37 PM
BOKF,Beyond The Numbers: 6 Analysts Discuss BOK Financial Stock,4/1/2024 4:00:33 PM
BOKF,Analysts Have Conflicting Sentiments on These Financial Companies: Capital One Financial (COF) and Bok Financial (BOKF),3/27/2024 5:30:40 AM
BOKF,Evaluating BOK Financial: Insights From 4 Financial Analysts,3/13/2024 10:00:34 PM
BOKF,"Wedbush expects a normalization of credit driven by CRE, affecting banks",2/28/2024 8:25:51 PM
BOKF,BOK Financial goes ex dividend tomorrow,2/12/2024 2:44:30 PM
BOKF,Navigating 4 Analyst Ratings For BOK Financial,1/25/2024 6:01:05 PM
BOKF,BOK Financial: Hold Rating Maintained Amid Balanced Performance and Outlook,1/24/2024 8:35:50 PM
BOKF,BOK Financial Q4 2023 Earnings Preview,1/23/2024 5:28:38 PM
BOKF,RBC Capital Remains a Hold on Bok Financial (BOKF),1/12/2024 1:46:35 AM
BOKF,Wells Fargo Keeps Their Hold Rating on Bok Financial (BOKF),12/14/2023 10:17:26 AM
BOKF,Expert Ratings for BOK Financial,12/1/2023 2:00:44 PM
BOKF,Meta To Rally Over 42%? Here Are 10 Top Analyst Forecasts For Thursday,10/26/2023 1:53:58 PM
BOKF,Why Owens Corning Shares Are Trading Lower By Around 9%? Here Are Other Stocks Moving In Wednesday's Mid-Day Session,10/25/2023 7:49:43 PM
BOKF,BOK Financial earnings: here's what to expect,10/24/2023 3:01:13 PM
BOKF,Analysts Offer Insights on Financial Companies: Bok Financial (BOKF) and Mastercard (MA),10/11/2023 10:00:57 AM
BOKF,Wells Fargo Remains a Buy on Bok Financial (BOKF),10/4/2023 9:35:43 AM
BOKF,Analyst Ratings for BOK Financial,9/27/2023 7:01:01 PM
BOKF,Analyst Ratings for BOK Financial,9/1/2023 7:00:40 PM
BOKF,"Benzinga Bulls And Bears: Disney, Paypal, Tesla And Why Dogecoin Is Set To Skyrocket 200%",8/12/2023 3:16:23 PM
BOKF,BOK Financial goes ex-dividend on Monday,8/11/2023 6:50:07 PM
BOKF,"US Banking Sector Shaken: Moody's Drops Credit Ratings Of 10 Banks, Sounds Alarm For More Downgrades",8/8/2023 3:02:20 PM
BOKF,Stephens & Co. Maintains Equal-Weight Rating for BOK Financial: Here's What You Need To Know,7/27/2023 7:00:38 PM
BOKF,"BOK Financial GAAP EPS of $2.27 beats by $0.01, revenue of $531.31M beats by $10.14M",7/26/2023 11:59:46 AM
BOKF,BOK Financial earnings: here's what Wall Street expects,7/25/2023 3:01:13 PM
BOKF,6 Analysts Have This to Say About BOK Financial,6/29/2023 10:00:30 PM
BOKF,The Latest Analyst Ratings for BOK Financial,6/9/2023 10:01:02 PM
BOKF,PacWest debt rating downgraded to junk at Fitch,5/18/2023 7:02:41 PM
BOKF,Analyst Expectations for BOK Financial's Future,4/27/2023 8:01:27 PM
BOKF,Wedbush Remains a Hold on Bok Financial (BOKF),4/26/2023 6:35:06 PM
BOKF,Here's what Wall Street expects from BOK Financial's earnings,4/25/2023 3:01:13 PM
BOKF,RBC Capital Keeps Their Hold Rating on Bok Financial (BOKF),3/28/2023 10:26:53 AM
BOKF,Where BOK Financial Stands With Analysts,3/23/2023 7:01:50 PM
BOKF,BOK Financial goes ex-dividend on Monday,2/10/2023 8:44:41 PM
BOKF,The Latest Analyst Ratings for BOK Financial,2/1/2023 5:00:52 PM
BOKF,Wall Street Analysts Are Neutral on Top Financial Picks,1/26/2023 8:30:20 PM
BOKF,Wedbush Reaffirms Their Hold Rating on Bok Financial (BOKF),1/25/2023 8:25:12 PM
BOKF,BOK Financial earnings preview: what Wall Street is expecting,1/24/2023 3:01:13 PM
BOKF,Bok Financial (BOKF) Receives a Hold from RBC Capital,1/13/2023 1:58:29 AM
BOKF,BOK Financial’s wealth management division appoints Carrie Clasen Porter as COO,12/8/2022 8:43:14 AM
BOKF,BOK Financial announces retirement of CFO Steven Nell in 2023,11/16/2022 4:00:00 PM
BOKF,BOK Financial goes ex-dividend on Monday,11/11/2022 8:00:49 PM
BOKF,BOK Financial and BOKF Foundation combine to reach $100 million donation milestone,11/4/2022 5:03:32 PM
BOKF,Wedbush Sticks to Their Hold Rating for Bok Financial (BOKF),10/27/2022 11:15:38 AM
BOKF,BOK Financial Corporation Reports Quarterly Earnings of $157 million or $2.32 Per Share in the Third Quarter,10/26/2022 1:55:00 PM
BOKF,Here's what Wall Street expects from BOK Financial's earnings report,10/25/2022 3:01:13 PM
BOKF,BOK Financial names new executive director of Commercial Strategies,10/17/2022 10:28:00 PM
BOKF,Bok Financial (BOKF) Receives a Hold from RBC Capital,10/15/2022 1:45:58 AM
BOKF,BOK Financial Corporation announces third quarter 2022 earnings conference call,10/11/2022 3:10:47 PM
BOKF,BOK Financial names new Chief Human Resource Officer,10/5/2022 5:00:00 PM
BOKF,Jeter to serve as BOK Financial Commercial Banking executive director,9/28/2022 4:34:00 PM
BOKF,Expert Ratings for BOK Financial,9/14/2022 5:02:26 PM
BOKF,"BOK Financial names new CIO, Consumer banking executive",9/7/2022 3:30:00 PM
BOKF,"BOK Financial® to eliminate non-sufficient funds fees, overdraft fee changes",9/2/2022 11:00:00 PM
BOKF,Mark Wade named Bank of Texas CEO,8/17/2022 6:55:00 PM
BOKF,BOK Financial names new Arkansas market president,8/11/2022 3:54:42 PM
BOKF,Analyst Ratings for BOK Financial,7/28/2022 6:08:58 PM
BOKF,BOK Financial Corporation Reports Quarterly Earnings of $133 million or $1.96 Per Share in the Second Quarter,7/27/2022 1:55:00 PM
BOKF,BOK Financial earnings: here's what Wall Street expects,7/26/2022 3:01:13 PM
BOKF,BOK Financial Corporation announces second quarter 2022 earnings conference call,7/5/2022 3:45:16 PM
BOKF,BOK Financial names new chief accounting officer,6/21/2022 8:00:00 PM
BOKF,BOK Financial names Chet Samuelson Arizona market executive,6/8/2022 11:00:00 PM
BOKF,BOK Financial Opportunity Banking receives national certification,5/5/2022 7:31:20 PM
BOKF,Bank of Albuquerque names Kyle Beasley market executive,5/4/2022 4:04:05 PM
BOKF,BOK Financial Corporation Reports Quarterly Earnings of $62 million or $0.91 Per Share in the First Quarter,4/27/2022 1:55:00 PM
BOKF,Here's what Wall Street expects from BOK Financial's earnings report,4/26/2022 3:01:13 PM
BOKF,BOK Financial Corporation announces first quarter 2022 earnings conference call,4/4/2022 4:45:00 PM
BOKF,Cavanal Hill Funds earns top 30 ranking on Barron’s Best Fund Families 2021 list,3/18/2022 9:04:58 PM
BOKF,Cavanal Hill Funds receive 14th Lipper award in 11 years,3/10/2022 6:05:16 PM
BOKF,BOK Financial ranked top retirement plan providers,3/4/2022 6:28:20 PM
BOKF,BOK Financial declares $0.53 dividend,2/10/2022 3:14:01 PM
BOKF,BOK Financial Corporation Reports Annual Earnings of $618 million or $8.95 Per Share and Quarterly Earnings of $117 million or $1.71 Per Share in the Fourth Quarter,1/19/2022 1:55:00 PM
BOKF,Billionaire George Kaiser's Excelerate Energy files for IPO,1/7/2022 11:49:34 PM
BOKF,BOK Financial Corporation announces date of fourth quarter 2021 earnings conference call,1/3/2022 4:15:00 PM
BOKF,BOK Financial CEO Steve Bradshaw to retire at end of 2021,12/1/2021 10:00:00 PM
BOKF,"BOK Financial announces changes within Credit, Regional Banking leadership",11/23/2021 4:00:00 PM
BOKF,Bank of Oklahoma names Greg Wheeler Oklahoma City Market Leader,11/2/2021 4:00:00 PM
BOKF,BOK Financial Corporation Reports Quarterly Earnings of $188 million or $2.74 Per Share in the Third Quarter,10/20/2021 1:55:00 PM
BOKF,BOK Financial is about to announce earnings — here's what Wall Street expects,10/18/2021 3:01:24 PM
BOKF,BOK Financial Corporation announces date of third quarter 2021 earnings conference call,10/1/2021 4:00:00 PM
BOKF,BOK Financial names Brad Vincent leader of Specialized Industries Banking,8/24/2021 8:05:00 PM
BOKF,Peggy Simmons joins BOK Financial Corporation Board of Directors,8/10/2021 4:00:00 PM
BOKF,BOK Financial names Stacy Kymes president and CEO,8/4/2021 5:05:00 PM
BOKF,BOK Financial Corporation Reports Quarterly Earnings of $166 million or $2.40 Per Share in the Second Quarter,7/21/2021 1:55:00 PM
BOKF,Here's what Wall Street expects from BOK Financial's earnings,7/19/2021 3:01:28 PM
BOKF,BOK Financial Announces Date of Second Quarter 2021 Earnings Conference Call,7/2/2021 4:00:00 PM
BOKF,BOK Financial Corporation -- Moody's affirms BOK's ratings (long-term issuer A3); changes outlook to stable from negative,5/25/2021 9:03:00 PM
BOKF,BOK Financial named a 2021 DiversityInc Top Regional Company,5/21/2021 10:00:00 PM
BOKF,BOK Financial goes ex-dividend tomorrow,5/13/2021 5:36:29 PM
BOKF,BOK Financial Corporation Reports Quarterly Earnings of $146 million or $2.10 Per Share in the First Quarter,4/21/2021 1:55:00 PM
BOKF,Notable earnings before Wednesday's open,4/20/2021 3:51:13 PM
BOKF,BOK Financial is about to announce its earnings — here's what to expect,4/19/2021 3:01:29 PM
BOKF,BOK Financial CEO Steve Bradshaw announces plans to retire,4/5/2021 5:15:00 PM
BOKF,BOK Financial Announces Date of First Quarter 2021 Earnings Conference Call,4/2/2021 4:00:00 PM
BOKF,BOK Financial names new executive director for TransFund division,3/24/2021 2:00:00 PM
BOKF,Stacy Kymes named BOK Financial Chief Operating Officer,3/1/2021 8:00:00 PM
BOKF,BOK Financial receives “Outstanding” Community Reinvestment Act rating,2/24/2021 2:00:00 PM
BOKF,BOK Financial names new managing director of loan syndications,2/22/2021 2:00:00 PM
BOKF,BOK Financial goes ex-dividend tomorrow,2/10/2021 6:26:32 PM
BOKF,BOK Financial Corporation -- Moody's announces completion of a periodic review of ratings of BOK Financial Corporation,2/5/2021 3:58:00 PM
BOKF,8 Dividend Stocks With a Decade of Dividend Increases,2/2/2021 3:09:53 PM
BOKF,BOK Financial adds four members to Diversity & Inclusion Council,1/26/2021 2:00:00 PM
BOKF,BOK Financial Corporation Reports Annual Earnings of $435 million or $6.19 Per Share and  Record Quarterly Earnings of $154 million or $2.21 Per Share in the Fourth Quarter,1/20/2021 1:55:00 PM
BOKF,Notable earnings before Wednesday's open,1/19/2021 5:48:12 PM
BOKF,BOK Financial earnings: here's what Wall Street expects,1/18/2021 3:01:18 PM
BOKF,Cavanal Hill Funds offers new hope for yield seekers,1/11/2021 3:00:00 PM
BOKF,BOK Financial Announces Date of Fourth Quarter 2020 Earnings Conference Call,1/5/2021 4:00:00 PM
BOKF,BOK Financial takes action on diversity and inclusion,11/19/2020 4:00:00 PM
BOKF,BOK Financial goes ex-dividend tomorrow,11/12/2020 6:14:22 PM
BOKF,BOK Financial Corporation Reports Record Quarterly Earnings of $154 million or $2.19 Per Share in the Third Quarter,10/21/2020 1:55:10 PM
BOKF,Notable earnings before Wednesday's open,10/20/2020 4:11:53 PM
BOKF,BOK Financial announces third quarter 2020 earnings conference call,10/2/2020 4:00:10 PM
BOKF,BOK Financial Corporation Reports Quarterly Earnings of $65 million or $0.92 Per Share in the Second Quarter,7/22/2020 1:55:10 PM
BOKF,BOK Financial earnings preview: what Wall Street is expecting,7/21/2020 3:01:34 PM
BOKF,BOK Financial announces second quarter 2020 earnings conference call,7/2/2020 4:00:10 PM
BOKF,BOK Financial names Sean Hampton Chief Marketing Officer,6/11/2020 4:54:31 PM
BOKF,Mandy Austin to lead Dallas market for Bank of Texas,5/26/2020 5:17:16 PM
BOKF,BOK Financial names Mark Wade Executive Director of Commercial Banking,5/12/2020 10:23:33 PM
BOKF,BOK Financial Reports Quarterly Earnings of $62 million or $0.88 Per Share in the First Quarter,4/22/2020 1:55:10 PM
BOKF,BOK Financial earnings: here's what Wall Street expects,4/21/2020 3:01:28 PM
BOKF,7 Bank Stocks to Watch as Earnings Season Heats Up,4/14/2020 3:34:36 PM
BOKF,BOK Financial announces first quarter 2020 earnings conference call,4/2/2020 3:55:00 PM
BOKF,"BOK Financial Corporation -- Moody's affirm BOK's ratings, changes outlook to negative from stable",3/31/2020 6:07:00 PM
BOKF,"Avoid shares of these banks with too much oil exposure, analyst says",3/10/2020 12:58:10 AM
BOKF,"Bok Financial, Bank7 top list of banks with energy exposure, KBW says",3/9/2020 2:32:14 PM
BOKF,Cavanal Hill Funds Receive 13th Award in 10 years,3/6/2020 4:00:00 PM
BOKF,BOK Financial Corporation -- Moody's announces completion of a periodic review of ratings of BOK Financial Corporation,2/28/2020 3:29:00 PM
BOKF,BOK Financial bolsters Syndications desk with strategic new hire,2/18/2020 6:00:00 PM
BOKF,BOK Financial Insurance expands to serve Oklahoma and Texas,2/12/2020 10:50:22 PM
BOKF,BOK Financial Ranks Among Top Retirement Plan Providers,2/5/2020 4:00:00 PM
BOKF,BOK Financial Reports Record Annual Earnings of $501 million or $7.03 Per Share,1/22/2020 1:55:00 PM
BOKF,BOK Financial announces fourth quarter 2019 earnings conference call,1/3/2020 4:00:00 PM
BOKF,BOK Financial Recognized Among the World’s Best Employers by Forbes,12/2/2019 7:47:45 PM
BOKF,Mobank to Rebrand to BOK Financial,10/28/2019 4:00:05 PM
BOKF,BOK Financial Reports Record Earnings for Second Straight Quarter,10/23/2019 1:55:05 PM
BOKF,BOK Financial Announces Third Quarter 2019 Earnings Conference Call,10/2/2019 4:00:00 PM
BOKF,BOK Financial Reports Quarterly Earnings of $138 million or $1.93 Per Share,7/24/2019 1:55:00 PM
BOKF,Here's what Wall Street expects from BOK Financial's earnings report,7/22/2019 3:01:34 PM
BOKF,BOK Financial Corporation -- Moody's affirms BOK's ratings; maintains outlook stable,7/2/2019 9:12:00 PM
BOKF,Mobank Welcomes Kevin Kramer to Lead Kansas City Market,6/27/2019 10:00:00 PM
BOKF,BOK Financial adds new depth to top-tier healthcare banking team,6/13/2019 2:00:00 PM
BOKF,"Bank of Texas Announces Small Business Week $5,000 Winner",5/24/2019 6:15:07 PM
BOKF,"Bank of Texas Celebrates Small Business Week, Chance to Win $5,000",4/25/2019 12:00:00 AM
BOKF,BOK Financial Reports Quarterly Earnings of $111 million or $1.54 Per Share,4/24/2019 1:55:00 PM
BOKF,Here's what to expect from BOK Financial's earnings,4/22/2019 3:01:36 PM
BOKF,BOK Financial Announces First Quarter 2019 Earnings Conference Call,4/1/2019 4:30:00 PM
BOKF,BOK Financial Corporation -- Moody's announces completion of a periodic review of ratings of BOK Financial Corporation,3/28/2019 10:12:00 PM
BOKF,BOK Financial adds new wealth management capabilities with key hires,3/27/2019 2:00:00 PM
BOKF,BOK Financial announces Sue Hermann Director Corporate Communications,3/7/2019 8:00:00 PM
BOKF,BOK Financial Reports Quarterly Earnings of $108 million or $1.50 Per Share,1/30/2019 1:55:00 PM
BOKF,BOK Financial earnings preview: what Wall Street is expecting,1/28/2019 3:01:45 PM
BOKF,BOK Financial names David Stratton executive vice president,1/7/2019 10:59:25 PM
BOKF,BOK Financial Announces Fourth Quarter 2018 Earnings Conference Call,1/3/2019 2:00:00 PM
BOKF,BOK Financial Promotes Derek Martin to Consumer Banking Executive,11/16/2018 3:00:00 PM
BOKF,BOK Financial Reports Record Quarterly Earnings of $117 million or $1.79 Per Share,10/24/2018 1:55:00 PM
BOKF,Here's what Wall Street expects from BOK Financial's earnings report,10/22/2018 3:01:43 PM
BOKF,Cavanal Hill Money Market Funds Closing Time Extended,10/18/2018 3:00:00 PM
BOKF,BOK Financial Announces Third Quarter 2018 Earnings Conference Call,10/5/2018 3:14:31 PM
BOKF,BOK Financial completes CoBiz acquisition,10/1/2018 1:00:00 PM
BOKF,CoBiz Shareholders Approve Merger with BOK Financial,9/27/2018 5:51:09 PM
BOKF,BOK Financial’s Private Bank is changing its name to Private Wealth,9/25/2018 7:13:54 PM
BOKF,BOK Financial receives regulatory approval for CoBiz acquisition,8/23/2018 3:00:00 PM
BOKF,"BOK Financial Reports Record Quarterly Earnings of $114 million or $1.75 Per Share; Results Driven by Strong Loan Growth, Net Interest Margin Expansion, and Continued Expense Control; Quarterly...",7/25/2018 1:55:00 PM
BOKF,BOK Financial is about to announce its earnings — here's what Wall Street expects,7/23/2018 3:01:43 PM
BOKF,BOK Financial Announces Second Quarter 2018 Earnings Conference Call,7/5/2018 4:37:56 PM
BOKF,WeissLaw LLP: CoBiz Financial Inc. Acquisition May Not Be In The Best Interests of COBZ Shareholders,6/18/2018 11:27:00 PM
BOKF,BOK Financial Achieves “Outstanding” Rating for Community Reinvestment  from the Office of the Comptroller of the Currency,4/30/2018 6:14:15 PM
BOKF,BRIEF-BOK Financial Reports Quarterly Earnings Of $106 Million,4/25/2018 1:52:37 PM
BOKF,BOK Financial Announces First Quarter 2018 Earnings Conference Call,4/9/2018 9:29:03 PM
BOKF,Cavanal Hill Funds receive Lipper Fund Awards for seventh consecutive yearOpportunistic Fund wins 5-Year Award for Absolute Return Category,2/28/2018 5:27:28 PM
BOKF,Cavanal Hill World Energy Fund (APWEX) included on Schwab OneSource Select List® for Q1 2018,2/26/2018 10:11:28 PM
BOKF,BOK Financial Reports 2017 Fourth Quarter and Full Year Results,1/24/2018 1:55:00 PM
BOKF,BOK Financial Announces Fourth Quarter 2017 Earnings Conference Call,1/8/2018 10:07:27 PM
BOKF,BOK Financial Corporation Increases Quarterly Dividend,10/31/2017 10:21:16 PM
BOKF,BOK Financial Reports Quarterly Earnings of $86 Million,10/25/2017 1:55:00 PM
BOKF,BOK Financial Corporation Announces Results of Annual Dodd-Frank Act Stress Test,10/18/2017 4:02:50 PM
BOKF,BOK Financial Announces Third Quarter 2017 Earnings Conference Call,10/4/2017 10:15:00 PM
BOKF,BRIEF-BOK Financial reports Q2 earnings per share $1.35 (BOKF),7/26/2017 2:32:04 PM
BOKF,BRIEF-BOK Financial Q1 earnings per share $1.35 (BOKF),4/26/2017 2:11:06 PM
BOKF,BRIEF-BOK Financial reports Q4 earnings per share $0.76 (BOKF),1/25/2017 2:04:05 PM
BOKF,BRIEF-Bok Financial change in fair value of mortgage servicing rights (BOKF),12/14/2016 11:48:03 PM
BOKF,Federal Reserve clears Bok Financial buyout of MBT Bancshares (BOKF),11/15/2016 11:20:19 PM
BOKF,BRIEF-BOK Financial Q3 earnings per share $1.13 (BOKF),10/26/2016 7:36:20 PM
