Ticker,Title,Link
IVT,InvenTrust Properties (IVT) Receives a Buy from Wells Fargo,8/28/2024 9:56:14 AM
IVT,InvenTrust Properties Corp Registered Shs hosts conference call for investors,8/1/2024 2:45:00 PM
IVT,InvenTrust Properties FFO of $0.43 beats by $0.01,7/31/2024 9:23:47 PM
IVT,InvenTrust Properties earnings: here's what to expect,7/30/2024 3:01:13 PM
IVT,Compass Point Reaffirms Their Hold Rating on InvenTrust Properties (IVT),6/25/2024 12:36:36 PM
IVT,"8 REITs increase dividend in May, Summit Hotel Properties posts largest hike - report",6/20/2024 5:46:13 PM
IVT,Cannabis REITs come out on top in screening REITs with SA Quant rating,6/2/2024 8:14:00 PM
IVT,InvenTrust Properties declares $0.226 dividend,5/31/2024 8:05:19 PM
IVT,Wells Fargo Keeps Their Buy Rating on InvenTrust Properties (IVT),5/28/2024 10:35:51 AM
IVT,IVT Stock Earnings: InvenTrust Properties Reported Results for Q1 2024,5/1/2024 1:55:26 AM
IVT,InvenTrust Properties GAAP EPS of $0.04,4/30/2024 10:15:20 PM
IVT,InvenTrust Properties earnings preview: what Wall Street is expecting,4/29/2024 3:01:13 PM
IVT,"8 REITs increase dividend payouts in March, says report",4/16/2024 4:30:29 PM
IVT,"Analysts Offer Insights on Real Estate Companies: InvenTrust Properties (IVT), Essex Property (ESS) and KE Holdings Inc. Sponsored ADR Class A (BEKE)",3/19/2024 10:22:16 AM
IVT,InvenTrust Properties raises dividend by 4.9% to $0.226,3/13/2024 5:20:59 AM
IVT,"Retail REITs' exposure to struggling Joann 'relatively low,' Wells Fargo says",3/5/2024 2:37:44 PM
IVT,InvenTrust Properties (IVT) Receives a Buy from Wells Fargo,2/29/2024 11:31:21 AM
IVT,"Analysts Have Conflicting Sentiments on These Real Estate Companies: Agree Realty (ADC), Stag Industrial (STAG) and InvenTrust Properties (IVT)",2/14/2024 10:50:30 AM
IVT,InvenTrust Properties FFO of $0.41 beats by $0.01,2/13/2024 9:53:20 PM
IVT,InvenTrust Properties (IVT) Receives a Buy from Wells Fargo,1/26/2024 10:34:22 AM
IVT,Wells Fargo Keeps Their Buy Rating on InvenTrust Properties (IVT),11/28/2023 10:16:53 AM
IVT,InvenTrust Properties (IVT) Receives a Buy from Wells Fargo,11/13/2023 12:18:27 PM
IVT,Compass Point Sticks to Their Hold Rating for InvenTrust Properties (IVT),11/10/2023 2:45:45 PM
IVT,InvenTrust Properties earnings: here's what Wall Street expects,10/31/2023 3:01:13 PM
IVT,Wells Fargo Remains a Buy on InvenTrust Properties (IVT),8/14/2023 8:35:33 AM
IVT,Looking for a Bargain? 7 Retirement Stocks to Buy That Are Down 10% in 2023,8/6/2023 9:23:05 PM
IVT,InvenTrust Properties GAAP EPS of $0.03,7/31/2023 8:59:46 PM
IVT,InvenTrust Properties earnings: here's what to expect,7/30/2023 3:01:13 PM
IVT,InvenTrust Properties declares $0.2155 dividend,6/21/2023 8:09:02 PM
IVT,"Benzinga's Top Ratings Upgrades, Downgrades For May 24, 2023",5/24/2023 5:00:50 PM
IVT,InvenTrust Properties FFO of $0.40 beats by $0.02,4/27/2023 8:38:27 PM
IVT,Here's what Wall Street expects from InvenTrust Properties's earnings,4/26/2023 3:01:13 PM
IVT,InvenTrust Properties raises dividend by 5%,3/15/2023 8:27:14 PM
IVT,"InvenTrust Properties Q4 results mixed, co guides FY 2023 FFO below consensus",2/14/2023 9:52:36 PM
IVT,InvenTrust Properties declares $0.2052 dividend,12/12/2022 9:52:27 PM
IVT,InvenTrust Properties FFO of $0.39 beats by $0.05,11/1/2022 10:16:54 PM
IVT,3 REITS With The Highest Total Return Over The Past 3 Years,10/27/2022 3:17:46 PM
IVT,"Benzinga's Top Ratings Upgrades, Downgrades For September 29, 2022",9/29/2022 4:06:56 PM
IVT,InvenTrust Properties declares $0.2052 dividend,9/15/2022 8:38:39 PM
IVT,InvenTrust Properties Q2 FFO up Y/Y,8/1/2022 8:43:20 PM
IVT,InvenTrust Properties declares $0.2052 dividend,6/14/2022 1:06:01 PM
IVT,InvenTrust Properties announces private placement of $250M senior notes,6/3/2022 8:08:32 PM
IVT,InvenTrust Properties Gains 7% On News Of Addition To MSCI US REIT Index ,5/13/2022 4:12:31 PM
IVT,InvenTrust Properties declares Q1 results,5/2/2022 8:27:22 PM
IVT,"Benzinga's Top Ratings Upgrades, Downgrades For April 22, 2022",4/22/2022 4:02:10 PM
IVT,InvenTrust Properties declares $0.2052 dividend,3/15/2022 12:34:11 PM
IVT,"InvenTrust Properties GAAP EPS of -$0.16, revenue of $53.58M",2/10/2022 9:54:54 PM
IVT,Mid-Afternoon Market Update: Crude Oil Drops Over 2%; Bottomline Technologies Shares Spike Higher,12/17/2021 8:47:05 PM
IVT,InvenTrust Properties declares $0.2052 dividend,12/8/2021 2:01:11 PM
IVT,InvenTrust Properties reports Q3 results,11/1/2021 9:30:00 PM
