Ticker,Title,Link
VGR,Vector Group To Be Bought By Japan's JT Group In $2.4 Bln Deal; Stock Up In Pre-market ,8/21/2024 12:34:17 PM
VGR,Vector declares $0.20 dividend,8/20/2024 8:02:05 PM
VGR,Barclays Remains a Buy on Vector Group (VGR),8/14/2024 6:25:55 AM
VGR,Vector Group (VGR) Receives a Buy from Oppenheimer,8/2/2024 12:37:19 PM
VGR,"VGR Stock Earnings: Vector Group Beats EPS, Beats Revenue for Q2 2024",8/1/2024 1:53:46 AM
VGR,"Vector Non-GAAP EPS of $0.34, revenue of $371.9M",7/31/2024 9:38:52 PM
VGR,7 Dividend Stock Dynamos to Upgrade Your Income Game,6/26/2024 10:00:00 AM
VGR,The tobacco sector is viewed cautiously by Seeking Alpha subscribers,6/25/2024 2:06:41 PM
VGR,3 Overlooked Tobacco Stocks Quietly Making Investors Rich,6/20/2024 9:13:07 PM
VGR,"WHO says tobacco industry targeting young people, especially with vaping products",5/23/2024 6:05:51 PM
VGR,Spicing Things Up: 3 Sin Stocks for the Adventurous Investor,5/22/2024 10:00:00 AM
VGR,Vector declares $0.20 dividend,5/16/2024 4:16:32 PM
VGR,Kellanova and Herbalife among Consumer Staples movers,5/2/2024 3:13:26 PM
VGR,"Vector Non-GAAP EPS of $0.24 misses by $0.01, revenue of $324.6M misses by $8.7M",5/1/2024 8:42:17 PM
VGR,Vector Q1 2024 Earnings Preview,4/30/2024 9:35:45 PM
VGR,Wall Street’s Favorite Dividend Stocks? 7 Tickers That Are Practically Money Machines,3/19/2024 10:30:00 AM
VGR,Oregon House passes bill to end hard drug decriminalization,3/1/2024 11:42:16 AM
VGR,Vector declares $0.20 dividend,2/15/2024 5:44:00 PM
VGR,SHOT and BOF among Consumer Staples movers,2/14/2024 4:38:22 PM
VGR,"Vector Non-GAAP EPS of $0.36 beats by $0.04, revenue of $360.35M beats by $2.75M",2/13/2024 9:40:07 PM
VGR,Notable earnings after Tuesday's close,2/12/2024 10:35:43 PM
VGR,Vector Group: Prioritizing Investor Satisfaction with Steady Earnings Performance,12/15/2023 4:05:35 PM
VGR,Vector Group earnings: here's what Wall Street expects,10/31/2023 3:01:13 PM
VGR,3 Tempting Sin Stocks for the Adventurous Investor,9/18/2023 11:17:57 AM
VGR,Vector declares $0.20 dividend,8/22/2023 3:05:07 PM
VGR,Top 5 Defensive Stocks Which Could Rescue Your Portfolio This Quarter,8/15/2023 2:03:30 PM
VGR,"Vector Non-GAAP EPS of $0.32, revenue of $365.7M",8/3/2023 9:06:56 PM
VGR,Vector declares $0.20 dividend,6/9/2023 8:04:02 PM
VGR,Why Vector Group Shares Are Tumbling Today,5/9/2023 7:09:49 PM
VGR,"Vector Non-GAAP EPS of $0.22 misses by $0.04, revenue of $334.15M in-line",5/8/2023 9:17:29 PM
VGR,Vector declares $0.20 dividend,3/6/2023 10:31:35 PM
VGR,"Vector Non-GAAP EPS of $0.31 beats by $0.08, revenue of $363.8M beats by $28.5M",2/15/2023 9:41:12 PM
VGR,Vector Q4 2022 Earnings Preview,2/14/2023 10:35:57 PM
VGR,The 7 Most Undervalued Long-Term Stocks to Buy in January,1/14/2023 9:03:39 PM
VGR,Congresswoman Virginia Foxx Recently Traded These 3 Stocks,1/6/2023 12:42:12 PM
VGR,"Vector Non-GAAP EPS of $0.24 misses by $0.03, revenue of $378M beats by $68.9M",11/1/2022 8:54:11 PM
VGR,Vector Q3 2022 Earnings Preview,10/31/2022 9:35:48 PM
VGR,FDA says more than 2.5M U.S. middle & high school students use e-cigarettes,10/6/2022 8:21:47 PM
VGR,Vector declares $0.20 dividend,8/22/2022 8:32:16 PM
VGR,Vector slides 6% after Q2 bottom line misses estimates,8/5/2022 5:04:49 PM
VGR,"Vector Non-GAAP EPS of $0.25 misses by $0.10, revenue of $387.2M beats by $49.5M",8/4/2022 9:26:35 PM
VGR,FDA conducting evaluation of tobacco division amid 'increasing number of novel products',7/19/2022 9:44:18 PM
VGR,7 Dividend Stocks to Avoid Despite Their Juicy Yields,6/20/2022 10:15:03 AM
VGR,Vector declares $0.20 dividend,6/6/2022 7:27:11 PM
VGR,7 ETFs With Dividends to Fight Any Market Downturns,5/29/2022 10:35:23 AM
VGR,Vector Group's stock falls 15% after first earnings miss post Douglas Elliman spin-off,5/10/2022 4:30:56 PM
VGR,27 Recession-Resistant Stocks To Look At Now,5/9/2022 7:26:47 PM
VGR,Notable earnings after Monday's close,5/8/2022 9:35:08 PM
VGR,53 Biggest Movers From Yesterday,4/1/2022 10:18:47 AM
VGR,"VTNR, MF and SABS among mid-day movers",3/31/2022 4:49:12 PM
VGR,Insider Weekends: ICONIQ Adds To Its Stake In Construction Management Software Company Procore Technologies + Notable Insider Trades,3/21/2022 6:39:28 PM
VGR,Vector declares $0.20 dividend,3/9/2022 1:14:04 PM
VGR,"Vector Non-GAAP EPS of $0.26 misses by $0.17, revenue of $313.67M misses by $298.53M",3/1/2022 9:41:15 PM
VGR,Vector Q4 2021 Earnings Preview,2/28/2022 10:35:46 PM
VGR,7 High-Yield Dividend Stocks That Can More Than Cover Their Dividend Payments,2/10/2022 4:09:57 PM
VGR,Vector Group rallies after Oppenheimer tips on M&A potential,1/21/2022 1:37:51 PM
VGR,"Jim Cramer Gives His Opinion On DuPont, Commercial Vehicle Group And More",1/20/2022 3:23:14 PM
VGR,"SA readers double down on crypto, pick up Douglas Elliman and drop Blackberry",1/9/2022 7:44:50 PM
VGR,63 Biggest Movers From Yesterday,12/31/2021 9:35:01 AM
VGR,Mid-Afternoon Market Update: Nasdaq Rises 70 Points; Future FinTech Shares Spike Higher,12/30/2021 8:38:10 PM
VGR,Calix Set to Join S&P MidCap 400; Douglas Elliman to Join S&P SmallCap 600,12/29/2021 12:02:00 AM
VGR,"Calix to join S&P MidCap 400, Douglas Elliman added to SmallCap 600",12/28/2021 10:57:43 PM
VGR,Vector declares $0.20 dividend,11/30/2021 9:21:57 PM
VGR,Vector Group Shares Gain After Barclays Upgrade,11/15/2021 8:21:31 PM
VGR,58 Stocks Moving In Tuesday's Mid-Day Session,11/9/2021 6:06:09 PM
VGR,"Vector EPS misses by $0.06, beats on revenue",11/8/2021 9:58:40 PM
VGR,Vector Q3 2021 Earnings Preview,11/7/2021 9:35:00 PM
VGR,Vector Group earnings: here's what Wall Street expects,11/6/2021 3:01:13 PM
VGR,7 Deep Value Stocks That Are an Even Better Buy Now After Tanking,9/29/2021 4:51:33 PM
VGR,Douglas Elliman Announces Strategic Investment in Bilt Rewards,9/21/2021 8:37:00 PM
VGR,Vector declares $0.20 dividend,8/23/2021 8:18:15 PM
VGR,Vector rises 8% after beat-and-strong earnings momentum in Tobacco and Real Estate segments,8/5/2021 3:05:44 PM
VGR,Vector declares $0.20 dividend,5/27/2021 9:24:33 PM
VGR,Vector Q1 2021 Earnings Preview,5/5/2021 6:21:55 PM
VGR,Vector Q1 2021 Earnings Preview,5/4/2021 9:35:42 PM
VGR,7 Dividend Stocks With Unsustainable Yields,4/7/2021 9:01:48 AM
VGR,Vector declares $0.20 dividend,3/2/2021 10:31:34 PM
VGR,"Vector EPS beats by $0.02, beats on revenue",2/25/2021 4:30:01 PM
VGR,Notable earnings after Wednesday's close,2/23/2021 10:35:55 PM
VGR,Vector Group Ltd. -- Moody's announces completion of a periodic review of ratings of Vector Group Ltd.,2/17/2021 9:31:00 PM
VGR,7 Stocks With Insider Buying This Week Worth A Look,1/29/2021 8:34:53 PM
VGR,"Notable Insider Buys Of The Past Week: Affirm, HEICO, Vector Group, Biotechs And More",1/24/2021 1:12:29 PM
VGR,Vector Group appoints Richard Lampen to COO,1/15/2021 11:43:39 AM
VGR,"Vector Group Ltd. -- Moody's rates Vector's senior secured notes Ba3, affirms CFR of B2; outlook is stable",1/11/2021 4:21:00 PM
VGR,Vector declares $0.20 dividend,12/3/2020 9:46:52 PM
VGR,Vector Q3 2020 Earnings Preview,11/4/2020 5:17:46 PM
VGR,Vector Group earnings preview: what to expect,8/5/2020 3:04:13 PM
VGR,"ARVN, ONEM among premarket losers",5/14/2020 1:18:57 PM
VGR,Vector Group Ltd. -- Moody's announces completion of a periodic review of ratings of Vector Group Ltd.,4/15/2020 4:41:00 PM
VGR,"OPK, AOBC, VGR and NNVC among after hours movers",3/5/2020 10:40:31 PM
VGR,"Stock Alert: Vector Group Loses 10% As Earnings, Revenue Fall ",2/28/2020 4:24:49 PM
VGR,Vector Q4 2019 Earnings Preview,2/27/2020 10:30:56 PM
VGR,"Vector Group Ltd. -- Moody's affirms Vector's CFR of B2, downgrades unsecured notes to Caa1; outlook changed to stable from negative",11/13/2019 6:35:00 PM
VGR,Vector Group is about to announce earnings — here's what Wall Street expects,8/6/2019 3:03:04 PM
VGR,Vector Group Ltd. -- Moody's announces completion of a periodic review of ratings of Vector Group Ltd.,6/11/2019 7:15:00 PM
VGR,Vector Group earnings preview: what Wall Street is expecting,5/6/2019 3:02:38 PM
VGR,Here's what to expect from Vector Group's earnings report,2/27/2019 3:01:54 PM
VGR,Vector Group Buys Remaining 29% Stake In Douglas Elliman Realty ,1/1/2019 5:32:26 AM
VGR,Vector Group earnings: here's what Wall Street expects,11/5/2018 3:02:36 PM
VGR,Vector Group Ltd. -- Moody's assigns B2 to Vector's new bond offering; outlook changed to negative,10/25/2018 9:02:00 PM
VGR,Vector Group earnings preview: what Wall Street is expecting,8/5/2018 3:01:59 PM
VGR,BRIEF-Vector Group Reports Q1 Adjusted Earnings Per Share Of $0.04,5/9/2018 12:35:06 PM
VGR,"Moody's: Legal marijuana provides potential revenue opportunities, challenges for North American governments and corporates",5/8/2018 11:12:00 AM
VGR,Vector Group Ltd. -- Moody's affirms Vector's B2 CFR; outlook stable,3/29/2018 10:46:00 PM
VGR,BRIEF-Vector Group says Q3 earnings per share $0.13 (VGR),11/7/2017 1:57:03 PM
VGR,"Stocks Under Scanner in the Cigarettes Space -- British American Tobacco, Altria, Philip Morris, and Vector",8/14/2017 12:35:00 PM
VGR,BRIEF-Vector Group Q2 earnings per share $0.20 (VGR),8/4/2017 12:17:03 PM
VGR,"Tobacco stocks tank after FDA says it plans to cut nicotine in cigarettes to non-addictive levels (BTI, MO, PM, VGR)",7/28/2017 4:48:07 PM
VGR,BRIEF-Vector Group Q1 loss per share $0.03 (VGR),5/5/2017 1:12:05 PM
VGR,"Research Reports on Cigarettes Equities -- Reynolds American, Altria, Philip Morris, and Vector",3/14/2017 1:05:00 PM
VGR,BRIEF-Vector Group Q4 earnings per share $0.04 (VGR),3/1/2017 10:18:20 PM
VGR,BRIEF-Vector announces pricing of $850 million of 6.125 pct senior secured notes (VGR),1/19/2017 11:30:09 PM
VGR,BRIEF-Vector Group says company and its subsidiary reached an agreement resolving 124 Engle Progeny tobacco litigation cases pending in Florida (VGR),12/9/2016 1:50:05 AM
