Ticker,Title,Link
SPNT,SPNT Stock Earnings: SiriusPoint Reported Results for Q2 2024,8/2/2024 1:54:22 AM
SPNT,SiriusPoint Announces Dividend on Series B Preference Shares,8/1/2024 10:10:30 PM
SPNT,SiriusPoint Announces Date for Second Quarter 2024 Earnings Release,7/18/2024 10:15:00 PM
SPNT,SiriusPoint Appoints Susan Cross to Board of Directors,5/28/2024 10:15:45 PM
SPNT,SiriusPoint Announces Jim McKinney as Chief Financial Officer,5/23/2024 10:15:56 PM
SPNT,SPNT Stock Earnings: SiriusPoint Reported Results for Q1 2024,5/1/2024 12:53:13 AM
SPNT,SiriusPoint Reports Sixth Consecutive Quarter of Underwriting Profits and Strong Net Income at $90.8m,4/30/2024 10:24:40 PM
SPNT,SiriusPoint Announces Date for First Quarter 2024 Earnings Release,4/16/2024 10:10:35 PM
SPNT,SiriusPoint Announces Pricing of Tender Offer for 4.600% Senior Notes due 2026,4/4/2024 5:15:27 PM
SPNT," SiriusPoint Announces Notes Offering, Tender Offer for 4.600% Senior Notes due 2026 and Redemption of 7.00% Senior Notes due 2025",3/21/2024 2:01:25 PM
SPNT,SiriusPoint reports 89.1% Combined ratio for its Core operations with Net Income up $742m from FY 22,2/20/2024 10:10:28 PM
SPNT,Notable earnings after Tuesday's close,2/19/2024 10:35:09 PM
SPNT,SiriusPoint Announces New Registrant Financial Obligations,2/10/2024 9:33:29 AM
SPNT,SiriusPoint Announces Date for Fourth Quarter and Full Year 2023 Earnings Release,2/6/2024 10:15:44 PM
SPNT,SiriusPoint Announces Dividend on Series B Preference Shares,2/2/2024 10:15:54 PM
SPNT,"SiriusPoint talking to Aspen Insurance, though deal is unlikely - report",1/25/2024 7:41:28 PM
SPNT,SiriusPoint gains amid report Aspen Insurance exploring deal,1/24/2024 3:17:05 PM
SPNT,The Parent of a SiriusPoint Shareholder Taken Into Private Receivership,12/14/2023 9:42:05 AM
SPNT,SiriusPoint S&P Global Ratings Outlook Revised to ‘Stable’,11/9/2023 3:15:56 PM
SPNT,SiriusPoint reports 87.6% Combined ratio for its Core operations with Net Income up $622m at 9M’23,11/8/2023 10:10:40 PM
SPNT,SiriusPoint Announces Date for Third Quarter 2023 Earnings Release,9/21/2023 11:59:46 PM
SPNT,"SiriusPoint, billionaire investor Daniel Loeb enter standstill agreement as buyout talks advance",8/9/2023 9:12:31 PM
SPNT,SiriusPoint drops after Dan Loeb says no longer exploring acquisition (update),5/12/2023 2:55:00 PM
SPNT,"SiriusPoint GAAP EPS of $0.78, revenue of $595.5M",5/3/2023 9:58:33 PM
SPNT,Top 4 Financial Stocks That May Crash In April,4/26/2023 2:45:03 PM
SPNT,Top 5 Financial Stocks That May Collapse In April,4/14/2023 2:12:51 PM
SPNT,Why Panbela Therapeutics Shares Are Trading Higher By Around 25%? Here Are Other Stocks Moving In Wednesday's Mid-Day Session,4/12/2023 6:47:38 PM
SPNT,"SiriusPoint GAAP EPS of -$0.17, revenue of $673.6M",2/23/2023 10:12:56 PM
SPNT,"Ocwen Financial among financials gainers, Lincoln National leads losers",11/3/2022 4:00:05 PM
SPNT,SiriusPoint reports year-over-year improvement of underwriting results and simplifies operating platform,11/2/2022 9:15:00 PM
SPNT,Ranking the 7 Top Small-Cap Stocks to Buy From Best to Worst,10/24/2022 6:05:47 PM
SPNT,SiriusPoint Announces Date for Third Quarter 2022 Earnings Release,10/19/2022 10:10:00 PM
SPNT,SiriusPoint Announces Steve Yendall as Chief Financial Officer,10/12/2022 10:10:00 PM
SPNT,Wheeler among financials losers; LexinFintech among gainers,9/7/2022 4:01:24 PM
SPNT,SiriusPoint reports a Q2 2022 combined ratio of 93.1% driven by positive underwriting results and growth in Insurance & Services segment,8/3/2022 10:15:00 PM
SPNT,SiriusPoint Announces Date for Second Quarter 2022 Earnings Release,7/20/2022 10:10:00 PM
SPNT,SiriusPoint Responds to S&P’s CreditWatch,6/28/2022 7:02:41 PM
SPNT,SiriusPoint Announces Appointments to Executive Leadership Team and Insurance & Services Segment,6/6/2022 10:30:00 PM
SPNT,SIRIUSPOINT ANNOUNCES DANIEL S. LOEB JOINING BOARD OF DIRECTORS,5/17/2022 10:23:00 PM
SPNT,SiriusPoint reports a Q1 2022 combined ratio of 93.7% driven by positive underwriting results and growth in Insurance & Services segment,5/4/2022 10:15:00 PM
SPNT,SiriusPoint Announces Date for First Quarter 2022 Earnings Release,4/20/2022 10:10:00 PM
SPNT,SiriusPoint to sell its Lloyd's managing agency to Mosaic Insurance,3/10/2022 3:11:35 PM
SPNT,SiriusPoint Announces the Appointment of Jason Robart to its Board of Directors,3/2/2022 3:03:03 PM
SPNT,SiriusPoint Celebrates One Year Anniversary,2/28/2022 3:20:00 PM
SPNT,SiriusPoint Announces Fourth Quarter and Full Year 2021 Earnings Results,2/24/2022 10:15:00 PM
SPNT,Here's what Wall Street expects from SiriusPoint's earnings,2/23/2022 3:01:13 PM
SPNT,SiriusPoint Announces Dividend on Series B Preference Shares,2/16/2022 2:00:00 PM
SPNT,SiriusPoint Announces Date for Fourth Quarter 2021 Earnings Release,2/10/2022 10:10:00 PM
SPNT,SiriusPoint appoints Andreas Kull as Chief Risk Officer,11/18/2021 1:00:00 PM
SPNT,LimitFi & SiriusPoint Announce Multi-Year Underwriting Partnership and Strategic Investment,11/9/2021 1:30:00 PM
SPNT,SiriusPoint Announces Third Quarter 2021 Earnings Results,11/3/2021 9:15:00 PM
SPNT,SiriusPoint earnings: here's what Wall Street expects,11/2/2021 3:01:13 PM
SPNT,SiriusPoint Announces Partnership with Climate Focused Start-up Parameter Climate,10/22/2021 11:31:38 AM
SPNT,SiriusPoint Announces Date for Third Quarter 2021 Earnings Release,10/21/2021 10:15:00 PM
SPNT,SiriusPoint Announces Estimated Impact on Q3 2021 Results from European Floods,9/9/2021 2:16:35 PM
SPNT,SiriusPoint Announces Dividend on Series B Preference Shares,8/6/2021 2:05:00 PM
SPNT,Compre and SiriusPoint Announce Strategic Deal,8/5/2021 10:15:00 PM
SPNT,SiriusPoint earnings: here's what Wall Street expects,8/3/2021 3:02:13 PM
SPNT,Insurtech Joyn Insurance Secures Insurance Partnership and Investment from SiriusPoint Ltd.,7/6/2021 2:30:00 PM
SPNT,"Outdoorsy raises $120M to support accelerated marketplace growth and rapid expansion of insurtech division, Roamly",6/24/2021 3:00:00 PM
SPNT,ArmadaCare Appoints Mike Ross as Chief Revenue Officer,6/22/2021 2:00:00 PM
SPNT,SiriusPoint Ltd. Contingent Value Rights to trade on the OTCQX,6/16/2021 1:00:00 PM
SPNT,SiriusPoint Hires CTO to Lead its Technology Drive,5/3/2021 10:15:00 PM
SPNT,"SiriusPoint appoints Larry Hallett as SVP, Casualty Underwriting",4/27/2021 10:00:30 PM
SPNT,SiriusPoint announces first partnership with advisory firm Hestia Capital,4/26/2021 1:00:00 PM
SPNT,"SiriusPoint Releases Inaugural Environmental, Social and Governance (ESG) Report",4/19/2021 3:57:04 PM
SPNT,Earth Hour 2021: Greenrock Announces SiriusPoint As Lead Bermuda Sponsor,3/26/2021 3:49:51 PM
SPNT,SiriusPoint to Ring New York Stock Exchange Opening Bell On March 16,3/16/2021 12:00:00 PM
