Ticker,Title,Link
TTGT,Wall Street Analysts Are Bullish on Top Communication Services Picks,8/12/2024 7:55:06 AM
TTGT,"Analysts Offer Insights on Communication Services Companies: Paramount Global Class B (PARA), TechTarget (TTGT) and Take-Two (TTWO)",8/9/2024 12:34:52 PM
TTGT,"TechTarget Non-GAAP EPS of $0.42 beats by $0.01, revenue of $58.9M beats by $0.82M",8/8/2024 10:03:40 PM
TTGT,What Wall Street expects from TechTarget's earnings,8/7/2024 3:01:13 PM
TTGT,Lake Street Keeps Their Buy Rating on TechTarget (TTGT),8/6/2024 1:08:13 PM
TTGT,3 Oversold Stocks Down 70% to Buy on the Dip Before They Rebound,6/8/2024 4:00:00 PM
TTGT,KeyBanc Keeps Their Buy Rating on TechTarget (TTGT),5/14/2024 6:45:47 AM
TTGT,"Analysts’ Top Communication Services Picks: Cineplex (CPXGF), TechTarget (TTGT)",5/10/2024 9:32:47 AM
TTGT,"TechTarget Non-GAAP EPS of $0.31 misses by $0.02, revenue of $51.6M beats by $0.56M",5/9/2024 9:11:48 PM
TTGT,TechTarget Q1 2024 Earnings Preview,5/8/2024 9:35:23 PM
TTGT,Craig-Hallum Sticks to Their Buy Rating for TechTarget (TTGT),5/7/2024 12:59:40 PM
TTGT,Lake Street Keeps Their Buy Rating on TechTarget (TTGT),5/6/2024 12:57:02 PM
TTGT,7 Terrific Tech Stocks to Buy Instead of the Magnificent 7,2/22/2024 11:45:00 AM
TTGT,"TechTarget Non-GAAP EPS of $0.42 beats by $0.05, revenue of $57.3M beats by $0.67M",2/8/2024 4:45:21 PM
TTGT,TechTarget Q4 2023 Earnings Preview,2/6/2024 10:35:57 PM
TTGT,TechTarget (TTGT) Gets a Buy from Lake Street,2/5/2024 1:55:22 PM
TTGT,Analyst Scoreboard: 7 Ratings For TechTarget,1/31/2024 2:00:19 PM
TTGT,Keybanc Maintains Overweight Rating for TechTarget: Here's What You Need To Know,1/22/2024 6:00:32 PM
TTGT,TechTarget Stock: A Deep Dive Into Analyst Perspectives (5 Ratings),1/12/2024 2:01:08 PM
TTGT,Why TechTarget Shares Are Trading Higher By Over 14%? Here Are Other Stocks Moving In Thursday's Mid-Day Session,1/11/2024 7:32:06 PM
TTGT,Positive Outlook for TechTarget (TTGT) Amidst Technological Innovation and Market Share Gain Potential,11/23/2023 11:46:56 AM
TTGT,Where TechTarget Stands With Analysts,11/20/2023 2:00:57 PM
TTGT,"Analysts Offer Insights on Technology Companies: Twilio (TWLO), Xometry (XMTR) and TechTarget (TTGT)",11/9/2023 7:42:49 PM
TTGT,TechTarget is about to announce its earnings — here's what Wall Street expects,11/7/2023 3:01:13 PM
TTGT,"Benzinga's Top Ratings Upgrades, Downgrades For September 25, 2023",9/25/2023 5:00:37 PM
TTGT,"Analysts Have Conflicting Sentiments on These Technology Companies: Intel (INTC), Zuora (ZUO) and TechTarget (TTGT)",8/16/2023 12:50:11 PM
TTGT,Expert Ratings for TechTarget,8/9/2023 7:02:07 PM
TTGT,"TechTarget GAAP EPS of $0.10 beats by $0.08, revenue of $58.43M beats by $1.59M",8/8/2023 9:04:36 PM
TTGT,TechTarget earnings preview: what Wall Street is expecting,8/7/2023 3:01:13 PM
TTGT,TechTarget's Struggles And Potential: Analyst Analyzes Revenue Estimates And Growth Prospects,5/15/2023 9:00:07 PM
TTGT,What 5 Analyst Ratings Have To Say About TechTarget,5/11/2023 11:01:41 PM
TTGT,Needham Sticks to Their Buy Rating for TechTarget (TTGT),5/10/2023 4:26:07 PM
TTGT,"RUM, SYNH and TTGT are among after hour movers",5/9/2023 9:56:08 PM
TTGT,Here's what Wall Street expects from TechTarget's earnings,5/8/2023 3:01:13 PM
TTGT,Micron Technology To Rally 20%? Here Are 10 Other Analyst Forecasts For Friday,2/10/2023 1:58:26 PM
TTGT,Needham Remains a Buy on TechTarget (TTGT),2/9/2023 8:05:15 PM
TTGT,TechTarget Q4 2022 Earnings Preview,2/8/2023 5:06:17 PM
TTGT,Analyst Ratings for TechTarget,12/20/2022 5:00:36 PM
TTGT,"TechTarget, AST SpaceMobile Are Among Oversold Communication Services Stocks: Are They Worth A Look?",12/8/2022 6:42:00 PM
TTGT,Why Apyx Medical Shares Dipped Over 60%; Here Are 123 Biggest Movers From Yesterday,11/11/2022 11:10:24 AM
TTGT,Why Magnite Shares Are Trading Higher By Over 45%? Here Are 69 Stocks Moving In Thursday's Mid-Day Session,11/10/2022 7:05:52 PM
TTGT,"TechTarget GAAP EPS of $0.46 beats by $0.11, revenue of $77.4M misses by $2.62M",11/9/2022 9:37:38 PM
TTGT,TechTarget Q3 2022 Earnings Preview,11/8/2022 10:35:37 PM
TTGT,TechTarget reports Q2 results,8/4/2022 1:19:59 PM
TTGT,TechTarget Q2 2022 Earnings Preview,8/3/2022 9:26:46 PM
TTGT,What 5 Analyst Ratings Have To Say About TechTarget,5/11/2022 5:05:40 PM
TTGT,"TechTarget Non-GAAP EPS of $0.53 beats by $0.06, revenue of $68.17M beats by $1.84M",5/10/2022 11:22:14 AM
TTGT,TechTarget Q1 2022 Earnings Preview,5/9/2022 4:12:40 PM
TTGT,7 Stocks To Buy at the Bottom After the Market Rout,2/17/2022 5:20:35 PM
TTGT,62 Biggest Movers From Yesterday,2/11/2022 10:31:07 AM
TTGT,42 Stocks Moving In Thursday's Mid-Day Session,2/10/2022 6:54:52 PM
TTGT,TechTarget Q4 2021 Earnings Preview,2/9/2022 6:15:13 PM
TTGT,TechTarget launches $360M convertible notes offering,12/7/2021 11:03:36 PM
TTGT,Ad-techs gain in wake of 25% post-earnings jump at The Trade Desk,11/8/2021 3:14:46 PM
TTGT,"TechTarget EPS beats by $0.05, beats on revenue",11/3/2021 9:00:15 PM
TTGT,TechTarget Q3 2021 Earnings Preview,11/2/2021 9:35:32 PM
TTGT,"TechTarget EPS beats by $0.03, beats on revenue",8/4/2021 8:40:10 PM
TTGT,Notable earnings after Wednesday's close,8/3/2021 9:35:34 PM
TTGT,Here's what Wall Street expects from TechTarget's earnings,8/2/2021 3:02:05 PM
TTGT,"Benzinga's Top Ratings Upgrades, Downgrades For June 30, 2021",6/30/2021 4:16:19 PM
TTGT,"Benzinga's Top Ratings Upgrades, Downgrades For June 23, 2021",6/23/2021 4:04:33 PM
TTGT,Notable earnings after Wednesday's close,5/4/2021 9:35:29 PM
TTGT,TechTarget earnings preview: what to expect,5/3/2021 3:01:44 PM
TTGT,"Benzinga's Top Ratings Upgrades, Downgrades For April 8, 2021",4/8/2021 4:52:38 PM
TTGT,"Benzinga's Top Ratings Upgrades, Downgrades For March 16, 2021",3/16/2021 3:38:12 PM
TTGT,"Benzinga's Top Ratings Upgrades, Downgrades For February 18, 2021",2/18/2021 4:02:47 PM
TTGT,TechTarget Q4 2020 Earnings Preview,2/9/2021 10:35:54 PM
TTGT,What Wall Street expects from TechTarget's earnings,2/8/2021 3:02:01 PM
TTGT,This Small Tech Stock has Big Upside Potential in the Data-Driven Marketing Megatrend of the Century,1/25/2021 2:50:54 PM
TTGT,TechTarget shores up decision support with ESG acquisition,1/4/2021 3:39:34 PM
TTGT,TechTarget completes $150M BrightTALK acquisition,12/23/2020 10:09:02 PM
TTGT,TechTarget prices $175M private convertible debt offering,12/15/2020 12:05:47 PM
TTGT,Penn National Gaming among consumer gainers; AMC Entertainment and Fossil Group among losers,12/14/2020 5:00:28 PM
TTGT,TechTarget to acquire BrightTALK for $150M,12/10/2020 2:20:13 PM
TTGT,Meredith and ODP among consumer gainers; Hanesbrands and Drive Shack among losers,11/5/2020 5:00:18 PM
TTGT,Notable earnings after Wednesday's close,11/3/2020 10:35:22 PM
TTGT,TechTarget is about to announce its earnings — here's what Wall Street expects,8/4/2020 3:03:46 PM
TTGT,TechTarget sees raised target from Craig-Hallum,6/9/2020 4:35:41 PM
TTGT,Here's what to expect from TechTarget's earnings,5/5/2020 3:01:45 PM
TTGT,TechTarget buys Data Science Central,3/4/2020 5:17:08 PM
TTGT,"WLL, NTAP, TRIP and NUS among after hour movers",2/12/2020 10:37:15 PM
TTGT,Here's what to expect from TechTarget's earnings report,2/11/2020 3:02:13 PM
TTGT,TechTarget earnings preview: what to expect,8/5/2019 3:03:10 PM
TTGT,Here's what Wall Street expects from TechTarget's earnings,5/6/2019 3:02:38 PM
TTGT,TechTarget earnings: here's what Wall Street expects,2/4/2019 3:02:00 PM
TTGT,TechTarget is about to announce earnings — here's what Wall Street expects,11/5/2018 3:02:36 PM
TTGT,"TechTarget to Present at the 7th Annual Liolios Gateway Conference on September 5, 2018",8/27/2018 2:30:00 PM
TTGT,TechTarget earnings preview: what Wall Street is expecting,8/6/2018 3:03:18 PM
TTGT,BRIEF-TechTarget Sees Q2 2018 Revenue $30 Million To $31 Million,5/9/2018 11:05:09 PM
TTGT,BRIEF-TechTarget and Hines Global enters third amendment to certain lease agreement (TTGT),10/27/2017 10:27:16 PM
TTGT,"BRIEF-Nine Ten Partners sells 40,000 shares of TechTarget Inc's common stock on Sept 20 (TTGT)",9/21/2017 7:47:07 PM
TTGT,BRIEF-Techtarget Inc entered into a first amendment to credit agreement (TTGT),6/22/2017 10:28:04 PM
TTGT,BRIEF-Techtarget qtrly loss per share $0.00 (TTGT),5/10/2017 10:40:03 PM
TTGT,BRIEF-TechTarget announces CFO transition plan (TTGT),9/26/2016 6:40:24 PM
