Ticker,Title,Link
NMRA,Neumora Therapeutics to Host Key Opinion Leader Roundtable to Discuss the Potential of Navacaprant in Neuropsychiatric Disorders,8/14/2024 1:00:00 PM
NMRA,"Analysts Are Bullish on Top Healthcare Stocks: Stereotaxis (STXS), Neumora Therapeutics, Inc. (NMRA)",8/12/2024 1:23:52 PM
NMRA,Neumora Therapeutics’ Advancing Drug Pipeline Supports Buy Rating,8/7/2024 10:57:22 AM
NMRA,NMRA Stock Earnings: Neumora Therapeutics Meets EPS for Q2 2024,8/6/2024 5:54:01 PM
NMRA,"Mizuho starts Neumora at outperform, bullish on lead drug's prospects",7/8/2024 5:38:13 PM
NMRA,Neumora Therapeutics Announces Initiation of Phase 1b Study of NMRA-511 for Treatment of Alzheimer’s Disease Agitation,6/20/2024 1:00:00 PM
NMRA,"Analysts Offer Insights on Healthcare Companies: Ionis Pharmaceuticals (IONS), Neumora Therapeutics, Inc. (NMRA) and Monte Rosa Therapeutics (GLUE)",6/17/2024 10:30:48 AM
NMRA,"Analysts Are Bullish on These Healthcare Stocks: Halozyme (HALO), 4D Molecular Therapeutics (FDMT)",6/7/2024 12:26:57 AM
NMRA,Neumora Therapeutics Announces Initiation of Phase 2 Study of Navacaprant in Bipolar Depression,5/14/2024 1:00:00 PM
NMRA,"Neumora Therapeutics, Inc. (NMRA) Gets a Buy from Bank of America Securities",5/13/2024 1:37:16 PM
NMRA,"Analysts Are Bullish on These Healthcare Stocks: Neumora Therapeutics, Inc. (NMRA), IDEAYA Biosciences (IDYA)",5/11/2024 2:00:32 AM
NMRA,NMRA Stock Earnings: Neumora Therapeutics Meets EPS for Q1 2024,5/7/2024 5:54:08 PM
NMRA,Neumora Therapeutics to Participate in Upcoming Conferences in May,5/6/2024 1:00:00 PM
NMRA,"Analysts Offer Insights on Healthcare Companies: Qiagen (QGEN), Innate Pharma SA (OtherIPHYF) and Neumora Therapeutics, Inc. (NMRA)",4/17/2024 8:10:44 AM
NMRA,S&P 500 Down Over 1%; US Retail Sales Increase 0.7% In March,4/15/2024 8:30:38 PM
NMRA,"RBC Capital Remains a Buy on Neumora Therapeutics, Inc. (NMRA)",3/28/2024 10:35:34 AM
NMRA,Why Clover Health Investments Shares Are Trading Higher By 11%? Here Are Other Stocks Moving In Wednesday's Mid-Day Session,3/13/2024 6:18:57 PM
NMRA,"IPO Roundup: Boundless Bio, NeOnc Technologies and more",3/11/2024 4:44:07 PM
NMRA,"Neumora Therapeutics, Inc. (NMRA) Gets a Buy from RBC Capital",3/8/2024 12:26:40 PM
NMRA,NMRA Stock Earnings: Neumora Therapeutics Misses EPS for Q4 2023,3/7/2024 7:52:36 PM
NMRA,"Stifel Nicolaus Sticks to Its Buy Rating for Neumora Therapeutics, Inc. (NMRA)",2/9/2024 1:29:16 PM
NMRA,Neumora Therapeutics Appoints Kaya Pai Panandiker as Chief Commercial Officer,1/22/2024 1:00:00 PM
NMRA,Neumora Therapeutics to Present at 42nd Annual J.P. Morgan Healthcare Conference,1/2/2024 1:00:00 PM
NMRA,Why AAR Shares Are Trading Lower By 7%? Here Are Other Stocks Moving In Friday's Mid-Day Session,12/22/2023 7:28:37 PM
NMRA,7 Stocks with Strong Insider Buying: December 2023,12/17/2023 5:35:39 PM
NMRA,Neumora Therapeutics Appoints Jason Duncan as Chief Legal Officer,12/12/2023 1:00:00 PM
NMRA,Why U Power Shares Are Trading Lower By Around 54%? Here Are Other Stocks Moving In Monday's Mid-Day Session,12/4/2023 7:10:23 PM
NMRA,Today’s Biggest Pre-Market Stock Movers: 10 Top Gainers and Losers on Thursday,11/30/2023 12:24:20 PM
NMRA,Neumora Therapeutics Begins Phase 1 Study With NMRA-266 - Quick Facts ,11/27/2023 1:24:19 PM
NMRA,Analyst Expectations for Neumora Therapeutics's Future,11/8/2023 10:00:27 PM
NMRA,"Analysts Offer Insights on Healthcare Companies: Alnylam Pharma (ALNY), Sanofi (OtherSNYNF) and Neumora Therapeutics, Inc. (NMRA)",11/3/2023 1:50:28 AM
NMRA,"PagerDuty, John Wiley & Sons, Ventyx Biosciences And Other Big Stocks Moving Lower On Tuesday",10/10/2023 5:37:49 PM
NMRA,Why Intelligent Bio Solutions Shares Are Trading Lower By Around 55%? Here Are Other Stocks Moving In Monday's Mid-Day Session,10/2/2023 7:01:18 PM
NMRA,Ticking Time Bombs: 3 New Stocks to Dump Before the Damage Is Done (IPO),9/28/2023 11:54:18 PM
NMRA,Why Gorilla Technology Group Shares Are Trading Lower By 25%? Here Are Other Stocks Moving In Wednesday's Mid-Day Session,9/20/2023 8:10:57 PM
