Ticker,Title,Link
TRV,"Israel's Viola raises fintech fund backed by Travelers, Scotiabank (BNS, TRV, POLI, LUMI)",12/6/2017 1:02:03 PM
TRV,"UPDATE 1-Travelers says it's in 'right spot' for cyber insurance exposure (TRV, EFX, AIG)",11/13/2017 8:22:03 PM
TRV,"BUZZ-U.S. stocks weekly: Cold front (AAPL, QCOM, AVGO, GGP, MAC, DIS, AXP, GS, JPM, TRV, NVDA)",11/10/2017 10:27:06 PM
TRV,"N. American commercial property insurance rates seen rising sharply in 2018 (WTW, AIG, TRV, CB)",11/6/2017 7:42:05 PM
TRV,"UPDATE 2-California insurance agency: wildfires losses at $3.3 bln, rising (TRV, ALL, CB)",10/31/2017 11:12:18 PM
TRV,"Global insurers look to raise rates after catastrophic quarter (CB, AIG, ALL, HSX, BEZ, TRV, HIG, HNR1, LRE)",10/26/2017 8:07:07 PM
TRV,UPDATE 1-California Dept of Insurance estimates wildfires losses at $1.05 bln (TRV),10/19/2017 11:52:12 PM
TRV,"Insurance payouts may not cover all wildfire damage for California wineries (AON, MMC, ALV, TRV, CB)",10/17/2017 12:12:05 PM
TRV,"US STOCKS-Wall St hits fresh record on financial, tech gains (AAPL, JPM, C, GS, MS, TRV, NFLX, CVX, XOM, ADBE, FCX)",10/16/2017 4:22:04 PM
TRV,"JPMorgan's card gamble lures millennial travelers, squeezes competitors",10/13/2017 11:02:21 AM
TRV,"RPT-BUZZ-U.S. stocks weekly: Runnin' down a dream (GM, NFLX, MYL, XLK, JPM, AXP, TRV, GS)",10/9/2017 1:32:03 PM
TRV,"BUZZ-U.S. stocks weekly: Runnin' down a dream (GM, NFLX, MYL, XLK, JPM, AXP, TRV, GS)",10/6/2017 10:27:03 PM
TRV,Former Coca-Cola® Executive William Lampe Joins NuZee (d/b/a/ Coffee Blenders®) As Operations Consultant,9/26/2017 12:30:00 PM
TRV,BRIEF-Travelers Companies introduces ZoneCheckSM to help contractors spot potential for vibration damage (TRV),9/20/2017 3:27:03 PM
TRV,"RPT-Business interrupted: hurricane-damaged firms dig in for insurance fight (TRV, HIG, AON)",9/15/2017 1:12:06 PM
TRV,"Insurance Stock Performance Review -- AmTrust Financial Services, Chubb, Radian, and Travelers Cos.",9/11/2017 12:40:00 PM
TRV,"US STOCKS-S&P 500 slips as Hurricane Irma nears Florida; tech falls (TRV, AAPL, HD, LOW, EFX, KR)",9/8/2017 11:57:08 PM
TRV,"US STOCKS-Fresh North Korea tensions hit Wall Street (GS, JPM, BAC, UTX, COL, BA, DAL, INSM, TRV, CB)",9/5/2017 11:07:15 PM
TRV,"Chubb, Allstate able to absorb Harvey losses -Barron's (CB, TRV, ALL, BRK.)",9/3/2017 11:57:03 PM
TRV,"RPT-Insurers count cost of Harvey and growing risk from climate change (MUV2, HNR1, SCR, ALL, TRV)",8/29/2017 9:07:04 AM
TRV,"UPDATE 1-Harvey hits insurance stocks as loss estimates surge to $20 bln (TRV, ALL, PGR, MMC, MUV2, SCR, HNR1)",8/28/2017 10:47:07 PM
TRV,Marriott set to woo Chinese tourists with Alibaba deal,8/7/2017 3:24:02 PM
TRV,BRIEF-Travelers completes acquisition of UK-based Simply Business (TRV),8/4/2017 10:12:08 PM
TRV,BRIEF-Travelers CEO Alan Schnitzer elected chairman of board (TRV),8/2/2017 2:22:04 PM
TRV,"RPT-Hail, pummeled cars loom over U.S. insurance results (TRV, AIG, ALL, HIG, ACGL, AON)",7/24/2017 1:04:04 PM
TRV,"US STOCKS-Wall St flat as home improvement retailers get Amazoned (SHLD, AMZN, HD, LOW, BBY, WHR, MSFT, VZ, T, QCOM, AAPL, TRV)",7/20/2017 10:38:04 PM
TRV,St. Paul Fire and Marine Insurance Company -- Moody's affirms Travelers' ratings (A2 senior); stable outlook,7/14/2017 2:05:00 AM
TRV,BRIEF-FINRA says William H. Heyman elected Chairman of FINRA board of governors (TRV),6/29/2017 6:42:07 PM
TRV,"BRIEF-Travelers results reported in 3 business segments, effective April 1 (TRV)",6/20/2017 1:14:04 PM
TRV,"Stocks Under Scanner in the Insurance Space -- Chubb, Radian, Travelers Cos., and XL Group",6/19/2017 12:55:00 PM
TRV,"Companies use kidnap insurance to guard against ransomware attacks (AIG, HSX, TRV, SYMC, AON, MMC)",5/19/2017 5:28:05 PM
TRV,BRIEF-Travelers Companies files for offering of up to $700.0 million aggregate principal amount of 4.000% senior notes (TRV),5/16/2017 11:24:07 PM
TRV,"Insurance Stocks Under Scanner -- MBIA Inc., XL Group, Travelers, and Chubb",5/9/2017 12:15:00 PM
TRV,"UPDATE 1-U.S. insurance profits hit by lower premiums, bad weather (MET, PRU, AIG, ALL, TRV)",5/4/2017 2:28:05 AM
TRV,BRIEF-Travelers to redeem certain debentures (TRV),5/3/2017 11:56:05 PM
TRV,"US STOCKS-Wall St climbs as earnings gather pace; AmEx boosts Dow (AXP, AAPL, CVX, XOM, PM, V)",4/20/2017 7:37:07 PM
TRV,"Saudi banks, bin Laden companies face $4.2 bln U.S. lawsuit by 9/11 insurers (TRV, 1120)",4/13/2017 9:05:02 PM
TRV,"BRIEF-Travelers Companies offers customers cybersecurity services from Symantec (SYMC, TRV)",4/10/2017 4:25:08 PM
TRV,BRIEF-Travelers Companies says CEO Alan Schnitzer's 2016 total compensation was $11.6 million (TRV),3/31/2017 6:20:52 PM
TRV,"Research Reports Initiation on Insurance Stocks -- Allstate, Old Republic, Travelers, and Chubb",3/29/2017 12:35:00 PM
TRV,Laptop ban hits Gulf airlines in battle for business travelers,3/22/2017 5:18:39 PM
TRV,BRIEF-Travelers estimates impact of UK Ogden discount rate change (TRV),3/20/2017 1:20:46 PM
TRV,"BUZZ-Dow's financial components have a lot baked in (GS, JPM, TRV, V, BRK., AXP, BAC)",3/13/2017 5:50:24 PM
TRV,BRIEF-Heather Masterson appointed CEO of Travelers Canada (TRV),11/10/2016 10:10:18 PM
TRV,BRIEF-Travelers companies agreed to a settlement with one of defendants in previously reported reinsurance dispute (TRV),11/8/2016 1:50:18 PM
TRV,"U.S. RESEARCH ROUNDUP-Alkermes, Chesapeake Energy Corp, Latam Airlines (AXAS, ALKS, BHE, SAM, CHK, CNS, CLW, CPA, CCK, LFL, DHR, EWBC, GXP, FTI, JAKK, MXIM, MSFT, PFBC, SLG, SIVB, PKG, TCBI, UBSH,...",10/21/2016 2:58:22 PM
TRV,UPDATE 1-Insurer Travelers reports 22.8 pct fall in profit (TRV),10/20/2016 3:10:23 PM
TRV,White House seeks to answer complaints of aggrieved air travelers,10/19/2016 1:56:18 AM
TRV,Delta Air to take payments via Alipay from Chinese travelers,4/1/2015 6:48:18 PM
TRV,"Lufthansa pilots' 15-hour strike affects 9,000 travelers",9/30/2014 12:13:14 PM
TRV,Venezuela airline crisis makes travelers ever more inventive,9/16/2014 7:08:49 AM
TRV,"Europe beckons air travelers, but may leave your bag behind",6/18/2014 5:53:15 PM
TRV,Travelers to cut auto insurance rates to battle competition,7/23/2013 6:01:24 PM
TRV,Travelers to buy insurer from Canada's E-L Financial for $1.1 billion,6/10/2013 3:54:07 PM
TRV,"Rush to help airlines, travelers could crack open budget door",4/27/2013 2:58:54 AM
