Ticker,Title,Link
TRV,Travelers Companies (TRV) Receives a Hold from Morgan Stanley,8/19/2024 1:09:01 PM
TRV,Wall Street Analysts Are Neutral on Top Financial Picks,8/7/2024 6:10:49 AM
TRV,7 Safe Stocks to Pick Up Amid Incoming Uncertainty,8/2/2024 10:00:00 AM
TRV,"Thanks, CrowdStrike Outage! 7 Insurance Stocks That Could See Increased Demand for Cyber Insurance.",7/31/2024 6:58:05 PM
TRV,Roth MKM Reaffirms Their Buy Rating on Travelers Companies (TRV),7/25/2024 11:55:58 AM
TRV,Cautious Hold Rating for The Travelers Companies Amid Reserve Additions and Industry Challenges,7/24/2024 8:49:43 AM
TRV,Evercore ISI Keeps Their Buy Rating on Travelers Companies (TRV),7/22/2024 12:19:40 PM
TRV,Underlying Challenges and Weakening Retention Underpin Sell Rating for Travelers Companies,7/21/2024 11:58:22 PM
TRV,"Travelers Q2 Earnings Beat, Revenues Miss Estimates",7/19/2024 9:46:15 PM
TRV,The Travelers Companies Q2 2024 Earnings Preview,7/18/2024 4:06:57 PM
TRV,"Progressive's Q2 Earnings Beat, Premiums Rise Y/Y",7/17/2024 6:44:36 PM
TRV,This BP Analyst Is No Longer Bullish; Here Are Top 5 Downgrades For Monday,7/15/2024 3:48:09 PM
TRV,"Earnings week ahead: BAC, GS, JNJ, TSM, UNH, ABT, UAL, NFLX, AXP and more",7/14/2024 12:00:00 PM
TRV,"Catalyst Watch: Netflix, Taiwan Semi, Amazon, and HashiCorp are in the spotlight",7/12/2024 7:00:29 PM
TRV,Wells Fargo lays out three tactical insurance trade ideas for Q2,7/11/2024 1:54:26 PM
TRV,Forecasting The Future: 15 Analyst Projections For Travelers Companies,7/10/2024 8:01:10 PM
TRV,3 Earnings All-Stars With More Room to Run,7/3/2024 12:00:00 PM
TRV,Stocks to watch as Category 5 Hurricane Beryl heads towards Jamaica,7/2/2024 11:16:42 AM
TRV,"CB, TRV stocks fall after downgrade by William Blair",6/28/2024 2:56:13 PM
TRV,Expert Ratings For Travelers Companies,6/24/2024 5:00:48 PM
TRV,Bank of America Securities Reaffirms Their Sell Rating on Travelers Companies (TRV),6/18/2024 1:16:27 PM
TRV,3 Sorry Dow Stocks to Sell in May While You Still Can,5/28/2024 11:30:00 AM
TRV,"Auto insurance inflation set to tap on the brakes, BofA economist says",5/26/2024 8:17:00 PM
TRV,Brace for Impact: 3 Stocks to Dump NOW Before 2024’s Devastating Hurricane Season,5/16/2024 10:38:00 AM
TRV,3 Must-Sell Stocks: Protect Your Profits from the Looming 2024 Hurricane Season Chaos,5/14/2024 2:09:19 PM
TRV,A Glimpse Into The Expert Outlook On Travelers Companies Through 17 Analysts,5/10/2024 9:01:23 PM
TRV,"Soaring Premiums, Soaring Profits: 3 Top Insurance Stocks to Own Now",5/1/2024 10:44:00 AM
TRV,Maintaining Hold: A Balanced View on Travelers Companies’ Current Performance and Market Strategy,4/26/2024 9:23:08 AM
TRV,Janney Montgomery Remains a Buy on Travelers Companies (TRV),4/22/2024 12:31:18 PM
TRV,Where Travelers Companies Stands With Analysts,4/18/2024 5:01:06 PM
TRV,"Stocks Fall As Geopolitics, Economic Worries Spook Investors, Chipmakers Sell Off, Bitcoin Tumbles To $60,000: What's Driving Markets Wednesday?",4/17/2024 8:09:41 PM
TRV,The Travelers Companies Q1 2024 Earnings Preview,4/16/2024 4:39:28 PM
TRV,"Earnings week ahead: BAC, JNJ, TSM, UNH, ABT, SLB, UAL, PG, NFLX and more",4/14/2024 12:00:00 PM
TRV,Top Seeking Alpha Quant picks in Financial sector as earnings kick off,4/10/2024 3:43:00 PM
TRV,8 Analysts Have This To Say About Travelers Companies,4/1/2024 8:00:12 PM
TRV,Baltimore bridge collision may be the largest insured marine loss ever,3/28/2024 3:59:48 PM
TRV,"Here are the Dow's best 2024 performers as the index approaches 40,000",3/22/2024 3:41:15 PM
TRV,Berkshire Hathaway stock slips after solid Q4 results; Geico still playing defense,2/26/2024 7:17:21 PM
TRV,"Analysts Conflicted on These Financial Names: Travelers Companies (TRV), Heartland Financial USA (HTLF) and Truist Financial (TFC)",2/21/2024 6:30:58 AM
TRV,It’s Time! 3 Overheated Dow Stocks to Sell in February,2/19/2024 7:25:00 PM
TRV,"Global insurance losses in 2023 exceed $100B for fourth straight year, Aon says",1/27/2024 9:17:00 PM
TRV,"How EVs, High-Tech Vehicles Are Fueling Surge In Insurance Stocks",1/25/2024 7:49:46 PM
TRV,"Analysts Offer Insights on Financial Companies: Travelers Companies (TRV), Blackstone Group (BX) and PNC Financial (PNC)",1/22/2024 8:20:32 PM
TRV,"Crypto-tied stocks Marathon, Riot, Coinbase top week's financial movers",1/20/2024 3:28:00 PM
TRV,S&P 500 Shatters Records: The Top-Performing Stocks In January 2024,1/19/2024 10:03:58 PM
TRV,Travelers is about to announce its earnings — here's what Wall Street expects,1/18/2024 3:01:13 PM
TRV,Wells Fargo Sticks to Their Hold Rating for Travelers Companies (TRV),1/11/2024 12:27:11 PM
TRV,A Closer Look at 5 Analyst Recommendations For Travelers Companies,1/10/2024 4:01:29 PM
TRV,7 Low-Volatility Stocks for Stable Growth in 2024,12/21/2023 7:11:41 PM
TRV,The Latest Analyst Ratings For Travelers Companies,12/20/2023 7:00:21 PM
TRV,Analysts Offer Insights on Financial Companies: Travelers Companies (TRV) and Invesco (IVZ),12/19/2023 11:40:32 AM
TRV,Wells Fargo Reaffirms Their Hold Rating on Travelers Companies (TRV),12/18/2023 12:28:21 PM
TRV,Analyst Expectations for Travelers Companies's Future,11/16/2023 1:00:37 PM
TRV,Travelers Companies Agrees To Acquire Corvus Insurance In $435 Mln Deal ,11/3/2023 1:21:22 PM
TRV,"Analysts Conflicted on These Financial Names: Mastercard (MA), Travelers Companies (TRV) and Lazard (LAZ)",10/31/2023 11:10:07 AM
TRV,"US Stocks Sink, VIX Soars As Overheated Economy, Mixed Earnings Complicate Fed's Path: What's Driving Markets Thursday?",10/26/2023 7:23:50 PM
TRV,Analysts’ Opinions Are Mixed on These Financial Stocks: Travelers Companies (TRV) and Wintrust Financial (WTFC),10/19/2023 2:03:11 PM
TRV,"The Travelers Companies  Inc. Q3 Profit Decreases, misses estimates",10/18/2023 1:00:47 PM
TRV,What Wall Street expects from Travelers's earnings,10/17/2023 3:01:13 PM
TRV,Analyst Ratings for Travelers Companies,10/6/2023 11:00:29 PM
TRV,3 Insurance Stocks for Long-Term Dividend Growth,10/5/2023 8:18:11 PM
TRV,Hold Rating on Travelers Due to Transition in Personal Insurance Segment: A Mixed Outlook,10/4/2023 8:37:38 PM
TRV,Missed Out on NVDA and META? 3 More AI Stocks to Buy Before It’s Too Late,9/18/2023 4:51:00 PM
TRV,VinFast soars again and trades at a higher market cap than Walgreens or Goldman Sachs,8/24/2023 2:29:22 PM
TRV,Looking for a Bargain? 7 Blue-Chip Stocks to Buy That Are Down 5% in 2023,8/1/2023 11:10:35 AM
TRV,Play offense and defense with these barbell stock strategies - BMO,7/30/2023 7:43:05 PM
TRV,Disaster-prone areas are becoming a haven for those seeking cheaper homes - Redfin,7/29/2023 8:27:00 PM
TRV,Analysts’ Opinions Are Mixed on These Financial Stocks: Travelers Companies (TRV) and Prudential Financial (PRU),7/25/2023 12:30:29 PM
TRV,What 5 Analyst Ratings Have To Say About Travelers Companies,7/24/2023 10:00:48 PM
TRV,"Analysts Offer Insights on Financial Companies: Capital One Financial (COF), Fifth Third Bancorp (FITB) and Travelers Companies (TRV)",7/21/2023 11:10:43 AM
TRV,Travelers Companies Q2 Core Profit Declines; Net Written Premiums Up 14% ,7/20/2023 1:37:16 PM
TRV,The Travelers Companies Q2 2023 Earnings Preview,7/19/2023 4:38:04 PM
TRV,RBC Capital Reaffirms Their Hold Rating on Travelers Companies (TRV),7/15/2023 1:47:29 AM
TRV,"Catalyst Watch: Microsoft-Activision Blizzard drama, Splunk event and Nasdaq 100 rebalancing countdown",7/14/2023 7:00:24 PM
TRV,Bank Q2 earnings set to kick off with the bar set low as rates stay high,7/13/2023 7:36:00 PM
TRV,Barclays Keeps Their Hold Rating on Travelers Companies (TRV),7/12/2023 1:25:10 AM
TRV,RBC Capital Sticks to Its Hold Rating for Travelers Companies (TRV),7/11/2023 1:46:33 AM
TRV,What 6 Analyst Ratings Have To Say About Travelers Companies,7/6/2023 7:01:10 PM
TRV,"15 Stocks Up, 15 Stocks Down: A Look At The Dow Jones Industrial Average Halfway Through 2023",6/30/2023 6:06:43 PM
TRV,Where Travelers Companies Stands With Analysts,6/20/2023 10:00:34 PM
TRV,Budget Committee launches probe into insurers' climate risk assessment,6/9/2023 6:43:10 PM
TRV,7 Undervalued Stocks with Strong Buyback Programs,4/30/2023 7:00:41 PM
TRV,"Analysts Offer Insights on Financial Companies: Fifth Third Bancorp (FITB), Deutsche Bank AG (DB) and Travelers Companies (TRV)",4/24/2023 10:31:32 AM
TRV,"Analysts’ Opinions Are Mixed on These Financial Stocks: Discover Financial Services (DFS), Travelers Companies (TRV) and Citizens Financial (CFG)",4/20/2023 7:20:29 AM
TRV,"Analysts Conflicted on These Financial Names: Morgan Stanley (MS), Travelers Companies (TRV) and Synchrony Financial (SYF)",4/19/2023 11:40:15 PM
TRV,Travelers Q1 2023 Earnings Preview,4/18/2023 5:15:57 PM
TRV,Travelers Companies (TRV) Receives a Hold from Wells Fargo,4/5/2023 12:36:05 PM
TRV,What 6 Analyst Ratings Have To Say About Travelers Companies,3/31/2023 7:00:36 PM
TRV,Travelers Europe hires new CFO,1/26/2023 11:09:08 AM
TRV,Wells Fargo Maintains Equal-Weight Rating for Travelers Companies: Here's What You Need To Know,1/25/2023 6:00:38 PM
TRV,"Dow, S&P 500, Nasdaq finish mixed as earnings season picks up steam",1/24/2023 9:06:22 PM
TRV,The Travelers Companies Q4 2022 Earnings Preview,1/23/2023 5:18:14 PM
TRV,BMO Capital analyst gets selective in insurance stock picks,1/21/2023 9:33:00 PM
TRV,"Benzinga's Top Ratings Upgrades, Downgrades For January 20, 2023",1/20/2023 4:00:43 PM
TRV,Where Travelers Companies Stands With Analysts,1/19/2023 2:01:12 PM
TRV,"Wall Street ends mixed: Seventh straight win for Nasdaq; Dow, S&P 500 fall",1/17/2023 9:08:38 PM
TRV,"Nearly half of U.S. consumers shop for life insurance online, undermining agents",1/14/2023 7:49:00 PM
TRV,Travelers Companies (TRV) Receives a Rating Update from a Top Analyst,1/13/2023 1:56:56 AM
TRV,Barclays Keeps Their Hold Rating on Travelers Companies (TRV),1/11/2023 1:25:18 AM
TRV,"Benzinga's Top Ratings Upgrades, Downgrades For January 10, 2023",1/10/2023 4:01:12 PM
TRV,7 Must-Buy Dow Stocks for Your January Buy List,1/5/2023 6:12:12 PM
TRV,7 Stocks That Do Well When Rates Are Rising,12/21/2022 6:34:39 PM
TRV,Travelers Companies (TRV) Receives a Hold from Wells Fargo,12/15/2022 4:55:05 AM
TRV,What 7 Analyst Ratings Have To Say About Travelers Companies,11/22/2022 6:02:55 PM
TRV,7 Analysts Have This to Say About Travelers Companies,11/1/2022 8:20:21 PM
TRV,7 Dow Stocks to Sell Before They Tumble,10/25/2022 4:04:05 PM
TRV,"Allstate stock sinks after inflation, accident severity contribute to $875M charge",10/20/2022 1:32:34 PM
TRV,Amazon starts offering home insurance in U.K. with new online store,10/19/2022 2:56:40 PM
TRV,The Travelers Companies Q3 2022 Earnings Preview,10/18/2022 6:19:45 PM
TRV,What 6 Analyst Ratings Have To Say About Travelers Companies,10/14/2022 8:15:43 PM
TRV,The Short List Of Dow Jones Stocks That Are Actually Up This Year: Hint — It's Very Short,10/3/2022 11:56:59 PM
TRV,Travelers Companies (TRV) Receives a Hold from Wells Fargo,9/30/2022 9:35:08 PM
TRV,"P&C insurance, reinsurance stocks hold up after Hurricane Ian pummels Florida",9/29/2022 4:19:03 PM
TRV,7 Stocks to Buy Before They Crush Q3 Earnings,9/26/2022 11:29:08 AM
TRV,Google Cloud and Travelers to Create Connected Data Ecosystem to Enhance the Commercial Insurance Underwriting Process,9/22/2022 2:44:00 PM
TRV,Where Travelers Companies Stands With Analysts,8/19/2022 5:17:19 PM
TRV,7 Beaten-Down Dow Stocks to Buy Before They Rebound,8/8/2022 10:00:37 AM
TRV,Raymond James Believes Favorable Pricing Has Made Travelers Companies Stock Attractive To Investors,7/25/2022 8:44:48 PM
TRV,Expert Ratings for Travelers Companies,7/22/2022 5:23:16 PM
TRV,"The Travelers Companies  Inc. Q2 Profit Decreases, but beats estimates",7/21/2022 1:02:12 PM
TRV,The Travelers Companies Q2 2022 Earnings Preview,7/20/2022 5:46:58 PM
TRV,6 Dow Stocks to Buy on the Dip,7/13/2022 2:53:24 PM
TRV,"Only 8 Of The 30 Dow Jones Stocks Were Positive In The First Half Of 2022: Chevron Leads, But Who Else Was Up?",7/1/2022 10:45:50 PM
TRV,Where Travelers Companies Stands With Analysts,6/23/2022 9:15:26 PM
TRV,7 Seriously Undervalued Dow Stocks to Buy Before Wall Street Catches On,6/15/2022 10:46:27 AM
TRV,Wells Fargo unveils its recession stock portfolio,6/14/2022 1:57:38 PM
TRV,"Benzinga's Top Ratings Upgrades, Downgrades For June 3, 2022",6/3/2022 4:08:02 PM
TRV,"Benzinga's Top Ratings Upgrades, Downgrades For May 24, 2022",5/24/2022 4:04:33 PM
TRV,More boxes checked off in stock market bottom checklist,5/17/2022 11:00:29 AM
TRV,"Benzinga's Top Ratings Upgrades, Downgrades For April 20, 2022",4/20/2022 4:01:45 PM
TRV,"The Travelers Companies  Inc. Q1 Profit Increases, beats estimates",4/19/2022 1:01:36 PM
TRV,The Travelers Companies Q1 2022 Earnings Preview,4/18/2022 6:31:41 PM
TRV,U.S could face $2T loss each year by end of 21st century on climate change: White House,4/4/2022 9:14:24 PM
TRV,S&P Global expects Russia-Ukraine insurance losses to hit $35B - Reuters,3/31/2022 2:34:42 PM
TRV,Providence Hires New Chief Legal Officer,3/28/2022 11:00:00 PM
TRV,7 Technology Stocks Reporting Earnings the Week of January 31,1/28/2022 6:15:32 PM
TRV,Analyst Ratings For Travelers Companies,1/21/2022 6:03:03 PM
TRV,Travelers Ticking Up In Pre-market On Upbeat Quarterly Results ,1/20/2022 1:58:24 PM
TRV,Travelers Q4 2021 Earnings Preview,1/19/2022 6:21:38 PM
TRV,"Hurricane Ida, European floods made 2021 second costliest on record: Munich Re",1/10/2022 6:40:45 PM
TRV,"Asset managers, capital markets lead financial stocks 2021 rally",1/2/2022 3:03:00 PM
TRV,Credit servicers jump the most among financial stocks this week,12/24/2021 4:09:00 PM
TRV,The Travelers Companies goes ex-dividend tomorrow,12/8/2021 5:21:24 PM
TRV,"Benzinga's Top Ratings Upgrades, Downgrades For November 23, 2021",11/23/2021 4:09:30 PM
TRV,"Benzinga's Top Ratings Upgrades, Downgrades For November 19, 2021",11/19/2021 4:08:55 PM
TRV,Cardano Moved on Positive News But There Are Reasons to Worry,10/29/2021 6:29:45 PM
TRV,United Insurance estimates Q3 catastrophe losses to climb to $37M,10/22/2021 8:32:59 PM
TRV,The Travelers Companies  Inc. Q3 adjusted earnings Beat Estimates,10/19/2021 1:02:12 PM
TRV,Notable earnings before Tuesday's open,10/18/2021 2:58:07 PM
TRV,P&C insurer stocks slip in Q3 as Hurricane Ida takes its toll,10/3/2021 9:15:00 PM
TRV,7 Financial Stocks to Buy to Protect Yourself Against Rising Rates,9/2/2021 12:00:18 PM
TRV,What does Hurricane Ida mean for gas prices and the economy?,8/30/2021 8:04:15 AM
TRV,"Benzinga's Top Ratings Upgrades, Downgrades For August 17, 2021",8/17/2021 4:08:52 PM
TRV,"Travelers Casualty Insurance Co. of America -- Moody's announces completion of a periodic review of ratings of Travelers Companies, Inc. (The)",8/16/2021 9:04:00 PM
TRV,Home insurance co. Kin targets Q4 public debut after SPAC deal with Omnichannel Acquisition,8/15/2021 1:00:49 PM
TRV,7 of the Best Funds to Buy for Income and Growth,8/11/2021 4:22:56 PM
TRV,7 Cheap Value Stocks To Buy For August 2021,8/3/2021 5:01:31 PM
TRV,"Benzinga's Top Ratings Upgrades, Downgrades For July 22, 2021",7/22/2021 4:10:57 PM
TRV,Travelers Cos. Declares Qtly. Dividend Of $0.88 Per Share - Quick Facts ,7/20/2021 1:27:08 PM
TRV,Notable earnings before Tuesday's open,7/19/2021 1:36:49 PM
TRV,P&C insurers cushion from AY2020 should provide comfort in 2021:  Morgan Stanley,7/18/2021 9:33:47 PM
TRV,Travelers Reveals Minority Investment In Privately Owned Fidelis Insurance; Terms Not Disclosed ,7/14/2021 12:10:28 PM
TRV,"Benzinga's Top Ratings Upgrades, Downgrades For July 12, 2021",7/12/2021 4:03:00 PM
TRV,Allstate stands out in J.P. Morgan's preview of insurance earnings,7/1/2021 12:03:43 PM
TRV,"U.S. commercial insurance prices continue to rise, but at a slower pace",6/8/2021 3:55:14 PM
TRV,"Travelers Companies, Inc. (The) -- Moody’s rates Travelers' senior notes A2",6/4/2021 1:32:00 AM
TRV,"Pandemic, catastrophes hit P&C insurers in 2020, still underwriting gains rose",5/28/2021 9:27:36 PM
TRV,7 Blue-Chip Stocks Looking Better Than Ever,5/18/2021 3:54:59 PM
TRV,Stocks That Hit 52-Week Highs On Monday,5/10/2021 5:26:20 PM
TRV,Insurance Stocks Moving In Tuesday's Intraday Session,4/20/2021 6:43:10 PM
TRV,The Travelers Companies Q1 2021 Earnings Preview,4/19/2021 6:38:16 PM
TRV,Travelers is about to announce its earnings — here's what Wall Street expects,4/18/2021 3:01:24 PM
TRV,10 Biggest Price Target Changes For Wednesday,3/24/2021 1:40:08 PM
TRV,"As 52-week highs pile up, it may be time to get more bullish: Alpha Tactics",3/13/2021 8:17:23 PM
TRV,Auto insurers rise as CPI includes higher motor vehicle insurance prices M/M,3/10/2021 5:36:26 PM
TRV,"Life insurance stocks revive as vaccines roll out, P&C stocks not so much",2/21/2021 10:23:21 PM
TRV,Stock Alert: Travelers Hits New 52-week High As Q4 Profit Beats View ,1/21/2021 4:11:00 PM
TRV,Notable earnings before Thursday's open,1/20/2021 5:51:31 PM
TRV,"With Secondary Planned, Lemonade Stock Investors Could Get Squeezed",1/15/2021 10:11:51 AM
TRV,"J.P. Morgan's 2021 look at property/casualty insurance is upbeat, even if its picks' upside dimmed a bit",1/5/2021 12:30:45 AM
TRV,U.S. commercial insurance prices rise in Q3; insurers stocks garner returns,12/7/2020 10:21:36 PM
TRV,Travelers acquires InsuraMatch from Plymouth Rock Group,12/3/2020 2:18:10 PM
TRV,Barclays bullish on non-life insurance firms; names Chubb top pick,11/17/2020 3:39:54 PM
TRV,Will Root Insurance Revolutionize Auto Insurance or Burn Investors?,11/3/2020 8:54:01 PM
TRV,Wells Fargo sees positive backing for commercial insurers from Travelers print,10/21/2020 10:57:22 PM
TRV,Travelers is about to announce its earnings — here's what to expect,10/20/2020 3:01:35 PM
TRV,The Travelers Companies Q3 2020 Earnings Preview,10/19/2020 6:37:33 PM
TRV,JPMorgan calls out winners and losers in the P&C insurance sector,10/12/2020 12:18:20 PM
TRV,"American Equity Specialty Insurance Company -- Moody's announces completion of a periodic review of ratings of Travelers Companies, Inc. (The)",9/18/2020 7:44:00 PM
TRV,Is Lemonade Stock a Buy Over $50?,9/15/2020 12:09:44 PM
TRV,Travelers Announces Reimagined Service Model For Its Its Constitution State Services ,8/26/2020 3:13:35 PM
TRV,Be Ready to Buy a Pullback With Lemonade Stock,8/19/2020 12:00:38 PM
TRV,Lemonade Stock Is In for Turbulence. Buy Only If LMND Slides 30%,8/14/2020 4:29:33 PM
TRV,The Travelers Companies  Inc. Q2 adjusted earnings Inline With Estimates,7/23/2020 1:04:27 PM
TRV,Travelers earnings: here's what Wall Street expects,7/22/2020 3:01:36 PM
TRV,Travelers Companies Projects Core Loss In Q2 - Quick Facts ,7/14/2020 1:07:25 PM
TRV,3 of the Best Dividend Stocks to Buy Now,6/18/2020 1:11:06 PM
TRV,Financials continue to swoon as near zero rates will stick around,6/11/2020 5:06:46 PM
TRV,Lemonade files for IPO,6/8/2020 5:37:33 PM
TRV,Travelers extends auto insurance discount as customers drive less,5/29/2020 2:45:11 PM
TRV,Southwest Airlines adds routes catering to business travelers,5/28/2020 5:20:15 PM
TRV,Dow Jones Today: Another Round of Unemployment Data Dragged Stocks,5/21/2020 8:48:55 PM
TRV,U.S. travelers pick car rentals over flights for holidays: travel website Kayak,5/20/2020 9:45:46 PM
TRV,"Berkshire Slashes Stake In Goldman; Trims JPMorgan; Exits Phillips 66, Travelers ",5/16/2020 10:38:28 AM
TRV,Why the United States might not open up to international travelers any time soon,5/14/2020 6:30:02 PM
TRV,Dow Jones Today: Stocks Swoon as the Fed Rejects Negative Rates,5/13/2020 8:52:28 PM
TRV,Dow Jones Today: Jobless Claims Soar But Stocks Do Too,5/7/2020 8:42:45 PM
TRV,"Travelers Companies, Inc. (The) -- Moody’s rates Travelers' senior notes A2",4/24/2020 4:21:00 PM
TRV,"Travelers Companies, Inc. (The) -- Moody’s rates Travelers' senior notes A2",4/23/2020 10:57:00 PM
TRV,"Travelers Companies Q1 Profit Down, Misses View ",4/21/2020 1:38:46 PM
TRV,Here's what Wall Street expects from Travelers's earnings,4/20/2020 3:01:28 PM
TRV,Dow Jones Today: Lowered Fatality Forecasts Sent Stocks Higher,4/9/2020 8:39:37 PM
TRV,Dow Jones Today: Stocks Backflip as Unemployment Picture Darkens,4/2/2020 8:20:35 PM
TRV,Colombia to suspend entry for all travelers from abroad,3/19/2020 4:21:19 PM
TRV,Dow Jones Today: Another Wicked Wednesday as 7 Stocks Plunge 15% or More,3/18/2020 8:24:54 PM
TRV,Here's what the new U.S. restrictions on Europe mean for travelers,3/14/2020 1:06:18 AM
TRV,Factbox: Here's what the new U.S. restrictions on Europe mean for travelers,3/13/2020 9:59:18 PM
TRV,Travel curbs on European travelers to U.S. to hit airlines: trade body,3/12/2020 4:52:33 AM
TRV,"UPDATE 2-Coronavirus spurs U.S. to ramp up mask production, screen travelers after first death",3/1/2020 6:09:44 PM
TRV,Air Canada to let travelers rebook flights to northern Italy as coronavirus spreads,2/24/2020 10:46:27 PM
TRV,Dow Jones Today: When Bad News From Apple Isn’t All That Bad,2/18/2020 9:24:49 PM
TRV,Hyatt extends cancellation policy for Chinese travelers,2/1/2020 12:41:45 PM
TRV,Iraq’s Basra airport to deny entry to travelers from China and Chinese citizens over coronavirus: state news agency,1/31/2020 8:41:55 PM
TRV,"Dow Jones Today: Coronavirus in Focus, But Doesn’t Derail Stocks",1/23/2020 9:18:11 PM
TRV,"Dow Jones Today: More Records as Financials, Tech Lead the Way",1/16/2020 9:14:51 PM
TRV,Dow Jones Today: Stocks Pinched by Jobs Disappointment,1/10/2020 9:30:04 PM
TRV,Dow Jones Today: Middle East Calm Proves Meaningful for Stocks,1/9/2020 9:19:34 PM
TRV,A 2019 Review of Dow Jones Stocks (And What 2020 May Bring),1/6/2020 7:03:48 PM
TRV,"3 Big Stock Charts for Thursday: Tesla, Nutanix, and American International Group",12/12/2019 12:18:57 PM
TRV,American Equity Specialty Insurance Company -- Moody’s affirms Travelers’ ratings (A2 senior); outlook stable,11/1/2019 10:27:00 PM
TRV,"Canadian airlines plan for grounded Boeing jet to fly again, travelers still leery",10/29/2019 6:25:11 PM
TRV,5 Dow Jones Industrial Average Stocks to Sell,10/24/2019 5:57:02 PM
TRV,"3 Big Stock Charts for Wednesday: Starbucks, Nordstrom, and Salesforce",10/23/2019 11:18:09 AM
TRV,"Dow Jones Today: Somehow, Brexit Trumped Earnings",10/22/2019 8:41:13 PM
TRV,"St. Paul Fire and Marine Insurance Company -- Moody's announces completion of a periodic review of ratings of Travelers Companies, Inc. (The)",10/8/2019 10:22:00 PM
TRV,Dow Jones Today: Thank You Jobs Report,10/4/2019 8:09:21 PM
TRV,Factbox: Countries scramble after Thomas Cook collapse strands travelers,9/24/2019 2:06:32 PM
TRV,Dow Jones Today: The Return of Trade Optimism,8/26/2019 8:26:00 PM
TRV,Dow Jones Today: Sliding Bond Yields Lift Dividend Stocks,8/7/2019 8:12:27 PM
TRV,"3 Big Stock Charts for Tuesday: Hanesbrands, Tapestry and Travelers Companies",7/30/2019 1:01:49 PM
TRV,UPDATE 1-Travelers profit misses as higher claims weigh on underwriting gain,7/23/2019 1:30:34 PM
TRV,Here's what Wall Street expects from Travelers's earnings,7/21/2019 3:01:27 PM
TRV,"UPDATE 5-U.S. cruise operators stop sailing to Cuba, travelers vent anger online",6/6/2019 12:45:18 AM
TRV,"UPDATE 4-U.S. cruise operators stop sailing to Cuba, travelers vent anger online",6/5/2019 11:43:31 PM
TRV,Exclusive: Behind Airbnb's bet on show business to hook travelers,4/24/2019 12:07:31 PM
TRV,"UPDATE 2-Travelers profit tops on lower catastrophe losses, shares rise 4 pct",4/18/2019 5:30:57 PM
TRV,Here's what Wall Street expects from Travelers's earnings,4/16/2019 3:01:27 PM
TRV,"U.S. airlines face too many travelers, too few planes in 737 MAX summer dilemma",4/15/2019 9:17:24 PM
TRV,"Too many travelers, too few planes is U.S. airlines' 737 MAX summer dilemma",4/14/2019 5:54:22 PM
TRV,"Lenders and travelers stick with Ethiopian Airlines, for now",3/19/2019 3:25:05 PM
TRV,"Travelers Companies, Inc. (The) -- Moody’s rates Travelers' senior notes A2; outlook stable",2/27/2019 7:18:00 PM
TRV,UPDATE 3-Insurer Travelers beats fourth-quarter profit estimates,1/22/2019 6:15:58 PM
TRV,Travelers earnings preview: what to expect,1/21/2019 3:01:26 PM
TRV,UPDATE 2-Travelers braces for Hurricane Michael losses as 3rd-qtr profit doubles,10/18/2018 5:49:50 PM
TRV,Travelers earnings preview: what Wall Street is expecting,10/16/2018 3:01:25 PM
TRV,Travelers To Offer Smart Home Solutions On Amazon ,10/10/2018 5:25:36 PM
TRV,Adventure Time: First jobs of legendary travelers,9/5/2018 1:06:38 PM
TRV,United Airlines eyes business travelers as it boosts European flights in 2019,8/30/2018 1:11:20 PM
TRV,Insurer Travelers names Daniel Frey as chief financial officer,8/7/2018 11:28:08 PM
TRV,UPDATE 2-Insurer Travelers misses profit estimates on storm losses,7/19/2018 3:38:17 PM
TRV,Travelers earnings: here's what to expect,7/17/2018 3:01:30 PM
TRV,BRIEF-Travelers Names Abbe Goldstein Head Of Investor Relations,5/7/2018 3:01:34 PM
TRV,"UPDATE 3-Higher catastrophe losses hit Travelers profit, stock off 3 pct",4/24/2018 5:15:27 PM
TRV,BRIEF-Old Mutual Says Travelers Inc Withdraws All Remedies They Were Claiming,4/9/2018 8:19:00 AM
TRV,BRIEF-Travelers Companies Says CEO Alan Schnitzer's 2017 Total Compensation Was $15.2 Mln,4/6/2018 6:18:56 PM
TRV,"Travelers Companies, Inc. (The) -- Moody's rates Travelers' senior notes A2; outlook stable",2/28/2018 6:48:00 PM
TRV,The Travelers Companies  Inc. Announces 31% Retreat In Q4 Earnings,1/23/2018 1:01:40 PM
TRV,BRIEF-Travelers Appoints Nick Rnjak To Lead Lloyd’S Platform (TRV),12/21/2017 6:57:03 PM
TRV,BRIEF-Travelers Europe To Create European Subsidiary In Dublin In Response To Brexit (TRV),12/19/2017 3:37:04 PM
TRV,Travelers Companies President And COO Brian MacLean To Retire ,12/18/2017 2:26:50 PM
