Ticker,Title,Link
STER,Sterling Check (STER) Gets a Hold from Morgan Stanley,8/9/2024 1:54:24 PM
STER,"STER Stock Earnings: Sterling Check Misses EPS, Beats Revenue for Q2 2024",8/8/2024 5:55:28 PM
STER,"Sterling Check, First Advantage receive request from DOJ for more information",5/28/2024 9:10:42 PM
STER,"STER Stock Earnings: Sterling Check Misses EPS, Beats Revenue for Q1 2024",5/9/2024 5:55:42 PM
STER,Sterling Named HR Tech Award Winner for Fourth Consecutive Year,5/1/2024 10:05:00 PM
STER,"Catalyst Watch: Fed rates meeting, Nvidia CEO speaks at GTC 2024, Reddit IPO",3/15/2024 7:16:36 PM
STER,Sterling Check Corp Registered Shs hosts conference call for investors,3/6/2024 2:45:00 PM
STER,Here's what Wall Street expects from Sterling Check's earnings report,3/5/2024 3:01:13 PM
STER,"Plug Power surges to top industrial gainer of week, First Advantage sees loser tag",3/2/2024 5:35:09 PM
STER,Sterling Check Acquisition: A Balanced Hold Rating Amid Favorable Terms and Economic Uncertainty,3/1/2024 10:25:26 AM
STER,Why Butterfly Network Shares Are Trading Lower By 22%? Here Are Other Stocks Moving In Thursday's Mid-Day Session,2/29/2024 8:00:01 PM
STER,"Sterling to Report Fourth Quarter 2023 Earnings Results and Host Conference Call on March 6, 2024",2/2/2024 2:00:00 PM
STER,Analyst Scoreboard: 5 Ratings For Sterling Check,1/11/2024 8:00:51 PM
STER,Sterling to Offer Market Leading Clinical Solutions Through Acquisition of Vault Workforce Screening,1/2/2024 2:00:00 PM
STER,Sterling Appoints Jagtar Narula to its Board of Directors,12/14/2023 10:05:00 PM
STER,Sterling Launches Enhanced Capabilities in Asia Pacific Region,11/28/2023 2:51:26 PM
STER,Where Sterling Check Stands With Analysts,11/10/2023 6:00:31 PM
STER,Goldman Sachs Maintains Buy Rating for Sterling Check: Here's What You Need To Know,11/9/2023 6:00:24 PM
STER,Needham Keeps Their Hold Rating on Sterling Check (STER),11/8/2023 8:35:23 PM
STER,Here's what Wall Street expects from Sterling Check's earnings,11/7/2023 3:01:13 PM
STER,Sterling Honored as Best International Power Partner by Prestigious Inc. Awards,10/24/2023 2:00:00 PM
STER,"Sterling to Report Third Quarter 2023 Earnings Results and Host Conference Call on November 8, 2023",10/19/2023 10:15:00 PM
STER,7 Low-Volatility Stocks to Buy if You’re a Concerned Investor,10/11/2023 8:40:12 PM
STER,Sterling to Attend Upcoming Investor Conferences,9/8/2023 2:00:00 PM
STER,Robert W. Baird Sticks to Its Buy Rating for Sterling Check (STER),8/11/2023 4:25:25 PM
STER,Sterling Check (STER) Gets a Buy from Goldman Sachs,8/9/2023 5:25:11 AM
STER,"Fox, Warner Music, Eli Lilly, Chegg And Other Big Stocks Moving Higher On Tuesday",8/8/2023 4:35:25 PM
STER,Here's what to expect from Sterling Check's earnings report,8/7/2023 3:01:13 PM
STER,7 Small-Cap Stocks That Have Insiders Running for the Exit,6/26/2023 9:39:40 PM
STER,Why Couchbase Shares Are Trading Lower By Around 19%? Here Are Other Stocks Moving In Wednesday's Mid-Day Session,6/7/2023 8:02:22 PM
STER,Stifel Nicolaus Sticks to Their Buy Rating for Sterling Check (STER),5/30/2023 2:16:31 AM
STER,Stifel Nicolaus Keeps Their Buy Rating on Sterling Check (STER),5/25/2023 2:08:49 AM
STER,Sterling Check (STER) Gets a Buy from Stifel Nicolaus,5/17/2023 2:06:30 AM
STER,Analyst Expectations for Sterling Check's Future,5/10/2023 5:02:00 PM
STER,"Sterling Check Non-GAAP EPS of $0.24 beats by $0.02, revenue of $179.27M beats by $3.75M",5/9/2023 11:28:04 AM
STER,Analyst Ratings for Sterling Check,4/12/2023 9:00:25 PM
STER,10 Small-Cap Stocks to Sell Now,3/24/2023 8:31:49 PM
STER,Analysts Offer Insights on Technology Companies: CrowdStrike Holdings (CRWD) and Sterling Check (STER),3/6/2023 12:10:51 PM
STER,"Sterling Check Non-GAAP EPS of $0.21 misses by $0.05, revenue of $169.92M misses by $10.04M",3/2/2023 12:38:11 PM
STER,Here's what Wall Street expects from Sterling Check's earnings report,3/1/2023 3:01:13 PM
STER,"Benzinga's Top Ratings Upgrades, Downgrades For February 10, 2023",2/10/2023 4:00:48 PM
STER,"WWOOF, VERI and EOLS are among after hour movers",1/30/2023 10:44:35 PM
STER,Why Grom Social Enterprises Shares Are Trading Lower By 30%? Here Are Other Stocks Moving In Wednesday's Mid-Day Session,1/25/2023 7:39:48 PM
STER,"Analysts Offer Insights on Technology Companies: SciPlay (SCPL), DoorDash (DASH) and Sterling Check (STER)",1/19/2023 4:31:31 PM
STER,"Sterling acquires Socrates, an independent background screening company",1/4/2023 12:18:23 PM
STER,Why Apyx Medical Shares Dipped Over 60%; Here Are 123 Biggest Movers From Yesterday,11/11/2022 11:10:24 AM
STER,Where Sterling Check Stands With Analysts,11/10/2022 10:32:02 PM
STER,"Analysts Are Bullish on These Technology Stocks: Trade Desk (TTD), Sterling Check (STER)",11/9/2022 7:00:56 PM
STER,Sterling Partners with Yoti to Launch an Exclusive Portable Digital Identity Solution Internationally,11/8/2022 10:10:00 PM
STER,Why MediaAlpha Shares Jumped Around 30%; Here Are 112 Biggest Movers From Friday,11/7/2022 9:07:41 AM
STER,Why Yelp Shares Are Trading Lower By 15%? Here Are 86 Stocks Moving In Friday's Mid-Day Session,11/4/2022 5:54:47 PM
STER,Sterling Check (STER) Receives a Hold from Morgan Stanley,9/27/2022 4:35:44 PM
STER,"Benzinga's Top Ratings Upgrades, Downgrades For September 21, 2022",9/21/2022 4:04:10 PM
STER,Sterling Check (STER) Initiated with a Buy at Needham,9/20/2022 8:15:11 PM
STER,"Sterling to Report Third Quarter 2022 Earnings Results and Host Conference Call on November 9, 2022",9/16/2022 10:05:00 PM
STER,Sterling Reports Record Second Quarter 2022 Results,8/9/2022 1:00:00 PM
STER,"Sterling to Attend Upcoming Investor Conferences in New York City, Boston, and Chicago",6/3/2022 3:00:00 PM
STER,Expert Ratings for Sterling Check,5/16/2022 5:01:49 PM
STER,"Sterling to Report Second Quarter 2022 Earnings Results and Host Conference Call on August 9, 2022",5/11/2022 11:32:21 PM
STER,Sterling Reports Record First Quarter 2022 Results,5/10/2022 1:00:00 PM
STER,28 Biggest Movers From Yesterday,4/12/2022 12:15:38 PM
STER,"Benzinga's Top Ratings Upgrades, Downgrades For April 11, 2022",4/11/2022 4:07:09 PM
STER,Where Sterling Check Stands With Analysts,4/1/2022 6:03:55 PM
STER,"Sterling to Report First Quarter 2022 Earnings Results and Host Conference Call on May 10, 2022",3/24/2022 9:30:00 PM
STER,Where Sterling Check Stands With Analysts,3/16/2022 3:12:08 PM
STER,Sterling Reports Record Fourth Quarter and Full Year 2021 Results,3/2/2022 1:05:00 PM
STER,"Sterling to Report Fourth Quarter 2021 Earnings Results and Host Conference Call on March 2, 2022",2/1/2022 3:00:00 PM
STER,Expert Ratings For Sterling Check,1/5/2022 8:03:46 PM
STER," Sterling Expands through Acquisition of Employment Background Investigations, Inc.",12/1/2021 2:30:00 PM
STER,"Benzinga's Top Ratings Upgrades, Downgrades For November 23, 2021",11/23/2021 4:09:30 PM
STER,Sterling Streamlines Hiring Process with New Form I-9 and E-Verify Integration with iCIMS,11/19/2021 2:30:00 PM
STER,Expert Ratings For Sterling Check,11/11/2021 6:23:03 PM
STER,Sterling Reports Third Quarter 2021 Results,11/10/2021 1:00:00 PM
STER,Sterling Selected by FINRA as Fingerprint Services Provider,11/9/2021 3:00:00 PM
STER,"Sterling to Participate in the J.P. Morgan Ultimate Services Investor Conference on November 18, 2021",10/28/2021 1:00:00 PM
STER,Sterling Appoints Judah Sokel as Vice President of Investor Relations,10/25/2021 1:00:00 PM
STER,"Benzinga's Top Ratings Upgrades, Downgrades For October 18, 2021",10/18/2021 4:22:04 PM
STER,"Catalyst watch for next week: Apple event, Tesla earnings, WeWork SPAC and earnings rush",10/15/2021 7:00:55 PM
STER,"Sterling to Report Third Quarter 2021 Earnings Results and Host Conference Call on November 10, 2021",10/14/2021 3:00:00 PM
STER,Sterling Announces Closing of Initial Public Offering and Full Exercise of Underwriters’ Option to Purchase Additional Shares,9/27/2021 11:01:33 PM
STER,58 Biggest Movers From Yesterday,9/24/2021 11:11:19 AM
