Ticker,Title,Link
LMB,3 Industrial Stocks That May Thrive in an Economic Recovery,8/7/2024 7:10:17 PM
LMB,"Limbach GAAP EPS of $0.50 beats by $0.13, revenue of $122.2M misses by $0.45M",8/6/2024 8:14:06 PM
LMB,Limbach Q2 2024 Earnings Preview,8/5/2024 9:35:55 PM
LMB,"Analysts Offer Insights on Industrial Goods Companies: SPX (SPXC), Haynes International (HAYN) and Limbach Holdings (LMB)",8/2/2024 1:05:13 PM
LMB,3 Infrastructure Stocks to Buy in Preparation for Rate Cuts,7/26/2024 1:59:37 PM
LMB,Small-Cap Superstars: 3 Stocks Packing a Massive Punch for Your Portfolio,6/12/2024 8:42:28 PM
LMB,3 Small-Cap Stocks on Fire After CPI-Fueled Russell 2000 Rally,5/20/2024 12:50:00 PM
LMB,"LMB Stock Earnings: Limbach Holdings Beats EPS, Misses Revenue for Q1 2024",5/9/2024 12:54:39 AM
LMB,"Limbach GAAP EPS of $0.64 beats by $0.30, revenue of $118.98M misses by $3.27M",5/8/2024 8:14:45 PM
LMB,Notable earnings after Wednesday's close,5/7/2024 9:35:59 PM
LMB,The Top Manufacturing Stocks to Buy in April 2024,4/23/2024 8:30:00 PM
LMB,"Analysts Offer Insights on Industrial Goods Companies: Limbach Holdings (LMB), Quest Resource (QRHC) and VirTra (VTSI)",4/18/2024 1:00:41 PM
LMB,Cheat Sheet: Small Cap Stocks to Watch,4/4/2024 2:40:52 PM
LMB,Small-Cap Stocks: A New Dawn?,4/1/2024 3:40:19 PM
LMB,3 Stocks That Are Making Hedge Fund Managers Envious,3/23/2024 10:00:00 AM
LMB,Easy Money: 3 Stocks That Seem Borderline Unfair to Invest In.,3/18/2024 7:53:51 PM
LMB,Why Limbach Holdings Shares Are Trading Lower By Around 15%? Here Are Other Stocks Moving In Thursday's Mid-Day Session,3/14/2024 6:38:41 PM
LMB,"Limbach GAAP EPS of $0.44 beats by $0.04, revenue of $142.7M beats by $13.32M",3/13/2024 8:15:45 PM
LMB,Notable earnings after Wednesday's close,3/12/2024 9:35:31 PM
LMB,Lake Street Sticks to Its Buy Rating for Limbach Holdings (LMB),3/11/2024 12:55:44 PM
LMB,Millionaire’s Shortcut: 3 Stocks with Explosive Growth Potential,2/1/2024 10:11:00 AM
LMB,3 Small-Cap Stocks With Mega-Cap Potential for 2024 and Beyond,1/31/2024 3:42:27 PM
LMB,3 Small-Cap Stocks With Mega-Cap Potential for 2024 and Beyond,1/29/2024 9:00:00 PM
LMB,Millionaire-Makers: 3 Soaring Stocks to Transform Your Portfolio by 2026,1/8/2024 10:24:07 PM
LMB,Wise Investments: 3 Cheap Stocks With Great Growth Potential,11/29/2023 3:42:39 AM
LMB,3 Infrastructure Stocks to Buy as They Build the Future,11/23/2023 6:44:37 PM
LMB,What Wall Street expects from Limbach's earnings,11/7/2023 3:01:13 PM
LMB,The 7 Most Promising Momentum Stocks to Own Now,8/31/2023 12:30:53 PM
LMB,Why Nordstrom Are Trading Lower By Around 10%? Here Are Other Stocks Moving In Friday's Mid-Day Session,8/25/2023 7:32:59 PM
LMB,YELL and GOL among industrial movers,8/10/2023 5:33:21 PM
LMB,"Limbach GAAP EPS of $0.46, revenue of $124.9M; increases FY guidance",8/9/2023 8:31:02 PM
LMB,EF Hutton Maintains Buy Rating for Limbach Holdings: Here's What You Need To Know,5/10/2023 7:00:48 PM
LMB,"Limbach reports Q1 results, reaffirms FY 2023 revenue guidance",5/8/2023 8:42:26 PM
LMB,Notable earnings after Monday's close,5/7/2023 9:35:00 PM
LMB,"MVST, ENVX and GWH among Industrial movers",3/13/2023 5:04:43 PM
LMB,Limbach Holdings (LMB) Receives a Buy from EF Hutton,3/10/2023 4:25:17 PM
LMB,"Limbach GAAP EPS beats by $0.03, revenue misses by $10.51M, guidance below consensus",3/8/2023 9:17:52 PM
LMB,Limbach Q4 2022 Earnings Preview,3/7/2023 10:35:34 PM
LMB,Limbach Says COO Michael McCann To Replace Charlie Bacon As CEO ,1/17/2023 2:09:41 PM
LMB,Why Apyx Medical Shares Dipped Over 60%; Here Are 123 Biggest Movers From Yesterday,11/11/2022 11:10:24 AM
LMB,Why Magnite Shares Are Trading Higher By Over 45%? Here Are 69 Stocks Moving In Thursday's Mid-Day Session,11/10/2022 7:05:52 PM
LMB,"Limbach GAAP EPS of $0.34 beats by $0.15, revenue of $122.36M misses by $7.63M",11/9/2022 9:38:58 PM
LMB,Limbach Q3 2022 Earnings Preview,11/8/2022 10:35:27 PM
LMB,"FREY, VIEW and LMB among industrial movers",10/18/2022 4:52:53 PM
LMB,"EOSE, HYRE among top industrial movers",8/22/2022 5:07:36 PM
LMB,"Limbach Q2 GAAP EPS up Y/Y, revenue down, FY22 guidance reconfirmed",8/9/2022 8:27:36 PM
LMB,Notable earnings after Tuesday's close,8/8/2022 9:35:42 PM
LMB,"MNTS, LMB, VLRS among top industrial movers",6/1/2022 4:55:12 PM
LMB,"Limbach GAAP EPS of -$0.15 misses by $0.12, revenue of $114.83M beats by $0.46M",5/10/2022 8:17:28 PM
LMB,Limbach Q1 2022 Earnings Preview,5/9/2022 9:44:39 PM
LMB,"Limbach GAAP EPS of $0.41 beats by $0.01, revenue of $126.8M misses by $1.77M",3/16/2022 8:23:51 PM
LMB,Notable earnings after Wednesday's close,3/15/2022 9:35:28 PM
LMB,58 Biggest Movers From Friday,12/6/2021 10:33:07 AM
LMB,"Limbach acquires specialty mechanical contractor, Jake Marshall in all-cash transaction",12/3/2021 12:28:35 PM
LMB,"Benzinga's Top Ratings Upgrades, Downgrades For November 22, 2021",11/22/2021 4:06:08 PM
LMB,"Limbach EPS beats by $0.08, beats on revenue",11/10/2021 9:20:59 PM
LMB,Notable earnings after Wednesday's close,11/9/2021 10:35:53 PM
LMB,BEST and BWEN among industrial movers,10/6/2021 4:26:19 PM
LMB,"SFL, EH among industrial movers",8/19/2021 5:56:30 PM
LMB,78 Biggest Movers From Friday,8/16/2021 11:12:54 AM
LMB,Limbach Holdings falls 10% after lowering guidance range,8/13/2021 6:11:04 PM
LMB,Limbach earnings preview: what to expect,8/10/2021 3:02:10 PM
LMB,74 Biggest Movers From Friday,5/17/2021 11:21:26 AM
LMB,54 Stocks Moving In Friday's Mid-Day Session,5/14/2021 6:02:23 PM
LMB,Limbach is about to announce its earnings — here's what to expect,5/12/2021 3:03:01 PM
LMB,Fly Leasing leads industrial gainers; Nordic American Tankers and Bloom Energy among losers,3/29/2021 5:01:29 PM
LMB,"Limbach EPS beats by $0.06, beats on revenue",3/25/2021 8:40:07 PM
LMB,Here's what to expect from Limbach's earnings,3/23/2021 3:01:27 PM
LMB,7 of the Best Swing Trade Stocks Available Right Now,2/18/2021 4:07:19 PM
LMB,94 Biggest Movers From Yesterday,2/11/2021 10:04:36 AM
LMB,70 Stocks Moving In Wednesday's Mid-Day Session,2/10/2021 7:06:18 PM
LMB,Stocks That Hit 52-Week Highs On Tuesday,12/22/2020 4:30:53 PM
LMB,FuelCell Energy leads industrial gainers; PaySign and Lightbridge among losers,11/18/2020 6:04:36 PM
LMB,"Limbach EPS beats by $0.22, beats on revenue",11/12/2020 12:43:33 PM
LMB,"Limbach Holdings, Inc. to Present at the LD 500 Virtual Conference",8/27/2020 4:00:00 PM
LMB,Limbach earnings preview: what to expect,8/12/2020 3:02:46 PM
LMB,"Limbach EPS beats by $0.13, beats on revenue",6/15/2020 9:20:16 PM
LMB,Limbach earnings: here's what Wall Street expects,6/14/2020 3:01:16 PM
LMB,Spirit AeroSystems among industrial gainers: Allegheny Technologies among losers,3/23/2020 5:04:24 PM
LMB,Alpha Pro Tech and Titan International among Industrial gainers; TriMas and Limbach among losers,2/27/2020 6:11:47 PM
LMB,Here's what Wall Street expects from Limbach's earnings report,8/12/2019 3:02:37 PM
LMB,Here's what Wall Street expects from Limbach's earnings,5/13/2019 3:02:36 PM
LMB,What Wall Street expects from Limbach's earnings,4/13/2019 3:01:17 PM
LMB,What Wall Street expects from Limbach's earnings,11/17/2018 3:01:16 PM
LMB,What Wall Street expects from Limbach's earnings,8/12/2018 3:02:01 PM
LMB,BRIEF-Limbach Holdings Announces Appointment Of Laurel Krzeminski To The Co's Board,4/30/2018 3:18:56 PM
