Ticker,Title,Link
OFIX,JMP Securities Keeps Their Hold Rating on Orthofix (OFIX),8/7/2024 4:38:42 AM
OFIX,"OFIX Stock Earnings: Orthofix Medical Beats EPS, Beats Revenue for Q2 2024",8/6/2024 3:54:44 PM
OFIX,Orthofix Q2 2024 Earnings Preview,8/5/2024 4:04:57 PM
OFIX,JMP Securities Reaffirms Their Hold Rating on Orthofix (OFIX),5/17/2024 9:05:40 PM
OFIX,Orthofix gets FDA clearance for Rodeo Telescopic Nail,5/9/2024 5:50:32 PM
OFIX,"Roth MKM ups Orthofix to buy, cites improving fundamentals",5/8/2024 4:50:09 PM
OFIX,"OFIX Stock Earnings: Orthofix Medical Meets EPS, Beats Revenue for Q1 2024",5/7/2024 5:53:36 PM
OFIX,Notable earnings before Tuesday's open,5/6/2024 3:08:27 PM
OFIX,Orthofix (OFIX) Gets a Hold from JMP Securities,4/19/2024 8:45:42 PM
OFIX,Stifel Nicolaus Remains a Hold on Orthofix (OFIX),3/6/2024 12:36:39 PM
OFIX,"Orthofix GAAP EPS of -$0.59 misses by $0.10, revenue of $200.4M beats by $4.83M",3/5/2024 9:22:01 PM
OFIX,Orthofix Q4 2023 Earnings Preview,3/4/2024 10:35:26 PM
OFIX,"Needham sees orthopedics market slowing; favors Enovis, Paragon 28",2/25/2024 11:50:34 PM
OFIX,"Acuity Brands Posts Upbeat Earnings, Joins Accolade, Urban Outfitters And Other Big Stocks Moving Higher On Tuesday",1/9/2024 4:59:04 PM
OFIX,Orthofix (OFIX) Receives a Hold from BTIG,1/7/2024 10:42:54 AM
OFIX,Orthofix (OFIX) Receives a Hold from BTIG,1/2/2024 2:41:50 PM
OFIX,BTIG Sticks to Its Hold Rating for Orthofix (OFIX),12/31/2023 10:21:50 AM
OFIX,"Alaska Air, Orthofix Medical And Other Big Stocks Moving Lower In Monday's Pre-Market Session",12/4/2023 11:20:12 AM
OFIX,"Uber Technologies, Jabil and Builders FirstSource Set to Join S&P 500; Others to Join S&P MidCap 400 and S&P SmallCap 600",12/2/2023 12:16:00 AM
OFIX,Orthofix Medical: Hold Rating Affirmed Amid Leadership Changes and Integration Challenges,12/1/2023 7:45:35 PM
OFIX,Orthofix (OFIX) Gets a Hold from BTIG,11/28/2023 2:06:33 PM
OFIX,"Analysts Offer Insights on Healthcare Companies: Keros Therapeutics (KROS), Orthofix (OFIX) and Amicus (FOLD)",11/9/2023 2:50:37 AM
OFIX,What Wall Street expects from Orthofix Medical's earnings,11/7/2023 3:01:13 PM
OFIX,Orthofix Medical Announces Launch Of WaveForm L Lateral Lumbar Interbody System - Quick Facts ,11/6/2023 1:37:54 PM
OFIX,"Benzinga's Top Ratings Upgrades, Downgrades For October 20, 2023",10/20/2023 5:00:53 PM
OFIX,"OFIX LOSS ALERT: ROSEN, NATIONAL TRIAL LAWYERS, Encourages Orthofix Medical Inc. Investors to Inquire About Securities Class Action Investigation - OFIX",10/7/2023 7:00:00 PM
OFIX,"ROSEN, TRUSTED INVESTOR COUNSEL, Encourages Orthofix Medical Inc. Investors to Inquire About Securities Class Action Investigation - OFIX",9/27/2023 10:37:00 PM
OFIX,Why CS Disco Are Trading Lower By 22%? Here Are Other Stocks Moving In Tuesday's Mid-Day Session,9/12/2023 7:45:09 PM
OFIX,JMP Securities Remains a Hold on Orthofix (OFIX),8/30/2023 4:35:07 PM
OFIX,Why Cutera Shares Are Trading Lower By Around 22%? Here Are Other Stocks Moving In Wednesday's Session,8/9/2023 9:17:48 PM
OFIX,"Orthofix GAAP EPS of -$1.07 misses by $0.35, revenue of $187M beats by $2.13M",8/8/2023 8:46:40 PM
OFIX,Catherine Burzik named chair of Orthofix Medical's board,6/20/2023 8:09:33 PM
OFIX,JMP Securities Sticks to Their Hold Rating for Orthofix (OFIX),5/24/2023 6:55:06 PM
OFIX,"Orthofix Non-GAAP EPS of -$0.10 beats by $0.10, revenue of $175.2M beats by $6.74M",5/9/2023 8:49:11 PM
OFIX,Orthofix (OFIX) Receives a Hold from JMP Securities,5/3/2023 4:25:15 AM
OFIX,"Analysts Offer Insights on Healthcare Companies: Orthofix (OFIX), Precigen (PGEN) and Cara Therapeutics (CARA)",3/7/2023 12:10:36 PM
OFIX,"Orthofix Non-GAAP EPS of $0.19 misses by $0.15, revenue of $122.23M in-line",3/6/2023 9:24:10 PM
OFIX,Orthofix Q4 2022 Earnings Preview,3/5/2023 10:35:00 PM
OFIX,NuVasive could see higher bid given valuation for Globus Medical deal - analyst,2/9/2023 8:58:07 PM
OFIX,"Orthofix holders should vote in favor of merger with SeaSpine, ISS says",12/23/2022 4:32:47 PM
OFIX,"SHAREHOLDER INVESTIGATION: Halper Sadeh LLC Investigates PFS, LBAI, OFIX, IMRA",12/15/2022 2:08:00 PM
OFIX,"SHAREHOLDER INVESTIGATION: Halper Sadeh LLC Investigates OFIX, KNBE, IMRA, LFG",11/15/2022 4:55:00 PM
OFIX,"SHAREHOLDER INVESTIGATION: Halper Sadeh LLC Investigates OFIX, AAWW, AVEO, MYOV",11/10/2022 4:35:00 PM
OFIX,Analysts Conflicted on These Healthcare Names: Orthofix (OFIX) and Immunovant (IMVT),11/4/2022 8:40:29 PM
OFIX,"Orthofix Non-GAAP EPS of $0.13 beats by $0.01, revenue of $114M beats by $12.77M",11/3/2022 11:23:33 AM
OFIX,Orthofix Medical earnings preview: what to expect,11/2/2022 3:01:13 PM
OFIX,"SHAREHOLDER INVESTIGATION: Halper Sadeh LLC Investigates FORG, AYLA, SPNE, OFIX",10/28/2022 5:15:00 PM
OFIX,"SHAREHOLDER INVESTIGATION: Halper Sadeh LLC Investigates ECOM, FORG, SPNE, OFIX",10/19/2022 5:08:00 AM
OFIX,"PTCT, PAYO AND  STKL  are among after hour movers",10/18/2022 9:25:09 PM
OFIX,"Uber, Lyft, AZZ And Other Big Losers From Tuesday",10/12/2022 10:46:16 AM
OFIX,Nasdaq Drops 150 Points; AZZ Shares Plummet,10/11/2022 9:19:40 PM
OFIX,"Orthofix Non-GAAP EPS of $0.08 misses by $0.02, revenue of $118.1M misses by $0.15M",8/5/2022 11:16:13 AM
OFIX,Orthofix inks licensing deal with CGBio for bone graft product Novosis,8/2/2022 12:04:32 PM
OFIX,"Orthofix GAAP EPS of -$0.22 misses by $0.12, revenue of $106.4M beats by $1.93M",5/6/2022 11:10:38 AM
OFIX,What Wall Street expects from Orthofix Medical's earnings,5/5/2022 3:01:13 PM
OFIX,Orthofix wins FDA clearance for TrueLok EVO to address bone issues,3/16/2022 3:28:10 PM
OFIX,Orthofix Medical upgraded at Stifel on growth trajectory and margin expansion,3/4/2022 7:09:16 PM
OFIX,"Orthofix Non-GAAP EPS of $0.27 beats by $0.10, revenue of $125.06M beats by $0.23M",2/25/2022 12:06:51 PM
OFIX,Orthofix Medical earnings: here's what Wall Street expects,2/24/2022 3:01:13 PM
OFIX,Orthofix Medical up 4% as revenue sits above market consensus: Q4 Prelim,1/10/2022 4:08:09 PM
OFIX,"The Daily Biotech Pulse: NRx's Zyesami Face Regulatory Rejection, Puma Slumps On Q3 Miss, Pfizer Has Good Tidings On Oral Antiviral COVID-19 Pill",11/5/2021 1:22:48 PM
OFIX,Orthofix Medical earnings: here's what Wall Street expects,11/4/2021 3:01:13 PM
OFIX,Orthofix Expects Low-single Digit Revenue Growth In Q3 ,9/29/2021 2:25:24 PM
OFIX,Orthofix Stock Ticks Up On Street-Beating Q2 Earnings; Raises FY21 Outlook,8/6/2021 9:30:05 PM
OFIX,Orthofix Medical earnings: here's what Wall Street expects,8/4/2021 3:02:34 PM
OFIX,"The Week Ahead In Biotech (Aug. 1-7): Biopharma Earnings Pick Up Pace, Eton Awaits FDA Decision, Focus On Pending Clinical Readouts and IPOs",8/1/2021 4:13:48 PM
OFIX,Orthofix launches OSCAR PRO in U.S. and Europe,5/17/2021 1:41:24 PM
OFIX,"MedTech Round Up: Update On Products By Conformis, Medtronic, Orthofix, Neovasc",5/10/2021 7:35:36 PM
OFIX,"The Daily Biotech Pulse: Hyperphosphatemia Drug Regulatory Review Extended, Phathom Pharma Data Readout, 2 IPOs",4/30/2021 1:31:19 PM
OFIX,"The Daily Biotech Pulse: KemPharm Receives $10M Milestone Payment, Zymergen, Neuropace Debut On Nasdaq, Renalytix Wins US Government Contract, 2 IPOs",4/22/2021 2:08:59 PM
OFIX,3 3D Stocks That Can Advance the World of Healthcare,4/13/2021 2:40:07 PM
OFIX,Orthofix to nominate industry veteran as new chiarman,4/7/2021 4:09:47 PM
OFIX,Orthofix wins FDA clearance for an implant used to treat spinal disc issues,4/5/2021 5:21:08 PM
OFIX,"Orthofix EPS beats by $0.51, beats on revenue",2/26/2021 12:03:37 PM
OFIX,"The Daily Biotech Pulse: Merck Goes Shopping, Decision Day For Sarepta, Pfizer, Moderna Unveil Vaccine Strategies For Coronavirus Variants",2/25/2021 2:08:03 PM
OFIX,Orthofix Medical earnings preview: what to expect,2/24/2021 3:01:45 PM
OFIX,"The Daily Biotech Pulse: Aridis To Study Antibody Cocktail For Coronavirus Variants, Revance & Protalix Data Readouts",2/23/2021 1:25:48 PM
OFIX,"The Week Ahead In Biotech: J&J Vaccine Adcom Meeting, Sarepta FDA Decision And Plenty Of Earnings",2/20/2021 3:36:28 PM
OFIX,"Orthofix's M6-C artificial cervical disc shows improvements in neck, arm pain and function",1/28/2021 1:00:58 PM
OFIX,Orthofix reports Q4 prelim sales sequential growth of 6%,1/12/2021 12:54:24 PM
OFIX,Spinal Elements to issue 7.7M shares in IPO at $13-$15 per share,10/8/2020 11:28:38 AM
OFIX,Orthofix Medical launches graft delivery system,10/7/2020 6:20:08 PM
OFIX,Here's what Wall Street expects from Orthofix Medical's earnings report,8/5/2020 3:04:13 PM
OFIX,"Orthofix EPS beats by $0.03, beats on revenue",5/8/2020 10:01:27 AM
OFIX,Here's what Wall Street expects from Orthofix Medical's earnings report,5/7/2020 3:02:03 PM
OFIX,"Orthofix reports preliminary Q1 revenues, withdraws FY20 guidance",4/9/2020 1:28:15 PM
OFIX,Mallinckrodt among healthcare gainers; Tocagen and Clovis Oncology among losers,2/25/2020 4:03:38 PM
OFIX,Here's what Wall Street expects from Orthofix Medical's earnings,2/23/2020 3:01:24 PM
OFIX,FDA OKs new version of Orthofix app for bone growth stimulators,2/13/2020 12:58:53 PM
OFIX,"AZN's POSEIDON Has Poise, MRTX On The Move, MOR Drops Atopic Dermatitis Trial ",10/29/2019 8:54:45 AM
