Ticker,Title,Link
MCFT,MasterCraft’s Strategic Prudence Amidst Economic Challenges: A Buy Rating by Craig Kennison,9/2/2024 6:31:46 AM
MCFT,"Analysts Are Bullish on Top Consumer Cyclical Stocks: Lululemon Athletica (LULU), MasterCraft Boat Holdings (MCFT)",8/30/2024 11:40:32 AM
MCFT,MasterCraft Boat sees FQ4 profits evaporate as sales sink 60%,8/29/2024 2:55:35 PM
MCFT,Here's the major earnings before the open tomorrow,8/28/2024 10:00:00 PM
MCFT,Powell put drives up interest rate-sensitive stocks,8/23/2024 5:48:51 PM
MCFT,"MasterCraft Boat Holdings, Inc. to Webcast Fiscal Fourth Quarter and Full Year 2024 Earnings Conference Call Thursday, August 29, 2024",8/15/2024 3:15:00 PM
MCFT,"Analysts Offer Insights on Consumer Cyclical Companies: Sealed Air (SEE), MasterCraft Boat Holdings (MCFT) and Penn National Gaming (PENN)",8/9/2024 12:31:00 PM
MCFT,"MasterCraft Boat Holdings, Inc. Enters into Asset Exchange Agreement with MarineMax for Aviara Brand",8/8/2024 10:10:00 PM
MCFT,Boating stocks soar after MarineMax leads off the earnings season with better-than-expected results,7/25/2024 3:49:25 PM
MCFT,The Analyst Landscape: 4 Takes On MasterCraft Boat Hldgs,7/10/2024 8:00:14 PM
MCFT,Vistra and MasterCraft Boat Have Been Highlighted as Zacks Bull and Bear of the Day,7/1/2024 6:58:38 PM
MCFT,3 Stocks at 52-Week Lows with Insider Buying,6/28/2024 10:07:00 AM
MCFT,The Under-the-Radar All-Stars: 3 Stocks Quietly Crushing the Competition,5/29/2024 6:04:34 PM
MCFT,Stifel Nicolaus Sticks to Their Buy Rating for MasterCraft Boat Holdings (MCFT),5/13/2024 2:08:04 AM
MCFT,MasterCraft Boat Holdings: Navigating Industry Challenges with Resilience and Strategic Innovation,5/10/2024 5:42:37 AM
MCFT,D.A. Davidson Reaffirms Their Hold Rating on MasterCraft Boat Holdings (MCFT),5/9/2024 12:58:22 PM
MCFT,"MCFT Stock Earnings: MasterCraft Boat Hldgs Beats EPS, Beats Revenue for Q3 2024",5/8/2024 4:54:59 PM
MCFT,MCBC earnings: here's what Wall Street expects,5/7/2024 3:01:13 PM
MCFT,Boating stocks slump after MarineMax warns of high promotional activity in the sector,4/25/2024 2:10:12 PM
MCFT,Crest Marine Expands Portfolio with the Launch of Balise Pontoon Boats,4/23/2024 10:05:10 PM
MCFT,"Analysts Are Bullish on Top Consumer Cyclical Stocks: Wingstop (WING), MasterCraft Boat Holdings (MCFT)",4/22/2024 5:51:27 AM
MCFT,"MasterCraft Boat Holdings, Inc. to Webcast Fiscal Third Quarter 2024 Earnings Conference Call Wednesday, May 8, 2024",4/19/2024 4:04:16 PM
MCFT,Over $1M Bet On This Consumer Cyclical Stock? Check Out These 3 Stocks Insiders Are Buying,4/15/2024 12:19:58 PM
MCFT,"MasterCraft Boat Holdings, Inc. Initiates Leadership Succession Plan",3/4/2024 2:30:00 PM
MCFT,MasterCraft to Participate in Raymond James 45th Annual Institutional Investors Conference,2/29/2024 3:51:54 PM
MCFT,Small cap value stocks with potential M&A candidacy - BofA,2/16/2024 4:10:43 PM
MCFT,"Analysts’ Opinions Are Mixed on These Consumer Cyclical Stocks: MasterCraft Boat Holdings (MCFT), The Chefs’ Warehouse (CHEF) and Jerash Holdings (US) (JRSH)",2/9/2024 1:30:39 PM
MCFT,Analysts Offer Insights on Consumer Cyclical Companies: Container Store Group (TCS) and MasterCraft Boat Holdings (MCFT),2/7/2024 4:50:12 PM
MCFT,MasterCraft Boat Q2 2024 Earnings Preview,2/6/2024 5:03:48 PM
MCFT,"MasterCraft Boat Holdings, Inc. to Webcast Fiscal Second Quarter 2024 Earnings Conference Call Wednesday, February 7, 2024",1/22/2024 11:47:30 PM
MCFT,Demystifying MasterCraft Boat Hldgs: Insights From 4 Analyst Reviews,1/9/2024 10:01:07 PM
MCFT,Wall Street Analysts Are Bullish on Top NA Picks,11/15/2023 2:10:06 AM
MCFT,KeyBanc Remains a Hold on MasterCraft Boat Holdings (MCFT),11/13/2023 10:25:22 AM
MCFT,Assessing MasterCraft Boat Holdings’ Performance and Future Outlook: A Balanced Analyst Perspective,11/9/2023 5:55:10 PM
MCFT,"MasterCraft Boat Holdings, Inc. Reports Results for Fiscal 2024 First Quarter",11/8/2023 1:30:32 PM
MCFT,Here's what Wall Street expects from MCBC's earnings report,11/7/2023 3:01:13 PM
MCFT,"MasterCraft Boat Holdings, Inc. to Webcast Fiscal First Quarter 2024 Earnings Conference Call Wednesday, November 8, 2023",10/25/2023 9:10:51 PM
MCFT,Analyst Ratings for MasterCraft Boat Hldgs,10/17/2023 8:00:53 PM
MCFT,More Than $7M Bet On Howard Hughes? Check Out These 3 Stocks Insiders Are Buying,9/29/2023 12:53:20 PM
MCFT,"MasterCraft Boat Holdings, Inc. Issues 2023 Sustainability Report",9/13/2023 3:05:12 PM
MCFT,This Analyst With 83% Accuracy Rate Sees Around 17% Upside In Hewlett Packard Enterprise - Here Are 5 Stock Picks For Last Week From Wall Street's Most Accurate Analysts,9/5/2023 12:54:47 PM
MCFT,This Analyst With 83% Accuracy Rate Sees More Than 7% Upside In Alphabet - Here Are 5 Stock Picks For August From Wall Street's Most Accurate Analysts,9/1/2023 12:58:31 PM
MCFT,5 Analysts Have This to Say About MasterCraft Boat Hldgs,8/31/2023 5:00:54 PM
MCFT,Why REX American Resources Are Trading Lower By 9%? Here Are Other Stocks Moving In Wednesday's Mid-Day Session,8/30/2023 7:17:52 PM
MCFT,MasterCraft Boat Q4 2023 Earnings Preview,8/29/2023 5:09:58 PM
MCFT,"MasterCraft Boat Holdings, Inc. to Webcast Fiscal Fourth Quarter and Full Year 2023 Earnings Conference Call Wednesday, August 30, 2023",8/16/2023 11:22:49 PM
MCFT,3 Stocks to Buy for This Tough-as-Nails Market,8/10/2023 10:07:52 AM
MCFT,Truist Financial Keeps Their Hold Rating on MasterCraft Boat Holdings (MCFT),7/17/2023 2:25:52 AM
MCFT,The 3 Best Consumer Cyclical Stocks to Buy Now,6/26/2023 8:38:24 PM
MCFT,"Benzinga's Top Ratings Upgrades, Downgrades For May 31, 2023",5/31/2023 5:00:48 PM
MCFT,This Analyst With 90% Accuracy Rate  Sees Around 134% Upside In LanzaTech Global - Here Are 5 Stock Picks For Last Week From Wall Street's Most Accurate Analysts,5/15/2023 2:07:58 PM
MCFT,"Analysts Offer Insights on Consumer Goods Companies: MasterCraft Boat Holdings (MCFT), Traeger (COOK) and Darling Ingredients (DAR)",5/11/2023 4:10:29 PM
MCFT,MasterCraft Boat stock sails higher on signal of resilient sales momentum,5/10/2023 12:33:15 PM
MCFT,MasterCraft Boat Q3 2023 Earnings Preview,5/9/2023 5:18:58 PM
MCFT,"Earnings Week Ahead: Fox Corporation, Disney, Airbnb, and more",5/5/2023 6:00:36 PM
MCFT,7 Small-Cap Stocks with Huge Growth Potential,5/4/2023 10:15:09 PM
MCFT,7 Value Stocks Worth Buying at These 52-Week Highs,3/22/2023 7:46:16 PM
MCFT,Analysts’ Opinions Are Mixed on These Consumer Goods Stocks: Coty (COTY) and MasterCraft Boat Holdings (MCFT),2/9/2023 12:04:12 PM
MCFT,What's Going On With MasterCraft Shares Today?,2/8/2023 8:48:53 PM
MCFT,MasterCraft Boat Q2 2023 Earnings Preview,2/7/2023 6:44:41 PM
MCFT,MarineMax stock sinks on softened guidance,1/26/2023 2:12:53 PM
MCFT,Robert W. Baird Keeps Their Buy Rating on MasterCraft Boat Holdings (MCFT),1/20/2023 3:55:20 AM
MCFT,"'$5 Is Where It Should Be, And No Higher': Cramer On This Stock Down 80% Year-To-Date",12/22/2022 2:50:48 PM
MCFT,Analysts Offer Insights on Consumer Goods Companies: Capri Holdings (CPRI) and MasterCraft Boat Holdings (MCFT),11/14/2022 4:02:13 AM
MCFT,5 Analysts Have This to Say About MasterCraft Boat Hldgs,11/10/2022 5:59:24 PM
MCFT,"MasterCraft Boat Holdings, Inc. Reports Record Results for Fiscal 2023 First Quarter",11/9/2022 1:30:55 PM
MCFT,MasterCraft Boat Q1 2023 Earnings Preview,11/8/2022 5:40:05 PM
MCFT,"Earnings week ahead: Disney, Lyft, Rivian, Palantir and more",11/4/2022 6:03:08 PM
MCFT,"MasterCraft Delivers More Connectivity, Convenience and Comfort to Entry-Level Lineup with All-New NXT21 & NXT23",11/2/2022 4:00:00 PM
MCFT,The 3 Catalysts Driving a Surging Market,11/1/2022 8:02:02 PM
MCFT,Wall Street's Top Analyst Just Said On Zions Bancorp; Here Are Other Picks For Tuesday From Analysts,10/26/2022 1:35:41 PM
MCFT,What 4 Analyst Ratings Have To Say About MasterCraft Boat Hldgs,10/25/2022 10:46:11 PM
MCFT,"Thor Industries, recreational vehicle stocks slide after Winnebago warning",10/19/2022 3:22:58 PM
MCFT,"Kamilah Mitchell-Thomas to Join MasterCraft Boat Holdings, Inc. Board of Directors",10/11/2022 9:05:03 PM
MCFT,"MasterCraft Boat Holdings, Inc. Issues Inaugural Sustainability Report",9/14/2022 9:05:06 PM
MCFT,5 Analysts Have This to Say About MasterCraft Boat Hldgs,9/9/2022 6:07:22 PM
MCFT,"US Stocks Flat, Crude Oil Rises 2%",9/8/2022 9:05:59 PM
MCFT,August marine retailer sentiment remains strained on economic concerns,9/7/2022 9:39:03 PM
MCFT,"MasterCraft Boat Holdings, Inc. to Webcast Fiscal Fourth Quarter and Full Year 2022 Earnings Conference Call Thursday, September 8, 2022",8/19/2022 7:41:02 PM
MCFT,"MasterCraft Boat Holdings, Inc. Announces Review of Strategic Alternatives for NauticStar Business",8/9/2022 10:30:38 PM
MCFT,MasterCraft Makes Summer Better With Release of New Model and Features for 2023,7/7/2022 5:55:19 PM
MCFT,"MasterCraft Adds All-New XT22 T to the XT Lineup, Amplifying On-Water Traditions",6/22/2022 5:00:00 PM
MCFT,MasterCraft Brings More Guts to Its Lineup With New MY23 XStar S Piranha Limited Edition,5/24/2022 7:33:49 PM
MCFT,"MasterCraft Signs Award-Winning Wakeboarder, Tyler Higham",5/12/2022 3:00:00 PM
MCFT,"Mastercraft takes on water despite report of record sales, profits",5/11/2022 1:43:28 PM
MCFT,MasterCraft Boat Q1 2022 Earnings Preview,5/10/2022 3:48:36 PM
MCFT,7 Consumer Discretionary Stocks to Buy in April,4/26/2022 10:54:58 PM
MCFT,MasterCraft Boat Company Celebrates Over 2 Million Safe Hours Worked,4/22/2022 6:02:53 PM
MCFT,"MasterCraft Boat Holdings, Inc. to Webcast Fiscal Third Quarter 2022 Earnings Conference Call Wednesday, May 11, 2022",4/18/2022 10:06:20 PM
MCFT,MasterCraft Boat Company and 7x World Champion Wakeboarder Meagan Ethell Announce “Let Her Rip” Tour ,3/8/2022 9:00:00 PM
MCFT,MasterCraft to Participate in Raymond James 43rd Annual Institutional Investors Conference,3/1/2022 10:01:00 PM
MCFT,MasterCraft Boat Company and Ilmor Marine Announce the Release of the World’s Most Powerful Towboat Engine,2/16/2022 5:00:00 PM
MCFT,20 Electric Vehicle Stocks To Choose From: Which One Is For You?,2/11/2022 7:23:50 PM
MCFT,"MasterCraft Boat Holdings, Inc. Reports Record Results for Fiscal 2022 Second Quarter",2/3/2022 1:30:00 PM
MCFT,Here's what to expect from MCBC's earnings,2/2/2022 3:01:13 PM
MCFT,MarineMax and Brunswick earnings power big day for boating sector,1/27/2022 3:45:39 PM
MCFT,"MasterCraft Boat Holdings, Inc. to Webcast Fiscal Second Quarter 2022 Earnings Conference Call Thursday, February 3, 2022",1/12/2022 10:05:00 PM
MCFT,7 Boating Stocks to Buy as GM Takes the EV War to the Water,12/3/2021 6:21:09 PM
MCFT,Recreational vehicle stocks gains as reports indicate 2022 could be another strong year,12/1/2021 5:23:32 PM
MCFT,General Motors looks to make a splash with electric boating investment,11/22/2021 4:46:06 PM
MCFT,Top 10 deletions to the MSCI US Small Cap 1750 Index during semiannual shuffle,11/12/2021 8:07:11 PM
MCFT,"MasterCraft Boat Holdings, Inc. Reports Record Results for Fiscal 2022 First Quarter",11/10/2021 1:30:00 PM
MCFT,MCBC earnings: here's what to expect,11/9/2021 3:01:13 PM
MCFT,"MasterCraft Boat Holdings, Inc. to Webcast Fiscal First Quarter 2022 Earnings Conference Call Wednesday, November 10, 2021",10/26/2021 11:10:08 PM
MCFT,"Cramer Gives His Opinion On Raytheon, Workhorse Group And More",9/21/2021 2:33:14 PM
MCFT,MasterCraft Reduces Q1 Guidance; Reaffirms Full Year Guidance ,9/17/2021 2:53:31 PM
MCFT,Mastercraft Boat Q4 Earnings Top Estimates,9/2/2021 8:59:49 PM
MCFT,MCBC earnings preview: what to expect,8/31/2021 3:01:18 PM
MCFT,IMAX gains 3% as B. Riley singles it out for M&A upside,8/23/2021 3:58:44 PM
MCFT,"MasterCraft Boat Holdings, Inc. to Webcast Fourth Quarter and Fiscal 2021 Earnings Conference Call Thursday, September 2, 2021",8/19/2021 10:05:00 PM
MCFT,Winnebago's purchase of pontoon boat maker contributes to broad rally in outdoors stocks,7/20/2021 7:07:52 PM
MCFT,Malibu Boats leads boating sector higher after Barron's nod,7/12/2021 6:59:11 PM
MCFT,"MasterCraft Boat Holdings, Inc. Elects Jennifer Deason to Board of Directors",7/7/2021 11:06:29 PM
MCFT,Mastercraft Boat Authorizes $50M Share Buyback,6/29/2021 7:26:48 PM
MCFT,"MasterCraft Boat Holdings, Inc. Announces New $50 Million Share Repurchase Program",6/28/2021 10:05:00 PM
MCFT,Return On Capital Employed Overview: MasterCraft Boat Hldgs,5/25/2021 7:23:13 PM
MCFT,"MasterCraft Boat Holdings, Inc. Reports Record Earnings for Fiscal 2021 Third Quarter",5/12/2021 1:30:00 PM
MCFT,MCBC earnings: here's what to expect,5/10/2021 3:01:58 PM
MCFT,Seeking Alpha Catalyst Watch,5/7/2021 7:30:30 PM
MCFT,"MasterCraft Boat Holdings, Inc. to Webcast Fiscal Third Quarter 2021 Earnings Conference Call Wednesday, May 12, 2021",4/23/2021 8:39:08 PM
MCFT,MasterCraft Boat Company and 6x World Champion Wakeboarder Meagan Ethell Partner to Empower Female Confidence In and Behind the Boat With “Let Her Rip” Campaign,3/8/2021 5:00:00 PM
MCFT,"MasterCraft Boat Company Announces Exclusive Partnership With Personalized Coaching App, Givego",3/3/2021 5:32:35 PM
MCFT,MasterCraft to Participate in Raymond James 42nd Annual Institutional Investors Conference,3/1/2021 10:05:00 PM
MCFT,"MasterCraft Boat Holdings, Inc. Reports Record Earnings for Fiscal 2021 Second Quarter",2/10/2021 1:30:00 PM
MCFT,Here's what Wall Street expects from MCBC's earnings report,2/8/2021 3:02:01 PM
MCFT,"MasterCraft Boat Holdings, Inc. to Webcast Fiscal Second Quarter 2021 Earnings Conference Call Wednesday, February 10, 2021",1/20/2021 1:30:00 PM
MCFT,MasterCraft Boat Company Launches Digital Boat Show Experience to Connect with Consumers Amidst Dynamic Boat Show Season,1/18/2021 10:05:00 PM
MCFT,Stocks That Hit 52-Week Highs On Wednesday,12/23/2020 4:57:31 PM
MCFT,Stocks That Hit 52-Week Highs On Tuesday,12/22/2020 4:30:53 PM
MCFT,Stocks That Hit 52-Week Highs On Friday,12/18/2020 8:42:01 PM
MCFT,10 Great Short-Term Stocks for Active Investors to Buy,12/11/2020 3:11:35 PM
MCFT,MasterCraft Boat rallies on upbeat FQ1 and outlook; strong boating market,11/11/2020 8:04:13 PM
MCFT,MasterCraft shoots higher on M&A talk,10/27/2020 2:39:59 PM
MCFT,"MasterCraft Boat Holdings, Inc. to Webcast First Quarter 2021 Earnings Conference Call Wednesday, November 11, 2020",10/22/2020 10:05:10 PM
MCFT,Stock Alert: MasterCraft Boat Slips 18% ,9/9/2020 4:25:26 PM
MCFT,MCBC earnings: here's what Wall Street expects,9/8/2020 3:01:32 PM
MCFT,MasterCraft Purchases Merritt Island Boat Manufacturing Plant to Establish Dedicated Aviara Manufacturing Facility,8/17/2020 10:05:10 PM
MCFT,"MasterCraft Boat Holdings, Inc. to Webcast Fourth Quarter and Fiscal 2020 Earnings Conference Call Wednesday, September 9, 2020",8/12/2020 10:30:10 PM
MCFT,"MasterCraft Boat Holdings, Inc., Names Scott Womack President of NauticStar",8/3/2020 10:05:10 PM
MCFT,MasterCraft Releases Newest and Largest NXT – The NXT24,7/15/2020 7:15:10 PM
MCFT,"MasterCraft Boat Holdings, Inc. Announces Partial Repayment of Revolving Credit Agreement",7/1/2020 3:00:10 PM
MCFT,10 Value Stocks to Keep on Your Short List,6/26/2020 1:50:19 PM
MCFT,MasterCraft’s Jan Morton Recognized by Boating Industry Magazine as a “Woman Making Waves”,6/25/2020 4:00:10 PM
MCFT,MasterCraft Announces the All-New 2021 ProStar,6/24/2020 10:30:10 PM
MCFT,Boating Industry Honors X26 with Top Product Award for 2020,5/8/2020 4:00:10 PM
MCFT,"MasterCraft Boat Holdings, Inc. Reports Fiscal 2020 Third Quarter Results",5/6/2020 1:30:10 PM
MCFT,What Wall Street expects from MCBC's earnings,5/5/2020 3:01:45 PM
MCFT,"MasterCraft Boat Holdings, Inc. to Webcast Fiscal 2020 Third-Quarter Earnings Conference Call  Wednesday, May 6, 2020",4/23/2020 10:05:10 PM
MCFT,Nautilus leads consumer gainers: Youngevity International among losers,4/9/2020 3:59:47 PM
MCFT,MasterCraft Provides Updates in Response to COVID-19,3/25/2020 9:05:00 PM
MCFT,MasterCraft Announces Executive Promotions to Newly Created C-Suite Roles,3/10/2020 9:05:00 PM
MCFT,Recreation stocks slide again,3/9/2020 6:41:29 PM
MCFT,MasterCraft to Participate in Raymond James 41st Annual Institutional Investors Conference,2/25/2020 9:15:00 PM
MCFT,Tesla among consumer gainers; Conagra Brands and Pyxus International among losers,2/18/2020 5:01:56 PM
MCFT,MasterCraft Boat Holdings Innovates at Record Speed With Aviara,2/13/2020 7:00:00 PM
MCFT,Coty and O-I Glass among consumer gainers; Tesla leads the losers,2/5/2020 5:00:04 PM
MCFT,MCBC earnings preview: what Wall Street is expecting,2/4/2020 3:01:59 PM
MCFT,"MasterCraft Boat Holdings, Inc. to Webcast Fiscal 2020 Second-Quarter Earnings Conference Call Wednesday, February 5, 2020",1/21/2020 10:05:00 PM
MCFT,9 Hot Stocks to Buy Now,12/30/2019 6:14:02 PM
MCFT,9 Hot Stocks to Buy Now,12/13/2019 3:18:22 PM
MCFT,"MasterCraft Boat Holdings, Inc., Names Brightbill CEO",12/3/2019 1:00:00 PM
MCFT,"MasterCraft Boat Holdings, Inc. Reports Fiscal 2020 First Quarter Results",11/7/2019 2:00:00 PM
MCFT,"MasterCraft Boat Holdings, Inc., Announces Leadership Transition",10/30/2019 9:05:05 PM
MCFT,"MasterCraft Boat Holdings, Inc. to Webcast Fiscal 2020 First-Quarter Earnings Conference Call Thursday, November 7, 2019",10/21/2019 10:05:05 PM
MCFT,MasterCraft Creates New Paradigm of Towboat Luxury and Performance with the New X26,9/26/2019 1:01:07 AM
MCFT,"MasterCraft Boat Holdings, Inc. Reports Fourth Quarter and Fiscal 2019 Results",9/12/2019 2:00:00 PM
MCFT,Here's what Wall Street expects from MCBC's earnings report,9/10/2019 3:01:22 PM
MCFT,"MasterCraft Boat Holdings, Inc. to Host Investor Day Tuesday, September 17, 2019",8/26/2019 4:00:00 PM
MCFT,"MasterCraft Boat Holdings, Inc. to Webcast Fiscal 2019  Fourth-Quarter Earnings Conference Call  Thursday, September 12, 2019",8/22/2019 6:00:00 PM
MCFT,10 Cyclical Stocks to Buy (or Sell) Now,8/5/2019 3:05:04 PM
MCFT,MasterCraft Announces Redesigned Entry-Level NXT Boats,7/17/2019 12:50:15 AM
MCFT,MasterCraft Boats Announces New 2020 Models and Features,7/9/2019 10:44:53 PM
MCFT,"MasterCraft Boat Holdings, Inc., to Present at the Baird 2019 Global Consumer, Technology and Services Conference",6/4/2019 11:10:12 PM
MCFT,"MasterCraft Boat Holdings, Inc., to Present at the 20th Annual B. Riley FBR Investor Conference",5/20/2019 3:00:00 PM
MCFT,"MasterCraft Boat Holdings, Inc. Reports Fiscal 2019 Third Quarter Results",5/9/2019 1:00:00 PM
MCFT,Here's what Wall Street expects from MCBC's earnings report,5/7/2019 3:03:14 PM
MCFT,MasterCraft X24 Named one of Boating Industry’s 2019 Top Products,5/6/2019 7:54:46 PM
MCFT,"MasterCraft Boat Holdings, Inc. to Webcast Fiscal 2019 Third-Quarter Earnings Conference Call Thursday, May 9, 2019",4/3/2019 5:00:00 PM
MCFT,"MasterCraft Boat Holdings, Inc., Promotes Jay Povlin to President of NauticStar",3/12/2019 1:30:00 PM
MCFT,MasterCraft X24 Named National Marine Manufacturers Association 2019 Innovation Award Winner,2/22/2019 6:57:53 PM
MCFT,Aviara Boats Defines Progressive Luxury with AV32,2/14/2019 7:30:00 PM
MCFT,"MasterCraft Boat Holdings, Inc. Partners with MarineMax, Inc. to Distribute Aviara",2/8/2019 5:12:13 PM
MCFT,"MasterCraft Boat Holdings, Inc. Reports Fiscal 2019 Second Quarter Results",2/7/2019 10:07:40 PM
MCFT,MasterCraft Boat Holdings Expands Portfolio with Aviara,2/5/2019 7:30:00 PM
MCFT,"MasterCraft Boat Holdings, Inc. to Webcast Fiscal 2019 Second-Quarter Earnings Conference Call Thursday, February 7, 2019",1/22/2019 4:05:50 PM
MCFT,NauticStar Introduces Three Exciting New Models,1/18/2019 5:00:00 PM
