Ticker,Title,Link
COR,ESPN just canceled a video game tournament broadcast in response to the mass shootings in El Paso and Dayton,8/9/2019 7:00:08 PM
COR,"Opioid distributors accused of fueling the national epidemic sink after offering a $10 billion settlement (ABC, MCK, CAH)",8/6/2019 10:45:05 PM
COR,AmerisourceBergen Raises Earnings Guidance - Quick Facts ,8/1/2019 12:53:12 PM
COR,Here's what Wall Street expects from AmerisourceBergen's earnings,7/30/2019 3:03:13 PM
COR,AmerisourceBergen Corporation -- Moody's announces completion of a periodic review of ratings of AmerisourceBergen Corporation,5/17/2019 11:45:00 PM
COR,AmerisourceBergen Boosts FY19 Adj. EPS Outlook - Quick Facts ,5/2/2019 12:51:38 PM
COR,Here's what Wall Street expects from AmerisourceBergen's earnings,4/30/2019 3:02:46 PM
COR,AmerisourceBergen Corp. Q1 adjusted earnings Beat Estimates,1/31/2019 12:35:35 PM
COR,Here's what Wall Street expects from AmerisourceBergen's earnings report,1/29/2019 3:02:02 PM
COR,AmerisourceBergen Under Pressure Despite Better Than Expected Q4 Earnings ,11/6/2018 6:41:47 PM
COR,AmerisourceBergen is about to announce its earnings — here's what Wall Street expects,11/4/2018 3:01:58 PM
COR,AmerisourceBergen Pays $625mln To Settle Charges Of Distributing Unapproved Drug ,10/2/2018 4:28:35 AM
COR,UPDATE 4-AmerisourceBergen to pay $625 mln in U.S. civil fraud settlement,10/1/2018 11:49:19 PM
COR,'Black-ish' creator opens up about an 'anti-Trump' episode shelved by ABC that was reportedly one reason he left for Netflix,9/12/2018 6:30:11 PM
COR,UPDATE 1-U.S. subpoenas AmerisourceBergen over opioid products,8/3/2018 12:00:34 AM
COR,U.S. subpoenas AmerisourceBergen over opioid products,8/2/2018 11:28:06 PM
COR,Here's what to expect from AmerisourceBergen's earnings,7/31/2018 3:02:52 PM
COR,Roseanne Barr blames Ambien for the racist tweet that caused ABC to cancel her show,5/30/2018 4:09:06 PM
COR,The engineer who helped create Venmo and now works for a former Facebook bigwig is trying to win over ABC's 'Bachelorette',5/29/2018 8:48:02 PM
COR,UPDATE 3-AmerisourceBergen sees Memphis plant back on track by 2019; shares rise,5/2/2018 4:58:06 PM
COR,BRIEF-Amerisourcebergen Production At Pharmedium's Memphis Outsourcing Facility Remains Voluntarily Suspended,4/2/2018 1:39:49 PM
COR,"Drug wholesaler AmerisourceBergen is dropping after Walgreens has reportedly ended acquisition talks (WBA, ABC)",2/27/2018 7:27:07 PM
COR,Walgreens bid for AmerisourceBergen would be a head-scratcher: analysts,2/13/2018 4:02:06 PM
COR,AmerisourceBergen Updates FY18 Outlook On U.S. Tax Reform - Quick Facts ,2/6/2018 12:45:36 PM
COR,"UPDATE 1-New Mexico adds Insys, Mallinckrodt to opioid epidemic lawsuit (JNJ, AGN, ENDP, TEVA, MCK, CAH, ABC)",12/20/2017 9:52:03 PM
COR,BRIEF-AmerisourceBergen Announces Operating Commitments to Address Opioid Diversion And Abuse (ABC),12/7/2017 2:37:03 PM
COR,"GRAPHIC-Lower taxes, big gains: The stocks poised to win from tax cuts (ZION, MTB, CMA, UNP, ALK, LUV, ABC, HCA, AFAM, DGX, ESRX, M, JWN, KSS, ROST, T, VZ)",12/4/2017 4:02:04 PM
COR,"GRAPHIC-Lower taxes, big gains: The stocks poised to win from tax cuts (ZION, MTB, CMA, UNP, ALK, LUV, ABC, HCA, AFAM, DGX, ESRX, M, JWN, KSS, ROST, T, VZ)",12/1/2017 11:02:03 PM
COR,Moody's: Pharma manufacturers and distributors face rising risks related to US opioid crisis,11/30/2017 4:08:00 PM
COR,BRIEF-AmerisourceBergen Prices $750 Mln 3.45 Pct Senior Notes Due 2027 (ABC),11/29/2017 11:22:03 PM
COR,UPDATE 1-AmerisourceBergen to pay $625 mln to settle U.S. government probe (ABC),11/22/2017 12:07:05 AM
COR,AmerisourceBergen to pay $625 mln to settle U.S. government probe (ABC),11/21/2017 11:32:03 PM
COR,AmerisourceBergen to buy drug wholesaler H.D. Smith for $815 mln (ABC),11/20/2017 11:42:03 PM
COR,"UPDATE 1-Trump administration proposes Medicare rules aimed at opioids, drug costs (ESRX, ABC, MCK)",11/17/2017 2:12:06 AM
COR,"Fringe benefits: Home demand in outer Australian cities prolong building boom (CSR, BKW, BLD, JHX, ARG, ABC, DLX)",11/15/2017 3:52:03 AM
COR,BRIEF-AmerisourceBergen increases dividend 4 percent (ABC),11/9/2017 3:12:03 PM
COR,"UPDATE 2-Drug distributor Cardinal Health names Mike Kaufmann as new CEO (CAH, ABC, MCK)",11/6/2017 4:07:03 PM
COR,"BRIEF-AmerisourceBergen, on conf call, says current trends indicate that generic buy side deflation rate has not worsened (ABC, RAD, AMZN)",11/2/2017 5:27:03 PM
COR,"UPDATE 1-Investor group presses U.S. drug companies on opioid controls (ABC, CAH, JNJ)",10/30/2017 2:52:12 PM
COR,"US STOCKS-Tech, bank stocks lift Wall St; tax-cut plan back in focus (ABC, GS, AAPL, GE, PG, CELG)",10/20/2017 5:57:03 PM
COR,UPDATE 1-AmerisourceBergen unit to plead guilty in U.S. syringe program case (ABC),9/27/2017 5:22:03 PM
COR,RBC Global Asset Management Inc. introduces seven new ETFs,9/21/2017 2:00:00 PM
COR,"BRIEF-NY A.G. Schneiderman, coalition of AGs expand investigation into opioid crisis (AGN, ENDP, JNJ, TEVA, ABC, CAH, MCK)",9/19/2017 6:42:09 PM
COR,Tilted Kilt Kicks Off The Football Season with New Menu Highlighting Fresh Ingredients,9/7/2017 10:58:00 PM
COR,"US Bioservices to resolve kickback claims for $13.4 mln -filing (ABC, BIOS, ESRX)",8/22/2017 6:52:08 PM
COR,BRIEF-AmerisourceBergen sets quarterly dividend of $0.365 per share (ABC),8/10/2017 3:37:03 PM
COR,"ABC settled 'pink slime' lawsuit for $177 million, leaving the beef company feeling 'vindicated'",8/9/2017 3:15:07 PM
COR,"RPT-Wal-Mart, Walgreens, CVS turn up the heat on generic drugmaker deals (WMT, CAH, ABC, TEVA, ENDP, ESRX, CVS, MCK)",8/4/2017 1:17:05 PM
COR,BRIEF-Amerisourcebergen says have yet to see generic deflation ease from its current high single digits (ABC),8/3/2017 4:02:03 PM
COR,"UPDATE 1-U.S. Senator expands opioid probe to distributors, drugmakers (ENDP, TEVA, AGN, JNJ, MYL, DEPO, MCK, ABC, CAH)",7/27/2017 9:12:08 PM
COR,"UPDATE 1-McKesson shareholders vote against exec pay structure (MCK, ABC, CAH)",7/26/2017 6:58:03 PM
COR,"UPDATE 1-Three US state treasurers seek change in McKesson exec pay policy (MCK, CAH, ABC)",7/25/2017 9:22:03 PM
COR,"The $5.7 billion 'pink slime' lawsuit against ABC was settled, leaving the beef company feeling 'vindicated'",6/28/2017 4:32:06 PM
COR,BRIEF-AmerisourceBergen says ‍announced a new organizational structure (ABC),6/19/2017 12:52:03 PM
COR,"BRIEF-AmerisourceBergen says ""we feel good"" about the low end of fiscal 2017 adjusted earnings forecast (ABC)",5/4/2017 4:26:02 PM
COR,Jimmy Kimmel hilariously mocks Starbucks' 'latest abomination' with his own new drink,4/21/2017 4:57:17 PM
COR,BRIEF-Tesaro selects US Bioservices as specialty pharmacy partner for Zejula (ABC),4/19/2017 11:51:06 PM
COR,"Research Reports Initiation on Services Stocks -- GNC Holdings, Cardinal Health, AmerisourceBergen, and McKesson",3/17/2017 12:30:00 PM
COR,BRIEF-Abcam H1 pretax profit rises (ABC),3/6/2017 9:44:21 AM
COR,How ABC's ambitious new time-travel show 'Time After Time' blows up our idea of technology,3/4/2017 8:02:51 AM
COR,"BRIEF-Greenlight Capital dissolves share stake in United States Steel, Michael Kors (X, GM)",2/14/2017 11:36:13 PM
COR,'Shark Tank' star Daymond John: Why 'American heroes' make great business partners,2/11/2017 1:15:12 AM
COR,"UPDATE 3-Cardinal Health profit beats estimates on lower costs (MCK, ABC, CAH)",2/7/2017 6:40:11 PM
COR,BRIEF-AmerisourceBergen Q1 adjusted earnings per share $1.36 (ABC),1/31/2017 1:02:07 PM
COR,Everything you need to know about Corinne Olympios — the newest villain of 'The Bachelor',1/23/2017 10:43:17 PM
COR,Watch 'Shark Tank' star Kevin O’Leary cook up a creative deal for a toy company,1/13/2017 5:14:48 PM
COR,Watch 'Shark Tank' star Kevin O'Leary skate off with a potential deal on the next episode,12/1/2016 8:56:49 PM
COR,"BRIEF-Moody's says largest US drug distributors face pricing pressure as they court independent pharmacies (ABC, CAH, MCK)",11/29/2016 8:06:04 PM
COR,"BRIEF-AmerisourceBergen, units entered into sixth amendment, restatement agreement to amend, restate credit agreement, dated as of March 18, 2011 (ABC)",11/23/2016 5:46:20 AM
COR,Billionaire Chris Sacca: My role on 'Shark Tank' is to 'bust Mark Cuban's balls',11/11/2016 9:15:23 PM
COR,"Drug wholesalers are getting slammed after McKesson warned that cost scrutiny is hurting its business (MCK, ABC, CAH)",10/29/2016 1:30:58 AM
COR,"BRIEF-Myriad Genetics, ION Solutions to partner for cancer testing (ABC, MYGN)",10/21/2016 11:08:22 PM
COR,'Shark Tank' is losing a lot of viewers — here's how the stars think it can turn around,10/11/2016 7:21:01 PM
COR,Drug distributor AmeriSourceBergen authorizes $2.4 billion share buyback,9/21/2015 11:29:16 PM
