Ticker,Title,Link
COR,Cencora’s Growth Potential Bolstered by Strategic OneOncology Acquisition,8/22/2024 4:36:50 AM
COR,Argus Research Keeps Their Buy Rating on Cencora (COR),8/9/2024 12:16:23 AM
COR,"Analysts Are Bullish on Top Healthcare Stocks: Cencora (COR), Acadia Healthcare (ACHC)",8/5/2024 6:31:37 AM
COR,Walgreens further cuts stake in Cencora for $1.1B,8/2/2024 9:35:21 AM
COR,"Analysts Conflicted on These Healthcare Names: Cencora (COR), Schrodinger (SDGR) and Biogen (BIIB)",8/1/2024 1:13:42 PM
COR,"COR Stock Earnings: Cencora Beats EPS, Beats Revenue for Q3 2024",7/31/2024 2:54:38 PM
COR,Cencora Q3 2024 Earnings Preview,7/30/2024 4:38:43 PM
COR,Evercore ISI Keeps Their Buy Rating on Cencora (COR),7/24/2024 12:18:05 PM
COR,Barclays Sticks to Its Buy Rating for Cencora (COR),7/22/2024 8:36:32 AM
COR,"McKesson, Cardinal, Cencora interested in buying private cancer clinics - report",7/17/2024 9:51:42 PM
COR,The 7 Most Undervalued Dividend Stocks to Buy in July 2024,7/11/2024 11:00:00 AM
COR,A Closer Look at 4 Analyst Recommendations For Cencora,7/9/2024 3:00:30 PM
COR,3 Dividend Compounding Machines Poised for 30%+ Total Returns by 2026,7/3/2024 7:50:52 PM
COR,Earnings Scorecard: Nike loses air after shocker results send shares sliding,6/29/2024 6:45:00 PM
COR,Buy Rating on Cencora’s Stock Amidst Walgreens Store Closures: Assessing Minimal EBIT Impact and Market Overreaction,6/28/2024 9:26:45 AM
COR,"CVS, Cencora drop as Walgreens announces store closures",6/27/2024 3:54:44 PM
COR,"3 Undervalued Gems Set to Soar 1,000% by 2026",6/25/2024 11:30:00 AM
COR,"Analysts Offer Insights on Healthcare Companies: Boston Scientific (BSX), Cencora (COR) and Intra-Cellular Therapies (ITCI)",6/20/2024 10:50:41 AM
COR,Mizuho Securities Sticks to Its Hold Rating for Cencora (COR),6/19/2024 4:38:10 AM
COR,"Cencora’s Stock Hold Rating: Assessing Market Position, Regulatory Impacts, and Growth Prospects",6/13/2024 10:00:37 AM
COR,Bulletproof Your Retirement: 3 Stocks That Will Stand the Test of Time,6/2/2024 8:00:00 PM
COR,Outlook gets EU approval for Lytenava for wet AMD,5/28/2024 3:50:44 PM
COR,Cencora reportedly notifying about cyberattack,5/24/2024 2:36:36 PM
COR,"Analysts Are Bullish on Top Healthcare Stocks: Teva Pharmaceutical (TEVA), Cencora (COR)",5/23/2024 7:50:39 AM
COR,Cencora: A Strong Buy on Robust Growth and Positive Industry Dynamics,5/20/2024 11:15:17 PM
COR,Health care is still very crowded but trades at a discount vs. history - BofA,5/14/2024 2:00:00 PM
COR,Unveiling 4 Analyst Insights On Cencora,5/2/2024 7:00:36 PM
COR,"COR Stock Earnings: Cencora Beats EPS, Misses Revenue for Q2 2024",5/1/2024 2:53:57 PM
COR,Cencora Q2 2024 Earnings Preview,4/30/2024 3:42:08 PM
COR,Cencora (COR) Receives a Buy from Barclays,4/24/2024 8:46:20 AM
COR,3 High-Quality Stocks That Will Never Put You in the Red,4/23/2024 10:24:00 AM
COR,Top 10 best performing S&P 500 health care stocks of 2024,4/10/2024 6:56:07 PM
COR,"Analysts Have Conflicting Sentiments on These Healthcare Companies: Madrigal Pharmaceuticals (MDGL), Inspire Medical Systems (INSP) and Cencora (COR)",3/15/2024 5:30:52 AM
COR,"Analysts Offer Insights on Healthcare Companies: Cencora (COR), Cormedix (CRMD) and NeueHealth Inc (NEUE)",3/13/2024 10:41:14 AM
COR,Cencora Appoints COO Robert Mauch As CEO; Backs Annual Outlook ,3/12/2024 2:32:02 PM
COR,Critical Insights From Cencora Analyst Ratings: What You Need To Know,2/26/2024 7:00:38 PM
COR,Pharma middlemen face govt. scrutiny over generic drug shortages,2/14/2024 3:24:17 PM
COR,Cencora Significant Share Sale Alters Ownership Stake,2/10/2024 9:29:03 AM
COR,Cencora Receives Legal Opinion on Note Validity,2/8/2024 9:29:56 AM
COR,Analysts Conflicted on These Healthcare Names: Cencora (COR) and Morphosys Ag (MOR),2/5/2024 6:20:10 PM
COR,Analysts’ Opinions Are Mixed on These Healthcare Stocks: Thermo Fisher (TMO) and Cencora (COR),2/1/2024 10:03:21 AM
COR,Cencora’s Strong Earnings Momentum and Operational Vigor Prompt a Buy Rating,1/31/2024 9:55:34 PM
COR,Cencora Q1 2024 Earnings Preview,1/30/2024 4:13:39 PM
COR,Johnson & Johnson inks ~$150M deal with Washington State to settle opioid claims,1/24/2024 8:57:44 PM
COR,Cencora’s Strong Position and Expansion Plans Bolster Buy Rating with New Price Target,1/11/2024 6:45:47 AM
COR,Cencora’s Market Position and Growth Prospects: A Hold Rating with a $213 Price Target,12/14/2023 10:45:43 AM
COR,Cencora Signs Distribution Agreement With Sapphiros For GoToKnow COVID-19 Antigen Rapid Tests ,11/22/2023 3:54:00 PM
COR,3 Biotech Stocks You’ll Regret Not Buying Soon: November 2023,11/14/2023 9:17:42 PM
COR,Walgreens Boots Alliance Sells Shares Of Cencora ,11/10/2023 1:50:10 AM
COR,Cencora’s Stock: Hold Rating Maintained Despite Strong Growth and Upward EPS Revision – An Analysis of Valuation Considerations,11/6/2023 6:39:36 AM
COR,"Analysts Offer Insights on Healthcare Companies: Cencora (COR), Syndax Pharmaceuticals (SNDX) and AMN Healthcare Services (AMN)",11/3/2023 11:10:45 AM
COR,AmerisourceBergen earnings: here's what Wall Street expects,11/1/2023 3:01:13 PM
COR,Outlook Therapeutics plunges as FDA rejects wet AMD therapy,8/30/2023 10:48:29 AM
COR,Why Is Tivic Health Systems (TIVC) Stock Up 112% Today?,8/29/2023 12:00:11 PM
COR,3 Sorry Retail Stocks to Sell in August Before It’s Too Late,8/23/2023 9:26:59 AM
COR,"Larry Robbins' Glenview Capital exits Alibaba in Q2, picks up stake in Warner Bros.",8/15/2023 8:57:12 PM
COR,J.P. Morgan Reaffirms Their Buy Rating on AmerisourceBergen (ABC),8/12/2023 12:15:34 PM
COR,Supreme Court to hear arguments on Purdue Pharma $6B bankruptcy settlement,8/10/2023 8:38:11 PM
COR,"3 key questions Disney analysts say CEO Bob Iger faces ahead of earnings, as concerns mount about succession and streaming profits",8/7/2023 6:52:01 PM
COR,Walgreens sells AmerisourceBergen stock for ~$1.9B proceeds,8/4/2023 10:55:10 AM
COR,AmerisourceBergen says selling stockholders offering up to 10.5M shares,8/3/2023 8:54:46 PM
COR,AmerisourceBergen declares $0.485 dividend,8/2/2023 1:20:19 PM
COR,AmerisourceBergen FQ3 2023 Earnings Preview,8/1/2023 5:03:11 PM
COR,AmerisourceBergen to repurchase its stock from Walgreens Boots Alliance Holdings,6/20/2023 11:21:23 AM
COR,"Analysts Offer Insights on Healthcare Companies: Qiagen (QGEN), AmerisourceBergen (ABC) and Doximity (DOCS)",6/7/2023 10:40:13 AM
COR,Expert Ratings for AmerisourceBergen,5/26/2023 4:00:59 PM
COR,Walgreens sells AmerisourceBergen shares for ~$694M,5/12/2023 9:40:31 AM
COR,Bank of America Securities Remains a Buy on AmerisourceBergen (ABC),5/11/2023 9:15:31 AM
COR,"Eli Lilly, Humana among best health care names in defensive environment - BofA",5/6/2023 8:00:00 PM
COR,Healthcare Solutions Trends And M&A Prospects: AmerisourceBergen Gets A Price Target Hike Amid Upside Scenarios,5/3/2023 9:17:50 PM
COR,AmerisourceBergen Lifts FY23 Earnings View Above Market - Update ,5/2/2023 1:36:56 PM
COR,AmerisourceBergen is about to announce its earnings — here's what Wall Street expects,5/1/2023 3:01:13 PM
COR,Bipartisan agreement reached in Senate prescription drug price legislation,4/25/2023 3:38:42 PM
COR,"Analysts Offer Insights on Healthcare Companies: AmerisourceBergen (ABC), Biogen (BIIB) and Elevance Health (ELV)",4/21/2023 12:10:11 PM
COR,"TPG, AmerisourceBergen acquiring OneOncology for $2.1B",4/20/2023 1:32:50 PM
COR,"Benzinga's Top Ratings Upgrades, Downgrades For March 31, 2023",3/31/2023 5:00:29 PM
COR,Animal Spirits Are Returning… With Mixed Results,3/29/2023 6:15:55 PM
COR,Sen. Duckworth calls on FTC to investigate AmerisourceBergen over abortion pill,3/27/2023 5:11:17 PM
COR,7 Stocks Set to Soar When the Market Recovers,3/17/2023 3:16:08 AM
COR,"Abcam to Report Full Year Results on Monday, March 20, 2023",3/10/2023 2:00:00 PM
COR,Quant Ratings Updated on 157 Stocks,3/7/2023 9:30:42 PM
COR,"Merck, GM among BofA's latest Alpha Surprise picks",2/2/2023 6:12:11 PM
COR,"AmerisourceBergen, off 4% on earnings, impacting peers Cardinal Health, McKesson",2/1/2023 7:53:10 PM
COR,The Latest Analyst Ratings for AmerisourceBergen,1/31/2023 9:01:22 PM
COR,"Catalyst watch: Eyes on tech earnings, Chinese EV stocks, Peloton and Church & Dwight",1/27/2023 7:15:05 PM
COR,AmerisourceBergen to rename as Cencora with aim to expand beyond US,1/24/2023 11:21:33 AM
COR,AmerisourceBergen partners with pharmaceutical company Civica,1/23/2023 1:57:55 PM
COR,Billionaire Leon Cooperman Says the Bear Market Is Expected to Continue in 2023 — Here Are 2 ‘Safe Haven’ Stocks That Analysts Like,1/8/2023 11:06:23 PM
COR,"Walgreens, CVS, Walmart in opioid settlements with Oklahoma",1/4/2023 5:55:05 PM
COR,U.S. DoJ Sues AmerisourceBergen Over Role In Opioid Crisis ,12/30/2022 3:45:56 AM
COR,AmerisourceBergen sued by DoJ over suspicious opioid orders,12/29/2022 4:13:10 PM
COR,Abcam plc: Update on AIM Delisting,12/12/2022 9:20:00 AM
COR,Walgreens Boots Alliance Sells AmerisourceBergen Shares For About $1.0 Bln ,12/9/2022 3:18:09 AM
COR,"Healthcare stocks come off lows, worst performing sector among defensive losers (update)",11/11/2022 8:16:39 PM
COR,AmerisourceBergen announces secondary stock offering by Walgreens Boots,11/7/2022 10:17:58 PM
COR,"Off-patent drugs make up 91% of prescriptions, but only 18% of spending - report",11/6/2022 5:00:24 PM
COR,Cardinal Health upgraded at Bank of America on pharma performance,11/4/2022 4:46:31 PM
COR,AmerisourceBergen Q4 Results Top Estimates; Declares Dividend - Update ,11/3/2022 12:05:28 PM
COR,AmerisourceBergen Q3 2022 Earnings Preview,11/2/2022 5:17:23 PM
COR,Pharma distributors shining bright ahead of earnings,10/30/2022 4:00:47 PM
COR,ABCAM PLC: Proposed resolution for cancellation of AIM listing,10/17/2022 8:00:00 AM
COR,Strong dollar will be the new earnings excuse; these stocks look insulated,10/12/2022 11:03:35 AM
COR,What 4 Analyst Ratings Have To Say About AmerisourceBergen,10/11/2022 4:07:32 PM
COR,"'I'm Not Going There,' Cramer Says About This Energy Stock",10/3/2022 2:21:39 PM
COR,Outlook Therapeutics ties up with AmerisourceBergen for anticipated launch of wet AMD drug,9/27/2022 2:17:42 PM
COR,Biden administration allocates $1.5B to address U.S. opioid crisis,9/23/2022 11:08:24 AM
COR,AmerisourceBergen To Buy Germany's PharmaLex Holding For EUR 1.28 Bln In Cash ,9/12/2022 2:34:55 PM
COR,"U.S. govt awards AmerisourceBergen ~$20M to expand, speed up monkeypox shot distribution",9/6/2022 8:53:09 PM
COR,"A leaked presentation shows how Disney is going up against Netflix, HBO Max, and others for streaming ad dollars",8/23/2022 7:12:00 PM
COR,Where AmerisourceBergen Stands With Analysts,8/22/2022 4:12:24 PM
COR,"Glenview adds Microsoft, Clarivate, exits Union Pacific, Alibaba and expanded stakes in Amazon, United Rentals",8/15/2022 10:25:09 AM
COR,AbCellera stock rises ~17% as continued strength from COVID royalties overshadows Q2 miss,8/10/2022 5:48:21 PM
COR,McKesson hits 52-week high; shares up 44% YTD,8/9/2022 5:28:42 PM
COR,eBay To $59? Plus Goldman Sachs Predicts This PT For Costco Wholesale,8/4/2022 3:15:21 PM
COR,AmerisourceBergen Q3 Results Top Estimates ,8/3/2022 4:10:05 PM
COR,AmerisourceBergen Q3 2022 Earnings Preview,8/2/2022 4:21:49 PM
COR,Drug distributors reach $400M opioid deal with West Virginia,8/1/2022 8:27:52 PM
COR,"Teva Pharmaceutical in $4.35B opioid settlement with states, Native American tribes",7/27/2022 2:06:05 AM
COR,ABCAM PLC First Half Trading Update,7/20/2022 3:06:00 PM
COR,"Benzinga's Top Ratings Upgrades, Downgrades For July 11, 2022",7/11/2022 5:53:47 PM
COR,"Benzinga Before The Bell: Record Inflows In 'Short Bitcoin' Funds, Elon Musk's Trillionaire Possibility, Gmail's Political Bias And Other Top Financial Stories Tuesday, July 5",7/5/2022 2:38:02 PM
COR,"AmerisourceBergen, Two Other Pharma Distributors To Pay $308 Mln To Oklahoma To Settle Opioid Suit ",7/1/2022 11:45:36 PM
COR,Walgreens reports decline in 3Q sales amid waning COVID impact,6/30/2022 12:24:49 PM
COR,British Columbia reaches $150M settlement with Purdue Pharma over opioid damages,6/29/2022 5:00:41 PM
COR,"AmerisourceBergen, McKesson, Cardinal to pay Oklahoma $250M to resolve opioid claims",6/28/2022 9:08:38 AM
COR,Abcam: Appointment of Vice President of Investor Relations,6/27/2022 8:00:00 AM
COR,Where AmerisourceBergen Stands With Analysts,6/13/2022 5:14:29 PM
COR,"Benzinga's Top Ratings Upgrades, Downgrades For June 7, 2022",6/7/2022 4:14:59 PM
COR,"Amazon, Domino's among additions to BofA's Alpha Surprise screen",6/3/2022 11:10:52 AM
COR,AmerisourceBergen shares down slightly as pharma wholesaler holds investor day,6/1/2022 5:00:53 PM
COR,Analyst Ratings for AmerisourceBergen,5/27/2022 5:09:06 PM
COR,"Benzinga's Top Ratings Upgrades, Downgrades For May 26, 2022",5/26/2022 4:27:58 PM
COR,AmerisourceBergen goes ex-dividend tomorrow,5/12/2022 3:16:59 PM
COR,Walgreens Boots Alliance cuts stake in AmerisourceBergen to 25.2%,5/11/2022 10:11:20 PM
COR,"ABC Boosts EPS Outlook, ADPT Sees 20-26% Revenue Growth, ANAB To Report HARP Data In Q3 ",5/5/2022 10:31:29 AM
COR,AmerisourceBergen Raises Annual Earnings Outlook Above View - Update ,5/4/2022 1:17:40 PM
COR,AmerisourceBergen FQ2 2022 Earnings Preview,5/3/2022 5:59:32 PM
COR,"San Francisco To Start Opioid Epidemic Trial Against Teva, Walgreen: Reuters",4/25/2022 10:11:22 PM
COR,"McKesson hits 52-week high as it outperforms rivals AmerisourceBergen, Cardinal Health",4/20/2022 7:28:39 PM
COR,"Benzinga's Top Ratings Upgrades, Downgrades For April 12, 2022",4/12/2022 4:03:25 PM
COR,10 Stocks That Have Moved Over 20% Since The Indices Plummeted,4/8/2022 8:52:36 PM
COR,"West Virginia Says J&J, Teva, AbbVie Caused 'Tsunami' Of Opioid Addiction: Reuters",4/4/2022 9:09:14 PM
COR,These 7 Cannabis Stocks May Be Underappreciated As Market Continues To Rebound,3/28/2022 7:47:25 PM
COR,Abcam the most awarded company at 2022 industry awards,3/25/2022 1:12:00 PM
COR,Appeal of Purdue Pharma $6B opioid settlement to be heard in late April,3/23/2022 4:52:39 PM
COR,"Teva, AbbVie unit reach $107M opioid settlement with Rhode Island",3/21/2022 8:52:27 PM
COR,Cardinal Health gains on vague takeover speculation,3/17/2022 4:24:13 PM
COR,Abcam Plc Results for the 12- and 18-month periods ended 31 December 2021,3/14/2022 1:00:00 PM
COR,"Pharma companies still supplying medicines to Russia, but some impact being felt",3/12/2022 9:00:00 PM
COR,DoJ bankruptcy arm raises concerns with potential Purdue opioid settlement,3/9/2022 3:37:30 PM
COR,"Purdue Pharma, Sacklers reach new $6B opioid settlement with states",3/3/2022 7:24:40 PM
COR,Johnson & Johnson to pay $5B as part of landmark opioid settlement,2/25/2022 2:17:56 PM
COR,Purdue's Sacklers mulling to add extra $1B in opioid settlement - Bloomberg News,2/11/2022 9:50:14 AM
COR,Two Insider Moonshots Rising on Sudden Buying,2/10/2022 9:50:29 PM
COR,List prices of prescription medicines rise nearly 7% on average in 2022,2/5/2022 5:00:00 PM
COR,What 5 Analyst Ratings Have To Say About AmerisourceBergen,2/3/2022 3:46:17 PM
COR,AmerisourceBergen Q1 Earnings Rise; Ups Annual Earnings Guidance ,2/2/2022 1:00:30 PM
COR,AmerisourceBergen FQ1 2022 Earnings Preview: What to Expect,2/1/2022 4:04:49 PM
COR,7 Low Labor-Cost Stocks to Buy for Solid Margins in 2022,1/21/2022 6:35:54 PM
COR,McKesson upgraded to buy at Credit Suisse; sees 35% upside,1/7/2022 2:39:30 PM
COR,Alamar Biosciences partners with Abcam to drive understanding of the human proteome,1/4/2022 10:00:00 AM
COR,States siding with McKinsey to block local governments' opioid cases,1/3/2022 8:55:57 PM
COR,Walgreens Boots is said to have received offer from Bain  for its Boots U.K. chain,1/2/2022 3:11:15 AM
COR,N.Y. jury has found Teva guilty in opioid trial; pharma distributors not guilty (updated),12/30/2021 5:04:38 PM
COR,Endo to pay $63M to settle Texas opioid claims,12/23/2021 8:53:48 PM
COR,AbbVie division Allergan in $200M settlement with New York over role in opioid crisis,12/8/2021 5:37:40 PM
COR,AmerisourceBergen files for mixed shelf offering,11/23/2021 10:39:10 PM
COR,Baird sees Street-high 35% upside in its favorite underappreciated drug distributor,11/9/2021 2:35:00 PM
COR,AmerisourceBergen Q4 Profit Beats Estimates ,11/4/2021 11:55:15 AM
COR,What Can Help Canopy Growth Reach $250M In Sales? Analyst's Thoughts Ahead Of Earnings,11/3/2021 7:15:21 PM
COR,"Walgreens Boots Alliance, Inc. -- Moody's rates Walgreen's proposed new notes Baa2; outlook negative",11/2/2021 10:49:00 PM
COR,Abcam completes $340m strategic acquisition and expands kit capacity and capability,10/27/2021 8:00:00 AM
COR,Johnson & Johnson to pay $290M in Texas as part of opioid settlement,10/26/2021 4:22:08 PM
COR,"'Shark Tank' exec producer reveals 13th season's pandemic shifts, recession-era roots, and the entrepreneurs Sharks are looking for",10/8/2021 9:09:12 PM
COR,Best Stocks for 2021: Walgreens Boots Alliance Still A Cheap Stock to Buy,10/4/2021 6:00:03 PM
COR,29% Constant Currency Revenue Growth in H2 as Lab Activity Gradually Recovers and Demand for Abcam In-house Products Increases,9/13/2021 1:00:00 PM
COR,Endo Shares Move Higher On Settlement Of New York State Opioid Cases,9/10/2021 1:31:21 PM
COR,Johnson & Johnson strikes opioid settlement in DC,8/23/2021 6:08:51 PM
COR,AmerisourceBergen Raises FY21 Adj. EPS Outlook ,8/4/2021 12:52:47 PM
COR,Notable earnings before Wednesday's open,8/3/2021 2:01:21 PM
COR,Abcam to Acquire BioVision for $340 million,8/2/2021 8:00:00 AM
COR,10 Best Stocks for 2021: Where Do Things Stand Halfway Through the Year?,7/26/2021 8:40:23 PM
COR,AmerisourceBergen Corporation -- Moody's: Proposed opioids settlement is credit negative for AmerisourceBergen,7/23/2021 3:21:00 PM
COR,Cardinal Health to record $140M pre-tax charge linked to opioid settlement,7/22/2021 12:36:22 PM
COR,What Did the Stock Market Do Today? 3 Big Stories to Catch Up On.,7/21/2021 8:47:49 PM
COR,"JNJ, drug distributors favored on Street as they near $26B opioid settlement with U.S.",7/20/2021 5:06:36 PM
COR,"Abcam opens new US facility in Boston, MA",7/13/2021 1:00:00 PM
COR,Best Stocks for 2021: Walgreens Boots Alliance Continues to Climb the Charts,7/9/2021 2:21:34 PM
COR,Fifteen states reach agreement with Purdue over bankruptcy plan - NYT,7/8/2021 2:42:54 PM
COR,Parexel is said near sale to EQT AB and Goldman Sachs for nearly $9B,7/2/2021 11:04:48 AM
COR,"New York Takes Drugmakers, Drug Retailers To Legal Trial Over Opioid",6/29/2021 9:24:57 PM
COR,JNJ viewed favorably by analysts after opioid settlement with New York,6/28/2021 8:33:39 PM
COR,"Skepticism over Amerisource acquisition, GSK upgraded - today's analyst action in healthcare",6/24/2021 2:00:35 PM
COR,"Parexel is said to get takeover interest from AmerisourceBergen, PE shops",6/23/2021 8:40:23 PM
COR,Pionyr and Abcam extend partnership to evaluate TREM2-expressing cells in cancer patients,6/22/2021 2:00:00 PM
COR,AmerisourceBergen Closes Acquisition Of Alliance Healthcare Businesses; Lifts FY Outlook ,6/2/2021 3:47:48 PM
COR,McKesson rebounds as fiscal 2022 outlook beats estimates,5/7/2021 3:54:21 PM
COR,AmerisourceBergen’s Q1 miss pressures rival healthcare distributors,5/5/2021 2:07:02 PM
COR,AmerisourceBergen Q2 2021 Earnings Preview,5/4/2021 6:49:31 PM
COR,AmerisourceBergen is about to announce its earnings — here's what Wall Street expects,5/3/2021 3:01:44 PM
COR,Drugmakers go on trial for opioid epidemic in California,4/19/2021 10:45:46 AM
COR,Abcam and MEDx extend precision medicine strategic partnership,4/12/2021 11:00:00 AM
COR,Stocks That Hit 52-Week Highs On Tuesday,3/30/2021 4:53:45 PM
COR,AmerisourceBergen raises ~$2.5B to fund the acquisition of Alliance Healthcare,3/26/2021 10:47:48 AM
COR,AmerisourceBergen Corporation -- Moody's rates AmerisourceBergen's new unsecured notes at Baa2,3/25/2021 3:35:00 PM
COR,"Walgreens Boots Alliance, Inc. -- Moody's announces completion of a periodic review of ratings of Walgreens Boots Alliance, Inc.",3/24/2021 9:52:00 PM
COR,"Sacklers raise opioid settlement offer to $4.3B, Reuters says",3/11/2021 7:37:14 PM
COR,Baird settles more into upside view on pharma services,3/10/2021 12:34:24 AM
COR,8.3% constant currency revenue growth in H1 as customers gradually return to labs,3/8/2021 1:00:00 PM
COR,Abcam Expands Presence in China to Support Increased Demand of BioPharma Sector,3/4/2021 10:00:00 AM
COR,AmerisourceBergen Corporation -- Moody's announces completion of a periodic review of ratings of AmerisourceBergen Corporation,3/1/2021 8:49:00 PM
COR,"Abcam to Report Interim Results on Monday, March 8, 2021",2/26/2021 8:00:00 AM
COR,Abcam to present at the 2021 SVB Leerink Global Healthcare Conference,2/17/2021 1:00:00 PM
COR,AmerisourceBergen upgraded to outperform at Evercore ISI; shares rise more than 6%,2/4/2021 6:51:38 PM
COR,Notable earnings before Thursday's open,2/3/2021 5:06:11 PM
COR,AmerisourceBergen earnings: here's what Wall Street expects,2/2/2021 3:01:46 PM
COR,Abcam Plc Appointment of Non-Executive Directors,1/28/2021 8:00:00 AM
COR,AmerisourceBergen declares $0.44 dividend,1/14/2021 9:36:10 PM
COR,"Baird Upgrades Walgreens Boots, Expects Turnaround Of 'Train Wreck' Performance",1/11/2021 5:21:08 PM
COR,"Walgreens Boots Alliance, Inc. -- Moody's says Walgreens' sale of Alliance Healthcare has no immediate impact on ratings",1/8/2021 6:29:00 PM
COR,Mid-Afternoon Market Update: Dow Rises 250 Points; 3D Systems Shares Spike Higher,1/7/2021 9:14:25 PM
COR,Amerisource Bergen raised at BofA after Walgreen's Alliance deal,1/6/2021 3:50:48 PM
COR,Purdue Pharma pleads guilty to criminal opioid crisis charges,11/25/2020 8:49:37 AM
COR,Goldman buys the dip in McKesson after yesterday's Amazon-related decline,11/18/2020 12:12:23 PM
COR,"CVS, Walgreens, and Rite Aid are all tumbling after Amazon's Pharmacy launch",11/17/2020 12:23:10 PM
COR,Eli Lilly gets emergency OK for COVID-19 treatment bamlanivimab; shares +4.7%,11/9/2020 11:42:39 PM
COR,Drug wholesalers and J&J agree to tentative $26B deal to settle opioid lawsuits,11/6/2020 3:34:01 PM
COR,AmerisourceBergen Corp. Q4 adjusted earnings Beat Estimates,11/5/2020 1:33:39 PM
COR,AmerisourceBergen Q4 2020 Earnings Preview,11/4/2020 5:58:48 PM
COR,"Abcam plc: Annual Report, Impact Report and Notice of AGM",11/3/2020 2:34:56 PM
COR,Abcam Announces Closing of Offering,10/26/2020 4:45:10 PM
COR,Shonda Rhimes said she left ABC after an exec told her she was asking for too much,10/22/2020 3:27:03 PM
COR,OxyContin maker Purdue Pharma to plead guilty to three criminal charges,10/21/2020 2:10:42 PM
COR,"Baird bullish, but 'patient,' on drug distributors heading into earnings",10/16/2020 2:16:04 AM
COR,7 Value Stocks to Buy For Growth and Peace of Mind,8/25/2020 2:55:57 PM
COR,"Walgreens Boots Alliance, Inc. -- Moody's changes Walgreens outlook to negative; affirms ratings",8/7/2020 7:43:00 PM
COR,AmerisourceBergen Raises Earnings Guidance - Quick Facts ,8/5/2020 1:57:41 PM
COR,Here's what Wall Street expects from AmerisourceBergen's earnings,8/4/2020 3:03:46 PM
COR,Positive drug distributor trends will outlast pandemic impact - Baird,6/2/2020 11:32:37 PM
COR,AmerisourceBergen Corporation -- Moody's rates AmerisourceBergen's new senior unsecured bonds at Baa2,5/12/2020 5:49:00 PM
COR,AmerisourceBergen is about to announce its earnings — here's what to expect,5/7/2020 3:02:03 PM
COR,AmerisourceBergen Q2 2020 Earnings Preview,5/6/2020 5:37:25 PM
COR,Exclusive: AmerisourceBergen eyes Walgreens' drug distribution business - sources,5/5/2020 8:27:19 AM
COR,AmerisourceBergen eyes Walgreens' drug distribution operation,5/4/2020 9:46:04 PM
COR,"Walgreens Boots Alliance, Inc. -- Moody's rates Walgreen's proposed new notes Baa2; outlook stable",4/13/2020 6:42:00 PM
COR,AmerisourceBergen Corporation -- Moody's announces completion of a periodic review of ratings of AmerisourceBergen Corporation,4/6/2020 4:41:00 PM
COR,Oppenheimer sees 26% downside in Intuitive Surgical in premarket action,4/1/2020 11:51:39 AM
COR,"'No. Don't tweet that': The most important advice Trump received was not to tweet, former chief of staff John Kelly says",3/26/2020 2:33:06 AM
COR,"SWIMMING WITH SHARKS: Founders who made it on 'Shark Tank' reveal winning pitches, tips to negotiate money-making deals, and how they've used the spotlight to their advantage",3/19/2020 8:12:04 PM
COR,"Moody's – More opioid settlements likely in 2020, with mainly negative credit impact for defendants",3/12/2020 12:07:00 PM
COR,Potholes Remain for Teva Pharmaceutical Stock,2/26/2020 3:02:08 PM
COR,Opioid-related payouts to less than expected - NYT,2/18/2020 12:57:08 PM
COR,Baird likes drug wholesalers in premarket analyst action,2/7/2020 12:58:53 PM
COR,3 Healthcare Stocks to Buy This Week Ahead of Earnings,2/4/2020 4:49:26 PM
COR,AmerisourceBergen Corporation -- Moody's: PharMedium exit will help AmerisourceBergen's earnings and reduce management distraction,1/31/2020 8:48:00 PM
COR,AmerisourceBergen Lifts FY20 Earnings Outlook; To Exit PharMEDium Business ,1/30/2020 1:13:37 PM
COR,Here's what Wall Street expects from AmerisourceBergen's earnings,1/29/2020 3:02:11 PM
COR,AmerisourceBergen Corporation -- Moody's affirms AmerisourceBergen's Baa2 senior unsecured rating; outlook stable,1/17/2020 10:49:00 PM
COR,AmerisourceBergen Issues FY20 Outlook - Quick Facts ,11/7/2019 12:42:50 PM
COR,Stock Market Today: Stocks Rally Ahead of Big Earnings Week,10/21/2019 8:16:27 PM
COR,"Opioid distributors soar after reportedly offering $18 billion to settle a swath of drug crisis lawsuits (MCK, ABC, CAH)",10/16/2019 3:18:06 PM
COR,Warren Buffett's biggest mistake might be dumping Disney stock — twice. The error cost him $20 billion.,8/29/2019 4:42:05 PM
