Ticker,Title,Link
GOSS,Buy Rating Affirmed for Gossamer Bio Amidst Financial Growth and Clinical Advancements,8/14/2024 10:35:49 AM
GOSS,"Analysts Offer Insights on Healthcare Companies: Meiragtx Holdings (MGTX), Spruce Biosciences (SPRB) and Gossamer Bio (GOSS)",8/13/2024 10:51:04 AM
GOSS,"Gossamer Bio GAAP EPS of $0.22, revenue of $88.8M",8/12/2024 9:02:53 PM
GOSS,Gossamer Bio (GOSS) Receives a Buy from Piper Sandler,7/15/2024 10:48:16 AM
GOSS,"Gossamer Bio's Clean Safety Profile Differentiates It From Merck, Analyst Says",6/25/2024 8:39:14 PM
GOSS,Gossamer Bio a new outperform at Oppenheimer on seralutinib for PAH,6/24/2024 9:57:36 PM
GOSS,"Analysts Offer Insights on Healthcare Companies: Mirum Pharmaceuticals (MIRM), Cytokinetics (CYTK) and Gossamer Bio (GOSS)",6/17/2024 3:05:40 PM
GOSS,The Penny Stock Pundits: 3 Companies Poised to Become the Talk of Wall Street,6/13/2024 7:35:06 PM
GOSS,Buy Rating Reaffirmed for Gossamer Bio on Seralutinib’s Promising Clinical Data and Future Prospects,5/20/2024 3:25:27 PM
GOSS,Buy Rating Affirmed for Gossamer Bio Amidst Strategic Collaboration and Market Opportunity Growth,5/9/2024 4:45:46 PM
GOSS,Strategic Partnership and Financial Upside: Gossamer Bio Earns a Buy Rating,5/8/2024 3:55:50 AM
GOSS,Gossamer Bio GAAP EPS of -$0.19 in-line,5/7/2024 9:48:20 PM
GOSS,Buy Rating on Gossamer Bio Supported by Strategic Partnership and Market Underestimation,5/6/2024 6:25:12 PM
GOSS,Buy Rating Affirmed on Gossamer Bio with Promising Seralutinib Prospects in PAH Treatment Landscape,3/27/2024 1:55:25 PM
GOSS,"Analysts Offer Insights on Healthcare Companies: Diamedica Therapeutics (DMAC), Gossamer Bio (GOSS) and Vor Biopharma (VOR)",3/21/2024 1:00:28 PM
GOSS,Piper Sandler Sticks to Its Buy Rating for Gossamer Bio (GOSS),3/13/2024 10:55:09 AM
GOSS,Barclays Keeps Their Hold Rating on Gossamer Bio (GOSS),3/11/2024 6:45:17 AM
GOSS,Optimistic Buy Rating for Gossamer Bio Amidst Progress in PAH Treatment Market,3/7/2024 4:19:07 AM
GOSS,Goldman Sachs Maintains Buy Rating for Gossamer Bio: Here's What You Need To Know,3/6/2024 6:00:20 PM
GOSS,Maintained Buy Rating on Gossamer Bio Amidst Anticipated Phase 3 PROSERA Trial Results,3/5/2024 11:15:20 PM
GOSS,7 Micro-Cap Stocks That Could Majorly Surprise Investors,1/31/2024 7:23:57 PM
GOSS,HC Wainwright & Co. Maintains Buy Rating for Gossamer Bio: Here's What You Need To Know,1/8/2024 6:00:12 PM
GOSS,"Analysts Offer Insights on Healthcare Companies: Kura Oncology (KURA), Gossamer Bio (GOSS) and 4D Molecular Therapeutics (FDMT)",1/4/2024 12:21:07 PM
GOSS,Seralutinib’s Promising Efficacy and Market Potential Reinforce Buy Rating,12/21/2023 6:27:35 AM
GOSS,"Analysts Are Bullish on These Healthcare Stocks: Gossamer Bio (GOSS), Viridian Therapeutics (VRDN)",12/19/2023 11:50:06 AM
GOSS,Why Lantheus Holdings Shares Are Trading Lower By Over 22%? Here Are Other Stocks Moving In Monday's Mid-Day Session,12/18/2023 7:05:04 PM
GOSS,"Analysts Offer Insights on Healthcare Companies: Ionis Pharmaceuticals (IONS), Viracta Therapeutics (VIRX) and Gossamer Bio (GOSS)",11/14/2023 8:30:30 AM
GOSS,Accelerated Progress and Positive Outlook for Gossamer Bio’s Seralutinib: A Buy Recommendation,11/10/2023 4:15:44 PM
GOSS,Piper Sandler Keeps Their Buy Rating on Gossamer Bio (GOSS),10/13/2023 10:36:17 AM
GOSS,Analyst Expectations for Gossamer Bio's Future,8/11/2023 8:00:24 PM
GOSS,Wedbush Sticks to Their Buy Rating for Gossamer Bio (GOSS),8/10/2023 8:15:17 PM
GOSS,"Analysts Offer Insights on Healthcare Companies: Gossamer Bio (GOSS), Invitae (NVTA) and Oscar Health (OSCR)",8/9/2023 11:30:59 AM
GOSS,Gossamer Bio GAAP EPS of -$0.45 beats by $0.04,8/8/2023 9:22:12 PM
GOSS,Gossamer Bio falls after UBS downgrades,7/27/2023 3:49:43 PM
GOSS,Analyst Ratings for Gossamer Bio,7/26/2023 3:00:42 PM
GOSS,"Analysts Are Bullish on These Healthcare Stocks: Gossamer Bio (GOSS), Legend Biotech (LEGN)",7/21/2023 11:13:43 AM
GOSS,Gossamer Bio to launch ~$212M private placement of securities,7/20/2023 12:33:09 PM
GOSS,Why MIND Technology Shares Are Trading Lower By Over 20%? Here Are Other Stocks Moving In Wednesday's Mid-Day Session,6/14/2023 7:12:22 PM
GOSS,"Catalyst watch: Eyes on Ford event, Virgin Galactic launch, Nvidia earnings and Microsoft conference",5/19/2023 7:00:19 PM
GOSS,"Analysts Are Bullish on Top Healthcare Stocks: Gossamer Bio (GOSS), Reneo Pharmaceuticals (RPHM)",5/15/2023 10:12:19 AM
GOSS,Gossamer Bio (GOSS) Receives a Buy from H.C. Wainwright,5/11/2023 10:25:39 AM
GOSS,Wedbush Reaffirms Their Buy Rating on Gossamer Bio (GOSS),5/10/2023 9:45:07 PM
GOSS,Gossamer ends development of phase 1 lymphoma candidate after clinical hold,4/3/2023 9:16:58 PM
GOSS,"WKHS, OPEN and BILI are among pre market gainers",3/23/2023 1:00:16 PM
GOSS,Gossamer Bio (GOSS) Gets a Buy from Wedbush,3/21/2023 5:25:15 PM
GOSS,Why Bed Bath & Beyond Shares Are Trading Lower By Around 24%? Here Are Other Stocks Moving In Monday's Mid-Day Session,3/20/2023 7:18:52 PM
GOSS,Gossamer Bio GAAP EPS of -$0.59 beats by $0.03,3/17/2023 11:34:07 AM
GOSS,Why Titan Machinery Shares Are Trading Lower By Around 18%? Here Are Other Stocks Moving In Thursday's Mid-Day Session,3/16/2023 6:56:51 PM
GOSS,Analyst Downgrades Gossamer Bio As Merck's Sotatercept Might Overshadow Seralutinib's Success,3/7/2023 7:37:52 PM
GOSS,Gossamer initiated Neutral at Guggenheim citing challenges for PAH therapy,3/1/2023 5:45:53 PM
GOSS,"Pre-market Movers: XPON, HPCO, LYFT, PHAT, AVXL… ",2/10/2023 12:56:17 PM
GOSS,7 Top Short-Squeeze Candidates to Watch in February,2/1/2023 9:25:01 PM
GOSS,"180 Life Sciences, KalVista top healthcare gainers; Edesa, Nutex among losers",12/27/2022 3:02:55 PM
GOSS,"Sintx, F-star top healthcare gainers; Celyad, IceCure lead losers' pack",12/21/2022 3:01:52 PM
GOSS,Why Cosmos Health Shares Are Trading Lower By Around 60%? Here Are 79 Stocks Moving In Monday's Mid-Day Session,12/19/2022 7:38:15 PM
GOSS,"GPRO, SGMO and CALA are among after hour mover",12/16/2022 10:58:39 PM
GOSS,"GRPN, AUPH and QRTEA are among after hour movers",12/9/2022 10:20:31 PM
GOSS,Lowe's To Rally Around 19%? Here Are 10 Other Price Target Changes For Thursday,12/8/2022 2:04:50 PM
GOSS,Why Prometheus Biosciences Shares Are Trading Higher By Over 184%? Here Are 55 Stocks Moving In Wednesday's Mid-Day Session,12/7/2022 7:46:00 PM
GOSS,Dow Dips Over 500 Points; Nasdaq Down 2.5%,12/6/2022 8:36:31 PM
GOSS,Gossamer Bio (GOSS) Receives a Buy from SVB Securities,11/30/2022 4:15:22 AM
GOSS,Wedbush Sticks to Their Buy Rating for Gossamer Bio (GOSS),11/18/2022 11:45:10 AM
GOSS,Analyst Expects 'Somewhat Smaller Effect Size' From Gossamer Bio's Upcoming PAH Trial,11/17/2022 8:37:35 PM
GOSS,"Analysts Offer Insights on Healthcare Companies: IQVIA Holdings (IQV), TG Therapeutics (TGTX) and Gossamer Bio (GOSS)",11/14/2022 12:10:54 PM
GOSS,"Analysts Have Conflicting Sentiments on These Healthcare Companies: Ascendis Pharma (ASND), Gossamer Bio (GOSS) and BioNTech SE (BNTX)",11/8/2022 11:21:43 AM
GOSS,Wedbush Sticks to Their Buy Rating for Gossamer Bio (GOSS),11/4/2022 5:45:09 PM
GOSS,Gossamer Bio GAAP EPS of -$0.65 misses by $0.01,11/3/2022 9:12:26 PM
GOSS,Goldman Sachs Says These 2 Buy-Rated Stocks Have at Least 60% Upside Potential,10/24/2022 12:30:29 PM
GOSS,What 5 Analyst Ratings Have To Say About Gossamer Bio,10/20/2022 8:03:36 PM
GOSS,Gossamer Bio (GOSS) Gets a Buy from H.C. Wainwright,10/13/2022 12:55:09 PM
GOSS,"Benzinga's Top Ratings Upgrades, Downgrades For September 21, 2022",9/21/2022 4:04:10 PM
GOSS,What 4 Analyst Ratings Have To Say About Gossamer Bio,9/19/2022 9:39:49 PM
GOSS,"CRSP, ICPT and PFG are among after hour movers",9/1/2022 10:26:29 PM
GOSS,"AMRS, IOVA and AVDL are among after hour movers",8/26/2022 9:27:35 PM
GOSS,Gossamer Bio GAAP EPS of -$0.74 misses by $0.04,8/9/2022 12:30:30 PM
GOSS,"Beyond Meat, Canoo, Veru And More: 12 Short Squeeze Candidates To Watch",7/20/2022 4:28:00 PM
GOSS,These stocks are on the most crowded shorts list - watch out above,7/19/2022 4:15:57 PM
GOSS,Insider Buying This Major Airline Stock; 3 Stocks Insiders Are Buying,7/18/2022 2:37:24 PM
GOSS,Why Cannabis Companies Traded Higher; Here's 60 Biggest Movers From Yesterday,7/15/2022 11:20:54 AM
GOSS,"KOPN, BPT and CLVR among mid-day movers-",7/14/2022 5:10:56 PM
GOSS,"Twitter, Delta Air Lines And 45 Stocks Moving In Wednesday's Mid-Day Session",7/13/2022 6:21:21 PM
GOSS,"REAL,COMM and OVID among after hour movers",7/1/2022 9:29:42 PM
GOSS,"ISPO, RDBX and GOSS are among after hour movers",5/11/2022 9:24:16 PM
GOSS,Gossamer Bio GAAP EPS of -$0.76 in-line,5/10/2022 9:42:25 PM
GOSS,71 Biggest Movers From Yesterday,4/27/2022 10:27:25 AM
GOSS,Where Gossamer Bio Stands With Analysts,4/26/2022 6:08:46 PM
GOSS,Gossamer Bio Pulls Plug On Mid-Stage Ulcerative Colitis Program,4/25/2022 2:54:08 PM
GOSS,"Benzinga's Top Ratings Upgrades, Downgrades For April 18, 2022",4/18/2022 4:04:01 PM
GOSS,"Benzinga's Top Ratings Upgrades, Downgrades For April 6, 2022",4/6/2022 4:16:32 PM
GOSS,Gossamer Bio GAAP EPS of -$0.74 misses by $0.02,3/3/2022 10:34:53 PM
GOSS,"Big Lots, II-VI make Piper Sandler's top 20 short squeeze list: Alpha Tactics",1/9/2022 3:15:25 AM
GOSS,"TBLA, ITCI and  GOSS among after hour movers",1/3/2022 11:01:44 PM
GOSS,Gossamer Bio EPS misses by $0.02,11/8/2021 9:15:32 PM
GOSS,Gossamer Bio Q3 2021 Earnings Preview,11/7/2021 9:35:00 PM
GOSS,"Lyft, Plug Power make latest Piper Sandler top 20 short squeeze list: Alpha Tactics",10/9/2021 6:34:49 PM
GOSS,"The Daily Biotech Pulse: Eisai, Biogen Pursue Approval Of Second Alzheimer's Treatment; Sanofi Changes mRNA Strategy; GSK Subsidiary To Develop Long-Acting HIV Preventive",9/28/2021 2:18:52 PM
GOSS,31 Stocks Moving In Monday's Mid-Day Session,9/27/2021 6:00:19 PM
GOSS,Gossamer Bio Appoints CFO Bryan Giraudo To Addl. Role Of COO - Quick Facts ,9/21/2021 2:57:02 PM
GOSS,"The Week Ahead In Biotech (Aug. 8-14): Jazz Pharma FDA Decision, Earnings Deluge and IPOs In The Spotlight",8/8/2021 4:11:24 PM
GOSS,"The Daily Biotech Pulse: Ardelyx Sinks On Regulatory Setback, AnPac Issues Positive Preannouncement, European Nod For Myovant, HCW Biologics Debuts On Wall Street",7/20/2021 2:19:56 PM
GOSS,"The Daily Biotech Pulse: Moderna To Join S&P 500 Index, Thumbs Down For FibroGen's Anemia Drug, Corvus Shelves COVID Study",7/16/2021 1:37:29 PM
GOSS,"The Daily Biotech Pulse: Galapagos Sinks On Data, J&J Recalls Sunscreen Products, FibroGen Awaits AdCom Verdict, 3 IPOs",7/15/2021 2:07:56 PM
GOSS,"The Daily Biotech Pulse: Sanofi, Translate Bio Start Early Stage Seasonal Flu Vaccine Study, Dr. Reddy's Launches Generic Vascepa, Halozyme Strikes Licensing Deal",6/22/2021 2:12:07 PM
GOSS,"The Week Ahead In Biotech: Biogen, Alexion And Vertex FDA Decisions, Multiple Conference Presentations On The Deck",6/7/2021 2:52:10 PM
GOSS,Seeking Alpha Catalyst Watch,6/4/2021 7:30:04 PM
GOSS,"SMMT, CLSD, ADBE and AVDL among after-hours movers",5/14/2021 9:41:39 PM
GOSS,"The Daily Biotech Pulse: Minerva, InflaRx Report Positive Data Readouts, Lucira COVID-19 Test Kit Available On Amazon, Decision Day For Heron",5/12/2021 2:57:17 PM
GOSS,Gossamer Bio EPS misses by $0.01,5/6/2021 12:02:21 PM
GOSS,Gossamer Bio's chief scientific officer Luisa Salter-Cid to resign,4/20/2021 12:04:55 PM
GOSS,"Gossamer Bio promotes Caryn Peterson to executive vice president, regulatory affairs",4/16/2021 11:59:56 AM
GOSS,Gossamer Bio EPS misses by $0.09,2/25/2021 12:35:02 PM
GOSS,Seeking Alpha Catalyst Watch,2/12/2021 8:15:29 PM
GOSS,"MESO, EAF, RC and MDWD among after-hours movers",12/14/2020 10:44:25 PM
GOSS,"Week Ahead In Pharma: FDA Decision, Review Of COVID-19 Vaccine, Data Readouts (MRNA, BCRX, ARVN...) ",12/13/2020 1:11:37 AM
GOSS,Seeking Alpha Catalyst Watch,12/11/2020 8:30:29 PM
GOSS,"Week Ahead In Pharma: FDA Decisions, SITC Presentations, 13D SEC Filing ",11/8/2020 3:52:03 PM
GOSS,"SOL, MGI, WWR and ICON among midday movers",10/13/2020 4:38:41 PM
GOSS,Gossamer Bio's GB004 shows positive action in early-stage ulcerative colitis study,10/12/2020 1:19:43 PM
GOSS,"DVAX, ABUS, ACB and SRNE among midday movers",5/19/2020 4:45:17 PM
GOSS,"ACB, BIDU, IQ and CLVS among after-hours movers",5/18/2020 9:37:33 PM
GOSS,BofA likes Johnson & Johnson in premarket analyst action,4/22/2020 11:38:49 AM
GOSS,Gossamer Bio files for mixed shelf,4/10/2020 9:00:09 PM
GOSS,Gossamer Bio EPS misses by $0.07,3/24/2020 11:08:09 AM
GOSS,Healthcare IPOs That Delivered Solid Returns In 2019 ,12/12/2019 2:10:57 PM
GOSS,"5 Top Gainers In Healthcare Sector (ARDS, PSTV, SLRX…) ",8/27/2019 4:27:32 AM
GOSS,7 First-Half IPO Stocks That Will Falter in 2019’s Second Half,6/13/2019 7:34:26 PM
