Ticker,Title,Link
ZYXI,Zynex Receives FDA Clearance For New TensWave Device ,9/3/2024 4:36:07 PM
ZYXI,COIN Stock: OpenAI Exec Joins Coinbase’s Board of Directors,7/26/2024 2:18:53 PM
ZYXI,"Zynex GAAP EPS of $0.04 misses by $0.04, revenue of $49.88M misses by $2.21M",7/25/2024 8:05:14 PM
ZYXI,Zynex Q2 2024 Earnings Preview,7/24/2024 9:35:39 PM
ZYXI,All You Need to Know About Zynex Rating Upgrade to Buy,6/26/2024 9:27:15 PM
ZYXI,3 Short-Squeeze Stocks Poised for a Jaw-Dropping Rally,6/24/2024 10:00:00 AM
ZYXI,Analyst Predictions: 3 Stocks Pegged to Soar Over 40% in One Year,6/19/2024 10:00:00 AM
ZYXI,"Catalyst Watch: Disney earnings, Apple iPad event and Fed speakers back on the circuit",5/3/2024 7:00:00 PM
ZYXI,"Analysts Offer Insights on Healthcare Companies: Eli Lilly & Co (LLY), Exelixis (EXEL) and Zynex (ZYXI)",5/1/2024 10:42:18 AM
ZYXI,"Zynex GAAP EPS of $0.00 misses by $0.03, revenue of $46.53M misses by $1.16M",4/30/2024 8:21:36 PM
ZYXI,Notable earnings after Tuesday's close,4/29/2024 9:35:36 PM
ZYXI,RBC Capital Remains a Buy on Zynex (ZYXI),4/17/2024 7:59:31 AM
ZYXI,3 Industrial Stocks Short Sellers Are Hammering: Cracks in the Foundation?,4/2/2024 6:58:16 PM
ZYXI,Zynex (ZYXI) Receives a Buy from RBC Capital,3/8/2024 12:27:41 PM
ZYXI,RBC Capital Remains a Buy on Zynex (ZYXI),3/1/2024 12:27:41 PM
ZYXI,"ADSK, NTAP and RILY are among after hour movers",2/29/2024 10:14:08 PM
ZYXI,Zynex Q4 2023 Earnings Preview,2/28/2024 10:35:36 PM
ZYXI,Zynex Says FDA Clears M-Wave Neuromuscular Electrical Stimulation Device ,2/6/2024 3:25:55 PM
ZYXI,3 Unloved Growth Stocks Poised for a Major Turnaround,1/28/2024 6:27:19 PM
ZYXI,Analysts Offer Insights on Healthcare Companies: Zynex (ZYXI) and Privia Health Group (PRVA),1/16/2024 2:02:24 AM
ZYXI,Zynex To Buy Back Up To $20 Mln Of Common Stock ,11/1/2023 2:49:19 PM
ZYXI,RBC Capital Reaffirms Their Buy Rating on Zynex (ZYXI),10/27/2023 10:38:07 AM
ZYXI,Here's what Wall Street expects from Zynex's earnings,10/25/2023 3:01:13 PM
ZYXI,"Benzinga's Top Ratings Upgrades, Downgrades For October 16, 2023",10/16/2023 5:00:44 PM
ZYXI,3 Micro-Cap Stocks to Sell While You Still Can,10/6/2023 1:00:03 PM
ZYXI,Zynex To Repurchase $10 Mln Of Shares; Stock Up Over 6% ,9/11/2023 3:46:49 PM
ZYXI,"Catalyst Watch: Arm IPO, Apple event, and Senate AI Forum with Musk, Zuckerberg, and Gates",9/8/2023 7:00:57 PM
ZYXI,"Blackstone and Airbnb Set to Join S&P 500; Others to Join S&P 100, S&P MidCap 400 and S&P SmallCap 600",9/2/2023 12:51:00 AM
ZYXI,"Airbnb, Blackstone rise on joining S&P 500 index",9/1/2023 10:33:42 PM
ZYXI,Analysts Offer Insights on Healthcare Companies: Zynex (ZYXI) and Arcutis Biotherapeutics (ARQT),7/28/2023 12:10:22 PM
ZYXI,"Zynex GAAP EPS of $0.09 beats by $0.05, revenue of $44.95M beats by $0.29M",7/27/2023 9:05:40 PM
ZYXI,Zynex Q2 2023 Earnings Preview,7/26/2023 9:35:31 PM
ZYXI,Zynex reaffims FY23 EPS $0.40-$0.50 vs. consensus $0.45,7/12/2023 2:24:31 PM
ZYXI,Zynex receives FDA clearance for CM-1600 fluid monitor,6/20/2023 6:03:58 PM
ZYXI,"Catalyst watch: Powell testifies to Congress, Microsoft-Activision Blizzard hearing and Dollar Tree event",6/16/2023 7:00:31 PM
ZYXI,Zynex Plans New $10M Stock Buyback Program,6/14/2023 6:24:22 PM
ZYXI,"7 Stocks With 1,000% Upside Potential",5/30/2023 10:34:32 PM
ZYXI,Zynex prices upsized $52M senior notes offering,5/5/2023 7:26:40 AM
ZYXI,Why Synaptics Shares Are Trading Lower By 17%? Here Are Other Stocks Moving In Thursday's Mid-Day Session,5/4/2023 9:03:41 PM
ZYXI,Ryerson says selling stockholders to offer 2.6M shares,5/3/2023 10:00:51 PM
ZYXI,The Latest Analyst Ratings for Zynex,4/28/2023 9:00:25 PM
ZYXI,"Zynex GAAP EPS of $0.04 beats by $0.03, revenue of $42.17M beats by $2.56M",4/27/2023 8:57:32 PM
ZYXI,Zynex earnings: here's what to expect,4/26/2023 3:01:13 PM
ZYXI,7 Small-Cap Stocks With Big Potential,4/20/2023 5:42:20 PM
ZYXI,"Analysts Offer Insights on Healthcare Companies: BeiGene (BGNE), Zynex (ZYXI) and Legend Biotech (LEGN)",4/12/2023 10:24:12 AM
ZYXI,Zynex gains 4.5% on record order growth,4/11/2023 1:35:05 PM
ZYXI,"ROSEN, A LEADING NATIONAL FIRM, Encourages Zynex, Inc. Investors to Inquire About Class Action Investigation - ZYXI",3/31/2023 1:06:00 AM
ZYXI,"ROSEN, LEADING INVESTOR COUNSEL, Encourages Zynex, Inc. Investors with Losses to Inquire About Class Action Investigation - ZYXI",3/15/2023 1:45:00 AM
ZYXI,H.C. Wainwright Sticks to Its Buy Rating for Zynex (ZYXI),3/14/2023 4:55:05 PM
ZYXI,Why Bank Shares Are Trading Lower? Here Are Other Stocks Moving In Monday's Mid-Day Session,3/13/2023 6:22:23 PM
ZYXI,Why Rivian Automotive Shares Are Trading Lower By Over 10%? Here Are Other Stocks Moving In Tuesday's Mid-Day Session,3/7/2023 7:02:26 PM
ZYXI,"VOD, ACAD and BLUE are among after hour movers",3/6/2023 10:01:40 PM
ZYXI,Notable earnings after Monday's close,3/5/2023 10:35:14 PM
ZYXI,Zynex leases new facility for meeting ZMS growth,2/21/2023 3:17:31 PM
ZYXI,Top 5 Health Care Stocks That Could Blast Off This Month,2/13/2023 2:28:08 PM
ZYXI,"Analysts’ Opinions Are Mixed on These Healthcare Stocks: Zynex (ZYXI), Sutro Biopharma (STRO) and Amryt Pharma (AMYT)",1/18/2023 11:20:44 AM
ZYXI,Why Spruce Biosciences Shares Are Trading Higher By 100%? Here Are Other Stocks Moving In Friday's Mid-Day Session,1/6/2023 7:16:03 PM
ZYXI,Zynex announces additional $10M share buyback plan,11/1/2022 1:23:06 PM
ZYXI,"ALNY Reiterates Guidance, TVTX Loss Widens, DXCM Paints Rosy Outlook ",10/28/2022 3:36:23 PM
ZYXI,"Zynex GAAP EPS of $0.13, revenue of $41.52M",10/27/2022 8:29:14 PM
ZYXI,Notable earnings after Thursday's close,10/26/2022 9:35:37 PM
ZYXI,7 Under-the-Radar Growth Stocks With 200% Growth Potential,10/17/2022 4:04:15 PM
ZYXI,"Analysts Offer Insights on Healthcare Companies: Zynex (ZYXI), Cabaletta Bio (CABA) and Kinnate Biopharma (KNTE)",10/12/2022 10:21:19 AM
ZYXI,"Zynex reports record order growth in Q3, reaffirms guidance",10/11/2022 1:29:46 PM
ZYXI,Zynex begins enrollment in blood loss detection trial for CM-1600 monitoring system,9/21/2022 2:00:27 PM
ZYXI,7 Hot Small-Cap Stocks to Buy in September,9/2/2022 10:45:17 AM
ZYXI,"Zynex stock soars 12% as Q2 revenue grows Y/Y, maintains FY22 outlook",7/29/2022 3:57:26 PM
ZYXI,"Zynex GAAP EPS, revenue beat estimates, reaffirms 2022 guidance",7/28/2022 8:06:50 PM
ZYXI,Zynex Q2 2022 Earnings Preview,7/27/2022 9:35:07 PM
ZYXI,"76 Biggest Movers From Yesterday: Ocean Bio-Chem, Athira Pharma And More",6/23/2022 10:25:37 AM
ZYXI,"MFGP, OMER and ZYXI among mid-day movers",6/22/2022 4:54:19 PM
ZYXI,Zynex announces additional $10M buyback,6/9/2022 1:13:46 PM
ZYXI,"ACCD Guides Q1 Well Below Analysts' Estimates, ALNY Cuts Outlook, NVCR Braces For Busy Year ",4/29/2022 11:15:58 AM
ZYXI,"Zynex GAAP EPS of $0.03 misses by $0.02, revenue of $31.08M beats by $0.06M",4/28/2022 8:13:34 PM
ZYXI,Notable earnings after Thursday's close,4/27/2022 9:35:10 PM
ZYXI,Zynex launches $10M share buyback program,4/11/2022 1:37:49 PM
ZYXI,"The Daily Biotech Pulse: Evotec Earns $16M Milestone Payment, Genmab Hit With Adverse Tribunal Ruling, Quidel Announces Above-Consensus Q1 Revenues And More",4/8/2022 1:52:26 PM
ZYXI,"SRAD, ZYXI and HCAT among after hour movers",3/25/2022 9:45:56 PM
ZYXI,"Catalyst watch for next week: GE Investor Day, Apple event and AT&T spotlight",3/4/2022 8:00:51 PM
ZYXI,"Zynex GAAP EPS of $0.23 beats by $0.04, revenue of $40.37M misses by $0.95M",2/24/2022 9:38:44 PM
ZYXI,Notable earnings after Thursday's close,2/23/2022 10:35:44 PM
ZYXI,70 Biggest Movers From Friday,2/22/2022 10:43:28 AM
ZYXI,42 Stocks Moving In Friday's Mid-Day Session,2/18/2022 6:04:29 PM
ZYXI,"Zynex, down 19%, hits 52-week low as it is dropped from UnitedHealth network",2/17/2022 6:46:51 PM
ZYXI,Zynex boosts profitability outlook: Q4 Prelim,1/18/2022 2:36:42 PM
ZYXI,Zynex files for FDA approval of fluid monitoring system,1/3/2022 3:02:47 PM
ZYXI,Zynex acquires Kestrel Labs for $31M,12/23/2021 2:14:39 PM
ZYXI,59 Biggest Movers From Yesterday,12/14/2021 11:15:51 AM
ZYXI,40 Stocks Moving In Monday's Mid-Day Session,12/13/2021 7:08:16 PM
ZYXI,Zynex declares $0.10 special dividend,11/10/2021 3:21:19 PM
ZYXI,Zynex Rises On Sharp Increase In Earnings Above Estimates ,11/3/2021 3:53:13 PM
ZYXI,"Zynex EPS beats by $0.05, misses on revenue",11/2/2021 8:21:25 PM
ZYXI,Notable earnings after Tuesday's close,11/1/2021 9:35:55 PM
ZYXI,"The Daily Biotech Pulse: J&J Files For Booster Dose Authorization, Gemini Restructures, Strata Skin CFO Departs, Kaleido Reports Positive Readout",10/5/2021 2:01:45 PM
ZYXI,"The Daily Biotech Pulse: Merck Rallies On Antiviral Pill Data, Gilead Files For Yescarta Label Expansion, Exscientia IPO",10/1/2021 1:56:15 PM
ZYXI,"The Daily Biotech Pulse: Merck Confirms Acceleron Purchase, Regeneron Touts COVID-19 Antibody Cocktail Data, Takeda In-Licenses Huntington's Disease Drug",9/30/2021 1:43:13 PM
ZYXI,"The Daily Biotech Pulse: AbbVie's Migraine Drug OK'd By FDA, Amicus Spins Off Gene Therapy Business, Geovax In-Licenses Cancer Drug",9/29/2021 2:13:41 PM
ZYXI,"The Daily Biotech Pulse: Eisai, Biogen Pursue Approval Of Second Alzheimer's Treatment; Sanofi Changes mRNA Strategy; GSK Subsidiary To Develop Long-Acting HIV Preventive",9/28/2021 2:18:52 PM
ZYXI,"The Daily Biotech Pulse: Leap, Phio, Silverback Among Early Movers On Oncology Conference Presentations, Aerie Slumps On Mixed Data, Axsome Commences Phase 3 Sleep Disorder Study",9/16/2021 1:48:49 PM
ZYXI,"The Daily Biotech Pulse: Lilly, Regeneron Ink COVID-19 Drug Deal With US, Regulatory Setback For Calliditas, Theravance To Cut 75% Jobs, 4 IPOs",9/15/2021 1:38:39 PM
ZYXI,63 Biggest Movers From Friday,8/2/2021 11:13:12 AM
ZYXI,41 Stocks Moving In Friday's Mid-Day Session,7/30/2021 5:58:10 PM
ZYXI,Zynex Announces 2021 Second Quarter Earnings,7/29/2021 10:01:00 PM
ZYXI,Zynex is about to announce earnings — here's what Wall Street expects,7/27/2021 3:02:14 PM
ZYXI,Zynex Schedules 2021 Second Quarter Earnings Call,7/21/2021 3:15:00 PM
ZYXI,"Benzinga's Top Ratings Upgrades, Downgrades For July 16, 2021",7/16/2021 4:15:27 PM
ZYXI,Zynex Announces 247% Order Growth and Increases Q2 Adjusted EBITDA Estimate,7/15/2021 3:15:00 PM
ZYXI,Zynex to Present at the Ladenburg Thalmann Virtual Annual Healthcare Conference,7/8/2021 3:15:00 PM
ZYXI,"Cramer Gives His Opinion On Virgin Galactic, Zynex And More",7/1/2021 1:28:48 PM
ZYXI,"Zynex EPS beats by $0.01, beats on revenue; outlook",4/29/2021 8:07:09 PM
ZYXI,"Zynex 1Q21 orders grow 140% Y/Y, sees revenues estimates in-line",4/12/2021 3:46:16 PM
ZYXI,"Benzinga's Top Ratings Upgrades, Downgrades For March 9, 2021",3/9/2021 4:07:00 PM
ZYXI,Zynex announces $10M buyback program,3/8/2021 5:46:26 PM
ZYXI,72 Biggest Movers From Friday,3/1/2021 10:56:51 AM
ZYXI,48 Stocks Moving In Friday's Mid-Day Session,2/26/2021 6:09:02 PM
ZYXI,"Benzinga's Top Ratings Upgrades, Downgrades For January 29, 2021",1/29/2021 4:04:37 PM
ZYXI,Zynex announces filing of patent for sepsis monitor,1/14/2021 9:15:32 PM
ZYXI,"Zynex sees Q4 and FY20 revenue in-line with consensus, increases Adj. EBITDA estimate",1/12/2021 3:25:32 PM
ZYXI,Zynex announces second utility patent for its blood volume monitor,1/6/2021 5:44:04 PM
ZYXI,ZYXI: Zynex Medical – Disruption Creates Opportunity,1/4/2021 11:01:28 AM
ZYXI,Zynex hires President and COO of Monitoring Solutions Division,10/23/2020 1:25:50 PM
ZYXI,"DDS, WIMI, SOL and FBIO among midday movers",10/12/2020 4:45:34 PM
ZYXI,Zynex growth leads to to newer facility,10/6/2020 1:27:35 PM
ZYXI,Stock Alert: Zynex Slips 10% ,7/15/2020 4:20:42 PM
ZYXI,Stock To Watch: Zynex Inc. (ZYXI) ,7/10/2020 10:40:03 AM
ZYXI,7 A-Rated Growth Stocks That Are Loaded With Long-Term Potential,6/18/2020 7:19:33 PM
ZYXI,Reata Pharmaceuticals leads healthcare gainers; Mustang Bio and Curis among losers,6/11/2020 3:00:03 PM
ZYXI,Zynex +9.1% on move into SmallCap 600,6/10/2020 9:37:42 PM
ZYXI,"Zynex EPS beats by $0.03, beats on revenue",4/28/2020 8:04:17 PM
ZYXI,Zynex is about to announce its earnings — here's what Wall Street expects,2/26/2020 3:02:11 PM
ZYXI,"ENLV leads healthcare gainers, MREO and CYH among losers",2/24/2020 3:58:52 PM
ZYXI,"Today's Top 5 Gainers In Healthcare Sector (SRNE, MDCO, RAPT...) ",11/26/2019 2:59:06 AM
ZYXI,"Zynex: No Pain, All Gain... ",10/22/2019 2:15:19 PM
ZYXI,7 Stocks to Buy Down 10% in the Past Week,8/28/2019 3:37:40 PM
ZYXI,Zynex is about to announce its earnings — here's what to expect,7/29/2019 3:02:47 PM
ZYXI,Here's what Wall Street expects from Zynex's earnings report,4/28/2019 3:02:09 PM
ZYXI,Here's what Wall Street expects from Zynex's earnings report,2/24/2019 3:01:31 PM
ZYXI,Here's what Wall Street expects from Zynex's earnings,11/4/2018 3:01:58 PM
ZYXI,Zynex earnings: here's what to expect,7/31/2018 3:02:53 PM
ZYXI,Zynex Recognized in Top 100 Public Companies by ColoradoBiz,5/23/2018 3:16:00 PM
ZYXI,Zynex Announces Share Buyback Program,5/14/2018 3:11:00 PM
ZYXI,Zynex Announces 2018 First Quarter Earnings,5/8/2018 3:19:00 PM
ZYXI,Zynex Schedules 2018 First Quarter Earnings Release and Webcast,5/1/2018 3:14:00 PM
ZYXI,Neurocrine Biosciences Reports First Quarter 2018 Financial Results,4/30/2018 10:01:00 PM
ZYXI,OTCQX And OTCQB Companies to Present At 2018 ROTH Conference,3/8/2018 4:00:00 PM
ZYXI,Zynex Appoints New Independent Board Member,3/6/2018 7:14:00 PM
ZYXI,Zynex Announces 2017 Fourth Quarter Earnings,2/28/2018 3:05:00 PM
ZYXI,Zynex Schedules 2017 Fourth Quarter and Full Year Earnings Release and Webcast,2/22/2018 3:24:00 PM
ZYXI,Zynex introduces the NeuroMove™ Device to its expanding sales force,2/1/2018 3:20:00 PM
ZYXI,Zynex Appoints Two New Independent Board of Directors,1/12/2018 7:24:00 PM
ZYXI,Electronic Exchange of POLST and Advance Directive Forms Between Hospitals and Post-Acute Care Providers Made Easier with Care Directives and Kno2 Partnership,1/10/2018 1:03:00 PM
ZYXI,Zynex Announces 4th Quarter and Year-End Revenue Guidance Update,1/8/2018 3:04:00 PM
ZYXI,Zynex Announces Share Buyback Program,12/6/2017 4:41:00 PM
ZYXI,Zynex Announces Webinar to Address the US Opioid Epidemic,11/28/2017 4:39:00 PM
ZYXI,PRMCA Asks the Cannabis Community to Support Hurricane Maria Relief Efforts,11/17/2017 9:47:00 PM
ZYXI,Zynex Announces 2017 Third Quarter Earnings,11/13/2017 2:55:00 PM
ZYXI,Zynex Schedules 2017 Third Quarter Earnings Release and Webcast,11/7/2017 3:11:00 PM
ZYXI,Zynex Presentation Now Available for On-Demand Viewing,11/6/2017 2:31:00 PM
ZYXI,"Live Investor Conference & Webinar: NASDAQ, NYSE and OTC companies present November 2nd",10/30/2017 3:41:00 PM
ZYXI,Zynex Growth Leads to a New Corporate Headquarters,10/27/2017 3:22:00 PM
ZYXI,Zynex to Present at the SeeThruEquity Disruptive Growth Company Showcase,9/21/2017 3:05:00 PM
ZYXI,Zynex Continues Fight Against Opioid Abuse and Expands Its Arsenal of Pain Relief Products,9/18/2017 5:12:00 PM
ZYXI,Zynex Announces 2017 Second Quarter Earnings,8/14/2017 3:05:00 PM
ZYXI,Zynex Schedules 2017 Second Quarter Earnings Release and Webcast,8/7/2017 3:16:00 PM
ZYXI,Zynex Recognized in Top 100 Public Companies by ColoradoBiz,6/19/2017 3:21:00 PM
ZYXI,Zynex Hires Chief Financial Officer,6/9/2017 3:12:00 PM
ZYXI,Zynex Announces 2017 First Quarter Results,5/15/2017 3:05:00 PM
ZYXI,Zynex Schedules 2017 First Quarter Earnings Release and Webcast,5/12/2017 3:25:00 PM
ZYXI,Zynex Announces 2016 Year End Results,4/3/2017 4:55:00 PM
