Ticker,Title,Link
SKIN,Hold Rating on Beauty Health Amidst Sales Decline and Prospects for Recovery,8/12/2024 11:18:07 AM
SKIN,Maintaining Hold on Beauty Health Amidst Downgraded Projections and Segment Struggles,8/9/2024 8:25:37 PM
SKIN,"The Beauty Health GAAP EPS of -$0.10 misses by $0.05, revenue of $90.6M misses by $7.95M",8/8/2024 9:36:41 PM
SKIN,The Beauty Health Company Registered A earnings preview: what to expect,8/7/2024 3:01:13 PM
SKIN,Stifel Nicolaus Sticks to Their Hold Rating for Beauty Health (SKIN),7/26/2024 12:33:39 PM
SKIN,Unveiling 4 Analyst Insights On Beauty Health,7/11/2024 5:00:23 PM
SKIN,Hims & Hers Health and BTC Digital among Consumer Staples movers,5/20/2024 3:09:49 PM
SKIN,Beauty Health (SKIN) Receives a Buy from D.A. Davidson,5/13/2024 12:25:20 PM
SKIN,"NVAX, GRPN and MVIS among mid-day movers",5/10/2024 4:57:54 PM
SKIN,"The Beauty Health GAAP EPS of -$0.10 beats by $0.04, revenue of $81.4M beats by $0.75M",5/9/2024 9:27:36 PM
SKIN,The Beauty Health Q1 2024 Earnings Preview,5/8/2024 9:35:25 PM
SKIN,Why Lifecore Biomedical Shares Are Trading Lower By Around 32%? Here Are Other Stocks Moving In Wednesday's Mid-Day Session,3/20/2024 7:03:46 PM
SKIN,Benchmark Co. Keeps Their Hold Rating on Beauty Health (SKIN),3/18/2024 11:06:14 AM
SKIN,Beauty Health (SKIN) Gets a Buy from D.A. Davidson,3/15/2024 12:35:40 PM
SKIN,Analyst Expectations For Beauty Health's Future,3/14/2024 7:00:20 PM
SKIN,Dow Surges Over 100 Points; Dollar Tree Earnings Miss Expectations,3/13/2024 7:32:51 PM
SKIN,Beauty Health Names Marla Beck CEO ,3/12/2024 10:12:42 PM
SKIN,Notable earnings after Tuesday's close,3/11/2024 9:35:46 PM
SKIN,"HNST, KR among consumer staples movers",3/7/2024 4:05:24 PM
SKIN,"Analysts Offer Insights on Consumer Cyclical Companies: Beauty Health (SKIN), Sweetgreen (SG) and Birkenstock Holding plc (BIRK)",3/1/2024 12:51:24 PM
SKIN,The Beauty Health Company Registered A earnings: here's what to expect,2/29/2024 3:01:13 PM
SKIN,The Beauty Health Q4 2023 Earnings Preview,2/28/2024 10:35:14 PM
SKIN,Watch out above - these highly-shorted stocks are pushing higher,1/22/2024 4:54:46 PM
SKIN,"ROSEN, A RESPECTED AND LEADING FIRM, Encourages The Beauty Health Company Investors to Secure Counsel Before Important Deadline in Securities Class Action - SKIN",1/1/2024 6:00:00 PM
SKIN,"Iovance Biotherapeutics, Nio, NetEase And Other Big Stocks Moving Lower On Wednesday",12/27/2023 6:27:30 PM
SKIN,"ROSEN, NATIONAL TRIAL LAWYERS, Encourages The Beauty Health Company Investors with Losses to Secure Counsel Before Important Deadline in Securities Class Action - SKIN",12/25/2023 8:26:00 PM
SKIN,Piper Sandler Sticks to Its Sell Rating for Beauty Health (SKIN),12/14/2023 12:37:00 PM
SKIN,"ROSEN, TRUSTED INVESTOR COUNSEL, Encourages The Beauty Health Company Investors with Losses to Secure Counsel Before Important Deadline in Securities Class Action - SKIN",12/12/2023 11:15:00 PM
SKIN,"From 'chunky' dad shoes to laminated eyebrows, a millennial mom broke down the Gen Z trends she said she won't be 'gaslit' into adopting",11/29/2023 11:06:01 PM
SKIN,Benchmark Co. Sticks to Its Hold Rating for Beauty Health (SKIN),11/28/2023 12:05:51 PM
SKIN,"SHAREHOLDER ALERT: The Law Offices of Vincent Wong Remind Beauty Health Investors of a Lead Plaintiff Deadline of January 16, 2024",11/27/2023 11:45:00 AM
SKIN,"ROSEN, A LEADING INVESTOR RIGHTS LAW FIRM, Encourages The Beauty Health Company Investors to Secure Counsel Before Important Deadline in Securities Class Action - SKIN",11/26/2023 9:00:00 PM
SKIN,"Analysts Offer Insights on NA Companies: Installed Building Products (IBP), Burlington Stores (BURL) and Beauty Health (SKIN)",11/24/2023 12:10:50 PM
SKIN,Why American Eagle Shares Are Trading Lower By Around 16%? Here Are Other Stocks Moving In Tuesday's Mid-Day Session,11/21/2023 7:28:06 PM
SKIN,GLOBALLY RECOGNIZED ROSEN LAW FIRM Encourages The Beauty Health Company Investors to Secure Counsel Before Important Deadline in Securities Class Action - SKIN,11/19/2023 5:15:00 AM
SKIN,Wix.com To Rally Over 40%? Here Are 10 Top Analyst Forecasts For Wednesday,11/15/2023 2:17:05 PM
SKIN,Why Beyond Air Shares Are Trading Lower By Around 37%? Here Are Other Stocks Moving In Tuesday's Mid-Day Session,11/14/2023 8:05:46 PM
SKIN,The Beauty Health Company Stock Is Plunging After Hours - Here's Why,11/13/2023 11:14:11 PM
SKIN,Buy Rating Justified for Beauty Health’s Stock (SKIN) Amid Collaboration with Prestige Brand Dr. Dennis Gross,11/9/2023 7:20:58 PM
SKIN,Analysts Offer Insights on NA Companies: Beauty Health (SKIN) and Stellantis (STLA),10/31/2023 11:20:06 AM
SKIN,Why InMode Shares Are Trading Lower By 20%? Here Are Other Stocks Moving In Thursday's Mid-Day Session,10/12/2023 6:55:08 PM
SKIN,Hydrafacial Brand Owner Beauty Health Plans To Initiate Stock Repurchase Program Next Week,9/20/2023 6:03:35 PM
SKIN,Analyst Expectations for Beauty Health's Future,9/13/2023 7:00:29 PM
SKIN,Why CS Disco Are Trading Lower By 22%? Here Are Other Stocks Moving In Tuesday's Mid-Day Session,9/12/2023 7:45:09 PM
SKIN,Analyst Expectations for Beauty Health's Future,8/25/2023 4:00:55 PM
SKIN,"Beauty Health jumps as management, board buy shares after year-long dip",8/18/2023 7:23:08 PM
SKIN,"Analysts’ Opinions Are Mixed on These NA Stocks: Beauty Health (SKIN), SeaWorld (SEAS) and Target Hospitality (TH)",8/14/2023 2:10:08 AM
SKIN,J.P. Morgan Remains a Hold on Beauty Health (SKIN),8/12/2023 12:16:14 PM
SKIN,Beauty Health Clocks 13% Growth In Q2 Revenues On Strong Demand For Hydrafacial,8/9/2023 5:46:44 PM
SKIN,Expert Ratings for Beauty Health,8/8/2023 5:00:26 PM
SKIN,Beauty Health gets FDA clearance for microneedling device for acne scarring,8/2/2023 3:15:41 PM
SKIN,The 3 Best Beauty Stocks to Buy for the Back-to-Office Boom,6/26/2023 8:56:37 PM
SKIN,Crude Oil Rises 2%; LumiraDx Shares Spike Higher,6/21/2023 9:04:02 PM
SKIN,Analysts’ Opinions Are Mixed on These NA Stocks: Beauty Health (SKIN) and Skechers USA (SKX),6/15/2023 12:05:00 PM
SKIN,Short Interest Sector Focus: Consumer Defensive Sector,6/5/2023 3:40:05 PM
SKIN,"Analysts Offer Insights on NA Companies: The Lovesac Company (LOVE), Beauty Health (SKIN) and Costco (COST)",6/2/2023 1:40:11 PM
SKIN,Why Hibbett Shares Are Trading Lower By 10%? Here Are Other Stocks Moving In Friday's Mid-Day Session,5/26/2023 6:48:36 PM
SKIN,7 Short-Squeeze Stocks Set for a May Rally,5/22/2023 9:38:33 PM
SKIN,Benchmark Co. Reaffirms Their Buy Rating on Beauty Health (SKIN),5/18/2023 4:25:13 PM
SKIN,Where Beauty Health Stands With Analysts,5/11/2023 4:00:30 PM
SKIN,"Analysts Offer Insights on Healthcare Companies: Mersana Therapeutics (MRSN), Twist Bioscience (TWST) and Beauty Health (SKIN)",5/10/2023 12:21:13 PM
SKIN,The Beauty Health Q1 2023 Earnings Preview,5/9/2023 5:01:43 PM
SKIN,Short Interest Sector Focus: Consumer Defensive Sector,4/21/2023 2:54:34 PM
SKIN,7 Short-Squeeze Stocks That Could Make You Rich,4/13/2023 7:12:55 PM
SKIN,"Analysts Are Bullish on These Healthcare Stocks: Beauty Health (SKIN), Rain Therapeutics (RAIN)",3/31/2023 11:50:29 AM
SKIN,Canaccord Genuity Sticks to Their Buy Rating for Beauty Health (SKIN),3/28/2023 12:35:24 PM
SKIN,Exane BNP Paribas upgrades Beauty Health (SKIN) to a Hold,3/20/2023 4:27:06 PM
SKIN,4 Analysts Have This to Say About Beauty Health,3/14/2023 5:01:50 PM
SKIN,J.P. Morgan Keeps Their Hold Rating on Beauty Health (SKIN),3/3/2023 12:05:59 PM
SKIN,Sarepta Therapeutics To Rally Over 53%? Here Are 10 Other Analyst Forecasts For Wednesday,3/1/2023 1:55:38 PM
SKIN,Why Titan International Shares Are Trading Lower By Around 22%? Here Are Other Stocks Moving In Tuesday's Mid-Day Session,2/28/2023 6:54:30 PM
SKIN,The Beauty Health Q4 2022 Earnings Preview,2/27/2023 6:10:06 PM
SKIN,Beauty Health Launches Skin Renewal Booster In Partnership With Hungarian Skincare Brand Omorovicza,2/21/2023 10:48:24 AM
SKIN,Beauty Health falls amid new short report from The Bear Cave,2/16/2023 5:45:17 PM
SKIN,Bausch + Lomb names Brent Saunders as new CEO,2/15/2023 12:14:28 PM
SKIN,Top 5 Defensive Stocks That May Fall Off A Cliff In February,2/8/2023 1:20:37 PM
SKIN,7 Short-Squeeze Stocks to Buy Before They Soar,1/30/2023 7:24:37 PM
SKIN,Meme traders are battling shorts again - watch these stocks,1/14/2023 2:46:20 PM
SKIN,What 6 Analyst Ratings Have To Say About Beauty Health,11/23/2022 6:06:58 PM
SKIN,Stifel Nicolaus Keeps Their Buy Rating on Beauty Health (SKIN),11/12/2022 2:06:08 AM
SKIN,Why Merrimack Pharmaceuticals Shares Jumped Around 213%; Here Are 114 Biggest Movers From Yesterday,11/10/2022 11:12:56 AM
SKIN,What 6 Analyst Ratings Have To Say About Beauty Health,11/9/2022 8:16:27 PM
SKIN,"James Hardie Industries, R1 RCM, Lyft among premarket losers' pack",11/8/2022 1:41:26 PM
SKIN,The Beauty Health Q3 2022 Earnings Preview,11/7/2022 5:45:47 PM
SKIN,"APRN, SKIN and ALLG are among consumer movers",9/28/2022 3:24:01 PM
SKIN,"Why Bellerophon Therapeutics Shares Are Trading Higher By 24%, Here Are 44 Stocks Moving In Tuesday's Mid-Day Session",9/27/2022 6:23:41 PM
SKIN,Expert Ratings for Beauty Health,9/16/2022 7:07:09 PM
SKIN,Beauty Health Company Adds 6% On Optimistic Financial Outlook ,9/15/2022 4:40:44 PM
SKIN,"Catalyst watch: Amgen data, Starbucks & Roblox events and Twitter vote on Elon Musk deal",9/9/2022 7:00:17 PM
SKIN,Analyst Ratings for Beauty Health,8/10/2022 2:04:43 PM
SKIN,"Beauty Health Down 8% Despite Improved Results, Guidance ",8/9/2022 3:54:27 PM
SKIN,The Beauty Health Q2 2022 Earnings Preview,8/8/2022 5:29:40 PM
SKIN,The Beauty Health Company Registered Shs -A- hosts conference call for investors,8/6/2022 2:45:00 PM
SKIN,Today’s Biggest Pre-Market Stock Movers: 10 Top Gainers and Losers on Tuesday,7/26/2022 11:29:16 AM
SKIN,5 Analysts Have This to Say About Beauty Health,6/30/2022 5:04:06 PM
SKIN,People are going out again - these stocks are soaring,5/27/2022 5:56:44 PM
SKIN,50 Stocks Moving In Tuesday's Mid-Day Session,5/24/2022 6:11:52 PM
SKIN,Piper Sandler Maintains Overweight Rating for Beauty Health: Here's What You Need To Know,5/11/2022 6:03:41 PM
SKIN,"The Beauty Health GAAP EPS of -$0.13 misses by $0.12, revenue of $75.42M beats by $7.27M",5/10/2022 8:09:43 PM
SKIN,The Beauty Health Q1 2022 Earnings Preview,5/9/2022 9:35:20 PM
SKIN,Expert Ratings for Beauty Health,4/28/2022 8:21:41 PM
SKIN,Baxter cut to Sell as Goldman Sachs flags macro risks in MedTech space,4/4/2022 2:10:57 PM
SKIN,"Benzinga's Top Ratings Upgrades, Downgrades For March 11, 2022",3/11/2022 4:28:33 PM
SKIN,63 Biggest Movers From Yesterday,2/24/2022 10:49:53 AM
SKIN,Mid-Afternoon Market Update: U.S. Stocks Extend Losses; Dow Dips 300 Points,2/23/2022 8:31:06 PM
SKIN,"The Beauty Health GAAP EPS of -$0.12 misses by $0.09, revenue of $77.9M beats by $7M",2/22/2022 9:44:14 PM
SKIN,Notable earnings after Tuesday's close,2/21/2022 10:35:19 PM
SKIN,The Beauty Health Company appoints Andrew Stanleick as President and CEO,1/20/2022 12:22:37 PM
SKIN,60 Biggest Movers From Yesterday,1/11/2022 10:52:59 AM
SKIN,"Lululemon Athletica, DexCom, Take-Two Interactive Software among premarket losers' pack",1/10/2022 2:11:34 PM
SKIN,"Benzinga's Top Ratings Upgrades, Downgrades For January 7, 2022",1/7/2022 4:38:12 PM
SKIN,76 Biggest Movers From Yesterday,11/11/2021 11:29:59 AM
SKIN,55 Stocks Moving In Wednesday's Mid-Day Session,11/10/2021 6:05:54 PM
SKIN,"The Beauty Health EPS misses by $1.61, beats on revenue",11/9/2021 9:30:50 PM
SKIN,"November SPAC Merger Calendar: Upcoming Votes, Earnings, Stocks To Watch",11/1/2021 10:11:00 PM
SKIN,"Catalyst watch for next week: FOMC and OPEC meetings, Beyond Meat hits McDonald's stores and more eyes on crypto",10/29/2021 7:00:57 PM
SKIN,"Benzinga's Top Ratings Upgrades, Downgrades For October 8, 2021",10/8/2021 5:52:27 PM
SKIN,"Benzinga's Top Ratings Upgrades, Downgrades For October 4, 2021",10/4/2021 4:02:09 PM
SKIN,48 Biggest Movers From Yesterday,9/10/2021 11:16:24 AM
SKIN,78 Biggest Movers From Friday,8/16/2021 11:12:54 AM
SKIN,53 Stocks Moving In Friday's Mid-Day Session,8/13/2021 6:00:09 PM
SKIN,The Beauty Health EPS of -$1.52,8/10/2021 8:30:53 PM
SKIN,"Benzinga's Top Ratings Upgrades, Downgrades For July 19, 2021",7/19/2021 4:03:42 PM
SKIN,The Beauty Health Co.'s First-Mover Advantages Have Turned Goldman Sachs Analysts Bullish,7/1/2021 7:41:17 PM
SKIN,One In Five Russell 3000 Additions Went Public Via SPAC: What Investors Should Know,6/28/2021 6:12:59 PM
SKIN,The Beauty Health Company expands its global direct market presence,6/24/2021 12:54:42 PM
SKIN,"A ""category creator,"" Canaccord initiates Beauty Health as a buy; shares up 3%",6/15/2021 6:27:38 PM
SKIN,XL Fleet gets added to Russell Microcap: At the Rebalance,6/14/2021 9:28:21 PM
