Ticker,Title,Link
SERA,TD Cowen Sticks to Their Buy Rating for Sera Prognostics (SERA),8/8/2024 4:26:28 AM
SERA,"Sera Prognostics GAAP EPS of -$0.25 beats by $0.02, revenue of $0.02M misses by $0.08M",8/7/2024 8:32:01 PM
SERA,Sera Prognostics A earnings: here's what to expect,8/6/2024 3:01:13 PM
SERA,"Sera Prognostics joins Russell 2000, Russell 3000 indexes",7/1/2024 3:11:05 PM
SERA,3 Stocks Under $10 With the Potential to Make You a Millionaire,6/16/2024 10:17:00 AM
SERA,SERA Stock Earnings: Sera Prognostics Beats EPS for Q1 2024,5/9/2024 12:57:18 AM
SERA,Sera Prognostics GAAP EPS of -$0.25 beats by $0.02,5/8/2024 9:05:57 PM
SERA,Sera Prognostics A is about to announce its earnings — here's what Wall Street expects,5/7/2024 3:01:13 PM
SERA,Why JPMorgan Shares Are Trading Lower By Around 5%? Here Are Other Stocks Moving In Friday's Mid-Day Session,4/12/2024 8:47:24 PM
SERA,"iBio, Mesoblast, Kodiak Sciences among healthcare movers",3/28/2024 2:01:50 PM
SERA,"Aehr Test Systems Reports Preliminary Results, Joins Dyne Therapeutics, United Airlines And Other Big Stocks Moving Lower On Monday",3/25/2024 3:32:03 PM
SERA,Wall Street Analysts Are Bullish on Top Healthcare Picks,3/21/2024 4:20:10 AM
SERA,"Sera Prognostics GAAP EPS of -$0.25 in-line, revenue of $0.04M misses by $0.01M",3/20/2024 8:16:17 PM
SERA,Notable earnings after Wednesday's close,3/19/2024 9:35:34 PM
SERA,Gold Moves Higher; Campbell Soup Earnings Top Expectations,12/6/2023 8:45:02 PM
SERA,SERA PROGNOSTICS TO PRESENT AT 35TH ANNUAL PIPER SANDLER HEALTHCARE CONFERENCE,11/22/2023 7:00:00 PM
SERA,Sera Prognostics (SERA) Gets a Buy from TD Cowen,11/10/2023 5:56:22 AM
SERA,SERA PROGNOSTICS REPORTS THIRD QUARTER 2023 FINANCIAL RESULTS,11/8/2023 10:05:00 PM
SERA,What Wall Street expects from Sera Prognostics A's earnings,11/7/2023 3:01:13 PM
SERA,"Sera Prognostics Announces Conference Call and Webcast of Third Quarter Fiscal Year 2023 Financial Results on November 8, 2023",10/25/2023 2:30:00 PM
SERA,SERA PROGNOSTICS TO PRESENT AT CANTOR FITZGERALD GLOBAL HEALTHCARE CONFERENCE 2023,9/21/2023 2:30:00 PM
SERA,SERA PROGNOSTICS REPORTS SECOND QUARTER 2023 FINANCIAL RESULTS,8/9/2023 10:05:00 PM
SERA,Here's what Wall Street expects from Sera Prognostics A's earnings report,8/8/2023 3:01:13 PM
SERA,"Sera Prognostics Announces Conference Call and Webcast of Second Quarter Fiscal Year 2023 Financial Results on August 9, 2023",7/31/2023 2:30:00 PM
SERA,Sera Prognostics Announces Commercial Changes and Actions to Optimize Business for Market Success Toward Accelerating Test Adoption and Revenue,5/25/2023 10:15:00 PM
SERA,Sera Prognostics Announces Retirement of President and CEO Dr. Greg Critchfield and Appointment of Board Member Zhenya Lindgardt as Interim CEO,5/15/2023 11:15:00 PM
SERA,SERA PROGNOSTICS REPORTS FIRST QUARTER 2023 FINANCIAL RESULTS,5/10/2023 10:05:00 PM
SERA,Here's what Wall Street expects from Sera Prognostics A's earnings report,5/9/2023 3:01:13 PM
SERA,"Sera Prognostics Announces Conference Call and Webcast of First Quarter Fiscal Year 2023 Financial Results on May 10, 2023",4/27/2023 2:30:00 PM
SERA,SERA PROGNOSTICS REPORTS FOURTH QUARTER 2022 FINANCIAL RESULTS,3/22/2023 9:05:00 PM
SERA,Sera Prognostics A earnings preview: what Wall Street is expecting,3/21/2023 3:01:13 PM
SERA,"Sera Prognostics Announces Conference Call and Webcast of Fourth Quarter and Fiscal Year 2022 Financial Results on March 22, 2023",3/9/2023 10:05:00 PM
SERA,Why Catalyst Biosciences Shares Are Trading Higher By 105%; Here Are 20 Stocks Moving Premarket,2/28/2023 1:57:23 PM
SERA,SERA PROGNOSTICS TO PRESENT AT UPCOMING MARCH INVESTOR CONFERENCES,2/23/2023 10:20:00 PM
SERA,"Pinduoduo, JD.com, DocuSign among premarket losers' pack",2/21/2023 1:41:19 PM
SERA,"FATE, TVTX and IMAB are among after hour movers",2/17/2023 10:28:04 PM
SERA,Why Axcella Health Shares Are Trading Higher By 54%; Here Are 20 Stocks Moving Premarket,2/16/2023 1:54:30 PM
SERA,Nasdaq Surges 90 Points; Credo Technology Group Shares Slide,2/15/2023 8:43:39 PM
SERA,FORS MARSH TO INCLUDE THE PreTRM® TEST IN ITS EMPLOYEE MATERNITY BENEFITS PACKAGE IN COLLABORATION WITH SERA PROGNOSTICS,11/29/2022 2:30:00 PM
SERA,SERA PROGNOSTICS ANNOUNCES PUBLICATION OF DATA PREDICTING CLINICAL UTILITY AND COST EFFECTIVENESS OF THE PRETRM® TEST-AND-TREAT STRATEGY ACROSS DIVERSE POPULATIONS,11/15/2022 2:30:00 PM
SERA,SERA PROGNOSTICS REPORTS THIRD QUARTER 2022 FINANCIAL RESULTS,11/9/2022 10:05:00 PM
SERA,Here's what Wall Street expects from Sera Prognostics A's earnings report,11/8/2022 3:01:13 PM
SERA,Sera Prognostics Announces Conference Call and Webcast of Third Quarter Fiscal Year 2022 Financial Results on November 9,10/27/2022 10:05:00 PM
SERA,SONRAVA HEALTH TO INCLUDE THE PreTRM® TEST IN ITS EMPLOYEE MATERNITY BENEFITS PACKAGE IN COLLABORATION WITH CEREBRAE AND SERA PROGNOSTICS,10/4/2022 2:30:00 PM
SERA,"BANNER HEALTH, SERA PROGNOSTICS TEAM UP TO PROVIDE PreTRM® TEST TO COVERED PREGNANT MEMBERS",9/22/2022 2:30:00 PM
SERA,Why Allena Pharmaceuticals Tumbled Over 30%; Here Are 85 Biggest Movers From Yesterday,9/7/2022 11:16:07 AM
SERA,"Why HyreCar Is Trading Higher By 60%, Here Are 63 Stocks Moving In Tuesday's Mid-Day Session",9/6/2022 7:36:41 PM
SERA,SERA PROGNOSTICS REPORTS SECOND QUARTER 2022 FINANCIAL RESULTS,8/10/2022 10:05:00 PM
SERA,Here's what Wall Street expects from Sera Prognostics A's earnings,8/9/2022 3:01:13 PM
SERA,Sera Prognostics Announces Conference Call and Webcast of Second Quarter Fiscal Year 2022 Financial Results on August 10,7/28/2022 2:30:00 PM
SERA,"InflaRx Climbs More Than 40%, Here's 58 Biggest Movers From Yesterday",6/29/2022 10:25:38 AM
SERA,Why Is Ceragon Networks Surging By 19%? 41 Stocks Moving In Tuesday's Mid-Day Session,6/28/2022 6:17:09 PM
SERA,"Carnival Surges Over 12%, Here's 75 Biggest Movers From Friday",6/27/2022 10:26:40 AM
SERA,SERA PROGNOSTICS TO PRESENT AT 42nd ANNUAL WILLIAM BLAIR GROWTH STOCK CONFERENCE,6/6/2022 8:15:00 PM
SERA,SERA PROGNOSTICS ANNOUNCES PUBLICATION OF DATA DEMONSTRATING IMPROVED PERFORMANCE OF ITS PRETRM® TEST WITH MORE PRECISE GESTATIONAL AGE,5/19/2022 10:15:00 PM
SERA,SERA PROGNOSTICS PRESENTS DATA DEMONSTRATING THE HEALTH AND ECONOMIC BENEFIT OF PRETRM® TESTING AT ISPOR ANNUAL MEETING,5/18/2022 9:03:00 PM
SERA,SERA PROGNOSTICS REPORTS FIRST QUARTER 2022 FINANCIAL RESULTS,5/10/2022 10:05:00 PM
SERA,What Wall Street expects from Sera Prognostics A's earnings,5/9/2022 3:01:13 PM
SERA,"SERA PROGNOSTICS AND NEWBORN FOUNDATION PARTNER TO REDUCE RISKS ASSOCIATED WITH PRETERM BIRTH AND IMPROVE HEALTH EQUITY THROUGH THE ""EVERY MOTHER, EVERY BABY"" PROJECT",5/5/2022 2:30:00 PM
SERA,Sera Prognostics Announces Conference Call and Webcast of First Quarter Fiscal Year 2022 Financial Results on May 10,5/2/2022 2:30:00 PM
SERA,"Benzinga's Top Ratings Upgrades, Downgrades For April 27, 2022",4/27/2022 4:02:20 PM
SERA,SERA PROGNOSTICS ANNOUNCES THE APPOINTMENT OF DR. JANE F. BARLOW TO THE SERA PROGNOSTICS BOARD,4/12/2022 2:30:00 PM
SERA,Sera Prognostics downgraded to neutral at Citi following quarterly results,3/30/2022 6:24:20 PM
SERA,SERA PROGNOSTICS REPORTS FOURTH QUARTER 2021 FINANCIAL RESULTS,3/29/2022 10:00:00 PM
SERA,75 Biggest Movers From Yesterday,3/22/2022 9:42:32 AM
SERA,46 Stocks Moving In Monday's Mid-Day Session,3/21/2022 5:44:30 PM
SERA,"SERA, PGEN and CNTB among after hour movers",3/18/2022 9:41:51 PM
SERA,SERA PROGNOSTICS TO PRESENT AT UPCOMING MARCH INVESTOR CONFERENCES,3/3/2022 2:30:00 PM
SERA,SERA PROGNOSTICS PRESENTATION RESCHEDULED FOR CITI 2022 HEALTHCARE CONFERENCE,2/17/2022 2:30:00 PM
SERA,SERA PROGNOSTICS TO PRESENT AT UPCOMING FEBRUARY INVESTOR CONFERENCES,2/7/2022 2:30:00 PM
SERA,Sera Prognostics in pact with MultiPlan to expand market for PreTRM Test,2/1/2022 4:36:30 PM
SERA,48 Biggest Movers From Yesterday,1/14/2022 10:43:03 AM
SERA,SERA PROGNOSTICS ADDED TO NASDAQ BIOTECHNOLOGY INDEX,12/15/2021 2:30:00 PM
SERA,"Pre-market Movers: EFOI, EVBG, CNTX, AI, AOUT… ",12/10/2021 12:59:42 PM
SERA,"Sera Prognostics Announces Pricing For PreTRM® Test, The Only Broadly Validated Blood Test To Assess Risk Of Preterm Birth",12/2/2021 2:00:00 PM
SERA,Sera Prognostics Announces Publication Of Data Confirming The Performance Of The IBP4/SHBG Biomarkers In Diverse Non-U.S. Populations,12/1/2021 5:40:00 PM
SERA,Sera Prognostics Announces The Appointment Of Sandra A.J. Lawrence To The Sera Prognostics Board,11/30/2021 2:00:00 PM
SERA,"Benzinga's Top Ratings Upgrades, Downgrades For November 19, 2021",11/19/2021 4:08:55 PM
SERA,Sera Prognostics Reports Third Quarter 2021 Financial Results,11/9/2021 10:01:00 PM
SERA,Sera Prognostics Announces The Appointment Of Zhenya Lindgardt To The Board,11/8/2021 10:21:00 PM
SERA,"Sera Prognostics Appoints Woodrow Myers, MD, MBA As Advisor Of Public And Political Affairs",11/4/2021 1:00:00 PM
SERA,Sera Prognostics Announces Publication of the Clinical Validation of PreTRM® Threshold for Clinical Action,11/3/2021 1:00:00 PM
SERA,Sera Prognostics Announces Collaboration To Help Underserved Communities Make Informed Decisions About Prenatal Health,11/2/2021 1:00:00 PM
SERA,Sera Prognostics Announces Conference Call and Webcast of Third Quarter 2021 Financial Results on November 9,10/27/2021 2:30:00 PM
SERA,Sera Prognostics Appoints Dr. Paul Kearney as Chief Data Officer,9/28/2021 2:30:00 PM
SERA,"The Daily Biotech Pulse: Aprea Jumps On ESMO Presentation, Verrica Sinks On Regulatory Setback, Aerie CEO Quits, J&J Touts Positive COVID-19 Booster Shot Data",9/21/2021 2:20:50 PM
SERA,Sera Prognostics to be Added to Russell 2000 Index ,9/20/2021 2:30:00 PM
SERA,Sera Prognostics Appoints Dr. Michael R. Foley as Chief Medical Officer,9/15/2021 2:00:00 PM
SERA,Sera Prognostics Announces Publication of Health Economic Analysis Supporting PreTRM® Test-and-Treat Strategy to Improve Maternal and Infant Health,9/14/2021 2:00:00 PM
SERA,Sera Prognostics to Present at Oppenheimer Fall Healthcare Life Sciences & Med Tech Summit,9/13/2021 2:00:00 PM
SERA,"The Daily Biotech Pulse: Cellect Jumps On First Apograft Transplantation, AstraZeneca, European Commission Bury Legal Hatchet, Cassava Defends Itself",9/3/2021 1:31:13 PM
SERA,Sera Prognostics Reports Second Quarter 2021 Financial Results,8/30/2021 10:05:00 PM
SERA,"Sera Prognostics’ PreTRM® Test and Treat Strategy Benefits Demonstrated by Results of Prospective, Randomized Controlled Intervention Trial Evaluating Clinical Utility",8/17/2021 2:00:00 PM
SERA,"Benzinga's Top Ratings Upgrades, Downgrades For August 9, 2021",8/9/2021 4:24:01 PM
SERA,"The Week Ahead In Biotech (Aug. 8-14): Jazz Pharma FDA Decision, Earnings Deluge and IPOs In The Spotlight",8/8/2021 4:11:24 PM
SERA,61 Biggest Movers From Yesterday,8/3/2021 10:45:42 AM
SERA,"The Daily Biotech Pulse: Merck's Disappointing Q2, Atreca Falls On Data, FDA Nod For Viatris, Nuvalent, Icosavax IPOs",7/29/2021 2:18:48 PM
SERA,"The Daily Biotech Pulse: J&J, Novartis Report Solid Results, Chembio Soars On COVID Test Order, Lumos Signals Clinical Trial Delay",7/21/2021 1:52:07 PM
SERA,"The Daily Biotech Pulse: Ardelyx Sinks On Regulatory Setback, AnPac Issues Positive Preannouncement, European Nod For Myovant, HCW Biologics Debuts On Wall Street",7/20/2021 2:19:56 PM
SERA,54 Biggest Movers From Yesterday,7/16/2021 10:52:13 AM
