Ticker,Title,Link
USCB,"Analysts’ Opinions Are Mixed on These Financial Stocks: USCB Financial Holdings, Inc. Class A (USCB), 1St Source (SRCE) and Valley National Bancorp (VLY)",7/26/2024 11:00:39 AM
USCB,"USCB Financial Holdings, Inc. Reports Record Fully Diluted EPS Since Going Public of $0.31 for Q2 2024",7/25/2024 10:30:00 PM
USCB,USCB Financial A earnings preview: what Wall Street is expecting,7/24/2024 3:01:13 PM
USCB,"USCB Financial Holdings, Inc. Declares Quarterly Cash Dividend on Common Stock",7/22/2024 10:30:00 PM
USCB,"USCB Financial Holdings, Inc. to Announce Second Quarter 2024 Results",7/8/2024 10:30:00 PM
USCB,U.S. community bank earnings expected to fall by about 12% this year - report,6/11/2024 1:27:55 PM
USCB,"USCB Financial Holdings, Inc. Class A (USCB) Receives a Buy from KBW",5/31/2024 5:25:32 AM
USCB,USCB Financial Holdings Inc Registered Shs -A- hosts conference call for investors,4/26/2024 2:45:00 PM
USCB,"USCB Financial Holdings, Inc. Reports Diluted EPS of $0.23 for Q1 2024 and Announces Adoption of New 500,000 Share Repurchase Program",4/25/2024 10:30:00 PM
USCB,USCB Financial A earnings preview: what Wall Street is expecting,4/24/2024 3:01:13 PM
USCB,"USCB Financial Holdings, Inc. Declares Quarterly Cash Dividend on Common Stock",4/23/2024 10:30:58 PM
USCB,"USCB Financial Holdings, Inc. to Announce First Quarter 2024 Results",4/5/2024 9:00:00 PM
USCB,Insiders Buying Hain Celestial And 3 Other Stocks,2/15/2024 2:21:06 PM
USCB,"Piper Sandler Initiates a Hold Rating on USCB Financial Holdings, Inc. Class A (USCB)",1/30/2024 12:26:30 PM
USCB,"USCB Financial Holdings, Inc. Initiates Quarterly Cash Dividend Program and Announces Declaration of First Cash Dividend",1/29/2024 10:30:00 PM
USCB,"U.S. Century Bank GAAP EPS of $0.14, revenue of $15.7M",1/26/2024 1:37:29 PM
USCB,"USCB Financial Holdings, Inc. Reports Diluted EPS of $0.14 for Q4 2023",1/25/2024 10:45:00 PM
USCB,USCB Financial A earnings: here's what Wall Street expects,1/24/2024 3:01:13 PM
USCB,"USCB Financial Holdings, Inc. To Announce Fourth Quarter 2023 Results",1/5/2024 10:30:00 PM
USCB,U.S. Century Bank Names William Turner New Executive Vice President and Chief Credit Officer,12/7/2023 10:30:00 PM
USCB,"USCB Financial Holdings, Inc. Announces Retirement of Chief Credit Officer, Benigno Pazos; Announces the Departure of Jay Shehadeh, General Counsel; Promotes Maricarmen Logroño to Chief Risk Officer",11/2/2023 9:30:00 PM
USCB,"Piper Sandler Reaffirms Their Hold Rating on USCB Financial Holdings, Inc. Class A (USCB)",10/27/2023 10:42:22 AM
USCB,"USCB Financial Holdings, Inc. Reports Diluted EPS of $0.19 for Q3 2023",10/26/2023 10:45:00 PM
USCB,Here's what Wall Street expects from USCB Financial A's earnings,10/25/2023 3:01:13 PM
USCB,"USCB Financial Holdings, Inc. to Announce Third Quarter 2023 Results",10/6/2023 10:30:00 PM
USCB,"U.S. Century Bank GAAP EPS of $0.21 misses by $0.05, revenue of $16.01M misses by $2.01M",7/28/2023 2:45:45 PM
USCB,Here's what Wall Street expects from USCB Financial A's earnings report,7/26/2023 3:01:13 PM
USCB,"Benzinga's Top Ratings Upgrades, Downgrades For July 11, 2023",7/11/2023 5:02:24 PM
USCB,USCB Financial president and CEO takes on board chair responsibility,6/28/2023 9:03:23 PM
USCB,"USCB Financial Holdings, Inc. Class A (USCB) Receives a Buy from KBW",5/2/2023 4:25:44 PM
USCB,"Piper Sandler Remains a Hold on USCB Financial Holdings, Inc. Class A (USCB)",4/28/2023 11:16:22 AM
USCB,"U.S. Century Bank Non-GAAP EPS of $0.29 beats by $0.03, revenue of $18.07M misses by $0.02M",4/27/2023 8:52:20 PM
USCB,"KBW Reaffirms Their Buy Rating on USCB Financial Holdings, Inc. Class A (USCB)",1/31/2023 4:25:37 PM
USCB,"Raymond James Sticks to Their Buy Rating for USCB Financial Holdings, Inc. Class A (USCB)",1/30/2023 4:25:47 PM
USCB,"U.S. Century Bank GAAP EPS of $0.22 misses by $0.08, revenue of $16.74M misses by $2.25M",1/26/2023 10:03:55 PM
USCB,"USCB Financial Holdings, Inc. Reports ROAA of 1.09% and ROAE of 11.90% for 3Q2022",10/27/2022 11:00:00 PM
USCB,"USCB Financial Holdings, Inc. to Announce Third Quarter 2022 Results",10/5/2022 11:00:00 PM
USCB,"With Hurricane Ian About To Slam Florida, Which Insurance, Bank Stocks Are Most Exposed?",9/28/2022 7:09:28 PM
USCB,"USCB Financial Holdings, Inc. Reports Second Quarter 2022 Results",7/28/2022 10:15:00 PM
USCB,"USCB Financial Holdings, Inc. to Announce Second Quarter 2022 Results",7/6/2022 10:15:00 PM
USCB,"USCB Financial Holdings, Inc. to Join the Russell 3000® Index",6/6/2022 10:30:00 PM
USCB,"USCB Financial Holdings, Inc. Reports First Quarter 2022 Results",4/28/2022 10:30:00 PM
USCB,"USCB Financial Holdings, Inc. Appoints Maria C. Alonso to Its Board of Directors",4/6/2022 10:30:00 PM
USCB,"USCB Financial Holdings, Inc. to Announce First Quarter 2022 Results",4/5/2022 10:30:00 PM
