Ticker,Title,Link
FORA,Forian (FORA) Receives a Buy from Roth MKM,8/15/2024 12:17:56 PM
FORA,Forian Inc. Announces Second Quarter 2024 Financial Results,8/14/2024 10:00:00 PM
FORA,Forian earnings preview: what Wall Street is expecting,8/13/2024 3:01:13 PM
FORA,"Forian Inc. to Announce Second Quarter 2024 Results on August 14, 2024",8/2/2024 5:30:00 PM
FORA,"FORA Stock Earnings: Forian Misses EPS, Misses Revenue for Q1 2024",5/15/2024 12:52:46 AM
FORA,7 Multibagger Growth Stocks to Buy to Defy the Downtrend,4/30/2024 7:25:06 PM
FORA,"Analysts Are Bullish on These Healthcare Stocks: TELA Bio (TELA), Petmed Express (PETS)",4/15/2024 1:30:39 PM
FORA,"Analysts Offer Insights on Healthcare Companies: Forian (FORA), Achieve Life Sciences (ACHV) and P3 Health Partners (PIII)",4/1/2024 1:00:32 PM
FORA,"FORA Stock Earnings: Forian Beats EPS, Misses Revenue for Q4 2023",3/29/2024 12:53:59 AM
FORA,Forian Inc. Announces Fourth Quarter and Full Year 2023 Financial Results,3/28/2024 9:06:28 PM
FORA,Here's what Wall Street expects from Forian's earnings,3/27/2024 3:01:13 PM
FORA,Lake Street Sticks to Its Buy Rating for Forian (FORA),3/25/2024 12:45:19 PM
FORA,"FGEN, LEXX and SGLY among mid-day movers",3/12/2024 4:21:11 PM
FORA,"7 Growth Stocks That Could Turn $10,000 Into $500,000",3/11/2024 8:30:00 PM
FORA,"Forian Inc. to Announce Fourth Quarter and Full Year 2023 Results on March 28, 2024",3/8/2024 4:13:52 PM
FORA,"Analysts Offer Insights on Healthcare Companies: Ascendis Pharma (ASND), Mirati Therapeutics (MRTX) and Forian (FORA)",12/20/2023 9:40:12 AM
FORA,Forian Inc. Announces Third Quarter 2023 Financial Results,11/9/2023 10:30:00 PM
FORA,What Wall Street expects from Forian's earnings,11/8/2023 3:01:13 PM
FORA,Lake Street Sticks to Its Buy Rating for Forian (FORA),11/6/2023 1:55:58 PM
FORA,"Forian Inc. to Announce Third Quarter 2023 Results on November 9, 2023",11/1/2023 9:00:00 PM
FORA,Forian Inc. to Participate in the 12th Annual ROTH MKM Technology Event,10/31/2023 1:00:00 PM
FORA,Forian (FORA) Gets a Buy from Lake Street,10/4/2023 12:46:45 PM
FORA,Forian Inc. Announces Stock Repurchase,10/3/2023 10:30:00 PM
FORA,Lake Street Reaffirms Their Buy Rating on Forian (FORA),8/11/2023 1:16:56 PM
FORA,Forian Inc. Announces Second Quarter 2023 Financial Results,8/10/2023 10:00:00 PM
FORA,Forian is about to announce earnings — here's what Wall Street expects,8/9/2023 3:01:13 PM
FORA,Why iMedia Brands Shares Are Trading Lower By 11%? Here Are Other Stocks Moving In Friday's Mid-Day Session,7/7/2023 6:55:51 PM
FORA,"Forian GAAP EPS of -$0.08 misses by $0.01, revenue of $4.87M misses by $0.13M",5/12/2023 8:07:15 PM
FORA,Forian earnings preview: what to expect,5/11/2023 3:01:13 PM
FORA,Lake Street Sticks to Their Buy Rating for Forian (FORA),3/28/2023 1:05:05 PM
FORA,"Forian GAAP EPS of -$0.81 misses by $0.66, revenue of $7.9M beats by $0.8M",3/27/2023 8:25:54 PM
FORA,Forian to sell subsidiary Bio-Tech to Alleaves for $30M,2/13/2023 2:54:35 PM
FORA,7 Little-Known Stocks That Will Make You Rich in 10 Years,1/18/2023 7:57:48 PM
FORA,"ReShape, Scilex top healthcare gainers; Palisade, Kala among losers",1/3/2023 3:05:29 PM
FORA,"NBY, RSLS and FORA among healthcare movers",12/30/2022 3:17:55 PM
FORA,Why Venus Concept Shares Are Trading Higher By Over 63%? Here Are 58 Stocks Moving In Wednesday's Mid-Day Session,12/21/2022 7:51:35 PM
FORA,Forian Inc. Announces Third Quarter 2022 Financial Results,11/14/2022 10:26:37 PM
FORA,"Forian Inc. to Announce 2022 Third Quarter Results on November 14, 2022",10/31/2022 10:30:00 PM
FORA,Why Aditxt Shares Dipped Over 58%; Here Are 82 Biggest Movers From Friday,9/19/2022 7:53:10 AM
FORA,Forian Inc. Announces Second Quarter 2022 Financial Results,8/11/2022 10:02:00 PM
FORA,"ScottsMiracle-Gro, TerrAscend, Canopy Growth & Other Large Cannabis Stocks Announce Earnings Release Dates",7/22/2022 5:46:05 PM
FORA,"Forian Inc. to Announce 2022 Second Quarter Results on August 11, 2022",7/21/2022 10:45:10 PM
FORA,69 Biggest Movers From Friday,6/6/2022 11:31:42 AM
FORA,"7 High-Risk, High-Reward Growth Stocks to Buy Now",5/20/2022 10:00:32 AM
FORA,Forian Inc. Announces First Quarter 2022 Financial Results,5/12/2022 10:05:00 PM
FORA,"Forian Inc. to Announce 2022 First Quarter Results on May 12, 2022",4/28/2022 10:30:00 PM
FORA,"Forian Inc. to Participate in Benzinga Cannabis Capital Conference April 20-21, 2022",4/14/2022 11:40:19 PM
FORA,Forian BioTrack Launches New Mexico Traceability Software for Adult Use Cannabis,4/5/2022 5:35:07 PM
FORA,"Forian Inc. Announces Q4 And Full Year 2021 Financial Results, FY21 Revenue $16.9M",3/24/2022 10:43:18 PM
FORA,Forian Inc. to Present at 34th Annual Roth Conference,3/10/2022 1:43:03 AM
FORA,"Forian Inc. to Announce Fourth Quarter and Full Year 2021 Results on March 24, 2022",3/8/2022 1:33:18 AM
FORA,Florida Chooses BioTrack as the State's Cannabis Track and Trace System,2/28/2022 3:29:33 PM
FORA,Cannabis Industry's Top CEOs Call On President Biden To Issue Pardons: Can These Multi-Billion Dollar Companies Sway Policy?,11/19/2021 6:00:35 PM
FORA,DGAP-News: Connecticut chooses BioTrack as the state's cannabis seed-to-sale tracking software,11/15/2021 8:43:08 PM
FORA,"The Week In Cannabis: Earnings Season, A GOP Legalization Bill, Seth Rogen & Sarah Silverman's Campaign",11/12/2021 8:35:56 PM
FORA,Forian Inc. Announces Third Quarter Fiscal 2021 Financial Results,11/11/2021 10:03:00 PM
FORA,"Forian Inc. to Announce 2021 Third Quarter Results on November 11, 2021",10/21/2021 7:00:00 PM
FORA,"Forian To Raise $24M Via Private Placement Of 3.5% Convertible Notes, Appoints New CFO",9/2/2021 5:19:30 PM
FORA,"Forian Inc. Announces $24 Million Private Placement of 3.5% Convertible Notes due 2025, Appoints New Chief Financial Officer",9/1/2021 10:15:00 PM
FORA,"Psyched: Cybin Gets $9 Price Target, FSD Pharma Acquires Lucid, New Trials From Psilera, Awakn, PharmaDrug And Braxia, California Bill Put On Hold",8/30/2021 5:21:25 PM
FORA,MindMed Teams Up With Forian To Improve Real-World Evidence Data To Help Psychiatric Patients,8/24/2021 5:18:32 PM
FORA,Forian Inc. Announces Second Quarter Fiscal 2021 Financial Results,8/12/2021 10:00:00 PM
FORA,VerticalScope Announces Second Quarter 2021 Financial Results,8/11/2021 2:21:00 AM
FORA,"VerticalScope to Report Second Quarter 2021 Financial Results on August 10, 2021",8/4/2021 1:41:00 AM
FORA,"Forian Inc. to Announce 2021 Second Quarter Results on August 12, 2021",7/22/2021 11:00:00 PM
FORA,"Benzinga's Top Ratings Upgrades, Downgrades For July 9, 2021",7/9/2021 4:36:01 PM
FORA,VerticalScope Acquires Paddling.com,6/24/2021 11:20:00 PM
FORA,VerticalScope Virtually Opens The Market,6/15/2021 5:00:00 PM
FORA,Forian Inc. Set to Join Russell 3000® Index,6/7/2021 3:19:00 PM
FORA,Forian reports Q1 results,5/17/2021 11:33:37 AM
FORA,Forian raises $12M in private placement,4/12/2021 10:06:07 PM
FORA,58 Biggest Movers From Yesterday,3/23/2021 10:16:23 AM
FORA,35 Stocks Moving In Monday's Mid-Day Session,3/22/2021 5:04:04 PM
FORA,62 Biggest Movers From Friday,3/8/2021 11:13:19 AM
