Ticker,Title,Link
ISDR,"ISDR Stock Earnings: Issuer Direct Beats EPS, Beats Revenue for Q2 2024",8/9/2024 12:59:48 AM
ISDR,"Issuer Direct Non-GAAP EPS of $0.22 beats by $0.01, revenue of $7.7M beats by $0.08M",8/8/2024 8:20:00 PM
ISDR,Issuer Direct is about to announce its earnings — here's what to expect,8/7/2024 3:01:13 PM
ISDR,"ISDR Stock Earnings: Issuer Direct Misses EPS, Misses Revenue for Q1 2024",5/10/2024 12:58:33 AM
ISDR,"Issuer Direct Non-GAAP EPS of $0.08 misses by $0.21, revenue of $7M misses by $1.63M",5/9/2024 8:06:21 PM
ISDR,Issuer Direct earnings: here's what to expect,5/8/2024 3:01:13 PM
ISDR,"ISDR Stock Earnings: Issuer Direct Misses EPS, Misses Revenue for Q4 2023",3/8/2024 2:55:00 AM
ISDR,"Issuer Direct Non-GAAP EPS of $0.15, revenue of $7.5M",3/7/2024 10:32:24 PM
ISDR,What Wall Street expects from Issuer Direct's earnings,3/6/2024 3:01:13 PM
ISDR,Northland Securities Remains a Buy on Issuer Direct (ISDR),11/13/2023 1:35:26 PM
ISDR,Issuer Direct earnings: here's what to expect,11/8/2023 3:01:13 PM
ISDR,Issuer Direct (ISDR) Gets a Buy from Northland Securities,9/15/2023 1:35:40 PM
ISDR,Northland Securities Sticks to Its Buy Rating for Issuer Direct (ISDR),8/11/2023 1:06:59 PM
ISDR,"Issuer Direct GAAP EPS of $0.36 beats by $0.12, revenue of $9.65M misses by $0.71M",8/10/2023 8:12:15 PM
ISDR,Issuer Direct reports Q1 results,5/11/2023 8:17:13 PM
ISDR,"Issuer Direct Non-GAAP EPS of $0.18 misses by $0.11, revenue of $7.14M beats by $0.34M",3/2/2023 9:04:44 PM
ISDR,Issuer Direct is about to announce its earnings — here's what to expect,3/1/2023 3:01:13 PM
ISDR,"Issuer Direct Non-GAAP EPS of $0.27, revenue of $5.28M",11/3/2022 9:02:28 PM
ISDR,Here's what Wall Street expects from Issuer Direct's earnings,11/2/2022 3:01:13 PM
ISDR,"Issuer Direct Non-GAAP EPS of $0.29 beats by $0.04, revenue of $5.8M misses by $0.19M",8/4/2022 8:19:26 PM
ISDR,Issuer Direct earnings preview: what Wall Street is expecting,8/3/2022 3:01:13 PM
ISDR,Why Is Allena Pharmaceuticals Jumping By 207%? 45 Stocks Moving In Wednesday's Mid-Day Session,6/29/2022 6:32:54 PM
ISDR,"Issuer Direct Non-GAAP EPS of $0.22 beats by $0.08, revenue of $5.29M misses by $0.05M",5/5/2022 8:38:18 PM
ISDR,"Issuer Direct Non-GAAP EPS of $0.23, revenue of $5.72M",3/3/2022 9:29:08 PM
ISDR,61 Biggest Movers From Yesterday,11/18/2021 9:49:19 AM
ISDR,"Issuer Direct EPS misses by $0.01, beats on revenue",11/4/2021 8:08:40 PM
ISDR,Issuer Direct earnings: here's what Wall Street expects,11/3/2021 3:01:13 PM
ISDR,Issuer Direct Corporation to Present at the 16th Annual Needham Virtual Technology & Media Conference on May 17 at 3:45 pm ET,5/11/2021 9:30:00 AM
ISDR,"Issuer Direct Joins the Pledge 1% Movement and Announces, ""Access to Giving"" Virtual Investor Conference July 13-15, 2021",4/14/2021 9:28:00 AM
ISDR,"Issuer Direct EPS beats by $0.14, beats on revenue",3/4/2021 10:45:14 PM
ISDR,Issuer Direct earnings: here's what to expect,3/2/2021 3:01:27 PM
ISDR,"Issuer Direct Corporation to Host Fourth Quarter and Full Year 2020 Earnings Conference Call March 4, 2021",2/25/2021 9:25:00 AM
ISDR,"Issuer Direct Subscription Platform Gets Significant, Industry-First Solution Upgrades",2/24/2021 9:35:00 AM
ISDR,"Issuer Direct Corporation to Present at the 23rd Annual Needham Virtual Growth Conference on Wednesday, January 13 at 4:15pm ET",1/5/2021 9:35:00 AM
ISDR,Daqo New Energy and ReneSola among tech gainers; voxeljet AG and Marin Software among tech losers,11/2/2020 7:59:00 PM
ISDR,Issuer Direct Reports Third Quarter 2020 Results,10/29/2020 4:00:00 PM
ISDR,What Wall Street expects from Issuer Direct's earnings,10/28/2020 3:04:57 PM
ISDR,"Issuer Direct Corporation to Host Third Quarter 2020 Earnings Conference Call on October 29, 2020",10/22/2020 4:25:00 PM
ISDR,Issuer Direct to Present at the LD Micro 500 Virtual Investor Conference,8/25/2020 9:00:00 AM
ISDR,Issuer Direct Reports Second Quarter 2020 Results,7/30/2020 4:01:00 PM
ISDR,Issuer Direct earnings preview: what Wall Street is expecting,7/29/2020 3:03:03 PM
ISDR,"Issuer Direct Corporation to Host Second Quarter 2020 Earnings Conference Call on July 30, 2020",7/23/2020 9:30:00 AM
ISDR,"LD Micro and Issuer Direct Join Forces to Host the ""500""",7/8/2020 9:30:00 AM
ISDR,Issuer Direct Reports First Quarter 2020 Results,4/30/2020 4:02:00 PM
ISDR,Here's what to expect from Issuer Direct's earnings report,4/29/2020 3:02:39 PM
ISDR,"Issuer Direct Corporation to Host First Quarter 2020 Earnings Conference Call on April 30, 2020",4/23/2020 9:15:00 AM
ISDR,"In the Age of Social Distancing, Issuer Direct Launches Video 1:1 Capabilities in its Virtual Event Platform",3/17/2020 9:45:00 AM
ISDR,Issuer Direct Increases Its Share Repurchase Program,3/16/2020 9:35:00 AM
ISDR,"Issuer Direct to Participate at 32nd Annual ROTH Conference March 15-17, 2020",3/5/2020 10:30:00 AM
ISDR,Issuer Direct Reports Fourth Quarter and Full Year 2019 Results,2/27/2020 4:01:00 PM
ISDR,"Issuer Direct Corporation to Host Fourth Quarter and Full Year 2019 Conference Call on February 27, 2020",2/20/2020 9:15:00 AM
ISDR,"Issuer Direct to Present at LD Micro 12th Annual Main Event Investor Conference on December 11, 2019",11/26/2019 9:15:00 AM
ISDR,Issuer Direct Reports Third Quarter 2019 Results,10/31/2019 4:01:00 PM
ISDR,"Issuer Direct Corporation to Host Third Quarter Conference Call on October 31, 2019",10/24/2019 9:05:00 AM
ISDR,Issuer Direct Announces Licensing & Development Agreement with SNN Incorporated,10/22/2019 9:05:00 AM
ISDR,OTC Markets Group Announces Third Quarter 2017 Financial Results,11/8/2017 11:00:00 PM
