Ticker,Title,Link
AIM,AIM ImmunoTech to recruit long-term COVID-19 patients with chronic fatigue in Ampligen trial,10/6/2020 4:35:50 PM
AIM,Aim ImmunoTech News: Why AIM Stock Is Shooting 22% Higher Today,9/22/2020 6:41:04 PM
AIM,AIM ImmunoTech Highlights Start of Recruitment in Roswell Park Clinical Trial Incorporating Ampligen in the Treatment of Cancer Patients with Mild or Moderate COVID-19,9/16/2020 6:50:00 AM
AIM,AIM ImmunoTech to Present at the H.C. Wainwright 22nd Annual Global Investment Conference on September 14th,9/10/2020 6:50:00 AM
AIM,"AIM ImmunoTech CEO to Participate in Virtual Panel: 'New Approaches to COVID-19: Hidden Breakthroughs,' on Thursday, September 10th",9/8/2020 6:50:00 AM
AIM,AIM ImmunoTech Inc. Decreases SARS-CoV-2 Infectious Viral Yields by 90% Using New In Vitro Model; Supports Further Testing of Ampligen as an Intranasal Prophylactic to Prevent COVID-19,8/27/2020 9:15:00 AM
AIM,AIM ImmunoTech to Present at The LD 500 Virtual Conference on September 1st,8/25/2020 6:55:00 AM
AIM,AIM ImmunoTech Provides Second Quarter 2020 Business Update and Reports Progress in Both COVID-19 and Cancer Trials,8/17/2020 6:55:00 AM
AIM,"49 Public Companies to Present at the SNN Network Virtual Conference on August 3-6, 2020",8/3/2020 8:00:00 AM
AIM,"AIM ImmunoTech to Present at the SNN Network Virtual Investor Conference on Monday, August 3rd",7/27/2020 6:55:00 AM
AIM,AIM ImmunoTech Seduces With Coronavirus Treatment Potential,7/17/2020 1:02:51 PM
AIM,AIM ImmunoTech Signs Clinical Trial Agreement with Roswell Park Comprehensive Cancer Center Supporting Phase 1/2 Clinical Trial of Ampligen Combined with Interferon Alfa-2b in COVID-19 Patients...,7/9/2020 6:30:00 AM
AIM,"AIM ImmunoTech Signs Material Transfer and Research Agreement with Japan's National Institute of Infectious Diseases and Shionogi, a Leading Global Pharmaceutical Company, to Test Ampligen as...",7/6/2020 9:00:00 AM
AIM,AIM ImmunoTech Added to Russell Microcap(R) Index,6/29/2020 6:55:00 AM
AIM,"2 Pros, 2 Cons for Buying AIM ImmunoTech",6/17/2020 3:35:24 PM
AIM,Coronavirus Research Is the Key for AIM ImmunoTech Stock,6/15/2020 1:10:53 PM
AIM,AIM ImmunoTech files provisional patent for the use of Ampligen in COVID-19,6/11/2020 1:27:38 PM
AIM,"VMW, MRVL among premarket gainers",5/29/2020 1:21:39 PM
AIM,Sorrento Therapeutics leads healthcare gainers; electroCore and Co-Diagnostics among losers,5/15/2020 3:06:31 PM
AIM,"ACB, AIM, CVET and NEWR among after-hours movers",5/14/2020 9:42:32 PM
AIM,AIM ImmunoTech’s CEO to Present at Maxim’s Infectious Disease Virtual Conference,4/29/2020 6:30:00 AM
AIM,"BBBY, DVAX among premarket gainers",4/28/2020 1:22:08 PM
AIM,AIM ImmunoTech’s CEO to Present at the Planet Microcap Showcase Virtual Investor Conference 2020,4/20/2020 6:30:00 AM
AIM,AIM Stock Is a Moonshot That Lacks the Fuel,4/9/2020 12:26:07 PM
AIM,Ignore the Coronavirus Catalyst for ABBV Stock,4/8/2020 2:03:52 PM
AIM,"CIM, EURN among premarke losers",4/7/2020 1:10:33 PM
AIM,"AIM ImmunoTech and Shenzhen Smoore Technology Announce an Agreement to Research Utilizing an Innovative Smoore Inhalation Delivery Device and Ampligen (rintatolimod) as a Potential, Easy-To-Use...",4/6/2020 6:30:00 PM
AIM,Don’t Pull the Trigger on AIM ImmunoTech Stock,4/2/2020 7:06:50 PM
AIM,"NVTA, AOBC, OMI and PVH among after-hours movers",4/1/2020 9:35:20 PM
AIM,AIM ImmunoTech Reports 2019 Year-end Financial Results,3/31/2020 6:45:00 AM
AIM,"OMI, PSTV, GRPN and WMC among midday movers",3/30/2020 4:40:14 PM
AIM,Read the Label Before Buying AIM Stock,3/27/2020 3:28:44 PM
AIM,AIM ImmunoTech Announces Further Efforts to Establish Clinical Trials Assessing Ampligen as a Potential Protective and Early-Onset Treatment for the Current COVID-19 Pandemic,3/26/2020 8:00:00 AM
AIM,"SOHO, TLRY, CPLG and BLCM among midday movers",3/13/2020 4:44:42 PM
AIM,Stocks Double And Tripled In Value From Coronavirus ,3/12/2020 1:27:04 PM
AIM,GT Biopharma News: GTBP Stock Spikes 26% on Coronavirus Treatment Hopes,3/10/2020 7:38:15 PM
AIM,AIM ImmunoTech News: AIM Stock Skyrockets 208% on Hopes for COVID-19 Treatment,3/9/2020 6:50:59 PM
AIM,"MRVL, VIPS among premarket gainers",3/5/2020 2:11:11 PM
AIM,"OCUL, AIM, INFN and OMI among midday movers",3/4/2020 5:39:09 PM
AIM,Healthcare dominates premarket losers amidst coronavirus situation,3/3/2020 2:23:03 PM
AIM,"NVAX, AIM, KPTI and CEI among midday movers",3/2/2020 5:40:16 PM
AIM,"DYNT, ALT, GKOS and VIR among midday movers",2/28/2020 5:40:28 PM
AIM,"WLL, SPEX, CODX and AIM among midday movers",2/27/2020 6:00:55 PM
AIM,"TSLA, KR among premarket gainers",2/18/2020 2:15:56 PM
AIM,"INO, CRSP among premarket gainers",2/13/2020 2:14:49 PM
AIM,"AIM, IO, WLL and BBBY among midday losers",2/12/2020 5:43:55 PM
AIM,AIM ImmunoTech Files Three Provisional Patent Applications Surrounding Ampligen(R) for Use Against the SARS-like Wuhan 2019 Novel Coronavirus ,2/11/2020 6:30:00 AM
AIM,AIM ImmunoTech Announces Completion of Third-Party Clinical Trial Using Ampligen in Combination with Other Therapies as Adjuvant Treatment of Peritoneal Surface Malignancies,2/5/2020 6:30:00 AM
AIM,AIM ImmunoTech to Present at the Investor Summit in Philadelphia,12/11/2019 12:20:00 PM
AIM,AIM ImmunoTech Issues Stockholder Update and Details Its Expectations for 2020,12/4/2019 6:30:00 AM
AIM,CORRECTION: AIM ImmunoTech Provides Business Update for the Third Quarter of 2019,11/15/2019 10:25:00 AM
AIM,AIM ImmunoTech to Present at the Dawson James Securities 5th Annual Small Cap Growth Conference ,10/23/2019 6:30:00 AM
AIM,AIM ImmunoTech Provides Comprehensive Clinical Trials Update With Major Inflection Points Identified,10/7/2019 6:30:00 AM
AIM,"AIM ImmunoTech, Inc. Announces Pricing of $8 Million Public Offering",9/25/2019 9:50:00 AM
AIM,"AIM ImmunoTech Inc. Announces a Second DoD Award, This One of $8.3 Million, to Fund Phase 2 Clinical Trial to Study Ampligen as Part of a New Treatment for Brain-Metastatic Breast Cancer at the...",9/24/2019 6:30:00 AM
AIM,"6 Top Gainers In Healthcare Sector (AIM, EDSA, ARAV…) ",9/20/2019 3:39:05 AM
AIM,AIM ImmunoTech Inc. Announces the U.S. Department of Defense’s Award of $6.42M to Roswell Park Comprehensive Cancer Center to Study Ampligen as Part of a New Treatment of Brain-Metastatic Breast...,9/19/2019 6:50:00 AM
