Ticker,Title,Link
WST,Hold Rating on West Pharmaceutical Services Amid Forecast Challenges and Demand Slowdown,7/26/2024 7:08:26 AM
WST,"WST Stock Earnings: West Pharmaceutical Servs Misses EPS, Misses Revenue for Q2 2024",7/25/2024 2:56:01 PM
WST,West Pharmaceutical Q2 2024 Earnings Preview,7/24/2024 5:34:04 PM
WST,Reasons to Hold West Pharmaceutical in Your Portfolio Now,6/21/2024 9:54:26 PM
WST,"Analysts Are Bullish on Top Healthcare Stocks: West Pharmaceutical Services (WST), Boston Scientific (BSX)",6/20/2024 12:10:48 PM
WST,Sell ideas in Staples and Health Care - Oppenheimer,6/3/2024 6:46:53 PM
WST,West Pharmaceutical Services: Strong Q1 Performance and Upbeat FY24 Outlook Bolster Buy Rating,4/26/2024 9:09:59 AM
WST,"WST Stock Earnings: West Pharmaceutical Servs Beats EPS, Beats Revenue for Q1 2024",4/25/2024 2:56:17 PM
WST,West Pharmaceutical Q1 2024 Earnings Preview,4/24/2024 5:44:19 PM
WST,Strong Buy: West Pharmaceutical Services’ Market Position and Growth Prospects in Drug Packaging Industry,4/18/2024 7:06:03 AM
WST,3 Pharma Stocks to Sell in March Before They Crash & Burn,3/14/2024 10:49:54 PM
WST,Buy Rating Affirmed for West Pharmaceutical Services on Robust Market Position and Growth Prospects,2/22/2024 7:05:19 AM
WST,West Pharmaceutical declares $0.20 dividend,2/20/2024 12:35:17 PM
WST,"Analysts Have Conflicting Sentiments on These Healthcare Companies: Bio-Rad Laboratories (BIO), Ultragenyx Pharmaceutical (RARE) and West Pharmaceutical Services (WST)",2/16/2024 1:40:42 PM
WST,"S&P Reclaims 5,000 As Disappointing Retail Sales Put Fed Cuts Back On Track, Small Caps Shine: What's Driving Markets Thursday?",2/15/2024 8:12:45 PM
WST,"Tudor Investment exits Airbnb, Adobe; boosts Nvidia, Splunk",2/14/2024 11:50:22 PM
WST,Keybanc Maintains Overweight Rating for West Pharmaceutical Servs: Here's What You Need To Know,2/13/2024 6:00:21 PM
WST,Booming weight-loss drug market to lift “pick-and-shovel” plays: Jefferies,2/11/2024 5:00:03 PM
WST,Hold Rating on West Pharmaceutical Services Amid Balanced Growth Prospects and Expansion Investments,12/18/2023 1:35:28 PM
WST,West Announces First-Quarter 2024 Dividend,12/6/2023 12:00:00 PM
WST,West Receives FDA 510(k) Clearance for Vial2Bag Advanced® 13mm Admixture Device,12/4/2023 9:00:00 PM
WST,Blue-Chip Bargains: Top 3 Oversold Aristocrats for Value Investors,11/15/2023 4:23:44 AM
WST,West to Participate in Upcoming Investor Conferences,11/1/2023 11:00:00 AM
WST,Why Harley-Davidson Shares Are Trading Lower By Around 10%? Here Are Other Stocks Moving In Thursday's Mid-Day Session,10/26/2023 7:27:42 PM
WST,West Pharmaceutical Services earnings preview: what Wall Street is expecting,10/25/2023 3:01:13 PM
WST,West to Attend and Showcase Industry Leadership in Packaging and Containment at CPHI Worldwide Conference,10/23/2023 12:00:00 PM
WST,7 Healthcare Stocks to invest in for a Healthy Future,10/20/2023 12:45:53 PM
WST,"West to Present on Development of Large Volume Delivery Systems, Self-injection Devices, and Prefillable Syringe Component Expertise at the PDA Conference",10/16/2023 12:00:00 PM
WST,West to Host Third-Quarter 2023 Conference Call,10/12/2023 12:00:00 PM
WST,West to Participate in Upcoming Investor Conference,9/7/2023 12:00:00 PM
WST,The 3 Best Retirement Stocks to Buy Now: September 2023,9/6/2023 1:05:21 PM
WST,What 4 Analyst Ratings Have To Say About West Pharmaceutical Servs,8/21/2023 8:00:39 PM
WST,West to Participate in Upcoming Investor Conference,8/2/2023 10:30:00 PM
WST,"Analysts Offer Insights on Healthcare Companies: West Pharmaceutical Services (WST), Argenx Se (ARGX) and HCA Healthcare (HCA)",7/28/2023 8:50:31 AM
WST,West Announces Second-Quarter 2023 Results,7/27/2023 12:00:00 PM
WST,West Pharmaceutical Q2 2023 Earnings Preview,7/26/2023 4:33:44 PM
WST,West to Host Second-Quarter 2023 Conference Call,7/13/2023 12:00:00 PM
WST,Citi screens for most crowded short stocks with new model,6/28/2023 10:49:41 AM
WST,"BofA ups West Pharmaceutical to buy, citing increased GLP-1 demand",6/16/2023 5:16:30 PM
WST,"Pre-market Movers: BLTE, LL, AMBA, TW, LAES… ",5/31/2023 12:47:04 PM
WST,3 ETFs to Buy for Stress-Free Profits,5/24/2023 9:50:12 PM
WST,West to Participate in Upcoming Investor Conference,5/4/2023 12:00:00 PM
WST,3 Overvalued S&P 500 Stocks to Dump Now,5/3/2023 1:03:14 PM
WST,FDA to broaden access to decentralized clinical trials,5/2/2023 7:43:45 PM
WST,7 Dividend Aristocrats to Buy for Long-Term Income,4/28/2023 8:00:09 PM
WST,West Announces First-Quarter 2023 Results and Declares Third-Quarter 2023 Dividend,4/27/2023 12:00:00 PM
WST,West Pharmaceutical Q1 2023 Earnings Preview,4/26/2023 4:16:13 PM
WST,West to Host First-Quarter 2023 Conference Call,4/13/2023 12:00:00 PM
WST,Analyst Says West Pharmaceutical Services Is 'Expensive But For Good Reason',4/11/2023 8:49:36 PM
WST,West Announces Second-Quarter 2023 Dividend,3/3/2023 12:00:00 PM
WST,"Tesla among top S&P 500 gainers in February, Moderna one of the biggest losers",3/2/2023 12:19:19 AM
WST,"Analysts Offer Insights on Healthcare Companies: Ultragenyx Pharmaceutical (RARE), West Pharmaceutical Services (WST) and Blueprint Medicines (BPMC)",2/17/2023 12:30:29 PM
WST,"Nasdaq, S&P, Dow set to end in the red as traders digest more inflation data, Fed talk",2/16/2023 8:27:35 PM
WST,West Pharmaceutical Q4 2022 Earnings Preview,2/15/2023 6:06:33 PM
WST,West Expands Corning Collaboration and Launches First Product,2/8/2023 2:30:00 PM
WST,West to Host Fourth-Quarter and Full-Year 2022 Conference Call and Announces Participation in Upcoming Investor Conferences,2/2/2023 12:00:00 PM
WST,West Announces Three New Product Innovations at Pharmapack Europe,1/31/2023 12:00:00 PM
WST,"West Pharmaceutical Services (NYSE:WST): A Mediocre, Risky COVID-19 Stock",1/18/2023 7:53:48 PM
WST,West to Participate in Upcoming Investor Conference,1/5/2023 12:00:00 PM
WST,"Benzinga's Top Ratings Upgrades, Downgrades For December 14, 2022",12/14/2022 4:01:41 PM
WST,West Announces First-Quarter 2023 Dividend and Participation in Upcoming Investor Conference,12/13/2022 12:00:00 PM
WST,Where West Pharmaceutical Servs Stands With Analysts,12/2/2022 1:02:32 PM
WST,"Benzinga's Top Ratings Upgrades, Downgrades For November 30, 2022",11/30/2022 4:01:31 PM
WST,7 Dividend Stocks Set to Surge Higher in 2023,11/21/2022 8:31:44 PM
WST,West to Participate in Upcoming Investor Conferences,11/4/2022 9:00:00 PM
WST,West to Attend and Showcase Industry Leadership in Packaging and Containment at CPhI Worldwide Conference,10/31/2022 9:00:00 PM
WST,"Benzinga's Top Ratings Upgrades, Downgrades For October 28, 2022",10/28/2022 4:12:35 PM
WST,"Credit Suisse, Meta Platforms, Wolfspeed And Some Other Big Stocks Moving Lower On Thursday",10/27/2022 5:27:56 PM
WST,West Pharmaceutical Q3 2022 Earnings Preview,10/26/2022 4:44:30 PM
WST,"West to Present on Development of Large Volume Delivery Systems, Self-injection Devices and Prefillable Syringe Component Expertise at the PDA Conference",10/18/2022 12:00:00 PM
WST,West to Host Third-Quarter 2022 Conference Call,10/13/2022 12:00:00 PM
WST,West Announced as Company of the Year Finalist for Global Generics and Biosimilar Awards 2022,10/6/2022 12:00:00 PM
WST,West to Participate in Upcoming Investor Conference,9/8/2022 12:00:00 PM
WST,"Micron, Intel among new ideas in BofA's Alpha Surprise screen",9/2/2022 10:00:00 PM
WST,"Biologic medicines, COVID vaccines spurring growth for contract injectable packaging firms",8/27/2022 8:00:00 PM
WST,"West Makes Minority Investment in Dublin-Based Latch Medical, a Developer of Vaccine and Biologics Delivery Platforms",8/11/2022 12:00:00 PM
WST,West Announces Second-Quarter 2022 Results,7/28/2022 12:00:00 PM
WST,Here's what Wall Street expects from West Pharmaceutical Services's earnings,7/27/2022 3:01:13 PM
WST,West to Host Second-Quarter 2022 Conference Call,7/14/2022 11:00:00 PM
WST,West Pharmaceutical Services Releases 2021 Corporate Responsibility Report,7/12/2022 9:00:00 PM
WST,West Introduces Daikyo Crystal Zenith® 2.25mL Insert Needle Syringe System at BIO International Convention,6/13/2022 12:00:00 PM
WST,West Receives Exhibitor Award at INTERPHEX 2022 for Proprietary DeltaCube™ Modeling Platform,5/24/2022 10:30:00 PM
WST,West to Attend and Showcase Industry Leadership in Packaging and Containment at INTERPHEX 2022,5/23/2022 10:30:00 PM
WST,West Announces Executive Leadership Appointments,5/12/2022 10:30:00 PM
WST,West to Participate in Upcoming Investor Conferences,5/3/2022 10:30:00 PM
WST,West Pharma stock falls as Q1 revenue misses estimates,4/28/2022 4:44:04 PM
WST,"West Pharmaceutical Q1 consensus EPS, revenue estimates up",4/27/2022 5:17:13 PM
WST,West to Host First-Quarter 2022 Conference Call,4/14/2022 12:00:00 PM
WST,scPharmaceuticals refiles for FDA approval of Furoscix for heart failure,4/12/2022 9:25:02 AM
WST,"Pneuma Systems collaborates with West Pharmaceutical Services, Inc. to improve the patient experience",4/7/2022 3:00:00 PM
WST,West Receives Fred Simon Award and Edward Smith Packaging Science Award at 2022 PDA Annual Meeting,4/4/2022 10:30:00 PM
WST,West to Showcase Leadership and Advancements of Packaging Science at the 2022 PDA Annual Meeting,3/31/2022 10:30:00 PM
WST,7 Healthcare Stocks to Buy for the Long Term,3/21/2022 4:14:29 PM
WST,West to Participate in Upcoming Investor Conference,3/9/2022 12:00:00 PM
WST,West Names President and CEO Eric M. Green as Chair of the Board,2/28/2022 10:30:00 PM
WST,West Announces Second-Quarter 2022 Dividend,2/23/2022 12:00:00 PM
WST,"The Daily Biotech Pulse: J&J Unit Announces Research Collaboration With Remix, Regencell Touts COVID Data, Decision Day For Agios",2/17/2022 2:00:05 PM
WST,West Pharmaceutical Q4 2021 Earnings Preview,2/16/2022 6:05:31 PM
WST,"The Week Ahead In Biotech (Feb. 13-19): Agios FDA Meeting, Avenue Adcom, Earnings And More",2/13/2022 2:32:29 PM
WST,West to Host Fourth-Quarter and Full-Year 2021 Conference Call,2/3/2022 12:00:00 PM
WST,West Announces Landmark Collaboration with Corning in Pharmaceutical Injectable Drug Delivery,1/25/2022 12:00:00 PM
WST,West Announces First-Quarter 2022 Dividend and 2022 Share Repurchase Program,1/5/2022 10:30:00 PM
WST,West to Participate in Upcoming Investor Conference,12/27/2021 10:30:00 PM
WST,West to Participate in Upcoming Investor Conferences,11/11/2021 10:30:00 PM
WST,West Announces Third-Quarter 2021 Results and Declares Fourth-Quarter 2021 Dividend,10/28/2021 12:00:00 PM
WST,Notable earnings before Thursday's open,10/27/2021 2:40:31 PM
WST,West Pharmaceutical Services is about to announce its earnings — here's what Wall Street expects,10/26/2021 3:02:03 PM
WST,West's NovaGuard® SA Pro Safety System Recognized for Best Technologies Innovation at INTERPHEX,10/25/2021 12:00:00 PM
WST,West Introduces DeltaCube™ Modeling Platform and NovaGuard® SA Pro Safety System for 0.5 mL Standard Glass Syringes at Interphex,10/19/2021 12:00:00 PM
WST,West to Host Third-Quarter 2021 Conference Call,10/14/2021 12:00:00 PM
WST,These S&P 500 Index stocks are expected to beat earnings,10/12/2021 3:24:53 PM
WST,3 Best ESG Stocks for Those Committed to Sustainable Investing,9/23/2021 9:57:08 AM
WST,"The Daily Biotech Pulse: Apellis Sinks On Data, Endo Shines On Opioid Litigation Settlement, T2 Biosystems Soars On Mutant Detection Ability of COVID Test",9/10/2021 2:00:05 PM
WST,"The Daily Biotech Pulse: ProQR-Lilly R&D Partnership, Sanofi's Pemphigus Trial Disappointment, Humanigen's COVID-19 Drug Denied Emergency Use Authorization",9/9/2021 2:17:07 PM
WST,7 Top-Performing S&P 500 Stocks to Watch,9/8/2021 1:54:34 PM
WST,"The Daily Biotech Pulse: Cellect Jumps On First Apograft Transplantation, AstraZeneca, European Commission Bury Legal Hatchet, Cassava Defends Itself",9/3/2021 1:31:13 PM
WST,"The Daily Biotech Pulse: Merck Releases Twin Dose Of Positive Tidings, Astellas Voluntarily Pauses Gene Therapy Study, Ascendis Offering",9/1/2021 1:32:13 PM
WST,"The Daily Biotech Pulse: VectivBio In M&A Mix, Sonnet Biotherapeutics Advances Candidate To Clinics, CEO Transitions At Galapagos, Talis Biomedical",8/31/2021 2:06:37 PM
WST,"The Daily Biotech Pulse: Cara's Korsuva Greenlighted By FDA, Clinical Trial Disappointments For Novartis, Theravance, Vertex Inks CRISPR Licensing Deal",8/24/2021 2:09:21 PM
WST,West Elects New Director to the Board,8/23/2021 10:30:00 PM
WST,"The Daily Biotech Pulse: J&J Announces CEO Transition, FibroGen's Roxadustat Approved In Europe, GeoVax, Sorrento Announce COVID-19 Vaccine Data",8/20/2021 1:45:43 PM
WST,"The Daily Biotech Pulse: Coherus Soars On Lung Cancer Data, Illumina Closes On Grail Buy Without Regulatory Clearance, Adagene Strikes Collaboration With Merck",8/19/2021 1:37:27 PM
WST,"The Daily Biotech Pulse: AzurRx Jumps On Data, Agios' Regulatory Application For Mitapivat Accepted For Priority Review, FDA Nod For GlaxoSmithKline",8/18/2021 1:37:56 PM
WST,"The Daily Biotech Pulse: Lilly Reorganizes Business Units In Neuroscience Focus, Helius Medical Spikes On Breakthrough Designation, Ra Medical Sells Dermatology Business",8/17/2021 2:28:53 PM
WST,"The Daily Biotech Pulse: FDA Rejects FibroGen's Anemia Drug, Crinetics Gains On Positive Readout, BioCryst Withdraws Public Offering",8/11/2021 2:14:38 PM
WST,"The Daily Biotech Pulse: Dicerna Slips On Data, Novavax Tightlipped On US Vaccine Approval, Adagio IPO",8/6/2021 1:42:39 PM
WST,"The Daily Biotech Pulse: Sanofi Buys Translate Bio In $3.2B Deal, Lilly's Q2 Earnings Disappoint, Bausch To Spin Off Medical Aesthetics Business",8/3/2021 1:55:12 PM
WST,"The Daily Biotech Pulse: Erytech Jumps On Fast Track Designation, GlaxoSmithKline FDA Nod, Alnylam's Clinical Collaboration, 4 IPOs",7/30/2021 1:53:58 PM
WST,"The Daily Biotech Pulse: Merck's Disappointing Q2, Atreca Falls On Data, FDA Nod For Viatris, Nuvalent, Icosavax IPOs",7/29/2021 2:18:48 PM
WST,Notable earnings before Thursday's open,7/28/2021 2:01:13 PM
WST,What Wall Street expects from West Pharmaceutical Services's earnings,7/27/2021 3:02:14 PM
WST,"The Week Ahead In Biotech: Big Pharma Earnings, Iterum FDA Decision, Alzheimer's Conference, IPOs and More",7/25/2021 3:26:31 PM
WST,West to Host Second-Quarter 2021 Conference Call,7/15/2021 12:00:00 PM
WST,"The Daily Biotech Pulse: Equillium Issues Positive Regulatory Update, Biogen In-Licenses Multiple Sclerosis Drug, Aridis Releases COVID-19 Antibody Cocktail Data",7/13/2021 2:05:06 PM
WST,"The Daily Biotech Pulse: Lilly, Morphic's Positive Data At ECCO, Humanigen's COVID Treatment Gets Expedited Review In UK, TransCode IPO",7/9/2021 1:36:16 PM
WST,"The Daily Biotech Pulse: Priority Review For Amgen's Asthma Treatment, Evaxion Reports Positive Skin Cancer Readout, Quidel Recalls Lyra COVID-19 Test",7/8/2021 1:45:17 PM
WST,"The Daily Biotech Pulse: Opiant Spikes On Data, OncoSec Rallies On Merck Collaboration, XBiotech Special Dividend",7/7/2021 1:41:27 PM
WST,"The Daily Biotech Pulse: Sanofi Bets Big On mRNA Tech, Decision Day For MediWound, DiaMedica Issues Kidney Disease Data Readout",6/29/2021 2:17:44 PM
WST,"The Daily Biotech Pulse: Roche Gets Authorization For COVID-19 Treatment, Nods For Sanofi-Regeneron In Europe, Osmotica Divestment, 2 IPOs",6/25/2021 1:32:32 PM
WST,"The Daily Biotech Pulse: Lilly Spikes On Alzheimer's Drug Regulatory Filing Plan, Applied Genetics, Arcus Issue Data Readouts, Adcom Test Awaits Incyte, Monte Rosa Prices IPO",6/24/2021 2:12:04 PM
WST,"The Daily Biotech Pulse: Sanofi, Translate Bio Start Early Stage Seasonal Flu Vaccine Study, Dr. Reddy's Launches Generic Vascepa, Halozyme Strikes Licensing Deal",6/22/2021 2:12:07 PM
WST,"The Daily Biotech Pulse: Orphazyme Falters At FDA, Athira's CEO Placed On Temporary Leave, 5 IPOs",6/18/2021 1:46:03 PM
WST,"The Daily Biotech Pulse: FDA Nod For Novartis, iRhythm CEO Quits Abruptly, Moderna Inks Vaccine Supply Agreements",6/2/2021 2:20:24 PM
WST,"The Daily Biotech Pulse: Vir-GlaxoSmithKline COVID-19 Antibody Treatment Approved, Zosano Spikes On Long-Term Migraine Drug Data, Decision Day For Eton, 2 IPOs",5/27/2021 2:23:09 PM
WST,"The Daily Biotech Pulse: Nabriva Jumps On Data, Larimar Wilts After Study Put On Hold, Travere To Delay Regulatory Filing",5/26/2021 1:33:21 PM
WST,"The Daily Biotech Pulse: Pfizer In Vaccine Supply Talks With India, Provention In Focus Ahead Of Briefing Doc, NeuroRx To List Via SPAC Deal",5/25/2021 1:53:39 PM
WST,"The Daily Biotech Pulse: Minerva, InflaRx Report Positive Data Readouts, Lucira COVID-19 Test Kit Available On Amazon, Decision Day For Heron",5/12/2021 2:57:17 PM
WST,West Pharmaceutical declares $0.17 dividend,5/5/2021 10:07:38 AM
WST,"The Daily Biotech Pulse: Vaxart Rebounds On Strong Vaccine Data, Pfizer's Beat-And-Raise Quarter, BioLineRx Data",5/4/2021 2:10:21 PM
WST,"The Daily Biotech Pulse: Hyperphosphatemia Drug Regulatory Review Extended, Phathom Pharma Data Readout, 2 IPOs",4/30/2021 1:31:19 PM
WST,"The Daily Biotech Pulse: Clinical Setback For Adverum, Galera Posts Data Readout, Moderna To Invest In Vaccine Manufacturing, Decision Day For Ardelyx",4/29/2021 2:15:50 PM
WST,West Pharmaceutical Q1 2021 Earnings Preview,4/28/2021 6:27:06 PM
WST,Here's what Wall Street expects from West Pharmaceutical Services's earnings,4/27/2021 3:02:23 PM
WST,"The Week Ahead In Biotech (April 25-May 1): FDA Decisions For Sol-Gel, Protalix Bio, Ardelyx",4/24/2021 3:24:00 PM
WST,"The Daily Biotech Pulse: Quidel Slides On Negative Pre-Announcement, Roche Gets Positive EMA Committee Recommendation, 3 IPOs",4/23/2021 1:28:48 PM
WST,"The Daily Biotech Pulse: KemPharm Receives $10M Milestone Payment, Zymergen, Neuropace Debut On Nasdaq, Renalytix Wins US Government Contract, 2 IPOs",4/22/2021 2:08:59 PM
WST,"The Daily Biotech Pulse: Moderna To Supply Variant-Specific Vaccine To Israel, Roche's Diagnostics Business Comes to Rescue",4/21/2021 1:31:27 PM
WST,"The Daily Biotech Pulse: Q1 Beat From Johnson & Johnson, KalVista Study Placed On Hold, European Label Expansion For GW Pharma's Epidiolex",4/20/2021 2:06:58 PM
WST,"The Daily Biotech Pulse: Lily-Rigel Licensing Deal, vTv Starts Early Stage Psoriasis Study, Immunic Data Readout",2/18/2021 2:14:38 PM
WST,West Pharmaceutical Q4 2020 Earnings Preview,2/17/2021 6:23:37 PM
WST,West Pharmaceutical Services earnings: here's what Wall Street expects,2/16/2021 3:01:35 PM
WST,"The Week Ahead In Biotech: FDA Decision On G1 Therapeutics, Earnings In The Mix For Light Calendar Week",2/14/2021 2:10:15 PM
WST,"Stitch Fix, Farfetch among top net purchases for Baron Asset Fund in 4Q",1/21/2021 7:54:30 PM
WST,"The Daily Biotech Pulse: Sarepta Gene Therapy Study Readout, Novavax Vaccine Supply Deal, 2 IPOs",1/8/2021 1:25:06 PM
WST,7 Coronavirus Stocks to Buy to Make Mass Vaccination Possible,1/5/2021 7:36:32 PM
WST,"Tesla leads list of 2020's biggest winners on both S&P 500, Nasdaq 100",1/1/2021 12:30:56 AM
WST,"West Pharmaceutical declares $0.17 dividend, announces buyback",12/9/2020 11:18:08 AM
WST,West Pharmaceutical raises dividend by 6.25% to $0.17,10/28/2020 10:11:37 AM
WST,"West Pharmaceutical EPS beats by $0.16, beats on revenue",10/22/2020 10:02:27 AM
WST,West Pharmaceutical Q3 2020 Earnings Preview,10/21/2020 4:40:02 PM
WST,7 Biotech Stocks To Buy For Profit From The Vaccine Crunch,10/7/2020 4:27:48 PM
WST,4 Pharmaceutical Stocks With Deep Pipelines,9/2/2020 2:21:45 PM
WST,Stock Alert: West Pharma Shares Hit 52-Week High ,8/31/2020 4:25:41 PM
WST,West Pharmaceutical Services earnings: here's what Wall Street expects,7/22/2020 3:01:36 PM
WST,West Pharmaceutical Services To Replace Helmerich & Payne In S&P 500 ,5/19/2020 3:07:24 AM
WST,Physicians Realty +7.9% on JCP-led index moves,5/18/2020 9:50:11 PM
WST,Citi cuts view on Illumina in premarket analyst action,4/24/2020 12:02:23 PM
WST,"West Pharmaceutical EPS beats by $0.19, beats on revenue",4/23/2020 10:00:59 AM
WST,Here's what Wall Street expects from West Pharmaceutical Services's earnings report,4/22/2020 3:01:37 PM
WST,Stock Alert: West Pharmaceutical Jumps 7.51% After Earnings Results ,2/14/2020 8:57:34 AM
WST,Here's what to expect from West Pharmaceutical Services's earnings report,2/12/2020 3:03:08 PM
WST,West Pharmaceutical Services earnings: here's what Wall Street expects,7/23/2019 3:02:02 PM
WST,West Pharmaceutical Services earnings: here's what Wall Street expects,4/23/2019 3:02:22 PM
WST,West Pharmaceutical Services is about to announce earnings — here's what Wall Street expects,2/12/2019 3:03:10 PM
WST,Here's what to expect from West Pharmaceutical Services's earnings,10/23/2018 3:02:10 PM
WST,Here's what Wall Street expects from West Pharmaceutical Services's earnings,7/24/2018 3:02:13 PM
WST,West's SelfDose™ Patient-Controlled Injector Wins Silver Medical Design Excellence Award,6/13/2018 7:00:00 PM
WST,West Announces Participation in Upcoming June Investor Conferences,5/24/2018 12:00:00 PM
WST,"West Announces Third-Quarter Dividend, Increase to Fourth-Quarter Dividend and Participation in Upcoming Investor Conferences",5/3/2018 12:00:00 PM
WST,West Announces First-Quarter 2018 Results,4/26/2018 12:00:00 PM
WST,West to Host First-Quarter 2018 Conference Call,4/12/2018 12:00:00 PM
WST,West to Showcase DAIKYO PLASCAP® RUV One-Step Press-Fit Vial Closure Solution at PDA Annual Meeting,3/19/2018 1:00:00 PM
WST,West Chief Financial Officer William Federici Announces Plans to Retire,3/2/2018 12:00:00 PM
WST,West Appoints Silji Abraham Chief Digital and Transformation Officer,2/26/2018 12:00:00 PM
WST,West Announces Fourth-Quarter and Full-Year 2017 Results and Announces Quarterly Dividend,2/15/2018 12:00:00 PM
WST,Alkermes Appoints Shane Cooke to Board of Directors,2/14/2018 2:00:00 PM
WST,SelfDose™ Patient-Controlled Injector Named as Recipient of Pharmapack Exhibitor Innovation Award,2/7/2018 8:00:00 PM
WST,West to Host Fourth-Quarter and Full-Year 2017 Conference Call,2/1/2018 1:00:00 PM
WST,IIROC Trading Halt - WST,1/22/2018 5:38:00 PM
WST,West Announces Quarterly Dividend and Participation in Upcoming Investor Conferences,12/22/2017 12:30:00 PM
WST,West Announces Upcoming Investor Conference,11/15/2017 1:00:00 PM
WST,West to Showcase New Extensions of the SmartDose® Drug Delivery Platform at the PDA Universe of Pre-filled Syringes and Injection Devices,11/6/2017 9:00:00 AM
WST,BRIEF-West reports Q3 earnings per share of $0.67 (WST),10/26/2017 1:52:13 PM
WST,West to Host Third-Quarter 2017 Conference Call,10/12/2017 1:00:00 PM
WST,Study Demonstrates Benefit of West's ID Adapter for Improving Intradermal Administration of Polio Vaccine,10/10/2017 2:00:00 PM
WST,West Announces Fall Investor Conference Schedule,8/25/2017 1:00:00 PM
WST,BRIEF-West Pharmaceutical announces increase to quarterly dividend (WST),7/20/2017 12:32:06 PM
WST,"Gerresheimer licenses syringe safety solution from West (GXI, WST)",7/17/2017 12:08:05 PM
WST,BRIEF-West Pharma Services elects new director to board (WST),6/1/2017 2:18:05 PM
WST,West to Present on Biologics Trends at InnoPack Pharma Confex,5/30/2017 2:00:00 PM
WST,West Announces Quarterly Dividend and Participation in Upcoming Investor Conferences,5/15/2017 10:30:00 PM
WST,West Highlights Company Scientific and Regulatory Expertise at Notable Industry Meetings,5/3/2017 2:00:00 PM
WST,"Golf Galaxy Opens 36 New Stores, Formerly Golfsmith Locations",5/1/2017 6:54:00 PM
WST,West Announces First-Quarter 2017 Results,4/27/2017 1:00:00 PM
WST,West to Host First-Quarter 2017 Conference Call,4/13/2017 2:00:00 PM
WST,"BRIEF-West Pharmaceutical Services, Daikyo Seiko enter amended and restated technology exchange (WST)",1/6/2017 10:34:05 PM
WST,BRIEF-West Pharma Q3 adj EPS $0.53; sees FY'16 adj EPS $2.17-$2.22 (WST),10/27/2016 2:10:20 PM
