Ticker,Title,Link
AEON,AEON Biopharma to Participate in the H.C. Wainwright 26th Annual Global Investment Conference 2024,8/19/2024 10:05:00 PM
AEON,AEON Biopharma reports Q2 results,8/13/2024 8:16:08 PM
AEON,AEON Biopharma Reports Second Quarter 2024 Financial Results and Provides Corporate Update,8/12/2024 10:05:00 PM
AEON,Today’s Biggest Pre-Market Stock Movers: 10 Top Gainers and Losers on Tuesday,7/16/2024 11:43:40 AM
AEON,Buy Rating Affirmed for AEON Biopharma on Strategic Biosimilar Pathway and Promising Phase 3 Study Prospects,7/10/2024 10:16:35 AM
AEON,AEON Biopharma announces strategic reprioritization for ABP-450,7/9/2024 2:49:03 PM
AEON,Buy Rating Affirmed for AEON Biopharma: Strategic Cost-Cutting and ABP-450’s Broad Market Potential,5/30/2024 10:29:33 AM
AEON,AEON Biopharma Announces Strategic Resource Reprioritization and Cost Reduction Plan,5/29/2024 2:00:00 PM
AEON,"Analysts Are Bullish on These Healthcare Stocks: AEON Biopharma (AEON), Palatin Technologies (PTN)",5/15/2024 3:20:55 PM
AEON,AEON Biopharma Reports First Quarter 2024 Financial Results,5/14/2024 10:05:00 PM
AEON, AEON Biopharma Provides Update on Development Pipeline,5/9/2024 2:00:00 PM
AEON,Maintaining Buy on AEON Biopharma: Potential of ABP-450 Despite Phase 2 Setback,5/6/2024 10:18:07 AM
AEON,"RCAT, SMFL and NUVO among mid-day movers",5/3/2024 4:51:44 PM
AEON,"INDO, IPDN and GSUN among mid-day movers",4/19/2024 4:45:34 PM
AEON,AEON Biopharma: Buoyant Prospects Following FDA Alignment on Migraine Studies,4/17/2024 10:25:24 AM
AEON,Gold Gains 1%; CXApp Shares Spike Higher,4/1/2024 9:02:51 PM
AEON,CORRECTION -- AEON Biopharma Announces Redemption of Public Warrants,3/31/2024 4:53:01 AM
AEON,AEON Biopharma Announces Redemption of Public Warrants,3/29/2024 9:15:00 PM
AEON,AEON Biopharma Announces Clinical Update and Productive End-of-Phase 2 Meeting with FDA on ABP-450 (prabotulinumtoxinA) for the Preventive Treatment of Migraine,3/19/2024 9:30:30 PM
AEON,Why UPS Shares Are Trading Lower By 8%? Here Are Other Stocks Moving In Tuesday's Mid-Day Session,1/30/2024 7:18:28 PM
AEON,"AEON Biopharma Presents Positive Clinical and Pre-clinical Data for ABP-450 (prabotulinumtoxinA) in Treating Cervical Dystonia and PTSD, Respectively, at a Leading Neurotoxin Conference",1/18/2024 10:05:00 PM
AEON,AEON Biopharma Completes Enrollment in Phase 2 Study of ABP-450 (prabotulinumtoxinA) for Preventive Treatment of Chronic Migraine,12/12/2023 2:00:00 PM
AEON,AEON Biopharma Reports Third Quarter 2023 Financial Results,11/13/2023 2:15:00 PM
AEON,Analysts Have Conflicting Sentiments on These NA Companies: Digital Realty (DLR) and AEON Biopharma (AEON),10/20/2023 10:20:32 AM
AEON,AEON Biopharma Announces Topline Results from Phase 2 Trial of ABP-450 (prabotulinumtoxinA) for the Preventive Treatment of Episodic Migraine,10/19/2023 10:05:00 PM
AEON,"SLGG, VERB and MYO among mid-day movers",9/12/2023 4:52:44 PM
AEON,"MVST, GDC and HYFM among mid-day movers",8/31/2023 4:41:47 PM
AEON,Why REX American Resources Are Trading Lower By 9%? Here Are Other Stocks Moving In Wednesday's Mid-Day Session,8/30/2023 7:17:52 PM
AEON,AEON Biopharma Presents Positive Results from Phase 2 Clinical Trial of ABP-450 (prabotulinumtoxinA) in Cervical Dystonia at the International Parkinson and Movement Disorders Society Congress®,8/29/2023 2:00:00 PM
AEON,AEON Biopharma Receives Notice of Allowance from USPTO for a Patent Covering Use of Botulinum Toxins to Treat Migraine Headache,8/24/2023 2:00:00 PM
AEON,"Benzinga's Top Ratings Upgrades, Downgrades For August 18, 2023",8/18/2023 5:00:37 PM
AEON,"Novo Integrated, Aeon top healthcare gainers; Impel, Jupiter Wellness among losers",8/16/2023 2:08:58 PM
AEON,"PLTR, W and IONQ are among pre market gainers",7/31/2023 12:37:42 PM
