Ticker,Title,Link
SPRB,"Analysts Offer Insights on Healthcare Companies: Pyxis Oncology (PYXS), Spruce Biosciences (SPRB) and Envista Holdings (NVST)",8/20/2024 7:02:14 AM
SPRB,"Analysts’ Opinions Are Mixed on These Healthcare Stocks: Kronos Bio (KRON), Spruce Biosciences (SPRB) and scPharmaceuticals (SCPH)",8/19/2024 10:30:27 AM
SPRB,"Spruce Biosciences GAAP EPS of -$0.22 beats by $0.01, revenue of $1.61M beats by $0.69M",8/13/2024 2:45:29 PM
SPRB,Optimistic Outlook for Spruce Biosciences: Tildacerfont’s Market Potential Amidst Upcoming Trial Data,7/26/2024 4:25:35 AM
SPRB,"Analysts Conflicted on These Healthcare Names: Tyra Bioscience (TYRA), Spruce Biosciences (SPRB) and UnitedHealth (UNH)",6/5/2024 10:20:32 AM
SPRB,Buy Rating Affirmed: Strategic Partnerships and Promising Trials Drive Optimism for Spruce Biosciences,6/4/2024 2:05:23 PM
SPRB,Hold Rating on Spruce Biosciences Amid Clinical Trial Uncertainties and Rising Competition,5/16/2024 8:09:24 AM
SPRB,Buy Rating Affirmed for Spruce Biosciences Amid Upcoming Trial Data and Strong Financial Position,5/14/2024 10:45:30 PM
SPRB,"Spruce Biosciences GAAP EPS of -$0.28 beats by $0.02, revenue of $2M beats by $0.84M",5/13/2024 9:38:01 PM
SPRB,Analysts Offer Insights on Healthcare Companies: Terns Pharmaceuticals (TERN) and Spruce Biosciences (SPRB),3/18/2024 4:30:16 AM
SPRB,"Spruce Biosciences' Hormone Treatment Stumbles In Trials, Prompts Stock Freefall",3/14/2024 9:15:32 PM
SPRB,Spruce Biosciences stock craters 75% on failed Phase 2 study,3/13/2024 9:39:31 PM
SPRB,"Analysts Are Bullish on Top Healthcare Stocks: Oxford BioMedica (OXBDF), EyePoint Pharmaceuticals (EYPT)",3/8/2024 1:51:10 AM
SPRB,Spruce Biosciences (SPRB) Gets a Buy from RBC Capital,2/26/2024 12:35:58 PM
SPRB,"Guggenheim starts Spruce Biosciences at buy, cites near-term catalysts",2/21/2024 7:33:16 PM
SPRB,Today’s Biggest Pre-Market Stock Movers: 10 Top Gainers and Losers on Tuesday,2/13/2024 12:26:28 PM
SPRB,Buy Rating on Spruce Biosciences: Anticipating Success with Tildacerfont amid a $2 Billion Market Opportunity,2/7/2024 1:34:53 PM
SPRB,"SYM, VRNS and RVMD are among after hour movers",2/5/2024 9:55:17 PM
SPRB,Analysts Offer Insights on Healthcare Companies: Spruce Biosciences (SPRB) and Scilex Holding Company (SCLX),1/23/2024 11:20:13 AM
SPRB,"Analysts Are Bullish on These Healthcare Stocks: Enanta Pharmaceuticals (ENTA), Spruce Biosciences (SPRB)",1/9/2024 6:21:11 AM
SPRB,Buy Rating Affirmed for Spruce Biosciences Amid Positive Clinical Trials and Market Potential for Tildacerfont,1/5/2024 11:27:47 AM
SPRB,"Analysts Are Bullish on Top Healthcare Stocks: Collegium Pharmaceutical (COLL), Spruce Biosciences (SPRB)",1/4/2024 5:10:24 PM
SPRB,Buy Rating Justified by Promising Efficacy and Market Potential of Spruce Biosciences’s Tildacerfont,12/5/2023 10:55:39 PM
SPRB,What 4 Analyst Ratings Have To Say About Spruce Biosciences,11/20/2023 6:00:22 PM
SPRB,Spruce Biosciences’ Tildacerfont Shows Promise: A Comprehensive Financial Analysis and Positive Outlook,11/16/2023 12:26:21 PM
SPRB,RBC Capital Reaffirms Their Buy Rating on Spruce Biosciences (SPRB),11/15/2023 1:47:35 AM
SPRB,Promising Trials and Robust Financials Bolster Spruce Biosciences’ Buy Rating: A Close Look at Tildacerfont’s Potential,11/14/2023 7:15:31 PM
SPRB,Buy Rating Issued for Spruce Biosciences: Strong Trial Performance and Promising Future for Tildacerfont,10/18/2023 2:45:32 PM
SPRB,Promising Future for Spruce Biosciences: A Buy Rating Based on Successful Pediatric and Adult CAH Trials,10/5/2023 5:15:47 PM
SPRB,"Analysts Are Bullish on Top Healthcare Stocks: Neurocrine (NBIX), HCA Healthcare (HCA)",9/13/2023 12:23:00 PM
SPRB,JMP Securities Sticks to Their Buy Rating for Spruce Biosciences (SPRB),9/12/2023 7:05:08 PM
SPRB,Why Hooker Furnishings Are Trading Lower By 15%? Here Are Other Stocks Moving In Friday's Mid-Day Session,9/8/2023 7:56:13 PM
SPRB,"Analysts Offer Insights on Healthcare Companies: Bioxcel Therapeutics (BTAI), Spruce Biosciences (SPRB) and Alpha Tau Medical Ltd (DRTS)",8/18/2023 10:20:07 AM
SPRB,Expert Ratings for Spruce Biosciences,8/16/2023 5:00:46 PM
SPRB,JMP Securities Sticks to Its Buy Rating for Spruce Biosciences (SPRB),8/15/2023 11:25:04 PM
SPRB,"Spruce Biosciences GAAP EPS of -$0.32, revenue of $2.2M",8/14/2023 9:18:34 PM
SPRB,"Pre-market Movers: EDTX, MVIS, LEJU, SPRB, LAES… ",6/15/2023 1:41:31 PM
SPRB,"Analysts Are Bullish on Top Healthcare Stocks: Spruce Biosciences (SPRB), Vaccitech Plc (VACC)",6/13/2023 10:30:19 AM
SPRB,"PRTS, CRBU and NDLS are among after hour movers",6/9/2023 9:15:14 PM
SPRB,Oppenheimer Remains a Buy on Spruce Biosciences (SPRB),5/23/2023 12:35:29 PM
SPRB,"Analysts Offer Insights on Healthcare Companies: Sarepta Therapeutics (SRPT), Spruce Biosciences (SPRB) and Centessa Pharmaceuticals (CNTA)",5/17/2023 12:40:18 AM
SPRB,"EVGO, EXTR and APLD are among after hour movers",5/16/2023 9:23:00 PM
SPRB,"Spruce Biosciences GAAP EPS of -$0.40, revenue of $1.96M",5/15/2023 4:06:59 PM
SPRB,4 Analysts Have This to Say About Spruce Biosciences,3/23/2023 6:01:02 PM
SPRB,"Analysts Offer Insights on Healthcare Companies: MoonLake Immunotherapeutics (MLTX), Spruce Biosciences (SPRB) and Immunome (IMNM)",3/20/2023 4:32:49 PM
SPRB,Analysts Offer Insights on Healthcare Companies: Matinas BioPharma (MTNB) and Spruce Biosciences (SPRB),3/17/2023 5:30:22 PM
SPRB,Spruce Biosciences GAAP EPS of -$1.96 beats by $0.05,3/16/2023 8:50:48 PM
SPRB,2 “Strong Buy” Penny Stocks With Multibagger Potential,2/23/2023 3:43:45 PM
SPRB,"BCRX, HOTH and SPRB are among pre market gainers",2/22/2023 1:29:25 PM
SPRB,"SFIX, SPRB and MHUA are among after hour movers",2/21/2023 11:06:30 PM
SPRB,Analysts Offer Insights on Healthcare Companies: Petiq (PETQ) and Spruce Biosciences (SPRB),2/13/2023 4:31:00 PM
SPRB,"Pre-market Movers: XPON, HPCO, LYFT, PHAT, AVXL… ",2/10/2023 12:56:17 PM
SPRB,Spruce Biosciences raises $53.6M in private financing,2/9/2023 2:53:02 PM
SPRB,"Illumina, ON Semiconductor, Euronav among premarket losers' pack",1/10/2023 1:23:23 PM
SPRB,Why CinCor Pharma Shares Are Trading Higher By 140%; Here Are 20 Stocks Moving Premarket,1/9/2023 2:04:48 PM
SPRB,Dow Jumps 700 Points; S&P 500 Rises Over 2%,1/6/2023 8:43:24 PM
SPRB,JMP Securities Remains a Buy on Spruce Biosciences (SPRB),1/5/2023 11:35:07 PM
SPRB,Today’s Biggest Pre-Market Stock Movers: 10 Top Gainers and Losers on Wednesday,12/21/2022 12:25:47 PM
SPRB,Today’s Biggest Pre-Market Stock Movers: 10 Top Gainers and Losers on Thursday,11/17/2022 12:26:00 PM
SPRB,Why Target Shares Are Trading Lower By 14%? Here Are 56 Stocks Moving In Wednesday's Mid-Day Session,11/16/2022 8:02:01 PM
SPRB,RBC Capital Keeps Their Buy Rating on Spruce Biosciences (SPRB),11/15/2022 1:45:40 AM
SPRB,Spruce Biosciences GAAP EPS of -$0.48 beats by $0.06,11/11/2022 4:34:53 AM
SPRB,Why WISeKey International Is Trading Higher By Over 20%; Here Are 29 Stocks Moving Premarket,10/6/2022 12:17:06 PM
SPRB,Why NLS Pharmaceutics Shares Tumbled Over 66%; Here Are 68 Biggest Movers From Yesterday,9/29/2022 11:09:35 AM
SPRB,Spruce Biosciences GAAP EPS of -$0.51 beats by $0.03,8/10/2022 9:33:46 PM
SPRB,"Turning Point, Amylyx top healthcare gainers; Novavax, Rallybio lead losers' pack",6/3/2022 2:00:10 PM
SPRB,Spruce Biosciences GAAP EPS of -$0.50 misses by $0.06,5/11/2022 8:39:06 PM
SPRB,"SPRB, RVMD and LYEL among after hour movers",4/8/2022 10:02:54 PM
SPRB,Where Spruce Biosciences Stands With Analysts,3/16/2022 2:14:48 PM
SPRB,Spruce Biosciences GAAP EPS of -$1.81,3/14/2022 9:52:55 PM
SPRB,"Benzinga's Top Ratings Upgrades, Downgrades For March 8, 2022",3/8/2022 4:04:26 PM
SPRB,"FCEL, MARA and CLNE among pre market gainers",1/26/2022 1:41:45 PM
SPRB,"Spruce Biosciences falls 9% amid pipeline update, outlook",1/24/2022 2:26:50 PM
SPRB,"Pre-market Movers: KAVL, ATHE, BLI, PSTV, CNSP… ",1/6/2022 1:34:31 PM
SPRB,"SomaLogic, Bio-Techne lead postmarket gainers; Berkeley Lights, ATA Creativity Global among losers",1/5/2022 10:24:40 PM
SPRB,"BBIO, SYTA and IMTE among mid-day movers",12/31/2021 5:22:08 PM
SPRB,45 Biggest Movers From Yesterday,12/29/2021 10:06:03 AM
SPRB,25 Stocks Moving In Tuesday's Mid-Day Session,12/28/2021 6:06:58 PM
SPRB,"PYR, SPRB and BBIO among mid-day movers",12/27/2021 6:01:50 PM
SPRB,50 Biggest Movers From Yesterday,12/23/2021 11:18:02 AM
SPRB,"PAVM, BLPH and LTRY among mid-day movers",12/22/2021 5:28:39 PM
SPRB,"The Daily Biotech Pulse: Aldeyra Sinks On Dry Eye Disease Readout, Sanofi Goes Shopping, Regulatory Setback For Aquestive, Aridis Touts Pan-Coronavirus Antibody Cocktail",12/21/2021 2:11:20 PM
SPRB,Mid-Afternoon Market Update: Dow Tumbles 500 Points; Bluerock Residential Growth Shares Spike Higher,12/20/2021 8:49:20 PM
SPRB,"SKM, SPRB and STRNW among technology movers",12/17/2021 8:12:59 PM
SPRB,"TPIC, CHRS among after-hours mover",12/16/2021 10:37:43 PM
SPRB,"Benzinga's Top Ratings Upgrades, Downgrades For December 10, 2021",12/10/2021 6:41:32 PM
SPRB,21 Stocks Moving in Thursday's Pre-Market Session,12/9/2021 1:30:02 PM
SPRB,"Benzinga's Top Ratings Upgrades, Downgrades For November 23, 2021",11/23/2021 4:09:30 PM
SPRB,80 Biggest Movers From Yesterday,11/17/2021 10:37:45 AM
SPRB,"Benzinga's Top Ratings Upgrades, Downgrades For November 16, 2021",11/16/2021 4:11:45 PM
SPRB,Spruce Biosciences EPS beats by $0.08,11/15/2021 9:55:29 PM
SPRB,"The Daily Biotech Pulse: Allogene Sinks On FDA Clinical Hold, Takeda Gets Adcom Backing, Quidel Reports Q3 COVID Revenues, IPOs",10/8/2021 1:31:18 PM
SPRB,"The Daily Biotech Pulse: Moderna Invests In Africa, Amgen Announces Neuroscience R&D Collaboration, Decision Day For Chemocentryx, Biophytis To Restate Results",10/7/2021 2:23:53 PM
SPRB,"The Daily Biotech Pulse: Merck Rallies On Antiviral Pill Data, Gilead Files For Yescarta Label Expansion, Exscientia IPO",10/1/2021 1:56:15 PM
SPRB,"The Daily Biotech Pulse: AbbVie's Migraine Drug OK'd By FDA, Amicus Spins Off Gene Therapy Business, Geovax In-Licenses Cancer Drug",9/29/2021 2:13:41 PM
SPRB,"The Daily Biotech Pulse: Restricted Authorization For Pfizer's COVID-19 Booster Dose, AbCellera Strikes Antibody Licensing Deal, Solid Biosciences Issues DMD Data",9/23/2021 1:56:57 PM
SPRB,"The Daily Biotech Pulse: Pfizer-BioNTech US Vaccine Contract, Summit Slumps On Adverse Regulatory Feedback, Cerevel CFO Departs",9/22/2021 1:45:28 PM
SPRB,"The Daily Biotech Pulse: Aprea Jumps On ESMO Presentation, Verrica Sinks On Regulatory Setback, Aerie CEO Quits, J&J Touts Positive COVID-19 Booster Shot Data",9/21/2021 2:20:50 PM
SPRB,"The Daily Biotech Pulse: Adcom Tryst For Pfizer/BioNTech Booster Shot, AbCellera's COVID Antibody Treatment Gets Expanded Use, Protagonist Slapped With Clinical Hold",9/17/2021 1:36:08 PM
SPRB,"The Daily Biotech Pulse: Leap, Phio, Silverback Among Early Movers On Oncology Conference Presentations, Aerie Slumps On Mixed Data, Axsome Commences Phase 3 Sleep Disorder Study",9/16/2021 1:48:49 PM
SPRB,"The Daily Biotech Pulse: Lilly, Regeneron Ink COVID-19 Drug Deal With US, Regulatory Setback For Calliditas, Theravance To Cut 75% Jobs, 4 IPOs",9/15/2021 1:38:39 PM
SPRB,"Catalyst watch for next week: Robinhood, FDA decisions and Jackson Hole",8/20/2021 7:30:21 PM
SPRB,"The Daily Biotech Pulse: Lilly Reorganizes Business Units In Neuroscience Focus, Helius Medical Spikes On Breakthrough Designation, Ra Medical Sells Dermatology Business",8/17/2021 2:28:53 PM
SPRB,"The Daily Biotech Pulse: Moderna's Vaccine Produces Durable Response Against Variants, FDA Approves Jazz's Sleep Disorder Drug, Dermata IPO",8/13/2021 1:43:02 PM
SPRB,"The Daily Biotech Pulse: Xeris Gets OK For Initiating Hyperthyroidism Study, Merck-Eisai Snag FDA Approval For Drug Combo, Decision Day For Jazz Pharma",8/12/2021 2:09:26 PM
SPRB,"The Daily Biotech Pulse: FDA Rejects FibroGen's Anemia Drug, Crinetics Gains On Positive Readout, BioCryst Withdraws Public Offering",8/11/2021 2:14:38 PM
SPRB,"The Daily Biotech Pulse: Arcturus Soars On COVID-19 Vaccine Updates, Merck's Keytruda On Track For More Label Expansions, Eliem Debuts",8/10/2021 1:55:36 PM
SPRB,"The Daily Biotech Pulse: Dicerna Slips On Data, Novavax Tightlipped On US Vaccine Approval, Adagio IPO",8/6/2021 1:42:39 PM
SPRB,"The Daily Biotech Pulse: Merck Reports Positive Keytruda Readout, Moderna Slips Despite Q2 Beat, Bayer To Buy Vividion For Up To $2B, GlycoMimetics Gets New CEO",8/5/2021 2:07:56 PM
SPRB,"The Daily Biotech Pulse: Pfizer's Positive Readout, NRx Strikes R&D Collaboration With Mannkind, Cerus & Invitae Jump On Earnings",8/4/2021 1:52:10 PM
SPRB,"The Daily Biotech Pulse: Sanofi Buys Translate Bio In $3.2B Deal, Lilly's Q2 Earnings Disappoint, Bausch To Spin Off Medical Aesthetics Business",8/3/2021 1:55:12 PM
SPRB,"Benzinga's Top Ratings Upgrades, Downgrades For July 19, 2021",7/19/2021 4:03:42 PM
SPRB,"The Daily Biotech Pulse: Sanofi, Translate Bio Start Early Stage Seasonal Flu Vaccine Study, Dr. Reddy's Launches Generic Vascepa, Halozyme Strikes Licensing Deal",6/22/2021 2:12:07 PM
SPRB,"Virpax Pharmaceuticals, Anavex Life Sciences leads healthcare gainers; Aptevo Therapeutics, Intec Pharma among major losers",6/21/2021 3:02:25 PM
SPRB,"The Daily Biotech Pulse: Orphazyme Falters At FDA, Athira's CEO Placed On Temporary Leave, 5 IPOs",6/18/2021 1:46:03 PM
SPRB,"The Daily Biotech Pulse: Biogen Faces Another Clinical Setback, CureVac's COVID-19 Vaccine Study Fails, Moment Of Reckoning For Orphazyme",6/17/2021 2:31:50 PM
SPRB,"The Daily Biotech Pulse: Regeneron COVID-19 Antibody Cocktail Data, FDA Nod For Mallinckrodt, Molecular Partners IPO",6/16/2021 2:20:39 PM
SPRB,"The Daily Biotech Pulse: Merck, AstraZeneca, Novartis Among Early Presenters At ASCO, Sanofi Strikes Breast Cancer Study Pact",6/4/2021 3:39:13 PM
SPRB,"The Daily Biotech Pulse: Vir-GlaxoSmithKline COVID-19 Antibody Treatment Approved, Zosano Spikes On Long-Term Migraine Drug Data, Decision Day For Eton, 2 IPOs",5/27/2021 2:23:09 PM
SPRB,"The Daily Biotech Pulse: Nabriva Jumps On Data, Larimar Wilts After Study Put On Hold, Travere To Delay Regulatory Filing",5/26/2021 1:33:21 PM
SPRB,Spruce presents positive phase 2 data on tildacerfont for adrenal disorder,5/24/2021 1:11:11 PM
SPRB,Spruce Biosciences EPS beats by $0.02,5/12/2021 8:53:42 PM
SPRB,"The Daily Biotech Pulse: Pfizer Vaccine 100% Effective In Adolescents, Equillium Readout, Amgen Goes Shopping, Achilles IPO",3/31/2021 1:41:12 PM
SPRB,"The Daily Biotech Pulse: Wave Life Sciences Pulls Plug On 2 Assets, Amarin's Vascepa Snags European Approval, Biocept Jumps On Earnings",3/30/2021 2:06:26 PM
SPRB,"The Daily Biotech Pulse: FDA Nod For Astellas, Seagen, Gilead Get Positive Regulatory Tidings From Europe, 3 IPOs",3/26/2021 12:28:52 PM
SPRB,Spruce Biosciences EPS beats by $0.34,3/22/2021 8:29:14 PM
SPRB,Seeking Alpha Catalyst Watch,3/19/2021 7:30:46 PM
SPRB,65 Biggest Movers From Yesterday,3/16/2021 11:29:14 AM
SPRB,"Week Ahead In Biotech (March 14-20): Update On Fibrogen-AstraZeneca's Anemia Drug, Earnings and Presentations",3/14/2021 1:14:58 PM
SPRB,Spruce Biosciences outlines milestones for 2021,1/6/2021 5:41:40 PM
SPRB,"KODK, TNXP, SNDL and MBIO among midday movers",12/7/2020 5:41:10 PM
SPRB,"Sundial Growers, FSD Pharma leads healthcare gainers; SCWorx, 9 Meters Biopharma among major losers",11/30/2020 4:06:24 PM
SPRB,"ADMP Snubbed Again, FDA Delay's Decision On BMY's Liso-cel, MRNA's COVID-19 Vaccine 94.5% Effective ",11/17/2020 8:10:16 AM
SPRB,"ANAB, GSK Amend Agreement, BSGM Plunges As COVID-19 Trial Flops, CATB Craters, MRTX Abuzz ",10/27/2020 6:43:58 AM
SPRB,Novo Holdings reports 21.5% stake in Spruce Biosciences,10/19/2020 10:00:38 AM
SPRB,"Spruce Biosciences Prices IPO Of 6.0 Mln Shares At $15, The Mid Of Expected Range ",10/9/2020 7:12:04 AM
SPRB,Healthcare IPOs For October 9 ,10/8/2020 3:25:30 AM
