Ticker,Title,Link
LPTV,"LPTV Stock Earnings: Loop Media Beats EPS, Misses Revenue for Q3 2024",8/8/2024 2:54:23 AM
LPTV,"Loop Media GAAP EPS of -$0.07 beats by $0.02, revenue of $4.4M misses by $0.06M",8/7/2024 8:45:04 PM
LPTV,Loop Media earnings preview: what Wall Street is expecting,8/6/2024 3:01:13 PM
LPTV,Today’s Biggest Pre-Market Stock Movers: 10 Top Gainers and Losers on Tuesday,7/30/2024 11:26:55 AM
LPTV,Why Is Chicken Soup for the Soul Entertainment (CSSE) Stock Down 29% Today?,7/1/2024 12:45:37 PM
LPTV,Loop Media announces $2.45M registered direct offering and private placement,5/31/2024 2:33:08 PM
LPTV,Strategic Realignment and Cost-Cutting Efforts Justify Buy Rating for Loop Media,5/6/2024 11:35:15 AM
LPTV,"LPTV Stock Earnings: Loop Media Misses EPS, Misses Revenue for Q2 2024",5/4/2024 12:53:01 AM
LPTV,"Loop Media GAAP EPS of -$0.11 misses by $0.01, revenue of $4M misses by $2.42M",5/3/2024 8:42:16 PM
LPTV,Loop Media earnings preview: what Wall Street is expecting,5/2/2024 3:01:13 PM
LPTV,Buy Rating Reaffirmed for Loop Media Amidst Strategic Cost-Cutting and Revenue Growth Opportunities,3/20/2024 11:25:17 AM
LPTV,"Analysts’ Opinions Are Mixed on These Communication Services Stocks: Snap (SNAP), Loop Media (LPTV) and Spotify Technology SA (SPOT)",2/7/2024 1:02:49 PM
LPTV,"Loop Media GAAP EPS of -$0.09 beats by $0.01, revenue of $10.17M beats by $0.61M",2/6/2024 9:56:38 PM
LPTV,Loop Media is about to announce its earnings — here's what Wall Street expects,2/5/2024 3:01:13 PM
LPTV,Optimistic Buy Rating for Loop Media Following Strategic Improvements and Financial Fortification,1/12/2024 10:06:18 AM
LPTV,Maintaining Buy Rating on Loop Media Amidst Advertising Tailwinds and Strategic Growth Initiatives,12/19/2023 12:35:50 PM
LPTV,Why Despegar.com Shares Are Trading Higher By Over 16%? Here Are Other Stocks Moving In Wednesday's Mid-Day Session,12/13/2023 7:40:34 PM
LPTV,Loop Media Inc Registered Shs hosts conference call for investors,12/12/2023 2:45:01 PM
LPTV,What Wall Street expects from Loop Media's earnings,12/11/2023 3:01:13 PM
LPTV,Why Comtech Telecommunications Shares Are Trading Lower By Over 16%? Here Are Other Stocks Moving In Friday's Mid-Day Session,12/8/2023 6:57:59 PM
LPTV,Top 5 Tech And Telecom Stocks That May Explode This Month,10/13/2023 2:13:37 PM
LPTV,Why Delta Apparel Shares Are Trading Higher By Around 8%; Here Are 20 Stocks Moving Premarket,10/3/2023 2:04:10 PM
LPTV,Why Avantax Shares Are Trading Higher By Over 27%? Here Are Other Stocks Moving In Monday's Mid-Day Session,9/11/2023 7:39:08 PM
LPTV,"GDC, HUYA among major communication services gainer; GRPN, LPTV among losers",8/28/2023 6:57:51 PM
LPTV,"LDWY, GETY among major communication services gainer; AMC, WB among losers",8/25/2023 7:05:47 PM
LPTV,"GMGI, CXDO among major communication services gainer; AMC, MSGM among losers",8/22/2023 7:12:17 PM
LPTV,B.Riley Financial Sticks to Their Buy Rating for Loop Media (LPTV),8/14/2023 12:45:17 PM
LPTV,Why Cutera Shares Are Trading Lower By Around 22%? Here Are Other Stocks Moving In Wednesday's Session,8/9/2023 9:17:48 PM
LPTV,7 Up-and-Coming Stocks to Buy for the Next Decade,6/29/2023 8:49:59 PM
LPTV,This Analyst With 87% Accuracy Rate Sees Around 16% Upside In Home Depot - Here Are 5 Stock Picks For Last Week From Wall Street's Most Accurate Analysts,6/12/2023 1:52:40 PM
LPTV,Why American Software Shares Are Trading Lower By Over 20%? Here Are Other Stocks Moving In Friday's Mid-Day Session,6/9/2023 6:49:35 PM
LPTV,Loop Media Provides Q3 Guidance Below Street Estimates On Macro Headwinds,6/2/2023 2:42:15 PM
LPTV,"AYX, CHWY and BLUE arer among pre market gainers",6/1/2023 12:37:05 PM
LPTV,Why Capri Holdings Shares Are Trading Lower By Around 11%? Here Are Other Stocks Moving In Wednesday's Mid-Day Session,5/31/2023 7:01:38 PM
LPTV,Loop Media reports FQ2 results,5/11/2023 8:43:44 PM
LPTV,"WTER, CDLX and CSSE are among consumer movers",4/6/2023 4:20:09 PM
LPTV,Why Jounce Therapeutics Shares Are Trading Higher By 23%? Here Are Other Stocks Moving In Monday's Mid-Day Session,3/27/2023 7:22:22 PM
LPTV,"Loop Media GAAP EPS of -$0.09 beats by $0.01, revenue of $14.8M beats by $0.96M",2/7/2023 9:15:51 PM
LPTV,"Catalyst watch: Tesla looks to end skid, Nike earnings, Rocket Lab launch and Broadcom-VMware review",12/16/2022 8:00:08 PM
LPTV,"Loop Media GAAP EPS of -$0.28 misses by $0.16, revenue of $12.15M beats by $0.11M",12/13/2022 9:11:02 PM
LPTV,Today’s Biggest Pre-Market Stock Movers: 10 Top Gainers and Losers on Tuesday,12/6/2022 12:29:42 PM
LPTV,Gold Down 1%; China Pharma Shares Spike Higher,12/5/2022 6:27:32 PM
LPTV,"Benzinga's Top Ratings Upgrades, Downgrades For October 17, 2022",10/17/2022 4:02:32 PM
LPTV,Why Avenue Therapeutics Shares Surged Around 106%; Here Are 87 Biggest Movers From Yesterday,9/23/2022 9:42:11 AM
LPTV,"Loop Media stock gains after uplisting to NYSE American, $12M public offering",9/22/2022 4:29:26 PM
