Ticker,Title,Link
NTRS,"Analysts’ Opinions Are Mixed on These Financial Stocks: Northern (NTRS), Western Union (WU) and Ares Management (ARES)",8/5/2024 7:43:34 AM
NTRS,Bank stocks dive as weak jobs report boosts bets on Fed rate cuts,8/2/2024 5:13:39 PM
NTRS,Morgan Stanley Keeps Their Sell Rating on Northern (NTRS),7/30/2024 12:17:54 PM
NTRS,Northern’s Outlook: Moderate EPS Growth with Structural Profitability Risks,7/22/2024 8:05:19 AM
NTRS,Northern (NTRS) Receives a Hold from Seaport Global,7/19/2024 12:57:17 PM
NTRS,Morgan Stanley Remains a Sell on Northern (NTRS),7/18/2024 12:36:18 PM
NTRS,Nasdaq 100 Suffers Worst Day In 11 Months As Chipmakers Tumble On China Curbs; Magnificent 7 Wipe Out $500B : What's Driving Markets Wednesday?,7/17/2024 8:27:47 PM
NTRS,Northern Trust declares $0.75 dividend,7/16/2024 8:45:33 PM
NTRS,Most shorted S&P 500 financial stocks at June's end,7/15/2024 3:17:14 PM
NTRS,"Earnings week ahead: BAC, GS, JNJ, TSM, UNH, ABT, UAL, NFLX, AXP and more",7/14/2024 12:00:00 PM
NTRS,"Big banks Q2 earnings expected to show rebounding IB, soft loan growth",7/11/2024 5:07:00 PM
NTRS,J.P. Morgan Remains a Hold on Northern (NTRS),7/9/2024 12:15:24 PM
NTRS,Northern (NTRS) Receives a Buy from Jefferies,7/3/2024 12:17:57 PM
NTRS,Morgan Stanley Sticks to Their Sell Rating for Northern (NTRS),7/2/2024 12:36:49 PM
NTRS,Northern (NTRS) Gets a Buy from RBC Capital,6/29/2024 1:45:53 AM
NTRS,Expert Ratings For Northern Trust,6/27/2024 3:00:39 PM
NTRS,Hold Rating on Northern Trust Maintained Amid Mixed Earnings Outlook and Historical Valuation,6/26/2024 9:35:16 PM
NTRS,Here's How BlackBerry is Placed Ahead of Q1 Earnings,6/24/2024 9:59:27 PM
NTRS,Northern Trust Asset Management names Naoto Komoro as head of Japan office,6/20/2024 7:16:17 AM
NTRS,Least shorted S&P 500 stocks in May,6/18/2024 2:34:48 PM
NTRS,Most shorted S&P 500 financial stocks,6/13/2024 2:47:00 PM
NTRS,Maintaining Hold: Balancing Wealth Management Growth and Capital Strategy Amid Rising Expenses,6/11/2024 10:55:24 PM
NTRS,Partners Group selects Northern Trust for asset servicing,5/28/2024 10:29:03 AM
NTRS,Analysts Have Conflicting Sentiments on These Financial Companies: PennyMac Financial (PFSI) and Northern (NTRS),5/15/2024 9:40:33 AM
NTRS,Wells Fargo Sticks to Their Hold Rating for Northern (NTRS),5/8/2024 1:09:18 AM
NTRS,"With rate cuts pushed out, Goldman looks at quality stocks",4/28/2024 7:24:54 PM
NTRS,"Analysts Conflicted on These Financial Names: Northern (NTRS), Banc of California (BANC) and MSCI (MSCI)",4/24/2024 8:50:55 AM
NTRS,Seaport Global Reaffirms Their Hold Rating on Northern (NTRS),4/18/2024 1:26:23 PM
NTRS,Northern Trust Corporation 4.7% DP SH PF E declares $0.2938 dividend,4/17/2024 12:28:42 PM
NTRS,"Stocks Grapple With Geopolitical Pressures, Gold Eyes $2,400, Bitcoin Falls Below $62,000: What's Driving Markets Tuesday?",4/16/2024 7:28:15 PM
NTRS,Northern Trust Q1 2024 Earnings Preview,4/15/2024 4:46:40 PM
NTRS,Northern (NTRS) Gets a Hold from Evercore ISI,4/5/2024 4:15:26 AM
NTRS,The Analyst Landscape: 5 Takes On Northern Trust,4/4/2024 10:00:29 PM
NTRS,Low Interest Rates Can Help These Commercial Banks Rally Higher,4/3/2024 6:07:01 PM
NTRS,This Underrated Natural Gas Stock Could Rally Double-Digits Soon,4/2/2024 7:54:05 PM
NTRS,Northern (NTRS) Gets a Hold from Wells Fargo,3/28/2024 8:58:33 AM
NTRS,Deutsche Bank opens Buy catalyst call on Northern Trust ahead of Q1 earnings,3/19/2024 3:39:02 PM
NTRS,Northern (NTRS) Receives a Buy from RBC Capital,3/14/2024 1:45:28 AM
NTRS,State Street bucks wider bank rally as it sees higher credit loss provision,3/5/2024 7:43:08 PM
NTRS,Stocks with the most insider buying and selling,3/3/2024 7:54:47 PM
NTRS,Barclays Sticks to Their Hold Rating for Northern (NTRS),2/29/2024 11:44:27 AM
NTRS,"Analysts Have Conflicting Sentiments on These Financial Companies: Northern (NTRS), Essent Group (ESNT) and SelectQuote (SLQT)",2/12/2024 12:11:01 PM
NTRS,"Citi, BofA, Goldman Sachs, BNY Mellon upped at Morgan Stanley on endgame lightening",1/30/2024 4:00:57 PM
NTRS,The Latest Analyst Ratings For Northern Trust,1/19/2024 3:01:03 PM
NTRS,"Northern Trust Corp. Bottom Line Drops In Q4, misses estimates",1/18/2024 1:14:52 PM
NTRS,Here's what Wall Street expects from Northern Trust's earnings report,1/17/2024 3:01:13 PM
NTRS,"Top Bank Stock Picks For 2024: 'Valuations Are At 50% Discount To S&P 500,' Analysts Say",1/4/2024 8:11:26 PM
NTRS,Analyst Issues Sell Rating for Northern Trust Amid Overvaluation Concerns and Competitive Disparities,1/3/2024 9:07:07 AM
NTRS,Demystifying Northern Trust: Insights From 6 Analyst Reviews,1/2/2024 3:00:36 PM
NTRS,"Analysts Offer Insights on Financial Companies: Northern (NTRS), Ninety One (OtherNINTF) and BANK POLSKA KASA OPIEKI SA (OtherBKPKF)",12/19/2023 12:20:12 PM
NTRS,Northern (NTRS) Gets a Hold from Wells Fargo,12/14/2023 10:17:19 AM
NTRS,Balancing Act: A Hold Rating for Northern Amidst Efficiency Drives and Market Challenges,12/7/2023 10:39:19 AM
NTRS,Analyst Ratings for Northern Trust,12/1/2023 5:00:35 PM
NTRS,Hold Rating for Northern: A Strategic Approach towards Sustainable Financial Performance and Cost Efficiency,11/10/2023 2:41:32 PM
NTRS,Bank of America Says This ‘Buy’ Signal Could Trigger an 11% Upswing in S&P 500 Next Year — Here Are 2 Stocks the Banking Giant Likes Right Now,11/8/2023 8:39:00 PM
NTRS,Bank Stocks Hit Historic 80-Year Low Vs. S&P 500: Analyst Sees Bear Market Bounce As Fed Rates Peak,11/6/2023 6:03:36 PM
NTRS,Analyst Expectations for Northern Trust's Future,10/19/2023 11:00:25 PM
NTRS,"Northern Trust Corp. Profit Retreats In Q3, but beats estimates",10/18/2023 1:20:39 PM
NTRS,Here's what to expect from Northern Trust's earnings report,10/17/2023 3:01:13 PM
NTRS,J.P. Morgan Sticks to Its Hold Rating for Northern (NTRS),10/9/2023 12:16:33 PM
NTRS,RBC Capital Maintains Outperform Rating for Northern Trust: Here's What You Need To Know,9/19/2023 7:00:12 PM
NTRS,Morgan Stanley Maintains Equal-Weight Rating for Northern Trust: Here's What You Need To Know,9/15/2023 7:00:34 PM
NTRS,Analyst Ratings for Northern Trust,9/12/2023 9:00:20 PM
NTRS,U.S. regulators propose long-term debt rules for big banks,8/30/2023 5:43:14 PM
NTRS,Rising Risk: US Banks Face Deposit Flight Threat With Shrinking Profits,8/13/2023 3:50:21 PM
NTRS,"US Banking Sector Shaken: Moody's Drops Credit Ratings Of 10 Banks, Sounds Alarm For More Downgrades",8/8/2023 3:02:20 PM
NTRS,"Analysts’ Opinions Are Mixed on These Financial Stocks: Northern (NTRS), Ares Management (ARES) and Moody’s (MCO)",7/26/2023 7:40:55 AM
NTRS,Where Northern Trust Stands With Analysts,7/21/2023 5:00:25 PM
NTRS,Barclays Sticks to Its Hold Rating for Northern (NTRS),7/20/2023 9:55:18 AM
NTRS,"AT&T, Carvana, Northern Trust, And Other Big Stocks Moving Higher On Wednesday",7/19/2023 4:23:13 PM
NTRS,Here's what to expect from Northern Trust's earnings,7/18/2023 3:01:13 PM
NTRS,Bank Q2 earnings set to kick off with the bar set low as rates stay high,7/13/2023 7:36:00 PM
NTRS,"Benzinga's Top Ratings Upgrades, Downgrades For July 10, 2023",7/10/2023 5:02:11 PM
NTRS,Analyst Expectations for Northern Trust's Future,7/5/2023 3:00:29 PM
NTRS,"Northern Trust maintains quarterly dividend, stress capital buffer unchanged",7/3/2023 7:08:38 AM
NTRS,All 23 banks pass Federal Reserve's stress test on capital levels,6/28/2023 8:32:36 PM
NTRS,Northern (NTRS) Gets a Hold from Barclays,6/27/2023 8:46:59 AM
NTRS,Northern (NTRS) Receives a Rating Update from a Top Analyst,6/15/2023 1:45:44 AM
NTRS,"Analysts Conflicted on These Financial Names: S&P Global (SPGI), Northern (NTRS) and PNC Financial (PNC)",6/14/2023 4:30:30 PM
NTRS,Stronger capital rules may be coming for the largest U.S. banks,6/5/2023 7:41:19 AM
NTRS,9 Analysts Have This to Say About Northern Trust,6/1/2023 3:02:11 PM
NTRS,Northern (NTRS) Gets a Hold from J.P. Morgan,5/16/2023 12:15:31 PM
NTRS,"Benzinga's Top Ratings Upgrades, Downgrades For April 26, 2023",4/26/2023 5:00:26 PM
NTRS,Northern Trust falls after increased provisions impact Q1 earnings,4/25/2023 6:42:10 PM
NTRS,Northern Trust Q1 2023 Earnings Preview,4/24/2023 4:33:55 PM
NTRS,Barclays Reaffirms Their Hold Rating on Northern (NTRS),4/12/2023 10:25:44 AM
NTRS,6 Analysts Have This to Say About Northern Trust,4/10/2023 6:01:41 PM
NTRS,Northern Trust Enhances Digital Workflow Experience for Private Capital Fund Managers,3/30/2023 3:00:00 PM
NTRS,Expert Ratings for Northern Trust,3/24/2023 2:00:42 PM
NTRS,"Should the FDIC deposit insurance cap be kept, waived or raised?",3/21/2023 11:34:54 AM
NTRS,"CINF, SSSS and NTRS are among after hour movers",3/17/2023 9:22:43 PM
NTRS,Buy Oversold Bank Stocks with These ETFs,3/16/2023 8:34:12 PM
NTRS,"Analysts Have Conflicting Sentiments on These Financial Companies: Royal Bank Of Canada (RY), Northern (NTRS) and UWM Holding (UWMC)",3/2/2023 8:20:47 AM
NTRS,7 A-Rated Healthcare Stocks to Buy for the Future of Medicine,2/12/2023 3:56:18 PM
NTRS,U.S. banks to face harsher adverse scenario in Fed's 2023 stress tests,2/10/2023 2:16:26 PM
NTRS,Northern (NTRS) Gets a Sell from J.P. Morgan,2/9/2023 12:15:08 PM
NTRS,Morgan Stanley Maintains Equal-Weight Rating for Northern Trust: Here's What You Need To Know,2/1/2023 6:00:50 PM
NTRS,Northern (NTRS) Gets a Buy from RBC Capital,1/21/2023 1:57:07 AM
NTRS,Analyst Expectations for Northern Trust's Future,1/20/2023 8:00:43 PM
NTRS,Northern Trust Q4 earnings miss as noninterest income slides on security losses,1/19/2023 2:29:13 PM
NTRS,Northern Trust declares $0.75 dividend,1/18/2023 10:14:05 PM
NTRS,"Will This Week Bring Investors Good News? Netflix, Goldman, P&G And Other Key Earnings Reports To Watch",1/16/2023 6:31:24 PM
NTRS,"JPMorgan, Citi, BofA kick off Q4 earnings as interest rates poised to help and hurt",1/12/2023 9:03:46 PM
NTRS,"Bank of America, Wells Fargo among bank upgrades at Odeon amid cycle shift",1/10/2023 4:25:21 PM
NTRS,Big Banks To Kick Off Q4 Earnings Season Amid Expectations For First S&P 500 Profit Decline In More Than 2 Years,1/8/2023 11:00:11 PM
NTRS,"Futu, Credit Acceptance, Nu top week's financial losers by wide margin",1/7/2023 3:36:00 PM
NTRS,"Wells Fargo, JPMorgan, Northern Trust most preferred banks into Q4 results: Morgan Stanley",1/6/2023 5:29:29 PM
NTRS,"Benzinga's Top Ratings Upgrades, Downgrades For January 4, 2023",1/4/2023 4:01:18 PM
NTRS,5 Investors Betting Big on Cenntro Electric (CENN) Stock,12/21/2022 9:39:50 PM
NTRS,Northern (NTRS) Receives a Rating Update from a Top Analyst,12/8/2022 1:45:47 AM
NTRS,Analyst Ratings for Northern Trust,12/1/2022 3:02:30 PM
NTRS,Analysts Offer Insights on Financial Companies: Northern (NTRS) and ASX Limited (OtherASXFF),11/18/2022 12:12:36 PM
NTRS,"Benzinga's Top Ratings Upgrades, Downgrades For October 20, 2022",10/20/2022 4:03:57 PM
NTRS,Northern Trust Corp. Slips 5% As Results Miss View ,10/19/2022 4:26:35 PM
NTRS,Northern Trust declares $0.75 dividend,10/18/2022 8:19:29 PM
NTRS,"JPMorgan, Citi, Morgan Stanley, Wells Fargo lead off Q3 bank earnings Friday",10/13/2022 7:47:00 PM
NTRS,J.P. Morgan Reaffirms Their Sell Rating on Northern (NTRS),10/12/2022 12:05:55 PM
NTRS,"Citi puts JPMorgan on positive catalyst, upgrades BNY Mellon, cuts M&T",10/4/2022 12:49:54 PM
NTRS,Expert Ratings for Northern Trust,9/30/2022 7:16:24 PM
NTRS,Jefferies Sticks to Its Buy Rating for Northern (NTRS),9/26/2022 12:45:05 PM
NTRS,"Wall Street consensus on bank deposits likely too high in QT environment, Evercore says",8/28/2022 2:41:00 PM
NTRS,What 12 Analyst Ratings Have To Say About Northern Trust,8/12/2022 9:06:14 PM
NTRS,Expert Ratings for Northern Trust,7/21/2022 6:05:19 PM
NTRS,"Northern Trust Corp. Q2 Profit Advances, but misses estimates",7/20/2022 1:43:53 PM
NTRS,Northern Trust Q2 2022 Earnings Preview,7/19/2022 3:54:15 PM
NTRS,"Banks to see net interest income growing, fees falling, credit fine in Q2, analysts say",7/12/2022 9:22:17 PM
NTRS,The “Sleeper” Stock Quietly Beating Robinhood,7/1/2022 6:44:55 PM
NTRS,9 Stocks to Survive a “Dead Cat Bounce”,6/29/2022 6:12:36 PM
NTRS,State Street downgraded to Hold at Deutsche Bank on EPS estimates cut,6/28/2022 2:15:05 PM
NTRS,Piper Sandler Maintains Overweight Rating for Northern Trust: Here's What You Need To Know,6/24/2022 6:01:07 PM
NTRS,All 34 banks in Federal Reserve's stress test would weather severe recession,6/23/2022 8:35:10 PM
NTRS,Financial stocks slump as JPMorgan's Dimon issues 'hurricane' warning,6/1/2022 3:55:20 PM
NTRS,Analyst Ratings for Northern Trust,5/19/2022 5:29:03 PM
NTRS,"Top News In Fintech And Beyond For May 13, 2022",5/13/2022 2:32:21 AM
NTRS,Citizens Financial raises prime lending rate after FED move,5/5/2022 8:46:11 AM
NTRS,What 4 Analyst Ratings Have To Say About Northern Trust,4/27/2022 6:03:01 PM
NTRS,Northern Trust declares $0.70 dividend,4/26/2022 9:05:21 PM
NTRS,Northern Trust Q1 2022 Earnings Preview,4/25/2022 5:31:20 PM
NTRS,Goldman highlights 25 tactical options trades for earnings season,4/13/2022 12:07:24 PM
NTRS,"Banks' Q1 earnings will reflect strong consumer, weak equity capital markets",4/10/2022 2:13:00 PM
NTRS,"Benzinga's Top Ratings Upgrades, Downgrades For March 30, 2022",3/30/2022 4:22:21 PM
NTRS,Expert Ratings For Northern Trust,3/28/2022 5:04:20 PM
NTRS,"Financial stocks get some relief as Treasury yields rise, oil price surge pauses",3/8/2022 6:36:01 PM
NTRS,Analyst Ratings For Northern Trust,2/18/2022 3:48:57 PM
NTRS,Bank stress tests will pose a bigger economic drop from higher starting point in '22,2/11/2022 6:34:24 PM
NTRS,Expert Ratings For Northern Trust,1/21/2022 8:14:29 PM
NTRS,Northern Trust stock edges higher on robust Q4 net interest income growth,1/20/2022 2:10:26 PM
NTRS,Northern Trust Q4 Earnings Preview,1/19/2022 5:17:52 PM
NTRS,Banks' Q4 earnings to reflect loan growth and strong credit but lower fees,1/11/2022 5:57:39 PM
NTRS,"Benzinga's Top Ratings Upgrades, Downgrades For January 5, 2022",1/5/2022 4:08:49 PM
NTRS,What 4 Analyst Ratings Have To Say About Northern Trust,1/4/2022 5:07:03 PM
NTRS,What 4 Analyst Ratings Have To Say About Northern Trust,12/6/2021 5:13:39 PM
NTRS,"Financial stocks gain after Powell renomination, chances of '22 rate hike increase",11/22/2021 3:58:42 PM
NTRS,Emerald Technology Ventures Adopts Private Equity Servicing with Broadridge Blockchain Solution,11/1/2021 8:00:00 AM
NTRS,"Northern Trust Q3 Results Rise, Top Estimates - Quick Facts ",10/20/2021 2:15:04 PM
NTRS,Notable earnings before Wednesday's open,10/19/2021 3:06:57 PM
NTRS,Here's what Wall Street expects from Northern Trust's earnings,10/18/2021 3:01:24 PM
NTRS,"Benzinga's Top Ratings Upgrades, Downgrades For October 8, 2021",10/8/2021 5:52:27 PM
NTRS,"Benzinga's Top Ratings Upgrades, Downgrades For October 7, 2021",10/7/2021 4:02:38 PM
NTRS,"Banks, insurers climb higher as 10-year Treasury yield breaks above 1.5%",10/5/2021 3:56:45 PM
NTRS,"Citigroup, Comerica stock climb as higher Treasury yields fuel financial sector",9/23/2021 4:59:40 PM
NTRS,Northern Trust Corp. Q2 Profit Rises,7/21/2021 1:37:58 PM
NTRS,Northern Trust Q2 2021 Earnings Preview,7/20/2021 4:40:01 PM
NTRS,Here's what to expect from Northern Trust's earnings report,7/19/2021 3:01:28 PM
NTRS,Investors to focus on banks' H2 guidance in Q2 earnings report this week,7/11/2021 9:05:00 PM
NTRS,Bank stocks gain after passing stress test; Capital One stands out as winner,6/25/2021 4:09:22 PM
NTRS,Stress tests: All 23 banks clear minimum risk levels set by the Fed,6/24/2021 8:39:01 PM
NTRS,Fundsmith SICAV picks Northern Trust to provide asset servicing solutions,6/21/2021 9:42:52 AM
NTRS,What banks will stand out on Thursday's stress test results?:  Analysts discuss,6/20/2021 5:04:00 PM
NTRS,Northern Trust surpasses $1T in defined contribution global assets,6/17/2021 3:17:52 PM
NTRS,"Inflation scare fuels commodities rally, but what's in store for financial stocks?",5/16/2021 9:37:00 PM
NTRS,Stocks That Hit 52-Week Highs On Monday,5/10/2021 5:26:20 PM
NTRS,Northern Trust declares $0.70 dividend,4/20/2021 9:07:16 PM
NTRS,Northern Trust Q1 2021 Earnings Preview,4/19/2021 6:10:33 PM
NTRS,Northern Trust earnings preview: what to expect,4/18/2021 3:01:24 PM
NTRS,"Benzinga's Top Ratings Upgrades, Downgrades For April 7, 2021",4/7/2021 4:06:42 PM
NTRS,Stocks That Hit 52-Week Highs On Tuesday,3/30/2021 4:53:45 PM
NTRS,Citigroup and JPMorgan lead bank stocks lower after Federal Reserve lets SLR temporary rule expire,3/19/2021 1:38:06 PM
NTRS,Fed to stress test banks with 'W'-shaped severely adverse scenario,2/14/2021 10:16:19 PM
NTRS,Northern Trust Corporation -- Moody's announces completion of a periodic review of ratings of Northern Trust Corporation,2/5/2021 3:10:00 PM
NTRS,Big banks await Fed decision on whether it extends a rule at the end of March,1/31/2021 10:04:00 PM
NTRS,"Benzinga's Top Ratings Upgrades, Downgrades For January 22, 2021",1/22/2021 4:03:51 PM
NTRS,Northern Trust Corp. Announces Fall In Q4 Earnings,1/21/2021 1:50:52 PM
NTRS,Northern Trust declares $0.70 dividend,1/20/2021 10:43:23 PM
NTRS,Northern Trust earnings: here's what Wall Street expects,1/19/2021 3:01:24 PM
NTRS,"Benzinga's Top Upgrades, Downgrades For January 5, 2021",1/5/2021 4:11:08 PM
NTRS,"A weaker dollar may be a good thing for banks, KBW says",12/28/2020 6:44:00 PM
NTRS,Goldman Sachs crowned winner of Fed's CCAR; M&T Bank loses,12/21/2020 4:33:58 PM
NTRS,Bank stocks gain as Fed loosen restriction on buybacks,12/18/2020 10:49:28 PM
NTRS,Northern Trust renews partnership with Wharton Global Family Alliance,12/10/2020 3:43:52 PM
NTRS,"Standard Chartered, Northern Trust Team To Launch Cryptocurrency Custodian Zodia ",12/9/2020 6:45:49 AM
NTRS,JPMorgan turns bearish on Northern Trust on money market outflows,12/1/2020 1:48:17 PM
NTRS,"State Street Bank and Trust Company -- Moody's affirms all ratings of BNY Mellon, Northern Trust and State Street; outlooks remain stable",11/13/2020 11:13:00 AM
NTRS,"BNY Mellon National Association -- Moody's affirms all ratings of BNY Mellon, Northern Trust and State Street; outlooks remain stable",11/12/2020 7:12:00 PM
NTRS,"What election 2020 uncertainty means for banks, financials: analysts speak",11/4/2020 7:35:39 PM
NTRS,Northern Trust Q3 clouded by $43M processing error,10/21/2020 1:55:44 PM
NTRS,Northern Trust Q3 2020 Earnings Preview,10/20/2020 4:31:32 PM
NTRS,Financials still stuck in Main Street vs. Wall Street tug of war,10/14/2020 4:42:05 PM
NTRS,Northern Trust appointed as custodian for $7B insurance mandate for Federated Mutual Insurance,10/7/2020 2:25:39 PM
NTRS,7 Cheap Stocks to Buy Today For A Defensive Bargain,10/5/2020 7:44:03 PM
NTRS,Northern Trust Corp. Q2 Earnings Drop,7/22/2020 1:43:32 PM
NTRS,Northern Trust earnings preview: what Wall Street is expecting,7/21/2020 3:01:34 PM
NTRS,5 Stocks to Buy That Have Steady Dividends and Earnings,6/29/2020 4:58:04 PM
NTRS,FDIC shows effects of COVID-19 on banking industry,6/17/2020 7:17:26 AM
NTRS,BlackRock's Aladdin expands to Northern Trust's Whole Office,5/28/2020 2:12:31 PM
NTRS,Northern Trust shutting fund; an outlier or sign of future risk?,5/20/2020 9:59:11 PM
NTRS,Northern Trust appoints new EMEA CTO,4/27/2020 8:51:50 AM
NTRS,Northern Trust Corp. Profit Rises In Q1,4/21/2020 1:34:09 PM
NTRS,Northern Trust earnings preview: what Wall Street is expecting,4/20/2020 3:01:28 PM
NTRS,Biggest U.S. banks should raise $200B in capital - Kashkari,4/16/2020 9:39:06 AM
NTRS,Goldman recalibrates capital markets sector ratings,3/24/2020 12:53:46 PM
NTRS,UPDATE 2-Fed's money market move lifts Northern Trust fund above key threshold,3/23/2020 8:05:30 PM
NTRS,"PNC Financial, Northern Trust also pause stock buybacks",3/16/2020 9:08:41 PM
NTRS,"Here are the banks that will benefit from Fed's SCB rule, analysts say",3/5/2020 6:06:31 PM
NTRS,Northern Trust Corporation -- Moody's announces completion of a periodic review of ratings of Northern Trust Corporation,2/24/2020 10:21:00 PM
NTRS,"2020 Fed stress test to be tougher for card issuers, brokers",2/7/2020 8:21:14 PM
NTRS,Northern Trust Corp. Announces Fall In Q4 Profit,1/22/2020 1:43:24 PM
NTRS,Northern Trust Corp. Profit Rises In Q3,10/23/2019 1:36:43 PM
NTRS,MOVES-Northern Trust makes three senior hires,9/25/2019 6:43:06 PM
NTRS,EARNINGS SUMMARY: Details of Northern Trust Corp. Q2 Earnings Report,7/24/2019 1:54:27 PM
NTRS,Here's what Wall Street expects from Northern Trust's earnings report,7/22/2019 3:01:34 PM
NTRS,Northern Trust Corp. Profit Falls In Q1,4/23/2019 2:07:04 PM
NTRS,Northern Trust earnings: here's what Wall Street expects,4/21/2019 3:01:29 PM
NTRS,MOVES-Northern Trust Names Melíosa O'Caoimh as head of Ireland business,4/2/2019 2:07:01 PM
NTRS,Northern Trust Corporation -- Moody's announces completion of a periodic review of ratings of Northern Trust Corporation,4/1/2019 2:33:00 AM
NTRS,Northern Trust Corporation -- Moody's announces completion of a periodic review of ratings of Northern Trust Corporation,3/29/2019 10:17:00 PM
NTRS,Northern Trust Corp. Profit Rises In Q4,1/23/2019 2:20:30 PM
NTRS,Here's what to expect from Northern Trust's earnings,1/21/2019 3:01:26 PM
NTRS,"MOVES-Close Brothers, Northern Trust, Aldermore",10/31/2018 4:25:45 PM
NTRS,Northern Trust Corp. Earnings Climb In Q3,10/17/2018 1:35:06 PM
NTRS,Northern Trust is about to announce its earnings — here's what to expect,10/15/2018 3:01:24 PM
NTRS,Northern Trust Corp. Profit Climbs In Q2,7/18/2018 1:39:45 PM
NTRS,Northern Trust earnings: here's what to expect,7/16/2018 3:01:24 PM
NTRS,First Midwest Bank -- Moody's assigns Counterparty Risk Ratings to bank subsidiaries of 60 US banking groups,6/20/2018 10:27:00 PM
NTRS,Northern Trust Corp. Q1 Profit Advances,4/17/2018 1:42:01 PM
NTRS,"BRIEF-First Mid-Illinois Bancshares Says On April 13, Co Entered Into Fifth Amended And Restated Credit Agreement With Northern Trust Co",4/13/2018 10:56:03 PM
NTRS,"MOVES-Northern Trust, Cavendish, Stifel Financial, LaSalle",4/12/2018 4:24:57 PM
NTRS,Northern Trust Corp. Reveals Rise In Q4 Profit,1/24/2018 1:34:36 PM
NTRS,BRIEF-‍Northern Trust Company Increased Prime Rate To 4.50 Pct​ (NTRS),12/14/2017 6:22:03 PM
NTRS,MOVES-Northern Trust names Dan Madden ETF Capital Markets head for FlexShares (NTRS),12/4/2017 9:47:05 PM
NTRS,"MOVES-Deutsche Bank, Citigroup, BNP Paribas, Northern Trust, AXA (C, NTRS, BNP, CS)",11/27/2017 3:52:03 PM
NTRS,Fideicomiso Financiero Supervielle Leasing II -- Moody's affirms ratings of three US custody and trust banks; outlook remains stable,11/22/2017 9:36:00 PM
NTRS,"MOVES-Asset manager Northern Trust names new COO for EMEA, APAC (NTRS)",11/13/2017 12:47:04 PM
NTRS,"GLOBAL MARKETS-Stock indexes, dollar dip on U.S. tax reform doubts (NTRS)",11/10/2017 5:27:06 PM
NTRS,BRIEF-Northern Trust hires Danielle Henderson for market advocacy & innovation research function in APAC (NTRS),11/8/2017 11:02:06 AM
NTRS,"BRIEF-IBM elects Joseph Swedish and Frederick Waddell to Board of Directors​ (IBM, NTRS)",10/30/2017 11:42:08 PM
NTRS,BRIEF-Northern Trust Corporation reports third quarter net income of $298.4 million (NTRS),10/18/2017 2:47:03 PM
NTRS,"BRIEF-Northern Trust names Michael G. O'Grady CEO effective January 1, 2018 (NTRS)",10/17/2017 10:17:03 PM
NTRS,BRIEF-Northern trust appoints St. Louis president (NTRS),9/20/2017 3:37:03 PM
NTRS,BRIEF-Northern Trust names Yen Leng Ong as country head Singapore and head of South East Asia (NTRS),8/30/2017 3:17:03 AM
NTRS,"Asset Management Stock Performance Review -- Northern Trust, T. Rowe Price, Voya Financial, and Waddell & Reed",8/29/2017 12:35:00 PM
NTRS,"UPDATE 1-Impact on banks from Britain's vote to leave the EU (BAC, BARC, BNP, C, ACA, 8601, DBK, GS, HSBA, INVP, INL, JPM, LLOY, MS, 8411, 8604, NTRS, GLE, STAN, 8316, KN)",7/26/2017 5:32:05 PM
NTRS,BRIEF-Northern Trust Corp reports Q2 earnings of $1.12 per share (NTRS),7/19/2017 2:54:04 PM
NTRS,BRIEF-Northern Trust says Stephen Potter appointed vice chairman of the board (NTRS),7/17/2017 10:22:03 PM
NTRS,BRIEF-Northern Trust raises prime rate (NTRS),6/14/2017 11:14:03 PM
NTRS,"Initiating Research Reports on Asset Management Equities -- T.Rowe Price, Ameriprise Financial, Lazard, and Northern Trust",6/9/2017 12:25:00 PM
NTRS,"RPT-Exxon vote shows Wall St diverging from Trump on climate change (XOM, BLK, NTRS, OXY, PPL, DVN, HES)",6/1/2017 1:04:03 PM
NTRS,"MOVES- Rothschild, Northern Trust, Bluemountain Capital (NTRS, LGEN)",5/24/2017 10:26:05 PM
NTRS,BRIEF-Northern Trust wins GB£6.7 bln mandate from Northern Ireland Local Government Officers’ Superannuation Committee (NTRS),4/27/2017 11:35:06 AM
NTRS,"A fund manager with $13.6 billion in assets shares his simple strategy for picking stocks (FN, NTRS)",4/26/2017 3:15:32 PM
NTRS,BRIEF-Northern Trust says Q1 earnings per share $1.09 (NTRS),4/25/2017 2:11:06 PM
NTRS,"MOVES-Citigroup, Northern Trust, Morningstar Credit Ratings (C, NTRS, MORN)",4/17/2017 8:23:03 PM
NTRS,"Technical Reports on Asset Management Stocks -- Fortress Investment, Waddell & Reed, Northern Trust, and Och-Ziff",4/10/2017 12:35:00 PM
NTRS,"UPDATE 1-Fed gives four foreign banks 'living will' extension, faults Northern Trust (NTRS, BARC, DBK, AXP, BBT, COF, CMA, DFS, FITB, HBAN, KEY, MTB, RF, STI, PNC, USB, ZION)",3/24/2017 3:50:46 PM
NTRS,"MOVES- Aurelius Equity, Markel International, Northern Trust (AR4, MKL, NTRS)",3/21/2017 12:02:45 PM
NTRS,BRIEF-Northern Trust Corp's CEO Frederick Waddell's 2016 total compensation was $11.2 mln (NTRS),3/16/2017 1:18:45 PM
NTRS,"Deals of the day-Mergers and acquisitions (ISP, 9437, FRO, DHT, BLND, WOR)",2/28/2017 11:58:14 AM
