Ticker,Title,Link
NTRS,"Technical Reports on Asset Management Equities -- Janus Capital, Northern Trust, Central Fund of Canada, and Lazard",2/27/2017 1:40:00 PM
NTRS,"Northern Trust uses blockchain for private equity record-keeping (NTRS, IBM)",2/22/2017 7:12:12 AM
NTRS,"Northern Trust buys UBS Asset Management administration units (NTRS, 8306)",2/20/2017 10:14:11 AM
NTRS,"RPT-INSIGHT-Struggling hedge funds still expense bonuses, bar tabs (BX, NTRS)",1/19/2017 1:08:04 PM
NTRS,MOVES-Northern Trust names new director of institutional business (NTRS),12/19/2016 12:46:05 PM
NTRS,BRIEF-Northern Trust raises prime rate (NTRS),12/14/2016 11:48:03 PM
NTRS,BRIEF-QIC Ltd reappoints Northern Trust in Australia (NTRS),12/13/2016 10:20:05 PM
NTRS,"MOVES-Credit Suisse, Northern Trust, AXA Investment, Unigestion (NTRS, CS)",9/29/2016 11:10:23 PM
