Ticker,Title,Link
LW,"Food spotlight: Blockbuster M&A as Mars takes Kellanova private, pantry inflation up 1%",8/14/2024 12:42:16 PM
LW,"Analysts’ Top Consumer Goods Picks: Lamb Weston Holdings (LW), Keurig Dr Pepper (KDP)",7/29/2024 12:17:38 PM
LW,Analysts Offer Insights on Consumer Goods Companies: Lamb Weston Holdings (LW) and Keurig Dr Pepper (KDP),7/26/2024 8:52:04 AM
LW,Citi Reaffirms Their Buy Rating on Lamb Weston Holdings (LW),7/25/2024 10:26:46 AM
LW,Lamb Weston Q4 Earnings and Revenues Lag Estimates,7/24/2024 9:55:28 PM
LW,Lamb Weston Q4 2024 Earnings Preview,7/23/2024 4:56:05 PM
LW,Analysts Conflicted on These Consumer Goods Names: Lamb Weston Holdings (LW) and Diageo (OtherDGEAF),7/19/2024 7:02:09 AM
LW,"Lamb Weston Holdings, Inc. declares $0.36 dividend",7/18/2024 8:33:57 PM
LW,Lamb Weston Holdings: A Buy Rating with Anticipated Growth and Recovery Despite Conservative FY25 Outlook,7/10/2024 10:26:29 AM
LW,Lamb Weston Holdings: Short-Term Challenges with a Positive Outlook Justify Buy Rating,7/8/2024 8:15:31 PM
LW,Lamb Weston Holdings Poised for Earnings Growth and Margin Expansion: A ‘Buy’ Rating Reiteration,6/20/2024 8:15:19 PM
LW,Lamb Weston Holdings (LW) Receives a Buy from Bank of America Securities,6/18/2024 1:16:18 PM
LW,4 Food Stocks to Keep an Eye on as Industry Trends Appear Rosy,6/12/2024 9:44:22 PM
LW,Sell ideas in Staples and Health Care - Oppenheimer,6/3/2024 6:46:53 PM
LW,Investors punished Salesforce after earnings. See the other worst recent post-report reactions,5/31/2024 4:33:20 PM
LW,Lamb Weston Holdings: A Buy Rating Anchored on QSR Promotional Boost and Strategic Market Positioning,5/23/2024 10:16:49 AM
LW,"Season finale: Q1 earnings winds down, retailers up next - Earnings Scorecard",5/18/2024 6:45:00 PM
LW,"Duquesne Family Office top Q1 buys, cuts: Coherent, Eli Lilly, others",5/15/2024 8:27:14 PM
LW,Lamb Weston Holdings: A Buy Rating Despite Short-Term Challenges,5/8/2024 2:35:19 PM
LW,7 Growth Stocks to Sweep From Your Portfolio This Spring,5/3/2024 11:05:00 AM
LW,Goldman picks top capex and R&D stocks,4/21/2024 6:42:04 PM
LW,3 Blue-Chip Stocks to Buy Now: Q2 Edition,4/17/2024 7:51:19 PM
LW,Lamb Weston Holdings: A Resilient Buy Rating with a Focus on Recovery and Growth Prospects,4/12/2024 10:06:58 AM
LW,Lamb Weston Holdings (LW) Receives a Buy from Wells Fargo,4/11/2024 9:36:09 AM
LW,Two S&P 500 names reported EPS beat this week; Conagra benefits from higher Grocery & Snacks sales - Earnings Scorecard,4/5/2024 6:45:13 PM
LW,Lamb Weston Holdings: A Strong Buy on Temporary Setbacks and Promising FY25 Outlook,4/4/2024 11:35:50 PM
LW,Lamb Weston Q3 2024 Earnings Preview,4/3/2024 5:51:02 PM
LW,"Catalyst Watch: Tesla deliveries, Disney board vote, DJT drama and Fortinet event",3/28/2024 7:00:00 PM
LW,Lamb Weston Holdings: A Buy Rating with Undervalued Potential and Positive Outlook,3/27/2024 9:05:32 PM
LW,Lamb Weston Holdings: Buy Rating Affirmed Amid Growth and Margin Expansion Prospects,3/21/2024 9:05:13 PM
LW,Lamb Weston Holdings: Overcoming ERP Headwinds with Strategic Pricing for a Strong FY25 – Buy Rating Affirmed,3/18/2024 10:15:34 AM
LW,Overlooked Outperformers: 3 Consumer Staples Stocks Goldman Sachs Missed,3/15/2024 10:15:00 AM
LW,The 3 Most Undervalued Sleeper Stocks to Buy in March 2024,3/12/2024 8:07:10 PM
LW,The 3 Best Food Stocks to Buy and Hold Forever: 2024 Edition,3/1/2024 12:00:00 PM
LW,"Druckenmiller's Duquesne drops Alibaba, Amazon; picks up Barrick Gold, Newmont",2/14/2024 10:41:35 PM
LW,‘Diamonds in the Rough’: Citi Says These 3 Packaged Food Stocks Are Poised to Thrive in a Tough Sector,2/4/2024 10:21:37 AM
LW,Stifel Nicolaus Keeps Their Buy Rating on Lamb Weston Holdings (LW),1/5/2024 12:45:12 PM
LW,Lamb Weston Holdings: A Strong Buy on Sustained Margin Performance and Growth Prospects,1/4/2024 10:35:28 PM
LW,Here's what Wall Street expects from Lamb Weston's earnings,1/3/2024 3:01:13 PM
LW,Lamb Weston Holdings (LW) Gets a Buy from Jefferies,12/28/2023 4:35:06 PM
LW,"5 Top Growth Stocks to Buy Now, According to Analysts – December 2023",12/26/2023 7:09:41 AM
LW,Buy Rating on Lamb Weston Holdings Anchored by Robust Crop Yields and Attractive Valuation,12/19/2023 9:25:39 PM
LW,3 Stocks Wall Street Bulls Are Betting On Big-Time,12/15/2023 3:51:25 PM
LW,"BRBR, LW, POST: 3 Tasty Food Stocks with Strong Buy Ratings",12/6/2023 6:09:05 AM
LW,Lamb Weston Holdings: A Sustainable Buy Amidst Surplus Crop and Operational Efficiency,12/4/2023 9:55:22 PM
LW,Investor Favorites: 7 Dividend Stocks with Strong Buy Ratings,12/3/2023 6:20:50 PM
LW,3 High-Potential Food Stocks to Bite Into as They Transform the Industry,11/27/2023 7:39:35 PM
LW,3 Food Stocks to Buy as Consumers Set Their Tables for the Holidays,11/24/2023 12:10:16 AM
LW,7 Safe Stocks to Buy to Hedge an Uncertain Future,10/30/2023 8:00:35 PM
LW,"Lamb Weston Is A Compelling Investment Opportunity, Says Analyst",10/12/2023 8:36:39 PM
LW,Prudent Management and Strong Growth Prospects: A Buy Recommendation for Lamb Weston Holdings,10/11/2023 9:05:26 PM
LW,Analyst Ratings for Lamb Weston Hldgs,10/6/2023 10:00:25 PM
LW,Lamb Weston Holdings’ Strong Performance and Undervalued Stock Earns a Buy Rating: An Analysis of Q1 Results and Future Prospects,10/5/2023 10:25:24 PM
LW,Lamb Weston earnings: here's what Wall Street expects,10/4/2023 3:01:13 PM
LW,"Stocks, Bonds Shaken By September Turbulence Ahead Of Government Shutdown Deadline: The Week In The Markets",9/29/2023 10:13:14 PM
LW,"Analysts’ Top Consumer Goods Picks: Lamb Weston Holdings (LW), Diageo (DGEAF)",9/28/2023 9:21:16 AM
LW,"5 Top Food Stocks to Buy Now, According to Analysts – September 2023",9/15/2023 3:58:46 PM
LW,Bank of America Securities Sticks to Its Buy Rating for Lamb Weston Holdings (LW),9/14/2023 11:35:55 AM
LW,"Benzinga's Top Ratings Upgrades, Downgrades For September 13, 2023",9/13/2023 5:00:44 PM
LW,"Benzinga's Top Ratings Upgrades, Downgrades For September 5, 2023",9/5/2023 5:00:45 PM
LW,Lamb Weston Holdings (LW) was upgraded to a Buy Rating at Goldman Sachs,9/4/2023 11:15:14 PM
LW,"Billionaire Stanley Druckenmiller Says Recession Is Still in the Cards, but Stays Heavily Invested in These 2 Stocks",8/28/2023 1:59:39 PM
LW,Analysts Have Conflicting Sentiments on These Consumer Goods Companies: Lamb Weston Holdings (LW) and General Mills (GIS),8/23/2023 10:10:52 AM
LW,Top 5 Defensive Stocks Which Could Rescue Your Portfolio This Quarter,8/15/2023 2:03:30 PM
LW,Stocks most loved and shunned by hedge funds,8/6/2023 9:35:15 PM
LW,"Benzinga's Top Ratings Upgrades, Downgrades For August 4, 2023",8/4/2023 5:01:17 PM
LW,Jefferies Sticks to Their Buy Rating for Lamb Weston Holdings (LW),7/29/2023 2:45:11 PM
LW,Analysts Conflicted on These Consumer Goods Names: Zevia PBC (ZVIA) and Lamb Weston Holdings (LW),7/26/2023 10:41:13 AM
LW,Why Alaska Air Group Shares Are Trading Lower By 9%? Here Are Other Stocks Moving In Tuesday's Mid-Day Session,7/25/2023 7:11:15 PM
LW,Lamb Weston Q4 2023 Earnings Preview,7/24/2023 4:17:29 PM
LW,Lamb Weston declares $0.28 dividend,7/20/2023 3:57:31 AM
LW,Bank of America Securities Reaffirms Their Buy Rating on Lamb Weston Holdings (LW),7/14/2023 10:25:06 AM
LW,Food inflation is moderating - watch these stocks,7/12/2023 12:42:33 PM
LW,SPY ETF Gains 13% YTD; Analysts See Further Upside,6/7/2023 12:02:59 PM
LW,Goldman Sachs picks top stocks in case of a hard landing,5/23/2023 11:39:57 AM
LW,"Druckenmiller's Duquesne adds Microsoft, IQVIA, exits Cenovus Energy, Lennar",5/15/2023 10:03:22 PM
LW,7 Stocks That Analysts Agree You Should Dump ASAP,5/2/2023 6:33:13 PM
LW,“Locked and Loaded” for Earnings Season,4/27/2023 8:30:14 PM
LW,"Analysts’ Top Consumer Goods Picks: Lowe’s (LOW), Lamb Weston Holdings (LW)",4/26/2023 12:41:16 PM
LW,Analysts Offer Insights on Consumer Goods Companies: Lululemon Athletica (LULU) and Lamb Weston Holdings (LW),4/20/2023 11:50:11 AM
LW,Where Lamb Weston Hldgs Stands With Analysts,4/14/2023 10:01:23 PM
LW,Time to pick up cooking? Food at home prices fall for first time since 2020,4/12/2023 12:54:34 PM
LW,Wall Street Analysts Are Bullish on Top Consumer Goods Picks,4/10/2023 9:50:07 AM
LW,Barclays Sticks to Their Buy Rating for Lamb Weston Holdings (LW),4/8/2023 1:25:07 AM
LW,"Lamb Weston, TH International, AMC Entertainment And Other Big Stocks Moving Higher On Thursday",4/6/2023 4:25:19 PM
LW,Lamb Weston earnings preview: what Wall Street is expecting,4/5/2023 3:01:13 PM
LW,"Netflix, FedEx among in BofA's top 10 stocks for the second quarter",4/4/2023 1:39:20 PM
LW,"Inflation Eases, S&P 500 Rally Continues Ahead Of Next Week's Critical Jobs Report",3/31/2023 10:01:22 PM
LW,Lamb Weston Holdings (LW) Gets a Buy from Jefferies,3/25/2023 2:45:17 PM
LW,Lamb Weston declares $0.28 dividend,3/24/2023 9:01:31 AM
LW,Sleep-at-night stocks for those hedging or risk averse,3/8/2023 11:41:29 AM
LW,7 Food Stocks to Buy as Shortages Hit Consumers,3/7/2023 6:55:29 PM
LW,Food inflation is still running in the double digits - watch these stocks for pricing power,2/14/2023 1:48:42 PM
LW,"Analysts Are Bullish on Top Consumer Goods Stocks: Darling Ingredients (DAR), Deckers Outdoor (DECK)",1/30/2023 2:11:19 AM
LW,Breaking Down the Latest Economic Reports,1/19/2023 9:30:49 PM
LW,Food inflation runs hot again in CPI report including egg prices up 60%,1/12/2023 1:45:40 PM
LW,Analysts Offer Insights on Consumer Goods Companies: Constellation Brands (STZ) and Lamb Weston Holdings (LW),1/9/2023 1:20:33 AM
LW,Analysts Offer Insights on Consumer Goods Companies: Conagra Brands (CAG) and Lamb Weston Holdings (LW),1/6/2023 12:10:39 PM
LW,Earnings Will Drive Stocks Higher,1/5/2023 9:31:52 PM
LW,Lamb Weston Q2 2023 Earnings Preview,1/4/2023 9:28:47 PM
LW,"Catalyst watch: Tesla deliveries, CES reveals and healthcare updates lead off 2023",12/30/2022 7:00:00 PM
LW,Lamb Weston declares $0.28 dividend,12/14/2022 11:00:12 PM
LW,These consumer staples stocks have extra interest rate risk,10/21/2022 3:15:48 PM
LW,"Lamb Weston To Buy Remaining Stake In European JV From Meijer For EUR 700 Mln In Cash, Stock ",10/20/2022 2:51:44 PM
LW,Analysts Offer Insights on Consumer Goods Companies: Leggett & Platt (LEG) and Lamb Weston Holdings (LW),10/12/2022 4:41:10 PM
LW,Barclays Sticks to Their Buy Rating for Lamb Weston Holdings (LW),10/8/2022 1:25:14 AM
LW,B of A Securities Maintains Buy Rating for Lamb Weston Hldgs: Here's What You Need To Know,10/6/2022 6:02:16 PM
LW,Analysts voice optimism on Lamb Weston after strong earnings report,10/5/2022 5:22:51 PM
LW,Lamb Weston Q1 2023 Earnings Preview,10/4/2022 4:18:28 PM
LW,S&P 500 Closes Out The Third Quarter At New Lows: Can It Bounce Back?,9/30/2022 9:40:57 PM
LW,Lamb Weston declares $0.245 dividend,9/29/2022 6:31:01 AM
LW,"KO, NEE, LW: These Stocks Could Hedge Your Bets against Rising Bond Yields",9/20/2022 12:36:34 PM
LW,3 ETFs to Buy Now for Safety,8/10/2022 6:25:51 PM
LW,First grain ship leaves Ukraine since start of the Russian invasion,8/1/2022 9:27:11 AM
LW,Lamb Weston Guides FY23 Earnings In Line As Q4 Results Top Estimates ,7/27/2022 2:53:31 PM
LW,Lamb Weston declares $0.245 dividend,7/21/2022 5:45:29 AM
LW,B&G Foods (BGS) Down 15% In 3 Months: High Costs A Key Reason,7/20/2022 4:03:44 PM
LW,3 Best ETFs to Buy Now for Safety-Seeking Investors,5/29/2022 12:44:13 PM
LW,Lamb Weston Holdings rallies 6% post FQ3 results,4/7/2022 4:56:30 PM
LW,Lamb Weston Q3 2022 Earnings Preview,4/6/2022 5:28:00 PM
LW,Lamb Weston declares $0.245 dividend,3/24/2022 8:30:05 PM
LW,Food protectionism in play as countries raise export barriers,3/21/2022 9:23:01 AM
LW,"Amgen, Target highlight BofA's new Alpha Surprise screen entrants",3/3/2022 12:20:15 PM
LW,7 Technology Stocks Reporting Earnings the Week of January 31,1/28/2022 6:15:32 PM
LW,BofA issues technical takes for its top 10 Q1 stocks,1/18/2022 12:01:59 PM
LW,58 Biggest Movers From Yesterday,1/7/2022 10:29:57 AM
LW,33 Stocks Moving In Thursday's Mid-Day Session,1/6/2022 6:01:46 PM
LW,Lamb Weston Q2 2022 Earnings Preview,1/5/2022 5:58:23 PM
LW,Lamb Weston increases dividend by 4% to $0.245 and authorizes $250M buyback,12/17/2021 9:19:32 PM
LW,Jefferies picks stocks to add and avoid in a shifting inflation landscape: Alpha Tactics,12/11/2021 8:35:20 PM
LW,7 CEOs That Ought to Follow Jack Dorsey Out the Door,12/10/2021 10:15:55 PM
LW,7 Stocks to Buy as Biden Picks Powell For Fed Chair,12/7/2021 6:07:11 PM
LW,Pantry-loading 2.0 sends some food stocks higher,10/20/2021 3:21:28 PM
LW,"Lamb Weston Holdings, Inc. -- Moody's assigns Ba3 to Lamb Weston's proposed unsecured notes",10/19/2021 7:05:00 PM
LW,"Lamb Weston Holdings, Inc. -- Moody's downgrades Lamb Weston to Ba2; outlook stable",10/14/2021 10:52:00 PM
LW,3 Stocks Insiders Are Buying,10/13/2021 2:14:09 PM
LW,10 Biggest Price Target Changes For Friday,10/8/2021 3:11:23 PM
LW,28 Stocks Moving In Thursday's Mid-Day Session,10/7/2021 6:01:05 PM
LW,Notable earnings before Thursday's open,10/6/2021 3:55:51 PM
LW,Lamb Weston is about to announce its earnings — here's what to expect,10/5/2021 3:01:17 PM
LW,Lamb Weston declares $0.235 dividend,9/23/2021 8:41:03 PM
LW,Lamb Weston Sees FY22 Sales Below Estimates - Quick Facts ,7/27/2021 3:25:20 PM
LW,Notable earnings before Tuesday's open,7/26/2021 2:08:25 PM
LW,Here's what Wall Street expects from Lamb Weston's earnings report,7/25/2021 3:01:45 PM
LW,Bank of America names its top high-conviction stock picks for Q3,7/19/2021 1:19:04 PM
LW,"Benzinga's Top Ratings Upgrades, Downgrades For May 21, 2021",5/21/2021 4:08:34 PM
LW,"Benzinga's Top Ratings Upgrades, Downgrades For April 8, 2021",4/8/2021 4:52:38 PM
LW,"EARNINGS SUMMARY: Details of Lamb Weston Holdings, Inc. Q3 Earnings Report",4/7/2021 2:45:02 PM
LW,Lamb Weston Q3 2021 Earnings Preview,4/6/2021 5:04:29 PM
LW,"Benzinga's Top Ratings Upgrades, Downgrades For April 5, 2021",4/5/2021 4:03:33 PM
LW,Lamb Weston declares $0.235 dividend,3/25/2021 8:33:26 PM
LW,"Lamb Weston Holdings, Inc. -- Moody's announces completion of a periodic review of ratings of Lamb Weston Holdings, Inc.",3/3/2021 3:35:00 PM
LW,Lamb Weston Says U.S. Shipments For First 4 Weeks Of Q3 At 85% Of Prior-year Levels ,1/7/2021 2:55:10 PM
LW,Lamb Weston Q2 2021 Earnings Preview,1/6/2021 6:57:21 PM
LW,Lamb Weston earnings preview: what to expect,1/5/2021 3:01:16 PM
LW,Lamb Weston raises dividend by 2.2% to $0.235 per share,12/18/2020 3:18:37 AM
LW,Lamb Weston gains after JPMorgan calls it a post-pandemic recovery pick,12/7/2020 12:33:38 PM
LW,Tyson leads select packaged food stocks higher,11/16/2020 6:55:13 PM
LW,How has China's U.S. farm purchases fared under trade deal?,10/25/2020 9:15:04 AM
LW,Lamb Weston Earnings: LW Stock Pops 3% on Q1 EPS Topper,10/7/2020 8:36:22 PM
LW,Lamb Weston Q1 2021 Earnings Preview,10/6/2020 5:21:45 PM
LW,7 Innovative Stocks With Their Eyes on the Future,9/30/2020 12:51:57 PM
LW,"Twin Falls County School District 411, ID -- Moody's assigns A1 UND, Aa1 ENH to Twin Falls County SD 411, ID's 2020 GO bonds",8/21/2020 8:33:00 PM
LW,10 Buy-and-Hold Stocks to Own Forever,8/19/2020 11:26:26 AM
LW,"AbbVie's Phase 3 Study Shows RINVOQ Plus TCS Improves Skin, Itch Symptoms In Atopic Dermatitis ",7/28/2020 3:16:31 PM
LW,"ConAgra Stock Was a Winner Before the Coronavirus, and Will Keep It up After",7/8/2020 11:40:42 AM
LW,"Lamb Weston Holdings, Inc. -- Moody's assigns Ba2 to Lamb Weston's new $400 million unsecured notes",5/7/2020 5:24:00 PM
LW,"Lamb Weston Holdings, Inc. -- Moody's announces completion of a periodic review of ratings of Lamb Weston Holdings, Inc.",4/13/2020 6:11:00 PM
LW,Lamb Weston Earnings: LW Stock Slides 12% Lower on Q3 Miss,4/1/2020 7:25:51 PM
LW,Notable earnings before Wednesday's open,3/31/2020 9:30:28 PM
LW,7 Food Stocks to Buy Now,1/23/2020 3:45:48 PM
LW,Stock Alert: Shares Of Lamb Weston Holdings Inc. (LW) Hit 52-Week High ,1/6/2020 11:45:55 AM
LW,Here's what Wall Street expects from Lamb Weston's earnings report,1/2/2020 3:01:15 PM
LW,3 Earnings Reports to Watch Next Week,10/18/2019 3:30:03 PM
LW,"Lamb Weston Holdings, Inc. to Host Earnings Call",10/2/2019 8:00:00 AM
LW,The 10 Best Stocks to Invest in for August,7/30/2019 5:50:33 PM
LW,Here's what Wall Street expects from Lamb Weston's earnings report,7/22/2019 3:01:34 PM
LW,10 Best S&P 500 Stocks to Buy For the Rest of 2019,6/24/2019 4:18:59 PM
LW,"Lamb Weston Holdings, Inc. -- Moody's announces completion of a periodic review of ratings of Lamb Weston Holdings, Inc.",5/9/2019 10:20:00 PM
LW,Lamb Weston earnings preview: what Wall Street is expecting,4/1/2019 3:01:18 PM
LW,Lamb Weston earnings preview: what to expect,1/3/2019 3:01:15 PM
LW,Lamb Weston Holdings To Replace Rockwell Collins In S&P 500 ,11/27/2018 1:59:45 AM
LW,Lamb Weston Jumping On Better Than Expected Q1 Earnings ,10/2/2018 6:54:56 PM
LW,Lamb Weston is about to announce earnings — here's what Wall Street expects,10/1/2018 3:01:16 PM
LW,"Lamb Weston Holdings, Inc. -- Moody's upgrades Lamb Weston CFR to Ba1; outlook is stable",8/30/2018 8:50:00 PM
LW,Lamb Weston earnings preview: what Wall Street is expecting,7/24/2018 3:02:13 PM
LW,"Lamb Weston Holdings, Inc. -- Moody's affirms Lamb Weston Ba2 CFR; revises outlook to positive",4/18/2018 1:21:00 AM
LW,"Pre-Market Technical Pulse on Food Stocks -- Blue Buffalo Pet Products, Kraft Heinz, Pilgrim's Pride, and Lamb Weston",8/11/2017 12:30:00 PM
LW,"Initiating Research Reports on Food Equities -- Blue Buffalo Pet Products, Kraft Heinz, Pilgrim's Pride, and Lamb Weston",6/28/2017 12:35:00 PM
LW,"Research Reports on Food Equities -- Kraft Heinz, Lamb Weston, Pilgrim's Pride, and Blue Buffalo",4/10/2017 12:05:00 PM
LW,"Technical Reports on Food Equities -- Lamb Weston, Pinnacle Foods, Blue Buffalo Pet Products, and Amplify Snack Brands",3/7/2017 1:40:00 PM
