Ticker,Title,Link
DKS,Robust Omnichannel Business and Margin Improvements Bolster Buy Rating for Retailer,8/29/2024 9:18:19 AM
DKS,Buy Rating Affirmed: Strategic Gains and Market Outperformance Anticipated for Dick’s Sporting Goods,8/28/2024 10:25:14 PM
DKS,Hold Rating on Dick’s Sporting Goods Amid Strong Performance and High Valuation,8/27/2024 11:15:13 PM
DKS,"Dick’s Sporting Goods: Strong Market Position Priced In, Caution Ahead for FY2025",8/23/2024 10:47:02 AM
DKS,Retail revival: Target and TJX lift peers after surprising to the upside with their outlooks,8/21/2024 2:06:58 PM
DKS,3 Riveting Retail Stocks to Put on Your Must-Buy List,8/15/2024 10:29:00 AM
DKS,"Analysts’ Opinions Are Mixed on These Consumer Cyclical Stocks: Dick’s Sporting Goods (DKS), Ford Motor (F) and Soho House & Co (SHCO)",8/12/2024 11:17:36 AM
DKS,"Catalyst Watch: Eyes on Walmart earnings, the July CPI print, and 13F filings",8/9/2024 7:00:00 PM
DKS,3 Stocks With Dual-Class Share Structures Worth Buying Now ,8/8/2024 12:00:00 PM
DKS,Potential winners and losers if the retail sector sees some dark days,8/7/2024 2:16:18 PM
DKS,"Analysts Offer Insights on Consumer Cyclical Companies: Wyndham Hotels & Resorts (WH), Dick’s Sporting Goods (DKS) and Airbnb (ABNB)",8/6/2024 11:41:25 AM
DKS,3 Stocks to Load-Up On Before Autumn Arrives    ,8/2/2024 7:41:34 PM
DKS,Q3’s Rising Stars: 8 Dividend Stocks for Your Must-Watch List,7/30/2024 7:32:17 PM
DKS,3 Retail Stocks to Buy Before the Big Back-to-School Boom,7/23/2024 3:55:50 PM
DKS,3 Best Dividend Growth Plays in July 2024,7/21/2024 12:06:00 PM
DKS,Small and Mid-Cap stocks likely to beat/miss this earnings season - BofA,7/18/2024 2:22:42 PM
DKS,Back-to-school spending likely to remain unchanged this year,7/15/2024 8:41:40 PM
DKS,Analysts Offer Insights on Consumer Cyclical Companies: Dick’s Sporting Goods (DKS) and OneWater Marine (ONEW),7/11/2024 11:20:12 AM
DKS,Hot Stocks: 3 Breakout Stars Racing Towards Triple-Digit Returns,7/10/2024 10:00:00 AM
DKS,DICK'S Slides 11% in a Week: Is This a Buy Opportunity?,7/5/2024 9:44:30 PM
DKS,3 Stocks Delivering Blockbuster Results Quarter After Quarter,7/4/2024 5:34:22 PM
DKS,D.A. Davidson Reaffirms Their Buy Rating on Dick’s Sporting Goods (DKS),6/28/2024 12:25:51 PM
DKS,3 Top Stocks Hoping for a Boost From the WNBA,6/27/2024 8:30:29 PM
DKS,"Catalyst Watch: Nike earnings, Datadog event, Norfolk Southern decision, and an oil field-crypto IPO",6/21/2024 7:00:42 PM
DKS,"NVDA, ORCL, WMT, and DKS hit all-time highs; see what SA analysts have to say",6/20/2024 2:50:36 PM
DKS,"Strategic Growth Pillars Aid Sally Beauty, High Costs Ail",6/17/2024 9:35:04 PM
DKS,The 3 Top-Performing Dividend Stocks So Far in June 2024,6/14/2024 11:35:00 AM
DKS,"Catalyst Watch: Apple's WWDC, Tesla's annual meeting, Fed's dot plot, and GameStop volatility",6/7/2024 7:00:58 PM
DKS,Blue-Chip Bonanzas: 3 Corporate Giants Trading at Unbelievably Low Valuations,6/6/2024 11:20:00 AM
DKS,Wall Street Bulls Look Optimistic About Dick's: Should You Buy?,6/5/2024 9:30:48 PM
DKS,"Dividend Roundup: Meta Platforms, Merck, Cigna, Halliburton, and more",5/31/2024 12:14:52 PM
DKS,Dick's Sporting Goods Ramps Up Growth: Analysts Raise Targets Amid Strong Sales And Margin Gains,5/30/2024 9:08:08 PM
DKS,"Dick's Sporting Goods Raised Outlook After Strong Q1 Earnings, But Analyst Is Watching For Inventory Shrink Commentary",5/29/2024 9:10:37 PM
DKS,Dick's Sporting Goods Q1 2025 Earnings Preview,5/28/2024 4:23:05 PM
DKS,"Earnings week ahead: Salesforce, Costco, Canopy Growth, Dell,  Dollar General, and more",5/26/2024 12:00:00 PM
DKS,"Catalyst Watch: Costco earnings, M&A drama, Viking ratings, and a key inflation read",5/24/2024 7:00:53 PM
DKS,"Analysts’ Opinions Are Mixed on These Consumer Cyclical Stocks: American Eagle (AEO), Red Robin Gourmet (RRGB) and Dick’s Sporting Goods (DKS)",5/23/2024 1:00:57 PM
DKS,Strategic Advantages and Operational Excellence: A Buy Rating for Dick’s Sporting Goods,5/22/2024 10:46:51 AM
DKS,Unveiling 24 Analyst Insights On Dick's Sporting Goods,5/21/2024 3:00:45 PM
DKS,SharkNinja Emerges As A Strong Buy: Analyst Forecasts Growth Amid Strategic Innovations,5/16/2024 7:26:06 PM
DKS,"Meme-stock resurgence lifts GME's market cap above names like DKS, BBY and ANF",5/14/2024 2:10:02 PM
DKS,Buy Rating for Dick’s Sporting Goods: Transformative House of Sport and Competitive Service Advantage,5/10/2024 10:37:46 AM
DKS,Hidden Opportunities: 3 Overlooked Stocks Primed for Outsized Gains Through 2030 ,5/9/2024 5:21:35 PM
DKS,"Analysts Offer Insights on Consumer Cyclical Companies: Dick’s Sporting Goods (DKS), DraftKings (DKNG) and Amazon (AMZN)",5/6/2024 11:51:09 AM
DKS,MSFT Analysis: Why Microsoft Stock Is a Must-Own for Investors in 2024,5/4/2024 10:34:00 AM
DKS,"Have $1,000? 3 Absurdly Cheap Stocks Long-Term Investors Should Buy Now",5/2/2024 10:00:00 AM
DKS,3 Retail Stock Rejects to Avoid at All Costs,4/30/2024 10:29:00 AM
DKS,"Dick's Sporting Goods' Investment Spree Could Spoil The Game For Investors, Analyst Says",4/29/2024 8:15:01 PM
DKS,Truist Financial Gives a Buy Rating to Dick’s Sporting Goods (DKS),4/26/2024 11:30:19 AM
DKS,Wells Fargo Reaffirms Their Hold Rating on Dick’s Sporting Goods (DKS),4/24/2024 10:48:21 AM
DKS,Dividend Growth Stars: 7 Stocks With 10-Year Double-Digit Rate Hikes,4/23/2024 8:41:25 PM
DKS,DICK'S Sporting Goods Expand Partnership With SidelineSwap ,4/16/2024 12:38:21 PM
DKS,3 Must-Own Retail Stocks Primed for a Tax Refund Rally,4/15/2024 5:31:53 PM
DKS,Peeling Back The Layers: Exploring Dick's Sporting Goods Through Analyst Insights,4/12/2024 4:01:36 PM
DKS,"Analysts Have Conflicting Sentiments on These Consumer Cyclical Companies: Dick’s Sporting Goods (DKS), ACV Auctions (ACVA) and DR Horton (DHI)",4/2/2024 1:50:14 PM
DKS,The 3 Most Compelling Stocks Now That the Q4 Earnings Dust Has Settled,3/29/2024 7:38:15 PM
DKS,"Catalyst Watch: Tesla deliveries, Disney board vote, DJT drama and Fortinet event",3/28/2024 7:00:00 PM
DKS,3 Stock Picks That Have Wall Street Analysts Drooling,3/22/2024 4:34:34 PM
DKS,"Jump Ship? 3 Stocks That Are Surging Too High, Too Fast",3/20/2024 5:43:54 PM
DKS,"Analysts Offer Insights on Consumer Cyclical Companies: Whirlpool (WHR), OneSpaWorld Holdings (OSW) and Dick’s Sporting Goods (DKS)",3/18/2024 11:50:23 AM
DKS,3 Remarkable Retail Stocks Defying the Odds in 2024,3/15/2024 8:40:56 PM
DKS,Dow Dips Over 100 Points; Dick's Sporting Goods Earnings Top Views,3/14/2024 7:46:59 PM
DKS,Here's what to expect from Dicks Sporting Goods's earnings report,3/13/2024 3:01:13 PM
DKS,Baird Maintains Neutral Rating for Dick's Sporting Goods: Here's What You Need To Know,3/12/2024 6:00:10 PM
DKS,Maintain Hold: Balancing Dick’s Sporting Goods’ Solid Performance with Stock Price Surge,3/11/2024 11:35:26 PM
DKS,Hold Rating Maintained for Dick’s Sporting Goods Amid Sales Deceleration and Margin Expansion,3/10/2024 9:35:43 PM
DKS,"Catalyst Watch: Oracle earnings, Arm IPO lockup, and triple-witching day",3/8/2024 8:00:00 PM
DKS,"Analysts Offer Insights on Consumer Cyclical Companies: Dick’s Sporting Goods (DKS), Mercadolibre (MELI) and The Chefs’ Warehouse (CHEF)",3/6/2024 2:00:53 PM
DKS,Truist Securities Maintains Buy Rating for Dick's Sporting Goods: Here's What You Need To Know,3/5/2024 6:00:25 PM
DKS,Amidst S&P’s Record Highs: Oppenheimer Recommends 3 Top Stocks for Investment,2/15/2024 10:49:12 AM
DKS,Wall Street Analysts Are Bullish on Top Consumer Cyclical Picks,2/9/2024 1:00:41 PM
DKS,Green Flags: 7 Stocks Flashing Buy Signals to Watch Now,2/5/2024 10:35:08 PM
DKS,Loop Capital Markets Remains a Hold on Dick’s Sporting Goods (DKS),2/2/2024 12:46:20 PM
DKS,Peloton (PTON) Stock Trades Higher on Stabilizing Revenue and Memberships,2/1/2024 1:07:43 PM
DKS,12 Stocks Near Record Highs Thanks to Bullish Consumer Sentiment,1/23/2024 8:09:31 PM
DKS,Peloton (PTON) Stock Is Still Spinning Its Wheels Despite TikTok Deal,1/5/2024 4:56:58 PM
DKS,Retail Red Flags: 3 Stocks to Sell Amid Outrageous Crime Claims,12/20/2023 8:54:59 PM
DKS,3 Stocks to Ride the Holiday Shopping Wave: Retail Winners for Q4 2023,12/14/2023 8:58:46 PM
DKS,DICK'S Sporting Goods Becomes Official Sporting Goods Retailer of Notre Dame Athletics in Multi-Year Partnership,12/5/2023 3:00:00 PM
DKS,7 Top-Rated Growth Stocks That Analysts Are Loving Now,12/2/2023 10:00:00 PM
DKS,3 Cheap Stocks to Buy Today,11/30/2023 7:43:32 PM
DKS,Analysts Highlight Healthy Traffic And Discounts On Black Friday - How's The Trend?,11/27/2023 7:55:57 PM
DKS,Strategic Reinvestment Boosts Performance: An Analysis of Dick’s Sporting Goods’ FY23 Outlook,11/26/2023 1:15:30 PM
DKS,3 Top Quality Stocks to Buy: Swelling Valuations and Growth Potential,11/23/2023 1:00:00 PM
DKS,Truist Securities Maintains Buy Rating for Dick's Sporting Goods: Here's What You Need To Know,11/22/2023 6:00:16 PM
DKS,Why American Eagle Shares Are Trading Lower By Around 16%? Here Are Other Stocks Moving In Tuesday's Mid-Day Session,11/21/2023 7:28:06 PM
DKS,"Retailers Report Earnings Ahead Of Black Friday: Best Buy, Kohl's, American Eagle And More Stocks To Watch",11/20/2023 6:18:37 PM
DKS,3 Dividend Stocks Destined to Move Significantly Higher in 2024,11/19/2023 6:55:31 PM
DKS,"Dick's Sporting Goods Emerges As A Promising Buy: Analyst Cites Strong Ties With Nike, On Holding & More",11/17/2023 9:27:22 PM
DKS,3 Compelling Cheap Stocks to Buy Heading Into Year-End,11/15/2023 9:42:10 PM
DKS,Where Dick's Sporting Goods Stands With Analysts,11/14/2023 7:01:10 PM
DKS,Analysts Conflicted on These NA Names: Savers Value Village Inc. (SVV) and Dick’s Sporting Goods (DKS),11/13/2023 12:40:20 PM
DKS,"DICK'S Sporting Goods Partners with Kelsey Plum for ""Holiday Shopping Sprint""",11/6/2023 3:00:00 PM
DKS,Dick’s Sporting Goods (DKS) Receives a Rating Update from a Top Analyst,10/26/2023 1:23:37 PM
DKS,GameChanger Puts Spotlight on Basketball with AutoStream: AI-Driven Innovation for Hands-Free Streaming,10/24/2023 2:00:00 PM
DKS,3 Hottest Retail Stocks to Buy Ahead of the Holiday Spending Surge,10/15/2023 9:10:34 PM
DKS,These 3 Consumer Stocks With Over 3% Dividend Yields Are Recommended By Wall Street's Most Accurate Analysts,10/6/2023 2:31:55 PM
DKS,Holiday Hiring In A Pinch? Dick's Sporting Goods Aims To Hire Less Seasonal Help Than Last Year,9/26/2023 8:38:48 PM
DKS,The 7 Most Undervalued Value Stocks to Buy in September 2023,9/14/2023 6:18:16 PM
DKS,7 Stocks to Buy for a Back-to-School Boom,9/12/2023 4:37:52 PM
DKS,Dick’s Sporting Goods (DKS) Gets a Hold from Wells Fargo,9/11/2023 10:35:18 AM
DKS,The 3 Best Consumer Stocks to Buy Now: September 2023,9/7/2023 5:00:40 AM
DKS,7 Blue-Chip Stocks to Buy for a Market Pullback,9/6/2023 9:08:16 PM
DKS,Academy Sports Stock (NASDAQ:ASO): A Diamond in the Retail Rough,8/31/2023 8:43:43 PM
DKS,"Weekly Points – August 25th, 2023 - 5 Things To Know In Investing This Week",8/30/2023 6:11:48 PM
DKS,"Academy Sports Could Face Impact From Weak Outdoor Product Demand In Q2, Analyst Warns of Margin Pressure",8/29/2023 7:19:45 PM
DKS,Hibbett Analysts On Q2 Earnings: 'Back-To-School Off To Strong Start',8/28/2023 6:20:55 PM
DKS,These Are the ONLY 3 Dividend Stocks to Consider in August 2023,8/25/2023 8:54:22 PM
DKS,3 Very Oversold Dow Stocks to Buy Right Now,8/24/2023 11:19:12 PM
DKS,Nvidia – King Of AI Becomes King Of Stock Market,8/23/2023 5:50:13 PM
DKS,Double Up: 3 Dual-Class Stocks Worth the Investment,8/22/2023 10:03:34 PM
DKS,Dick's Sporting Goods Q2 2024 Earnings Preview,8/21/2023 5:07:09 PM
DKS,"Catalyst watch: Nvidia earnings, Twilio event, AMC drama and Jackson Hole jitters",8/18/2023 7:00:03 PM
DKS,Why Dick's Outperformance In The Sporting Goods Sector Is Here To Stay: A Deep Dive Into The Brand's Unique Strengths,8/15/2023 9:31:26 PM
DKS,DKS' Edge Over Peers: B Of A Analyst On Higher Household Income And Challenges Ahead In H2 Comps,8/14/2023 8:49:55 PM
DKS,Why These 7 Stocks Are the Best Ways to Play Retail Right Now,7/13/2023 4:31:28 PM
DKS,Path To Steady Expansion: Oppenheimer's Positive Outlook On Academy Sports And Outdoors,6/30/2023 7:32:15 PM
DKS,4 Dividend Stocks to Watch This Summer,6/29/2023 8:28:03 PM
DKS,Analysts’ Opinions Are Mixed on These NA Stocks: Booking Holdings (BKNG) and Dick’s Sporting Goods (DKS),6/28/2023 9:10:31 AM
DKS,7 Stocks to Buy as Companies Show Major Signs of Confidence,6/22/2023 10:00:16 AM
DKS,3 Stocks to Dump as Economic Alarm Sounds,6/19/2023 9:47:37 AM
DKS,3 Stocks These AI-Powered ETFs Are Betting On,6/14/2023 10:00:05 AM
DKS,7 Momentum Stocks That Could Skyrocket in the Next 12 Months,6/8/2023 10:18:48 PM
DKS,3 Robotics Stocks to Sell Before They Malfunction,6/7/2023 3:11:00 PM
DKS,"DICK'S Sporting Goods Partners with Nike, Jordan Brand and Athletes For Next Phase of ""Sports Change Lives"" Campaign",6/6/2023 7:30:00 PM
DKS,"Analysts Are Bullish on These NA Stocks: Lifetime Brands (LCUT), Dick’s Sporting Goods (DKS)",6/5/2023 1:10:13 PM
DKS,"Analysts Offer Insights on NA Companies: Nordstrom (JWN), Choice Hotels (CHH) and Dick’s Sporting Goods (DKS)",6/1/2023 12:30:38 PM
DKS,"Analysts Offer Insights on NA Companies: Jack In The Box (JACK), Dick’s Sporting Goods (DKS) and e.l.f. Beauty (ELF)",5/30/2023 2:10:05 AM
DKS,Hibbett cut to Sell at Williams after earnings miss,5/26/2023 5:15:24 PM
DKS,D.A. Davidson Sticks to Their Buy Rating for Dick’s Sporting Goods (DKS),5/24/2023 12:25:09 PM
DKS,Dick’s Sporting Goods (DKS) Receives a Buy from Goldman Sachs,5/23/2023 11:35:04 PM
DKS,"Foot Locker's Weak Q1 Performance Was Due to Company-Specific Issues, Says Analyst",5/22/2023 6:44:01 PM
DKS,"Catalyst watch: Eyes on Ford event, Virgin Galactic launch, Nvidia earnings and Microsoft conference",5/19/2023 7:00:19 PM
DKS,These 3 Consumer Stocks Delivering High-Dividend Yields Are Recommended By Wall Street's Most Accurate Analysts,5/18/2023 3:18:05 PM
DKS,Dick’s Sporting Goods (DKS) Receives a Hold from Citigroup,5/16/2023 11:05:25 AM
DKS,Dick's Sporting Goods Set To Outperform: An In-Depth Forecast By Analyst Ahead Of 1Q23 Earnings,5/12/2023 8:40:06 PM
DKS,WNBA Legend Sheryl Swoopes Joins DICK'S Sporting Goods and Nike for Third Annual It's Her Shot Tour Designed to Empower Young Female Athletes to Take Their Place on the Court,5/8/2023 4:33:00 PM
DKS,7 Stocks That Analysts Agree You Should Dump ASAP,5/2/2023 6:33:13 PM
DKS,7 Consumer Stocks to Watch as the Economy Rebounds,5/1/2023 10:10:30 AM
DKS,"Analysts Offer Insights on Consumer Goods Companies: Altria Group (MO), Coca-Cola (KO) and Dick’s Sporting Goods (DKS)",4/25/2023 9:30:38 AM
DKS,DICK'S Sporting Goods and the Boston Athletic Association Announce Multi-Year Partnership,4/13/2023 4:10:00 PM
DKS,3 Undervalued Consumer Stocks to Buy in April ,4/10/2023 11:15:24 AM
DKS,"Analysts Offer Insights on Consumer Goods Companies: Dick’s Sporting Goods (DKS), JD (JD) and e.l.f. Beauty (ELF)",3/31/2023 9:10:56 AM
DKS,5 Retail Stocks Sitting in the Sweet Spot,3/30/2023 5:40:20 PM
DKS,7 Retail Stocks to Buy as Shoppers Start Prepping for Armageddon,3/28/2023 11:11:57 PM
DKS,Raymond James Remains Bullish On Nike's FY24 Margin Setup Despite Likely Mixed Q3,3/17/2023 7:12:09 PM
DKS,"3 Hot Stocks for Tomorrow: Thursday Predictions for ADBE, DG, MSFT",3/15/2023 9:00:32 PM
DKS,"Benzinga's Top Ratings Upgrades, Downgrades For March 14, 2023",3/14/2023 4:00:44 PM
DKS,Consumers Have Strained From Non-Necessity Retailers,3/13/2023 3:37:08 PM
DKS,"DICK'S Sporting Goods Showcases the Power of Sport in New ""Sports Change Lives"" Campaign",3/9/2023 7:35:00 PM
DKS,"DICK'S Sporting Goods, NCAA, Warner Bros. Discovery Sports and CBS Sports Announce New Partnership, Making DICK'S the Official Sporting Goods Retail Partner of the NCAA",3/8/2023 4:45:00 PM
DKS,Dick's Sporting Goods rallies to all-time high and lifts peers after sizzling holiday quarter report,3/7/2023 7:21:52 PM
DKS,Dick's Sporting Goods Q4 2023 Earnings Preview,3/6/2023 3:35:23 PM
DKS,"Catalyst watch: General Electric, Apple, Chevron, Black Knight and Ethereum in the spotlight",3/3/2023 8:30:02 PM
DKS,DICK'S Sporting Goods and Just Women's Sports Team Up with 6 WNBA Stars for Second Annual Women's College Basketball Bracket Challenge,3/2/2023 4:30:00 PM
DKS,"Benzinga's Top Ratings Upgrades, Downgrades For February 28, 2023",2/28/2023 4:00:37 PM
DKS,"Analysts Are Bullish on These Consumer Goods Stocks: CVS Health (CVS), Dick’s Sporting Goods (DKS)",2/23/2023 1:00:56 PM
DKS,DKS Stock Alert: Dick’s Sporting Goods Acquires Moosejaw From Walmart,2/22/2023 6:56:17 PM
DKS,Analysts Offer Insights on Consumer Goods Companies: Dick’s Sporting Goods (DKS) and Kraft Heinz (KHC),2/18/2023 1:20:39 AM
DKS,"Benzinga's Top Ratings Upgrades, Downgrades For February 15, 2023",2/15/2023 4:01:07 PM
DKS,DICK'S Sporting Goods Announces Plans for 200+ SidelineSwap Trade-in Events in first half of 2023,2/9/2023 3:36:00 PM
DKS,Dick's Sporting Goods' Structural Drivers Prompt This Analyst Boost Price Target By 22%,1/9/2023 8:06:41 PM
DKS,What 7 Analyst Ratings Have To Say About Dick's Sporting Goods,1/6/2023 4:00:20 PM
DKS,"Nike soars off earnings star power; gains for Under Armour, Lululemon, Foot Locker",12/21/2022 1:38:05 PM
DKS,7 Short-Term Stocks to Make a Move on Now,12/20/2022 8:39:48 PM
DKS,Investors strap in for Nike's earnings report after last quarter's margin shocker,12/19/2022 7:53:32 PM
DKS,7 Undervalued Retail Stocks to Buy Now,12/16/2022 12:33:43 PM
DKS,Retail sector swings lower on concerns consumers are tightening,12/15/2022 3:47:21 PM
DKS,7 Faded Stocks to Sell Before They Bankrupt You,12/13/2022 11:47:38 PM
DKS,On Holding's Strong Brand Momentum Gets The Likes Of This Analyst,12/7/2022 8:02:29 PM
DKS,"THE DICK'S SPORTING GOODS FOUNDATION CELEBRATED SPORTS MATTER DAY IN HOUSTON BY DONATING SPORTS EQUIPMENT TO 10,000 LOCAL YOUTH",12/5/2022 4:32:00 PM
DKS,DICK'S Sporting Goods Names Ray Sliva Executive Vice President of Stores,12/1/2022 11:21:00 PM
DKS,3 Growth Stocks Hedge Funds Are Buying Now,11/30/2022 5:44:26 PM
DKS,What 4 Analyst Ratings Have To Say About Dick's Sporting Goods,11/23/2022 2:01:01 PM
DKS,"Best Buy, Abercrombie & Fitch, Burlington Stores And Some Other Big Stocks Moving Higher On Tuesday",11/22/2022 5:19:47 PM
DKS,Dicks Sporting Goods earnings preview: what Wall Street is expecting,11/21/2022 3:01:13 PM
DKS,"DICK'S SPORTING GOODS RELEASES HOLIDAY GIFT GUIDE, BLACK FRIDAY HOURS AND DEALS",11/18/2022 2:55:00 PM
DKS,Retail stocks are soaring because inflation may have peaked,11/10/2022 3:29:57 PM
DKS,Holiday retail sales are forecast to be solid despite inflation headwinds,11/3/2022 5:49:05 PM
DKS,Walmart takes aim at Amazon with half-off special on its subscription service,11/1/2022 6:40:53 PM
DKS,"Catalyst watch: FOMC jitters, Starbucks and Pfizer earnings, Boeing and AMD events",10/28/2022 6:30:28 PM
DKS,Peloton Stock (NASDAQ:PTON): Exercise Your Right to Stay Away,10/22/2022 2:19:58 AM
DKS,Where Dick's Sporting Goods Stands With Analysts,10/20/2022 9:04:22 PM
DKS,2 Equity REITs Touting Double-Digit Yields To Fight Inflation,10/18/2022 6:38:44 PM
DKS,7 Stocks That Could Sink Your Portfolio if You Don’t Sell Now,10/12/2022 10:45:01 PM
DKS,Executive Back Pedal Is a Major Red Flag for PTON Stock,10/11/2022 6:06:07 PM
DKS,Holiday online sales are forecast to rise but discounting will be 'massive',10/10/2022 2:25:41 PM
DKS,Retail stocks are on watch as signs of a disappointing holiday season emerge,10/3/2022 3:07:01 PM
DKS,7 S&P 500 Stocks to Sell Before They Die,10/2/2022 2:30:26 PM
DKS,"Why Are LULU, UAA, NKE Stocks Down Today?",9/30/2022 5:51:48 PM
DKS,PELOTON AND DICK'S SPORTING GOODS PARTNER TO OFFER PELOTON EQUIPMENT AT MORE THAN 100 DICK'S RETAIL LOCATIONS NATIONWIDE AND DICKS.COM,9/29/2022 2:40:00 PM
DKS,DICK'S Sporting Goods to Begin Holiday Hiring with National Signing Day® on September 28,9/26/2022 3:07:00 PM
DKS,7 Small Company Stocks You Should Own Now,9/21/2022 5:20:39 PM
DKS,7 Stocks Reporting Earnings the Week of Sept. 19,9/19/2022 2:55:38 AM
DKS,"Inflation breakdown: Food prices run hot again, while apparel and sporting goods lag",9/13/2022 12:47:47 PM
DKS,7 Growth Stocks That Could 10X by 2027,9/5/2022 12:43:54 PM
DKS,3 Best Momentum Stocks to Buy for September,9/1/2022 6:39:46 PM
DKS,DICK'S Sporting Goods Expands Resale Partnership with SidelineSwap,8/30/2022 3:03:00 PM
DKS,3 Retail Stocks to Buy After Crushing Q2 Earnings,8/25/2022 5:03:49 PM
DKS,Barclays Maintains Overweight Rating for Dick's Sporting Goods: Here's What You Need To Know,8/24/2022 6:09:56 PM
DKS,"Dick's Sporting Goods Benefits From 'Strong Demand,' Says This Analyst",8/23/2022 7:55:18 PM
DKS,Dick's Sporting Goods Q2 2023 Earnings Preview,8/22/2022 3:52:02 PM
DKS,Apple To $185? Here Are 5 Other Price Target Changes For Friday,8/19/2022 12:32:01 PM
DKS,DICK'S Sporting Goods Becomes Title Sponsor of Perfect Game All-American Classic,8/18/2022 5:54:00 PM
DKS,Where Dick's Sporting Goods Stands With Analysts,8/17/2022 5:09:10 PM
DKS,"Lone Pine takes new stakes in Alphabet, LPL; exits Snap, DoorDash while boosting Thermo Fisher",8/16/2022 4:20:13 PM
DKS,Retail earnings revisions likely to lead to retest of lows - Morgan Stanley,8/14/2022 12:59:20 PM
DKS,3 Dividend Stocks to Buy to Beat Runaway Inflation,8/9/2022 11:00:11 AM
DKS,Jim Cramer: 'I Am No Longer A Huge Crypto Guy',8/5/2022 2:25:49 PM
DKS,"THE DICK'S SPORTING GOODS FOUNDATION CELEBRATES SPORTS MATTER DAY IN CHICAGO BY DONATING EQUIPMENT TO 10,000 YOUTH ATHLETES",8/3/2022 3:07:00 PM
DKS,DICK'S Sporting Goods Supports Supplier Diversity by Offering Early Payments,7/28/2022 3:07:00 PM
DKS,DICK'S Sporting Goods Kicks Off Back-to-School with Roblox,7/27/2022 3:07:00 PM
DKS,7 S&P 500 Stocks Trading at a Huge Discount Right Now,7/23/2022 4:00:17 PM
DKS,7 Best Cyclical Stocks to Buy Now for 2022,7/20/2022 12:42:38 PM
DKS,UBS outlines major beneficiaries should China tariffs be taken off,7/6/2022 4:20:27 PM
DKS,What Companies Will Pay for Abortion Travel?,7/1/2022 4:34:01 PM
DKS,Telsey Advisory Cuts Nike Price Target - Read Why,6/22/2022 8:51:02 PM
DKS,Can Dick's Sporting Goods Break Possible Headwinds? 2 Analysts Weigh In,5/26/2022 6:59:39 PM
DKS,Mid-Afternoon Market Update: Dow Rises Over 100 Points; Verrica Pharmaceuticals Shares Slide,5/25/2022 8:51:59 PM
DKS,Dick's Sporting Goods Q1 2023 Earnings Preview,5/24/2022 5:16:45 PM
DKS,Where Dick's Sporting Goods Stands With Analysts,5/23/2022 11:12:09 PM
DKS,Target and retail were just crushed - these stocks may have been oversold,5/21/2022 1:44:34 PM
DKS,"7 Stocks Reporting Earnings the Week of May 23, 2022",5/19/2022 10:15:36 PM
DKS,"13F Watch: What Buffett, SoftBank, Ackman and more bought and sold",5/18/2022 10:49:04 AM
DKS,"Lone Pine Capital raises stakes in Square, adds Meta Platforms, exits Adobe, slashes MasterCard",5/17/2022 4:50:08 PM
DKS,"David Tepper's Appaloosa bumps up Uber stake in Q1, exits Alliance Data",5/16/2022 9:23:36 PM
DKS,7 Hot Stocks to Buy on Any Dips in May,5/12/2022 11:15:42 PM
DKS,8 Stocks Moved By Traders On 'Fast Money: Halftime Report',5/6/2022 7:15:02 PM
DKS,Dick's Sporting Goods goes ex-dividend tomorrow,3/16/2022 2:49:13 PM
DKS,"DICK'S Sporting Goods Teams Up with Just Women's Sports for $150,000 Bracket Challenge Prize, Largest Ever for Women's College Basketball",3/9/2022 4:11:00 PM
DKS,Mid-Afternoon Market Update: Nasdaq Rises 100 Points; Gold Surges 2.5%,3/8/2022 8:43:33 PM
DKS,"4 Top Stock Trades for Tuesday: AAPL, AMZN, AAL, DKS ",3/7/2022 9:55:51 PM
DKS,7 Earnings Reports to Watch the Week of March 7,3/4/2022 6:25:32 PM
DKS,7 Value Stocks to Buy in This Pricey Market,2/18/2022 1:58:27 PM
DKS,"Nvidia, AMD highlight BofA's list of covered call options plays",2/5/2022 2:22:14 PM
DKS,10 High-Performance Stocks to Buy for Their Special Dividends,2/4/2022 5:28:27 PM
DKS,DICK'S Sporting Goods Champions National Girls & Women in Sports Day,1/31/2022 3:30:00 PM
DKS,7 Technology Stocks Reporting Earnings the Week of January 31,1/28/2022 6:15:32 PM
DKS,Visa U.S. Spending Momentum Index closes 2021 on highest reading note,1/13/2022 5:12:31 PM
DKS,DICK'S Sporting Goods and Golf Galaxy Become the First-Ever Retail Partners of the Golf Digest 'Hot List',1/6/2022 3:00:00 PM
DKS,10 Stocks to Buy Heading Into the Teeth of Winter,1/4/2022 7:15:03 PM
DKS,Citi's top stocks for big dividend growth in 2022: Alpha Tactics,12/19/2021 12:10:53 AM
DKS,Dick's Sporting Goods rises after authorizing additional $2B in repurchases,12/17/2021 2:12:40 PM
DKS,"Benzinga's Top Ratings Upgrades, Downgrades For December 16, 2021",12/16/2021 4:13:40 PM
DKS,Retail stocks are underperforming but Walmart and Costco are tracking higher,12/15/2021 6:30:08 PM
DKS,Cramer Weighs In On Ralph Lauren Stock Following Analyst Downgrade,12/14/2021 6:07:24 PM
DKS,"Nordstrom, Dick's and Boot Barn are among the hardest hit on rough day for retail",12/13/2021 6:31:14 PM
DKS,Dick's Sporting Goods rises as Executive Chairman buys shares worth $11.04M,12/9/2021 3:52:17 PM
DKS,Reddit Hype Will Only Help Vinco Ventures so Much,12/6/2021 8:34:11 PM
DKS,Sportsman's Warehouse plunges after terminating sale to Great Outdoors,12/3/2021 9:04:21 PM
DKS,"BofA Downgrades Hibbett On Lower Stimulus, Inventory Challenges",12/2/2021 5:45:24 PM
DKS,7 Anti-Metaverse Stocks to Hedge Against Meta Mania,12/1/2021 12:16:53 PM
DKS,"Key Black Friday Takeaways For Academy Sports, Dick's & Other Leisure Brands",11/30/2021 12:35:44 AM
DKS,"Dick's, other sporting goods retailers fall as Black Friday traffic remains below 2019 levels",11/29/2021 8:52:59 PM
DKS,"Wedbush's Seth Basham Talks Q3 Winners, Losers With PreMarket Prep Plus",11/24/2021 10:52:23 PM
