Ticker,Title,Link
DKS,CSMC 2018-SITE -- Moody's assigns definitive ratings to seven CMBS classes of CSMC 2018-SITE,12/21/2018 8:41:00 PM
DKS,CSMC 2018-SITE -- Moody's assigns provisional ratings to seven CMBS classes of CSMC 2018-SITE,12/5/2018 10:54:00 PM
DKS,Dick's Sporting Goods Raises FY18 Earnings Outlook - Quick Facts ,11/28/2018 1:43:55 PM
DKS,COMM 2015-CCRE26 Mortgage Trust -- Moody's affirms six classes of COMM 2015-CCRE26,11/19/2018 11:24:00 PM
DKS,WFRBS Commercial Mortgage Trust 2012-C10 -- Moody's affirms ten and downgrades two classes of WFRBS 2012-C10,11/9/2018 6:49:00 PM
DKS,Wells Fargo Commercial Mortgage Trust 2015-P2 -- Moody's affirms eight classes of WFCM 2015-P2,11/2/2018 7:31:00 PM
DKS,UBS Commercial Mortgage Trust 2017-C4 -- Moody's affirms seven classes of UBSCM 2017-C4,10/18/2018 1:40:00 AM
DKS,Wells Fargo Commercial Mortgage Trust 2017-C40 -- Moody's affirms seven classes of Wells Fargo Commercial Mortgage Trust 2017-C40,10/12/2018 8:43:00 PM
DKS,"Synchrony Card Issuance Trust, SynchronySeries -- Moody's assigns definitive ratings to Synchrony Card Issuance Trust, SynchronySeries Class A(2018-1), B(2018-1) and C(2018-1) Notes",9/27/2018 12:19:00 AM
DKS,"Synchrony Card Issuance Trust, SynchronySeries -- Moody's assigns definitive ratings to Synchrony Card Issuance Trust, SynchronySeries Class A(2018-1), B(2018-1) and C(2018-1) Notes",9/26/2018 8:32:00 PM
DKS,Wells Fargo Commercial Mortgage Trust 2017-C39 -- Moody's affirms eight classes of WFCM 2017-C39,9/25/2018 12:08:00 AM
DKS,WFRBS Commercial Mortgage Trust 2014-C25 -- Moody's affirms ten classes of WFRBS 2014-C25,9/24/2018 5:14:00 PM
DKS,WFRBS Commercial Mortgage Trust 2014-C25 -- Moody's affirms ten classes of WFRBS 2014-C25,9/21/2018 10:14:00 PM
DKS,"Synchrony Card Issuance Trust, SynchronySeries -- Moody's assigns provisional ratings to Synchrony Card Issuance Trust, SynchronySeries Class A(2018-1), Class B(2018-1) and Class C(2018-1) Notes",9/17/2018 7:20:00 PM
DKS,Wells Fargo Commercial Mortgage Trust 2015-NXS4 -- Moody's affirms eight classes of WFCM 2015-NXS4,9/15/2018 12:19:00 AM
DKS,Wells Fargo Commercial Mortgage Trust 2015-NXS4 -- Moody's affirms eight classes of WFCM 2015-NXS4,9/14/2018 8:34:00 PM
DKS,J.P. Morgan Chase Commercial Mortgage Securities Trust 2012-LC9 -- Moody's Affirms Fourteen Classes of JPMCC 2012-LC9,8/31/2018 4:21:00 PM
DKS,J.P. Morgan Chase Comml Mtge Sec Tr 2012-LC9 -- Moody's Affirms Fourteen Classes of JPMCC 2012-LC9,8/30/2018 10:30:00 PM
DKS,Dick's Sporting Goods plunges after saying it saw 'significant declines in Under Armour sales' (DKS),8/29/2018 2:24:05 PM
DKS,GS Mortgage Securities Trust 2012-GCJ7 -- Moody's Affirms Six and Downgrades Four Classes of GSMS 2012-GCJ7,7/30/2018 3:58:00 PM
DKS,GS Mortgage Securities Trust 2012-GCJ7 -- Moody's Affirms Six and Downgrades Four Classes of GSMS 2012-GCJ7,7/27/2018 8:09:00 PM
DKS,Palisades Center Trust 2016-PLSD -- Moody's Affirms Two and Downgrades Two CMBS Classes of Palisades Center Trust 2016-PLSD,7/24/2018 7:02:00 PM
DKS,Palisades Center Trust 2016-PLSD -- Moody's Affirms Two and Downgrades Two CMBS Classes of Palisades Center Trust 2016-PLSD,7/20/2018 9:33:00 PM
DKS,Wells Fargo Commercial Mortgage Trust 2016-C35 -- Moody's Affirms Eight Classes of WFCM 2016-C35,7/13/2018 4:34:00 AM
DKS,WFRBS Commercial Mortgage Trust 2012-C9 -- Moody's Affirms Ten Classes of WFRBS 2012-C9,6/23/2018 1:04:00 AM
DKS,WFRBS Commercial Mortgage Trust 2012-C9 -- Moody's Affirms Ten Classes of WFRBS 2012-C9,6/22/2018 6:16:00 PM
DKS,Morgan Stanley Bank of America Merrill Lynch Trust 2012-C5 -- Moody's Affirms 14 Classes of MSBAM 2012-C5,6/18/2018 6:33:00 PM
DKS,Morgan Stanley Capital I Trust 2011-C3 -- Moody's Affirms Ten Classes of MSC 2011-C3,6/6/2018 5:39:00 PM
DKS,Morgan Stanley Capital I Trust 2011-C3 -- Moody's Affirms Ten Classes of MSC 2011-C3,6/2/2018 12:13:00 AM
DKS,ALTR Created Diamonds Unveil Groundbreaking Diamond Growing Film At JCK Las Vegas 2018,5/31/2018 10:28:00 PM
DKS,Dick's pulled the plug on selling assault-style weapons and now its hunting business is 'under significant pressure' (DKS),5/30/2018 10:15:06 PM
DKS,"SHAREHOLDER ALERT: Purcell Julie & Lefkowitz LLP Is Investigating Dick's Sporting Goods, Inc. for Potential Breaches Of Fiduciary Duty By Its Board of Directors",5/29/2018 7:48:00 PM
DKS,DICK'S Sporting Goods Announces Quarterly Dividend,5/22/2018 1:30:00 PM
DKS,UBS-Citigroup Commercial Mortgage Trust 2011-C1 -- Moody's Affirms 11 Classes of UBSC 2011-C1,5/18/2018 7:22:00 PM
DKS,DICK'S Sporting Goods First Quarter Results Call Scheduled for May 30th,5/15/2018 2:00:00 PM
DKS,GS Mortgage Securities Corporation II Commercial Mortgages Pass-Through Certificates Series 2010-C1 -- Moody's Affirms Eight Classes of GSMSC II 2010-C1,5/12/2018 12:36:00 AM
DKS,Wells Fargo Commercial Mortgage Trust 2010-C1 -- Moody's Affirms Nine Classes of WFCM 2010-C1,5/11/2018 8:51:00 PM
DKS,DICK'S Sporting Goods Announces Grand Opening of Four New Stores in May,5/7/2018 4:59:00 PM
DKS,Morgan Stanley Capital I Trust 2015-MS1 -- Moody's Affirms Seven Classes of MSC 2015-MS1,5/3/2018 8:06:00 PM
DKS,WF-RBS COMMERCIAL MORTGAGE TRUST 2011-C2 -- Moody's Affirms Eight Classes of WF-RBS 2011-C2,5/2/2018 11:59:00 PM
DKS,SG Commercial Mortgage Securities Trust 2016-C5 -- Moody's Affirms Six Classes of SGCMS 2016-C5,4/27/2018 9:49:00 PM
DKS,DICK'S Sporting Goods Announces Multi-Year Partnership Between GameChanger And The National Federation Of State High School Associations,4/25/2018 8:07:00 PM
DKS,"Greenwich Capital Commercial Funding Corp., 2007-GG9 -- Moody's Affirms Six Classes of GCCFC 2007-GG9",4/20/2018 4:55:00 PM
DKS,Dick's Sporting Goods is destroying its unsold assault-style guns (DKS),4/17/2018 8:12:06 PM
DKS,JPMBB Commercial Mortgage Securities Trust 2013-C14 -- Moody's Affirms Eleven Classes and Downgrades One Class of JPMBB 2013-C14,4/13/2018 7:01:00 PM
DKS,DICK'S Sporting Goods Announces Grand Opening of Two New Stores in April,4/10/2018 5:15:00 PM
DKS,DICK'S Team Sports HQ Announces A.D. STARR Named the Official Ball Supplier of the Little League® World Series,4/5/2018 3:00:00 PM
DKS,"Under Armour falls as Wall Street warns of falling sales at one of its biggest distributors (UAA, DKS)",4/2/2018 3:39:04 PM
DKS,GS Mortgage Securities Trust 2011-GC5 -- Moody's Downgrades One and Affirms Nine Classes of GSMS 2011-GC5,3/30/2018 8:01:00 PM
DKS,GS Mortgage Securities Trust 2011-GC5 -- Moody's Downgrades One and Affirms Nine Classes of GSMS 2011-GC5,3/29/2018 9:55:00 PM
DKS,Dick's faced boycott threats when it changed its gun policies — but the majority of America agrees with the retailer (DKS),3/24/2018 2:42:04 PM
DKS,COMM 2012-CCRE1 Mortgage Trust -- Moody's Affirms Eleven Classes of COMM 2012-CCRE1,3/16/2018 11:44:00 AM
DKS,Dick's Sporting Goods Relaunches Iconic Tommy Armour Golf Brand With Renewed Focus On Innovation,3/15/2018 1:30:00 PM
DKS,"Dick's Sporting Goods' CEO just called out Under Armour's worst mistake (DKS, UA)",3/13/2018 9:42:05 PM
DKS,Wells Fargo Commercial Mortgage Trust 2013-LC12 -- Moody's Affirms Twelve Classes of WFCM 2013-LC12,3/8/2018 10:06:00 PM
DKS,Dick's Sued Over New Gun Policy ,3/7/2018 6:50:32 PM
DKS,COMM 2013-SFS Mortgage Trust -- Moody's Affirms Six Classes of COMM 2013-SFS,3/2/2018 7:41:00 PM
DKS,Walmart Raises Age Restriction For Purchase Of Firearms And Ammunition To 21 ,3/1/2018 2:13:52 AM
DKS,Dick's Sporting Goods' assault-rifles ban was reportedly spurred by a meeting with nuns (DKS),2/28/2018 9:00:04 PM
DKS,DICK'S Sporting Goods Announces Grand Opening of Four New Stores in Three States,2/27/2018 4:39:00 PM
DKS,Wells Fargo Commercial Mortgage Trust 2014-LC16 -- Moody's Affirms Ten Classes of WFCM 2014-LC16,2/15/2018 8:08:00 PM
DKS,UBS-Barclays Commercial Mortgage Trust 2013-C6 -- Moody's Affirms Fourteen Classes of UBS-BB 2013-C6,2/14/2018 9:13:00 PM
DKS,WFRBS Commercial Mortgage Trust 2014-C20 -- Moody's Affirms Twelve Classes of WFRBS 2014-C20,2/9/2018 9:47:00 PM
DKS,DICK'S Sporting Goods Announces Grand Opening of Four New Stores in February,2/8/2018 4:40:00 PM
DKS,Morgan Stanley Capital I Trust 2011-C2 -- Moody's Downgrades One and Affirms Eight Classes of MSC 2011-C2,2/1/2018 11:35:00 PM
DKS,Dick's Sporting Goods Remains Positive After Upgrade By Deutsche Bank ,1/12/2018 9:33:51 PM
DKS,"A Wall Street analyst says Under Armour could suffer the same fate as Reebok (UA, UAA, DKS, HIBB, KSS, DSW)",1/9/2018 7:24:11 PM
DKS,CFCRE 2016-C3 Mortgage Trust -- Moody's Affirms Six Classes of CFCRE 2016-C3,1/8/2018 2:02:00 PM
DKS,CFCRE 2016-C3 Mortgage Trust -- Moody's Affirms Six Classes of CFCRE 2016-C3,1/5/2018 10:22:00 PM
DKS,"Department stores surge following report of the best holiday sales in 6 years (JCP, M, DDS, KSS, TJX, DKS, FINL, EXPR)",12/26/2017 5:24:03 PM
DKS,"Toys ""R"" Us plans new playdate with U.S. shoppers (AMZN, WMT, DPZ, DKS, BBY, ULTA, BBW, MAT)",12/21/2017 7:02:03 AM
DKS,DICK'S Sporting Goods Saves Houston-Based Refugee Soccer Team With Surprise Donation,12/11/2017 4:30:00 PM
DKS,DICK'S Sporting Goods Names New Chief Technology Officer,11/14/2017 2:30:00 PM
DKS,COMM 2012-LC4 Mortgage Trust -- Moody's Affirms Seven and Downgrades Three Classes of COMM 2012-LC4,11/10/2017 11:50:00 PM
DKS,"New York City Challenged by Bed Bugs, Delta Five Offers Green Solution",11/8/2017 3:31:00 PM
DKS,DICK'S Sporting Goods Third Quarter Results Call Scheduled for November 14th,11/7/2017 2:00:00 PM
DKS,COMM 2015-CCRE26 Mortgage Trust -- Moody's Affirms Seven Classes of COMM 2015-CCRE26,11/3/2017 8:17:00 PM
DKS,Burton Mills - Demand for Steel to Decrease in 2018,10/25/2017 7:45:00 PM
DKS,WFRBS Commercial Mortgage Trust 2012-C10 -- Moody's Affirms Ten and Downgrades Two Classes of WFRBS 2012-C10,10/13/2017 6:09:00 PM
DKS,Snow Phipps Group Acquires Leading Bakery Solutions Provider DecoPac,10/3/2017 2:00:00 PM
DKS,WFRBS Commercial Mortgage Trust 2014-C24 -- Moody's Affirms Fourteen Classes of WFRBS 2014-C24,9/29/2017 7:10:00 PM
DKS,BRIEF-U.S. CPSC says Dick's Sporting Goods recalls resistance tubes (DKS),9/27/2017 9:57:09 PM
DKS,Renova Therapeutics leadership speaking at Cell & Gene Therapy CEO forum and Boulder Peptide Symposium,9/25/2017 5:30:00 PM
DKS,DICK'S Sporting Goods Announces Grand Opening of Four New Stores in Three States,9/22/2017 3:00:00 PM
DKS,WFRBS Commercial Mortgage Trust 2014-C25 -- Moody's Affirms Ten Classes of WFRBS 2014-C25,9/20/2017 11:38:00 PM
DKS,Wells Fargo Commercial Mortgage Trust 2015-NXS4 -- Moody's Affirms Eight Classes of WFCM 2015-NXS4,9/15/2017 8:50:00 PM
DKS,DICK'S Sporting Goods & The DICK'S Sporting Goods Foundation Pledge More Than $5.5 Million Towards Recent Hurricane Relief Efforts,9/12/2017 7:50:00 PM
DKS,"Lululemon is leaning toward men to bolster growth (LULU, NKE, GPS, DKS)",9/1/2017 6:12:05 PM
DKS,JPMBB Commercial Mortgage Securities Trust 2014-C24 -- Moody's Affirms Thirteen Classes of JPMBB 2014-C24,8/31/2017 9:03:00 PM
DKS,"DICK'S Sporting Goods' Management to Present at the Goldman Sachs 24th Annual Global Retailing Conference on Wednesday, September 6th",8/30/2017 2:00:00 PM
DKS,UBS Commercial Mortgage Trust 2012-C1 -- Moody's Affirms Eight and Downgrades Two Classes of UBSCM 2012-C1,8/18/2017 9:05:00 PM
DKS,"DICK'S Sporting Goods Foundation Pledges $500,000 To Support Local Little League® Baseball And Softball Programs",8/17/2017 7:00:00 PM
DKS,Dick's Sporting Goods Stock Price Target Cut To $37 From $62 At BMO Capital ,8/16/2017 7:15:22 PM
DKS,DICK'S CEO: The retail industry is in 'panic mode' (DKS),8/15/2017 7:21:03 PM
DKS,The Growth of Sales in Sportswear,8/10/2017 8:31:00 PM
DKS,COMM 2012-CCRE3 Mortgage Trust -- Moody's Affirms Thirteen Classes of COMM 2012-CCRE3,8/9/2017 8:44:00 PM
DKS,DICK'S Sporting Goods Second Quarter Results Call Scheduled for August 15th,8/8/2017 2:00:00 PM
DKS,Morgan Stanley Capital I Trust 2012-C4 -- Moody's Affirms Eight and Downgrades Three Classes of MSC 2012-C4,8/4/2017 9:19:00 PM
DKS,UBS-Citigroup Commercial Mortgage Trust 2011-C1 -- Moody's Affirms Eight and Downgrades Three Classes of UBSC 2011-C1,8/3/2017 4:25:00 PM
DKS,GS Mortgage Securities Trust 2012-GCJ7 -- Moody's Affirms Eight and Downgrades Two CMBS Classes of GSMS 2012-GCJ7,7/26/2017 5:58:00 PM
DKS,"US STOCKS-Nasdaq, tech shine as earnings pick up; Dow, S&P lag (NFLX, AMZN, JNJ, HAL, HIBB, DKS, FL, FINL)",7/24/2017 10:32:03 PM
DKS,"Morgan Stanley Capital I Trust 2007-IQ14 -- Moody's Upgrades Two, Downgrades Two and Affirms Three Classes of MSC 2007-IQ14",7/21/2017 1:07:00 AM
DKS,Pairnomix Teams Up With StemoniX To Co-Develop New Epilepsy Model,7/18/2017 3:00:00 PM
DKS,Wells Fargo Commercial Mortgage Trust 2016-C35 -- Moody's Affirms Eight Classes of WFCM 2016-C35,7/14/2017 9:32:00 PM
DKS,DICK'S Sporting Goods Announces First-Ever 'Celebrate Youth Sports Weekend' Featuring Donations & Discounts Nationwide,7/13/2017 3:00:00 PM
DKS,"READ NOW: Monteverde & Associates PC Invites Dick's Sporting Goods, Inc. Shareholders with Significant Losses To Contact The Firm Immediately - DKS",6/1/2017 9:16:00 PM
DKS,DICK'S Sporting Goods to Webcast Annual Stockholders' Meeting on June 7th,5/31/2017 2:00:00 PM
DKS,"Lifshitz & Miller LLP Announces Investigation of Akari Therapeutics, Plc, Alexion Pharmaceuticals, Inc., Amgen Inc., Cel-Sci Corp., Dick's Sporting Goods, Inc., Eco Science Solutions, Inc.",5/30/2017 7:43:00 PM
DKS,Dick's Sporting Goods is getting clobbered after same-store sales miss (DKS),5/17/2017 2:39:46 AM
DKS,"STOCKS SNOOZE, DOLLAR FALLS: Here's what you need to know (F, DKS)",5/16/2017 10:52:18 PM
DKS,"SHAREHOLDER ALERT: Pomerantz Law Firm Investigates Claims On Behalf of Investors of Dick's Sporting Goods, Inc. - DKS",5/12/2017 11:49:00 PM
DKS,"BRIEF-DICK'S Sporting Goods announces COO retirement, appoints President (DKS)",5/11/2017 7:00:08 PM
DKS,CALIA By Carrie Underwood And The DICK'S Sporting Goods Foundation Partner To Fully Fund Girls Team Sports Projects On DonorsChoose.org In May,5/9/2017 5:30:00 PM
DKS,DICK'S Sporting Goods Announces Grand Opening of Three New Stores in May,5/2/2017 8:28:00 PM
DKS,"Golf Galaxy Opens 36 New Stores, Formerly Golfsmith Locations",5/1/2017 6:54:00 PM
DKS,DICK'S Sporting Goods Announces Grand Opening of Six New Stores,4/4/2017 9:41:00 PM
DKS,"DICK'S Sporting Goods Announces Grand Opening of New Store in Atlanta, GA",3/15/2017 4:13:00 PM
DKS,"Stock Option reports for Salesforce, DISH Network, Dicks Sporting Goods, MOMO Inc. and Teck Resources Ltd!",3/8/2017 3:31:00 PM
DKS,Dick's Sporting Goods is getting slammed after guidance disappoints,3/7/2017 7:26:11 PM
DKS,DICK'S Sporting Goods Fourth Quarter Results Call Scheduled for March 7th,2/28/2017 2:00:00 PM
DKS,"Hedge fund Night Square to shut, founders move to Citadel (LOW, DKS, JACK)",2/15/2017 10:10:11 PM
DKS,"UPDATE 1-Sports Direct in talks to bid for Bob's, Eastern Mountain Sports -sources (TJX, FCCN, DKS, SPD)",2/2/2017 5:54:07 PM
DKS,BRIEF-Dick's Sporting Goods extends aircraft charter agreement (DKS),12/13/2016 10:30:06 PM
DKS,BRIEF-DICK'S Sporting Goods expands team sports HQ suite of digital offerings with the acquisition of GameChanger Media (DKS),11/28/2016 10:10:04 PM
DKS,BRIEF-Dick's Sporting Goods reports third quarter results (DKS),11/15/2016 3:26:17 PM
DKS,Dick's prepares bid for bankrupt retailer Golfsmith's U.S. stores -sources (DKS),10/18/2016 1:10:21 PM
DKS,Dick's Sporting Goods Announces the Grand Opening of Dick's Sporting Goods Park,4/4/2007 1:32:00 PM
